id,observed_on,time_observed_at,time_zone,quality_grade,url,image_url,description,num_identification_agreements,num_identification_disagreements,captive_cultivated,place_guess,latitude,longitude,positional_accuracy,geoprivacy,positioning_device,place_town_name,place_county_name,species_guess,scientific_name,common_name,iconic_taxon_name,taxon_id,taxon_family_name,taxon_genus_name,taxon_species_name
2684261,2/14/16,,Pacific Time (US & Canada),research,http://www.inaturalist.org/observations/2684261,http://static.inaturalist.org/photos/3017868/medium.jpg,,2,0,FALSE,Black Diamond Mines,37.950533,-121.867905,795,,,,Contra Costa,Miner's Lettuce,Claytonia perfoliata,miner's lettuce,Plantae,52994,Montiaceae,Claytonia,Claytonia perfoliata
2684271,2/14/16,,Pacific Time (US & Canada),research,http://www.inaturalist.org/observations/2684271,http://static.inaturalist.org/photos/3017890/medium.jpg,,2,0,FALSE,Black Diamond Mines,37.950533,-121.867905,795,,,,Contra Costa,California Bee Plant,Scrophularia californica,California beeplant,Plantae,50812,Scrophulariaceae,Scrophularia,Scrophularia californica
2684277,2/14/16,,Pacific Time (US & Canada),research,http://www.inaturalist.org/observations/2684277,http://static.inaturalist.org/photos/3017899/medium.jpg,,2,0,FALSE,Black Diamond Mines,37.950533,-121.867905,795,,,,Contra Costa,California Buckeye,Aesculus californica,California buckeye,Plantae,53348,Sapindaceae,Aesculus,Aesculus californica
2684509,2/14/16,,Pacific Time (US & Canada),research,http://www.inaturalist.org/observations/2684509,http://static.inaturalist.org/photos/3018239/medium.jpg,,2,0,FALSE,Black Diamond Mines,37.950641,-121.863098,838,,,,Contra Costa,Oak mistletoe,Phoradendron villosum,oak mistletoe,Plantae,343310,Santalaceae,Phoradendron,Phoradendron villosum
2684511,2/14/16,,Pacific Time (US & Canada),research,http://www.inaturalist.org/observations/2684511,http://static.inaturalist.org/photos/3018244/medium.jpg,,3,0,FALSE,Black Diamond Mines,37.950641,-121.863098,838,,,,Contra Costa,Indian Warrior,Pedicularis densiflora,Warrior's Plume,Plantae,49645,Orobanchaceae,Pedicularis,Pedicularis densiflora
2684522,2/14/16,,Pacific Time (US & Canada),research,http://www.inaturalist.org/observations/2684522,http://static.inaturalist.org/photos/3018253/medium.jpg,Abundant.,1,0,FALSE,Black Diamond Mines,37.950641,-121.863098,838,,,,Contra Costa,Henderson's shooting star (Dodecatheon hendersonii),Primula hendersonii,Henderson's shooting star,Plantae,487175,Primulaceae,Primula,Primula hendersonii
2684525,2/14/16,,Pacific Time (US & Canada),research,http://www.inaturalist.org/observations/2684525,http://static.inaturalist.org/photos/3018270/medium.jpg,,1,0,FALSE,Black Diamond Mines,37.950641,-121.863098,838,,,,Contra Costa,Turkey pea,Sanicula tuberosa,Tuberous Sanicle,Plantae,56842,Apiaceae,Sanicula,Sanicula tuberosa
2684530,2/14/16,,Pacific Time (US & Canada),research,http://www.inaturalist.org/observations/2684530,http://static.inaturalist.org/photos/3018272/medium.jpg,,1,0,FALSE,Black Diamond Mines,37.950641,-121.863098,838,,,,Contra Costa,Western Hoptree,Ptelea crenulata,Western Hoptree,Plantae,50622,Rutaceae,Ptelea,Ptelea crenulata
2684531,2/14/16,,Pacific Time (US & Canada),research,http://www.inaturalist.org/observations/2684531,http://static.inaturalist.org/photos/3018273/medium.jpg,,2,0,FALSE,Black Diamond Mines,37.950641,-121.863098,838,,,,Contra Costa,California manroot,Marah fabacea,California manroot,Plantae,205330,Cucurbitaceae,Marah,Marah fabacea
2684538,2/14/16,,Pacific Time (US & Canada),research,http://www.inaturalist.org/observations/2684538,http://static.inaturalist.org/photos/3018291/medium.jpg,,1,0,FALSE,Black Diamond Mines,37.950641,-121.863098,838,,,,Contra Costa,Dipterostemon capitatus,Dipterostemon capitatus,Blue Dicks,Plantae,1196784,Asparagaceae,Dipterostemon,Dipterostemon capitatus
2684543,2/14/16,,Pacific Time (US & Canada),research,http://www.inaturalist.org/observations/2684543,http://static.inaturalist.org/photos/3018301/medium.jpg,,1,0,FALSE,Black Diamond Mines,37.950641,-121.863098,838,,,,Contra Costa,California sagebrush,Artemisia californica,California sagebrush,Plantae,53357,Asteraceae,Artemisia,Artemisia californica
2684547,2/14/16,,Pacific Time (US & Canada),research,http://www.inaturalist.org/observations/2684547,http://static.inaturalist.org/photos/3018303/medium.jpg,,2,0,FALSE,Black Diamond Mines,37.950641,-121.863098,838,,,,Contra Costa,Yerba Santa,Eriodictyon californicum,California yerba santa,Plantae,57095,Boraginaceae,Eriodictyon,Eriodictyon californicum
2684550,2/14/16,,Pacific Time (US & Canada),research,http://www.inaturalist.org/observations/2684550,http://static.inaturalist.org/photos/3018306/medium.jpg,,1,0,FALSE,Black Diamond Mines,37.950641,-121.863098,838,,,,Contra Costa,Black Sage,Salvia mellifera,black sage,Plantae,50643,Lamiaceae,Salvia,Salvia mellifera
2684555,2/14/16,,Pacific Time (US & Canada),research,http://www.inaturalist.org/observations/2684555,http://static.inaturalist.org/photos/3018310/medium.jpg,,1,0,FALSE,Black Diamond Mines,37.950641,-121.863098,838,,,,Contra Costa,Woolly Indian Paintbrush (Woolly paintbrush),Castilleja foliolosa,Woolly Indian Paintbrush,Plantae,56760,Orobanchaceae,Castilleja,Castilleja foliolosa
2684565,2/14/16,,Pacific Time (US & Canada),research,http://www.inaturalist.org/observations/2684565,http://static.inaturalist.org/photos/3018311/medium.jpg,,1,0,FALSE,Black Diamond Mines,37.950641,-121.863098,838,,,,Contra Costa,Ceanothus cuneatus (Buckbrush),Ceanothus cuneatus,Buckbrush,Plantae,49673,Rhamnaceae,Ceanothus,Ceanothus cuneatus
2684569,2/14/16,,Pacific Time (US & Canada),research,http://www.inaturalist.org/observations/2684569,http://static.inaturalist.org/photos/3018324/medium.jpg,,1,0,FALSE,Black Diamond Mines,37.950641,-121.863098,838,,,,Contra Costa,Chamise,Adenostoma fasciculatum,chamise,Plantae,47146,Rosaceae,Adenostoma,Adenostoma fasciculatum
2684644,2/14/16,,Pacific Time (US & Canada),research,http://www.inaturalist.org/observations/2684644,http://static.inaturalist.org/photos/3018422/medium.jpg,"This species was once named for Mary Bowerman, but the new Jepson does not recognize it as such and has lumped it with Mt. Diablo Manzanita.",2,0,FALSE,Black Diamond Mines,37.950641,-121.863098,838,,,,Contra Costa,Mount Diablo manzanita,Arctostaphylos auriculata,Mount Diablo manzanita,Plantae,48023,Ericaceae,Arctostaphylos,Arctostaphylos auriculata
2684648,2/14/16,,Pacific Time (US & Canada),research,http://www.inaturalist.org/observations/2684648,http://static.inaturalist.org/photos/3018427/medium.jpg,,2,0,FALSE,Black Diamond Mines,37.950641,-121.863098,838,,,,Contra Costa,Toyon,Heteromeles arbutifolia,Toyon,Plantae,53405,Rosaceae,Heteromeles,Heteromeles arbutifolia
2684658,2/14/16,,Pacific Time (US & Canada),research,http://www.inaturalist.org/observations/2684658,http://static.inaturalist.org/photos/3018442/medium.jpg,Pink form.,2,0,FALSE,Black Diamond Mines,37.950641,-121.863098,838,,,,Contra Costa,Padre's shootingstar (Dodecatheon clevelandii),Primula clevelandii,Padre's Shooting Star,Plantae,486971,Primulaceae,Primula,Primula clevelandii
2684661,2/14/16,,Pacific Time (US & Canada),research,http://www.inaturalist.org/observations/2684661,http://static.inaturalist.org/photos/3018444/medium.jpg,White form.,2,0,FALSE,Black Diamond Mines,37.950641,-121.863098,838,,,,Contra Costa,Padre's shootingstar (Dodecatheon clevelandii),Primula clevelandii,Padre's Shooting Star,Plantae,486971,Primulaceae,Primula,Primula clevelandii
2684688,2/14/16,,Pacific Time (US & Canada),research,http://www.inaturalist.org/observations/2684688,http://static.inaturalist.org/photos/3018471/medium.jpg,Magenta form.,2,0,FALSE,Black Diamond Mines,37.950641,-121.863098,838,,,,Contra Costa,Padre's shootingstar (Dodecatheon clevelandii),Primula clevelandii,Padre's Shooting Star,Plantae,486971,Primulaceae,Primula,Primula clevelandii
2684691,2/14/16,,Pacific Time (US & Canada),research,http://www.inaturalist.org/observations/2684691,http://static.inaturalist.org/photos/3018476/medium.jpg,,2,0,FALSE,Black Diamond Mines,37.950641,-121.863098,838,,,,Contra Costa,Glue-seed,Blennosperma nanum,glue-seed,Plantae,57914,Asteraceae,Blennosperma,Blennosperma nanum
2684693,2/14/16,,Pacific Time (US & Canada),research,http://www.inaturalist.org/observations/2684693,http://static.inaturalist.org/photos/3018478/medium.jpg,,1,0,FALSE,Black Diamond Mines,37.950641,-121.863098,838,,,,Contra Costa,Interior Live Oak,Quercus wislizeni,interior live oak,Plantae,51089,Fagaceae,Quercus,Quercus wislizeni
2684703,2/14/16,,Pacific Time (US & Canada),research,http://www.inaturalist.org/observations/2684703,http://static.inaturalist.org/photos/3018490/medium.JPG,,2,0,FALSE,Black Diamond Mines,37.950641,-121.863098,838,,,,Contra Costa,Micranthes californica (California saxifrage),Micranthes californica,California Saxifrage,Plantae,78023,Saxifragaceae,Micranthes,Micranthes californica
2688762,2/14/16,2016-02-14 19:59:59 UTC,Pacific Time (US & Canada),research,http://www.inaturalist.org/observations/2688762,https://inaturalist-open-data.s3.amazonaws.com/photos/3023697/medium.JPG,,2,0,FALSE,"Black Diamond Mines Regional Preserve , CA",37.951981,-121.870909,271,,,,Contra Costa,Blennosperma nanum,Blennosperma nanum,glue-seed,Plantae,57914,Asteraceae,Blennosperma,Blennosperma nanum
2688775,2/14/16,2016-02-14 19:56:19 UTC,Pacific Time (US & Canada),research,http://www.inaturalist.org/observations/2688775,https://inaturalist-open-data.s3.amazonaws.com/photos/3023739/medium.JPG,,3,0,FALSE,"Black Diamond Mines Regional Preserve , CA",37.952074,-121.871257,271,,,,Contra Costa,Padre's shootingstar,Primula clevelandii,Padre's Shooting Star,Plantae,486971,Primulaceae,Primula,Primula clevelandii
2689059,2/14/16,2016-02-14 20:57:53 UTC,Pacific Time (US & Canada),research,http://www.inaturalist.org/observations/2689059,https://inaturalist-open-data.s3.amazonaws.com/photos/3024104/medium.JPG,Bowerman`s form . ,1,0,FALSE,"Black Diamond Mines Regional Preserve , CA",37.955661,-121.862336,271,,,,Contra Costa,Mount Diablo manzanita,Arctostaphylos auriculata,Mount Diablo manzanita,Plantae,48023,Ericaceae,Arctostaphylos,Arctostaphylos auriculata
2689098,2/14/16,2016-02-14 19:23:03 UTC,Pacific Time (US & Canada),research,http://www.inaturalist.org/observations/2689098,https://inaturalist-open-data.s3.amazonaws.com/photos/3024172/medium.JPG,,1,0,FALSE,"Black Diamond Mines Regional Preserve , CA",37.955627,-121.868194,271,,,,Contra Costa,Castilleja foliolosa,Castilleja foliolosa,Woolly Indian Paintbrush,Plantae,56760,Orobanchaceae,Castilleja,Castilleja foliolosa
2689120,2/14/16,2016-02-14 19:44:38 UTC,Pacific Time (US & Canada),research,http://www.inaturalist.org/observations/2689120,https://inaturalist-open-data.s3.amazonaws.com/photos/3024208/medium.JPG,,4,0,FALSE,"Black Diamond Mines Regional Preserve , CA",37.952641,-121.871319,271,,,,Contra Costa,Indian Warrior,Pedicularis densiflora,Warrior's Plume,Plantae,49645,Orobanchaceae,Pedicularis,Pedicularis densiflora
2689218,2/14/16,2016-02-14 19:33:33 UTC,Pacific Time (US & Canada),research,http://www.inaturalist.org/observations/2689218,https://inaturalist-open-data.s3.amazonaws.com/photos/3024315/medium.JPG,,3,0,FALSE,"Black Diamond Mines Regional Preserve , CA",37.953639,-121.871102,543,,,,Contra Costa,Primula hendersonii,Primula hendersonii,Henderson's shooting star,Plantae,487175,Primulaceae,Primula,Primula hendersonii
2689458,2/14/16,2016-02-14 21:09:40 UTC,Pacific Time (US & Canada),research,http://www.inaturalist.org/observations/2689458,https://inaturalist-open-data.s3.amazonaws.com/photos/3024627/medium.JPG,,3,0,FALSE,"Black Diamond Mines Regional Preserve , CA",37.955712,-121.862948,271,,,,Contra Costa,toyon,Heteromeles arbutifolia,Toyon,Plantae,53405,Rosaceae,Heteromeles,Heteromeles arbutifolia
2689462,2/14/16,2016-02-14 20:05:56 UTC,Pacific Time (US & Canada),research,http://www.inaturalist.org/observations/2689462,https://inaturalist-open-data.s3.amazonaws.com/photos/3024633/medium.JPG,,1,0,FALSE,"Black Diamond Mines Regional Preserve , CA",37.952514,-121.869965,543,,,,Contra Costa,Interior Live Oak,Quercus wislizeni,interior live oak,Plantae,51089,Fagaceae,Quercus,Quercus wislizeni
2689758,2/14/16,2016-02-14 19:20:09 UTC,Pacific Time (US & Canada),research,http://www.inaturalist.org/observations/2689758,https://inaturalist-open-data.s3.amazonaws.com/photos/3025086/medium.JPG,,4,0,FALSE,"Black Diamond Mines Regional Preserve , CA",37.954333,-121.869085,543,,,,Contra Costa,Dipterostemon capitatus,Dipterostemon capitatus,Blue Dicks,Plantae,1196784,Asparagaceae,Dipterostemon,Dipterostemon capitatus
2689780,2/14/16,2016-02-14 18:50:39 UTC,Pacific Time (US & Canada),research,http://www.inaturalist.org/observations/2689780,https://inaturalist-open-data.s3.amazonaws.com/photos/3025123/medium.JPG,,3,0,FALSE,"Black Diamond Mines Regional Preserve , CA",37.957438,-121.863946,271,,,,Contra Costa,Oak mistletoe,Phoradendron villosum,oak mistletoe,Plantae,343310,Santalaceae,Phoradendron,Phoradendron villosum
2689791,2/14/16,2016-02-14 19:16:40 UTC,Pacific Time (US & Canada),research,http://www.inaturalist.org/observations/2689791,https://inaturalist-open-data.s3.amazonaws.com/photos/3025142/medium.JPG,,4,0,FALSE,"Black Diamond Mines Regional Preserve , CA",37.956008,-121.86857,543,,,,Contra Costa,marah fabacea,Marah fabacea,California manroot,Plantae,205330,Cucurbitaceae,Marah,Marah fabacea
2724076,2/27/16,2016-02-27 22:17:34 UTC,Pacific Time (US & Canada),research,http://www.inaturalist.org/observations/2724076,http://static.inaturalist.org/photos/3074223/medium.jpg,,1,0,FALSE,"Black Diamond Mines Regional Preserve, Antioch, CA, US",37.9550592,-121.8495086,1247,,,,Contra Costa,Silver Bush Lupine,Lupinus albifrons albifrons,Silver Bush Lupine,Plantae,53418,Fabaceae,Lupinus,Lupinus albifrons
2903826,4/8/16,2016-04-08 18:41:43 UTC,Pacific Time (US & Canada),research,http://www.inaturalist.org/observations/2903826,https://inaturalist-open-data.s3.amazonaws.com/photos/3321808/medium.JPG,Non-native .,1,0,FALSE,"Black Diamond Mines Regional Preserve , CA",37.956507,-121.865899,271,,,,Contra Costa,Vicia villosa,Vicia villosa,hairy vetch,Plantae,57317,Fabaceae,Vicia,Vicia villosa
2903931,4/8/16,2016-04-08 19:53:08 UTC,Pacific Time (US & Canada),research,http://www.inaturalist.org/observations/2903931,https://inaturalist-open-data.s3.amazonaws.com/photos/3321962/medium.JPG,The leaves are pretty much diagnostic . ,1,0,FALSE,"Black Diamond Mines Regional Preserve , CA",37.9538,-121.867862,271,,,,Contra Costa,tomcat clover,Trifolium willdenovii,tomcat clover,Plantae,57081,Fabaceae,Trifolium,Trifolium willdenovii
2904103,4/8/16,2016-04-08 20:19:12 UTC,Pacific Time (US & Canada),research,http://www.inaturalist.org/observations/2904103,https://inaturalist-open-data.s3.amazonaws.com/photos/3322155/medium.JPG,In heavy bloom . ,1,0,FALSE,"Black Diamond Mines Regional Preserve , CA",37.95045,-121.862036,271,,,,Contra Costa,Bush Poppy,Dendromecon rigida,Bush Poppy,Plantae,58224,Papaveraceae,Dendromecon,Dendromecon rigida
2905728,4/8/16,2016-04-08 20:27:39 UTC,Pacific Time (US & Canada),research,http://www.inaturalist.org/observations/2905728,https://inaturalist-open-data.s3.amazonaws.com/photos/3324068/medium.JPG,Casting a shadow on the plant and then using a flash gives this odd portrait . ,1,0,FALSE,"Black Diamond Mines Regional Preserve , CA",37.951127,-121.863538,271,,,,Contra Costa,valley tassels,Castilleja attenuata,valley tassels,Plantae,49341,Orobanchaceae,Castilleja,Castilleja attenuata
2905756,4/8/16,2016-04-08 20:30:18 UTC,Pacific Time (US & Canada),research,http://www.inaturalist.org/observations/2905756,https://inaturalist-open-data.s3.amazonaws.com/photos/3324114/medium.JPG,Taken by flash after casting a shadow on the plant . ,1,0,FALSE,"Black Diamond Mines Regional Preserve , CA",37.951093,-121.863527,271,,,,Contra Costa,purple owl's-clover,Castilleja exserta,purple owl's-clover,Plantae,49343,Orobanchaceae,Castilleja,Castilleja exserta
2905785,4/8/16,2016-04-08 20:31:21 UTC,Pacific Time (US & Canada),research,http://www.inaturalist.org/observations/2905785,https://inaturalist-open-data.s3.amazonaws.com/photos/3324152/medium.JPG,,1,0,FALSE,"Black Diamond Mines Regional Preserve , CA",37.950577,-121.860909,271,,,,Contra Costa,Woolly Indian Paintbrush,Castilleja foliolosa,Woolly Indian Paintbrush,Plantae,56760,Orobanchaceae,Castilleja,Castilleja foliolosa
2909719,4/8/16,2016-04-08 19:36:35 UTC,Pacific Time (US & Canada),research,http://www.inaturalist.org/observations/2909719,https://inaturalist-open-data.s3.amazonaws.com/photos/3329299/medium.JPG,,1,0,FALSE,"Black Diamond Mines Regional Preserve , CA",37.954231,-121.86386,271,,,,Contra Costa,Western Hoptree,Ptelea crenulata,Western Hoptree,Plantae,50622,Rutaceae,Ptelea,Ptelea crenulata
2921541,4/8/16,2016-04-08 21:09:37 UTC,Pacific Time (US & Canada),research,http://www.inaturalist.org/observations/2921541,https://inaturalist-open-data.s3.amazonaws.com/photos/3345329/medium.JPG,,2,0,FALSE,"Black Diamond Mines Regional Preserve , CA",37.952294,-121.85576,271,,,,Contra Costa,Blow Wives,Achyrachaena mollis,Blow Wives,Plantae,56852,Asteraceae,Achyrachaena,Achyrachaena mollis
3044708,4/27/16,2016-04-27 16:30:48 UTC,Pacific Time (US & Canada),research,http://www.inaturalist.org/observations/3044708,https://inaturalist-open-data.s3.amazonaws.com/photos/3505996/medium.jpg,,2,0,FALSE,"Black Diamond Mines Reg Preser, Brentwood, CA, US",37.95327833,-121.8688967,,,,,Contra Costa,Butterfly Mariposa Lily,Calochortus venustus,Butterfly Mariposa Lily,Plantae,53902,Liliaceae,Calochortus,Calochortus venustus
3078405,5/1/16,2016-05-01 21:23:18 UTC,Pacific Time (US & Canada),research,http://www.inaturalist.org/observations/3078405,http://static.inaturalist.org/photos/3549280/medium.jpg,,3,0,FALSE,Black Diamond Mines Regional Park,37.971782,-121.861398,1254,,manual,,Contra Costa,Calochortus albus,Calochortus albus,White Globe Lily,Plantae,51315,Liliaceae,Calochortus,Calochortus albus
3078413,5/1/16,2016-05-01 21:43:52 UTC,Pacific Time (US & Canada),research,http://www.inaturalist.org/observations/3078413,http://static.inaturalist.org/photos/3549285/medium.jpg,,1,0,FALSE,Black Diamond Mines Regional Park,37.971782,-121.861398,1254,,manual,,Contra Costa,California Pitcher Sage,Lepechinia calycina,California Pitcher Sage,Plantae,57114,Lamiaceae,Lepechinia,Lepechinia calycina
3078420,5/1/16,2016-05-01 21:48:45 UTC,Pacific Time (US & Canada),research,http://www.inaturalist.org/observations/3078420,http://static.inaturalist.org/photos/3549293/medium.jpg,,2,0,FALSE,Black Diamond Mines Regional Park,37.971782,-121.861398,1254,,manual,,Contra Costa,oneleaf onion,Allium unifolium,oneleaf onion,Plantae,59781,Amaryllidaceae,Allium,Allium unifolium
3078457,5/1/16,2016-05-01 22:20:35 UTC,Pacific Time (US & Canada),research,http://www.inaturalist.org/observations/3078457,http://static.inaturalist.org/photos/3549362/medium.jpg,,1,0,FALSE,Black Diamond Mines Regional Park,37.971782,-121.861398,1254,,manual,,Contra Costa,Butterfly Mariposa Lily,Calochortus venustus,Butterfly Mariposa Lily,Plantae,53902,Liliaceae,Calochortus,Calochortus venustus
3236583,5/1/16,,Pacific Time (US & Canada),research,http://www.inaturalist.org/observations/3236583,http://static.inaturalist.org/photos/3746036/medium.jpg,,1,0,FALSE,Black Diamond Mines,37.951724,-121.85297,2224,,,,Contra Costa,Butterfly Mariposa Lily,Calochortus venustus,Butterfly Mariposa Lily,Plantae,53902,Liliaceae,Calochortus,Calochortus venustus
3236613,5/1/16,,Pacific Time (US & Canada),research,http://www.inaturalist.org/observations/3236613,http://static.inaturalist.org/photos/3746080/medium.jpg,C albus x C. pulchellus likely hybrid.,3,0,FALSE,Black Diamond Mines,37.951724,-121.85297,2224,,,,Contra Costa,Calochortus albus,Calochortus albus,White Globe Lily,Plantae,51315,Liliaceae,Calochortus,Calochortus albus
3236643,5/1/16,,Pacific Time (US & Canada),research,http://www.inaturalist.org/observations/3236643,http://static.inaturalist.org/photos/3746107/medium.jpg,,1,0,FALSE,Black Diamond Mines,37.951724,-121.85297,2224,,,,Contra Costa,California pitcher sage,Lepechinia calycina,California Pitcher Sage,Plantae,57114,Lamiaceae,Lepechinia,Lepechinia calycina
3236670,5/1/16,,Pacific Time (US & Canada),research,http://www.inaturalist.org/observations/3236670,http://static.inaturalist.org/photos/3746155/medium.jpg,,1,0,FALSE,Black Diamond Mines,37.951724,-121.85297,2224,,,,Contra Costa,oneleaf onion,Allium unifolium,oneleaf onion,Plantae,59781,Amaryllidaceae,Allium,Allium unifolium
3236685,5/1/16,,Pacific Time (US & Canada),research,http://www.inaturalist.org/observations/3236685,http://static.inaturalist.org/photos/3746194/medium.jpg,,1,0,FALSE,Black Diamond Mines,37.951724,-121.85297,2224,,,,Contra Costa,Whiskerbrush,Leptosiphon ciliatus,Whiskerbrush,Plantae,77684,Polemoniaceae,Leptosiphon,Leptosiphon ciliatus
3236693,5/1/16,,Pacific Time (US & Canada),research,http://www.inaturalist.org/observations/3236693,http://static.inaturalist.org/photos/3746213/medium.jpg,,1,0,FALSE,Black Diamond Mines,37.951724,-121.85297,2224,,,,Contra Costa,Winecup Clarkia,Clarkia purpurea,Winecup Clarkia,Plantae,51087,Onagraceae,Clarkia,Clarkia purpurea
3236719,5/1/16,,Pacific Time (US & Canada),research,http://www.inaturalist.org/observations/3236719,http://static.inaturalist.org/photos/3746273/medium.jpg,,1,0,FALSE,Black Diamond Mines,37.951724,-121.85297,2224,,,,Contra Costa,Q-tips,Micropus californicus,Q-tips,Plantae,56975,Asteraceae,Micropus,Micropus californicus
4055199,9/4/16,2016-09-05 00:49:43 UTC,Pacific Time (US & Canada),research,http://www.inaturalist.org/observations/4055199,http://static.inaturalist.org/photos/4803979/medium.jpg,,3,0,FALSE,"Contra Loma Regional Park, Antioch, CA, US",37.97456667,-121.833275,,,,,Contra Costa,Yellow Starthistle,Centaurea solstitialis,Yellow Star-Thistle,Plantae,52588,Asteraceae,Centaurea,Centaurea solstitialis
4055201,9/4/16,2016-09-05 00:50:49 UTC,Pacific Time (US & Canada),research,http://www.inaturalist.org/observations/4055201,http://static.inaturalist.org/photos/4803982/medium.jpg,,2,0,FALSE,"Contra Loma Regional Park, Antioch, CA, US",37.97505333,-121.8334367,,,,,Contra Costa,wild oat,Avena fatua,wild oat,Plantae,52698,Poaceae,Avena,Avena fatua
4055208,9/4/16,2016-09-05 00:50:23 UTC,Pacific Time (US & Canada),research,http://www.inaturalist.org/observations/4055208,http://static.inaturalist.org/photos/4803990/medium.jpg,,2,0,FALSE,"Contra Loma Regional Park, Antioch, CA, US",37.97482167,-121.8333133,,,,,Contra Costa,Turkey Mullein,Croton setiger,turkey mullein,Plantae,154156,Euphorbiaceae,Croton,Croton setiger
4681928,12/2/16,2016-12-02 21:47:00 UTC,Pacific Time (US & Canada),research,http://www.inaturalist.org/observations/4681928,http://static.inaturalist.org/photos/5682958/medium.jpg,Possibly cultivated.,2,0,FALSE,"Antioch, CA, USA",37.9749669,-121.8279076,31,,,,Contra Costa,Toyon,Heteromeles arbutifolia,Toyon,Plantae,53405,Rosaceae,Heteromeles,Heteromeles arbutifolia
4717632,9/25/16,2016-09-25 17:40:21 UTC,Pacific Time (US & Canada),research,http://www.inaturalist.org/observations/4717632,http://static.inaturalist.org/photos/5702025/medium.jpg,,2,0,FALSE,"Black Diamond Mines Regional Preserve, Pittsburg, CA, US",37.95760338,-121.8669345,73,,,,Contra Costa,Vinegar Weed,Trichostema lanceolatum,Vinegar Weed,Plantae,54875,Lamiaceae,Trichostema,Trichostema lanceolatum
4718128,4/3/16,2016-04-03 18:13:40 UTC,Pacific Time (US & Canada),research,http://www.inaturalist.org/observations/4718128,http://static.inaturalist.org/photos/5702984/medium.jpg,,1,0,FALSE,"Lougher Loop Trl, Pittsburg, CA, US",37.96830582,-121.8780358,76,,,,Contra Costa,Purple Owl's Clover,Castilleja exserta,purple owl's-clover,Plantae,49343,Orobanchaceae,Castilleja,Castilleja exserta
5056415,4/16/16,2016-04-17 00:27:00 UTC,Pacific Time (US & Canada),research,https://www.inaturalist.org/observations/5056415,https://inaturalist-open-data.s3.amazonaws.com/photos/6200005/medium.jpg,Black Diamond Mines Regional Preserve,1,0,FALSE,"Contra Costa County, CA, USA",37.95278611,-121.8654472,,,,,Contra Costa,Mount Diablo manzanita,Arctostaphylos auriculata,Mount Diablo manzanita,Plantae,48023,Ericaceae,Arctostaphylos,Arctostaphylos auriculata
5090248,2/11/17,2017-02-11 18:48:52 UTC,Pacific Time (US & Canada),research,https://www.inaturalist.org/observations/5090248,https://inaturalist-open-data.s3.amazonaws.com/photos/6253337/medium.jpg,,1,0,FALSE,"Black Diamond Mines Regional Preserve, Brentwood, CA, US",37.9542403,-121.8681109,5,,,,Contra Costa,Woolly Indian Paintbrush,Castilleja foliolosa,Woolly Indian Paintbrush,Plantae,56760,Orobanchaceae,Castilleja,Castilleja foliolosa
5090395,2/11/17,2017-02-11 19:09:55 UTC,Pacific Time (US & Canada),research,https://www.inaturalist.org/observations/5090395,https://inaturalist-open-data.s3.amazonaws.com/photos/6253651/medium.jpg,"Mt Diablo Manzanita?
",1,0,FALSE,"Black Diamond Mines Regional Preserve, Brentwood, CA, US",37.95151412,-121.8695975,5,,,,Contra Costa,Mount Diablo manzanita,Arctostaphylos auriculata,Mount Diablo manzanita,Plantae,48023,Ericaceae,Arctostaphylos,Arctostaphylos auriculata
5092679,2/11/17,2017-02-11 19:33:42 UTC,Pacific Time (US & Canada),research,https://www.inaturalist.org/observations/5092679,https://inaturalist-open-data.s3.amazonaws.com/photos/6256832/medium.jpg,,2,0,FALSE,"Black Diamond Mines Regional Preserve, Brentwood, CA, US",37.9524592,-121.8651141,51,,,,Contra Costa,Indian Warrior,Pedicularis densiflora,Warrior's Plume,Plantae,49645,Orobanchaceae,Pedicularis,Pedicularis densiflora
5177642,2/25/17,2017-02-25 18:05:00 UTC,Pacific Time (US & Canada),research,https://www.inaturalist.org/observations/5177642,https://inaturalist-open-data.s3.amazonaws.com/photos/6385457/medium.jpg,,1,0,FALSE,"Contra Costa County, CA, USA",37.95401167,-121.8673183,,,,,Contra Costa,Woolly Indian Paintbrush,Castilleja foliolosa,Woolly Indian Paintbrush,Plantae,56760,Orobanchaceae,Castilleja,Castilleja foliolosa
5177645,2/25/17,2017-02-25 18:00:00 UTC,Pacific Time (US & Canada),research,https://www.inaturalist.org/observations/5177645,https://inaturalist-open-data.s3.amazonaws.com/photos/6385461/medium.jpg,,2,0,FALSE,"Contra Costa County, CA, USA",37.95401167,-121.8673183,,,,,Contra Costa,Indian Warrior,Pedicularis densiflora,Warrior's Plume,Plantae,49645,Orobanchaceae,Pedicularis,Pedicularis densiflora
5177649,2/25/17,2017-02-25 17:54:00 UTC,Pacific Time (US & Canada),research,https://www.inaturalist.org/observations/5177649,https://inaturalist-open-data.s3.amazonaws.com/photos/6385473/medium.jpg,,1,0,FALSE,"Contra Costa County, CA, USA",37.95445833,-121.86664,,,,,Contra Costa,California saxifrage,Micranthes californica,California Saxifrage,Plantae,78023,Saxifragaceae,Micranthes,Micranthes californica
5177654,2/25/17,2017-02-25 17:48:00 UTC,Pacific Time (US & Canada),research,https://www.inaturalist.org/observations/5177654,https://inaturalist-open-data.s3.amazonaws.com/photos/6385481/medium.jpg,,1,0,FALSE,"Black Diamond Mines Regional Preserve, Contra Costa, California, United States",37.95508833,-121.8651417,,,,,Contra Costa,Padre's Shooting Star,Primula clevelandii,Padre's Shooting Star,Plantae,486971,Primulaceae,Primula,Primula clevelandii
5178951,2/25/17,2017-02-25 19:02:00 UTC,Pacific Time (US & Canada),research,https://www.inaturalist.org/observations/5178951,https://inaturalist-open-data.s3.amazonaws.com/photos/6387465/medium.jpg,,1,0,FALSE,"Contra Costa County, CA, USA",37.951515,-121.8600067,,,,,Contra Costa,Glue-seed,Blennosperma nanum,glue-seed,Plantae,57914,Asteraceae,Blennosperma,Blennosperma nanum
5178952,2/25/17,2017-02-25 18:58:00 UTC,Pacific Time (US & Canada),research,https://www.inaturalist.org/observations/5178952,https://inaturalist-open-data.s3.amazonaws.com/photos/6387469/medium.jpg,,2,0,FALSE,"Contra Costa County, CA, USA",37.95076833,-121.8607667,,,,,Contra Costa,Adelinia grande,Adelinia grande,Pacific hound's tongue,Plantae,769151,Boraginaceae,Adelinia,Adelinia grande
5181507,2/25/17,2017-02-25 17:58:59 UTC,Pacific Time (US & Canada),research,https://www.inaturalist.org/observations/5181507,https://inaturalist-open-data.s3.amazonaws.com/photos/6391470/medium.jpg,,1,0,FALSE,"Black Diamond Mines Regional Preserve, Brentwood, CA, US",37.95408333,-121.86718,,,,,Contra Costa,,Adenostoma fasciculatum,chamise,Plantae,47146,Rosaceae,Adenostoma,Adenostoma fasciculatum
5281398,3/11/17,2017-03-11 16:13:52 UTC,Pacific Time (US & Canada),research,https://www.inaturalist.org/observations/5281398,https://inaturalist-open-data.s3.amazonaws.com/photos/6542652/medium.jpg,,2,0,FALSE,"Black Diamond Mines Regional Preserve, Brentwood, CA, US",37.94873,-121.8920367,,,,,Contra Costa,Henderson's shooting star,Primula hendersonii,Henderson's shooting star,Plantae,487175,Primulaceae,Primula,Primula hendersonii
5505542,3/29/17,2017-03-30 00:26:04 UTC,Pacific Time (US & Canada),research,https://www.inaturalist.org/observations/5505542,https://static.inaturalist.org/photos/6787425/medium.jpg,,1,0,FALSE,"Black Diamond Mines Regional Preserve, Brentwood, CA, US",37.952625,-121.8511583,,,,,Contra Costa,purple owl's-clover,Castilleja exserta,purple owl's-clover,Plantae,49343,Orobanchaceae,Castilleja,Castilleja exserta
5747614,4/15/17,2017-04-15 20:21:00 UTC,Pacific Time (US & Canada),research,https://www.inaturalist.org/observations/5747614,https://inaturalist-open-data.s3.amazonaws.com/photos/7133140/medium.jpeg,,3,0,FALSE,"Black Diamond Mines Regional Preserve , CA",37.955238,-121.865362,425,,,,Contra Costa,Calochortus albus,Calochortus albus,White Globe Lily,Plantae,51315,Liliaceae,Calochortus,Calochortus albus
5747776,4/15/17,2017-04-15 20:25:00 UTC,Pacific Time (US & Canada),research,https://www.inaturalist.org/observations/5747776,https://inaturalist-open-data.s3.amazonaws.com/photos/7133340/medium.jpeg,,2,0,FALSE,"Black Diamond Mines Regional Preserve , CA",37.954346,-121.866006,106,,,,Contra Costa,Western Hoptree,Ptelea crenulata,Western Hoptree,Plantae,50622,Rutaceae,Ptelea,Ptelea crenulata
5748171,4/15/17,2017-04-15 20:49:00 UTC,Pacific Time (US & Canada),research,https://www.inaturalist.org/observations/5748171,https://inaturalist-open-data.s3.amazonaws.com/photos/7134184/medium.jpeg,Note the clasping leaves . The similar Pallid Manzanita is not found here .,1,0,FALSE,"Black Diamond Mines Regional Preserve , CA",37.952954,-121.865469,212,,,,Contra Costa,Mount Diablo manzanita,Arctostaphylos auriculata,Mount Diablo manzanita,Plantae,48023,Ericaceae,Arctostaphylos,Arctostaphylos auriculata
5748446,4/15/17,2017-04-15 20:55:00 UTC,Pacific Time (US & Canada),research,https://www.inaturalist.org/observations/5748446,https://inaturalist-open-data.s3.amazonaws.com/photos/7134535/medium.jpeg,,2,0,FALSE,"Black Diamond Mines Regional Preserve , CA",37.952844,-121.863956,212,,,,Contra Costa,Yerba Santa,Eriodictyon californicum,California yerba santa,Plantae,57095,Boraginaceae,Eriodictyon,Eriodictyon californicum
5748576,4/15/17,2017-04-15 21:07:00 UTC,Pacific Time (US & Canada),research,https://www.inaturalist.org/observations/5748576,https://inaturalist-open-data.s3.amazonaws.com/photos/7134737/medium.jpeg,,1,0,FALSE,"Black Diamond Mines Regional Preserve , CA",37.950636,-121.862594,212,,,,Contra Costa,Bush Poppy,Dendromecon rigida,Bush Poppy,Plantae,58224,Papaveraceae,Dendromecon,Dendromecon rigida
5748733,4/15/17,2017-04-15 21:12:00 UTC,Pacific Time (US & Canada),research,https://www.inaturalist.org/observations/5748733,https://inaturalist-open-data.s3.amazonaws.com/photos/7134944/medium.jpeg,,1,0,FALSE,"Black Diamond Mines Regional Preserve , CA",37.950602,-121.861017,106,,,,Contra Costa,valley tassels,Castilleja attenuata,valley tassels,Plantae,49341,Orobanchaceae,Castilleja,Castilleja attenuata
5748988,4/15/17,2017-04-15 21:15:00 UTC,Pacific Time (US & Canada),research,https://www.inaturalist.org/observations/5748988,https://inaturalist-open-data.s3.amazonaws.com/photos/7135210/medium.jpeg,,1,0,FALSE,"Black Diamond Mines Regional Preserve , CA",37.950616,-121.86088,26,,,,Contra Costa,purple owl's-clover,Castilleja exserta,purple owl's-clover,Plantae,49343,Orobanchaceae,Castilleja,Castilleja exserta
5749869,4/15/17,2017-04-15 21:20:00 UTC,Pacific Time (US & Canada),research,https://www.inaturalist.org/observations/5749869,https://inaturalist-open-data.s3.amazonaws.com/photos/7136311/medium.jpeg,,2,0,FALSE,"Black Diamond Mines Regional Preserve , CA",37.951127,-121.861092,106,,,,Contra Costa,Whiskerbrush,Leptosiphon ciliatus,Whiskerbrush,Plantae,77684,Polemoniaceae,Leptosiphon,Leptosiphon ciliatus
5749991,4/15/17,2017-04-15 21:24:00 UTC,Pacific Time (US & Canada),research,https://www.inaturalist.org/observations/5749991,https://inaturalist-open-data.s3.amazonaws.com/photos/7136445/medium.jpeg,,1,0,FALSE,"Black Diamond Mines Regional Preserve , CA",37.950678,-121.860942,106,,,,Contra Costa,tomcat clover,Trifolium willdenovii,tomcat clover,Plantae,57081,Fabaceae,Trifolium,Trifolium willdenovii
5750140,4/15/17,2017-04-15 21:32:00 UTC,Pacific Time (US & Canada),research,https://www.inaturalist.org/observations/5750140,https://inaturalist-open-data.s3.amazonaws.com/photos/7136759/medium.jpeg,,1,0,FALSE,"Black Diamond Mines Regional Preserve , CA",37.951139,-121.860282,106,,,,Contra Costa,Zigzag Larkspur,Delphinium patens,Zigzag Larkspur,Plantae,57237,Ranunculaceae,Delphinium,Delphinium patens
5750262,4/15/17,2017-04-15 21:34:00 UTC,Pacific Time (US & Canada),research,https://www.inaturalist.org/observations/5750262,https://inaturalist-open-data.s3.amazonaws.com/photos/7136942/medium.jpeg,,1,0,FALSE,"Black Diamond Mines Regional Preserve , CA",37.951524,-121.859815,106,,,,Contra Costa,graceful bedstraw,Galium porrigens,graceful bedstraw,Plantae,53063,Rubiaceae,Galium,Galium porrigens
5750353,4/15/17,2017-04-15 21:34:00 UTC,Pacific Time (US & Canada),research,https://www.inaturalist.org/observations/5750353,https://inaturalist-open-data.s3.amazonaws.com/photos/7137082/medium.jpeg,,1,0,FALSE,"Black Diamond Mines Regional Preserve , CA",37.951372,-121.859944,212,,,,Contra Costa,jeweled onion,Allium serra,jeweled onion,Plantae,59784,Amaryllidaceae,Allium,Allium serra
5750399,4/15/17,2017-04-15 21:35:00 UTC,Pacific Time (US & Canada),research,https://www.inaturalist.org/observations/5750399,https://inaturalist-open-data.s3.amazonaws.com/photos/7137173/medium.jpeg,"Note the white pollen sacs , a diagnostic mark in this area .",1,0,FALSE,"Black Diamond Mines Regional Preserve , CA",37.951397,-121.860073,212,,,,Contra Costa,glue-seed,Blennosperma nanum,glue-seed,Plantae,57914,Asteraceae,Blennosperma,Blennosperma nanum
5750434,4/15/17,2017-04-15 21:35:00 UTC,Pacific Time (US & Canada),research,https://www.inaturalist.org/observations/5750434,https://inaturalist-open-data.s3.amazonaws.com/photos/7137260/medium.jpeg,,1,0,FALSE,"Black Diamond Mines Regional Preserve , CA",37.952006,-121.859869,106,,,,Contra Costa,Narrowleaf Goldenbush,Ericameria linearifolia,narrowleaf goldenbush,Plantae,57971,Asteraceae,Ericameria,Ericameria linearifolia
5750464,4/15/17,2017-04-15 21:39:00 UTC,Pacific Time (US & Canada),research,https://www.inaturalist.org/observations/5750464,https://inaturalist-open-data.s3.amazonaws.com/photos/7137316/medium.jpeg,,1,0,FALSE,"Black Diamond Mines Regional Preserve , CA",37.95204,-121.859397,106,,,,Contra Costa,Henderson's Shooting Star,Primula hendersonii,Henderson's shooting star,Plantae,487175,Primulaceae,Primula,Primula hendersonii
5750509,4/15/17,2017-04-15 21:39:00 UTC,Pacific Time (US & Canada),research,https://www.inaturalist.org/observations/5750509,https://inaturalist-open-data.s3.amazonaws.com/photos/7137440/medium.jpeg,,1,0,FALSE,"Black Diamond Mines Regional Preserve , CA",37.952091,-121.859128,106,,,,Contra Costa,Poison sanicle,Sanicula bipinnata,Poison sanicle,Plantae,57626,Apiaceae,Sanicula,Sanicula bipinnata
5750584,4/15/17,2017-04-15 21:44:00 UTC,Pacific Time (US & Canada),research,https://www.inaturalist.org/observations/5750584,https://inaturalist-open-data.s3.amazonaws.com/photos/7137541/medium.jpeg,Correct ?,2,0,FALSE,"Black Diamond Mines Regional Preserve , CA",37.952133,-121.858549,425,,,,Contra Costa,mountain dandelion,Agoseris heterophylla,Annual Agoseris,Plantae,56856,Asteraceae,Agoseris,Agoseris heterophylla
5750773,4/15/17,2017-04-15 21:48:00 UTC,Pacific Time (US & Canada),research,https://www.inaturalist.org/observations/5750773,https://inaturalist-open-data.s3.amazonaws.com/photos/7137663/medium.jpeg,I think this correct .,1,0,FALSE,"Black Diamond Mines Regional Preserve , CA",37.952252,-121.856189,425,,,,Contra Costa,cowbag clover,Trifolium depauperatum,cowbag clover,Plantae,58164,Fabaceae,Trifolium,Trifolium depauperatum
5750936,4/15/17,2017-04-15 21:47:00 UTC,Pacific Time (US & Canada),research,https://www.inaturalist.org/observations/5750936,https://inaturalist-open-data.s3.amazonaws.com/photos/7137833/medium.jpeg,,2,0,FALSE,"Black Diamond Mines Regional Preserve , CA",37.952336,-121.855427,106,,,,Contra Costa,Blow Wives,Achyrachaena mollis,Blow Wives,Plantae,56852,Asteraceae,Achyrachaena,Achyrachaena mollis
5751109,4/15/17,2017-04-15 21:52:00 UTC,Pacific Time (US & Canada),research,https://www.inaturalist.org/observations/5751109,https://inaturalist-open-data.s3.amazonaws.com/photos/7138132/medium.jpeg,,1,0,FALSE,"Black Diamond Mines Regional Preserve , CA",37.952404,-121.856875,106,,,,Contra Costa,Tree Clover,Trifolium ciliolatum,Tree Clover,Plantae,60197,Fabaceae,Trifolium,Trifolium ciliolatum
5751279,4/15/17,2017-04-15 22:09:00 UTC,Pacific Time (US & Canada),research,https://www.inaturalist.org/observations/5751279,https://inaturalist-open-data.s3.amazonaws.com/photos/7138316/medium.jpeg,Something like Microseris ?,1,0,FALSE,"Black Diamond Mines Regional Preserve , CA",37.954011,-121.856596,425,,,,Contra Costa,Douglas' silverpuffs,Microseris douglasii,Douglas' silverpuffs,Plantae,56976,Asteraceae,Microseris,Microseris douglasii
5756908,4/15/17,2017-04-15 19:44:00 UTC,Pacific Time (US & Canada),research,https://www.inaturalist.org/observations/5756908,https://inaturalist-open-data.s3.amazonaws.com/photos/7145740/medium.jpeg,,1,0,FALSE,"Black Diamond Mines Regional Preserve , CA",37.956845,-121.864364,106,,,,Contra Costa,Blue Oak,Quercus douglasii,blue oak,Plantae,49009,Fagaceae,Quercus,Quercus douglasii
5756970,4/15/17,2017-04-15 19:43:00 UTC,Pacific Time (US & Canada),research,https://www.inaturalist.org/observations/5756970,https://inaturalist-open-data.s3.amazonaws.com/photos/7145816/medium.jpeg,,1,0,FALSE,"Black Diamond Mines Regional Preserve , CA",37.95737,-121.863989,106,,,,Contra Costa,Oak mistletoe,Phoradendron villosum,oak mistletoe,Plantae,343310,Santalaceae,Phoradendron,Phoradendron villosum
5758193,4/15/17,2017-04-15 19:54:00 UTC,Pacific Time (US & Canada),research,https://www.inaturalist.org/observations/5758193,https://inaturalist-open-data.s3.amazonaws.com/photos/7147524/medium.jpeg,,1,0,FALSE,"Black Diamond Mines Regional Preserve , CA",37.956202,-121.866424,212,,,,Contra Costa,Rancher's fiddleneck,Amsinckia menziesii intermedia,Rancher's fiddleneck,Plantae,49141,Boraginaceae,Amsinckia,Amsinckia menziesii
5758472,4/15/17,2017-04-15 20:05:00 UTC,Pacific Time (US & Canada),research,https://www.inaturalist.org/observations/5758472,https://inaturalist-open-data.s3.amazonaws.com/photos/7147884/medium.jpeg,,1,0,FALSE,"Black Diamond Mines Regional Preserve , CA",37.956408,-121.867902,26,,,,Contra Costa,Mediterranean lineseed,Bellardia trixago,Mediterranean lineseed,Plantae,51286,Orobanchaceae,Bellardia,Bellardia trixago
5758598,4/15/17,2017-04-15 20:17:00 UTC,Pacific Time (US & Canada),research,https://www.inaturalist.org/observations/5758598,https://inaturalist-open-data.s3.amazonaws.com/photos/7148041/medium.jpeg,Strong mint scent .,1,0,FALSE,"Black Diamond Mines Regional Preserve , CA",37.955949,-121.864729,106,,,,Contra Costa,Coyote Mint,Monardella villosa,Coyote Mint,Plantae,52181,Lamiaceae,Monardella,Monardella villosa
5771129,4/15/17,2017-04-15 18:31:00 UTC,Pacific Time (US & Canada),research,https://www.inaturalist.org/observations/5771129,https://static.inaturalist.org/photos/7165466/medium.jpg,,1,0,FALSE,"Contra Costa County, CA, USA",37.96985358,-121.8625567,197,,,,Contra Costa,Blue Oak,Quercus douglasii,blue oak,Plantae,49009,Fagaceae,Quercus,Quercus douglasii
5771198,4/15/17,2017-04-15 18:42:00 UTC,Pacific Time (US & Canada),research,https://www.inaturalist.org/observations/5771198,https://static.inaturalist.org/photos/7165578/medium.jpg,,1,0,FALSE,"Contra Costa County, CA, USA",37.95808414,-121.8641925,257,,,,Contra Costa,Oak mistletoe,Phoradendron villosum,oak mistletoe,Plantae,343310,Santalaceae,Phoradendron,Phoradendron villosum
5771535,4/15/17,2017-04-15 18:59:00 UTC,Pacific Time (US & Canada),research,https://www.inaturalist.org/observations/5771535,https://static.inaturalist.org/photos/7166004/medium.jpg,,1,0,FALSE,"Contra Costa County, CA, USA",37.95654454,-121.8677974,31,,,,Contra Costa,coontail,Ceratophyllum demersum,coontail,Plantae,60997,Ceratophyllaceae,Ceratophyllum,Ceratophyllum demersum
5771853,4/15/17,2017-04-15 19:16:00 UTC,Pacific Time (US & Canada),research,https://www.inaturalist.org/observations/5771853,https://static.inaturalist.org/photos/7166563/medium.jpg,,1,0,FALSE,"Contra Costa County, CA, USA",37.9554448,-121.8590426,270,,,,Contra Costa,Coyote Mint,Monardella villosa,Coyote Mint,Plantae,52181,Lamiaceae,Monardella,Monardella villosa
5771981,4/15/17,2017-04-15 19:54:00 UTC,Pacific Time (US & Canada),research,https://www.inaturalist.org/observations/5771981,https://static.inaturalist.org/photos/7166753/medium.jpg,,2,0,FALSE,"Contra Costa County, CA, USA",37.96793007,-121.8533134,240,,,,Contra Costa,Fremont's Deathcamas,Toxicoscordion fremontii,Common star lily,Plantae,49649,Melanthiaceae,Toxicoscordion,Toxicoscordion fremontii
5772135,4/15/17,2017-04-15 20:13:00 UTC,Pacific Time (US & Canada),research,https://www.inaturalist.org/observations/5772135,https://static.inaturalist.org/photos/7166918/medium.jpg,,1,0,FALSE,"Contra Costa County, CA, USA",37.9678624,-121.8537426,326,,,,Contra Costa,purple owl's-clover,Castilleja exserta,purple owl's-clover,Plantae,49343,Orobanchaceae,Castilleja,Castilleja exserta
5772246,4/15/17,2017-04-15 20:28:00 UTC,Pacific Time (US & Canada),research,https://www.inaturalist.org/observations/5772246,https://static.inaturalist.org/photos/7167118/medium.jpg,White  variant.,1,0,FALSE,"Contra Costa County, CA, USA",37.96825147,-121.8534207,196,,,,Contra Costa,purple owl's-clover,Castilleja exserta,purple owl's-clover,Plantae,49343,Orobanchaceae,Castilleja,Castilleja exserta
5772422,4/15/17,2017-04-15 20:31:00 UTC,Pacific Time (US & Canada),research,https://www.inaturalist.org/observations/5772422,https://static.inaturalist.org/photos/7167204/medium.jpg,,1,0,FALSE,"Contra Costa County, CA, USA",37.97855271,-121.8537855,258,,,,Contra Costa,deltoid balsamroot,Balsamorhiza deltoidea,deltoid balsamroot,Plantae,70383,Asteraceae,Balsamorhiza,Balsamorhiza deltoidea
5772447,4/15/17,2017-04-15 20:31:00 UTC,Pacific Time (US & Canada),research,https://www.inaturalist.org/observations/5772447,https://static.inaturalist.org/photos/7167295/medium.jpg,,2,0,FALSE,"Contra Costa County, CA, USA",37.97924618,-121.8535495,209,,,,Contra Costa,Zigzag Larkspur,Delphinium patens,Zigzag Larkspur,Plantae,57237,Ranunculaceae,Delphinium,Delphinium patens
5772497,4/15/17,2017-04-15 20:57:00 UTC,Pacific Time (US & Canada),research,https://www.inaturalist.org/observations/5772497,https://static.inaturalist.org/photos/7167426/medium.jpg,,2,0,FALSE,"Contra Costa County, CA, USA",37.98105592,-121.8548584,96,,,,Contra Costa,Redmaids,Calandrinia menziesii,redmaids,Plantae,400267,Montiaceae,Calandrinia,Calandrinia menziesii
5772595,4/15/17,2017-04-15 21:25:00 UTC,Pacific Time (US & Canada),research,https://www.inaturalist.org/observations/5772595,https://static.inaturalist.org/photos/7167582/medium.jpg,This may be a pink variant of Winter vetch.,1,0,FALSE,"Contra Costa County, CA, USA",37.95980981,-121.8617249,93,,,,Contra Costa,hairy vetch,Vicia villosa,hairy vetch,Plantae,57317,Fabaceae,Vicia,Vicia villosa
5772677,4/15/17,2017-04-15 18:52:00 UTC,Pacific Time (US & Canada),research,https://www.inaturalist.org/observations/5772677,https://static.inaturalist.org/photos/7167710/medium.jpeg,,1,0,FALSE,"Contra Costa County, CA, USA",37.95645994,-121.8656301,117,,,,Contra Costa,Rancher's fiddleneck,Amsinckia menziesii intermedia,Rancher's fiddleneck,Plantae,49141,Boraginaceae,Amsinckia,Amsinckia menziesii
5772798,4/15/17,2017-04-15 19:17:00 UTC,Pacific Time (US & Canada),research,https://www.inaturalist.org/observations/5772798,https://static.inaturalist.org/photos/7167909/medium.jpeg,,1,0,FALSE,"Contra Costa County, CA, USA",37.95544167,-121.8644583,,,,,Contra Costa,Interior Live Oak,Quercus wislizeni,interior live oak,Plantae,51089,Fagaceae,Quercus,Quercus wislizeni
5772818,4/15/17,2017-04-15 19:19:00 UTC,Pacific Time (US & Canada),research,https://www.inaturalist.org/observations/5772818,https://static.inaturalist.org/photos/7167944/medium.jpeg,,4,0,FALSE,"Contra Costa County, CA, USA",37.95503889,-121.8648917,,,,,Contra Costa,Calochortus albus,Calochortus albus,White Globe Lily,Plantae,51315,Liliaceae,Calochortus,Calochortus albus
5772852,4/15/17,2017-04-15 19:20:00 UTC,Pacific Time (US & Canada),research,https://www.inaturalist.org/observations/5772852,https://static.inaturalist.org/photos/7167989/medium.jpeg,,1,0,FALSE,"Contra Costa County, CA, USA",37.95470833,-121.8651833,,,,,Contra Costa,Q-tips,Micropus californicus,Q-tips,Plantae,56975,Asteraceae,Micropus,Micropus californicus
5772885,4/15/17,2017-04-15 19:21:00 UTC,Pacific Time (US & Canada),research,https://www.inaturalist.org/observations/5772885,https://static.inaturalist.org/photos/7168047/medium.jpeg,,1,0,FALSE,"Contra Costa County, CA, USA",37.95491389,-121.865375,,,,,Contra Costa,alkali desertparsley,Lomatium caruifolium,alkali desertparsley,Plantae,56213,Apiaceae,Lomatium,Lomatium caruifolium
5772944,4/15/17,2017-04-15 19:22:00 UTC,Pacific Time (US & Canada),research,https://www.inaturalist.org/observations/5772944,https://static.inaturalist.org/photos/7168089/medium.jpeg,,1,0,FALSE,"Contra Costa County, CA, USA",37.95469722,-121.8653194,,,,,Contra Costa,Gray Mule-Ears,Wyethia helenioides,Gray Mule-Ears,Plantae,50799,Asteraceae,Wyethia,Wyethia helenioides
5773029,4/15/17,2017-04-15 19:23:00 UTC,Pacific Time (US & Canada),research,https://www.inaturalist.org/observations/5773029,https://static.inaturalist.org/photos/7168242/medium.jpeg,,1,0,FALSE,"Contra Costa County, CA, USA",37.95451111,-121.8657028,,,,,Contra Costa,Western Hoptree,Ptelea crenulata,Western Hoptree,Plantae,50622,Rutaceae,Ptelea,Ptelea crenulata
5773163,4/15/17,2017-04-15 19:27:00 UTC,Pacific Time (US & Canada),research,https://www.inaturalist.org/observations/5773163,https://static.inaturalist.org/photos/7168415/medium.jpeg,,1,0,FALSE,"Contra Costa County, CA, USA",37.95459444,-121.8666833,,,,,Contra Costa,Poison sanicle,Sanicula bipinnata,Poison sanicle,Plantae,57626,Apiaceae,Sanicula,Sanicula bipinnata
5773451,4/15/17,2017-04-15 19:31:00 UTC,Pacific Time (US & Canada),research,https://www.inaturalist.org/observations/5773451,https://static.inaturalist.org/photos/7168726/medium.jpeg,,1,0,FALSE,"Contra Costa County, CA, USA",37.954325,-121.8661139,,,,,Contra Costa,jeweled onion,Allium serra,jeweled onion,Plantae,59784,Amaryllidaceae,Allium,Allium serra
5773528,4/15/17,2017-04-15 19:31:00 UTC,Pacific Time (US & Canada),research,https://www.inaturalist.org/observations/5773528,https://static.inaturalist.org/photos/7168760/medium.jpeg,,1,0,FALSE,"Contra Costa County, CA, USA",37.95415278,-121.8659611,,,,,Contra Costa,Dipterostemon capitatus,Dipterostemon capitatus,Blue Dicks,Plantae,1196784,Asparagaceae,Dipterostemon,Dipterostemon capitatus
5773543,4/15/17,2017-04-15 19:32:00 UTC,Pacific Time (US & Canada),research,https://www.inaturalist.org/observations/5773543,https://static.inaturalist.org/photos/7168800/medium.jpeg,,1,0,FALSE,"Contra Costa County, CA, USA",37.95431111,-121.8658194,,,,,Contra Costa,tomcat clover,Trifolium willdenovii,tomcat clover,Plantae,57081,Fabaceae,Trifolium,Trifolium willdenovii
5773574,4/15/17,2017-04-15 19:28:00 UTC,Pacific Time (US & Canada),research,https://www.inaturalist.org/observations/5773574,https://static.inaturalist.org/photos/7168837/medium.jpeg,,2,0,FALSE,"Contra Costa County, CA, USA",37.95429167,-121.8665972,,,,,Contra Costa,Zigzag Larkspur,Delphinium patens,Zigzag Larkspur,Plantae,57237,Ranunculaceae,Delphinium,Delphinium patens
5773588,4/15/17,2017-04-15 19:32:00 UTC,Pacific Time (US & Canada),research,https://www.inaturalist.org/observations/5773588,https://static.inaturalist.org/photos/7168859/medium.jpeg,,1,0,FALSE,"Contra Costa County, CA, USA",37.95431111,-121.8658194,,,,,Contra Costa,distant phacelia,Phacelia distans,distant phacelia,Plantae,56631,Boraginaceae,Phacelia,Phacelia distans
5773621,4/15/17,2017-04-15 19:33:00 UTC,Pacific Time (US & Canada),research,https://www.inaturalist.org/observations/5773621,https://static.inaturalist.org/photos/7168886/medium.jpeg,,1,0,FALSE,"Contra Costa County, CA, USA",37.95395556,-121.8657944,,,,,Contra Costa,sand fringepod,Thysanocarpus curvipes,sand fringepod,Plantae,58088,Brassicaceae,Thysanocarpus,Thysanocarpus curvipes
5773654,4/15/17,2017-04-15 19:32:00 UTC,Pacific Time (US & Canada),research,https://www.inaturalist.org/observations/5773654,https://static.inaturalist.org/photos/7168934/medium.jpeg,,1,0,FALSE,"Contra Costa County, CA, USA",37.95411944,-121.8658944,,,,,Contra Costa,San Francisco woodland-star,Lithophragma affine,San Francisco woodland-star,Plantae,50803,Saxifragaceae,Lithophragma,Lithophragma affine
5773785,4/15/17,2017-04-15 19:34:00 UTC,Pacific Time (US & Canada),research,https://www.inaturalist.org/observations/5773785,https://static.inaturalist.org/photos/7168971/medium.jpeg,,1,0,FALSE,"Contra Costa County, CA, USA",37.954025,-121.8658528,,,,,Contra Costa,Silver Hairgrass,Aira caryophyllea,Silver Hairgrass,Plantae,52694,Poaceae,Aira,Aira caryophyllea
5773859,4/15/17,2017-04-15 19:34:00 UTC,Pacific Time (US & Canada),research,https://www.inaturalist.org/observations/5773859,https://static.inaturalist.org/photos/7169240/medium.jpeg,,2,0,FALSE,"Contra Costa County, CA, USA",37.954175,-121.8658361,,,,,Contra Costa,deerweed,Acmispon glaber,deerweed,Plantae,53134,Fabaceae,Acmispon,Acmispon glaber
5773915,4/15/17,2017-04-15 19:36:00 UTC,Pacific Time (US & Canada),research,https://www.inaturalist.org/observations/5773915,https://static.inaturalist.org/photos/7169317/medium.jpeg,,1,0,FALSE,"Contra Costa County, CA, USA",37.95398056,-121.8657028,,,,,Contra Costa,orange bush monkeyflower,Diplacus aurantiacus,orange bush monkeyflower,Plantae,777371,Phrymaceae,Diplacus,Diplacus aurantiacus
5773965,4/15/17,2017-04-15 19:44:00 UTC,Pacific Time (US & Canada),research,https://www.inaturalist.org/observations/5773965,https://static.inaturalist.org/photos/7169364/medium.jpeg,,2,0,FALSE,"Contra Costa County, CA, USA",37.96491891,-121.8578196,185,,,,Contra Costa,Indian Warrior,Pedicularis densiflora,Warrior's Plume,Plantae,49645,Orobanchaceae,Pedicularis,Pedicularis densiflora
5774008,4/15/17,2017-04-15 19:45:00 UTC,Pacific Time (US & Canada),research,https://www.inaturalist.org/observations/5774008,https://static.inaturalist.org/photos/7169450/medium.jpeg,,1,0,FALSE,"Contra Costa County, CA, USA",37.95288333,-121.8655389,,,,,Contra Costa,Woolly Indian Paintbrush,Castilleja foliolosa,Woolly Indian Paintbrush,Plantae,56760,Orobanchaceae,Castilleja,Castilleja foliolosa
5774052,4/15/17,2017-04-15 19:47:00 UTC,Pacific Time (US & Canada),research,https://www.inaturalist.org/observations/5774052,https://static.inaturalist.org/photos/7169537/medium.jpeg,,2,0,FALSE,"Contra Costa County, CA, USA",37.95263611,-121.8653083,,,,,Contra Costa,Mount Diablo manzanita,Arctostaphylos auriculata,Mount Diablo manzanita,Plantae,48023,Ericaceae,Arctostaphylos,Arctostaphylos auriculata
5774100,4/15/17,2017-04-15 19:48:00 UTC,Pacific Time (US & Canada),research,https://www.inaturalist.org/observations/5774100,https://static.inaturalist.org/photos/7169635/medium.jpeg,,1,0,FALSE,"Contra Costa County, CA, USA",37.96851734,-121.8528843,595,,,,Contra Costa,Chamise,Adenostoma fasciculatum,chamise,Plantae,47146,Rosaceae,Adenostoma,Adenostoma fasciculatum
5774123,4/15/17,2017-04-15 19:54:00 UTC,Pacific Time (US & Canada),research,https://www.inaturalist.org/observations/5774123,https://static.inaturalist.org/photos/7169696/medium.jpeg,,1,0,FALSE,"Contra Costa County, CA, USA",37.97476392,-121.8535495,334,,,,Contra Costa,Bush Poppy,Dendromecon rigida,Bush Poppy,Plantae,58224,Papaveraceae,Dendromecon,Dendromecon rigida
5774157,4/15/17,2017-04-15 19:54:00 UTC,Pacific Time (US & Canada),research,https://www.inaturalist.org/observations/5774157,https://static.inaturalist.org/photos/7169745/medium.jpeg,,3,0,FALSE,"Contra Costa County, CA, USA",37.95189722,-121.8648611,,,,,Contra Costa,California yerba santa,Eriodictyon californicum,California yerba santa,Plantae,57095,Boraginaceae,Eriodictyon,Eriodictyon californicum
5774184,4/15/17,2017-04-15 20:01:00 UTC,Pacific Time (US & Canada),research,https://www.inaturalist.org/observations/5774184,https://static.inaturalist.org/photos/7169790/medium.jpeg,,2,0,FALSE,"Contra Costa County, CA, USA",37.950775,-121.8655722,,,,,Contra Costa,everlasting neststraw,Stylocline gnaphaloides,everlasting neststraw,Plantae,58043,Asteraceae,Stylocline,Stylocline gnaphaloides
5774248,4/15/17,2017-04-15 20:02:00 UTC,Pacific Time (US & Canada),research,https://www.inaturalist.org/observations/5774248,https://static.inaturalist.org/photos/7169904/medium.jpeg,,2,0,FALSE,"Contra Costa County, CA, USA",37.96896195,-121.8550086,460,,,,Contra Costa,Mount Diablo manzanita,Arctostaphylos auriculata,Mount Diablo manzanita,Plantae,48023,Ericaceae,Arctostaphylos,Arctostaphylos auriculata
5774356,4/15/17,2017-04-15 20:10:00 UTC,Pacific Time (US & Canada),research,https://www.inaturalist.org/observations/5774356,https://static.inaturalist.org/photos/7170091/medium.jpeg,,1,0,FALSE,"Contra Costa County, CA, USA",37.95046667,-121.8621861,,,,,Contra Costa,valley tassels,Castilleja attenuata,valley tassels,Plantae,49341,Orobanchaceae,Castilleja,Castilleja attenuata
5774797,4/15/17,2017-04-15 20:16:00 UTC,Pacific Time (US & Canada),research,https://www.inaturalist.org/observations/5774797,https://static.inaturalist.org/photos/7170677/medium.jpeg,,1,0,FALSE,"Contra Costa County, CA, USA",37.97662451,-121.8538284,181,,,,Contra Costa,tomcat clover,Trifolium willdenovii,tomcat clover,Plantae,57081,Fabaceae,Trifolium,Trifolium willdenovii
5774820,4/15/17,2017-04-15 20:11:00 UTC,Pacific Time (US & Canada),research,https://www.inaturalist.org/observations/5774820,https://static.inaturalist.org/photos/7170734/medium.jpeg,,1,0,FALSE,"Contra Costa County, CA, USA",37.95058611,-121.8618194,,,,,Contra Costa,tomcat clover,Trifolium willdenovii,tomcat clover,Plantae,57081,Fabaceae,Trifolium,Trifolium willdenovii
5774868,4/15/17,2017-04-15 20:19:00 UTC,Pacific Time (US & Canada),research,https://www.inaturalist.org/observations/5774868,https://static.inaturalist.org/photos/7170810/medium.jpeg,,2,0,FALSE,"Contra Costa County, CA, USA",37.95099444,-121.8610694,,,,,Contra Costa,Whiskerbrush,Leptosiphon ciliatus,Whiskerbrush,Plantae,77684,Polemoniaceae,Leptosiphon,Leptosiphon ciliatus
5775200,4/15/17,2017-04-15 20:47:00 UTC,Pacific Time (US & Canada),research,https://www.inaturalist.org/observations/5775200,https://static.inaturalist.org/photos/7171222/medium.jpeg,,1,0,FALSE,"Contra Costa County, CA, USA",37.95184444,-121.8581917,,,,,Contra Costa,alkali desertparsley,Lomatium caruifolium,alkali desertparsley,Plantae,56213,Apiaceae,Lomatium,Lomatium caruifolium
5775229,4/15/17,2017-04-15 20:48:00 UTC,Pacific Time (US & Canada),research,https://www.inaturalist.org/observations/5775229,https://static.inaturalist.org/photos/7171264/medium.jpeg,,1,0,FALSE,"Contra Costa County, CA, USA",37.95208056,-121.8578889,,,,,Contra Costa,Dove's-foot crane's-bill,Geranium molle,Dove's-foot crane's-bill,Plantae,53076,Geraniaceae,Geranium,Geranium molle
5775326,4/15/17,2017-04-15 20:37:00 UTC,Pacific Time (US & Canada),research,https://www.inaturalist.org/observations/5775326,https://static.inaturalist.org/photos/7171356/medium.jpeg,,1,0,FALSE,"Contra Costa County, CA, USA",37.95151667,-121.8598,,,,,Contra Costa,Henderson's Shooting Star,Primula hendersonii,Henderson's shooting star,Plantae,487175,Primulaceae,Primula,Primula hendersonii
5775364,4/15/17,2017-04-15 20:38:00 UTC,Pacific Time (US & Canada),research,https://www.inaturalist.org/observations/5775364,https://static.inaturalist.org/photos/7171402/medium.jpeg,,1,0,FALSE,"Contra Costa County, CA, USA",37.95145833,-121.8598694,,,,,Contra Costa,Purple Sanicle,Sanicula bipinnatifida,Purple Sanicle,Plantae,56840,Apiaceae,Sanicula,Sanicula bipinnatifida
5775376,4/15/17,2017-04-15 20:46:00 UTC,Pacific Time (US & Canada),research,https://www.inaturalist.org/observations/5775376,https://static.inaturalist.org/photos/7171452/medium.jpeg,,2,0,FALSE,"Contra Costa County, CA, USA",37.95229444,-121.8585306,,,,,Contra Costa,Blow Wives,Achyrachaena mollis,Blow Wives,Plantae,56852,Asteraceae,Achyrachaena,Achyrachaena mollis
5775398,4/15/17,2017-04-15 20:42:00 UTC,Pacific Time (US & Canada),research,https://www.inaturalist.org/observations/5775398,https://static.inaturalist.org/photos/7171493/medium.jpeg,,2,0,FALSE,"Contra Costa County, CA, USA",37.952075,-121.8592917,,,,,Contra Costa,mountain dandelion,Agoseris heterophylla,Annual Agoseris,Plantae,56856,Asteraceae,Agoseris,Agoseris heterophylla
5775445,4/15/17,2017-04-15 20:48:00 UTC,Pacific Time (US & Canada),research,https://www.inaturalist.org/observations/5775445,https://static.inaturalist.org/photos/7171617/medium.jpeg,,1,0,FALSE,"Contra Costa County, CA, USA",37.95208056,-121.8578889,,,,,Contra Costa,Sacramento Valley Buttercup,Ranunculus canus,Sacramento Valley Buttercup,Plantae,60238,Ranunculaceae,Ranunculus,Ranunculus canus
5775478,4/15/17,2017-04-15 20:50:00 UTC,Pacific Time (US & Canada),research,https://www.inaturalist.org/observations/5775478,https://static.inaturalist.org/photos/7171656/medium.jpeg,,1,0,FALSE,"Contra Costa County, CA, USA",37.95203056,-121.857825,,,,,Contra Costa,Tree Clover,Trifolium ciliolatum,Tree Clover,Plantae,60197,Fabaceae,Trifolium,Trifolium ciliolatum
5775553,4/15/17,2017-04-15 20:50:00 UTC,Pacific Time (US & Canada),research,https://www.inaturalist.org/observations/5775553,https://static.inaturalist.org/photos/7171704/medium.jpeg,,1,0,FALSE,"Contra Costa County, CA, USA",37.95198889,-121.8577889,,,,,Contra Costa,Miner's Lettuce,Claytonia perfoliata,miner's lettuce,Plantae,52994,Montiaceae,Claytonia,Claytonia perfoliata
5775591,4/15/17,2017-04-15 20:51:00 UTC,Pacific Time (US & Canada),research,https://www.inaturalist.org/observations/5775591,https://static.inaturalist.org/photos/7171771/medium.jpeg,,1,0,FALSE,"Contra Costa County, CA, USA",37.97941531,-121.8540215,360,,,,Contra Costa,Small Baby Blue-eyes,Nemophila heterophylla,White nemophila,Plantae,53158,Boraginaceae,Nemophila,Nemophila heterophylla
5775622,4/15/17,2017-04-15 21:07:00 UTC,Pacific Time (US & Canada),research,https://www.inaturalist.org/observations/5775622,https://static.inaturalist.org/photos/7171817/medium.jpeg,,2,0,FALSE,"Contra Costa County, CA, USA",37.97545742,-121.8602228,473,,,,Contra Costa,silverpuffs,Uropappus lindleyi,silverpuffs,Plantae,50806,Asteraceae,Uropappus,Uropappus lindleyi
5775639,4/15/17,2017-04-15 21:10:00 UTC,Pacific Time (US & Canada),research,https://www.inaturalist.org/observations/5775639,https://static.inaturalist.org/photos/7171885/medium.jpeg,,2,0,FALSE,"Contra Costa County, CA, USA",37.97894173,-121.8576479,31,,,,Contra Costa,Ithuriel's Spear,Triteleia laxa,Ithuriel's Spear,Plantae,51085,Asparagaceae,Triteleia,Triteleia laxa
5781338,4/15/17,2017-04-15 20:19:00 UTC,Pacific Time (US & Canada),research,https://www.inaturalist.org/observations/5781338,https://inaturalist-open-data.s3.amazonaws.com/photos/7180845/medium.jpeg,,1,0,FALSE,"Black Diamond Mines Regional Preserve , CA",37.955077,-121.865931,212,,,,Contra Costa,Toyon,Heteromeles arbutifolia,Toyon,Plantae,53405,Rosaceae,Heteromeles,Heteromeles arbutifolia
5781815,4/15/17,2017-04-15 20:19:00 UTC,Pacific Time (US & Canada),research,https://www.inaturalist.org/observations/5781815,https://inaturalist-open-data.s3.amazonaws.com/photos/7182112/medium.jpeg,,1,0,FALSE,"Black Diamond Mines Regional Preserve , CA",37.955312,-121.865314,425,,,,Contra Costa,Interior Live Oak,Quercus wislizeni,interior live oak,Plantae,51089,Fagaceae,Quercus,Quercus wislizeni
5781929,4/15/17,2017-04-15 20:22:00 UTC,Pacific Time (US & Canada),research,https://www.inaturalist.org/observations/5781929,https://inaturalist-open-data.s3.amazonaws.com/photos/7182357/medium.jpeg,,1,0,FALSE,"Black Diamond Mines Regional Preserve , CA",37.954671,-121.866252,212,,,,Contra Costa,Q-tips,Micropus californicus,Q-tips,Plantae,56975,Asteraceae,Micropus,Micropus californicus
5782045,4/15/17,2017-04-15 20:23:00 UTC,Pacific Time (US & Canada),research,https://www.inaturalist.org/observations/5782045,https://inaturalist-open-data.s3.amazonaws.com/photos/7182602/medium.jpeg,Correct ?,1,0,FALSE,"Black Diamond Mines Regional Preserve , CA",37.954824,-121.865973,212,,,,Contra Costa,alkali desertparsley,Lomatium caruifolium,alkali desertparsley,Plantae,56213,Apiaceae,Lomatium,Lomatium caruifolium
5782101,4/15/17,2017-04-15 20:33:00 UTC,Pacific Time (US & Canada),research,https://www.inaturalist.org/observations/5782101,https://inaturalist-open-data.s3.amazonaws.com/photos/7182761/medium.jpeg,,1,0,FALSE,"Black Diamond Mines Regional Preserve , CA",37.954553,-121.866682,425,,,,Contra Costa,Pacific Poison Oak,Toxicodendron diversilobum,Pacific poison oak,Plantae,51080,Anacardiaceae,Toxicodendron,Toxicodendron diversilobum
5782156,4/15/17,2017-04-15 20:34:00 UTC,Pacific Time (US & Canada),research,https://www.inaturalist.org/observations/5782156,https://inaturalist-open-data.s3.amazonaws.com/photos/7182873/medium.jpeg,,1,0,FALSE,"Black Diamond Mines Regional Preserve , CA",37.954333,-121.866553,425,,,,Contra Costa,distant phacelia,Phacelia distans,distant phacelia,Plantae,56631,Boraginaceae,Phacelia,Phacelia distans
5782578,4/15/17,2017-04-15 20:35:00 UTC,Pacific Time (US & Canada),research,https://www.inaturalist.org/observations/5782578,https://inaturalist-open-data.s3.amazonaws.com/photos/7183493/medium.jpeg,,1,0,FALSE,"Black Diamond Mines Regional Preserve , CA",37.953605,-121.865952,212,,,,Contra Costa,sand fringepod,Thysanocarpus curvipes,sand fringepod,Plantae,58088,Brassicaceae,Thysanocarpus,Thysanocarpus curvipes
5782646,4/15/17,2017-04-15 20:35:00 UTC,Pacific Time (US & Canada),research,https://www.inaturalist.org/observations/5782646,https://inaturalist-open-data.s3.amazonaws.com/photos/7183606/medium.jpeg,,1,0,FALSE,"Black Diamond Mines Regional Preserve , CA",37.953343,-121.865973,212,,,,Contra Costa,San Francisco woodland-star,Lithophragma affine,San Francisco woodland-star,Plantae,50803,Saxifragaceae,Lithophragma,Lithophragma affine
5782720,4/15/17,2017-04-15 20:36:00 UTC,Pacific Time (US & Canada),research,https://www.inaturalist.org/observations/5782720,https://inaturalist-open-data.s3.amazonaws.com/photos/7183708/medium.jpeg,,2,0,FALSE,"Black Diamond Mines Regional Preserve , CA",37.953182,-121.866446,212,,,,Contra Costa,deerweed,Acmispon glaber,deerweed,Plantae,53134,Fabaceae,Acmispon,Acmispon glaber
5782922,4/15/17,2017-04-15 20:40:00 UTC,Pacific Time (US & Canada),research,https://www.inaturalist.org/observations/5782922,https://inaturalist-open-data.s3.amazonaws.com/photos/7184006/medium.jpeg,Only Marah found here is this species .,2,1,FALSE,"Black Diamond Mines Regional Preserve , CA",37.953665,-121.865748,212,,,,Contra Costa,California Manroot,Marah fabacea,California manroot,Plantae,205330,Cucurbitaceae,Marah,Marah fabacea
5783031,4/15/17,2017-04-15 20:41:00 UTC,Pacific Time (US & Canada),research,https://www.inaturalist.org/observations/5783031,https://inaturalist-open-data.s3.amazonaws.com/photos/7184189/medium.jpeg,,2,0,FALSE,"Black Diamond Mines Regional Preserve , CA",37.953259,-121.865684,212,,,,Contra Costa,Indian Warrior,Pedicularis densiflora,Warrior's Plume,Plantae,49645,Orobanchaceae,Pedicularis,Pedicularis densiflora
5783061,4/15/17,2017-04-15 20:46:00 UTC,Pacific Time (US & Canada),research,https://www.inaturalist.org/observations/5783061,https://inaturalist-open-data.s3.amazonaws.com/photos/7184285/medium.jpeg,,1,0,FALSE,"Black Diamond Mines Regional Preserve , CA",37.952531,-121.865201,212,,,,Contra Costa,Woolly Indian Paintbrush,Castilleja foliolosa,Woolly Indian Paintbrush,Plantae,56760,Orobanchaceae,Castilleja,Castilleja foliolosa
5783174,4/15/17,2017-04-15 20:49:00 UTC,Pacific Time (US & Canada),research,https://www.inaturalist.org/observations/5783174,https://inaturalist-open-data.s3.amazonaws.com/photos/7184392/medium.jpeg,,1,0,FALSE,"Black Diamond Mines Regional Preserve , CA",37.951541,-121.864965,212,,,,Contra Costa,Chamise,Adenostoma fasciculatum,chamise,Plantae,47146,Rosaceae,Adenostoma,Adenostoma fasciculatum
5783289,4/15/17,2017-04-15 21:02:00 UTC,Pacific Time (US & Canada),research,https://www.inaturalist.org/observations/5783289,https://inaturalist-open-data.s3.amazonaws.com/photos/7184579/medium.jpeg,,2,0,FALSE,"Black Diamond Mines Regional Preserve , CA",37.95089,-121.864697,212,,,,Contra Costa,everlasting neststraw,Stylocline gnaphaloides,everlasting neststraw,Plantae,58043,Asteraceae,Stylocline,Stylocline gnaphaloides
5783381,4/15/17,2017-04-15 21:21:00 UTC,Pacific Time (US & Canada),research,https://www.inaturalist.org/observations/5783381,https://inaturalist-open-data.s3.amazonaws.com/photos/7184796/medium.jpeg,,2,0,FALSE,"Black Diamond Mines Regional Preserve , CA",37.951115,-121.86116,26,,,,Contra Costa,checker lily,Fritillaria affinis,checker lily,Plantae,50618,Liliaceae,Fritillaria,Fritillaria affinis
5783546,4/15/17,2017-04-15 21:33:00 UTC,Pacific Time (US & Canada),research,https://www.inaturalist.org/observations/5783546,https://inaturalist-open-data.s3.amazonaws.com/photos/7185003/medium.jpeg,This plant is distinctive once you have seen it well .,1,0,FALSE,"Black Diamond Mines Regional Preserve , CA",37.950811,-121.860478,53,,,,Contra Costa,deltoid balsamroot,Balsamorhiza deltoidea,deltoid balsamroot,Plantae,70383,Asteraceae,Balsamorhiza,Balsamorhiza deltoidea
5783638,4/15/17,2017-04-15 21:51:00 UTC,Pacific Time (US & Canada),research,https://www.inaturalist.org/observations/5783638,https://inaturalist-open-data.s3.amazonaws.com/photos/7185133/medium.jpeg,The white flower here .,2,0,FALSE,"Black Diamond Mines Regional Preserve , CA",37.952015,-121.858056,212,,,,Contra Costa,Miner's Lettuce,Claytonia perfoliata,miner's lettuce,Plantae,52994,Montiaceae,Claytonia,Claytonia perfoliata
5783668,4/15/17,2017-04-15 21:58:00 UTC,Pacific Time (US & Canada),research,https://www.inaturalist.org/observations/5783668,https://inaturalist-open-data.s3.amazonaws.com/photos/7185199/medium.jpeg,,1,0,FALSE,"Black Diamond Mines Regional Preserve , CA",37.952243,-121.855524,212,,,,Contra Costa,Purple Sanicle,Sanicula bipinnatifida,Purple Sanicle,Plantae,56840,Apiaceae,Sanicula,Sanicula bipinnatifida
5783750,4/15/17,2017-04-15 22:12:00 UTC,Pacific Time (US & Canada),research,https://www.inaturalist.org/observations/5783750,https://inaturalist-open-data.s3.amazonaws.com/photos/7185299/medium.jpeg,,2,0,FALSE,"Black Diamond Mines Regional Preserve , CA",37.95402,-121.856993,212,,,,Contra Costa,Ithuriel's Spear,Triteleia laxa,Ithuriel's Spear,Plantae,51085,Asparagaceae,Triteleia,Triteleia laxa
5783827,4/15/17,2017-04-15 21:58:00 UTC,Pacific Time (US & Canada),research,https://www.inaturalist.org/observations/5783827,https://inaturalist-open-data.s3.amazonaws.com/photos/7185404/medium.jpeg,,1,0,FALSE,"Black Diamond Mines Regional Preserve , CA",37.952565,-121.854461,106,,,,Contra Costa,Common Chickweed,Stellaria media,common chickweed,Plantae,53298,Caryophyllaceae,Stellaria,Stellaria media
5783868,4/15/17,2017-04-15 22:00:00 UTC,Pacific Time (US & Canada),research,https://www.inaturalist.org/observations/5783868,https://inaturalist-open-data.s3.amazonaws.com/photos/7185452/medium.jpeg,,1,0,FALSE,"Black Diamond Mines Regional Preserve , CA",37.952531,-121.85473,106,,,,Contra Costa,Redmaids,Calandrinia menziesii,redmaids,Plantae,400267,Montiaceae,Calandrinia,Calandrinia menziesii
5783895,4/15/17,2017-04-15 22:12:00 UTC,Pacific Time (US & Canada),research,https://www.inaturalist.org/observations/5783895,https://inaturalist-open-data.s3.amazonaws.com/photos/7185532/medium.jpeg,Correct ?,1,0,FALSE,"Black Diamond Mines Regional Preserve , CA",37.954028,-121.856575,425,,,,Contra Costa,notch-leaved clover,Trifolium bifidum,Notchleaf Clover,Plantae,60196,Fabaceae,Trifolium,Trifolium bifidum
5783995,4/15/17,2017-04-15 22:23:00 UTC,Pacific Time (US & Canada),research,https://www.inaturalist.org/observations/5783995,https://inaturalist-open-data.s3.amazonaws.com/photos/7185669/medium.jpeg,,1,0,FALSE,"Black Diamond Mines Regional Preserve , CA",37.955661,-121.860545,212,,,,Contra Costa,Hedge Mustard,Sisymbrium officinale,Hedge mustard,Plantae,53266,Brassicaceae,Sisymbrium,Sisymbrium officinale
5784032,4/15/17,2017-04-15 22:16:00 UTC,Pacific Time (US & Canada),research,https://www.inaturalist.org/observations/5784032,https://inaturalist-open-data.s3.amazonaws.com/photos/7185715/medium.jpeg,,1,0,FALSE,"Black Diamond Mines Regional Preserve , CA",37.955492,-121.859375,212,,,,Contra Costa,wild oat,Avena fatua,wild oat,Plantae,52698,Poaceae,Avena,Avena fatua
5784073,4/15/17,2017-04-15 22:26:00 UTC,Pacific Time (US & Canada),research,https://www.inaturalist.org/observations/5784073,https://inaturalist-open-data.s3.amazonaws.com/photos/7185744/medium.jpeg,,1,0,FALSE,"Black Diamond Mines Regional Preserve , CA",37.957361,-121.863238,106,,,,Contra Costa,Hairy Vetch,Vicia villosa,hairy vetch,Plantae,57317,Fabaceae,Vicia,Vicia villosa
6028285,4/30/17,2017-04-30 22:27:52 UTC,Pacific Time (US & Canada),research,https://www.inaturalist.org/observations/6028285,https://static.inaturalist.org/photos/7546207/medium.jpg,,1,0,FALSE,"94531, Antioch, CA, US",37.96917551,-121.8238122,5,,,,Contra Costa,hairy vetch,Vicia villosa,hairy vetch,Plantae,57317,Fabaceae,Vicia,Vicia villosa
6028746,4/30/17,2017-04-30 22:53:44 UTC,Pacific Time (US & Canada),research,https://www.inaturalist.org/observations/6028746,https://static.inaturalist.org/photos/7546849/medium.jpg,,2,0,FALSE,"3620 Longview Rd, Antioch, CA, US",37.97252161,-121.8280459,5,,,,Contra Costa,Mallows,Malva,Mallows,Plantae,55978,Malvaceae,Malva,
6029044,4/30/17,2017-04-30 23:11:20 UTC,Pacific Time (US & Canada),research,https://www.inaturalist.org/observations/6029044,https://static.inaturalist.org/photos/7547215/medium.jpg,,1,0,FALSE,"Contra Loma Regional Park, Antioch, CA, US",37.97404665,-121.8312043,5,,,,Contra Costa,Milk Thistle,Silybum marianum,milk thistle,Plantae,52586,Asteraceae,Silybum,Silybum marianum
6029099,4/30/17,2017-04-30 23:17:37 UTC,Pacific Time (US & Canada),research,https://www.inaturalist.org/observations/6029099,https://static.inaturalist.org/photos/7547421/medium.jpg,,2,0,FALSE,"Contra Loma Regional Park, Antioch, CA, US",37.97533545,-121.8277186,5,,,,Contra Costa,hairy vetch,Vicia villosa,hairy vetch,Plantae,57317,Fabaceae,Vicia,Vicia villosa
6029141,4/30/17,2017-04-30 23:18:56 UTC,Pacific Time (US & Canada),research,https://www.inaturalist.org/observations/6029141,https://static.inaturalist.org/photos/7547493/medium.jpg,,2,0,FALSE,"Contra Loma Regional Park, Antioch, CA, US",37.9753067,-121.8281886,5,,,,Contra Costa,Toyon,Heteromeles arbutifolia,Toyon,Plantae,53405,Rosaceae,Heteromeles,Heteromeles arbutifolia
6029368,4/30/17,2017-04-30 23:29:33 UTC,Pacific Time (US & Canada),research,https://www.inaturalist.org/observations/6029368,https://static.inaturalist.org/photos/7547769/medium.jpg,,1,0,FALSE,"Contra Loma Regional Park, Antioch, CA, US",37.97612792,-121.8273871,5,,,,Contra Costa,Tule,Schoenoplectus acutus,hardstem bulrush,Plantae,59205,Cyperaceae,Schoenoplectus,Schoenoplectus acutus
6029373,4/30/17,2017-04-30 23:30:09 UTC,Pacific Time (US & Canada),research,https://www.inaturalist.org/observations/6029373,https://static.inaturalist.org/photos/7547772/medium.jpg,,1,0,FALSE,"Contra Loma Regional Park, Antioch, CA, US",37.97609204,-121.8272649,5,,,,Contra Costa,floating primrose-willow,Ludwigia peploides,floating primrose-willow,Plantae,60220,Onagraceae,Ludwigia,Ludwigia peploides
6029445,4/30/17,2017-04-30 23:34:46 UTC,Pacific Time (US & Canada),research,https://www.inaturalist.org/observations/6029445,https://static.inaturalist.org/photos/7547862/medium.jpg,,1,0,FALSE,"Contra Loma Regional Park, Antioch, CA, US",37.9767525,-121.8262923,5,,,,Contra Costa,California Poppy,Eschscholzia californica,California poppy,Plantae,48225,Papaveraceae,Eschscholzia,Eschscholzia californica
6029712,4/30/17,2017-04-30 23:49:41 UTC,Pacific Time (US & Canada),research,https://www.inaturalist.org/observations/6029712,https://static.inaturalist.org/photos/7548414/medium.jpg,,1,0,FALSE,"Contra Loma Reservoir, Antioch, CA, US",37.97639958,-121.8222513,5,,,,Contra Costa,purple owl's-clover,Castilleja exserta,purple owl's-clover,Plantae,49343,Orobanchaceae,Castilleja,Castilleja exserta
6131285,5/7/17,2017-05-07 22:37:37 UTC,Pacific Time (US & Canada),research,https://www.inaturalist.org/observations/6131285,https://static.inaturalist.org/photos/7679130/medium.jpg,,4,0,FALSE,"Black Diamond Mines Regional Preserve, Brentwood, CA, US",37.95232336,-121.8709041,5,,,,Contra Costa,Butterfly Mariposa Lily,Calochortus venustus,Butterfly Mariposa Lily,Plantae,53902,Liliaceae,Calochortus,Calochortus venustus
6183556,5/7/17,2017-05-07 17:36:00 UTC,Pacific Time (US & Canada),research,https://www.inaturalist.org/observations/6183556,https://inaturalist-open-data.s3.amazonaws.com/photos/7758477/medium.jpeg,"Black Diamond Mines EBRP
",3,0,FALSE,"Contra Costa County, CA, USA",37.951875,-121.8704444,,,,,Contra Costa,Butterfly Mariposa Lily,Calochortus venustus,Butterfly Mariposa Lily,Plantae,53902,Liliaceae,Calochortus,Calochortus venustus
6464517,6/1/17,2017-06-01 19:28:00 UTC,Pacific Time (US & Canada),research,https://www.inaturalist.org/observations/6464517,https://static.inaturalist.org/photos/8172964/medium.jpg,,1,0,FALSE,"Contra Costa County, CA, USA",37.97130837,-121.8567202,197,,,,Contra Costa,Bush Poppy,Dendromecon rigida,Bush Poppy,Plantae,58224,Papaveraceae,Dendromecon,Dendromecon rigida
6464535,6/1/17,2017-06-01 20:14:00 UTC,Pacific Time (US & Canada),research,https://www.inaturalist.org/observations/6464535,https://static.inaturalist.org/photos/8173003/medium.jpg,,1,0,FALSE,"Contra Costa County, CA, USA",37.96463611,-121.8728507,765,,,,Contra Costa,Buckbrush,Ceanothus cuneatus,Buckbrush,Plantae,49673,Rhamnaceae,Ceanothus,Ceanothus cuneatus
6464616,6/1/17,2017-06-01 20:32:00 UTC,Pacific Time (US & Canada),research,https://www.inaturalist.org/observations/6464616,https://static.inaturalist.org/photos/8173085/medium.jpg,,1,0,FALSE,"Contra Costa County, CA, USA",37.96345191,-121.8756187,187,,,,Contra Costa,sessileflower false goldenaster,Heterotheca sessiliflora,sessileflower false goldenaster,Plantae,57988,Asteraceae,Heterotheca,Heterotheca sessiliflora
6464632,6/1/17,2017-06-01 20:35:00 UTC,Pacific Time (US & Canada),research,https://www.inaturalist.org/observations/6464632,https://static.inaturalist.org/photos/8173168/medium.jpg,,1,0,FALSE,"Contra Costa County, CA, USA",37.96521129,-121.8773568,143,,,,Contra Costa,Western Hoptree,Ptelea crenulata,Western Hoptree,Plantae,50622,Rutaceae,Ptelea,Ptelea crenulata
6464636,6/1/17,2017-06-01 20:42:00 UTC,Pacific Time (US & Canada),research,https://www.inaturalist.org/observations/6464636,https://static.inaturalist.org/photos/8173174/medium.jpg,,1,0,FALSE,"Contra Costa County, CA, USA",37.96497445,-121.8773782,211,,,,Contra Costa,Turkey Mullein,Croton setiger,turkey mullein,Plantae,154156,Euphorbiaceae,Croton,Croton setiger
6464655,6/1/17,2017-06-01 20:33:00 UTC,Pacific Time (US & Canada),research,https://www.inaturalist.org/observations/6464655,https://static.inaturalist.org/photos/8173204/medium.jpg,,2,0,FALSE,"Contra Costa County, CA, USA",37.96451769,-121.8701899,684,,,,Contra Costa,Mount Diablo manzanita,Arctostaphylos auriculata,Mount Diablo manzanita,Plantae,48023,Ericaceae,Arctostaphylos,Arctostaphylos auriculata
6464660,6/1/17,2017-06-01 20:43:00 UTC,Pacific Time (US & Canada),research,https://www.inaturalist.org/observations/6464660,https://static.inaturalist.org/photos/8173210/medium.jpg,In fruit.,2,0,FALSE,"Contra Costa County, CA, USA",37.96761345,-121.8677223,443,,,,Contra Costa,Mount Diablo manzanita,Arctostaphylos auriculata,Mount Diablo manzanita,Plantae,48023,Ericaceae,Arctostaphylos,Arctostaphylos auriculata
6464669,6/1/17,2017-06-01 20:49:00 UTC,Pacific Time (US & Canada),research,https://www.inaturalist.org/observations/6464669,https://static.inaturalist.org/photos/8173229/medium.jpg,,1,0,FALSE,"Contra Costa County, CA, USA",37.96494062,-121.8685591,405,,,,Contra Costa,Bush Poppy,Dendromecon rigida,Bush Poppy,Plantae,58224,Papaveraceae,Dendromecon,Dendromecon rigida
6464672,6/1/17,2017-06-01 20:58:00 UTC,Pacific Time (US & Canada),research,https://www.inaturalist.org/observations/6464672,https://static.inaturalist.org/photos/8173237/medium.jpg,,1,0,FALSE,"Contra Costa County, CA, USA",37.96453461,-121.8712842,435,,,,Contra Costa,Chamise,Adenostoma fasciculatum,chamise,Plantae,47146,Rosaceae,Adenostoma,Adenostoma fasciculatum
6464675,6/1/17,2017-06-01 21:00:00 UTC,Pacific Time (US & Canada),research,https://www.inaturalist.org/observations/6464675,https://static.inaturalist.org/photos/8173241/medium.jpg,,1,0,FALSE,"Contra Costa County, CA, USA",37.96407785,-121.8730223,360,,,,Contra Costa,California Pitcher Sage,Lepechinia calycina,California Pitcher Sage,Plantae,57114,Lamiaceae,Lepechinia,Lepechinia calycina
6464679,6/1/17,2017-06-01 21:03:00 UTC,Pacific Time (US & Canada),research,https://www.inaturalist.org/observations/6464679,https://static.inaturalist.org/photos/8173246/medium.jpg,,2,0,FALSE,"Contra Costa County, CA, USA",37.9646192,-121.8715847,475,,,,Contra Costa,Honey-scented pincushion plant,Navarretia mellita,Honey-scented pincushion plant,Plantae,58975,Polemoniaceae,Navarretia,Navarretia mellita
6464697,6/1/17,2017-06-01 21:28:00 UTC,Pacific Time (US & Canada),research,https://www.inaturalist.org/observations/6464697,https://static.inaturalist.org/photos/8173263/medium.jpg,,1,0,FALSE,"Contra Costa County, CA, USA",37.96414552,-121.8769276,415,,,,Contra Costa,Woolly Indian Paintbrush,Castilleja foliolosa,Woolly Indian Paintbrush,Plantae,56760,Orobanchaceae,Castilleja,Castilleja foliolosa
6464701,6/1/17,2017-06-01 21:38:00 UTC,Pacific Time (US & Canada),research,https://www.inaturalist.org/observations/6464701,https://static.inaturalist.org/photos/8173271/medium.jpg,,2,0,FALSE,"Contra Costa County, CA, USA",37.96426394,-121.8770134,245,,,,Contra Costa,tree-of-heaven,Ailanthus altissima,tree-of-heaven,Plantae,57278,Simaroubaceae,Ailanthus,Ailanthus altissima
6464705,6/1/17,2017-06-01 21:34:00 UTC,Pacific Time (US & Canada),research,https://www.inaturalist.org/observations/6464705,https://static.inaturalist.org/photos/8173274/medium.jpg,,1,0,FALSE,"Contra Costa County, CA, USA",37.96468686,-121.8770134,209,,,,Contra Costa,hollyleaf redberry,Rhamnus ilicifolia,hollyleaf redberry,Plantae,58308,Rhamnaceae,Rhamnus,Rhamnus ilicifolia
6464706,6/1/17,2017-06-01 21:36:00 UTC,Pacific Time (US & Canada),research,https://www.inaturalist.org/observations/6464706,https://static.inaturalist.org/photos/8173276/medium.jpg,,1,0,FALSE,"Contra Costa County, CA, USA",37.96311356,-121.8755758,230,,,,Contra Costa,Coyote Mint,Monardella villosa,Coyote Mint,Plantae,52181,Lamiaceae,Monardella,Monardella villosa
6464709,6/1/17,2017-06-01 21:36:00 UTC,Pacific Time (US & Canada),research,https://www.inaturalist.org/observations/6464709,https://static.inaturalist.org/photos/8173280/medium.jpg,,1,0,FALSE,"Contra Costa County, CA, USA",37.96335041,-121.8747389,198,,,,Contra Costa,common woolly sunflower,Eriophyllum lanatum,common woolly sunflower,Plantae,77049,Asteraceae,Eriophyllum,Eriophyllum lanatum
6464711,6/1/17,2017-06-01 21:38:00 UTC,Pacific Time (US & Canada),research,https://www.inaturalist.org/observations/6464711,https://static.inaturalist.org/photos/8173293/medium.jpg,,1,0,FALSE,"Contra Costa County, CA, USA",37.96431469,-121.8770134,385,,,,Contra Costa,California Buckeye,Aesculus californica,California buckeye,Plantae,53348,Sapindaceae,Aesculus,Aesculus californica
6569136,6/9/17,2017-06-10 02:21:00 UTC,Hawaii,research,https://www.inaturalist.org/observations/6569136,https://inaturalist-open-data.s3.amazonaws.com/photos/8333519/medium.jpg,,3,0,FALSE,"Contra Costa County, CA, USA",37.956245,-121.823794,10,,,,Contra Costa,seaside heliotrope,Heliotropium curassavicum,alkali heliotrope,Plantae,58058,Boraginaceae,Heliotropium,Heliotropium curassavicum
7090575,7/16/17,2017-07-16 19:41:44 UTC,Pacific Time (US & Canada),research,https://www.inaturalist.org/observations/7090575,https://static.inaturalist.org/photos/9110040/medium.jpg,,2,0,FALSE,"Black Diamond Mines Regional Preserve, Brentwood, CA, US",37.94975,-121.85115,,,,,Contra Costa,chamise,Adenostoma fasciculatum,chamise,Plantae,47146,Rosaceae,Adenostoma,Adenostoma fasciculatum
7385158,8/6/17,2017-08-06 20:51:10 UTC,Pacific Time (US & Canada),research,https://www.inaturalist.org/observations/7385158,https://inaturalist-open-data.s3.amazonaws.com/photos/9584178/medium.jpeg,,1,0,FALSE,"Homestead Trail, Antioch, CA 94509, USA",37.96407915,-121.8225729,7,,,,Contra Costa,Great Valley gumweed,Grindelia camporum,Great Valley gumweed,Plantae,56953,Asteraceae,Grindelia,Grindelia camporum
7385164,8/6/17,2017-08-06 20:52:36 UTC,Pacific Time (US & Canada),research,https://www.inaturalist.org/observations/7385164,https://inaturalist-open-data.s3.amazonaws.com/photos/9584189/medium.jpeg,,2,0,FALSE,"4916-4920 Eastview Way, Antioch, CA 94531, USA",37.9640726,-121.8225007,5,,,,Contra Costa,Yellow Starthistle,Centaurea solstitialis,Yellow Star-Thistle,Plantae,52588,Asteraceae,Centaurea,Centaurea solstitialis
7385170,8/6/17,2017-08-06 20:55:24 UTC,Pacific Time (US & Canada),research,https://www.inaturalist.org/observations/7385170,https://inaturalist-open-data.s3.amazonaws.com/photos/9584204/medium.jpeg,,1,0,FALSE,"Homestead Trail, Antioch, CA 94509, USA",37.96386047,-121.8225171,8,,,,Contra Costa,Turkey Mullein,Croton setiger,turkey mullein,Plantae,154156,Euphorbiaceae,Croton,Croton setiger
7385182,8/6/17,2017-08-06 20:59:20 UTC,Pacific Time (US & Canada),research,https://www.inaturalist.org/observations/7385182,https://inaturalist-open-data.s3.amazonaws.com/photos/9584235/medium.jpeg,,2,0,FALSE,"5266 Judsonville Dr, Antioch, CA 94531, USA",37.96263611,-121.8216375,4,,,,Contra Costa,alkali mallow,Malvella leprosa,alkali mallow,Plantae,58203,Malvaceae,Malvella,Malvella leprosa
7385184,8/6/17,2017-08-06 21:04:05 UTC,Pacific Time (US & Canada),research,https://www.inaturalist.org/observations/7385184,https://inaturalist-open-data.s3.amazonaws.com/photos/9584253/medium.jpeg,,1,0,FALSE,"Contra Loma Trail, Antioch, CA 94531, USA",37.96191011,-121.8223736,8,,,,Contra Costa,Alkali Heath,Frankenia salina,Alkali Heath,Plantae,58168,Frankeniaceae,Frankenia,Frankenia salina
7385186,8/6/17,2017-08-06 21:17:36 UTC,Pacific Time (US & Canada),research,https://www.inaturalist.org/observations/7385186,https://inaturalist-open-data.s3.amazonaws.com/photos/9584269/medium.jpeg,,3,0,FALSE,"Black Diamond Mines Regional Preserve, Contra Costa County, US-CA, US",37.95972812,-121.8233575,5,,,,Contra Costa,Narrowleaf Milkweed,Asclepias fascicularis,narrowleaf milkweed,Plantae,56851,Apocynaceae,Asclepias,Asclepias fascicularis
7385194,8/6/17,2017-08-06 21:24:49 UTC,Pacific Time (US & Canada),research,https://www.inaturalist.org/observations/7385194,https://inaturalist-open-data.s3.amazonaws.com/photos/9584290/medium.jpeg,,1,0,FALSE,"Unnamed Road, Antioch, CA 94531, USA",37.95624701,-121.8237565,9,,,,Contra Costa,seaside heliotrope,Heliotropium curassavicum,alkali heliotrope,Plantae,58058,Boraginaceae,Heliotropium,Heliotropium curassavicum
7385203,8/6/17,2017-08-06 21:25:40 UTC,Pacific Time (US & Canada),research,https://www.inaturalist.org/observations/7385203,https://inaturalist-open-data.s3.amazonaws.com/photos/9584299/medium.jpeg,,1,0,FALSE,"Unnamed Road, Antioch, CA 94531, USA",37.95609804,-121.8238211,4,,,,Contra Costa,broadleaved pepperweed,Lepidium latifolium,broadleaved pepperweed,Plantae,60153,Brassicaceae,Lepidium,Lepidium latifolium
7385270,8/6/17,2017-08-06 21:54:24 UTC,Pacific Time (US & Canada),research,https://www.inaturalist.org/observations/7385270,https://inaturalist-open-data.s3.amazonaws.com/photos/9584399/medium.jpeg,,1,0,FALSE,"Unnamed Road, Antioch, CA 94531, USA",37.95281674,-121.8240862,8,,,,Contra Costa,blue oak,Quercus douglasii,blue oak,Plantae,49009,Fagaceae,Quercus,Quercus douglasii
7517248,8/6/17,2017-08-06 21:45:00 UTC,Pacific Time (US & Canada),research,https://www.inaturalist.org/observations/7517248,https://inaturalist-open-data.s3.amazonaws.com/photos/9799358/medium.jpg,,1,0,FALSE,"Black Diamond Mines Regional Park, Contra Costa County, CA, USA",37.95395833,-121.82283,,,,,Contra Costa,panicled willowherb,Epilobium brachycarpum,panicled willowherb,Plantae,52971,Onagraceae,Epilobium,Epilobium brachycarpum
7790848,8/21/17,2017-08-21 17:36:51 UTC,Pacific Time (US & Canada),research,https://www.inaturalist.org/observations/7790848,https://static.inaturalist.org/photos/10241940/medium.jpg,,1,0,FALSE,"Black Diamond Mines Regional Preserve, Brentwood, CA, US",37.95040833,-121.8673083,,,,,Contra Costa,Chamise,Adenostoma fasciculatum,chamise,Plantae,47146,Rosaceae,Adenostoma,Adenostoma fasciculatum
7855200,9/9/17,2017-09-09 22:13:03 UTC,Pacific Time (US & Canada),research,https://www.inaturalist.org/observations/7855200,https://inaturalist-open-data.s3.amazonaws.com/photos/10346236/medium.jpeg,,2,0,FALSE,"Unnamed Road, Antioch, CA 94531, USA",37.95544107,-121.8245918,8,,,,Contra Costa,Pit-gland Tarweed,Holocarpha virgata,Pit-gland Tarweed,Plantae,53099,Asteraceae,Holocarpha,Holocarpha virgata
7855222,9/9/17,2017-09-09 22:17:22 UTC,Pacific Time (US & Canada),research,https://www.inaturalist.org/observations/7855222,https://inaturalist-open-data.s3.amazonaws.com/photos/10346281/medium.jpeg,,1,0,FALSE,"Unnamed Road, Antioch, CA 94531, USA",37.95469332,-121.8254917,9,,,,Contra Costa,panicled willowherb,Epilobium brachycarpum,panicled willowherb,Plantae,52971,Onagraceae,Epilobium,Epilobium brachycarpum
7855228,9/9/17,2017-09-09 22:32:43 UTC,Pacific Time (US & Canada),research,https://www.inaturalist.org/observations/7855228,https://inaturalist-open-data.s3.amazonaws.com/photos/10346297/medium.jpeg,,3,0,FALSE,"Unnamed Road, Antioch, CA 94531, USA",37.95231229,-121.8216474,8,,,,Contra Costa,Vinegar Weed,Trichostema lanceolatum,Vinegar Weed,Plantae,54875,Lamiaceae,Trichostema,Trichostema lanceolatum
7855231,9/9/17,2017-09-09 22:33:24 UTC,Pacific Time (US & Canada),research,https://www.inaturalist.org/observations/7855231,https://inaturalist-open-data.s3.amazonaws.com/photos/10346304/medium.jpeg,,2,0,FALSE,"Unnamed Road, Antioch, CA 94531, USA",37.95215012,-121.8217602,5,,,,Contra Costa,Turkey Mullein,Croton setiger,turkey mullein,Plantae,154156,Euphorbiaceae,Croton,Croton setiger
8485956,10/20/17,2017-10-20 17:30:07 UTC,Pacific Time (US & Canada),research,https://www.inaturalist.org/observations/8485956,https://static.inaturalist.org/photos/11318028/medium.jpg,,2,0,FALSE,"Black Diamond Mines Regional Preserve, Antioch, CA, US",37.97573333,-121.861725,,,,,Contra Costa,California goldenrod,Solidago velutina californica,California goldenrod,Plantae,80217,Asteraceae,Solidago,Solidago velutina
8752599,11/10/17,2017-11-10 19:46:37 UTC,Pacific Time (US & Canada),research,https://www.inaturalist.org/observations/8752599,https://static.inaturalist.org/photos/11751163/medium.jpg,,1,0,FALSE,"Black Diamond Mines Regional Preserve, Brentwood, CA, US",37.95360436,-121.873495,5,,,,Contra Costa,California sagebrush,Artemisia californica,California sagebrush,Plantae,53357,Asteraceae,Artemisia,Artemisia californica
8761510,11/10/17,2017-11-10 19:56:18 UTC,Pacific Time (US & Canada),research,https://www.inaturalist.org/observations/8761510,https://static.inaturalist.org/photos/11766393/medium.jpg,,2,0,FALSE,"Black Diamond Mines Regional Preserve, Brentwood, CA, US",37.95267146,-121.8712094,5,,,,Contra Costa,chamise,Adenostoma fasciculatum,chamise,Plantae,47146,Rosaceae,Adenostoma,Adenostoma fasciculatum
8767284,11/11/17,2017-11-11 18:10:36 UTC,Pacific Time (US & Canada),research,https://www.inaturalist.org/observations/8767284,https://inaturalist-open-data.s3.amazonaws.com/photos/11784878/medium.jpeg,"not sure. citrus scented.  According to docent, reminder settlers of hops.",1,0,FALSE,"Black Diamond Mines Regional Preserve, Contra Costa County, US-CA, US",37.95857137,-121.8637155,7,,,,Contra Costa,Western Hoptree,Ptelea crenulata,Western Hoptree,Plantae,50622,Rutaceae,Ptelea,Ptelea crenulata
8808405,11/14/17,2017-11-14 21:44:32 UTC,Pacific Time (US & Canada),research,https://www.inaturalist.org/observations/8808405,https://static.inaturalist.org/photos/12840696/medium.jpg,,2,0,FALSE,"Black Diamond Mines Regional Preserve, Antioch, CA, US",37.960475,-121.8229217,5,,,,Contra Costa,Tamarisks,Tamarix,Tamarisks,Plantae,51305,Tamaricaceae,Tamarix,
9015117,12/1/17,2017-12-01 20:26:00 UTC,Pacific Time (US & Canada),research,https://www.inaturalist.org/observations/9015117,https://inaturalist-open-data.s3.amazonaws.com/photos/12156004/medium.jpeg,,1,0,FALSE,"Contra Loma Reservoir , CA",37.974843,-121.828187,208,,,,Contra Costa,Annual saltmarsh aster,Symphyotrichum subulatum,annual saltmarsh aster,Plantae,64208,Asteraceae,Symphyotrichum,Symphyotrichum subulatum
9025577,12/1/17,2017-12-01 20:11:00 UTC,Pacific Time (US & Canada),research,https://www.inaturalist.org/observations/9025577,https://static.inaturalist.org/photos/12173251/medium.jpg,,2,0,FALSE,"Antioch, CA, USA",37.97492094,-121.8223286,61,,,,Contra Costa,Fremont cottonwood,Populus fremontii,Fremont Cottonwood,Plantae,52120,Salicaceae,Populus,Populus fremontii
9025934,12/1/17,2017-12-01 21:07:00 UTC,Pacific Time (US & Canada),research,https://www.inaturalist.org/observations/9025934,https://static.inaturalist.org/photos/12173925/medium.jpg,,1,0,FALSE,"Antioch, CA, USA",37.97671388,-121.8273497,61,,,,Contra Costa,Turkey Mullein,Croton setiger,turkey mullein,Plantae,154156,Euphorbiaceae,Croton,Croton setiger
9025998,12/1/17,2017-12-01 21:48:00 UTC,Pacific Time (US & Canada),research,https://www.inaturalist.org/observations/9025998,https://static.inaturalist.org/photos/12174061/medium.jpg,,1,0,FALSE,"Antioch, CA, USA",37.97329712,-121.8219423,61,,,,Contra Costa,mule fat,Baccharis salicifolia,mule fat,Plantae,57913,Asteraceae,Baccharis,Baccharis salicifolia
9383310,1/6/18,2018-01-06 17:55:56 UTC,Pacific Time (US & Canada),research,https://www.inaturalist.org/observations/9383310,https://inaturalist-open-data.s3.amazonaws.com/photos/12746101/medium.jpeg,,2,0,FALSE,"Knob Cone Point Rd, Danville, CA 94506, USA",37.97189642,-121.8201616,9,,,,Contra Costa,Mount Diablo manzanita,Arctostaphylos auriculata,Mount Diablo manzanita,Plantae,48023,Ericaceae,Arctostaphylos,Arctostaphylos auriculata
9572565,1/20/18,2018-01-20 22:52:58 UTC,Pacific Time (US & Canada),research,https://www.inaturalist.org/observations/9572565,https://static.inaturalist.org/photos/13068156/medium.jpeg,,2,0,FALSE,"Pittsburg, CA 94565, USA",37.95388794,-121.8669434,,,gps,,Contra Costa,Indian Warrior,Pedicularis densiflora,Warrior's Plume,Plantae,49645,Orobanchaceae,Pedicularis,Pedicularis densiflora
9637926,1/27/18,2018-01-27 23:33:47 UTC,Pacific Time (US & Canada),research,https://www.inaturalist.org/observations/9637926,https://static.inaturalist.org/photos/13161189/medium.jpg,,3,0,FALSE,"Black Diamond Mines Regional Preserve, Brentwood, CA, US",37.9536304,-121.8655721,22,,,,Contra Costa,Indian Warrior,Pedicularis densiflora,Warrior's Plume,Plantae,49645,Orobanchaceae,Pedicularis,Pedicularis densiflora
9648036,1/28/18,2018-01-28 20:05:59 UTC,Pacific Time (US & Canada),research,https://www.inaturalist.org/observations/9648036,https://inaturalist-open-data.s3.amazonaws.com/photos/13178427/medium.jpg,,3,0,FALSE,"Black Diamond Mines Regional Preserve, Brentwood, CA, US",37.95052,-121.8611617,10,,,,Contra Costa,Indian Warrior,Pedicularis densiflora,Warrior's Plume,Plantae,49645,Orobanchaceae,Pedicularis,Pedicularis densiflora
10129784,3/7/18,2018-03-07 20:30:57 UTC,Pacific Time (US & Canada),research,https://www.inaturalist.org/observations/10129784,https://static.inaturalist.org/photos/13970354/medium.jpg,,2,0,FALSE,"Black Diamond Mines Regional Preserve, Contra Costa County, US-CA, US",37.95199564,-121.8649995,6,,,,Contra Costa,Indian Warrior,Pedicularis densiflora,Warrior's Plume,Plantae,49645,Orobanchaceae,Pedicularis,Pedicularis densiflora
10133189,3/7/18,2018-03-07 21:15:00 UTC,Pacific Time (US & Canada),research,https://www.inaturalist.org/observations/10133189,https://static.inaturalist.org/photos/13976520/medium.jpg,,1,0,FALSE,"Black Diamond Mines Regional Preserve, Contra Costa County, US-CA, US",37.95199927,-121.8598932,5,,,,Contra Costa,glue-seed,Blennosperma nanum,glue-seed,Plantae,57914,Asteraceae,Blennosperma,Blennosperma nanum
10133191,3/7/18,2018-03-07 21:11:08 UTC,Pacific Time (US & Canada),research,https://www.inaturalist.org/observations/10133191,https://static.inaturalist.org/photos/13976532/medium.jpg,,1,0,FALSE,"Black Diamond Mines Regional Preserve, Contra Costa County, US-CA, US",37.95166093,-121.8598389,5,,,,Contra Costa,miner's lettuce,Claytonia perfoliata,miner's lettuce,Plantae,52994,Montiaceae,Claytonia,Claytonia perfoliata
10133192,3/7/18,2018-03-07 21:09:37 UTC,Pacific Time (US & Canada),research,https://www.inaturalist.org/observations/10133192,https://static.inaturalist.org/photos/13976534/medium.jpg,,1,0,FALSE,"Black Diamond Mines Regional Preserve, Contra Costa County, US-CA, US",37.95159635,-121.8598533,5,,,,Contra Costa,Henderson's shooting star,Primula hendersonii,Henderson's shooting star,Plantae,487175,Primulaceae,Primula,Primula hendersonii
10133196,3/7/18,2018-03-07 21:02:43 UTC,Pacific Time (US & Canada),research,https://www.inaturalist.org/observations/10133196,https://static.inaturalist.org/photos/13976543/medium.jpg,,2,0,FALSE,"Black Diamond Mines Regional Preserve, Clayton, CA, US",37.95064438,-121.8609834,5,,,,Contra Costa,Woolly Indian Paintbrush,Castilleja foliolosa,Woolly Indian Paintbrush,Plantae,56760,Orobanchaceae,Castilleja,Castilleja foliolosa
10133203,3/7/18,2018-03-07 20:33:29 UTC,Pacific Time (US & Canada),research,https://www.inaturalist.org/observations/10133203,https://static.inaturalist.org/photos/13976560/medium.jpg,,2,0,FALSE,"Black Diamond Mines Regional Preserve, Contra Costa County, US-CA, US",37.95190703,-121.8649344,10,,,,Contra Costa,Indian Warrior,Pedicularis densiflora,Warrior's Plume,Plantae,49645,Orobanchaceae,Pedicularis,Pedicularis densiflora
10158121,3/7/18,2018-03-07 18:39:00 UTC,Pacific Time (US & Canada),research,https://www.inaturalist.org/observations/10158121,https://static.inaturalist.org/photos/14018893/medium.jpg,,2,0,FALSE,"Contra Costa County, CA, USA",37.97020883,-121.8638442,197,,,,Contra Costa,Johnnytuck,Triphysaria eriantha,Johnnytuck,Plantae,50792,Orobanchaceae,Triphysaria,Triphysaria eriantha
10158127,3/7/18,2018-03-07 18:39:00 UTC,Pacific Time (US & Canada),research,https://www.inaturalist.org/observations/10158127,https://static.inaturalist.org/photos/14018903/medium.jpg,,1,0,FALSE,"Contra Costa County, CA, USA",37.97120687,-121.8632648,197,,,,Contra Costa,Miniature Lupine,Lupinus bicolor,Miniature Lupine,Plantae,50614,Fabaceae,Lupinus,Lupinus bicolor
10158176,3/7/18,2018-03-07 18:45:00 UTC,Pacific Time (US & Canada),research,https://www.inaturalist.org/observations/10158176,https://static.inaturalist.org/photos/14018983/medium.jpg,,1,0,FALSE,"Contra Costa County, CA, USA",37.97281384,-121.8632004,197,,,,Contra Costa,small-flowered fiddleneck,Amsinckia menziesii,Common Fiddleneck,Plantae,55436,Boraginaceae,Amsinckia,Amsinckia menziesii
10158238,3/7/18,2018-03-07 18:58:00 UTC,Pacific Time (US & Canada),research,https://www.inaturalist.org/observations/10158238,https://static.inaturalist.org/photos/14019013/medium.jpg,On walnut.,1,0,FALSE,"5175 Somersville Rd, Antioch, CA 94509, USA",37.97220488,-121.8635867,197,,,,Contra Costa,sycamore mistletoe,Phoradendron macrophyllum,broadleaf mistletoe,Plantae,166732,Santalaceae,Phoradendron,Phoradendron macrophyllum
10162336,3/9/18,2018-03-09 23:36:35 UTC,Pacific Time (US & Canada),research,https://www.inaturalist.org/observations/10162336,https://static.inaturalist.org/photos/14025968/medium.jpg,,2,0,FALSE,"Black Diamond Mines Regional Preserve, Antioch, CA, US",37.96436742,-121.8548369,911,,,,Contra Costa,Redmaids,Calandrinia menziesii,redmaids,Plantae,400267,Montiaceae,Calandrinia,Calandrinia menziesii
10162400,3/9/18,2018-03-09 23:51:27 UTC,Pacific Time (US & Canada),research,https://www.inaturalist.org/observations/10162400,https://static.inaturalist.org/photos/14026030/medium.jpg,,1,0,FALSE,"Black Diamond Mines Regional Preserve, Antioch, CA, US",37.96130849,-121.8565995,625,,,,Contra Costa,Padre's Shooting Star,Primula clevelandii,Padre's Shooting Star,Plantae,486971,Primulaceae,Primula,Primula clevelandii
10162419,3/9/18,2018-03-09 23:59:34 UTC,Pacific Time (US & Canada),research,https://www.inaturalist.org/observations/10162419,https://static.inaturalist.org/photos/14032197/medium.jpg,,1,0,FALSE,"Black Diamond Mines Regional Preserve, Antioch, CA, US",37.96385555,-121.8557381,1178,,,,Contra Costa,Great Valley phacelia,Phacelia ciliata,Great Valley phacelia,Plantae,58180,Boraginaceae,Phacelia,Phacelia ciliata
10177491,3/4/18,2018-03-04 22:43:17 UTC,Pacific Time (US & Canada),research,https://www.inaturalist.org/observations/10177491,https://inaturalist-open-data.s3.amazonaws.com/photos/14052323/medium.jpeg,,1,0,FALSE,"Ridge Trail, Pittsburg, CA 94565, USA",37.95055389,-121.8608322,,,gps,,Contra Costa,Woolly Indian Paintbrush,Castilleja foliolosa,Woolly Indian Paintbrush,Plantae,56760,Orobanchaceae,Castilleja,Castilleja foliolosa
10177495,3/4/18,2018-03-04 22:37:20 UTC,Pacific Time (US & Canada),research,https://www.inaturalist.org/observations/10177495,https://inaturalist-open-data.s3.amazonaws.com/photos/14052333/medium.jpeg,,1,0,FALSE,"Ridge Trail, Pittsburg, CA 94565, USA",37.95166779,-121.859726,,,gps,,Contra Costa,miner's lettuce,Claytonia perfoliata,miner's lettuce,Plantae,52994,Montiaceae,Claytonia,Claytonia perfoliata
