id,observed_on,time_observed_at,time_zone,quality_grade,url,image_url,description,num_identification_agreements,num_identification_disagreements,captive_cultivated,place_guess,latitude,longitude,positional_accuracy,geoprivacy,place_town_name,place_county_name,species_guess,scientific_name,common_name,iconic_taxon_name,taxon_id,taxon_family_name,taxon_genus_name,taxon_species_name
2685967,2/15/16,2016-02-15 23:35:57 +0100,Pacific Time (US & Canada),research,http://www.inaturalist.org/observations/2685967,https://inaturalist-open-data.s3.amazonaws.com/photos/3021672/medium.jpg,,6,0,FALSE,"Las Trampas Regional Wilderness, Contra Costa County, CA, USA",37.81601443,-122.0448524,19,,,Contra Costa,California Dutchman's Pipe,Aristolochia californica,California Dutchman's Pipe,Plantae,55190,Aristolochiaceae,Aristolochia,Aristolochia californica
2685968,2/15/16,2016-02-15 23:54:21 +0100,Pacific Time (US & Canada),research,http://www.inaturalist.org/observations/2685968,https://inaturalist-open-data.s3.amazonaws.com/photos/3019841/medium.jpeg,,2,0,FALSE,"San Ramon, CA 94583",37.8085646,-122.0457845,36,,,Contra Costa,Buckbrush,Ceanothus cuneatus,Buckbrush,Plantae,49673,Rhamnaceae,Ceanothus,Ceanothus cuneatus
2686754,2/15/16,2016-02-16 01:00:17 +0100,Pacific Time (US & Canada),research,http://www.inaturalist.org/observations/2686754,https://inaturalist-open-data.s3.amazonaws.com/photos/3020750/medium.jpeg,,2,0,FALSE,"Las Trampas Regional Wilderness, Contra Costa County, CA, USA",37.82390865,-122.0516347,4,,,Contra Costa,Curnow's Curse,Calandrinia menziesii,redmaids,Plantae,400267,Montiaceae,Calandrinia,Calandrinia menziesii
2686756,2/15/16,2016-02-16 01:14:35 +0100,Pacific Time (US & Canada),research,http://www.inaturalist.org/observations/2686756,https://inaturalist-open-data.s3.amazonaws.com/photos/3020778/medium.jpeg,,3,0,FALSE,"Las Trampas Regional Wilderness, Contra Costa County, CA, USA",37.82540513,-122.0549757,3,,,Contra Costa,Indian Warrior,Pedicularis densiflora,Warrior's Plume,Plantae,49645,Orobanchaceae,Pedicularis,Pedicularis densiflora
2686757,2/15/16,2016-02-16 01:18:08 +0100,Pacific Time (US & Canada),research,http://www.inaturalist.org/observations/2686757,https://inaturalist-open-data.s3.amazonaws.com/photos/3020833/medium.jpeg,,4,0,FALSE,"Las Trampas Regional Wilderness, Contra Costa County, CA, USA",37.82535112,-122.055374,5,,,Contra Costa,milkmaids,Cardamine californica,milkmaids,Plantae,49651,Brassicaceae,Cardamine,Cardamine californica
2686758,2/15/16,2016-02-16 01:19:32 +0100,Pacific Time (US & Canada),research,http://www.inaturalist.org/observations/2686758,https://inaturalist-open-data.s3.amazonaws.com/photos/3020920/medium.jpeg,,2,0,FALSE,"Las Trampas Regional Wilderness, Contra Costa County, CA, USA",37.82547098,-122.0560517,7,,,Contra Costa,California saxifrage,Micranthes californica,California Saxifrage,Plantae,78023,Saxifragaceae,Micranthes,Micranthes californica
2686831,2/15/16,2016-02-15 23:50:21 +0100,Pacific Time (US & Canada),research,http://www.inaturalist.org/observations/2686831,https://inaturalist-open-data.s3.amazonaws.com/photos/3020856/medium.jpg,,1,0,FALSE,"Las Trampas Regional Wilderness, Contra Costa, California, United States",37.81692,-122.04167,,,,Contra Costa,California manroot,Marah fabacea,California manroot,Plantae,205330,Cucurbitaceae,Marah,Marah fabacea
2686832,2/15/16,2016-02-15 23:57:05 +0100,Pacific Time (US & Canada),research,http://www.inaturalist.org/observations/2686832,https://inaturalist-open-data.s3.amazonaws.com/photos/3020857/medium.jpg,,2,0,FALSE,"Las Trampas Regional Wilderness, Contra Costa, California, United States",37.81713667,-122.0414617,,,,Contra Costa,Birchleaf Mountain Mahogany,Cercocarpus betuloides,Birchleaf Mountain Mahogany,Plantae,63977,Rosaceae,Cercocarpus,Cercocarpus betuloides
2686836,2/15/16,2016-02-16 01:04:32 +0100,Pacific Time (US & Canada),research,http://www.inaturalist.org/observations/2686836,https://inaturalist-open-data.s3.amazonaws.com/photos/3020864/medium.jpg,,2,0,FALSE,"Las Trampas Regional Wilderness, Contra Costa, California, United States",37.82461833,-122.0516983,,,,Contra Costa,chaparral currant,Ribes malvaceum,Chaparral Currant,Plantae,54942,Grossulariaceae,Ribes,Ribes malvaceum
2686882,2/15/16,2016-02-16 00:36:59 +0100,Pacific Time (US & Canada),research,http://www.inaturalist.org/observations/2686882,https://inaturalist-open-data.s3.amazonaws.com/photos/3020931/medium.jpg,,2,0,FALSE,"Las Trampas Regional Wilderness, Contra Costa, California, United States",37.82113667,-122.0448367,,,,Contra Costa,hillside gooseberry,Ribes californicum,hillside gooseberry,Plantae,47129,Grossulariaceae,Ribes,Ribes californicum
2686886,2/15/16,2016-02-16 01:14:59 +0100,Pacific Time (US & Canada),research,http://www.inaturalist.org/observations/2686886,https://inaturalist-open-data.s3.amazonaws.com/photos/3020935/medium.jpg,,4,0,FALSE,"Las Trampas Regional Wilderness, Contra Costa, California, United States",37.825385,-122.0550367,,,,Contra Costa,Indian Warrior,Pedicularis densiflora,Warrior's Plume,Plantae,49645,Orobanchaceae,Pedicularis,Pedicularis densiflora
2686900,2/15/16,2016-02-15 23:28:46 +0100,Pacific Time (US & Canada),research,http://www.inaturalist.org/observations/2686900,https://inaturalist-open-data.s3.amazonaws.com/photos/3020964/medium.jpg,,1,0,FALSE,"Las Trampas Regional Wilderness, Contra Costa, California, United States",37.81589333,-122.0449567,,,,Contra Costa,small baby blue eyes,Nemophila heterophylla,White nemophila,Plantae,53158,Boraginaceae,Nemophila,Nemophila heterophylla
2686901,2/15/16,2016-02-16 01:00:31 +0100,Pacific Time (US & Canada),research,http://www.inaturalist.org/observations/2686901,https://inaturalist-open-data.s3.amazonaws.com/photos/3020965/medium.jpg,,4,0,FALSE,"Las Trampas Regional Wilderness, Contra Costa, California, United States",37.823875,-122.05159,,,,Contra Costa,redmaids,Calandrinia menziesii,redmaids,Plantae,400267,Montiaceae,Calandrinia,Calandrinia menziesii
2686904,2/15/16,2016-02-16 00:49:13 +0100,Pacific Time (US & Canada),research,http://www.inaturalist.org/observations/2686904,https://inaturalist-open-data.s3.amazonaws.com/photos/3020969/medium.jpg,,2,0,FALSE,"Las Trampas Regional Wilderness, Contra Costa, California, United States",37.82094,-122.0476983,,,,Contra Costa,California scrub oak,Quercus berberidifolia,California scrub oak,Plantae,57082,Fagaceae,Quercus,Quercus berberidifolia
2687332,2/15/16,2016-02-15 23:56:20 +0100,Pacific Time (US & Canada),research,http://www.inaturalist.org/observations/2687332,https://inaturalist-open-data.s3.amazonaws.com/photos/3021665/medium.jpg,What it looks like right before the flowers open.,1,0,FALSE,"Las Trampas Regional Wilderness, Contra Costa, California, United States",37.81712333,-122.0415833,,,,Contra Costa,Cercocarpus betuloides,Cercocarpus betuloides,Birchleaf Mountain Mahogany,Plantae,63977,Rosaceae,Cercocarpus,Cercocarpus betuloides
16433081,3/23/16,,Pacific Time (US & Canada),research,https://www.inaturalist.org/observations/16433081,https://inaturalist-open-data.s3.amazonaws.com/photos/24722667/medium.jpg,,1,0,FALSE,"Alamo, CA, USA",37.82113262,-122.0459256,31,,,Contra Costa,Purple Sanicle,Sanicula bipinnatifida,Purple Sanicle,Plantae,56840,Apiaceae,Sanicula,Sanicula bipinnatifida
2857988,3/31/16,2016-03-31 20:14:55 +0200,Pacific Time (US & Canada),research,http://www.inaturalist.org/observations/2857988,https://inaturalist-open-data.s3.amazonaws.com/photos/3261040/medium.jpg,Lupine,2,0,FALSE,"Jeep Trl, Danville, CA, US",37.81730892,-122.0330261,5,,,Contra Costa,Silver Lupine,Lupinus albifrons,Silver Lupine,Plantae,51691,Fabaceae,Lupinus,Lupinus albifrons
3015532,4/23/16,2016-04-23 23:40:37 +0200,Pacific Time (US & Canada),research,http://www.inaturalist.org/observations/3015532,https://inaturalist-open-data.s3.amazonaws.com/photos/3471312/medium.jpg,,1,0,FALSE,"94507, Alamo, CA, US",37.8282597,-122.038814,50,,,Contra Costa,California Bee Plant,Scrophularia californica,California beeplant,Plantae,50812,Scrophulariaceae,Scrophularia,Scrophularia californica
3017503,4/23/16,2016-04-23 19:32:09 +0200,Pacific Time (US & Canada),research,http://www.inaturalist.org/observations/3017503,https://inaturalist-open-data.s3.amazonaws.com/photos/3471363/medium.jpg,,1,0,FALSE,"379 South Ave, Alamo, CA, US",37.83824135,-122.0367841,343,,,Contra Costa,Common Catchfly,Silene gallica,Small-flowered Catchfly,Plantae,53212,Caryophyllaceae,Silene,Silene gallica
3017537,4/23/16,2016-04-23 21:15:43 +0200,Pacific Time (US & Canada),research,http://www.inaturalist.org/observations/3017537,https://inaturalist-open-data.s3.amazonaws.com/photos/3471419/medium.jpg,,3,0,FALSE,"94507, Alamo, CA, US",37.83679562,-122.0392992,377,,,Contra Costa,Calochortus albus,Calochortus albus,White Globe Lily,Plantae,51315,Liliaceae,Calochortus,Calochortus albus
3017556,4/23/16,2016-04-23 22:40:48 +0200,Pacific Time (US & Canada),research,http://www.inaturalist.org/observations/3017556,https://inaturalist-open-data.s3.amazonaws.com/photos/3471451/medium.jpg,,1,0,FALSE,"94507, Alamo, CA, US",37.83345149,-122.0433824,392,,,Contra Costa,Mediterranean lineseed,Bellardia trixago,Mediterranean lineseed,Plantae,51286,Orobanchaceae,Bellardia,Bellardia trixago
3017558,4/23/16,2016-04-23 23:05:14 +0200,Pacific Time (US & Canada),research,http://www.inaturalist.org/observations/3017558,https://inaturalist-open-data.s3.amazonaws.com/photos/3471453/medium.jpg,,1,0,FALSE,"94507, Alamo, CA, US",37.83093561,-122.0400507,377,,,Contra Costa,hillside woodland star,Lithophragma heterophyllum,hillside woodland star,Plantae,53124,Saxifragaceae,Lithophragma,Lithophragma heterophyllum
3177645,5/14/16,2016-05-15 00:07:52 +0200,Pacific Time (US & Canada),research,http://www.inaturalist.org/observations/3177645,https://inaturalist-open-data.s3.amazonaws.com/photos/3675106/medium.jpg,,1,0,FALSE,"Las Trampas Regional Wilderness, Contra Costa County, US-CA, US",37.82281851,-122.0579883,5,,,Contra Costa,Dwarf Nettle,Urtica urens,Dwarf Nettle,Plantae,53315,Urticaceae,Urtica,Urtica urens
3177658,5/14/16,2016-05-15 00:22:19 +0200,Pacific Time (US & Canada),research,http://www.inaturalist.org/observations/3177658,https://inaturalist-open-data.s3.amazonaws.com/photos/3675115/medium.jpg,,2,0,FALSE,"Las Trampas Regional Wilderness, Contra Costa County, US-CA, US",37.8242255,-122.0597756,5,,,Contra Costa,common yarrow,Achillea millefolium,common yarrow,Plantae,52821,Asteraceae,Achillea,Achillea millefolium
3177662,5/14/16,2016-05-15 00:27:55 +0200,Pacific Time (US & Canada),research,http://www.inaturalist.org/observations/3177662,https://inaturalist-open-data.s3.amazonaws.com/photos/3675121/medium.jpg,,1,0,FALSE,"Las Trampas Regional Wilderness, Contra Costa County, US-CA, US",37.82487878,-122.0585112,5,,,Contra Costa,Winecup Clarkia,Clarkia purpurea,Winecup Clarkia,Plantae,51087,Onagraceae,Clarkia,Clarkia purpurea
3177665,5/14/16,2016-05-15 00:29:15 +0200,Pacific Time (US & Canada),research,http://www.inaturalist.org/observations/3177665,https://inaturalist-open-data.s3.amazonaws.com/photos/3675130/medium.jpg,,2,0,FALSE,"Las Trampas Regional Wilderness, Contra Costa County, US-CA, US",37.82489215,-122.0582391,5,,,Contra Costa,Narrowleaf Cottonrose,Logfia gallica,narrowleaf cottonrose,Plantae,56949,Asteraceae,Logfia,Logfia gallica
3177671,5/14/16,2016-05-15 00:30:10 +0200,Pacific Time (US & Canada),research,http://www.inaturalist.org/observations/3177671,https://inaturalist-open-data.s3.amazonaws.com/photos/3675136/medium.jpg,,1,0,FALSE,"Las Trampas Regional Wilderness, Contra Costa County, US-CA, US",37.82494701,-122.0581991,5,,,Contra Costa,slender woolly-marbles,Psilocarphus tenellus,slender woolly-marbles,Plantae,53188,Asteraceae,Psilocarphus,Psilocarphus tenellus
3177674,5/14/16,2016-05-15 00:38:19 +0200,Pacific Time (US & Canada),research,http://www.inaturalist.org/observations/3177674,https://inaturalist-open-data.s3.amazonaws.com/photos/3675144/medium.jpg,,3,0,FALSE,"Las Trampas Regional Wilderness, Contra Costa County, US-CA, US",37.82613598,-122.057618,5,,,Contra Costa,Pimpernel,Lysimachia arvensis,scarlet pimpernel,Plantae,791928,Primulaceae,Lysimachia,Lysimachia arvensis
3177681,5/14/16,2016-05-15 00:46:16 +0200,Pacific Time (US & Canada),research,http://www.inaturalist.org/observations/3177681,https://inaturalist-open-data.s3.amazonaws.com/photos/3675150/medium.jpg,,1,0,FALSE,"Las Trampas Regional Wilderness, Contra Costa County, US-CA, US",37.82750261,-122.0587319,5,,,Contra Costa,tomcat clover,Trifolium willdenovii,tomcat clover,Plantae,57081,Fabaceae,Trifolium,Trifolium willdenovii
3177690,5/14/16,2016-05-15 00:52:30 +0200,Pacific Time (US & Canada),research,http://www.inaturalist.org/observations/3177690,https://inaturalist-open-data.s3.amazonaws.com/photos/3675157/medium.jpg,Abundant along the ridge trail north of its intersection with the Bollinger Canyon Loop Trail.,1,0,FALSE,"Las Trampas Regional Wilderness, Contra Costa County, US-CA, US",37.82833657,-122.0600034,5,,,Contra Costa,Hairy Rupturewort,Herniaria hirsuta,hairy rupturewort,Plantae,58102,Caryophyllaceae,Herniaria,Herniaria hirsuta
3177706,5/14/16,2016-05-15 00:56:15 +0200,Pacific Time (US & Canada),research,http://www.inaturalist.org/observations/3177706,https://inaturalist-open-data.s3.amazonaws.com/photos/3675185/medium.jpg,,1,0,FALSE,"Las Trampas Regional Wilderness, Contra Costa County, US-CA, US",37.82850626,-122.0602177,5,,,Contra Costa,Coast silk tassel,Garrya elliptica,Coast silk tassel,Plantae,53399,Garryaceae,Garrya,Garrya elliptica
3177716,5/14/16,2016-05-15 00:56:29 +0200,Pacific Time (US & Canada),research,http://www.inaturalist.org/observations/3177716,https://inaturalist-open-data.s3.amazonaws.com/photos/3675191/medium.jpg,,1,0,FALSE,"Las Trampas Regional Wilderness, Contra Costa County, US-CA, US",37.82854205,-122.0602669,5,,,Contra Costa,Toyon,Heteromeles arbutifolia,Toyon,Plantae,53405,Rosaceae,Heteromeles,Heteromeles arbutifolia
3177722,5/14/16,2016-05-15 01:03:39 +0200,Pacific Time (US & Canada),research,http://www.inaturalist.org/observations/3177722,https://inaturalist-open-data.s3.amazonaws.com/photos/3675199/medium.jpg,,2,0,FALSE,"Las Trampas Regional Wilderness, Contra Costa County, US-CA, US",37.82928674,-122.0611747,5,,,Contra Costa,California yerba santa,Eriodictyon californicum,California yerba santa,Plantae,57095,Boraginaceae,Eriodictyon,Eriodictyon californicum
3177907,5/14/16,2016-05-15 01:57:53 +0200,Pacific Time (US & Canada),research,http://www.inaturalist.org/observations/3177907,https://inaturalist-open-data.s3.amazonaws.com/photos/3675426/medium.jpg,"At glorious, peak bloom.",1,0,FALSE,"Las Trampas Regional Wilderness, Contra Costa County, US-CA, US",37.82657079,-122.0575136,5,,,Contra Costa,Chamise,Adenostoma fasciculatum,chamise,Plantae,47146,Rosaceae,Adenostoma,Adenostoma fasciculatum
3177917,5/14/16,2016-05-15 02:00:16 +0200,Pacific Time (US & Canada),research,http://www.inaturalist.org/observations/3177917,https://inaturalist-open-data.s3.amazonaws.com/photos/3675445/medium.jpg,Horrible lactuca-ish smell.,0,0,FALSE,"Las Trampas Regional Wilderness, Contra Costa County, US-CA, US",37.82603255,-122.0569617,5,,,Contra Costa,California chicory,Rafinesquia californica,California chicory,Plantae,53193,Asteraceae,Rafinesquia,Rafinesquia californica
3177931,5/14/16,2016-05-15 02:02:15 +0200,Pacific Time (US & Canada),research,http://www.inaturalist.org/observations/3177931,https://inaturalist-open-data.s3.amazonaws.com/photos/3675460/medium.jpg,,1,0,FALSE,"Las Trampas Regional Wilderness, Contra Costa County, US-CA, US",37.82559854,-122.0563697,5,,,Contra Costa,Purple Chinese Houses,Collinsia heterophylla,Purple Chinese Houses,Plantae,47325,Plantaginaceae,Collinsia,Collinsia heterophylla
3177948,5/14/16,2016-05-15 02:04:35 +0200,Pacific Time (US & Canada),research,http://www.inaturalist.org/observations/3177948,https://inaturalist-open-data.s3.amazonaws.com/photos/3675479/medium.jpg,,1,0,FALSE,"Las Trampas Regional Wilderness, Contra Costa County, US-CA, US",37.82564225,-122.0560398,5,,,Contra Costa,golden yarrow,Eriophyllum confertiflorum,Golden Yarrow,Plantae,53395,Asteraceae,Eriophyllum,Eriophyllum confertiflorum
3177966,5/14/16,2016-05-15 02:07:00 +0200,Pacific Time (US & Canada),research,http://www.inaturalist.org/observations/3177966,https://inaturalist-open-data.s3.amazonaws.com/photos/3675500/medium.jpg,,1,0,FALSE,"Las Trampas Regional Wilderness, Contra Costa County, US-CA, US",37.82541049,-122.0557063,5,,,Contra Costa,Miner's Lettuce,Claytonia perfoliata,miner's lettuce,Plantae,52994,Montiaceae,Claytonia,Claytonia perfoliata
3177973,5/14/16,2016-05-15 02:07:30 +0200,Pacific Time (US & Canada),research,http://www.inaturalist.org/observations/3177973,https://inaturalist-open-data.s3.amazonaws.com/photos/3675503/medium.jpg,,3,0,FALSE,"Las Trampas Regional Wilderness, Contra Costa County, US-CA, US",37.82541275,-122.0556837,5,,,Contra Costa,Calochortus albus,Calochortus albus,White Globe Lily,Plantae,51315,Liliaceae,Calochortus,Calochortus albus
3177982,5/14/16,2016-05-15 02:11:49 +0200,Pacific Time (US & Canada),research,http://www.inaturalist.org/observations/3177982,https://inaturalist-open-data.s3.amazonaws.com/photos/3675521/medium.jpg,,1,0,FALSE,"Las Trampas Regional Wilderness, Contra Costa County, US-CA, US",37.82542201,-122.0550423,10,,,Contra Costa,Pacific pea,Lathyrus vestitus,Pacific pea,Plantae,50320,Fabaceae,Lathyrus,Lathyrus vestitus
3177985,5/14/16,2016-05-15 02:14:44 +0200,Pacific Time (US & Canada),research,http://www.inaturalist.org/observations/3177985,https://inaturalist-open-data.s3.amazonaws.com/photos/3675527/medium.jpg,,1,0,FALSE,"Las Trampas Regional Wilderness, Contra Costa County, US-CA, US",37.82515413,-122.0531069,5,,,Contra Costa,hillside woodland star,Lithophragma heterophyllum,hillside woodland star,Plantae,53124,Saxifragaceae,Lithophragma,Lithophragma heterophyllum
3177995,5/14/16,2016-05-15 02:21:18 +0200,Pacific Time (US & Canada),research,http://www.inaturalist.org/observations/3177995,https://inaturalist-open-data.s3.amazonaws.com/photos/3675545/medium.jpg,,2,0,FALSE,"Las Trampas Regional Wilderness, Contra Costa County, US-CA, US",37.82422881,-122.0517472,5,,,Contra Costa,Ithuriel's Spear,Triteleia laxa,Ithuriel's Spear,Plantae,51085,Asparagaceae,Triteleia,Triteleia laxa
3178003,5/14/16,2016-05-15 02:21:31 +0200,Pacific Time (US & Canada),research,http://www.inaturalist.org/observations/3178003,https://inaturalist-open-data.s3.amazonaws.com/photos/3675551/medium.jpg,,2,0,FALSE,"Las Trampas Regional Wilderness, Contra Costa County, US-CA, US",37.82422881,-122.0517472,5,,,Contra Costa,Blow Wives,Achyrachaena mollis,Blow Wives,Plantae,56852,Asteraceae,Achyrachaena,Achyrachaena mollis
3178008,5/14/16,2016-05-15 02:26:27 +0200,Pacific Time (US & Canada),research,http://www.inaturalist.org/observations/3178008,https://inaturalist-open-data.s3.amazonaws.com/photos/3675558/medium.jpg,,1,0,FALSE,"Las Trampas Regional Wilderness, Contra Costa County, US-CA, US",37.82271516,-122.0502179,5,,,Contra Costa,Pink Honeysuckle,Lonicera hispidula,Pink Honeysuckle,Plantae,53416,Caprifoliaceae,Lonicera,Lonicera hispidula
3178020,5/14/16,2016-05-15 02:38:55 +0200,Pacific Time (US & Canada),research,http://www.inaturalist.org/observations/3178020,https://inaturalist-open-data.s3.amazonaws.com/photos/3676837/medium.jpg,"Wonderfully fruity, almost lemony smell. Minuscule in size.",1,0,FALSE,"Las Trampas Regional Wilderness, Contra Costa County, US-CA, US",37.82115055,-122.0449904,5,,,Contra Costa,small tarweed,Madia exigua,small tarweed,Plantae,56971,Asteraceae,Madia,Madia exigua
3178064,5/14/16,2016-05-15 02:49:52 +0200,Pacific Time (US & Canada),research,http://www.inaturalist.org/observations/3178064,https://inaturalist-open-data.s3.amazonaws.com/photos/3675599/medium.jpg,,1,0,FALSE,"Las Trampas Regional Wilderness, Contra Costa County, US-CA, US",37.82004733,-122.0417887,5,,,Contra Costa,Elegant Clarkia,Clarkia unguiculata,Elegant Clarkia,Plantae,51735,Onagraceae,Clarkia,Clarkia unguiculata
3178080,5/14/16,2016-05-15 02:53:35 +0200,Pacific Time (US & Canada),research,http://www.inaturalist.org/observations/3178080,https://inaturalist-open-data.s3.amazonaws.com/photos/3675606/medium.jpg,,1,0,FALSE,"Las Trampas Regional Wilderness, Contra Costa County, US-CA, US",37.81935054,-122.039981,5,,,Contra Costa,Q-tips,Micropus californicus,Q-tips,Plantae,56975,Asteraceae,Micropus,Micropus californicus
3178084,5/14/16,2016-05-15 02:59:44 +0200,Pacific Time (US & Canada),research,http://www.inaturalist.org/observations/3178084,https://inaturalist-open-data.s3.amazonaws.com/photos/3675614/medium.jpg,,1,0,FALSE,"Las Trampas Regional Wilderness, Contra Costa County, US-CA, US",37.81717791,-122.041108,5,,,Contra Costa,Woolly Indian Paintbrush,Castilleja foliolosa,Woolly Indian Paintbrush,Plantae,56760,Orobanchaceae,Castilleja,Castilleja foliolosa
3178879,5/14/16,2016-05-15 00:42:50 +0200,Pacific Time (US & Canada),research,http://www.inaturalist.org/observations/3178879,https://inaturalist-open-data.s3.amazonaws.com/photos/3676809/medium.jpg,,1,0,FALSE,"Las Trampas Regional Wilderness, Contra Costa, California, United States",37.82640333,-122.0579067,,,,Contra Costa,Fairy Mist,Pterostegia drymarioides,Fairy Mist,Plantae,53191,Polygonaceae,Pterostegia,Pterostegia drymarioides
3178886,5/14/16,2016-05-15 00:51:23 +0200,Pacific Time (US & Canada),research,http://www.inaturalist.org/observations/3178886,https://inaturalist-open-data.s3.amazonaws.com/photos/3676815/medium.jpg,,2,0,FALSE,"Las Trampas Regional Wilderness, Contra Costa, California, United States",37.82804667,-122.05949,,,,Contra Costa,blue elder,Sambucus cerulea,blue elder,Plantae,143799,Viburnaceae,Sambucus,Sambucus cerulea
16432510,5/16/16,,Pacific Time (US & Canada),research,https://www.inaturalist.org/observations/16432510,https://inaturalist-open-data.s3.amazonaws.com/photos/24721472/medium.jpg,,1,0,FALSE,"Alamo, CA, USA",37.82516661,-122.0578776,31,,,Contra Costa,chamise,Adenostoma fasciculatum,chamise,Plantae,47146,Rosaceae,Adenostoma,Adenostoma fasciculatum
3330145,5/28/16,2016-05-28 19:11:00 +0200,Arizona,research,http://www.inaturalist.org/observations/3330145,https://inaturalist-open-data.s3.amazonaws.com/photos/3842731/medium.JPG,,2,0,FALSE,"Contra Costa County, CA, USA",37.8130693,-122.05931,122,,,Contra Costa,Ithuriel's Spear,Triteleia laxa,Ithuriel's Spear,Plantae,51085,Asparagaceae,Triteleia,Triteleia laxa
3330148,5/28/16,2016-05-28 19:22:00 +0200,Arizona,research,http://www.inaturalist.org/observations/3330148,https://inaturalist-open-data.s3.amazonaws.com/photos/3842741/medium.JPG,,1,0,FALSE,"Contra Costa County, CA, USA",37.8130693,-122.05931,122,,,Contra Costa,Winecup Clarkia,Clarkia purpurea,Winecup Clarkia,Plantae,51087,Onagraceae,Clarkia,Clarkia purpurea
3330149,5/28/16,2016-05-28 19:42:00 +0200,Arizona,research,http://www.inaturalist.org/observations/3330149,https://inaturalist-open-data.s3.amazonaws.com/photos/3842745/medium.JPG,,1,0,FALSE,"Contra Costa County, CA, USA",37.8130693,-122.05931,122,,,Contra Costa,Purple Owl's Clover,Castilleja exserta,purple owl's-clover,Plantae,49343,Orobanchaceae,Castilleja,Castilleja exserta
3330150,5/28/16,2016-05-28 19:42:00 +0200,Arizona,research,http://www.inaturalist.org/observations/3330150,https://inaturalist-open-data.s3.amazonaws.com/photos/3842743/medium.JPG,,2,0,FALSE,"Contra Costa County, CA, USA",37.8130693,-122.05931,122,,,Contra Costa,common yarrow,Achillea millefolium,common yarrow,Plantae,52821,Asteraceae,Achillea,Achillea millefolium
3330151,5/28/16,2016-05-28 19:44:00 +0200,Arizona,research,http://www.inaturalist.org/observations/3330151,https://inaturalist-open-data.s3.amazonaws.com/photos/3842754/medium.JPG,,1,0,FALSE,"Contra Costa County, CA, USA",37.8130693,-122.05931,122,,,Contra Costa,narrowleaf mule-ears,Wyethia angustifolia,narrowleaf mule-ears,Plantae,56987,Asteraceae,Wyethia,Wyethia angustifolia
3330153,5/28/16,2016-05-28 19:54:00 +0200,Arizona,research,http://www.inaturalist.org/observations/3330153,https://inaturalist-open-data.s3.amazonaws.com/photos/3842762/medium.JPG,,2,0,FALSE,"Contra Costa County, CA, USA",37.8130693,-122.05931,122,,,Contra Costa,Purple Chinese Houses,Collinsia heterophylla,Purple Chinese Houses,Plantae,47325,Plantaginaceae,Collinsia,Collinsia heterophylla
3330157,5/28/16,2016-05-28 19:59:00 +0200,Arizona,research,http://www.inaturalist.org/observations/3330157,https://inaturalist-open-data.s3.amazonaws.com/photos/3842786/medium.JPG,,1,0,FALSE,"Contra Costa County, CA, USA",37.813922,-122.059702,,,,Contra Costa,narrowleaf mule-ears,Wyethia angustifolia,narrowleaf mule-ears,Plantae,56987,Asteraceae,Wyethia,Wyethia angustifolia
3330211,5/28/16,2016-05-28 22:35:00 +0200,Arizona,research,http://www.inaturalist.org/observations/3330211,https://inaturalist-open-data.s3.amazonaws.com/photos/3842963/medium.JPG,,1,0,FALSE,"Contra Costa County, CA, USA",37.8130693,-122.05931,122,,,Contra Costa,California Mugwort,Artemisia douglasiana,California mugwort,Plantae,52854,Asteraceae,Artemisia,Artemisia douglasiana
3330212,5/28/16,2016-05-28 22:45:00 +0200,Arizona,research,http://www.inaturalist.org/observations/3330212,https://inaturalist-open-data.s3.amazonaws.com/photos/3842956/medium.JPG,,1,0,FALSE,"Contra Costa County, CA, USA",37.8130693,-122.05931,122,,,Contra Costa,ocean spray,Holodiscus discolor,Ocean spray,Plantae,53414,Rosaceae,Holodiscus,Holodiscus discolor
3330215,5/28/16,2016-05-28 22:54:00 +0200,Arizona,research,http://www.inaturalist.org/observations/3330215,https://inaturalist-open-data.s3.amazonaws.com/photos/3842967/medium.JPG,,1,0,FALSE,"Contra Costa County, CA, USA",37.8130693,-122.05931,122,,,Contra Costa,Hillside False Bindweed,Calystegia subacaulis,Hillside False Bindweed,Plantae,57012,Convolvulaceae,Calystegia,Calystegia subacaulis
3330216,5/28/16,2016-05-28 22:58:00 +0200,Arizona,research,http://www.inaturalist.org/observations/3330216,https://inaturalist-open-data.s3.amazonaws.com/photos/3842971/medium.JPG,,1,0,FALSE,"Contra Costa County, CA, USA",37.8130693,-122.05931,122,,,Contra Costa,Mediterranean lineseed,Bellardia trixago,Mediterranean lineseed,Plantae,51286,Orobanchaceae,Bellardia,Bellardia trixago
3330217,5/28/16,2016-05-28 23:01:00 +0200,Arizona,research,http://www.inaturalist.org/observations/3330217,https://inaturalist-open-data.s3.amazonaws.com/photos/3842970/medium.JPG,,1,0,FALSE,"Contra Costa County, CA, USA",37.8130693,-122.05931,122,,,Contra Costa,California buttercup,Ranunculus californicus,California buttercup,Plantae,52173,Ranunculaceae,Ranunculus,Ranunculus californicus
3330219,5/28/16,2016-05-28 23:04:00 +0200,Arizona,research,http://www.inaturalist.org/observations/3330219,https://inaturalist-open-data.s3.amazonaws.com/photos/3842976/medium.JPG,,1,0,FALSE,"Contra Costa County, CA, USA",37.8130693,-122.05931,122,,,Contra Costa,Western Blue-eyed Grass,Sisyrinchium bellum,western blue-eyed grass,Plantae,49918,Iridaceae,Sisyrinchium,Sisyrinchium bellum
3330220,5/28/16,2016-05-28 23:04:00 +0200,Arizona,research,http://www.inaturalist.org/observations/3330220,https://inaturalist-open-data.s3.amazonaws.com/photos/3842977/medium.JPG,,2,0,FALSE,"Contra Costa County, CA, USA",37.8130693,-122.05931,122,,,Contra Costa,Blow Wives,Achyrachaena mollis,Blow Wives,Plantae,56852,Asteraceae,Achyrachaena,Achyrachaena mollis
3330222,5/28/16,2016-05-28 23:20:00 +0200,Arizona,research,http://www.inaturalist.org/observations/3330222,https://inaturalist-open-data.s3.amazonaws.com/photos/3842983/medium.JPG,,1,0,FALSE,"Contra Costa County, CA, USA",37.8130693,-122.05931,122,,,Contra Costa,Ookow,Dichelostemma congestum,Ookow,Plantae,56593,Asparagaceae,Dichelostemma,Dichelostemma congestum
3597277,7/2/16,2016-07-03 00:13:09 +0200,Pacific Time (US & Canada),research,http://www.inaturalist.org/observations/3597277,https://inaturalist-open-data.s3.amazonaws.com/photos/4164007/medium.jpeg,,2,0,FALSE,"Las Trampas Ridge Trail Moraga, CA 94556",37.82359369,-122.0512087,8,,,Contra Costa,California Mugwort,Artemisia douglasiana,California mugwort,Plantae,52854,Asteraceae,Artemisia,Artemisia douglasiana
3598781,7/2/16,2016-07-03 00:20:18 +0200,Pacific Time (US & Canada),research,http://www.inaturalist.org/observations/3598781,https://inaturalist-open-data.s3.amazonaws.com/photos/4166492/medium.jpeg,,2,0,FALSE,"Las Trampas Ridge Trail Moraga, CA 94556",37.82531064,-122.0516528,14,,,Contra Costa,Pink Honeysuckle,Lonicera hispidula,Pink Honeysuckle,Plantae,53416,Caprifoliaceae,Lonicera,Lonicera hispidula
3598783,7/2/16,2016-07-03 00:20:44 +0200,Pacific Time (US & Canada),research,http://www.inaturalist.org/observations/3598783,https://inaturalist-open-data.s3.amazonaws.com/photos/4166500/medium.jpeg,,2,0,FALSE,"Las Trampas Ridge Trail Moraga, CA 94556",37.8252739,-122.0517446,10,,,Contra Costa,Coyote Mint,Monardella villosa,Coyote Mint,Plantae,52181,Lamiaceae,Monardella,Monardella villosa
3598784,7/2/16,2016-07-03 00:21:32 +0200,Pacific Time (US & Canada),research,http://www.inaturalist.org/observations/3598784,https://inaturalist-open-data.s3.amazonaws.com/photos/4166511/medium.jpeg,,2,0,FALSE,"Las Trampas Ridge Trail Moraga, CA 94556",37.82526308,-122.0517321,10,,,Contra Costa,Wavy-leafed Soap Plant,Chlorogalum pomeridianum,wavy-leafed soap plant,Plantae,47597,Asparagaceae,Chlorogalum,Chlorogalum pomeridianum
3598785,7/2/16,2016-07-03 00:22:24 +0200,Pacific Time (US & Canada),research,http://www.inaturalist.org/observations/3598785,https://inaturalist-open-data.s3.amazonaws.com/photos/4166523/medium.jpeg,,2,0,FALSE,"Las Trampas Ridge Trail Moraga, CA 94556",37.82534648,-122.0517295,10,,,Contra Costa,orange bush monkeyflower,Diplacus aurantiacus,orange bush monkeyflower,Plantae,777371,Phrymaceae,Diplacus,Diplacus aurantiacus
3598786,7/2/16,2016-07-03 00:26:03 +0200,Pacific Time (US & Canada),research,http://www.inaturalist.org/observations/3598786,https://inaturalist-open-data.s3.amazonaws.com/photos/4166531/medium.jpeg,,2,0,FALSE,"Las Trampas Ridge Trail Moraga, CA 94556",37.82584233,-122.0512483,7,,,Contra Costa,California bay,Umbellularia californica,California bay,Plantae,48807,Lauraceae,Umbellularia,Umbellularia californica
3598788,7/2/16,2016-07-03 00:44:40 +0200,Pacific Time (US & Canada),research,http://www.inaturalist.org/observations/3598788,https://inaturalist-open-data.s3.amazonaws.com/photos/4166541/medium.jpeg,,1,0,FALSE,"Las Trampas Regional Wilderness, Contra Costa County, US-CA, US",37.82665706,-122.0499134,13,,,Contra Costa,Elegant Clarkia,Clarkia unguiculata,Elegant Clarkia,Plantae,51735,Onagraceae,Clarkia,Clarkia unguiculata
3598790,7/2/16,2016-07-03 00:59:45 +0200,Pacific Time (US & Canada),research,http://www.inaturalist.org/observations/3598790,https://inaturalist-open-data.s3.amazonaws.com/photos/4166549/medium.jpeg,,1,0,FALSE,"Las Trampas Regional Wilderness, Contra Costa County, US-CA, US",37.82518482,-122.0529179,8,,,Contra Costa,Baldhip rose,Rosa gymnocarpa,Baldhip Rose,Plantae,53441,Rosaceae,Rosa,Rosa gymnocarpa
3598791,7/2/16,2016-07-03 01:23:30 +0200,Pacific Time (US & Canada),research,http://www.inaturalist.org/observations/3598791,https://inaturalist-open-data.s3.amazonaws.com/photos/4166550/medium.jpeg,,1,0,FALSE,"Las Trampas Regional Wilderness, Contra Costa County, US-CA, US",37.82521414,-122.057589,6,,,Contra Costa,Summer Lupine,Lupinus formosus,Summer Lupine,Plantae,57054,Fabaceae,Lupinus,Lupinus formosus
3598822,7/2/16,2016-07-02 23:12:55 +0200,Pacific Time (US & Canada),research,http://www.inaturalist.org/observations/3598822,https://inaturalist-open-data.s3.amazonaws.com/photos/4166564/medium.jpg,,2,0,FALSE,"Las Trampas Regional Wilderness, Contra Costa County, US-CA, US",37.81553824,-122.0461838,5,,,Contra Costa,California Poppy,Eschscholzia californica,California poppy,Plantae,48225,Papaveraceae,Eschscholzia,Eschscholzia californica
3598823,7/2/16,2016-07-02 23:13:49 +0200,Pacific Time (US & Canada),research,http://www.inaturalist.org/observations/3598823,https://inaturalist-open-data.s3.amazonaws.com/photos/4166566/medium.jpg,,2,0,FALSE,"Las Trampas Regional Wilderness, Contra Costa County, US-CA, US",37.81550471,-122.0461488,5,,,Contra Costa,Yellow Starthistle,Centaurea solstitialis,Yellow Star-Thistle,Plantae,52588,Asteraceae,Centaurea,Centaurea solstitialis
3598824,7/2/16,2016-07-02 23:21:30 +0200,Pacific Time (US & Canada),research,http://www.inaturalist.org/observations/3598824,https://inaturalist-open-data.s3.amazonaws.com/photos/4166568/medium.jpg,,1,0,FALSE,"Las Trampas Regional Wilderness, Contra Costa County, US-CA, US",37.81753414,-122.0452955,5,,,Contra Costa,Birchleaf Mountain Mahogany,Cercocarpus betuloides,Birchleaf Mountain Mahogany,Plantae,63977,Rosaceae,Cercocarpus,Cercocarpus betuloides
3598825,7/2/16,2016-07-02 23:30:11 +0200,Pacific Time (US & Canada),research,http://www.inaturalist.org/observations/3598825,https://inaturalist-open-data.s3.amazonaws.com/photos/4166571/medium.jpg,"One of the few things left flowering, crowded with tiny hymenopterans.",1,0,FALSE,"Las Trampas Regional Wilderness, Contra Costa County, US-CA, US",37.81756544,-122.0452687,5,,,Contra Costa,California Cudweed,Pseudognaphalium californicum,California cudweed,Plantae,53077,Asteraceae,Pseudognaphalium,Pseudognaphalium californicum
3598826,7/2/16,2016-07-02 23:46:22 +0200,Pacific Time (US & Canada),research,http://www.inaturalist.org/observations/3598826,https://inaturalist-open-data.s3.amazonaws.com/photos/4166575/medium.jpg,,2,0,FALSE,"Las Trampas Regional Wilderness, Contra Costa County, US-CA, US",37.82037292,-122.0466325,10,,,Contra Costa,ruby chalice clarkia,Clarkia rubicunda,ruby chalice clarkia,Plantae,57148,Onagraceae,Clarkia,Clarkia rubicunda
3598828,7/2/16,2016-07-02 23:50:04 +0200,Pacific Time (US & Canada),research,http://www.inaturalist.org/observations/3598828,https://inaturalist-open-data.s3.amazonaws.com/photos/4166578/medium.jpg,,2,0,FALSE,"Las Trampas Regional Wilderness, Contra Costa County, US-CA, US",37.8208359,-122.0476703,5,,,Contra Costa,Common Yarrow,Achillea millefolium,common yarrow,Plantae,52821,Asteraceae,Achillea,Achillea millefolium
3598838,7/2/16,2016-07-03 01:51:02 +0200,Pacific Time (US & Canada),research,http://www.inaturalist.org/observations/3598838,https://inaturalist-open-data.s3.amazonaws.com/photos/4166598/medium.jpg,,2,0,FALSE,"Las Trampas Regional Wilderness, Contra Costa County, US-CA, US",37.81615121,-122.0501691,5,,,Contra Costa,Turkey Mullein,Croton setiger,turkey mullein,Plantae,154156,Euphorbiaceae,Croton,Croton setiger
3599907,7/2/16,2016-07-03 02:03:00 +0200,Pacific Time (US & Canada),research,http://www.inaturalist.org/observations/3599907,https://inaturalist-open-data.s3.amazonaws.com/photos/4168227/medium.jpg,,1,0,FALSE,"Las Trampas Regional Wilderness, Contra Costa County, CA, USA",37.812255,-122.0451633,,,,Contra Costa,coast tarweed,Madia sativa,coast tarweed,Plantae,53143,Asteraceae,Madia,Madia sativa
3690709,7/16/16,2016-07-17 01:09:00 +0200,Pacific Time (US & Canada),research,http://www.inaturalist.org/observations/3690709,https://inaturalist-open-data.s3.amazonaws.com/photos/4280866/medium.jpeg,,1,0,FALSE,"Las Trampas Regional Wilderness, Bollinger Canyon Road, San Ramon, CA, United States",37.8158101,-122.0407758,,,,Contra Costa,wiry snapdragon,Sairocarpus vexillocalyculatus,wiry snapdragon,Plantae,168308,Plantaginaceae,Sairocarpus,Sairocarpus vexillocalyculatus
3690713,7/16/16,2016-07-17 00:45:00 +0200,Pacific Time (US & Canada),research,http://www.inaturalist.org/observations/3690713,https://inaturalist-open-data.s3.amazonaws.com/photos/4280896/medium.jpeg,,1,0,FALSE,"Las Trampas Regional Wilderness, Bollinger Canyon Road, San Ramon, CA, United States",37.8158101,-122.0407758,,,,Contra Costa,common hareleaf,Lagophylla ramosissima,common hareleaf,Plantae,56965,Asteraceae,Lagophylla,Lagophylla ramosissima
3690716,7/16/16,2016-07-17 00:31:00 +0200,Pacific Time (US & Canada),research,http://www.inaturalist.org/observations/3690716,https://inaturalist-open-data.s3.amazonaws.com/photos/4280923/medium.jpeg,,1,0,FALSE,"Las Trampas Regional Wilderness, Bollinger Canyon Road, San Ramon, CA, United States",37.838132,-122.057405,,,,Contra Costa,Red Ribbons,Clarkia concinna,Red Ribbons,Plantae,51854,Onagraceae,Clarkia,Clarkia concinna
3690719,7/16/16,2016-07-17 00:20:00 +0200,Pacific Time (US & Canada),research,http://www.inaturalist.org/observations/3690719,https://inaturalist-open-data.s3.amazonaws.com/photos/4280931/medium.jpeg,,2,0,FALSE,"Las Trampas Regional Wilderness, Bollinger Canyon Road, San Ramon, CA, United States",37.8158101,-122.0407758,,,,Contra Costa,California Poppy,Eschscholzia californica,California poppy,Plantae,48225,Papaveraceae,Eschscholzia,Eschscholzia californica
3690720,7/16/16,2016-07-17 00:07:00 +0200,Pacific Time (US & Canada),research,http://www.inaturalist.org/observations/3690720,https://inaturalist-open-data.s3.amazonaws.com/photos/4280933/medium.jpeg,,1,0,FALSE,"Las Trampas Regional Wilderness, Bollinger Canyon Road, San Ramon, CA, United States",37.835064,-122.057041,,,,Contra Costa,Elegant Clarkia,Clarkia unguiculata,Elegant Clarkia,Plantae,51735,Onagraceae,Clarkia,Clarkia unguiculata
3690722,7/16/16,2016-07-16 23:48:00 +0200,Pacific Time (US & Canada),research,http://www.inaturalist.org/observations/3690722,https://inaturalist-open-data.s3.amazonaws.com/photos/4280974/medium.jpeg,,1,0,FALSE,"Las Trampas Regional Wilderness, Bollinger Canyon Road, San Ramon, CA, United States",37.8158101,-122.0407758,,,,Contra Costa,Crevice Alumroot,Heuchera micrantha,crevice alumroot,Plantae,51274,Saxifragaceae,Heuchera,Heuchera micrantha
3690725,7/16/16,2016-07-16 23:35:00 +0200,Pacific Time (US & Canada),research,http://www.inaturalist.org/observations/3690725,https://inaturalist-open-data.s3.amazonaws.com/photos/4280976/medium.jpeg,,1,0,FALSE,"Las Trampas Regional Wilderness, Bollinger Canyon Road, San Ramon, CA, United States",37.8158101,-122.0407758,,,,Contra Costa,Ocean spray,Holodiscus discolor,Ocean spray,Plantae,53414,Rosaceae,Holodiscus,Holodiscus discolor
3690726,7/16/16,2016-07-16 23:40:00 +0200,Pacific Time (US & Canada),research,http://www.inaturalist.org/observations/3690726,https://inaturalist-open-data.s3.amazonaws.com/photos/4280987/medium.jpeg,,1,0,FALSE,"Las Trampas Regional Wilderness, Bollinger Canyon Road, San Ramon, CA, United States",37.8158101,-122.0407758,,,,Contra Costa,Pink Honeysuckle,Lonicera hispidula,Pink Honeysuckle,Plantae,53416,Caprifoliaceae,Lonicera,Lonicera hispidula
3690727,7/16/16,2016-07-16 22:49:00 +0200,Pacific Time (US & Canada),research,http://www.inaturalist.org/observations/3690727,https://inaturalist-open-data.s3.amazonaws.com/photos/4280985/medium.jpeg,,1,0,FALSE,"Las Trampas Regional Wilderness, Bollinger Canyon Road, San Ramon, CA, United States",37.8158101,-122.0407758,,,,Contra Costa,roughleaf aster,Eurybia radulina,roughleaf aster,Plantae,52974,Asteraceae,Eurybia,Eurybia radulina
3690729,7/16/16,2016-07-16 22:49:00 +0200,Pacific Time (US & Canada),research,http://www.inaturalist.org/observations/3690729,https://inaturalist-open-data.s3.amazonaws.com/photos/4281008/medium.jpeg,,1,0,FALSE,"Las Trampas Regional Wilderness, Bollinger Canyon Road, San Ramon, CA, United States",37.83192,-122.05111,,,,Contra Costa,Hillside broomrape,Aphyllon vallicola,Hillside broomrape,Plantae,938507,Orobanchaceae,Aphyllon,Aphyllon vallicola
3690736,7/16/16,2016-07-16 21:51:00 +0200,Pacific Time (US & Canada),research,http://www.inaturalist.org/observations/3690736,https://inaturalist-open-data.s3.amazonaws.com/photos/4281031/medium.jpeg,,1,0,FALSE,"Las Trampas Regional Wilderness, Bollinger Canyon Road, San Ramon, CA, United States",37.8158101,-122.0407758,,,,Contra Costa,Coyote Mint,Monardella villosa,Coyote Mint,Plantae,52181,Lamiaceae,Monardella,Monardella villosa
3690746,7/16/16,2016-07-16 20:19:00 +0200,Pacific Time (US & Canada),research,http://www.inaturalist.org/observations/3690746,https://inaturalist-open-data.s3.amazonaws.com/photos/4281078/medium.jpeg,,1,0,FALSE,"Las Trampas Regional Wilderness, Bollinger Canyon Road, San Ramon, CA, United States",37.8158101,-122.0407758,,,,Contra Costa,California Black Oak,Quercus kelloggii,California black oak,Plantae,49919,Fagaceae,Quercus,Quercus kelloggii
3937504,8/21/16,2016-08-21 22:32:00 +0200,Pacific Time (US & Canada),research,http://www.inaturalist.org/observations/3937504,https://inaturalist-open-data.s3.amazonaws.com/photos/4636384/medium.jpeg,,2,0,FALSE,"Alamo, CA, USA",37.82067805,-122.047637,763,,,Contra Costa,deerweed,Acmispon glaber,deerweed,Plantae,53134,Fabaceae,Acmispon,Acmispon glaber
3937509,8/21/16,2016-08-21 22:58:00 +0200,Pacific Time (US & Canada),research,http://www.inaturalist.org/observations/3937509,https://inaturalist-open-data.s3.amazonaws.com/photos/4636397/medium.jpeg,,1,0,FALSE,"Alamo, CA, USA",37.82067805,-122.047637,763,,,Contra Costa,roughleaf aster,Eurybia radulina,roughleaf aster,Plantae,52974,Asteraceae,Eurybia,Eurybia radulina
3937510,8/21/16,2016-08-21 23:02:00 +0200,Pacific Time (US & Canada),research,http://www.inaturalist.org/observations/3937510,https://inaturalist-open-data.s3.amazonaws.com/photos/4636399/medium.jpeg,,1,0,FALSE,"Alamo, CA, USA",37.82067805,-122.047637,763,,,Contra Costa,Canyon Live Oak,Quercus chrysolepis,canyon live oak,Plantae,51092,Fagaceae,Quercus,Quercus chrysolepis
3937512,8/21/16,2016-08-21 23:23:00 +0200,Pacific Time (US & Canada),research,http://www.inaturalist.org/observations/3937512,https://inaturalist-open-data.s3.amazonaws.com/photos/4636411/medium.jpeg,,1,0,FALSE,"Alamo, CA, USA",37.82067805,-122.047637,763,,,Contra Costa,panicled willowherb,Epilobium brachycarpum,panicled willowherb,Plantae,52971,Onagraceae,Epilobium,Epilobium brachycarpum
3937513,8/21/16,2016-08-21 23:32:00 +0200,Pacific Time (US & Canada),research,http://www.inaturalist.org/observations/3937513,https://inaturalist-open-data.s3.amazonaws.com/photos/4636422/medium.jpeg,Native Oak Woodland,3,0,FALSE,"Alamo, CA, USA",37.82067805,-122.047637,763,,,Contra Costa,California Dutchman's Pipe,Aristolochia californica,California Dutchman's Pipe,Plantae,55190,Aristolochiaceae,Aristolochia,Aristolochia californica
3937515,8/21/16,2016-08-21 23:40:00 +0200,Pacific Time (US & Canada),research,http://www.inaturalist.org/observations/3937515,https://inaturalist-open-data.s3.amazonaws.com/photos/4636428/medium.jpeg,On Quercus,1,0,FALSE,"Alamo, CA, USA",37.82067805,-122.047637,763,,,Contra Costa,Oak mistletoe,Phoradendron villosum,oak mistletoe,Plantae,343310,Santalaceae,Phoradendron,Phoradendron villosum
4364372,10/15/16,2016-10-15 21:57:06 +0200,Pacific Time (US & Canada),research,http://www.inaturalist.org/observations/4364372,https://inaturalist-open-data.s3.amazonaws.com/photos/5228545/medium.jpeg,,2,0,FALSE,"Las Trampas Regional Wilderness, Contra Costa County, US-CA, US",37.81634402,-122.0513943,6,,,Contra Costa,Summer Lupine,Lupinus formosus,Summer Lupine,Plantae,57054,Fabaceae,Lupinus,Lupinus formosus
4366258,10/15/16,2016-10-16 00:58:52 +0200,Pacific Time (US & Canada),research,http://www.inaturalist.org/observations/4366258,https://inaturalist-open-data.s3.amazonaws.com/photos/5231612/medium.jpeg,Just one that I could see.,2,0,FALSE,"San Ramon, CA 94583",37.80736533,-122.053326,7,,,Contra Costa,purple star-thistle,Centaurea calcitrapa,purple star-thistle,Plantae,56865,Asteraceae,Centaurea,Centaurea calcitrapa
4847384,12/26/16,2016-12-27 00:43:06 +0100,Pacific Time (US & Canada),research,https://www.inaturalist.org/observations/4847384,https://inaturalist-open-data.s3.amazonaws.com/photos/5886702/medium.jpg,,1,0,FALSE,"94549, Lafayette, CA, US",37.82121667,-122.0459138,,,,Contra Costa,Chamise,Adenostoma fasciculatum,chamise,Plantae,47146,Rosaceae,Adenostoma,Adenostoma fasciculatum
4847688,12/26/16,2016-12-26 21:03:04 +0100,Pacific Time (US & Canada),research,https://www.inaturalist.org/observations/4847688,https://inaturalist-open-data.s3.amazonaws.com/photos/5887169/medium.jpg,,2,0,FALSE,"94583, San Ramon, CA, US",37.81738333,-122.0432055,,,,Contra Costa,Pacific hound's tongue,Adelinia grande,Pacific hound's tongue,Plantae,769151,Boraginaceae,Adelinia,Adelinia grande
4847898,12/26/16,2016-12-26 21:59:00 +0100,Pacific Time (US & Canada),research,https://www.inaturalist.org/observations/4847898,https://inaturalist-open-data.s3.amazonaws.com/photos/5887474/medium.jpeg,,2,0,FALSE,"Alamo, CA, USA",37.817344,-122.042549,52,,,Contra Costa,Pacific hound's tongue,Adelinia grande,Pacific hound's tongue,Plantae,769151,Boraginaceae,Adelinia,Adelinia grande
4847901,12/26/16,2016-12-26 22:17:00 +0100,Pacific Time (US & Canada),research,https://www.inaturalist.org/observations/4847901,https://inaturalist-open-data.s3.amazonaws.com/photos/5887478/medium.jpeg,,2,0,FALSE,"Alamo, CA, USA",37.817616,-122.040339,104,,,Contra Costa,Woolly Indian Paintbrush,Castilleja foliolosa,Woolly Indian Paintbrush,Plantae,56760,Orobanchaceae,Castilleja,Castilleja foliolosa
4948072,1/14/17,2017-01-15 00:44:00 +0100,Pacific Time (US & Canada),research,https://www.inaturalist.org/observations/4948072,https://inaturalist-open-data.s3.amazonaws.com/photos/6034474/medium.jpg,,4,0,FALSE,"Alamo, CA, USA",37.82773333,-122.0589167,,,,Contra Costa,Pacific madrone,Arbutus menziesii,Pacific madrone,Plantae,51046,Ericaceae,Arbutus,Arbutus menziesii
4948073,1/14/17,2017-01-15 00:47:00 +0100,Pacific Time (US & Canada),research,https://www.inaturalist.org/observations/4948073,https://inaturalist-open-data.s3.amazonaws.com/photos/6034473/medium.jpg,,2,0,FALSE,"Las Trampas Regional Wilderness, Contra Costa, California, United States",37.82918833,-122.061005,,,,Contra Costa,coast silk tassel,Garrya elliptica,Coast silk tassel,Plantae,53399,Garryaceae,Garrya,Garrya elliptica
9572116,2/5/17,2017-02-05 21:25:36 +0100,Pacific Time (US & Canada),research,https://www.inaturalist.org/observations/9572116,https://inaturalist-open-data.s3.amazonaws.com/photos/13067283/medium.jpeg,,1,0,FALSE,"Las Trampas Ridge Trail, Moraga, CA 94556, USA",37.82517985,-122.0536352,688,,,Contra Costa,bluewitch nightshade,Solanum umbelliferum,bluewitch nightshade,Plantae,50639,Solanaceae,Solanum,Solanum umbelliferum
9736930,2/5/17,2017-02-05 21:21:22 +0100,Pacific Time (US & Canada),research,https://www.inaturalist.org/observations/9736930,https://static.inaturalist.org/photos/13325395/medium.jpeg,,2,0,FALSE,"Las Trampas Ridge Trail, Moraga, CA 94556, USA",37.82535553,-122.0550232,,,,Contra Costa,Indian Warrior,Pedicularis densiflora,Warrior's Plume,Plantae,49645,Orobanchaceae,Pedicularis,Pedicularis densiflora
13162551,3/11/17,2017-03-11 22:44:57 +0100,Pacific Time (US & Canada),research,https://www.inaturalist.org/observations/13162551,https://static.inaturalist.org/photos/19212228/medium.jpeg,,2,0,FALSE,"Las Trampas Ridge Trail, Moraga, CA 94556, USA",37.82532501,-122.0550232,,,,Contra Costa,Indian Warrior,Pedicularis densiflora,Warrior's Plume,Plantae,49645,Orobanchaceae,Pedicularis,Pedicularis densiflora
5417086,3/19/17,2017-03-19 19:51:00 +0100,Pacific Time (US & Canada),research,https://www.inaturalist.org/observations/5417086,https://static.inaturalist.org/photos/6659999/medium.jpg,OLYMPUS DIGITAL CAMERA,1,0,FALSE,"18012 Bollinger Canyon Rd, San Ramon, CA 94583, USA",37.82847809,-122.0290089,122,,,Contra Costa,Coast Live Oak,Quercus agrifolia,coast live oak,Plantae,47850,Fagaceae,Quercus,Quercus agrifolia
5417093,3/19/17,2017-03-19 19:51:00 +0100,Pacific Time (US & Canada),research,https://www.inaturalist.org/observations/5417093,https://static.inaturalist.org/photos/6660015/medium.jpg,OLYMPUS DIGITAL CAMERA,1,0,FALSE,"Alamo, CA, USA",37.8368162,-122.0409393,122,,,Contra Costa,California Black Oak,Quercus kelloggii,California black oak,Plantae,49919,Fagaceae,Quercus,Quercus kelloggii
5417128,3/19/17,2017-03-19 20:23:00 +0100,Pacific Time (US & Canada),research,https://www.inaturalist.org/observations/5417128,https://static.inaturalist.org/photos/6660047/medium.jpg,OLYMPUS DIGITAL CAMERA,1,0,FALSE,"Alamo, CA, USA",37.83722292,-122.0444584,122,,,Contra Costa,Miner's Lettuce,Claytonia perfoliata,miner's lettuce,Plantae,52994,Montiaceae,Claytonia,Claytonia perfoliata
5417131,3/19/17,2017-03-19 20:24:00 +0100,Pacific Time (US & Canada),research,https://www.inaturalist.org/observations/5417131,https://static.inaturalist.org/photos/6660052/medium.jpg,OLYMPUS DIGITAL CAMERA,2,0,FALSE,"Alamo, CA, USA",37.83559605,-122.0381069,122,,,Contra Costa,milkmaids,Cardamine californica,milkmaids,Plantae,49651,Brassicaceae,Cardamine,Cardamine californica
5417231,3/19/17,2017-03-19 20:29:00 +0100,Pacific Time (US & Canada),research,https://www.inaturalist.org/observations/5417231,https://static.inaturalist.org/photos/6660106/medium.jpg,OLYMPUS DIGITAL CAMERA,1,0,FALSE,"Alamo, CA, USA",37.8342403,-122.0393944,122,,,Contra Costa,Pacific Sanicle,Sanicula crassicaulis,Pacific Sanicle,Plantae,53201,Apiaceae,Sanicula,Sanicula crassicaulis
5417239,3/19/17,2017-03-19 20:29:00 +0100,Pacific Time (US & Canada),research,https://www.inaturalist.org/observations/5417239,https://static.inaturalist.org/photos/6660114/medium.jpg,OLYMPUS DIGITAL CAMERA,1,0,FALSE,"Alamo, CA, USA",37.83471482,-122.0386219,122,,,Contra Costa,Miner's Lettuce,Claytonia perfoliata,miner's lettuce,Plantae,52994,Montiaceae,Claytonia,Claytonia perfoliata
5417249,3/19/17,2017-03-19 20:29:00 +0100,Pacific Time (US & Canada),research,https://www.inaturalist.org/observations/5417249,https://static.inaturalist.org/photos/6660129/medium.jpg,OLYMPUS DIGITAL CAMERA,1,0,FALSE,"Alamo, CA, USA",37.8309864,-122.0424843,122,,,Contra Costa,Small Baby Blue-eyes,Nemophila heterophylla,White nemophila,Plantae,53158,Boraginaceae,Nemophila,Nemophila heterophylla
5417517,3/19/17,2017-03-19 20:39:00 +0100,Pacific Time (US & Canada),research,https://www.inaturalist.org/observations/5417517,https://static.inaturalist.org/photos/6660458/medium.jpg,OLYMPUS DIGITAL CAMERA,2,0,FALSE,"Alamo, CA, USA",37.82940798,-122.0474625,244,,,Contra Costa,milkmaids,Cardamine californica,milkmaids,Plantae,49651,Brassicaceae,Cardamine,Cardamine californica
5417540,3/19/17,2017-03-19 20:44:00 +0100,Pacific Time (US & Canada),research,https://www.inaturalist.org/observations/5417540,https://static.inaturalist.org/photos/6660491/medium.jpg,OLYMPUS DIGITAL CAMERA,1,0,FALSE,"Alamo, CA, USA",37.82913681,-122.0508957,244,,,Contra Costa,hillside woodland star,Lithophragma heterophyllum,hillside woodland star,Plantae,53124,Saxifragaceae,Lithophragma,Lithophragma heterophyllum
5417553,3/19/17,2017-03-19 20:49:00 +0100,Pacific Time (US & Canada),research,https://www.inaturalist.org/observations/5417553,https://static.inaturalist.org/photos/6660533/medium.jpg,OLYMPUS DIGITAL CAMERA,2,0,FALSE,"Alamo, CA, USA",37.83064745,-122.0540714,122,,,Contra Costa,fewflower blue-eyed Mary,Collinsia sparsiflora,fewflower blue-eyed Mary,Plantae,50656,Plantaginaceae,Collinsia,Collinsia sparsiflora
5417615,3/19/17,2017-03-19 20:51:00 +0100,Pacific Time (US & Canada),research,https://www.inaturalist.org/observations/5417615,https://static.inaturalist.org/photos/6660655/medium.jpg,OLYMPUS DIGITAL CAMERA,1,0,FALSE,"Alamo, CA, USA",37.83302011,-122.0545864,122,,,Contra Costa,small-flowered fiddleneck,Amsinckia menziesii,Common Fiddleneck,Plantae,55436,Boraginaceae,Amsinckia,Amsinckia menziesii
5417618,3/19/17,2017-03-19 20:52:00 +0100,Pacific Time (US & Canada),research,https://www.inaturalist.org/observations/5417618,https://static.inaturalist.org/photos/6660662/medium.jpg,OLYMPUS DIGITAL CAMERA,1,0,FALSE,"Alamo, CA, USA",37.8308994,-122.0457458,244,,,Contra Costa,Dove's-foot crane's-bill,Geranium molle,Dove's-foot crane's-bill,Plantae,53076,Geraniaceae,Geranium,Geranium molle
5417648,3/19/17,2017-03-19 20:53:00 +0100,Pacific Time (US & Canada),research,https://www.inaturalist.org/observations/5417648,https://static.inaturalist.org/photos/6660674/medium.jpg,OLYMPUS DIGITAL CAMERA,1,0,FALSE,"Alamo, CA, USA",37.82787812,-122.0495224,488,,,Contra Costa,Cut-leaved Crane's-bill,Geranium dissectum,Cut-leaved crane's-bill,Plantae,53075,Geraniaceae,Geranium,Geranium dissectum
5417697,3/19/17,2017-03-19 20:59:00 +0100,Pacific Time (US & Canada),research,https://www.inaturalist.org/observations/5417697,https://static.inaturalist.org/photos/6660807/medium.jpg,OLYMPUS DIGITAL CAMERA,2,0,FALSE,"Alamo, CA, USA",37.82995032,-122.0483208,244,,,Contra Costa,California Buckeye,Aesculus californica,California buckeye,Plantae,53348,Sapindaceae,Aesculus,Aesculus californica
5423128,3/19/17,2017-03-19 21:06:00 +0100,Pacific Time (US & Canada),research,https://www.inaturalist.org/observations/5423128,https://static.inaturalist.org/photos/6668703/medium.jpg,Seedling.,1,0,FALSE,"Alamo, CA, USA",37.83376578,-122.0427418,122,,,Contra Costa,California buckeye,Aesculus californica,California buckeye,Plantae,53348,Sapindaceae,Aesculus,Aesculus californica
5423146,3/19/17,2017-03-19 21:12:00 +0100,Pacific Time (US & Canada),research,https://www.inaturalist.org/observations/5423146,https://static.inaturalist.org/photos/6668832/medium.jpg,On right.,1,0,FALSE,"Alamo, CA, USA",37.833698,-122.0402956,122,,,Contra Costa,Milk Thistle,Silybum marianum,milk thistle,Plantae,52586,Asteraceae,Silybum,Silybum marianum
5423149,3/19/17,2017-03-19 21:19:00 +0100,Pacific Time (US & Canada),research,https://www.inaturalist.org/observations/5423149,https://static.inaturalist.org/photos/6668870/medium.jpg,OLYMPUS DIGITAL CAMERA,1,0,FALSE,"Alamo, CA, USA",37.83058982,-122.0438576,488,,,Contra Costa,Subterranean Clover,Trifolium subterraneum,Subterranean Clover,Plantae,60201,Fabaceae,Trifolium,Trifolium subterraneum
5423162,3/19/17,2017-03-19 21:22:00 +0100,Pacific Time (US & Canada),research,https://www.inaturalist.org/observations/5423162,https://static.inaturalist.org/photos/6668893/medium.jpg,OLYMPUS DIGITAL CAMERA,3,0,FALSE,"Alamo, CA, USA",37.83523791,-122.0411968,244,,,Contra Costa,Pineapple Weed,Matricaria discoidea,pineapple-weed,Plantae,52992,Asteraceae,Matricaria,Matricaria discoidea
5423165,3/19/17,2017-03-19 21:22:00 +0100,Pacific Time (US & Canada),research,https://www.inaturalist.org/observations/5423165,https://static.inaturalist.org/photos/6668919/medium.jpg,OLYMPUS DIGITAL CAMERA,1,0,FALSE,"Alamo, CA, USA",37.81575104,-122.0409393,1701,,,Contra Costa,bur clover,Medicago polymorpha,bur clover,Plantae,53151,Fabaceae,Medicago,Medicago polymorpha
5423197,3/19/17,2017-03-19 21:30:00 +0100,Pacific Time (US & Canada),research,https://www.inaturalist.org/observations/5423197,https://static.inaturalist.org/photos/6668932/medium.jpg,OLYMPUS DIGITAL CAMERA,2,0,FALSE,"Alamo, CA, USA",37.83031866,-122.0424843,488,,,Contra Costa,shepherd's purse,Capsella bursa-pastoris,shepherd's-purse,Plantae,56121,Brassicaceae,Capsella,Capsella bursa-pastoris
5423745,3/19/17,2017-03-19 21:44:00 +0100,Pacific Time (US & Canada),research,https://www.inaturalist.org/observations/5423745,https://static.inaturalist.org/photos/6669761/medium.jpg,OLYMPUS DIGITAL CAMERA,2,0,FALSE,"Alamo, CA, USA",37.83471482,-122.0409822,122,,,Contra Costa,California Black Oak,Quercus kelloggii,California black oak,Plantae,49919,Fagaceae,Quercus,Quercus kelloggii
5423750,3/19/17,2017-03-19 21:46:00 +0100,Pacific Time (US & Canada),research,https://www.inaturalist.org/observations/5423750,https://static.inaturalist.org/photos/6669775/medium.jpg,OLYMPUS DIGITAL CAMERA,3,0,FALSE,"Alamo, CA, USA",37.83605135,-122.0375919,244,,,Contra Costa,California Mugwort,Artemisia douglasiana,California mugwort,Plantae,52854,Asteraceae,Artemisia,Artemisia douglasiana
5423753,3/19/17,2017-03-19 21:46:00 +0100,Pacific Time (US & Canada),research,https://www.inaturalist.org/observations/5423753,https://static.inaturalist.org/photos/6669799/medium.jpg,OLYMPUS DIGITAL CAMERA,1,0,FALSE,"Alamo, CA, USA",37.83735849,-122.0384073,122,,,Contra Costa,Common Snowberry,Symphoricarpos albus,Common Snowberry,Plantae,48523,Caprifoliaceae,Symphoricarpos,Symphoricarpos albus
5423772,3/19/17,2017-03-19 21:49:00 +0100,Pacific Time (US & Canada),research,https://www.inaturalist.org/observations/5423772,https://static.inaturalist.org/photos/6669828/medium.jpg,OLYMPUS DIGITAL CAMERA,2,0,FALSE,"Alamo, CA, USA",37.83735849,-122.0382357,122,,,Contra Costa,Valley Oak,Quercus lobata,valley oak,Plantae,49011,Fagaceae,Quercus,Quercus lobata
5423777,3/19/17,2017-03-19 21:49:00 +0100,Pacific Time (US & Canada),research,https://www.inaturalist.org/observations/5423777,https://static.inaturalist.org/photos/6669839/medium.jpg,OLYMPUS DIGITAL CAMERA,1,0,FALSE,"Alamo, CA, USA",37.83722292,-122.039609,122,,,Contra Costa,Bigleaf Maple,Acer macrophyllum,bigleaf maple,Plantae,48227,Sapindaceae,Acer,Acer macrophyllum
5423793,3/19/17,2017-03-19 21:57:00 +0100,Pacific Time (US & Canada),research,https://www.inaturalist.org/observations/5423793,https://static.inaturalist.org/photos/6669866/medium.jpg,OLYMPUS DIGITAL CAMERA,3,0,FALSE,"Alamo, CA, USA",37.83769741,-122.0377207,122,,,Contra Costa,Star-flowered Lily-of-the-valley,Maianthemum stellatum,star-flowered lily-of-the-valley,Plantae,53268,Asparagaceae,Maianthemum,Maianthemum stellatum
5423798,3/19/17,2017-03-19 21:57:00 +0100,Pacific Time (US & Canada),research,https://www.inaturalist.org/observations/5423798,https://static.inaturalist.org/photos/6669868/medium.jpg,OLYMPUS DIGITAL CAMERA,1,0,FALSE,"Alamo, CA, USA",37.83769741,-122.0365191,122,,,Contra Costa,broadleaf forget-me-not,Myosotis latifolia,broadleaf forget-me-not,Plantae,49132,Boraginaceae,Myosotis,Myosotis latifolia
5423805,3/19/17,2017-03-19 21:58:00 +0100,Pacific Time (US & Canada),research,https://www.inaturalist.org/observations/5423805,https://static.inaturalist.org/photos/6669873/medium.jpg,OLYMPUS DIGITAL CAMERA,1,0,FALSE,"Alamo, CA, USA",37.8372907,-122.0360899,122,,,Contra Costa,Pacific Sanicle,Sanicula crassicaulis,Pacific Sanicle,Plantae,53201,Apiaceae,Sanicula,Sanicula crassicaulis
12251874,3/19/17,2017-03-20 00:40:48 +0100,Pacific Time (US & Canada),research,https://www.inaturalist.org/observations/12251874,https://inaturalist-open-data.s3.amazonaws.com/photos/17613600/medium.jpg,"37 49 31 N, 122 03 18 W

Pedicularis densiflora
Warrior's plume
Las Trampas Ridge Trail
San Ramon, CA",3,0,FALSE,"37 49 31 N, 122 03 18 W",37.825278,-122.055,,,,Contra Costa,Indian Warrior,Pedicularis densiflora,Warrior's Plume,Plantae,49645,Orobanchaceae,Pedicularis,Pedicularis densiflora
12694659,3/19/17,2017-03-20 00:50:36 +0100,Pacific Time (US & Canada),research,https://www.inaturalist.org/observations/12694659,https://inaturalist-open-data.s3.amazonaws.com/photos/18378626/medium.jpg,"Las Trampas Wilderness
San Ramon, CA",1,0,FALSE,"Las Trampas Regional Wilderness, Contra Costa County, US-CA, US",37.82555556,-122.0519444,,,,Contra Costa,California black oak,Quercus kelloggii,California black oak,Plantae,49919,Fagaceae,Quercus,Quercus kelloggii
12694660,3/19/17,2017-03-20 01:16:54 +0100,Pacific Time (US & Canada),research,https://www.inaturalist.org/observations/12694660,https://inaturalist-open-data.s3.amazonaws.com/photos/18378629/medium.jpg,"Toxicoscordion fremontii
&quot;Common star-lily&quot; aka &quot;Frmont's deathcamas&quot;
Las Trampas Wilderness
San Ramon, CA",1,0,FALSE,"Las Trampas Regional Wilderness, Contra Costa County, US-CA, US",37.81861111,-122.0452778,,,,Contra Costa,Fremont's Deathcamas,Toxicoscordion fremontii,Common star lily,Plantae,49649,Melanthiaceae,Toxicoscordion,Toxicoscordion fremontii
12696077,3/19/17,2017-03-20 00:38:54 +0100,Pacific Time (US & Canada),research,https://www.inaturalist.org/observations/12696077,https://inaturalist-open-data.s3.amazonaws.com/photos/18381191/medium.jpg,"37 49 31 N, 122 03 18 W

Pedicularis densiflora
Warrior's plume
Las Trampas Ridge Trail",2,0,FALSE,"37 49 31 N, 122 03 18 W",37.825278,-122.055,,,,Contra Costa,Indian Warrior,Pedicularis densiflora,Warrior's Plume,Plantae,49645,Orobanchaceae,Pedicularis,Pedicularis densiflora
15768972,3/29/17,2017-03-30 01:19:00 +0200,Pacific Time (US & Canada),research,https://www.inaturalist.org/observations/15768972,https://inaturalist-open-data.s3.amazonaws.com/photos/23557231/medium.jpg,"Las Trampas Regional Wilderness, Las Trampas Ridge Trail, San Ramon, CA",1,0,FALSE,"Alamo, CA, USA",37.82464119,-122.0517407,31,,,Contra Costa,black sage,Salvia mellifera,black sage,Plantae,50643,Lamiaceae,Salvia,Salvia mellifera
15792937,3/29/17,2017-03-29 22:25:00 +0200,Pacific Time (US & Canada),research,https://www.inaturalist.org/observations/15792937,https://inaturalist-open-data.s3.amazonaws.com/photos/23601055/medium.jpg,"Rocky Ridge Rd, Las Trampas Regional Wilderness, San Ramon, CA",1,0,FALSE,"Contra Costa County, CA, USA",37.81706115,-122.0576721,122,,,Contra Costa,ribwort plantain,Plantago lanceolata,ribwort plantain,Plantae,53178,Plantaginaceae,Plantago,Plantago lanceolata
5555501,4/2/17,2017-04-02 21:59:56 +0200,Mountain Time (US & Canada),research,https://www.inaturalist.org/observations/5555501,https://inaturalist-open-data.s3.amazonaws.com/photos/6858178/medium.jpg,,2,0,FALSE,"18013 Bollinger Canyon Rd, Moraga, CA, US",37.81788833,-122.0512555,,,,Contra Costa,Shining Pepperweed,Lepidium nitidum,Shining Pepperweed,Plantae,47202,Brassicaceae,Lepidium,Lepidium nitidum
5555560,4/2/17,2017-04-02 22:09:24 +0200,Mountain Time (US & Canada),research,https://www.inaturalist.org/observations/5555560,https://inaturalist-open-data.s3.amazonaws.com/photos/6858280/medium.jpg,,2,0,FALSE,"18013 Bollinger Canyon Rd, Moraga, CA, US",37.81907,-122.0528028,,,,Contra Costa,bird's-eye speedwell,Veronica persica,bird's-eye speedwell,Plantae,55666,Plantaginaceae,Veronica,Veronica persica
5555656,4/2/17,2017-04-02 22:53:10 +0200,Mountain Time (US & Canada),research,https://www.inaturalist.org/observations/5555656,https://inaturalist-open-data.s3.amazonaws.com/photos/6858402/medium.jpg,,1,0,FALSE,"18013 Bollinger Canyon Rd, Moraga, CA, US",37.82066667,-122.0544055,,,,Contra Costa,Western Blue-eyed Grass,Sisyrinchium bellum,western blue-eyed grass,Plantae,49918,Iridaceae,Sisyrinchium,Sisyrinchium bellum
5555835,4/2/17,2017-04-02 23:21:41 +0200,Mountain Time (US & Canada),research,https://www.inaturalist.org/observations/5555835,https://inaturalist-open-data.s3.amazonaws.com/photos/6858674/medium.jpg,,2,0,FALSE,"94549, Lafayette, CA, US",37.82386667,-122.0600362,,,,Contra Costa,Redmaids,Calandrinia menziesii,redmaids,Plantae,400267,Montiaceae,Calandrinia,Calandrinia menziesii
5555875,4/2/17,2017-04-02 23:35:22 +0200,Mountain Time (US & Canada),research,https://www.inaturalist.org/observations/5555875,https://inaturalist-open-data.s3.amazonaws.com/photos/6866199/medium.jpg,,1,0,FALSE,"94549, Lafayette, CA, US",37.824875,-122.0586083,,,,Contra Costa,black sage,Salvia mellifera,black sage,Plantae,50643,Lamiaceae,Salvia,Salvia mellifera
5561132,4/2/17,2017-04-02 23:38:29 +0200,Mountain Time (US & Canada),research,https://www.inaturalist.org/observations/5561132,https://inaturalist-open-data.s3.amazonaws.com/photos/6866209/medium.jpg,,1,0,FALSE,"94549, Lafayette, CA, US",37.82496667,-122.0583722,,,,Contra Costa,Common Vetch,Vicia sativa,Common Vetch,Plantae,53324,Fabaceae,Vicia,Vicia sativa
5561134,4/2/17,2017-04-02 23:39:36 +0200,Mountain Time (US & Canada),research,https://www.inaturalist.org/observations/5561134,https://inaturalist-open-data.s3.amazonaws.com/photos/6866217/medium.jpg,,1,0,FALSE,"94549, Lafayette, CA, US",37.82543833,-122.0584333,,,,Contra Costa,Hairy Vetch,Vicia villosa,hairy vetch,Plantae,57317,Fabaceae,Vicia,Vicia villosa
5561137,4/2/17,2017-04-02 23:41:20 +0200,Mountain Time (US & Canada),research,https://www.inaturalist.org/observations/5561137,https://inaturalist-open-data.s3.amazonaws.com/photos/6866231/medium.jpg,,1,0,FALSE,"94549, Lafayette, CA, US",37.825375,-122.0581445,,,,Contra Costa,Fremont's Deathcamas,Toxicoscordion fremontii,Common star lily,Plantae,49649,Melanthiaceae,Toxicoscordion,Toxicoscordion fremontii
5561145,4/2/17,2017-04-02 23:43:24 +0200,Mountain Time (US & Canada),research,https://www.inaturalist.org/observations/5561145,https://inaturalist-open-data.s3.amazonaws.com/photos/6866237/medium.jpg,,1,0,FALSE,"94549, Lafayette, CA, US",37.82537,-122.0579305,,,,Contra Costa,California Poppy,Eschscholzia californica,California poppy,Plantae,48225,Papaveraceae,Eschscholzia,Eschscholzia californica
5561150,4/2/17,2017-04-02 23:50:51 +0200,Mountain Time (US & Canada),research,https://www.inaturalist.org/observations/5561150,https://inaturalist-open-data.s3.amazonaws.com/photos/6866243/medium.jpg,,2,0,FALSE,"94549, Lafayette, CA, US",37.8261,-122.0576388,,,,Contra Costa,Pimpernel,Lysimachia arvensis,scarlet pimpernel,Plantae,791928,Primulaceae,Lysimachia,Lysimachia arvensis
5561161,4/2/17,2017-04-02 23:52:43 +0200,Mountain Time (US & Canada),research,https://www.inaturalist.org/observations/5561161,https://inaturalist-open-data.s3.amazonaws.com/photos/6866247/medium.jpg,,2,0,FALSE,"94549, Lafayette, CA, US",37.82605333,-122.0576388,,,,Contra Costa,slender woolly-marbles,Psilocarphus tenellus,slender woolly-marbles,Plantae,53188,Asteraceae,Psilocarphus,Psilocarphus tenellus
5561166,4/2/17,2017-04-02 23:56:12 +0200,Mountain Time (US & Canada),research,https://www.inaturalist.org/observations/5561166,https://inaturalist-open-data.s3.amazonaws.com/photos/6866256/medium.jpg,,1,0,FALSE,"94549, Lafayette, CA, US",37.82648333,-122.058,,,,Contra Costa,tomcat clover,Trifolium willdenovii,tomcat clover,Plantae,57081,Fabaceae,Trifolium,Trifolium willdenovii
5561173,4/2/17,2017-04-03 00:15:07 +0200,Mountain Time (US & Canada),research,https://www.inaturalist.org/observations/5561173,https://inaturalist-open-data.s3.amazonaws.com/photos/6866275/medium.jpg,,2,0,FALSE,"94549, Lafayette, CA, US",37.829005,-122.0609278,,,,Contra Costa,Coffeeberry,Frangula californica,coffeeberry,Plantae,53423,Rhamnaceae,Frangula,Frangula californica
5561175,4/2/17,2017-04-03 00:16:28 +0200,Mountain Time (US & Canada),research,https://www.inaturalist.org/observations/5561175,https://inaturalist-open-data.s3.amazonaws.com/photos/6866279/medium.jpg,,2,0,FALSE,"94549, Lafayette, CA, US",37.82918,-122.0612112,,,,Contra Costa,Pacific madrone,Arbutus menziesii,Pacific madrone,Plantae,51046,Ericaceae,Arbutus,Arbutus menziesii
5561345,4/2/17,2017-04-03 03:15:55 +0200,Mountain Time (US & Canada),research,https://www.inaturalist.org/observations/5561345,https://inaturalist-open-data.s3.amazonaws.com/photos/6866613/medium.jpg,,2,0,FALSE,"94549, Lafayette, CA, US",37.82258667,-122.0594333,,,,Contra Costa,woolly clover,Trifolium tomentosum,woolly clover,Plantae,61024,Fabaceae,Trifolium,Trifolium tomentosum
5634095,4/9/17,2017-04-09 21:33:00 +0200,Pacific Time (US & Canada),research,https://www.inaturalist.org/observations/5634095,https://inaturalist-open-data.s3.amazonaws.com/photos/6969656/medium.jpeg,,1,0,FALSE,"Alamo, CA, USA",37.81586111,-122.0459583,,,,Contra Costa,Black Sage,Salvia mellifera,black sage,Plantae,50643,Lamiaceae,Salvia,Salvia mellifera
5634096,4/9/17,2017-04-09 21:41:00 +0200,Pacific Time (US & Canada),research,https://www.inaturalist.org/observations/5634096,https://inaturalist-open-data.s3.amazonaws.com/photos/6969663/medium.jpeg,,1,0,FALSE,"Alamo, CA, USA",37.81593333,-122.0452806,,,,Contra Costa,Fremont's Deathcamas,Toxicoscordion fremontii,Common star lily,Plantae,49649,Melanthiaceae,Toxicoscordion,Toxicoscordion fremontii
5634098,4/9/17,2017-04-09 21:44:00 +0200,Pacific Time (US & Canada),research,https://www.inaturalist.org/observations/5634098,https://inaturalist-open-data.s3.amazonaws.com/photos/6969667/medium.jpeg,,2,0,FALSE,"Alamo, CA, USA",37.81621944,-122.0454111,,,,Contra Costa,Chamise,Adenostoma fasciculatum,chamise,Plantae,47146,Rosaceae,Adenostoma,Adenostoma fasciculatum
5634101,4/9/17,2017-04-09 22:14:00 +0200,Pacific Time (US & Canada),research,https://www.inaturalist.org/observations/5634101,https://inaturalist-open-data.s3.amazonaws.com/photos/6969680/medium.jpeg,,1,0,FALSE,"Las Trampas Regional Wilderness, Contra Costa, California, United States",37.81960556,-122.0461722,,,,Contra Costa,Dot-seed Plantain,Plantago erecta,dot-seed plantain,Plantae,53177,Plantaginaceae,Plantago,Plantago erecta
5634103,4/9/17,2017-04-09 22:39:00 +0200,Pacific Time (US & Canada),research,https://www.inaturalist.org/observations/5634103,https://inaturalist-open-data.s3.amazonaws.com/photos/6969687/medium.jpeg,,1,0,FALSE,"Las Trampas Regional Wilderness, Contra Costa, California, United States",37.82118889,-122.0452944,,,,Contra Costa,Longhorn Seablush,Plectritis macrocera,Longhorn Seablush,Plantae,57287,Caprifoliaceae,Plectritis,Plectritis macrocera
5634108,4/9/17,2017-04-09 23:10:00 +0200,Pacific Time (US & Canada),research,https://www.inaturalist.org/observations/5634108,https://inaturalist-open-data.s3.amazonaws.com/photos/6969705/medium.jpeg,,1,0,FALSE,"Las Trampas Regional Wilderness, Contra Costa, California, United States",37.81889722,-122.0393917,,,,Contra Costa,baby-blue-eyes,Nemophila menziesii,Menzies' baby blue eyes,Plantae,50648,Boraginaceae,Nemophila,Nemophila menziesii
5634110,4/9/17,2017-04-09 23:22:00 +0200,Pacific Time (US & Canada),research,https://www.inaturalist.org/observations/5634110,https://inaturalist-open-data.s3.amazonaws.com/photos/6969710/medium.jpeg,,1,0,FALSE,"Las Trampas Regional Wilderness, Contra Costa, California, United States",37.81795556,-122.0379194,,,,Contra Costa,valley tassels,Castilleja attenuata,valley tassels,Plantae,49341,Orobanchaceae,Castilleja,Castilleja attenuata
5634124,4/9/17,2017-04-09 21:38:24 +0200,Pacific Time (US & Canada),research,https://www.inaturalist.org/observations/5634124,https://inaturalist-open-data.s3.amazonaws.com/photos/6969808/medium.jpg,,1,0,FALSE,"18013 Bollinger Canyon Rd, San Ramon, CA, US",37.81546167,-122.0454638,,,,Contra Costa,Blow Wives,Achyrachaena mollis,Blow Wives,Plantae,56852,Asteraceae,Achyrachaena,Achyrachaena mollis
5634147,4/9/17,2017-04-09 21:45:06 +0200,Pacific Time (US & Canada),research,https://www.inaturalist.org/observations/5634147,https://inaturalist-open-data.s3.amazonaws.com/photos/6969859/medium.jpg,,1,0,FALSE,"18013 Bollinger Canyon Rd, San Ramon, CA, US",37.81623833,-122.0454638,,,,Contra Costa,silverpuffs,Uropappus lindleyi,silverpuffs,Plantae,50806,Asteraceae,Uropappus,Uropappus lindleyi
5634210,4/9/17,2017-04-09 23:52:28 +0200,Pacific Time (US & Canada),research,https://www.inaturalist.org/observations/5634210,https://static.inaturalist.org/photos/6969885/medium.jpg,,2,0,FALSE,"94549, Lafayette, CA, US",37.82620333,-122.0577695,,,,Contra Costa,orange bush monkeyflower,Diplacus aurantiacus,orange bush monkeyflower,Plantae,777371,Phrymaceae,Diplacus,Diplacus aurantiacus
5634241,4/9/17,2017-04-09 22:31:17 +0200,Pacific Time (US & Canada),research,https://www.inaturalist.org/observations/5634241,https://inaturalist-open-data.s3.amazonaws.com/photos/6969953/medium.jpg,,1,0,FALSE,"94549, Lafayette, CA, US",37.82116333,-122.0459528,,,,Contra Costa,blue skullcap,Scutellaria tuberosa,blue skullcap,Plantae,57122,Lamiaceae,Scutellaria,Scutellaria tuberosa
5634289,4/9/17,2017-04-10 00:41:40 +0200,Pacific Time (US & Canada),research,https://www.inaturalist.org/observations/5634289,https://inaturalist-open-data.s3.amazonaws.com/photos/6970039/medium.jpg,"Oh man, was rushed on the trail and took terrible photos of this. ",1,0,FALSE,"94526, Danville, CA, US",37.81957167,-122.0342555,,,,Contra Costa,fewflower blue-eyed Mary,Collinsia sparsiflora,fewflower blue-eyed Mary,Plantae,50656,Plantaginaceae,Collinsia,Collinsia sparsiflora
5634316,4/9/17,2017-04-09 22:44:00 +0200,Pacific Time (US & Canada),research,https://www.inaturalist.org/observations/5634316,https://inaturalist-open-data.s3.amazonaws.com/photos/6970000/medium.jpeg,,1,0,FALSE,"Alamo, CA, USA",37.82093611,-122.0441083,,,,Contra Costa,Red larkspur,Delphinium nudicaule,Red larkspur,Plantae,50642,Ranunculaceae,Delphinium,Delphinium nudicaule
5634317,4/9/17,2017-04-09 22:45:00 +0200,Pacific Time (US & Canada),research,https://www.inaturalist.org/observations/5634317,https://inaturalist-open-data.s3.amazonaws.com/photos/6970001/medium.jpeg,,1,0,FALSE,"Alamo, CA, USA",37.82095,-122.0441139,,,,Contra Costa,western wallflower,Erysimum capitatum,Western Wallflower,Plantae,50628,Brassicaceae,Erysimum,Erysimum capitatum
5910083,4/22/17,2017-04-22 21:23:57 +0200,Pacific Time (US & Canada),research,https://www.inaturalist.org/observations/5910083,https://inaturalist-open-data.s3.amazonaws.com/photos/7371116/medium.jpg,,2,0,FALSE,"94549, Lafayette, CA, US",37.82487833,-122.0585555,,,,Contra Costa,Common Catchfly,Silene gallica,Small-flowered Catchfly,Plantae,53212,Caryophyllaceae,Silene,Silene gallica
5913818,4/22/17,2017-04-23 00:01:28 +0200,Pacific Time (US & Canada),research,https://www.inaturalist.org/observations/5913818,https://inaturalist-open-data.s3.amazonaws.com/photos/7376756/medium.jpg,,2,0,FALSE,"94556, Moraga, CA, US",37.82125833,-122.056825,,,,Contra Costa,milkmaids,Cardamine californica,milkmaids,Plantae,49651,Brassicaceae,Cardamine,Cardamine californica
6116693,5/6/17,2017-05-07 00:35:31 +0200,Pacific Time (US & Canada),research,https://www.inaturalist.org/observations/6116693,https://inaturalist-open-data.s3.amazonaws.com/photos/7656415/medium.jpeg,,1,0,FALSE,"Las Trampas Regional Wilderness, Contra Costa County, US-CA, US",37.82058779,-122.0536515,5,,,Contra Costa,Mediterranean lineseed,Bellardia trixago,Mediterranean lineseed,Plantae,51286,Orobanchaceae,Bellardia,Bellardia trixago
6116858,5/6/17,2017-05-07 00:35:09 +0200,Pacific Time (US & Canada),research,https://www.inaturalist.org/observations/6116858,https://inaturalist-open-data.s3.amazonaws.com/photos/7656422/medium.jpeg,,2,0,FALSE,"Las Trampas Regional Wilderness, Contra Costa County, US-CA, US",37.82063432,-122.053616,6,,,Contra Costa,Western Blue-eyed Grass,Sisyrinchium bellum,western blue-eyed grass,Plantae,49918,Iridaceae,Sisyrinchium,Sisyrinchium bellum
6116881,5/6/17,2017-05-07 00:48:10 +0200,Pacific Time (US & Canada),research,https://www.inaturalist.org/observations/6116881,https://inaturalist-open-data.s3.amazonaws.com/photos/7661766/medium.jpeg,,1,0,FALSE,"1221 Bollinger Canyon Road Moraga, CA 94556",37.8226806,-122.0579089,6,,,Contra Costa,Common Vetch,Vicia sativa,Common Vetch,Plantae,53324,Fabaceae,Vicia,Vicia sativa
6120337,5/6/17,2017-05-07 00:47:07 +0200,Pacific Time (US & Canada),research,https://www.inaturalist.org/observations/6120337,https://inaturalist-open-data.s3.amazonaws.com/photos/7661775/medium.jpeg,,1,0,FALSE,"1219 Bollinger Canyon Road Moraga, CA 94556",37.8227239,-122.057958,8,,,Contra Costa,bigleaf maple,Acer macrophyllum,bigleaf maple,Plantae,48227,Sapindaceae,Acer,Acer macrophyllum
6136320,5/6/17,2017-05-07 00:17:00 +0200,Pacific Time (US & Canada),research,https://www.inaturalist.org/observations/6136320,https://inaturalist-open-data.s3.amazonaws.com/photos/7686940/medium.jpg,,1,0,FALSE,"Las Trampas Regional Wilderness, Contra Costa, California, United States",37.81584833,-122.0463333,,,,Contra Costa,hairy vetch,Vicia villosa,hairy vetch,Plantae,57317,Fabaceae,Vicia,Vicia villosa
6136322,5/6/17,2017-05-07 00:17:00 +0200,Pacific Time (US & Canada),research,https://www.inaturalist.org/observations/6136322,https://inaturalist-open-data.s3.amazonaws.com/photos/7686945/medium.jpg,,1,0,FALSE,"Las Trampas Regional Wilderness, Contra Costa, California, United States",37.81586667,-122.046435,,,,Contra Costa,Italian thistle,Carduus pycnocephalus,Italian thistle,Plantae,52990,Asteraceae,Carduus,Carduus pycnocephalus
7381105,5/28/17,2017-05-28 21:53:42 +0200,Pacific Time (US & Canada),research,https://www.inaturalist.org/observations/7381105,https://static.inaturalist.org/photos/9577488/medium.jpg,,2,0,FALSE,"Las Trampas Regional Wilderness, San Ramon, CA, US",37.81561362,-122.0426075,1375,,,Contra Costa,Ithuriel's Spear,Triteleia laxa,Ithuriel's Spear,Plantae,51085,Asparagaceae,Triteleia,Triteleia laxa
6799679,6/25/17,2017-06-25 22:12:00 +0200,Pacific Time (US & Canada),research,https://www.inaturalist.org/observations/6799679,https://static.inaturalist.org/photos/8649782/medium.jpg,,1,0,FALSE,"Contra Costa County, CA, USA",37.81568324,-122.0550585,122,,,Contra Costa,Elegant Clarkia,Clarkia unguiculata,Elegant Clarkia,Plantae,51735,Onagraceae,Clarkia,Clarkia unguiculata
6827113,6/27/17,2017-06-27 23:31:27 +0200,Pacific Time (US & Canada),research,https://www.inaturalist.org/observations/6827113,https://static.inaturalist.org/photos/8691426/medium.jpg,,2,0,FALSE,"Las Trampas Regional Wilderness, Contra Costa County, US-CA, US",37.81706266,-122.0439432,10,,,Contra Costa,California Dutchman's Pipe,Aristolochia californica,California Dutchman's Pipe,Plantae,55190,Aristolochiaceae,Aristolochia,Aristolochia californica
6827158,6/27/17,2017-06-27 23:31:46 +0200,Pacific Time (US & Canada),research,https://www.inaturalist.org/observations/6827158,https://static.inaturalist.org/photos/8691637/medium.jpg,,2,0,FALSE,"Las Trampas Regional Wilderness, Contra Costa County, US-CA, US",37.8170847,-122.0439749,5,,,Contra Costa,trailing blackberry,Rubus ursinus,trailing blackberry,Plantae,53445,Rosaceae,Rubus,Rubus ursinus
6827285,6/27/17,2017-06-27 23:39:17 +0200,Pacific Time (US & Canada),research,https://www.inaturalist.org/observations/6827285,https://static.inaturalist.org/photos/8691639/medium.jpg,,1,0,FALSE,"Las Trampas Regional Wilderness, San Ramon, CA, US",37.81700063,-122.0415056,5,,,Contra Costa,orange bush monkeyflower,Diplacus aurantiacus,orange bush monkeyflower,Plantae,777371,Phrymaceae,Diplacus,Diplacus aurantiacus
6827287,6/27/17,2017-06-27 23:39:25 +0200,Pacific Time (US & Canada),research,https://www.inaturalist.org/observations/6827287,https://static.inaturalist.org/photos/8691643/medium.jpg,,1,0,FALSE,"Las Trampas Regional Wilderness, San Ramon, CA, US",37.81703424,-122.0415009,5,,,Contra Costa,Black Sage,Salvia mellifera,black sage,Plantae,50643,Lamiaceae,Salvia,Salvia mellifera
6827288,6/27/17,2017-06-27 23:40:15 +0200,Pacific Time (US & Canada),research,https://www.inaturalist.org/observations/6827288,https://static.inaturalist.org/photos/8691649/medium.jpg,,2,0,FALSE,"Las Trampas Regional Wilderness, San Ramon, CA, US",37.8170948,-122.0415442,5,,,Contra Costa,chamise,Adenostoma fasciculatum,chamise,Plantae,47146,Rosaceae,Adenostoma,Adenostoma fasciculatum
6827293,6/27/17,2017-06-27 23:43:12 +0200,Pacific Time (US & Canada),research,https://www.inaturalist.org/observations/6827293,https://static.inaturalist.org/photos/8691651/medium.jpg,,2,0,FALSE,"Las Trampas Regional Wilderness, San Ramon, CA, US",37.81744449,-122.0404238,5,,,Contra Costa,bristly dogtail grass,Cynosurus echinatus,bristly dogtail grass,Plantae,47695,Poaceae,Cynosurus,Cynosurus echinatus
6827297,6/27/17,2017-06-27 23:46:25 +0200,Pacific Time (US & Canada),research,https://www.inaturalist.org/observations/6827297,https://static.inaturalist.org/photos/8691654/medium.jpg,,2,0,FALSE,"Las Trampas Regional Wilderness, San Ramon, CA, US",37.81823855,-122.0400839,5,,,Contra Costa,milk thistle,Silybum marianum,milk thistle,Plantae,52586,Asteraceae,Silybum,Silybum marianum
6827320,6/27/17,2017-06-27 23:59:25 +0200,Pacific Time (US & Canada),research,https://www.inaturalist.org/observations/6827320,https://static.inaturalist.org/photos/8691802/medium.jpg,,1,0,FALSE,"Las Trampas Regional Wilderness, Lafayette, CA, US",37.82046353,-122.042672,5,,,Contra Costa,orange bush monkeyflower,Diplacus aurantiacus,orange bush monkeyflower,Plantae,777371,Phrymaceae,Diplacus,Diplacus aurantiacus
6827358,6/27/17,2017-06-28 00:02:52 +0200,Pacific Time (US & Canada),research,https://www.inaturalist.org/observations/6827358,https://static.inaturalist.org/photos/8691912/medium.jpg,,1,0,FALSE,"Las Trampas Regional Wilderness, Lafayette, CA, US",37.82073074,-122.0434546,5,,,Contra Costa,Elegant Clarkia,Clarkia unguiculata,Elegant Clarkia,Plantae,51735,Onagraceae,Clarkia,Clarkia unguiculata
6827411,6/27/17,2017-06-28 00:06:41 +0200,Pacific Time (US & Canada),research,https://www.inaturalist.org/observations/6827411,https://static.inaturalist.org/photos/8691914/medium.jpg,,2,0,FALSE,"Las Trampas Regional Wilderness, Lafayette, CA, US",37.82115533,-122.0452967,5,,,Contra Costa,deerweed,Acmispon glaber,deerweed,Plantae,53134,Fabaceae,Acmispon,Acmispon glaber
6827413,6/27/17,2017-06-28 00:07:28 +0200,Pacific Time (US & Canada),research,https://www.inaturalist.org/observations/6827413,https://static.inaturalist.org/photos/8691917/medium.jpg,,2,0,FALSE,"Las Trampas Regional Wilderness, Lafayette, CA, US",37.82112218,-122.0453759,5,,,Contra Costa,chamise,Adenostoma fasciculatum,chamise,Plantae,47146,Rosaceae,Adenostoma,Adenostoma fasciculatum
6827419,6/27/17,2017-06-28 00:08:48 +0200,Pacific Time (US & Canada),research,https://www.inaturalist.org/observations/6827419,https://static.inaturalist.org/photos/8691920/medium.jpg,,1,0,FALSE,"Las Trampas Regional Wilderness, Lafayette, CA, US",37.82126031,-122.0458495,5,,,Contra Costa,Coast Live Oak,Quercus agrifolia,coast live oak,Plantae,47850,Fagaceae,Quercus,Quercus agrifolia
6827512,6/27/17,2017-06-28 00:25:09 +0200,Pacific Time (US & Canada),research,https://www.inaturalist.org/observations/6827512,https://static.inaturalist.org/photos/8692094/medium.jpg,,1,0,FALSE,"Las Trampas Regional Wilderness, Lafayette, CA, US",37.82446136,-122.0518234,5,,,Contra Costa,California Cudweed,Pseudognaphalium californicum,California cudweed,Plantae,53077,Asteraceae,Pseudognaphalium,Pseudognaphalium californicum
6829092,6/27/17,2017-06-28 00:33:08 +0200,Pacific Time (US & Canada),research,https://www.inaturalist.org/observations/6829092,https://static.inaturalist.org/photos/8694469/medium.jpg,,2,0,FALSE,"94549, Lafayette, CA, US",37.82564686,-122.056093,5,,,Contra Costa,California Black Oak,Quercus kelloggii,California black oak,Plantae,49919,Fagaceae,Quercus,Quercus kelloggii
6829131,6/27/17,2017-06-27 23:43:23 +0200,Pacific Time (US & Canada),research,https://www.inaturalist.org/observations/6829131,https://inaturalist-open-data.s3.amazonaws.com/photos/8694520/medium.jpg,,3,0,FALSE,"Las Trampas Regional Wilderness, Contra Costa County, US-CA, US",37.81741738,-122.0404962,5,,,Contra Costa,bristly dogtail grass,Cynosurus echinatus,bristly dogtail grass,Plantae,47695,Poaceae,Cynosurus,Cynosurus echinatus
6829160,6/27/17,2017-06-28 00:10:53 +0200,Pacific Time (US & Canada),research,https://www.inaturalist.org/observations/6829160,https://inaturalist-open-data.s3.amazonaws.com/photos/8694556/medium.jpeg,,1,0,FALSE,"Las Trampas Regional Wilderness, Contra Costa County, US-CA, US",37.82098635,-122.0462902,9,,,Contra Costa,ruby chalice clarkia,Clarkia rubicunda,ruby chalice clarkia,Plantae,57148,Onagraceae,Clarkia,Clarkia rubicunda
6829165,6/27/17,2017-06-28 01:38:12 +0200,Pacific Time (US & Canada),research,https://www.inaturalist.org/observations/6829165,https://inaturalist-open-data.s3.amazonaws.com/photos/8694565/medium.jpeg,,1,0,FALSE,"Las Trampas Regional Wilderness, Contra Costa County, US-CA, US",37.81595997,-122.0484566,5,,,Contra Costa,round-leaved fluellin,Kickxia spuria,round-leaved fluellen,Plantae,64191,Plantaginaceae,Kickxia,Kickxia spuria
6830105,6/27/17,2017-06-28 01:38:13 +0200,Pacific Time (US & Canada),research,https://www.inaturalist.org/observations/6830105,https://static.inaturalist.org/photos/8697715/medium.jpg,,2,0,FALSE,"Las Trampas Regional Wilderness, Contra Costa County, US-CA, US",37.81599815,-122.0483602,5,,,Contra Costa,Eiblttriges Schlangenmaul,Kickxia spuria,round-leaved fluellen,Plantae,64191,Plantaginaceae,Kickxia,Kickxia spuria
6830932,6/27/17,2017-06-28 01:38:55 +0200,Pacific Time (US & Canada),research,https://www.inaturalist.org/observations/6830932,https://static.inaturalist.org/photos/8697716/medium.jpg,,2,0,FALSE,"Las Trampas Regional Wilderness, Contra Costa County, US-CA, US",37.81598642,-122.0484117,5,,,Contra Costa,Stinkwort,Dittrichia graveolens,Stinkwort,Plantae,58822,Asteraceae,Dittrichia,Dittrichia graveolens
6830933,6/27/17,2017-06-28 01:39:58 +0200,Pacific Time (US & Canada),research,https://www.inaturalist.org/observations/6830933,https://static.inaturalist.org/photos/8697720/medium.jpg,,2,0,FALSE,"Las Trampas Regional Wilderness, Contra Costa County, US-CA, US",37.81583601,-122.048225,5,,,Contra Costa,puncture vine,Tribulus terrestris,puncture vine,Plantae,64238,Zygophyllaceae,Tribulus,Tribulus terrestris
7208190,6/27/17,2017-06-27 22:04:00 +0200,Pacific Time (US & Canada),research,https://www.inaturalist.org/observations/7208190,https://inaturalist-open-data.s3.amazonaws.com/photos/9299359/medium.jpg,,1,0,FALSE,"Alameda County, CA, USA",37.79650315,-122.0595345,,,,Alameda,Artichoke Thistle,Cynara cardunculus,Artichoke Thistle,Plantae,57563,Asteraceae,Cynara,Cynara cardunculus
7208191,6/27/17,2017-06-27 22:04:00 +0200,Pacific Time (US & Canada),research,https://www.inaturalist.org/observations/7208191,https://inaturalist-open-data.s3.amazonaws.com/photos/9299365/medium.jpg,,1,0,FALSE,"Alameda County, CA, USA",37.79652012,-122.059549,,,,Alameda,Artichoke Thistle,Cynara cardunculus,Artichoke Thistle,Plantae,57563,Asteraceae,Cynara,Cynara cardunculus
7270164,7/29/17,2017-07-29 20:58:00 +0200,Pacific Time (US & Canada),research,https://www.inaturalist.org/observations/7270164,https://inaturalist-open-data.s3.amazonaws.com/photos/9397625/medium.jpg,,1,0,FALSE,"Alamo, CA, USA",37.81459927,-122.0462925,,,,Contra Costa,spiny cocklebur,Xanthium spinosum,spiny cocklebur,Plantae,58045,Asteraceae,Xanthium,Xanthium spinosum
7270165,7/29/17,2017-07-29 20:58:00 +0200,Pacific Time (US & Canada),research,https://www.inaturalist.org/observations/7270165,https://inaturalist-open-data.s3.amazonaws.com/photos/9397634/medium.jpg,,1,0,FALSE,"Las Trampas Regional Wilderness, Contra Costa, California, United States",37.81471853,-122.0464877,,,,Contra Costa,Turkey Mullein,Croton setiger,turkey mullein,Plantae,154156,Euphorbiaceae,Croton,Croton setiger
7270167,7/29/17,2017-07-29 21:00:00 +0200,Pacific Time (US & Canada),research,https://www.inaturalist.org/observations/7270167,https://inaturalist-open-data.s3.amazonaws.com/photos/9397644/medium.jpg,,2,0,FALSE,"Las Trampas Regional Wilderness, Contra Costa, California, United States",37.81546863,-122.0469066,,,,Contra Costa,field bindweed,Convolvulus arvensis,field bindweed,Plantae,53021,Convolvulaceae,Convolvulus,Convolvulus arvensis
7270170,7/29/17,2017-07-29 21:05:00 +0200,Pacific Time (US & Canada),research,https://www.inaturalist.org/observations/7270170,https://inaturalist-open-data.s3.amazonaws.com/photos/9397662/medium.jpg,,2,0,FALSE,"Las Trampas Regional Wilderness, Contra Costa, California, United States",37.81551423,-122.0461756,,,,Contra Costa,Yellow Starthistle,Centaurea solstitialis,Yellow Star-Thistle,Plantae,52588,Asteraceae,Centaurea,Centaurea solstitialis
7270171,7/29/17,2017-07-29 21:06:00 +0200,Pacific Time (US & Canada),research,https://www.inaturalist.org/observations/7270171,https://inaturalist-open-data.s3.amazonaws.com/photos/9397663/medium.jpg,,1,0,FALSE,"Las Trampas Regional Wilderness, Contra Costa, California, United States",37.81587448,-122.0458544,,,,Contra Costa,milk thistle,Silybum marianum,milk thistle,Plantae,52586,Asteraceae,Silybum,Silybum marianum
7270177,7/29/17,2017-07-29 21:13:00 +0200,Pacific Time (US & Canada),research,https://www.inaturalist.org/observations/7270177,https://inaturalist-open-data.s3.amazonaws.com/photos/9397668/medium.jpg,,1,0,FALSE,"Las Trampas Regional Wilderness, Contra Costa, California, United States",37.81690923,-122.0455449,,,,Contra Costa,Pearly Everlasting,Anaphalis margaritacea,pearly everlasting,Plantae,52833,Asteraceae,Anaphalis,Anaphalis margaritacea
7270179,7/29/17,2017-07-29 21:14:00 +0200,Pacific Time (US & Canada),research,https://www.inaturalist.org/observations/7270179,https://inaturalist-open-data.s3.amazonaws.com/photos/9397676/medium.jpg,,1,0,FALSE,"Las Trampas Regional Wilderness, Contra Costa, California, United States",37.81720553,-122.0453871,,,,Contra Costa,orange bush monkeyflower,Diplacus aurantiacus,orange bush monkeyflower,Plantae,777371,Phrymaceae,Diplacus,Diplacus aurantiacus
7270182,7/29/17,2017-07-29 21:17:00 +0200,Pacific Time (US & Canada),research,https://www.inaturalist.org/observations/7270182,https://inaturalist-open-data.s3.amazonaws.com/photos/9397682/medium.jpg,,1,0,FALSE,"Las Trampas Regional Wilderness, Contra Costa, California, United States",37.81799972,-122.0453341,,,,Contra Costa,Black Sage,Salvia mellifera,black sage,Plantae,50643,Lamiaceae,Salvia,Salvia mellifera
7270190,7/29/17,2017-07-29 21:34:00 +0200,Pacific Time (US & Canada),research,https://www.inaturalist.org/observations/7270190,https://inaturalist-open-data.s3.amazonaws.com/photos/9397696/medium.jpg,,1,0,FALSE,"Las Trampas Regional Wilderness, Contra Costa, California, United States",37.82206778,-122.0491511,,,,Contra Costa,Pacific Poison Oak,Toxicodendron diversilobum,Pacific poison oak,Plantae,51080,Anacardiaceae,Toxicodendron,Toxicodendron diversilobum
7270195,7/29/17,2017-07-29 21:40:00 +0200,Pacific Time (US & Canada),research,https://www.inaturalist.org/observations/7270195,https://inaturalist-open-data.s3.amazonaws.com/photos/9397703/medium.jpg,,1,0,FALSE,"Las Trampas Regional Wilderness, Contra Costa, California, United States",37.82435722,-122.0517237,,,,Contra Costa,blue elder,Sambucus cerulea,blue elder,Plantae,143799,Viburnaceae,Sambucus,Sambucus cerulea
7270205,7/29/17,2017-07-29 22:02:00 +0200,Pacific Time (US & Canada),research,https://www.inaturalist.org/observations/7270205,https://inaturalist-open-data.s3.amazonaws.com/photos/9397719/medium.jpg,,1,0,FALSE,"Las Trampas Regional Wilderness, Contra Costa, California, United States",37.82609387,-122.0508341,,,,Contra Costa,California Sagebrush,Artemisia californica,California sagebrush,Plantae,53357,Asteraceae,Artemisia,Artemisia californica
7270211,7/29/17,2017-07-29 21:05:00 +0200,Pacific Time (US & Canada),research,https://www.inaturalist.org/observations/7270211,https://inaturalist-open-data.s3.amazonaws.com/photos/9397728/medium.jpg,,2,0,FALSE,"Alamo, CA, USA",37.81582462,-122.0460358,,,,Contra Costa,deerweed,Acmispon glaber,deerweed,Plantae,53134,Fabaceae,Acmispon,Acmispon glaber
7306699,7/29/17,2017-07-29 22:05:43 +0200,Pacific Time (US & Canada),research,https://www.inaturalist.org/observations/7306699,https://inaturalist-open-data.s3.amazonaws.com/photos/9457130/medium.jpg,,1,0,FALSE,"94549, Lafayette, CA, US",37.82537,-122.0514,,,,Contra Costa,Bigleaf Maple,Acer macrophyllum,bigleaf maple,Plantae,48227,Sapindaceae,Acer,Acer macrophyllum
7363397,8/5/17,2017-08-05 19:17:42 +0200,Pacific Time (US & Canada),research,https://www.inaturalist.org/observations/7363397,https://inaturalist-open-data.s3.amazonaws.com/photos/9548118/medium.jpg,,1,0,FALSE,"94507, Alamo, CA, US",37.83646667,-122.0371472,,,,Contra Costa,roughleaf aster,Eurybia radulina,roughleaf aster,Plantae,52974,Asteraceae,Eurybia,Eurybia radulina
7397121,8/5/17,2017-08-06 01:43:46 +0200,Pacific Time (US & Canada),research,https://www.inaturalist.org/observations/7397121,https://inaturalist-open-data.s3.amazonaws.com/photos/9604029/medium.jpg,,2,0,FALSE,"94507, Alamo, CA, US",37.82902833,-122.0363612,,,,Contra Costa,Yellow Starthistle,Centaurea solstitialis,Yellow Star-Thistle,Plantae,52588,Asteraceae,Centaurea,Centaurea solstitialis
7712023,8/29/17,2017-08-30 03:46:37 +0200,Pacific Time (US & Canada),research,https://www.inaturalist.org/observations/7712023,https://static.inaturalist.org/photos/10113636/medium.jpg,,1,0,FALSE,"Las Trampas Regional Wilderness, San Ramon, CA, US",37.81551265,-122.0428084,1800,,,Contra Costa,Yellow Starthistle,Centaurea solstitialis,Yellow Star-Thistle,Plantae,52588,Asteraceae,Centaurea,Centaurea solstitialis
7712032,8/29/17,2017-08-30 03:56:30 +0200,Pacific Time (US & Canada),research,https://www.inaturalist.org/observations/7712032,https://static.inaturalist.org/photos/10113648/medium.jpg,,2,0,FALSE,"Las Trampas Regional Wilderness, San Ramon, CA, US",37.81604891,-122.0428576,894,,,Contra Costa,common water hyacinth,Pontederia crassipes,common water hyacinth,Plantae,962637,Pontederiaceae,Pontederia,Pontederia crassipes
7712071,8/29/17,2017-08-30 03:57:05 +0200,Pacific Time (US & Canada),research,https://www.inaturalist.org/observations/7712071,https://static.inaturalist.org/photos/10113688/medium.jpg,,2,0,FALSE,"Las Trampas Regional Wilderness, San Ramon, CA, US",37.81611499,-122.0433956,982,,,Contra Costa,bull thistle,Cirsium vulgare,Bull Thistle,Plantae,52989,Asteraceae,Cirsium,Cirsium vulgare
8266530,10/4/17,2017-10-04 20:21:17 +0200,Pacific Time (US & Canada),research,https://www.inaturalist.org/observations/8266530,https://static.inaturalist.org/photos/10964047/medium.jpg,,1,0,FALSE,"Las Trampas Regional Wilderness, San Ramon, CA, US",37.81497167,-122.0461362,,,,Contra Costa,,Salvia mellifera,black sage,Plantae,50643,Lamiaceae,Salvia,Salvia mellifera
8930617,11/25/17,2017-11-25 20:00:34 +0100,Pacific Time (US & Canada),research,https://www.inaturalist.org/observations/8930617,https://inaturalist-open-data.s3.amazonaws.com/photos/12028972/medium.jpg,,2,0,FALSE,"Lafayette, CA  94549, Lafayette, CA, US",37.82525718,-122.0533631,20,,,Contra Costa,pacific madrone,Arbutus menziesii,Pacific madrone,Plantae,51046,Ericaceae,Arbutus,Arbutus menziesii
9348756,1/1/18,2018-01-01 21:33:11 +0100,Pacific Time (US & Canada),research,https://www.inaturalist.org/observations/9348756,https://static.inaturalist.org/photos/12686905/medium.jpg,,1,0,FALSE,"Las Trampas Regional Wilderness, San Ramon, CA, US",37.81726133,-122.0377761,450,,,Contra Costa,Yellow Starthistle,Centaurea solstitialis,Yellow Star-Thistle,Plantae,52588,Asteraceae,Centaurea,Centaurea solstitialis
9348774,1/1/18,2018-01-01 21:43:51 +0100,Pacific Time (US & Canada),research,https://www.inaturalist.org/observations/9348774,https://static.inaturalist.org/photos/12686962/medium.jpg,,1,0,FALSE,"Las Trampas Regional Wilderness, San Ramon, CA, US",37.81707205,-122.0369493,457,,,Contra Costa,coyote brush,Baccharis pilularis,coyote brush,Plantae,53359,Asteraceae,Baccharis,Baccharis pilularis
9348788,1/1/18,2018-01-01 22:21:24 +0100,Pacific Time (US & Canada),research,https://www.inaturalist.org/observations/9348788,https://static.inaturalist.org/photos/12687019/medium.jpg,,4,0,FALSE,"Las Trampas Regional Wilderness, San Ramon, CA, US",37.81723436,-122.0376339,879,,,Contra Costa,California yerba santa,Eriodictyon californicum,California yerba santa,Plantae,57095,Boraginaceae,Eriodictyon,Eriodictyon californicum
9348832,1/1/18,2018-01-01 21:47:32 +0100,Pacific Time (US & Canada),research,https://www.inaturalist.org/observations/9348832,https://static.inaturalist.org/photos/12687053/medium.jpg,,2,0,FALSE,"Las Trampas Regional Wilderness, San Ramon, CA, US",37.81929552,-122.0410797,182,,,Contra Costa,Toyon,Heteromeles arbutifolia,Toyon,Plantae,53405,Rosaceae,Heteromeles,Heteromeles arbutifolia
9348954,1/1/18,2018-01-01 22:28:00 +0100,Pacific Time (US & Canada),research,https://www.inaturalist.org/observations/9348954,https://static.inaturalist.org/photos/12687235/medium.jpg,,1,0,FALSE,"Las Trampas Regional Wilderness, Lafayette, CA, US",37.82073319,-122.0439552,126,,,Contra Costa,Pacific Madrone,Arbutus menziesii,Pacific madrone,Plantae,51046,Ericaceae,Arbutus,Arbutus menziesii
9544888,1/20/18,2018-01-20 23:09:31 +0100,Pacific Time (US & Canada),research,https://www.inaturalist.org/observations/9544888,https://inaturalist-open-data.s3.amazonaws.com/photos/13021677/medium.jpeg,Further evidence that the one in my.garden is insane: it's back country relatives are *barely* leafing out.,1,0,FALSE,"Las Trampas Regional Wilderness, Contra Costa County, US-CA, US",37.81707245,-122.0445355,8,,,Contra Costa,California Dutchman's Pipe,Aristolochia californica,California Dutchman's Pipe,Plantae,55190,Aristolochiaceae,Aristolochia,Aristolochia californica
9544893,1/20/18,2018-01-20 23:48:05 +0100,Pacific Time (US & Canada),research,https://www.inaturalist.org/observations/9544893,https://inaturalist-open-data.s3.amazonaws.com/photos/13021681/medium.jpeg,,3,0,FALSE,"Alamo, CA, USA",37.81973162,-122.0382893,6,,,Contra Costa,California bay,Umbellularia californica,California bay,Plantae,48807,Lauraceae,Umbellularia,Umbellularia californica
9544924,1/20/18,2018-01-21 00:30:10 +0100,Pacific Time (US & Canada),research,https://www.inaturalist.org/observations/9544924,https://inaturalist-open-data.s3.amazonaws.com/photos/13021719/medium.jpeg,,1,0,FALSE,"Las Trampas Regional Wilderness, Contra Costa County, US-CA, US",37.81769416,-122.034024,4,,,Contra Costa,Chamise,Adenostoma fasciculatum,chamise,Plantae,47146,Rosaceae,Adenostoma,Adenostoma fasciculatum
9547452,1/20/18,2018-01-20 23:05:00 +0100,Pacific Time (US & Canada),research,https://www.inaturalist.org/observations/9547452,https://inaturalist-open-data.s3.amazonaws.com/photos/13025759/medium.jpg,,2,0,FALSE,"Las Trampas Regional Wilderness, Contra Costa County, CA, USA",37.81581167,-122.044705,,,,Contra Costa,Adelinia grande,Adelinia grande,Pacific hound's tongue,Plantae,769151,Boraginaceae,Adelinia,Adelinia grande
9547453,1/20/18,2018-01-20 23:28:00 +0100,Pacific Time (US & Canada),research,https://www.inaturalist.org/observations/9547453,https://inaturalist-open-data.s3.amazonaws.com/photos/13025762/medium.jpg,Only one with open flowers I could find.,2,0,FALSE,"Las Trampas Regional Wilderness, Contra Costa County, CA, USA",37.81713167,-122.041125,,,,Contra Costa,Buckbrush,Ceanothus cuneatus,Buckbrush,Plantae,49673,Rhamnaceae,Ceanothus,Ceanothus cuneatus
9547456,1/20/18,2018-01-21 00:47:00 +0100,Pacific Time (US & Canada),research,https://www.inaturalist.org/observations/9547456,https://inaturalist-open-data.s3.amazonaws.com/photos/13025765/medium.jpg,,1,0,FALSE,"Las Trampas Regional Wilderness, Contra Costa County, CA, USA",37.81916,-122.0403533,,,,Contra Costa,canyon live oak,Quercus chrysolepis,canyon live oak,Plantae,51092,Fagaceae,Quercus,Quercus chrysolepis
9547458,1/20/18,2018-01-21 01:03:00 +0100,Pacific Time (US & Canada),research,https://www.inaturalist.org/observations/9547458,https://inaturalist-open-data.s3.amazonaws.com/photos/13025774/medium.jpg,,1,0,FALSE,"Las Trampas Regional Wilderness, Contra Costa County, CA, USA",37.82107333,-122.0448533,,,,Contra Costa,hillside gooseberry,Ribes californicum,hillside gooseberry,Plantae,47129,Grossulariaceae,Ribes,Ribes californicum
9547461,1/20/18,2018-01-21 01:12:00 +0100,Pacific Time (US & Canada),research,https://www.inaturalist.org/observations/9547461,https://inaturalist-open-data.s3.amazonaws.com/photos/13025783/medium.jpg,"Small, head-high bush/tree. One of two seen, mostly without leaves, this one covered in Disholcaspis plumbella galls.",1,0,FALSE,"Las Trampas Regional Wilderness, Contra Costa County, CA, USA",37.820515,-122.0469617,,,,Contra Costa,California scrub oak,Quercus berberidifolia,California scrub oak,Plantae,57082,Fagaceae,Quercus,Quercus berberidifolia
9559525,1/20/18,2018-01-20 22:58:32 +0100,Pacific Time (US & Canada),research,https://www.inaturalist.org/observations/9559525,https://inaturalist-open-data.s3.amazonaws.com/photos/13046509/medium.jpeg,Italian thistle?,2,0,FALSE,"Chamise Trail, Danville, CA 94526, USA",37.81597519,-122.0450363,,,,Contra Costa,Italian thistle,Carduus pycnocephalus,Italian thistle,Plantae,52990,Asteraceae,Carduus,Carduus pycnocephalus
