id,observed_on,time_observed_at,time_zone,quality_grade,url,image_url,description,num_identification_agreements,num_identification_disagreements,captive_cultivated,place_guess,latitude,longitude,positional_accuracy,geoprivacy,place_town_name,place_county_name,species_guess,scientific_name,common_name,iconic_taxon_name,taxon_id,taxon_family_name,taxon_genus_name,taxon_species_name
2017450,9/30/15,2015-09-30 23:46:09 UTC,Pacific Time (US & Canada),research,http://www.inaturalist.org/observations/2017450,https://inaturalist-open-data.s3.amazonaws.com/photos/2457752/medium.,,1,0,FALSE,"Anthony Chabot Regional Park, Alameda County, US-CA, US",37.76757889,-122.1112321,6,,,Alameda,Stinkwort,Dittrichia graveolens,Stinkwort,Plantae,58822,Asteraceae,Dittrichia,Dittrichia graveolens
2017451,9/30/15,2015-09-30 23:47:12 UTC,Pacific Time (US & Canada),research,http://www.inaturalist.org/observations/2017451,https://inaturalist-open-data.s3.amazonaws.com/photos/2457753/medium.,,1,0,FALSE,"Anthony Chabot Regional Park, Alameda County, US-CA, US",37.76759956,-122.1112123,8,,,Alameda,California coffee berry,Frangula californica,coffeeberry,Plantae,53423,Rhamnaceae,Frangula,Frangula californica
2017452,9/30/15,2015-09-30 23:48:17 UTC,Pacific Time (US & Canada),research,http://www.inaturalist.org/observations/2017452,https://inaturalist-open-data.s3.amazonaws.com/photos/2457754/medium.,,1,0,FALSE,"Anthony Chabot Regional Park, Alameda County, US-CA, US",37.76729541,-122.1112498,8,,,Alameda,Coyote Brush,Baccharis pilularis,coyote brush,Plantae,53359,Asteraceae,Baccharis,Baccharis pilularis
2196485,10/18/15,2015-10-18 21:02:12 UTC,Pacific Time (US & Canada),research,http://www.inaturalist.org/observations/2196485,https://inaturalist-open-data.s3.amazonaws.com/photos/2542098/medium.jpeg,,3,0,FALSE,,37.71874625,-122.1067739,10,,Castro Valley,Alameda,Rosilla,Helenium puberulum,Rosilla,Plantae,53092,Asteraceae,Helenium,Helenium puberulum
2196487,10/18/15,2015-10-18 21:02:46 UTC,Pacific Time (US & Canada),research,http://www.inaturalist.org/observations/2196487,https://inaturalist-open-data.s3.amazonaws.com/photos/2542103/medium.jpeg,,2,0,FALSE,,37.71865321,-122.106744,9,,Castro Valley,Alameda,stinkwort,Dittrichia graveolens,Stinkwort,Plantae,58822,Asteraceae,Dittrichia,Dittrichia graveolens
2196491,10/18/15,2015-10-18 22:32:31 UTC,Pacific Time (US & Canada),research,http://www.inaturalist.org/observations/2196491,https://inaturalist-open-data.s3.amazonaws.com/photos/2542116/medium.jpeg,,2,0,FALSE,,37.72841791,-122.0962149,7,,,Alameda,Pennyroyal,Mentha pulegium,Pennyroyal,Plantae,57116,Lamiaceae,Mentha,Mentha pulegium
2196492,10/18/15,2015-10-18 22:34:21 UTC,Pacific Time (US & Canada),research,http://www.inaturalist.org/observations/2196492,https://inaturalist-open-data.s3.amazonaws.com/photos/2542119/medium.jpeg,,3,0,FALSE,"Anthony Chabot Regional Park, Alameda County, US-CA, US",37.72854665,-122.0961025,15,,,Alameda,Bristly Ox-Tongue,Helminthotheca echioides,bristly oxtongue,Plantae,61906,Asteraceae,Helminthotheca,Helminthotheca echioides
2490193,12/19/15,2015-12-19 21:24:32 UTC,Pacific Time (US & Canada),research,http://www.inaturalist.org/observations/2490193,http://static.inaturalist.org/photos/2793049/medium.jpg,,2,0,FALSE,"Anthony Chabot Regional Park, Oakland, CA, US",37.79564667,-122.1471333,,,,Alameda,wavy-leafed soap plant,Chlorogalum pomeridianum,wavy-leafed soap plant,Plantae,47597,Asparagaceae,Chlorogalum,Chlorogalum pomeridianum
2610900,1/23/16,2016-01-23 20:44:28 UTC,Pacific Time (US & Canada),research,http://www.inaturalist.org/observations/2610900,https://inaturalist-open-data.s3.amazonaws.com/photos/2918598/medium.jpg,,2,0,FALSE,,37.79760897,-122.1542632,5,,,Alameda,Toyon,Heteromeles arbutifolia,Toyon,Plantae,53405,Rosaceae,Heteromeles,Heteromeles arbutifolia
2610903,1/23/16,2016-01-23 21:27:54 UTC,Pacific Time (US & Canada),research,http://www.inaturalist.org/observations/2610903,https://inaturalist-open-data.s3.amazonaws.com/photos/2918607/medium.jpg,,2,0,FALSE,"Anthony Chabot Regional Park, Oakland, CA, US",37.79833317,-122.1471567,5,,,Alameda,Brittleleaf Manzanita,Arctostaphylos crustacea,Brittleleaf Manzanita,Plantae,75507,Ericaceae,Arctostaphylos,Arctostaphylos crustacea
2610905,1/23/16,2016-01-23 21:29:23 UTC,Pacific Time (US & Canada),research,http://www.inaturalist.org/observations/2610905,https://inaturalist-open-data.s3.amazonaws.com/photos/2918609/medium.jpg,"Was surprised to find this here. Only a few plants, maybe just a relict population.",1,0,FALSE,"Anthony Chabot Regional Park, Oakland, CA, US",37.79833317,-122.1471567,5,,,Alameda,chamise,Adenostoma fasciculatum,chamise,Plantae,47146,Rosaceae,Adenostoma,Adenostoma fasciculatum
2610907,1/23/16,2016-01-23 21:30:29 UTC,Pacific Time (US & Canada),research,http://www.inaturalist.org/observations/2610907,https://inaturalist-open-data.s3.amazonaws.com/photos/2918614/medium.jpg,,1,0,FALSE,"Anthony Chabot Regional Park, Oakland, CA, US",37.79839427,-122.1471672,5,,,Alameda,California Huckleberry,Vaccinium ovatum,Evergreen Huckleberry,Plantae,48349,Ericaceae,Vaccinium,Vaccinium ovatum
2610909,1/23/16,2016-01-23 21:31:02 UTC,Pacific Time (US & Canada),research,http://www.inaturalist.org/observations/2610909,https://inaturalist-open-data.s3.amazonaws.com/photos/2918615/medium.jpg,,1,0,FALSE,"Anthony Chabot Regional Park, Castro Valley, CA, US",37.79854724,-122.1470867,5,,,Alameda,Coffeeberry,Frangula californica,coffeeberry,Plantae,53423,Rhamnaceae,Frangula,Frangula californica
2610910,1/23/16,2016-01-23 21:32:02 UTC,Pacific Time (US & Canada),research,http://www.inaturalist.org/observations/2610910,https://inaturalist-open-data.s3.amazonaws.com/photos/2918618/medium.jpg,,2,0,FALSE,"Anthony Chabot Regional Park, Castro Valley, CA, US",37.79851309,-122.1470683,5,,,Alameda,Pacific madrone,Arbutus menziesii,Pacific madrone,Plantae,51046,Ericaceae,Arbutus,Arbutus menziesii
2774856,3/12/16,2016-03-12 22:47:13 UTC,Pacific Time (US & Canada),research,http://www.inaturalist.org/observations/2774856,http://static.inaturalist.org/photos/3143034/medium.jpg,,1,0,FALSE,"Anthony Chabot Regional Park, Castro Valley, CA, US",37.75348333,-122.1181195,,,Oakland,Alameda,Giant Wakerobin,Trillium chloropetalum,giant wakerobin,Plantae,50823,Melanthiaceae,Trillium,Trillium chloropetalum
2827378,3/20/16,2016-03-20 17:02:46 UTC,Pacific Time (US & Canada),research,http://www.inaturalist.org/observations/2827378,http://static.inaturalist.org/photos/3218367/medium.jpg,,1,0,FALSE,"Anthony Chabot Regional Park, Castro Valley, CA, US",37.76371667,-122.1143638,,,,Alameda,Coast Indian Paintbrush,Castilleja affinis,Coast Paintbrush,Plantae,50042,Orobanchaceae,Castilleja,Castilleja affinis
2827379,3/20/16,2016-03-20 16:31:52 UTC,Pacific Time (US & Canada),research,http://www.inaturalist.org/observations/2827379,http://static.inaturalist.org/photos/3218371/medium.jpg,,2,0,FALSE,"Anthony Chabot Regional Park, Castro Valley, CA, US",37.765475,-122.1106945,,,,Alameda,sun cup,Taraxia ovata,Sun Cup,Plantae,68182,Onagraceae,Taraxia,Taraxia ovata
2813612,3/21/16,2016-03-21 18:42:32 UTC,Pacific Time (US & Canada),research,http://www.inaturalist.org/observations/2813612,http://static.inaturalist.org/photos/3198465/medium.jpg,,1,0,FALSE,"Anthony Chabot Regional Park, San Leandro, CA, US",37.71637833,-122.1121833,,,Castro Valley,Alameda,sun cup,Taraxia ovata,Sun Cup,Plantae,68182,Onagraceae,Taraxia,Taraxia ovata
2813615,3/21/16,2016-03-21 18:51:11 UTC,Pacific Time (US & Canada),research,http://www.inaturalist.org/observations/2813615,http://static.inaturalist.org/photos/3198470/medium.jpg,,1,0,FALSE,"Anthony Chabot Regional Park, San Leandro, CA, US",37.71769667,-122.1118472,,,Castro Valley,Alameda,narrowleaf mule-ears,Wyethia angustifolia,narrowleaf mule-ears,Plantae,56987,Asteraceae,Wyethia,Wyethia angustifolia
2813616,3/21/16,2016-03-21 18:57:26 UTC,Pacific Time (US & Canada),research,http://www.inaturalist.org/observations/2813616,http://static.inaturalist.org/photos/3198474/medium.jpg,,2,0,FALSE,"Anthony Chabot Regional Park, San Leandro, CA, US",37.71973333,-122.1122888,,,Castro Valley,Alameda,Purple Sanicle,Sanicula bipinnatifida,Purple Sanicle,Plantae,56840,Apiaceae,Sanicula,Sanicula bipinnatifida
2813618,3/21/16,2016-03-21 18:59:45 UTC,Pacific Time (US & Canada),research,http://www.inaturalist.org/observations/2813618,http://static.inaturalist.org/photos/3198477/medium.jpg,,2,0,FALSE,"Anthony Chabot Regional Park, San Leandro, CA, US",37.72025333,-122.1123805,,,Castro Valley,Alameda,Foothill desert-parsley,Lomatium utriculatum,Foothill desert-parsley,Plantae,56827,Apiaceae,Lomatium,Lomatium utriculatum
2813620,3/21/16,2016-03-21 19:00:08 UTC,Pacific Time (US & Canada),research,http://www.inaturalist.org/observations/2813620,http://static.inaturalist.org/photos/3198478/medium.jpg,,1,0,FALSE,"Anthony Chabot Regional Park, San Leandro, CA, US",37.72027167,-122.1123888,,,Castro Valley,Alameda,Wavy-leafed Soap Plant,Chlorogalum pomeridianum,wavy-leafed soap plant,Plantae,47597,Asparagaceae,Chlorogalum,Chlorogalum pomeridianum
2905030,3/26/16,2016-03-26 22:36:43 UTC,Pacific Time (US & Canada),research,http://www.inaturalist.org/observations/2905030,http://static.inaturalist.org/photos/3323222/medium.jpg,,1,0,FALSE,"Anthony Chabot Regional Park, Castro Valley, CA, US",37.78526667,-122.1321112,,,,Alameda,California Poppy,Eschscholzia californica,California poppy,Plantae,48225,Papaveraceae,Eschscholzia,Eschscholzia californica
2844769,3/27/16,2016-03-27 21:07:58 UTC,Pacific Time (US & Canada),research,http://www.inaturalist.org/observations/2844769,http://static.inaturalist.org/photos/3243026/medium.jpeg,,1,0,FALSE,"Castro Valley, CA",37.72740677,-122.0950056,1376,,Castro Valley,Alameda,sun cup,Taraxia ovata,Sun Cup,Plantae,68182,Onagraceae,Taraxia,Taraxia ovata
7127524,4/2/16,2016-04-02 10:05:19 UTC,Pacific Time (US & Canada),research,https://www.inaturalist.org/observations/7127524,https://static.inaturalist.org/photos/9170945/medium.jpg,,2,0,FALSE,"Anthony Chabot Regional Park, Oakland, CA, US",37.79055253,-122.1424167,574,,,Alameda,California poppy,Eschscholzia californica,California poppy,Plantae,48225,Papaveraceae,Eschscholzia,Eschscholzia californica
2936896,4/4/16,2016-04-04 20:45:44 UTC,Pacific Time (US & Canada),research,http://www.inaturalist.org/observations/2936896,https://inaturalist-open-data.s3.amazonaws.com/photos/3366384/medium.jpeg,,3,0,FALSE,"2821 Harrison St Oakland, CA 94611",37.79327393,-122.1424942,,,,Alameda,Redmaids,Calandrinia menziesii,redmaids,Plantae,400267,Montiaceae,Calandrinia,Calandrinia menziesii
2941547,4/15/16,2016-04-15 19:03:33 UTC,Pacific Time (US & Canada),research,http://www.inaturalist.org/observations/2941547,http://static.inaturalist.org/photos/3372666/medium.jpeg,,2,0,FALSE,"Anthony Chabot Regional Park, Alameda County, US-CA, US",37.79824851,-122.1528065,12,,,Alameda,Bigleaf Maple,Acer macrophyllum,bigleaf maple,Plantae,48227,Sapindaceae,Acer,Acer macrophyllum
2941553,4/15/16,2016-04-15 19:09:13 UTC,Pacific Time (US & Canada),research,http://www.inaturalist.org/observations/2941553,http://static.inaturalist.org/photos/3372673/medium.jpeg,,1,0,FALSE,"Anthony Chabot Regional Park, Alameda County, US-CA, US",37.79810099,-122.1524887,30,,,Alameda,European holly,Ilex aquifolium,European holly,Plantae,53856,Aquifoliaceae,Ilex,Ilex aquifolium
2941555,4/15/16,2016-04-15 19:11:15 UTC,Pacific Time (US & Canada),research,http://www.inaturalist.org/observations/2941555,http://static.inaturalist.org/photos/3372674/medium.jpeg,,2,0,FALSE,"Anthony Chabot Regional Park, Alameda County, US-CA, US",37.79811694,-122.1522442,20,,,Alameda,Pacific Poison Oak,Toxicodendron diversilobum,Pacific poison oak,Plantae,51080,Anacardiaceae,Toxicodendron,Toxicodendron diversilobum
2941562,4/15/16,2016-04-15 19:18:55 UTC,Pacific Time (US & Canada),research,http://www.inaturalist.org/observations/2941562,http://static.inaturalist.org/photos/3372688/medium.jpeg,,2,0,FALSE,"Anthony Chabot Regional Park, Alameda County, US-CA, US",37.79785471,-122.1512295,6,,,Alameda,greater periwinkle,Vinca major,greater periwinkle,Plantae,53326,Apocynaceae,Vinca,Vinca major
2941568,4/15/16,2016-04-15 19:34:18 UTC,Pacific Time (US & Canada),research,http://www.inaturalist.org/observations/2941568,http://static.inaturalist.org/photos/3372704/medium.jpeg,,2,0,FALSE,"Anthony Chabot Regional Park, Alameda County, US-CA, US",37.79798002,-122.1524488,15,,,Alameda,California buckeye,Aesculus californica,California buckeye,Plantae,53348,Sapindaceae,Aesculus,Aesculus californica
2941569,4/15/16,2016-04-15 19:40:58 UTC,Pacific Time (US & Canada),research,http://www.inaturalist.org/observations/2941569,http://static.inaturalist.org/photos/3374441/medium.jpeg,,2,0,FALSE,"Anthony Chabot Regional Park, Alameda County, US-CA, US",37.79862125,-122.1534044,9,,,Alameda,Pale pink-sorrel,Oxalis incarnata,Pale pink-sorrel,Plantae,61776,Oxalidaceae,Oxalis,Oxalis incarnata
2944060,4/15/16,2016-04-15 23:02:56 UTC,Pacific Time (US & Canada),research,http://www.inaturalist.org/observations/2944060,https://inaturalist-open-data.s3.amazonaws.com/photos/3376078/medium.jpg,,2,0,FALSE,"Anthony Chabot Regional Park, Oakland, CA, US",37.79903,-122.154525,,,,Alameda,broadleaf forget-me-not,Myosotis latifolia,broadleaf forget-me-not,Plantae,49132,Boraginaceae,Myosotis,Myosotis latifolia
2944070,4/15/16,2016-04-15 23:03:11 UTC,Pacific Time (US & Canada),research,http://www.inaturalist.org/observations/2944070,https://inaturalist-open-data.s3.amazonaws.com/photos/3376124/medium.jpg,,1,0,FALSE,"Anthony Chabot Regional Park, Oakland, CA, US",37.79902,-122.1547,,,,Alameda,poison hemlock,Conium maculatum,poison hemlock,Plantae,52998,Apiaceae,Conium,Conium maculatum
2944090,4/15/16,2016-04-15 23:04:14 UTC,Pacific Time (US & Canada),research,http://www.inaturalist.org/observations/2944090,https://inaturalist-open-data.s3.amazonaws.com/photos/3376143/medium.jpg,,1,0,FALSE,"Anthony Chabot Regional Park, Oakland, CA, US",37.79898833,-122.1549833,,,,Alameda,Pale pink-sorrel,Oxalis incarnata,Pale pink-sorrel,Plantae,61776,Oxalidaceae,Oxalis,Oxalis incarnata
2944105,4/15/16,2016-04-15 23:05:14 UTC,Pacific Time (US & Canada),research,http://www.inaturalist.org/observations/2944105,https://inaturalist-open-data.s3.amazonaws.com/photos/3376164/medium.jpg,,2,0,FALSE,"Anthony Chabot Regional Park, Oakland, CA, US",37.799045,-122.1549695,,,,Alameda,California hazelnut,Corylus cornuta californica,California hazelnut,Plantae,53368,Betulaceae,Corylus,Corylus cornuta
2944122,4/15/16,2016-04-15 23:07:10 UTC,Pacific Time (US & Canada),research,http://www.inaturalist.org/observations/2944122,https://inaturalist-open-data.s3.amazonaws.com/photos/3376189/medium.jpg,,2,0,FALSE,"Anthony Chabot Regional Park, Oakland, CA, US",37.79889667,-122.1548,,,,Alameda,California bay,Umbellularia californica,California bay,Plantae,48807,Lauraceae,Umbellularia,Umbellularia californica
2944160,4/15/16,2016-04-15 23:11:23 UTC,Pacific Time (US & Canada),research,http://www.inaturalist.org/observations/2944160,https://inaturalist-open-data.s3.amazonaws.com/photos/3376252/medium.jpg,,1,0,FALSE,"Anthony Chabot Regional Park, Oakland, CA, US",37.79882833,-122.1545778,,,,Alameda,Coast Live Oak,Quercus agrifolia,coast live oak,Plantae,47850,Fagaceae,Quercus,Quercus agrifolia
2944165,4/15/16,2016-04-15 23:11:42 UTC,Pacific Time (US & Canada),research,http://www.inaturalist.org/observations/2944165,https://inaturalist-open-data.s3.amazonaws.com/photos/3376259/medium.jpg,,2,0,FALSE,"Anthony Chabot Regional Park, Oakland, CA, US",37.79882833,-122.1545862,,,,Alameda,Miner's Lettuce,Claytonia perfoliata,miner's lettuce,Plantae,52994,Montiaceae,Claytonia,Claytonia perfoliata
2944203,4/15/16,2016-04-15 23:16:02 UTC,Pacific Time (US & Canada),research,http://www.inaturalist.org/observations/2944203,https://inaturalist-open-data.s3.amazonaws.com/photos/3376313/medium.jpg,,1,0,FALSE,"Anthony Chabot Regional Park, Oakland, CA, US",37.79872833,-122.154525,,,,Alameda,Catchweed Bedstraw,Galium aparine,catchweed bedstraw,Plantae,53059,Rubiaceae,Galium,Galium aparine
2944253,4/15/16,2016-04-15 23:33:28 UTC,Pacific Time (US & Canada),research,http://www.inaturalist.org/observations/2944253,https://inaturalist-open-data.s3.amazonaws.com/photos/3376397/medium.jpg,,1,0,FALSE,"Anthony Chabot Regional Park, Oakland, CA, US",37.79861333,-122.1549833,,,,Alameda,Pacific pea,Lathyrus vestitus,Pacific pea,Plantae,50320,Fabaceae,Lathyrus,Lathyrus vestitus
2944296,4/15/16,2016-04-15 23:45:50 UTC,Pacific Time (US & Canada),research,http://www.inaturalist.org/observations/2944296,https://inaturalist-open-data.s3.amazonaws.com/photos/3376466/medium.jpg,,1,0,FALSE,"Anthony Chabot Regional Park, Oakland, CA, US",37.79865,-122.1543972,,,,Alameda,French broom,Genista monspessulana,French broom,Plantae,53403,Fabaceae,Genista,Genista monspessulana
2944309,4/15/16,2016-04-15 23:46:07 UTC,Pacific Time (US & Canada),research,http://www.inaturalist.org/observations/2944309,https://inaturalist-open-data.s3.amazonaws.com/photos/3376482/medium.jpg,,2,0,FALSE,"Anthony Chabot Regional Park, Oakland, CA, US",37.79863,-122.1544112,,,,Alameda,Wild strawberry,Fragaria vesca,woodland strawberry,Plantae,50298,Rosaceae,Fragaria,Fragaria vesca
2944314,4/15/16,2016-04-15 23:47:15 UTC,Pacific Time (US & Canada),research,http://www.inaturalist.org/observations/2944314,https://inaturalist-open-data.s3.amazonaws.com/photos/3376491/medium.jpg,,1,0,FALSE,"Anthony Chabot Regional Park, Oakland, CA, US",37.79856333,-122.1543055,,,,Alameda,legumes,Medicago arabica,Spotted medick,Plantae,61012,Fabaceae,Medicago,Medicago arabica
2947365,4/15/16,2016-04-15 23:59:21 UTC,Pacific Time (US & Canada),research,http://www.inaturalist.org/observations/2947365,https://inaturalist-open-data.s3.amazonaws.com/photos/3380120/medium.jpg,,1,0,FALSE,"Anthony Chabot Regional Park, Oakland, CA, US",37.7976,-122.1547472,,,,Alameda,Pacific poison oak,Toxicodendron diversilobum,Pacific poison oak,Plantae,51080,Anacardiaceae,Toxicodendron,Toxicodendron diversilobum
2947402,4/15/16,2016-04-16 00:00:19 UTC,Pacific Time (US & Canada),research,http://www.inaturalist.org/observations/2947402,https://inaturalist-open-data.s3.amazonaws.com/photos/3380169/medium.jpg,,1,0,FALSE,"Anthony Chabot Regional Park, Oakland, CA, US",37.79751167,-122.15435,,,,Alameda,Pink Honeysuckle,Lonicera hispidula,Pink Honeysuckle,Plantae,53416,Caprifoliaceae,Lonicera,Lonicera hispidula
2947426,4/15/16,2016-04-16 00:01:43 UTC,Pacific Time (US & Canada),research,http://www.inaturalist.org/observations/2947426,https://inaturalist-open-data.s3.amazonaws.com/photos/3380177/medium.jpg,,2,0,FALSE,"Anthony Chabot Regional Park, Oakland, CA, US",37.79773667,-122.1541278,,,,Alameda,Western Star Flower,Lysimachia latifolia,Western Starflower,Plantae,496537,Primulaceae,Lysimachia,Lysimachia latifolia
2947437,4/15/16,2016-04-16 00:02:22 UTC,Pacific Time (US & Canada),research,http://www.inaturalist.org/observations/2947437,https://inaturalist-open-data.s3.amazonaws.com/photos/3380189/medium.jpg,,2,0,FALSE,"Anthony Chabot Regional Park, Oakland, CA, US",37.79771333,-122.1539528,,,,Alameda,hairy ceanothus,Ceanothus oliganthus,hairy ceanothus,Plantae,53360,Rhamnaceae,Ceanothus,Ceanothus oliganthus
2947459,4/15/16,2016-04-16 00:03:09 UTC,Pacific Time (US & Canada),research,http://www.inaturalist.org/observations/2947459,https://inaturalist-open-data.s3.amazonaws.com/photos/3380218/medium.jpg,,1,0,FALSE,"Anthony Chabot Regional Park, Oakland, CA, US",37.79778667,-122.1539695,,,,Alameda,Fremont's Deathcamas,Toxicoscordion fremontii,Common star lily,Plantae,49649,Melanthiaceae,Toxicoscordion,Toxicoscordion fremontii
2947472,4/15/16,2016-04-16 00:03:34 UTC,Pacific Time (US & Canada),research,http://www.inaturalist.org/observations/2947472,https://inaturalist-open-data.s3.amazonaws.com/photos/3380265/medium.jpg,,2,0,FALSE,"Anthony Chabot Regional Park, Oakland, CA, US",37.797795,-122.1539083,,,,Alameda,Pacific madrone,Arbutus menziesii,Pacific madrone,Plantae,51046,Ericaceae,Arbutus,Arbutus menziesii
2947510,4/15/16,2016-04-16 00:04:19 UTC,Pacific Time (US & Canada),research,http://www.inaturalist.org/observations/2947510,https://inaturalist-open-data.s3.amazonaws.com/photos/3380291/medium.jpg,,1,0,FALSE,"Anthony Chabot Regional Park, Oakland, CA, US",37.79773667,-122.1538388,,,,Alameda,English Plantain,Plantago lanceolata,ribwort plantain,Plantae,53178,Plantaginaceae,Plantago,Plantago lanceolata
2947546,4/15/16,2016-04-16 00:05:40 UTC,Pacific Time (US & Canada),research,http://www.inaturalist.org/observations/2947546,https://inaturalist-open-data.s3.amazonaws.com/photos/3380337/medium.jpg,,1,0,FALSE,"Anthony Chabot Regional Park, Oakland, CA, US",37.79728667,-122.15355,,,,Alameda,Wavy-leafed Soap Plant,Chlorogalum pomeridianum,wavy-leafed soap plant,Plantae,47597,Asparagaceae,Chlorogalum,Chlorogalum pomeridianum
2947627,4/15/16,2016-04-16 00:09:19 UTC,Pacific Time (US & Canada),research,http://www.inaturalist.org/observations/2947627,https://inaturalist-open-data.s3.amazonaws.com/photos/3380398/medium.jpg,,1,0,FALSE,"Anthony Chabot Regional Park, Oakland, CA, US",37.79771333,-122.1529612,,,,Alameda,Three-cornered leek,Allium triquetrum,Three-cornered garlic,Plantae,55505,Amaryllidaceae,Allium,Allium triquetrum
2947685,4/15/16,2016-04-16 00:11:34 UTC,Pacific Time (US & Canada),research,http://www.inaturalist.org/observations/2947685,https://inaturalist-open-data.s3.amazonaws.com/photos/3380487/medium.jpg,,1,0,FALSE,"Anthony Chabot Regional Park, Oakland, CA, US",37.79754167,-122.1526112,,,,Alameda,California Buckeye,Aesculus californica,California buckeye,Plantae,53348,Sapindaceae,Aesculus,Aesculus californica
2947705,4/15/16,2016-04-16 00:11:47 UTC,Pacific Time (US & Canada),research,http://www.inaturalist.org/observations/2947705,https://inaturalist-open-data.s3.amazonaws.com/photos/3380509/medium.jpg,,1,0,FALSE,"Anthony Chabot Regional Park, Oakland, CA, US",37.79743833,-122.1526195,,,,Alameda,Adelinia grande,Adelinia grande,Pacific hound's tongue,Plantae,769151,Boraginaceae,Adelinia,Adelinia grande
2948045,4/15/16,2016-04-16 00:31:34 UTC,Pacific Time (US & Canada),research,http://www.inaturalist.org/observations/2948045,https://inaturalist-open-data.s3.amazonaws.com/photos/3380945/medium.jpg,,1,0,FALSE,"Anthony Chabot Regional Park, Oakland, CA, US",37.798595,-122.1536333,,,,Alameda,Bigleaf Maple,Acer macrophyllum,bigleaf maple,Plantae,48227,Sapindaceae,Acer,Acer macrophyllum
2948083,4/15/16,2016-04-16 00:32:56 UTC,Pacific Time (US & Canada),research,http://www.inaturalist.org/observations/2948083,https://inaturalist-open-data.s3.amazonaws.com/photos/3380982/medium.jpg,,2,0,FALSE,"Anthony Chabot Regional Park, Oakland, CA, US",37.79865333,-122.1535333,,,,Alameda,Zantedeschia aethiopica,Zantedeschia aethiopica,calla lily,Plantae,56006,Araceae,Zantedeschia,Zantedeschia aethiopica
2948211,4/15/16,2016-04-16 00:42:09 UTC,Pacific Time (US & Canada),research,http://www.inaturalist.org/observations/2948211,https://inaturalist-open-data.s3.amazonaws.com/photos/3381148/medium.jpg,,1,0,FALSE,"Anthony Chabot Regional Park, Oakland, CA, US",37.79852833,-122.1537167,,,,Alameda,Bermuda Buttercup,Oxalis pes-caprae,Bermuda buttercup,Plantae,53169,Oxalidaceae,Oxalis,Oxalis pes-caprae
2959630,4/17/16,2016-04-17 19:54:20 UTC,Pacific Time (US & Canada),research,http://www.inaturalist.org/observations/2959630,http://static.inaturalist.org/photos/3396605/medium.jpeg,,2,0,FALSE,"Anthony Chabot Regional Park, Alameda County, US-CA, US",37.75931161,-122.1056997,5,,,Alameda,western blue-eyed grass,Sisyrinchium bellum,western blue-eyed grass,Plantae,49918,Iridaceae,Sisyrinchium,Sisyrinchium bellum
2959632,4/17/16,2016-04-17 19:56:30 UTC,Pacific Time (US & Canada),research,http://www.inaturalist.org/observations/2959632,http://static.inaturalist.org/photos/3396608/medium.jpeg,,1,0,FALSE,"Anthony Chabot Regional Park, Alameda County, US-CA, US",37.75972564,-122.1058818,6,,,Alameda,French broom,Genista monspessulana,French broom,Plantae,53403,Fabaceae,Genista,Genista monspessulana
2959633,4/17/16,2016-04-17 19:57:52 UTC,Pacific Time (US & Canada),research,http://www.inaturalist.org/observations/2959633,http://static.inaturalist.org/photos/3396609/medium.jpeg,Tree,2,0,FALSE,"Anthony Chabot Regional Park, Alameda County, US-CA, US",37.76009552,-122.1061722,3,,,Alameda,Pacific madrone,Arbutus menziesii,Pacific madrone,Plantae,51046,Ericaceae,Arbutus,Arbutus menziesii
2959636,4/17/16,2016-04-17 20:01:17 UTC,Pacific Time (US & Canada),research,http://www.inaturalist.org/observations/2959636,http://static.inaturalist.org/photos/3396619/medium.jpeg,,2,0,FALSE,"Anthony Chabot Regional Park, Alameda County, US-CA, US",37.76078542,-122.1067753,6,,,Alameda,Narrow-leaved clover,Trifolium angustifolium,Narrow-leaved clover,Plantae,69939,Fabaceae,Trifolium,Trifolium angustifolium
2959637,4/17/16,2016-04-17 20:02:35 UTC,Pacific Time (US & Canada),research,http://www.inaturalist.org/observations/2959637,http://static.inaturalist.org/photos/3396623/medium.jpeg,,2,0,FALSE,"Anthony Chabot Regional Park, Alameda County, US-CA, US",37.76080599,-122.1068273,3,,,Alameda,ribwort plantain,Plantago lanceolata,ribwort plantain,Plantae,53178,Plantaginaceae,Plantago,Plantago lanceolata
2959638,4/17/16,2016-04-17 20:04:14 UTC,Pacific Time (US & Canada),research,http://www.inaturalist.org/observations/2959638,http://static.inaturalist.org/photos/3396625/medium.jpeg,,1,0,FALSE,"Anthony Chabot Regional Park, Alameda County, US-CA, US",37.76103189,-122.1070902,5,,,Alameda,Pacific Poison Oak,Toxicodendron diversilobum,Pacific poison oak,Plantae,51080,Anacardiaceae,Toxicodendron,Toxicodendron diversilobum
2959639,4/17/16,2016-04-17 20:04:33 UTC,Pacific Time (US & Canada),research,http://www.inaturalist.org/observations/2959639,http://static.inaturalist.org/photos/3396627/medium.jpeg,,1,0,FALSE,"Anthony Chabot Regional Park, Alameda County, US-CA, US",37.76106603,-122.1071266,3,,,Alameda,common yarrow,Achillea millefolium,common yarrow,Plantae,52821,Asteraceae,Achillea,Achillea millefolium
2959640,4/17/16,2016-04-17 20:05:22 UTC,Pacific Time (US & Canada),research,http://www.inaturalist.org/observations/2959640,http://static.inaturalist.org/photos/3396628/medium.jpeg,,1,0,FALSE,"Anthony Chabot Regional Park, Alameda County, US-CA, US",37.7610689,-122.1071343,6,,,Alameda,orange bush monkeyflower,Diplacus aurantiacus,orange bush monkeyflower,Plantae,777371,Phrymaceae,Diplacus,Diplacus aurantiacus
2959641,4/17/16,2016-04-17 20:08:19 UTC,Pacific Time (US & Canada),research,http://www.inaturalist.org/observations/2959641,http://static.inaturalist.org/photos/3396631/medium.jpeg,,2,0,FALSE,"Anthony Chabot Regional Park, Alameda County, US-CA, US",37.76073508,-122.108481,4,,,Alameda,hairy vetch,Vicia villosa,hairy vetch,Plantae,57317,Fabaceae,Vicia,Vicia villosa
2959648,4/17/16,2016-04-17 20:31:21 UTC,Pacific Time (US & Canada),research,http://www.inaturalist.org/observations/2959648,http://static.inaturalist.org/photos/3396650/medium.jpeg,,2,0,FALSE,"Anthony Chabot Regional Park, Alameda County, US-CA, US",37.75994798,-122.1061479,15,,,Alameda,Milk Thistle,Silybum marianum,milk thistle,Plantae,52586,Asteraceae,Silybum,Silybum marianum
3023391,4/24/16,2016-04-24 20:14:55 UTC,Pacific Time (US & Canada),research,http://www.inaturalist.org/observations/3023391,https://inaturalist-open-data.s3.amazonaws.com/photos/3479731/medium.jpg,Beautiful wild flowers seen today while walking in Lake Chabot Regional Park. Such a delicate color! Can someone identify them?,4,0,FALSE,"Anthony Chabot Regional Park, Castro Valley, CA, US",37.72565,-122.1018362,,,Castro Valley,Alameda,Calochortus albus,Calochortus albus,White Globe Lily,Plantae,51315,Liliaceae,Calochortus,Calochortus albus
3165505,5/13/16,2016-05-13 18:17:44 UTC,Pacific Time (US & Canada),research,http://www.inaturalist.org/observations/3165505,https://inaturalist-open-data.s3.amazonaws.com/photos/3660311/medium.jpeg,,2,0,FALSE,"Goldenrod Trail Oakland, CA 94619",37.75494766,-122.1187057,,,,Alameda,orange bush monkeyflower,Diplacus aurantiacus,orange bush monkeyflower,Plantae,777371,Phrymaceae,Diplacus,Diplacus aurantiacus
3199435,5/14/16,2016-05-14 23:29:22 UTC,Pacific Time (US & Canada),research,http://www.inaturalist.org/observations/3199435,http://static.inaturalist.org/photos/3702518/medium.jpg,,1,0,FALSE,Anthony Chabot Regional Park,37.750197,-122.104594,2500,,,Alameda,Pholistoma auritum,Pholistoma auritum,Fiesta Flower,Plantae,55437,Boraginaceae,Pholistoma,Pholistoma auritum
3199436,5/14/16,2016-05-15 00:01:44 UTC,Pacific Time (US & Canada),research,http://www.inaturalist.org/observations/3199436,http://static.inaturalist.org/photos/3702519/medium.jpg,,3,0,FALSE,Anthony Chabot Regional Park,37.750053,-122.104691,,,,Alameda,Calochortus albus,Calochortus albus,White Globe Lily,Plantae,51315,Liliaceae,Calochortus,Calochortus albus
3199437,5/14/16,2016-05-15 00:13:02 UTC,Pacific Time (US & Canada),research,http://www.inaturalist.org/observations/3199437,http://static.inaturalist.org/photos/3702520/medium.jpg,,1,0,FALSE,Anthony Chabot Regional Park,37.750053,-122.104691,,,,Alameda,Lonicera hispidula,Lonicera hispidula,Pink Honeysuckle,Plantae,53416,Caprifoliaceae,Lonicera,Lonicera hispidula
3199439,5/14/16,2016-05-15 00:13:31 UTC,Pacific Time (US & Canada),research,http://www.inaturalist.org/observations/3199439,http://static.inaturalist.org/photos/3702521/medium.jpg,,1,0,FALSE,Anthony Chabot Regional Park,37.750053,-122.104691,,,,Alameda,orange bush monkeyflower,Diplacus aurantiacus,orange bush monkeyflower,Plantae,777371,Phrymaceae,Diplacus,Diplacus aurantiacus
3248549,5/14/16,2016-05-14 19:08:43 UTC,Pacific Time (US & Canada),research,http://www.inaturalist.org/observations/3248549,http://static.inaturalist.org/photos/3758226/medium.jpeg,,1,0,FALSE,"9999 Redwood Rd Oakland, CA 94605",37.75999832,-122.1061096,,,,Alameda,orange bush monkeyflower,Diplacus aurantiacus,orange bush monkeyflower,Plantae,777371,Phrymaceae,Diplacus,Diplacus aurantiacus
3258838,5/14/16,2016-05-14 20:25:37 UTC,Pacific Time (US & Canada),research,http://www.inaturalist.org/observations/3258838,http://static.inaturalist.org/photos/3768778/medium.jpeg,pretty flower,1,0,FALSE,"Redtail Trail Castro Valley, CA 94552",37.76444626,-122.1100006,,,,Alameda,Western Columbine,Aquilegia formosa,western columbine,Plantae,48244,Ranunculaceae,Aquilegia,Aquilegia formosa
3258904,5/14/16,2016-05-14 21:21:06 UTC,Pacific Time (US & Canada),research,http://www.inaturalist.org/observations/3258904,http://static.inaturalist.org/photos/3768825/medium.jpeg,certified 100% native,1,0,FALSE,"Columbine Trail Castro Valley, CA 94552",37.73805618,-122.1141663,,,,Alameda,orange bush monkeyflower,Diplacus aurantiacus,orange bush monkeyflower,Plantae,777371,Phrymaceae,Diplacus,Diplacus aurantiacus
3258926,5/14/16,2016-05-15 00:51:38 UTC,Pacific Time (US & Canada),research,http://www.inaturalist.org/observations/3258926,http://static.inaturalist.org/photos/3768842/medium.jpeg,green pineapple plant,1,0,FALSE,"Honker Bay Trail Castro Valley, CA 94552",37.72777939,-122.1041641,,,,Alameda,Fuller's teasel,Dipsacus sativus,fuller's teasel,Plantae,53028,Caprifoliaceae,Dipsacus,Dipsacus sativus
3258990,5/14/16,2016-05-14 21:03:54 UTC,Pacific Time (US & Canada),research,http://www.inaturalist.org/observations/3258990,http://static.inaturalist.org/photos/3768926/medium.jpeg,"I believe this is a ""Sting Nettle,"" who ever heard of ""stinging nettle???"" ",1,0,FALSE,"Redtail Trail Castro Valley, CA 94552",37.76444626,-122.1100006,,,,Alameda,stinging nettle,Urtica dioica,great stinging nettle,Plantae,51884,Urticaceae,Urtica,Urtica dioica
3259072,5/14/16,2016-05-14 20:12:51 UTC,Pacific Time (US & Canada),research,http://www.inaturalist.org/observations/3259072,http://static.inaturalist.org/photos/3769041/medium.jpeg,jellyfish plant wow so cool. who knows what it could be!?!,4,0,FALSE,"Redtail Trail Castro Valley, CA 94552",37.76444626,-122.1100006,,,,Alameda,Calochortus albus,Calochortus albus,White Globe Lily,Plantae,51315,Liliaceae,Calochortus,Calochortus albus
3259197,5/14/16,2016-05-14 19:10:58 UTC,Pacific Time (US & Canada),research,http://www.inaturalist.org/observations/3259197,http://static.inaturalist.org/photos/3769175/medium.jpeg,"cool lookin'... but wait, what are these clovers doing in our part of town!?",1,0,FALSE,"9999 Redwood Rd Oakland, CA 94605",37.76027679,-122.1063919,,,,Alameda,Narrow-leaved Clover,Trifolium angustifolium,Narrow-leaved clover,Plantae,69939,Fabaceae,Trifolium,Trifolium angustifolium
3259210,5/14/16,2016-05-15 00:41:41 UTC,Pacific Time (US & Canada),research,http://www.inaturalist.org/observations/3259210,http://static.inaturalist.org/photos/3769325/medium.jpeg,It may be a sausageplant but I am not entirely sure. Assistance is requested. Thank you!,3,0,FALSE,"Honker Bay Trail Castro Valley, CA 94552",37.72722244,-122.1072235,,,,Alameda,wavy-leafed soap plant,Chlorogalum pomeridianum,wavy-leafed soap plant,Plantae,47597,Asparagaceae,Chlorogalum,Chlorogalum pomeridianum
3259226,5/14/16,2016-05-14 18:55:35 UTC,Pacific Time (US & Canada),research,http://www.inaturalist.org/observations/3259226,http://static.inaturalist.org/photos/3769213/medium.jpeg,"delicious! even better than trader joes! wild berries, didnt even need to wash off the pesticides! amazing.",1,0,FALSE,"Redtail Trail Castro Valley, CA 94552",37.7555542,-122.1033325,,,,Alameda,California blackberry,Rubus ursinus macropetalus,California blackberry,Plantae,53444,Rosaceae,Rubus,Rubus ursinus
3269486,5/14/16,2016-05-14 22:08:14 UTC,Hawaii,research,http://www.inaturalist.org/observations/3269486,http://static.inaturalist.org/photos/3780199/medium.jpg,,1,0,FALSE,"Anthony Chabot Regional Park, Alameda, California, United States",37.76,-122.1061111,,,,Alameda,French broom,Genista monspessulana,French broom,Plantae,53403,Fabaceae,Genista,Genista monspessulana
3199443,5/15/16,2016-05-15 14:41:48 UTC,Pacific Time (US & Canada),research,http://www.inaturalist.org/observations/3199443,http://static.inaturalist.org/photos/3702525/medium.jpg,,2,0,FALSE,Chabot Campground,37.735041,-122.096181,,,,Alameda,Wavy-leaved soap plant,Chlorogalum pomeridianum,wavy-leafed soap plant,Plantae,47597,Asparagaceae,Chlorogalum,Chlorogalum pomeridianum
15948713,6/8/16,,Pacific Time (US & Canada),research,https://www.inaturalist.org/observations/15948713,https://inaturalist-open-data.s3.amazonaws.com/photos/23865668/medium.jpg,,1,0,FALSE,"17600 Lake Chabot Rd, Castro Valley, CA 94546, USA",37.7151183,-122.1022667,189,,Castro Valley,Alameda,turkey tangle frogfruit,Phyla nodiflora,turkey tangle frogfruit,Plantae,59040,Verbenaceae,Phyla,Phyla nodiflora
16432512,6/8/16,,Pacific Time (US & Canada),research,https://www.inaturalist.org/observations/16432512,https://inaturalist-open-data.s3.amazonaws.com/photos/24721487/medium.jpg,,1,0,FALSE,"Castro Valley, CA, USA",37.72532621,-122.0872392,15,,Castro Valley,Alameda,Spanish clover,Acmispon americanus,Spanish clover,Plantae,57049,Fabaceae,Acmispon,Acmispon americanus
3430388,6/10/16,2016-06-10 19:38:21 UTC,Pacific Time (US & Canada),research,http://www.inaturalist.org/observations/3430388,https://inaturalist-open-data.s3.amazonaws.com/photos/3973926/medium.jpg,"Beautiful and fragrant blooms. Nearly spent. The bees, butterflies and birds were enjoying them too. ",1,0,FALSE,"Anthony Chabot Regional Park, Castro Valley, CA, US",37.77270833,-122.1245028,,,,Alameda,California Buckeye,Aesculus californica,California buckeye,Plantae,53348,Sapindaceae,Aesculus,Aesculus californica
7759629,7/6/16,2016-07-06 23:04:58 UTC,Pacific Time (US & Canada),research,https://www.inaturalist.org/observations/7759629,https://static.inaturalist.org/photos/10190894/medium.jpg,,2,0,FALSE,"Anthony Chabot Regional Park, Castro Valley, CA, US",37.75368833,-122.1158138,,,,Alameda,Broad-leaved Helleborine,Epipactis helleborine,Broad-leafed Helleborine,Plantae,50717,Orchidaceae,Epipactis,Epipactis helleborine
3651755,7/9/16,2016-07-09 22:49:48 UTC,Pacific Time (US & Canada),research,http://www.inaturalist.org/observations/3651755,https://inaturalist-open-data.s3.amazonaws.com/photos/4225474/medium.,,1,0,FALSE,"Anthony Chabot Regional Park, Oakland, CA, US",37.79769167,-122.1547695,,,,Alameda,scarlet monkeyflower,Erythranthe cardinalis,scarlet monkeyflower,Plantae,319974,Phrymaceae,Erythranthe,Erythranthe cardinalis
3651914,7/9/16,2016-07-09 22:55:20 UTC,Pacific Time (US & Canada),research,http://www.inaturalist.org/observations/3651914,https://inaturalist-open-data.s3.amazonaws.com/photos/4225673/medium.,,2,0,FALSE,"Anthony Chabot Regional Park, Oakland, CA, US",37.79755,-122.154525,,,,Alameda,Broad-leaved Helleborine,Epipactis helleborine,Broad-leafed Helleborine,Plantae,50717,Orchidaceae,Epipactis,Epipactis helleborine
3659018,7/10/16,2016-07-10 19:35:25 UTC,Pacific Time (US & Canada),research,http://www.inaturalist.org/observations/3659018,https://inaturalist-open-data.s3.amazonaws.com/photos/4236257/medium.jpg,,0,0,FALSE,"Anthony Chabot Regional Park, Castro Valley, CA, US",37.79053833,-122.1363222,,,,Alameda,Brittleleaf Manzanita,Arctostaphylos crustacea,Brittleleaf Manzanita,Plantae,75507,Ericaceae,Arctostaphylos,Arctostaphylos crustacea
3880331,8/13/16,2016-08-14 02:13:45 UTC,Pacific Time (US & Canada),research,http://www.inaturalist.org/observations/3880331,http://static.inaturalist.org/photos/4552238/medium.jpg,,2,0,FALSE,"Anthony Chabot Regional Park, Castro Valley, CA, US",37.72285375,-122.110286,5,,Castro Valley,Alameda,bull thistle,Cirsium vulgare,Bull Thistle,Plantae,52989,Asteraceae,Cirsium,Cirsium vulgare
3976381,8/27/16,2016-08-27 20:44:53 UTC,Pacific Time (US & Canada),research,http://www.inaturalist.org/observations/3976381,http://static.inaturalist.org/photos/4690790/medium.jpg,,1,0,FALSE,"Anthony Chabot Regional Park, Alameda County, US-CA, US",37.79808519,-122.1527213,10,,,Alameda,Ocean spray,Holodiscus discolor,Ocean spray,Plantae,53414,Rosaceae,Holodiscus,Holodiscus discolor
3976664,8/27/16,2016-08-27 20:47:55 UTC,Pacific Time (US & Canada),research,http://www.inaturalist.org/observations/3976664,http://static.inaturalist.org/photos/4690792/medium.jpg,,2,0,FALSE,"Anthony Chabot Regional Park, Alameda County, US-CA, US",37.7974853,-122.1525968,5,,,Alameda,beaked hazelnut,Corylus cornuta,beaked hazelnut,Plantae,53374,Betulaceae,Corylus,Corylus cornuta
3976665,8/27/16,2016-08-27 20:48:37 UTC,Pacific Time (US & Canada),research,http://www.inaturalist.org/observations/3976665,http://static.inaturalist.org/photos/4690793/medium.jpg,,2,0,FALSE,"Anthony Chabot Regional Park, Alameda County, US-CA, US",37.797485,-122.1526704,5,,,Alameda,orange bush monkeyflower,Diplacus aurantiacus,orange bush monkeyflower,Plantae,777371,Phrymaceae,Diplacus,Diplacus aurantiacus
3976667,8/27/16,2016-08-27 20:51:46 UTC,Pacific Time (US & Canada),research,http://www.inaturalist.org/observations/3976667,http://static.inaturalist.org/photos/4690797/medium.jpg,,2,0,FALSE,"Anthony Chabot Regional Park, Alameda County, US-CA, US",37.79780945,-122.15259,112,,,Alameda,wavy-leafed soap plant,Chlorogalum pomeridianum,wavy-leafed soap plant,Plantae,47597,Asparagaceae,Chlorogalum,Chlorogalum pomeridianum
3976668,8/27/16,2016-08-27 20:52:47 UTC,Pacific Time (US & Canada),research,http://www.inaturalist.org/observations/3976668,http://static.inaturalist.org/photos/4690798/medium.jpg,,2,0,FALSE,"Anthony Chabot Regional Park, Alameda County, US-CA, US",37.79768558,-122.1537078,5,,,Alameda,Pacific Poison Oak,Toxicodendron diversilobum,Pacific poison oak,Plantae,51080,Anacardiaceae,Toxicodendron,Toxicodendron diversilobum
3976671,8/27/16,2016-08-27 20:53:48 UTC,Pacific Time (US & Canada),research,http://www.inaturalist.org/observations/3976671,http://static.inaturalist.org/photos/4690801/medium.jpg,,1,0,FALSE,"Anthony Chabot Regional Park, Alameda County, US-CA, US",37.79773608,-122.1537908,5,,,Alameda,yerba buena,Clinopodium douglasii,yerba buena,Plantae,53203,Lamiaceae,Clinopodium,Clinopodium douglasii
3976673,8/27/16,2016-08-27 20:57:40 UTC,Pacific Time (US & Canada),research,http://www.inaturalist.org/observations/3976673,http://static.inaturalist.org/photos/4690804/medium.jpg,,1,0,FALSE,"Anthony Chabot Regional Park, Alameda County, US-CA, US",37.79776513,-122.1547228,5,,,Alameda,scarlet monkeyflower,Erythranthe cardinalis,scarlet monkeyflower,Plantae,319974,Phrymaceae,Erythranthe,Erythranthe cardinalis
3976675,8/27/16,2016-08-27 20:58:35 UTC,Pacific Time (US & Canada),research,http://www.inaturalist.org/observations/3976675,http://static.inaturalist.org/photos/4690806/medium.jpg,,1,0,FALSE,"Anthony Chabot Regional Park, Alameda County, US-CA, US",37.79776513,-122.1547228,5,,,Alameda,scarlet monkeyflower,Erythranthe cardinalis,scarlet monkeyflower,Plantae,319974,Phrymaceae,Erythranthe,Erythranthe cardinalis
3981493,8/28/16,2016-08-28 19:05:16 UTC,Pacific Time (US & Canada),research,http://www.inaturalist.org/observations/3981493,https://inaturalist-open-data.s3.amazonaws.com/photos/4700992/medium.jpg,,2,0,FALSE,"Anthony Chabot Regional Park, Alameda County, US-CA, US",37.72733149,-122.1074658,5,,,Alameda,blue elder,Sambucus cerulea,blue elder,Plantae,143799,Viburnaceae,Sambucus,Sambucus cerulea
4033653,9/4/16,2016-09-04 19:24:50 UTC,Pacific Time (US & Canada),research,http://www.inaturalist.org/observations/4033653,https://inaturalist-open-data.s3.amazonaws.com/photos/4771008/medium.jpg,,2,0,FALSE,"Anthony Chabot Regional Park, Castro Valley, CA, US",37.74394321,-122.1147803,10,,,Alameda,Pink Honeysuckle,Lonicera hispidula,Pink Honeysuckle,Plantae,53416,Caprifoliaceae,Lonicera,Lonicera hispidula
4146149,9/17/16,2016-09-18 01:48:44 UTC,Pacific Time (US & Canada),research,http://www.inaturalist.org/observations/4146149,https://inaturalist-open-data.s3.amazonaws.com/photos/4935942/medium.jpg,,2,0,FALSE,"Anthony Chabot Regional Park, Castro Valley, CA, US",37.71939167,-122.1080862,,,Castro Valley,Alameda,Coast Live Oak,Quercus agrifolia,coast live oak,Plantae,47850,Fagaceae,Quercus,Quercus agrifolia
4511437,9/17/16,2016-09-18 00:50:44 UTC,Pacific Time (US & Canada),research,http://www.inaturalist.org/observations/4511437,https://inaturalist-open-data.s3.amazonaws.com/photos/5458439/medium.jpg,,1,0,FALSE,"Anthony Chabot Regional Park, Castro Valley, CA, US",37.71575833,-122.1023722,,,Castro Valley,Alameda,Northern California Black Walnut,Juglans hindsii,northern California black walnut,Plantae,54502,Juglandaceae,Juglans,Juglans hindsii
4398802,10/19/16,2016-10-20 01:34:14 UTC,Pacific Time (US & Canada),research,http://www.inaturalist.org/observations/4398802,https://inaturalist-open-data.s3.amazonaws.com/photos/5281664/medium.jpg,,2,0,FALSE,"Anthony Chabot Regional Park, Castro Valley, CA, US",37.77463667,-122.1259695,,,,Alameda,Pacific madrone,Arbutus menziesii,Pacific madrone,Plantae,51046,Ericaceae,Arbutus,Arbutus menziesii
4511428,11/5/16,2016-11-06 00:52:46 UTC,Pacific Time (US & Canada),research,http://www.inaturalist.org/observations/4511428,https://inaturalist-open-data.s3.amazonaws.com/photos/5458422/medium.jpg,,2,0,FALSE,"Anthony Chabot Regional Park, Castro Valley, CA, US",37.71637833,-122.1040278,,,Castro Valley,Alameda,California fuchsia,Epilobium canum,California fuchsia,Plantae,53051,Onagraceae,Epilobium,Epilobium canum
4511433,11/5/16,2016-11-06 00:32:20 UTC,Pacific Time (US & Canada),research,http://www.inaturalist.org/observations/4511433,https://inaturalist-open-data.s3.amazonaws.com/photos/5458431/medium.jpg,,1,0,FALSE,"Anthony Chabot Regional Park, Castro Valley, CA, US",37.71827167,-122.1059278,,,Castro Valley,Alameda,Toyon,Heteromeles arbutifolia,Toyon,Plantae,53405,Rosaceae,Heteromeles,Heteromeles arbutifolia
4524463,11/9/16,2016-11-10 01:03:10 UTC,Pacific Time (US & Canada),research,http://www.inaturalist.org/observations/4524463,https://inaturalist-open-data.s3.amazonaws.com/photos/5478963/medium.jpg,,3,0,FALSE,"Anthony Chabot Regional Park, Castro Valley, CA, US",37.718395,-122.1064138,,,Castro Valley,Alameda,California bay,Umbellularia californica,California bay,Plantae,48807,Lauraceae,Umbellularia,Umbellularia californica
4657696,11/28/16,2016-11-28 20:14:53 UTC,Pacific Time (US & Canada),research,http://www.inaturalist.org/observations/4657696,http://static.inaturalist.org/photos/5638302/medium.jpg,,1,0,FALSE,"Anthony Chabot Regional Park, Alameda County, US-CA, US",37.71070951,-122.1052628,5,,Castro Valley,Alameda,Himalayan Blackberry,Rubus armeniacus,Armenian Blackberry,Plantae,61317,Rosaceae,Rubus,Rubus armeniacus
4975419,1/15/17,2017-01-16 01:03:57 UTC,Pacific Time (US & Canada),research,https://www.inaturalist.org/observations/4975419,https://inaturalist-open-data.s3.amazonaws.com/photos/6074190/medium.jpg,,2,0,FALSE,"Anthony Chabot Regional Park, Oakland, CA, US",37.79786333,-122.1551667,,,,Alameda,Indian Warrior,Pedicularis densiflora,Warrior's Plume,Plantae,49645,Orobanchaceae,Pedicularis,Pedicularis densiflora
5050603,2/3/17,2017-02-04 00:12:38 UTC,Pacific Time (US & Canada),research,https://www.inaturalist.org/observations/5050603,https://inaturalist-open-data.s3.amazonaws.com/photos/6190511/medium.jpg,,3,0,FALSE,"Anthony Chabot Regional Park, Castro Valley, CA, US",37.73739167,-122.0868138,,,,Alameda,Pacific hound's tongue,Adelinia grande,Pacific hound's tongue,Plantae,769151,Boraginaceae,Adelinia,Adelinia grande
5106792,2/12/17,,Pacific Time (US & Canada),research,https://www.inaturalist.org/observations/5106792,https://inaturalist-open-data.s3.amazonaws.com/photos/6279153/medium.jpeg,,2,0,FALSE,"Anthony Chabot Park, Oakland",37.74161,-122.104433,565,,,Alameda,Sun Cup,Taraxia ovata,Sun Cup,Plantae,68182,Onagraceae,Taraxia,Taraxia ovata
5106844,2/13/17,,Pacific Time (US & Canada),research,https://www.inaturalist.org/observations/5106844,https://inaturalist-open-data.s3.amazonaws.com/photos/6279231/medium.jpeg,,4,0,FALSE,"Anthony Chabot Park, Oakland",37.740395,-122.113252,444,,,Alameda,Adelinia grande,Adelinia grande,Pacific hound's tongue,Plantae,769151,Boraginaceae,Adelinia,Adelinia grande
6107889,3/17/17,2017-03-17 23:14:00 UTC,Pacific Time (US & Canada),research,https://www.inaturalist.org/observations/6107889,https://static.inaturalist.org/photos/7642783/medium.jpg,,1,0,FALSE,"Alameda County, CA, USA",37.74416667,-122.1122139,,,,Alameda,Giant Wakerobin,Trillium chloropetalum,giant wakerobin,Plantae,50823,Melanthiaceae,Trillium,Trillium chloropetalum
6107890,3/17/17,2017-03-17 23:14:00 UTC,Pacific Time (US & Canada),research,https://www.inaturalist.org/observations/6107890,https://static.inaturalist.org/photos/7642784/medium.jpg,,1,0,FALSE,"Alameda County, CA, USA",37.74416613,-122.1122126,,,,Alameda,Giant Wakerobin,Trillium chloropetalum,giant wakerobin,Plantae,50823,Melanthiaceae,Trillium,Trillium chloropetalum
6107941,3/17/17,2017-03-17 22:01:00 UTC,Pacific Time (US & Canada),research,https://www.inaturalist.org/observations/6107941,https://static.inaturalist.org/photos/7642877/medium.jpg,,1,0,FALSE,"Alameda County, CA, USA",37.74815833,-122.1131222,,,,Alameda,Fremont's Deathcamas,Toxicoscordion fremontii,Common star lily,Plantae,49649,Melanthiaceae,Toxicoscordion,Toxicoscordion fremontii
6107972,3/17/17,2017-03-17 21:57:00 UTC,Pacific Time (US & Canada),research,https://www.inaturalist.org/observations/6107972,https://static.inaturalist.org/photos/7642893/medium.jpg,,2,0,FALSE,"Alameda County, CA, USA",37.74985,-122.1137167,,,,Alameda,checker lily,Fritillaria affinis,checker lily,Plantae,50618,Liliaceae,Fritillaria,Fritillaria affinis
6107973,3/17/17,2017-03-17 21:57:00 UTC,Pacific Time (US & Canada),research,https://www.inaturalist.org/observations/6107973,https://static.inaturalist.org/photos/7642895/medium.jpg,,2,0,FALSE,"Alameda County, CA, USA",37.74986944,-122.1137306,,,,Alameda,checker lily,Fritillaria affinis,checker lily,Plantae,50618,Liliaceae,Fritillaria,Fritillaria affinis
6107974,3/17/17,2017-03-17 21:56:00 UTC,Pacific Time (US & Canada),research,https://www.inaturalist.org/observations/6107974,https://static.inaturalist.org/photos/7642897/medium.jpg,,4,0,FALSE,"Alameda County, CA, USA",37.74998889,-122.1137861,,,,Alameda,checker lily,Fritillaria affinis,checker lily,Plantae,50618,Liliaceae,Fritillaria,Fritillaria affinis
6108042,3/17/17,2017-03-17 21:16:00 UTC,Pacific Time (US & Canada),research,https://www.inaturalist.org/observations/6108042,https://static.inaturalist.org/photos/7643020/medium.jpg,,2,0,FALSE,"Alameda County, CA, USA",37.75721111,-122.1161889,,,,Alameda,Thimbleberry,Rubus parviflorus,thimbleberry,Plantae,51646,Rosaceae,Rubus,Rubus parviflorus
5451670,3/24/17,2017-03-24 18:09:20 UTC,Pacific Time (US & Canada),research,https://www.inaturalist.org/observations/5451670,https://static.inaturalist.org/photos/6709897/medium.jpg,,2,0,FALSE,"Anthony Chabot Regional Park, Castro Valley, CA, US",37.76505333,-122.1114888,,,,Alameda,dwarf orthocarpus,Triphysaria pusilla,dwarf orthocarpus,Plantae,57276,Orobanchaceae,Triphysaria,Triphysaria pusilla
5468955,3/24/17,2017-03-24 17:03:36 UTC,Pacific Time (US & Canada),research,https://www.inaturalist.org/observations/5468955,https://static.inaturalist.org/photos/6734876/medium.jpg,,1,0,FALSE,"Anthony Chabot Regional Park, Castro Valley, CA, US",37.76281167,-122.1085362,,,,Alameda,Mediterranean lineseed,Bellardia trixago,Mediterranean lineseed,Plantae,51286,Orobanchaceae,Bellardia,Bellardia trixago
5506675,3/29/17,,Pacific Time (US & Canada),research,https://www.inaturalist.org/observations/5506675,https://inaturalist-open-data.s3.amazonaws.com/photos/6788981/medium.jpg,,1,0,FALSE,Anthony Chabot Regional Park,37.743281,-122.105359,1660,,,Alameda,common flax,Linum usitatissimum,common flax,Plantae,51306,Linaceae,Linum,Linum usitatissimum
5506804,3/29/17,,Pacific Time (US & Canada),research,https://www.inaturalist.org/observations/5506804,https://inaturalist-open-data.s3.amazonaws.com/photos/6789210/medium.jpg,,3,0,FALSE,Anthony Chabot Regional Park,37.743281,-122.105359,1660,,,Alameda,Dove's-foot crane's-bill,Geranium molle,Dove's-foot crane's-bill,Plantae,53076,Geraniaceae,Geranium,Geranium molle
5513501,3/29/17,,Pacific Time (US & Canada),research,https://www.inaturalist.org/observations/5513501,https://inaturalist-open-data.s3.amazonaws.com/photos/6799235/medium.jpeg,,1,0,FALSE,Anthony Chabot Regional Park,37.743281,-122.105359,1660,,,Alameda,orange bush monkeyflower,Diplacus aurantiacus,orange bush monkeyflower,Plantae,777371,Phrymaceae,Diplacus,Diplacus aurantiacus
5525873,3/29/17,,Pacific Time (US & Canada),research,https://www.inaturalist.org/observations/5525873,https://inaturalist-open-data.s3.amazonaws.com/photos/6817466/medium.jpg,,2,0,FALSE,"Anthony Chabot Regional Park, Oakland",37.741109,-122.104243,912,,,Alameda,Western Blue-eyed Grass,Sisyrinchium bellum,western blue-eyed grass,Plantae,49918,Iridaceae,Sisyrinchium,Sisyrinchium bellum
5525900,3/29/17,,Pacific Time (US & Canada),research,https://www.inaturalist.org/observations/5525900,https://inaturalist-open-data.s3.amazonaws.com/photos/6817542/medium.jpg,,1,0,FALSE,"Anthony Chabot Regional Park, Oakland",37.741109,-122.104243,912,,,Alameda,Sun Cup,Taraxia ovata,Sun Cup,Plantae,68182,Onagraceae,Taraxia,Taraxia ovata
5649324,4/7/17,2017-04-07 23:39:13 UTC,Pacific Time (US & Canada),research,https://www.inaturalist.org/observations/5649324,https://inaturalist-open-data.s3.amazonaws.com/photos/7045075/medium.jpg,,1,0,FALSE,"Anthony Chabot Regional Park, Castro Valley, CA, US",37.79082453,-122.1390561,5,,,Alameda,Sheep's sorrel,Rumex acetosella,Sheep's sorrel,Plantae,53195,Polygonaceae,Rumex,Rumex acetosella
5879989,4/8/17,,Pacific Time (US & Canada),research,https://www.inaturalist.org/observations/5879989,https://inaturalist-open-data.s3.amazonaws.com/photos/7327510/medium.jpg,,3,1,FALSE,lake chabot,37.7172,-122.10435,,,Castro Valley,Alameda,Bermuda buttercup,Oxalis pes-caprae,Bermuda buttercup,Plantae,53169,Oxalidaceae,Oxalis,Oxalis pes-caprae
5695163,4/14/17,2017-04-14 18:38:33 UTC,Pacific Time (US & Canada),research,https://www.inaturalist.org/observations/5695163,https://inaturalist-open-data.s3.amazonaws.com/photos/7054404/medium.jpg,,2,0,FALSE,"Anthony Chabot Regional Park, Oakland, CA, US",37.79081016,-122.1434359,5,,Oakland,Alameda,Sun Cup,Taraxia ovata,Sun Cup,Plantae,68182,Onagraceae,Taraxia,Taraxia ovata
5695176,4/14/17,2017-04-14 18:40:08 UTC,Pacific Time (US & Canada),research,https://www.inaturalist.org/observations/5695176,https://inaturalist-open-data.s3.amazonaws.com/photos/7054418/medium.jpg,,3,0,FALSE,"Anthony Chabot Regional Park, Oakland, CA, US",37.79094942,-122.1430097,5,,,Alameda,Pineapple Weed,Matricaria discoidea,pineapple-weed,Plantae,52992,Asteraceae,Matricaria,Matricaria discoidea
5695184,4/14/17,2017-04-14 18:52:24 UTC,Pacific Time (US & Canada),research,https://www.inaturalist.org/observations/5695184,https://inaturalist-open-data.s3.amazonaws.com/photos/7054434/medium.jpg,,2,0,FALSE,"Anthony Chabot Regional Park, Castro Valley, CA, US",37.79291301,-122.1422419,5,,,Alameda,Redmaids,Calandrinia menziesii,redmaids,Plantae,400267,Montiaceae,Calandrinia,Calandrinia menziesii
5695559,4/14/17,2017-04-14 19:08:57 UTC,Pacific Time (US & Canada),research,https://www.inaturalist.org/observations/5695559,https://inaturalist-open-data.s3.amazonaws.com/photos/7054917/medium.jpg,,1,0,FALSE,"Anthony Chabot Regional Park, Castro Valley, CA, US",37.79436241,-122.1430069,5,,,Alameda,Miner's Lettuce,Claytonia perfoliata,miner's lettuce,Plantae,52994,Montiaceae,Claytonia,Claytonia perfoliata
5695968,4/14/17,2017-04-14 19:04:10 UTC,Pacific Time (US & Canada),research,https://www.inaturalist.org/observations/5695968,https://inaturalist-open-data.s3.amazonaws.com/photos/7055452/medium.jpg,,1,0,FALSE,"5167 Parkridge Dr, Oakland, CA, US",37.79408593,-122.142663,5,,,Alameda,Coast Live Oak,Quercus agrifolia,coast live oak,Plantae,47850,Fagaceae,Quercus,Quercus agrifolia
5696319,4/14/17,2017-04-14 19:25:10 UTC,Pacific Time (US & Canada),research,https://www.inaturalist.org/observations/5696319,https://inaturalist-open-data.s3.amazonaws.com/photos/7055934/medium.jpg,,1,0,FALSE,"Anthony Chabot Regional Park, Castro Valley, CA, US",37.79423664,-122.1428367,5,,,Alameda,Sheep's Sorrel,Rumex acetosella,Sheep's sorrel,Plantae,53195,Polygonaceae,Rumex,Rumex acetosella
5696464,4/14/17,2017-04-14 19:37:43 UTC,Pacific Time (US & Canada),research,https://www.inaturalist.org/observations/5696464,https://inaturalist-open-data.s3.amazonaws.com/photos/7056069/medium.jpg,,1,0,FALSE,"Anthony Chabot Regional Park, Castro Valley, CA, US",37.79286335,-122.1421644,5,,,Alameda,Coffeeberry,Frangula californica,coffeeberry,Plantae,53423,Rhamnaceae,Frangula,Frangula californica
5696943,4/14/17,2017-04-14 19:45:17 UTC,Pacific Time (US & Canada),research,https://www.inaturalist.org/observations/5696943,https://inaturalist-open-data.s3.amazonaws.com/photos/7056672/medium.jpg,,1,0,FALSE,"Anthony Chabot Regional Park, Castro Valley, CA, US",37.79216312,-122.1423729,5,,,Alameda,Wavy-leafed Soap Plant,Chlorogalum pomeridianum,wavy-leafed soap plant,Plantae,47597,Asparagaceae,Chlorogalum,Chlorogalum pomeridianum
5696988,4/14/17,2017-04-14 19:26:16 UTC,Pacific Time (US & Canada),research,https://www.inaturalist.org/observations/5696988,https://inaturalist-open-data.s3.amazonaws.com/photos/7059192/medium.jpg,,2,0,FALSE,"Anthony Chabot Regional Park, Castro Valley, CA, US",37.79406737,-122.1427023,5,,,Alameda,Pacific madrone,Arbutus menziesii,Pacific madrone,Plantae,51046,Ericaceae,Arbutus,Arbutus menziesii
5699381,4/14/17,2017-04-14 19:31:36 UTC,Pacific Time (US & Canada),research,https://www.inaturalist.org/observations/5699381,https://inaturalist-open-data.s3.amazonaws.com/photos/7060222/medium.jpg,,1,0,FALSE,"Anthony Chabot Regional Park, Castro Valley, CA, US",37.79339958,-122.1426378,5,,,Alameda,Big Quaking Grass,Briza maxima,Greater Quaking Grass,Plantae,57157,Poaceae,Briza,Briza maxima
5699521,4/14/17,2017-04-14 20:04:50 UTC,Pacific Time (US & Canada),research,https://www.inaturalist.org/observations/5699521,https://inaturalist-open-data.s3.amazonaws.com/photos/7060319/medium.jpg,,1,0,FALSE,"Anthony Chabot Regional Park, Castro Valley, CA, US",37.79053733,-122.1379974,5,,,Alameda,Dipterostemon capitatus,Dipterostemon capitatus,Blue Dicks,Plantae,1196784,Asparagaceae,Dipterostemon,Dipterostemon capitatus
5700004,4/14/17,2017-04-14 20:19:11 UTC,Pacific Time (US & Canada),research,https://www.inaturalist.org/observations/5700004,https://inaturalist-open-data.s3.amazonaws.com/photos/7061188/medium.jpg,,1,0,FALSE,"Anthony Chabot Regional Park, Castro Valley, CA, US",37.78889238,-122.1355273,5,,,Alameda,Jimbrush,Ceanothus oliganthus sorediatus,Jimbrush,Plantae,53361,Rhamnaceae,Ceanothus,Ceanothus oliganthus
5700060,4/14/17,2017-04-14 20:39:52 UTC,Pacific Time (US & Canada),research,https://www.inaturalist.org/observations/5700060,https://inaturalist-open-data.s3.amazonaws.com/photos/7061307/medium.jpg,,1,0,FALSE,"Anthony Chabot Regional Park, Castro Valley, CA, US",37.78861762,-122.1353778,5,,,Alameda,California Bee Plant,Scrophularia californica,California beeplant,Plantae,50812,Scrophulariaceae,Scrophularia,Scrophularia californica
5700118,4/14/17,2017-04-14 20:42:38 UTC,Pacific Time (US & Canada),research,https://www.inaturalist.org/observations/5700118,https://inaturalist-open-data.s3.amazonaws.com/photos/7061400/medium.jpg,,2,0,FALSE,"Anthony Chabot Regional Park, Castro Valley, CA, US",37.78884527,-122.1359588,5,,,Alameda,Pink Honeysuckle,Lonicera hispidula,Pink Honeysuckle,Plantae,53416,Caprifoliaceae,Lonicera,Lonicera hispidula
5700242,4/14/17,2017-04-14 20:46:25 UTC,Pacific Time (US & Canada),research,https://www.inaturalist.org/observations/5700242,https://inaturalist-open-data.s3.amazonaws.com/photos/7061653/medium.jpg,,2,0,FALSE,"Anthony Chabot Regional Park, Castro Valley, CA, US",37.78982688,-122.136733,5,,,Alameda,California bay,Umbellularia californica,California bay,Plantae,48807,Lauraceae,Umbellularia,Umbellularia californica
5701501,4/14/17,2017-04-14 19:35:35 UTC,Pacific Time (US & Canada),research,https://www.inaturalist.org/observations/5701501,https://inaturalist-open-data.s3.amazonaws.com/photos/7063700/medium.jpg,,1,0,FALSE,"Anthony Chabot Regional Park, Castro Valley, CA, US",37.79301707,-122.1423656,5,,,Alameda,hillside gooseberry,Ribes californicum,hillside gooseberry,Plantae,47129,Grossulariaceae,Ribes,Ribes californicum
5707231,4/14/17,2017-04-14 23:11:05 UTC,Pacific Time (US & Canada),research,https://www.inaturalist.org/observations/5707231,https://inaturalist-open-data.s3.amazonaws.com/photos/7073422/medium.jpg,,1,0,FALSE,"Anthony Chabot Regional Park, Castro Valley, CA, US",37.77306768,-122.1288016,5,,,Alameda,Cow Parsnip,Heracleum maximum,common cowparsnip,Plantae,53094,Apiaceae,Heracleum,Heracleum maximum
5707556,4/14/17,2017-04-14 23:12:25 UTC,Pacific Time (US & Canada),research,https://www.inaturalist.org/observations/5707556,https://inaturalist-open-data.s3.amazonaws.com/photos/7074126/medium.jpg,,1,0,FALSE,"Anthony Chabot Regional Park, Alameda County, US-CA, US",37.77313147,-122.1287118,5,,,Alameda,Three-cornered Leek,Allium triquetrum,Three-cornered garlic,Plantae,55505,Amaryllidaceae,Allium,Allium triquetrum
5707700,4/14/17,2017-04-14 23:23:49 UTC,Pacific Time (US & Canada),research,https://www.inaturalist.org/observations/5707700,https://inaturalist-open-data.s3.amazonaws.com/photos/7074425/medium.jpg,,1,0,FALSE,"Anthony Chabot Regional Park, Alameda County, US-CA, US",37.77317702,-122.1258714,5,,,Alameda,California Poppy,Eschscholzia californica,California poppy,Plantae,48225,Papaveraceae,Eschscholzia,Eschscholzia californica
5708258,4/14/17,2017-04-14 23:30:46 UTC,Pacific Time (US & Canada),research,https://www.inaturalist.org/observations/5708258,https://inaturalist-open-data.s3.amazonaws.com/photos/7075460/medium.jpg,,1,0,FALSE,"Anthony Chabot Regional Park, Alameda County, US-CA, US",37.77428503,-122.1262109,5,,,Alameda,California Buckeye,Aesculus californica,California buckeye,Plantae,53348,Sapindaceae,Aesculus,Aesculus californica
5708366,4/14/17,2017-04-14 23:36:52 UTC,Pacific Time (US & Canada),research,https://www.inaturalist.org/observations/5708366,https://inaturalist-open-data.s3.amazonaws.com/photos/7075628/medium.jpg,,1,0,FALSE,"Anthony Chabot Regional Park, Alameda County, US-CA, US",37.77553121,-122.1261372,5,,,Alameda,Western Blue-eyed Grass,Sisyrinchium bellum,western blue-eyed grass,Plantae,49918,Iridaceae,Sisyrinchium,Sisyrinchium bellum
5708646,4/14/17,2017-04-14 23:38:36 UTC,Pacific Time (US & Canada),research,https://www.inaturalist.org/observations/5708646,https://inaturalist-open-data.s3.amazonaws.com/photos/7076141/medium.jpg,,1,0,FALSE,"Anthony Chabot Regional Park, Castro Valley, CA, US",37.7756496,-122.1260913,22,,,Alameda,Twinberry Honeysuckle,Lonicera involucrata,twinberry honeysuckle,Plantae,60881,Caprifoliaceae,Lonicera,Lonicera involucrata
5708916,4/14/17,2017-04-14 23:58:29 UTC,Pacific Time (US & Canada),research,https://www.inaturalist.org/observations/5708916,https://inaturalist-open-data.s3.amazonaws.com/photos/7076596/medium.jpg,,1,0,FALSE,"Anthony Chabot Regional Park, Alameda County, US-CA, US",37.77936853,-122.1326834,10,,,Alameda,fringe cups,Tellima grandiflora,fringe cups,Plantae,51655,Saxifragaceae,Tellima,Tellima grandiflora
5709234,4/14/17,2017-04-15 00:16:53 UTC,Pacific Time (US & Canada),research,https://www.inaturalist.org/observations/5709234,https://inaturalist-open-data.s3.amazonaws.com/photos/7077137/medium.jpg,,1,0,FALSE,"Anthony Chabot Regional Park, Castro Valley, CA, US",37.7781814,-122.1335256,5,,,Alameda,Evergreen Huckleberry,Vaccinium ovatum,Evergreen Huckleberry,Plantae,48349,Ericaceae,Vaccinium,Vaccinium ovatum
5709260,4/14/17,2017-04-15 00:21:37 UTC,Pacific Time (US & Canada),research,https://www.inaturalist.org/observations/5709260,https://inaturalist-open-data.s3.amazonaws.com/photos/7077212/medium.jpg,,1,0,FALSE,"Anthony Chabot Regional Park, Castro Valley, CA, US",37.77757119,-122.1328218,5,,,Alameda,Bigleaf Maple,Acer macrophyllum,bigleaf maple,Plantae,48227,Sapindaceae,Acer,Acer macrophyllum
5741850,4/15/17,2017-04-16 00:19:41 UTC,Pacific Time (US & Canada),research,https://www.inaturalist.org/observations/5741850,https://static.inaturalist.org/photos/7123850/medium.jpeg,,2,0,FALSE,"Anthony Chabot Regional Park, Alameda County, US-CA, US",37.72453297,-122.1122804,42,,Castro Valley,Alameda,California bay,Umbellularia californica,California bay,Plantae,48807,Lauraceae,Umbellularia,Umbellularia californica
7127611,4/18/17,2017-04-18 21:41:35 UTC,Pacific Time (US & Canada),research,https://www.inaturalist.org/observations/7127611,https://static.inaturalist.org/photos/9171248/medium.jpg,,1,0,FALSE,Lake Chabot Regional Park,37.72158023,-122.1039775,178,,Castro Valley,Alameda,orange bush monkeyflower,Diplacus aurantiacus,orange bush monkeyflower,Plantae,777371,Phrymaceae,Diplacus,Diplacus aurantiacus
7148962,5/1/17,2017-05-01 21:43:03 UTC,Pacific Time (US & Canada),research,https://www.inaturalist.org/observations/7148962,https://static.inaturalist.org/photos/9205680/medium.jpg,,1,0,FALSE,Lake Chabot Regional Park,37.717069,-122.104349,211,,Castro Valley,Alameda,Red Valerian,Centranthus ruber,Red Valerian,Plantae,57283,Caprifoliaceae,Centranthus,Centranthus ruber
12989240,5/2/17,2017-05-02 19:22:46 UTC,Pacific Time (US & Canada),research,https://www.inaturalist.org/observations/12989240,https://static.inaturalist.org/photos/18891330/medium.jpeg,,2,0,FALSE,"17500 Lake Chabot Rd, Castro Valley, CA 94546, USA",37.72021866,-122.1126633,,,Castro Valley,Alameda,common yarrow,Achillea millefolium,common yarrow,Plantae,52821,Asteraceae,Achillea,Achillea millefolium
6115150,5/6/17,2017-05-06 20:52:34 UTC,Pacific Time (US & Canada),research,https://www.inaturalist.org/observations/6115150,https://inaturalist-open-data.s3.amazonaws.com/photos/7653866/medium.jpeg,,2,0,FALSE,"Goldenrod Trail Oakland, CA 94605",37.75289458,-122.1174794,7,,,Alameda,French broom,Genista monspessulana,French broom,Plantae,53403,Fabaceae,Genista,Genista monspessulana
6115245,5/6/17,2017-05-06 20:59:12 UTC,Pacific Time (US & Canada),research,https://www.inaturalist.org/observations/6115245,https://inaturalist-open-data.s3.amazonaws.com/photos/7654035/medium.jpeg,,2,0,FALSE,"Goldenrod Trail Oakland, CA 94605",37.75114108,-122.1165753,3,,,Alameda,Wild Radish,Raphanus sativus,wild radish,Plantae,55410,Brassicaceae,Raphanus,Raphanus sativus
6116490,5/6/17,2017-05-06 22:20:56 UTC,Pacific Time (US & Canada),research,https://www.inaturalist.org/observations/6116490,https://inaturalist-open-data.s3.amazonaws.com/photos/7655878/medium.jpeg,,2,0,FALSE,"Columbine Trail Oakland, CA 94605",37.74524952,-122.1125944,17,,,Alameda,Pacific Poison Oak,Toxicodendron diversilobum,Pacific poison oak,Plantae,51080,Anacardiaceae,Toxicodendron,Toxicodendron diversilobum
7735633,5/13/17,2017-05-13 14:51:08 UTC,Pacific Time (US & Canada),research,https://www.inaturalist.org/observations/7735633,https://static.inaturalist.org/photos/10151538/medium.jpg,,1,0,FALSE,"Lake Chabot Golf Course, Oakland, CA, US",37.74167,-122.1163945,,,Oakland,Alameda,Dipterostemon capitatus,Dipterostemon capitatus,Blue Dicks,Plantae,1196784,Asparagaceae,Dipterostemon,Dipterostemon capitatus
8124065,5/16/17,2017-05-16 19:59:37 UTC,Pacific Time (US & Canada),research,https://www.inaturalist.org/observations/8124065,https://static.inaturalist.org/photos/10766823/medium.jpg,,2,0,FALSE,"Anthony Chabot Regional Park, Castro Valley, CA, US",37.74906167,-122.1137472,,,,Alameda,Stinking iris,Iris foetidissima,Stinking iris,Plantae,64331,Iridaceae,Iris,Iris foetidissima
6288926,5/17/17,2017-05-17 23:37:50 UTC,Pacific Time (US & Canada),research,https://www.inaturalist.org/observations/6288926,https://inaturalist-open-data.s3.amazonaws.com/photos/7915191/medium.jpg,,1,0,FALSE,"Lake Chabot, Castro Valley, CA, US",37.72699049,-122.1046112,176,,,Alameda,Mediterranean lineseed,Bellardia trixago,Mediterranean lineseed,Plantae,51286,Orobanchaceae,Bellardia,Bellardia trixago
7708283,5/19/17,2017-05-19 19:59:26 UTC,Pacific Time (US & Canada),research,https://www.inaturalist.org/observations/7708283,https://static.inaturalist.org/photos/10106816/medium.jpg,,2,0,FALSE,"Anthony Chabot Regional Park, Castro Valley, CA, US",37.75572167,-122.1181333,,,,Alameda,Mediterranean lineseed,Bellardia trixago,Mediterranean lineseed,Plantae,51286,Orobanchaceae,Bellardia,Bellardia trixago
8447950,5/20/17,2017-05-20 18:42:00 UTC,Pacific Time (US & Canada),research,https://www.inaturalist.org/observations/8447950,https://inaturalist-open-data.s3.amazonaws.com/photos/11256628/medium.jpg,,1,0,FALSE,"Alameda County, CA, USA",37.77722222,-122.1272222,,,,Alameda,California poppy,Eschscholzia californica,California poppy,Plantae,48225,Papaveraceae,Eschscholzia,Eschscholzia californica
6518258,6/5/17,2017-06-05 19:17:52 UTC,Pacific Time (US & Canada),research,https://www.inaturalist.org/observations/6518258,https://inaturalist-open-data.s3.amazonaws.com/photos/8255643/medium.jpg,,1,0,FALSE,"Anthony Chabot Regional Park, Castro Valley, CA, US",37.74676257,-122.1117802,241,,,Alameda,North Californian Indian pink,Silene laciniata californica,North Californian Indian pink,Plantae,62222,Caryophyllaceae,Silene,Silene laciniata
15796636,6/7/17,2017-06-07 22:51:00 UTC,Pacific Time (US & Canada),research,https://www.inaturalist.org/observations/15796636,https://inaturalist-open-data.s3.amazonaws.com/photos/23607970/medium.jpg,"Cameron Loop, Lake Chabot Regional Park, Castro Valley, CA",1,0,FALSE,"Alameda County, CA, USA",37.72825382,-122.0880867,31,,,Alameda,Yorkshire fog,Holcus lanatus,Yorkshire fog,Plantae,52793,Poaceae,Holcus,Holcus lanatus
7364020,6/14/17,,UTC,research,https://www.inaturalist.org/observations/7364020,https://static.inaturalist.org/photos/9549082/medium.jpg,,3,1,FALSE,"Castro Valley, CA, USA",37.7158132,-122.1117308,265,,Castro Valley,Alameda,clay mariposa lily,Calochortus argillosus,clay mariposa lily,Plantae,64330,Liliaceae,Calochortus,Calochortus argillosus
34569087,6/24/17,2017-06-24 20:28:00 UTC,Pacific Time (US & Canada),research,https://www.inaturalist.org/observations/34569087,https://inaturalist-open-data.s3.amazonaws.com/photos/54419394/medium.jpg,,2,0,FALSE,"Alameda County, CA, USA",37.75638889,-122.1119444,,,,Alameda,broad-leaved sweet pea,Lathyrus latifolius,broad-leaved sweet pea,Plantae,61009,Fabaceae,Lathyrus,Lathyrus latifolius
6938020,7/5/17,2017-07-06 01:00:39 UTC,Pacific Time (US & Canada),research,https://www.inaturalist.org/observations/6938020,https://inaturalist-open-data.s3.amazonaws.com/photos/8865529/medium.jpg,,1,0,FALSE,"Anthony Chabot Regional Park, Castro Valley, CA, US",37.75720711,-122.1132562,50,,,Alameda,orange bush monkeyflower,Diplacus aurantiacus,orange bush monkeyflower,Plantae,777371,Phrymaceae,Diplacus,Diplacus aurantiacus
6938025,7/5/17,2017-07-06 01:04:37 UTC,Pacific Time (US & Canada),research,https://www.inaturalist.org/observations/6938025,https://inaturalist-open-data.s3.amazonaws.com/photos/8865535/medium.jpg,,1,0,FALSE,"Anthony Chabot Regional Park, Castro Valley, CA, US",37.75575654,-122.1134298,30,,,Alameda,California Sagebrush,Artemisia californica,California sagebrush,Plantae,53357,Asteraceae,Artemisia,Artemisia californica
6938040,7/5/17,2017-07-06 01:24:21 UTC,Pacific Time (US & Canada),research,https://www.inaturalist.org/observations/6938040,https://inaturalist-open-data.s3.amazonaws.com/photos/8865549/medium.jpg,,2,0,FALSE,"Anthony Chabot Regional Park, Castro Valley, CA, US",37.75938712,-122.1165409,500,,,Alameda,Bigleaf Maple,Acer macrophyllum,bigleaf maple,Plantae,48227,Sapindaceae,Acer,Acer macrophyllum
6938048,7/5/17,2017-07-06 01:26:09 UTC,Pacific Time (US & Canada),research,https://www.inaturalist.org/observations/6938048,https://inaturalist-open-data.s3.amazonaws.com/photos/8865557/medium.jpg,,1,0,FALSE,"Anthony Chabot Regional Park, Castro Valley, CA, US",37.75844562,-122.1172904,20,,,Alameda,Ocean spray,Holodiscus discolor,Ocean spray,Plantae,53414,Rosaceae,Holodiscus,Holodiscus discolor
12989070,7/13/17,2017-07-13 19:53:20 UTC,Pacific Time (US & Canada),research,https://www.inaturalist.org/observations/12989070,https://static.inaturalist.org/photos/18890958/medium.jpeg,,3,0,FALSE,"17280 Cardinal Ct, Castro Valley, CA 94546, USA",37.72128296,-122.0823593,,,Castro Valley,Alameda,blue elder,Sambucus cerulea,blue elder,Plantae,143799,Viburnaceae,Sambucus,Sambucus cerulea
7285784,7/30/17,2017-07-30 22:25:58 UTC,Pacific Time (US & Canada),research,https://www.inaturalist.org/observations/7285784,https://static.inaturalist.org/photos/9422793/medium.jpg,,1,0,FALSE,"Anthony Chabot Regional Park, Alameda County, US-CA, US",37.7572952,-122.1166832,10,,,Alameda,Coyote Mint,Monardella villosa,Coyote Mint,Plantae,52181,Lamiaceae,Monardella,Monardella villosa
15733172,8/16/17,2017-08-16 19:55:00 UTC,Pacific Time (US & Canada),research,https://www.inaturalist.org/observations/15733172,https://inaturalist-open-data.s3.amazonaws.com/photos/23491447/medium.jpg,"Brandon Trail, Anthony Chabot Regional Park, Oakland CA",1,0,FALSE,"Alameda County, CA, USA",37.77416955,-122.1257241,15,,,Alameda,Cardre  lainer,Dipsacus sativus,fuller's teasel,Plantae,53028,Caprifoliaceae,Dipsacus,Dipsacus sativus
15733173,8/16/17,2017-08-16 19:55:00 UTC,Pacific Time (US & Canada),research,https://www.inaturalist.org/observations/15733173,https://inaturalist-open-data.s3.amazonaws.com/photos/23491454/medium.jpg,"Brandon Trail, Anthony Chabot Regional Park, Oakland CA",1,0,FALSE,"Alameda County, CA, USA",37.766583,-122.1208649,31,,,Alameda,stinging nettle,Urtica dioica,great stinging nettle,Plantae,51884,Urticaceae,Urtica,Urtica dioica
15735815,8/16/17,2017-08-16 21:22:00 UTC,Pacific Time (US & Canada),research,https://www.inaturalist.org/observations/15735815,https://inaturalist-open-data.s3.amazonaws.com/photos/23495561/medium.jpg,"Brandon Trail, Anthony Chabot Regional Park, Oakland, CA",1,0,FALSE,"Alameda County, CA, USA",37.75565419,-122.1159686,31,,,Alameda,broad-leaved sweet pea,Lathyrus latifolius,broad-leaved sweet pea,Plantae,61009,Fabaceae,Lathyrus,Lathyrus latifolius
7815496,9/6/17,2017-09-07 01:44:10 UTC,Pacific Time (US & Canada),research,https://www.inaturalist.org/observations/7815496,https://static.inaturalist.org/photos/10281009/medium.jpg,,1,0,FALSE,"Anthony Chabot Regional Park, Castro Valley, CA, US",37.76011957,-122.1202906,5,,,Alameda,Eurabbie,Eucalyptus globulus,Eurabbie,Plantae,53398,Myrtaceae,Eucalyptus,Eucalyptus globulus
7815598,9/6/17,2017-09-07 01:50:58 UTC,Pacific Time (US & Canada),research,https://www.inaturalist.org/observations/7815598,https://static.inaturalist.org/photos/10281093/medium.jpg,,2,0,FALSE,"Anthony Chabot Regional Park, Castro Valley, CA, US",37.76114405,-122.12174,5,,,Alameda,California bay,Umbellularia californica,California bay,Plantae,48807,Lauraceae,Umbellularia,Umbellularia californica
7815658,9/6/17,2017-09-07 01:58:47 UTC,Pacific Time (US & Canada),research,https://www.inaturalist.org/observations/7815658,https://static.inaturalist.org/photos/10281151/medium.jpg,,1,0,FALSE,"Anthony Chabot Regional Park, Castro Valley, CA, US",37.76323097,-122.1237361,5,,Oakland,Alameda,Pacific Poison Oak,Toxicodendron diversilobum,Pacific poison oak,Plantae,51080,Anacardiaceae,Toxicodendron,Toxicodendron diversilobum
8683060,11/4/17,2017-11-04 20:17:56 UTC,Pacific Time (US & Canada),research,https://www.inaturalist.org/observations/8683060,https://inaturalist-open-data.s3.amazonaws.com/photos/11635604/medium.jpg,,1,0,FALSE,"Lake Chabot Golf Course, Oakland, CA, US",37.73609842,-122.1137553,10,,,Alameda,Pink Honeysuckle,Lonicera hispidula,Pink Honeysuckle,Plantae,53416,Caprifoliaceae,Lonicera,Lonicera hispidula
8683093,11/4/17,2017-11-04 20:19:17 UTC,Pacific Time (US & Canada),research,https://www.inaturalist.org/observations/8683093,https://inaturalist-open-data.s3.amazonaws.com/photos/11635616/medium.jpg,,1,0,FALSE,"Anthony Chabot Regional Park, Castro Valley, CA, US",37.73612704,-122.113426,10,,,Alameda,orange bush monkeyflower,Diplacus aurantiacus,orange bush monkeyflower,Plantae,777371,Phrymaceae,Diplacus,Diplacus aurantiacus
8683111,11/4/17,2017-11-04 20:20:15 UTC,Pacific Time (US & Canada),research,https://www.inaturalist.org/observations/8683111,https://inaturalist-open-data.s3.amazonaws.com/photos/11635683/medium.jpg,,1,0,FALSE,"Anthony Chabot Regional Park, Castro Valley, CA, US",37.73618123,-122.1133436,5,,,Alameda,California sagebrush,Artemisia californica,California sagebrush,Plantae,53357,Asteraceae,Artemisia,Artemisia californica
8683155,11/4/17,2017-11-04 20:23:10 UTC,Pacific Time (US & Canada),research,https://www.inaturalist.org/observations/8683155,https://inaturalist-open-data.s3.amazonaws.com/photos/11635747/medium.jpg,,2,0,FALSE,"Anthony Chabot Regional Park, Castro Valley, CA, US",37.73608077,-122.1125387,10,,,Alameda,California bay,Umbellularia californica,California bay,Plantae,48807,Lauraceae,Umbellularia,Umbellularia californica
8741918,11/4/17,2017-11-04 20:30:05 UTC,Pacific Time (US & Canada),research,https://www.inaturalist.org/observations/8741918,https://inaturalist-open-data.s3.amazonaws.com/photos/11733886/medium.jpg,,1,0,FALSE,"Anthony Chabot Regional Park, Castro Valley, CA, US",37.73604687,-122.113135,5,,,Alameda,Pink Honeysuckle,Lonicera hispidula,Pink Honeysuckle,Plantae,53416,Caprifoliaceae,Lonicera,Lonicera hispidula
9120826,12/10/17,2017-12-11 00:16:31 UTC,Pacific Time (US & Canada),research,https://www.inaturalist.org/observations/9120826,https://static.inaturalist.org/photos/12324155/medium.jpg,,1,0,FALSE,"Anthony Chabot Regional Park, Castro Valley, CA, US",37.730725,-122.1081,,,,Alameda,Tasmanian Blue Gum,Eucalyptus globulus,Eurabbie,Plantae,53398,Myrtaceae,Eucalyptus,Eucalyptus globulus
9182339,12/17/17,2017-12-17 18:39:59 UTC,Pacific Time (US & Canada),research,https://www.inaturalist.org/observations/9182339,https://inaturalist-open-data.s3.amazonaws.com/photos/12427803/medium.jpeg,,1,0,FALSE,"2601-2655 Fairmont Dr, Castro Valley, CA 94546, USA",37.71375354,-122.108023,7,,Castro Valley,Alameda,Rosilla,Helenium puberulum,Rosilla,Plantae,53092,Asteraceae,Helenium,Helenium puberulum
9323187,12/31/17,2017-12-31 18:46:46 UTC,Pacific Time (US & Canada),research,https://www.inaturalist.org/observations/9323187,https://static.inaturalist.org/photos/12643330/medium.jpg,,2,0,FALSE,"Anthony Chabot Regional Park, Alameda County, US-CA, US",37.77499225,-122.1301713,5,,,Alameda,Toyon,Heteromeles arbutifolia,Toyon,Plantae,53405,Rosaceae,Heteromeles,Heteromeles arbutifolia
9551822,1/21/18,2018-01-21 18:08:37 UTC,Pacific Time (US & Canada),research,https://www.inaturalist.org/observations/9551822,https://static.inaturalist.org/photos/13033060/medium.jpg,,2,0,FALSE,"Anthony Chabot Regional Park, Alameda County, US-CA, US",37.77349202,-122.130218,5,,,Alameda,orange bush monkeyflower,Diplacus aurantiacus,orange bush monkeyflower,Plantae,777371,Phrymaceae,Diplacus,Diplacus aurantiacus
9551826,1/21/18,2018-01-21 18:20:32 UTC,Pacific Time (US & Canada),research,https://www.inaturalist.org/observations/9551826,https://static.inaturalist.org/photos/13033064/medium.jpg,,2,0,FALSE,"Anthony Chabot Regional Park, Alameda County, US-CA, US",37.77627053,-122.1292401,5,,,Alameda,coast live oak,Quercus agrifolia,coast live oak,Plantae,47850,Fagaceae,Quercus,Quercus agrifolia
9730406,2/4/18,2018-02-04 18:29:49 UTC,Pacific Time (US & Canada),research,https://www.inaturalist.org/observations/9730406,https://static.inaturalist.org/photos/13313582/medium.jpg,,1,0,FALSE,"Anthony Chabot Regional Park, Castro Valley, CA, US",37.77686632,-122.1304958,10,,,Alameda,pacific madrone,Arbutus menziesii,Pacific madrone,Plantae,51046,Ericaceae,Arbutus,Arbutus menziesii
9808654,2/9/18,2018-02-09 21:58:07 UTC,Pacific Time (US & Canada),research,https://www.inaturalist.org/observations/9808654,https://static.inaturalist.org/photos/13422110/medium.jpg,,2,0,FALSE,"Anthony Chabot Regional Park, Castro Valley, CA, US",37.72368411,-122.1032929,265,,Castro Valley,Alameda,Wild strawberry,Fragaria vesca,woodland strawberry,Plantae,50298,Rosaceae,Fragaria,Fragaria vesca
9808669,2/9/18,2018-02-09 22:06:19 UTC,Pacific Time (US & Canada),research,https://www.inaturalist.org/observations/9808669,https://static.inaturalist.org/photos/13422143/medium.jpg,,1,0,FALSE,"Anthony Chabot Regional Park, Castro Valley, CA, US",37.72384026,-122.1032117,257,,Castro Valley,Alameda,poison hemlock,Conium maculatum,poison hemlock,Plantae,52998,Apiaceae,Conium,Conium maculatum
9816782,2/9/18,2018-02-09 22:31:27 UTC,Pacific Time (US & Canada),research,https://www.inaturalist.org/observations/9816782,https://static.inaturalist.org/photos/13436593/medium.jpg,,1,0,FALSE,"Lake Chabot, Castro Valley, CA, US",37.72558183,-122.1021762,178,,Castro Valley,Alameda,hillside gooseberry,Ribes californicum,hillside gooseberry,Plantae,47129,Grossulariaceae,Ribes,Ribes californicum
9816813,2/9/18,2018-02-09 23:03:20 UTC,Pacific Time (US & Canada),research,https://www.inaturalist.org/observations/9816813,https://static.inaturalist.org/photos/13437592/medium.jpg,,1,0,FALSE,"Anthony Chabot Regional Park, Castro Valley, CA, US",37.72586822,-122.1014621,243,,Castro Valley,Alameda,broadleaf forget-me-not,Myosotis latifolia,broadleaf forget-me-not,Plantae,49132,Boraginaceae,Myosotis,Myosotis latifolia
9824399,2/11/18,2018-02-11 18:05:41 UTC,Pacific Time (US & Canada),research,https://www.inaturalist.org/observations/9824399,https://static.inaturalist.org/photos/13449481/medium.jpg,,1,0,FALSE,"Anthony Chabot Regional Park, Alameda County, US-CA, US",37.77524496,-122.1292103,5,,,Alameda,California sagebrush,Artemisia californica,California sagebrush,Plantae,53357,Asteraceae,Artemisia,Artemisia californica
9824404,2/11/18,2018-02-11 18:10:32 UTC,Pacific Time (US & Canada),research,https://www.inaturalist.org/observations/9824404,https://static.inaturalist.org/photos/13449483/medium.jpg,,2,0,FALSE,"Anthony Chabot Regional Park, Alameda County, US-CA, US",37.77457852,-122.129995,5,,,Alameda,Pacific pea,Lathyrus vestitus,Pacific pea,Plantae,50320,Fabaceae,Lathyrus,Lathyrus vestitus
9886747,2/11/18,2018-02-11 20:09:45 UTC,Pacific Time (US & Canada),research,https://www.inaturalist.org/observations/9886747,https://static.inaturalist.org/photos/13553156/medium.jpg,,3,0,FALSE,"Anthony Chabot Regional Park, Castro Valley, CA, US",37.72442779,-122.1116176,357,,Castro Valley,Alameda,Adelinia grande,Adelinia grande,Pacific hound's tongue,Plantae,769151,Boraginaceae,Adelinia,Adelinia grande
9906702,2/18/18,2018-02-18 16:25:44 UTC,Pacific Time (US & Canada),research,https://www.inaturalist.org/observations/9906702,https://inaturalist-open-data.s3.amazonaws.com/photos/14416301/medium.jpg,,1,0,FALSE,"Anthony Chabot Regional Park, Oakland, CA, US",37.75820099,-122.1190371,5,,,Alameda,Tasmanian blackwood,Acacia melanoxylon,blackwood,Plantae,53344,Fabaceae,Acacia,Acacia melanoxylon
9913392,2/18/18,2018-02-18 21:00:19 UTC,Pacific Time (US & Canada),research,https://www.inaturalist.org/observations/9913392,https://inaturalist-open-data.s3.amazonaws.com/photos/13597624/medium.jpeg,,2,0,FALSE,"Skyline Trail, Oakland, CA 94605, USA",37.75820582,-122.1172113,516,,,Alameda,broadleaf forget-me-not,Myosotis latifolia,broadleaf forget-me-not,Plantae,49132,Boraginaceae,Myosotis,Myosotis latifolia
10615108,2/19/18,2018-02-19 20:15:18 UTC,Pacific Time (US & Canada),research,https://www.inaturalist.org/observations/10615108,https://static.inaturalist.org/photos/14805108/medium.jpg,,2,0,FALSE,"Anthony Chabot Regional Park, Alameda County, US-CA, US",37.74386827,-122.1124822,5,,,Alameda,Wild strawberry,Fragaria vesca,woodland strawberry,Plantae,50298,Rosaceae,Fragaria,Fragaria vesca
9986562,2/24/18,2018-02-24 23:11:44 UTC,Pacific Time (US & Canada),research,https://www.inaturalist.org/observations/9986562,https://static.inaturalist.org/photos/13726283/medium.jpg,,2,0,FALSE,"Anthony Chabot Regional Park, Alameda County, US-CA, US",37.79697408,-122.149929,30,,,Alameda,giant wakerobin,Trillium chloropetalum,giant wakerobin,Plantae,50823,Melanthiaceae,Trillium,Trillium chloropetalum
10015102,2/26/18,2018-02-26 23:05:53 UTC,Pacific Time (US & Canada),research,https://www.inaturalist.org/observations/10015102,https://inaturalist-open-data.s3.amazonaws.com/photos/13773636/medium.jpg,,2,0,FALSE,"Anthony Chabot Regional Park, Castro Valley, CA, US",37.72536957,-122.1148248,305,,Castro Valley,Alameda,California bay,Umbellularia californica,California bay,Plantae,48807,Lauraceae,Umbellularia,Umbellularia californica
10036013,2/28/18,2018-02-28 21:23:46 UTC,Pacific Time (US & Canada),research,https://www.inaturalist.org/observations/10036013,https://static.inaturalist.org/photos/13811115/medium.jpg,,3,0,FALSE,"Anthony Chabot Regional Park, Oakland, CA, US",37.748905,-122.1136083,10,,,Alameda,milkmaids,Cardamine californica,milkmaids,Plantae,49651,Brassicaceae,Cardamine,Cardamine californica
10042039,2/28/18,2018-02-28 21:43:23 UTC,Pacific Time (US & Canada),research,https://www.inaturalist.org/observations/10042039,https://static.inaturalist.org/photos/13816965/medium.jpg,,2,0,FALSE,"Anthony Chabot Regional Park, Oakland, CA, US",37.75328333,-122.1158138,5,,,Alameda,Trillium chloropetalum giganteum,Trillium chloropetalum giganteum,,Plantae,243295,Melanthiaceae,Trillium,Trillium chloropetalum
10042061,2/28/18,2018-02-28 21:44:42 UTC,Pacific Time (US & Canada),research,https://www.inaturalist.org/observations/10042061,https://static.inaturalist.org/photos/13817002/medium.jpg,,2,0,FALSE,"Anthony Chabot Regional Park, Oakland, CA, US",37.75329167,-122.1158445,5,,,Alameda,giant wakerobin,Trillium chloropetalum,giant wakerobin,Plantae,50823,Melanthiaceae,Trillium,Trillium chloropetalum
10172440,3/10/18,2018-03-10 17:44:51 UTC,Pacific Time (US & Canada),research,https://www.inaturalist.org/observations/10172440,https://static.inaturalist.org/photos/14067367/medium.jpg,,1,0,FALSE,"Anthony Chabot Regional Park, Alameda County, US-CA, US",37.77533356,-122.1297473,10,,,Alameda,Sun Cup,Taraxia ovata,Sun Cup,Plantae,68182,Onagraceae,Taraxia,Taraxia ovata
11857912,3/17/18,2018-03-17 23:34:36 UTC,Pacific Time (US & Canada),research,https://www.inaturalist.org/observations/11857912,https://inaturalist-open-data.s3.amazonaws.com/photos/16971760/medium.jpg,,1,0,FALSE,"Anthony Chabot Regional Park, Oakland, CA, US",37.74014667,-122.1150138,16,,Oakland,Alameda,Greater celandine,Chelidonium majus,Greater celandine,Plantae,55757,Papaveraceae,Chelidonium,Chelidonium majus
11860162,3/17/18,2018-03-17 23:55:48 UTC,Pacific Time (US & Canada),research,https://www.inaturalist.org/observations/11860162,https://inaturalist-open-data.s3.amazonaws.com/photos/16975457/medium.jpg,,1,0,FALSE,"Anthony Chabot Regional Park, Oakland, CA, US",37.74434167,-122.1124888,400,,,Alameda,giant wakerobin,Trillium chloropetalum,giant wakerobin,Plantae,50823,Melanthiaceae,Trillium,Trillium chloropetalum
11977829,3/17/18,2018-03-18 00:16:41 UTC,Pacific Time (US & Canada),research,https://www.inaturalist.org/observations/11977829,https://inaturalist-open-data.s3.amazonaws.com/photos/17158103/medium.jpg,,1,0,FALSE,"Lake Chabot Golf Course, Oakland, CA, US",37.746425,-122.1153555,6,,,Alameda,Sun Cup,Taraxia ovata,Sun Cup,Plantae,68182,Onagraceae,Taraxia,Taraxia ovata
10344236,3/21/18,2018-03-21 18:29:32 UTC,Pacific Time (US & Canada),research,https://www.inaturalist.org/observations/10344236,https://static.inaturalist.org/photos/14344457/medium.jpg,,1,0,FALSE,"Anthony Chabot Regional Park, Castro Valley, CA, US",37.72872807,-122.090607,22,,,Alameda,Three-cornered Leek,Allium triquetrum,Three-cornered garlic,Plantae,55505,Amaryllidaceae,Allium,Allium triquetrum
10349007,3/21/18,2018-03-21 18:23:21 UTC,Pacific Time (US & Canada),research,https://www.inaturalist.org/observations/10349007,https://static.inaturalist.org/photos/14352442/medium.jpg,,1,0,FALSE,"Anthony Chabot Regional Park, Castro Valley, CA, US",37.72520364,-122.0882435,16,,Castro Valley,Alameda,broadleaf forget-me-not,Myosotis latifolia,broadleaf forget-me-not,Plantae,49132,Boraginaceae,Myosotis,Myosotis latifolia
10422355,3/25/18,2018-03-25 23:46:42 UTC,Pacific Time (US & Canada),research,https://www.inaturalist.org/observations/10422355,https://static.inaturalist.org/photos/14478612/medium.jpg,,1,0,FALSE,"Anthony Chabot Regional Park, Castro Valley, CA, US",37.72727952,-122.0930545,5,,Castro Valley,Alameda,Common Vetch,Vicia sativa,Common Vetch,Plantae,53324,Fabaceae,Vicia,Vicia sativa
10522826,3/26/18,2018-03-27 04:08:00 UTC,Hawaii,research,https://www.inaturalist.org/observations/10522826,https://static.inaturalist.org/photos/14645939/medium.jpg,,2,0,FALSE,"Alameda County, CA, USA",37.76476667,-122.1122194,5,,,Alameda,bigleaf maple,Acer macrophyllum,bigleaf maple,Plantae,48227,Sapindaceae,Acer,Acer macrophyllum
10519953,3/30/18,2018-03-31 00:23:55 UTC,Pacific Time (US & Canada),research,https://www.inaturalist.org/observations/10519953,https://inaturalist-open-data.s3.amazonaws.com/photos/14640527/medium.jpg,,1,0,FALSE,"Anthony Chabot Regional Park, Oakland, CA, US",37.78754394,-122.1346147,5,,,Alameda,Common Vetch,Vicia sativa,Common Vetch,Plantae,53324,Fabaceae,Vicia,Vicia sativa
10519960,3/30/18,2018-03-31 00:25:22 UTC,Pacific Time (US & Canada),research,https://www.inaturalist.org/observations/10519960,https://inaturalist-open-data.s3.amazonaws.com/photos/14640536/medium.jpg,,1,0,FALSE,"Anthony Chabot Regional Park, Oakland, CA, US",37.78777612,-122.1345183,22,,,Alameda,trailing blackberry,Rubus ursinus,trailing blackberry,Plantae,53445,Rosaceae,Rubus,Rubus ursinus
10519991,3/30/18,2018-03-31 00:30:25 UTC,Pacific Time (US & Canada),research,https://www.inaturalist.org/observations/10519991,https://inaturalist-open-data.s3.amazonaws.com/photos/14640561/medium.jpg,,1,0,FALSE,"Anthony Chabot Regional Park, Oakland, CA, US",37.78823381,-122.1348549,5,,,Alameda,western blue-eyed grass,Sisyrinchium bellum,western blue-eyed grass,Plantae,49918,Iridaceae,Sisyrinchium,Sisyrinchium bellum
10520017,3/30/18,2018-03-31 00:49:14 UTC,Pacific Time (US & Canada),research,https://www.inaturalist.org/observations/10520017,https://inaturalist-open-data.s3.amazonaws.com/photos/14640602/medium.jpg,,1,0,FALSE,"Anthony Chabot Regional Park, Oakland, CA, US",37.79019413,-122.137443,5,,,Alameda,miner's lettuce,Claytonia perfoliata,miner's lettuce,Plantae,52994,Montiaceae,Claytonia,Claytonia perfoliata
10520023,3/30/18,2018-03-31 00:54:05 UTC,Pacific Time (US & Canada),research,https://www.inaturalist.org/observations/10520023,https://inaturalist-open-data.s3.amazonaws.com/photos/14640614/medium.jpg,,1,0,FALSE,"Anthony Chabot Regional Park, Oakland, CA, US",37.79083916,-122.1397441,22,,,Alameda,Sun Cup,Taraxia ovata,Sun Cup,Plantae,68182,Onagraceae,Taraxia,Taraxia ovata
10575727,4/1/18,2018-04-01 23:45:24 UTC,Pacific Time (US & Canada),research,https://www.inaturalist.org/observations/10575727,https://inaturalist-open-data.s3.amazonaws.com/photos/14738567/medium.jpeg,,3,0,FALSE,"200-216 Victoria Rd, Burlingame, CA 94010, USA",37.7401362,-122.1134737,9,,,Alameda,yerba buena,Clinopodium douglasii,yerba buena,Plantae,53203,Lamiaceae,Clinopodium,Clinopodium douglasii
10575747,4/1/18,2018-04-02 00:01:25 UTC,Pacific Time (US & Canada),research,https://www.inaturalist.org/observations/10575747,https://inaturalist-open-data.s3.amazonaws.com/photos/14738604/medium.jpeg,,2,0,FALSE,"Mirador Trail, Castro Valley, CA 94552, USA",37.74025838,-122.1134091,9,,,Alameda,California sagebrush,Artemisia californica,California sagebrush,Plantae,53357,Asteraceae,Artemisia,Artemisia californica
10575756,4/1/18,2018-04-02 00:03:10 UTC,Pacific Time (US & Canada),research,https://www.inaturalist.org/observations/10575756,https://inaturalist-open-data.s3.amazonaws.com/photos/14738621/medium.jpeg,,2,0,FALSE,"Anthony Chabot Regional Park, Alameda County, US-CA, US",37.74019941,-122.113377,6,,,Alameda,Pacific poison oak,Toxicodendron diversilobum,Pacific poison oak,Plantae,51080,Anacardiaceae,Toxicodendron,Toxicodendron diversilobum
10689521,4/7/18,2018-04-07 23:23:40 UTC,Pacific Time (US & Canada),research,https://www.inaturalist.org/observations/10689521,https://static.inaturalist.org/photos/14927013/medium.jpg,,1,0,FALSE,"Anthony Chabot Regional Park, Castro Valley, CA, US",37.73872577,-122.1130891,10,,,Alameda,miner's lettuce,Claytonia perfoliata,miner's lettuce,Plantae,52994,Montiaceae,Claytonia,Claytonia perfoliata
10689536,4/7/18,2018-04-07 23:24:47 UTC,Pacific Time (US & Canada),research,https://www.inaturalist.org/observations/10689536,https://static.inaturalist.org/photos/14927045/medium.jpg,,1,0,FALSE,"Anthony Chabot Regional Park, Castro Valley, CA, US",37.73905358,-122.1132257,10,,,Alameda,Pacific poison oak,Toxicodendron diversilobum,Pacific poison oak,Plantae,51080,Anacardiaceae,Toxicodendron,Toxicodendron diversilobum
10689580,4/7/18,2018-04-07 23:26:17 UTC,Pacific Time (US & Canada),research,https://www.inaturalist.org/observations/10689580,https://static.inaturalist.org/photos/14927152/medium.jpg,,1,0,FALSE,"Anthony Chabot Regional Park, Castro Valley, CA, US",37.73900329,-122.1132352,5,,,Alameda,Dove's-foot crane's-bill,Geranium molle,Dove's-foot crane's-bill,Plantae,53076,Geraniaceae,Geranium,Geranium molle
11714381,4/8/18,2018-04-08 22:21:50 UTC,Pacific Time (US & Canada),research,https://www.inaturalist.org/observations/11714381,https://inaturalist-open-data.s3.amazonaws.com/photos/16748783/medium.jpg,,1,0,FALSE,"Chabot Park, Oakland, CA, US",37.73034667,-122.1239,8,,Oakland,Alameda,Menzies' baby blue eyes,Nemophila menziesii,Menzies' baby blue eyes,Plantae,50648,Boraginaceae,Nemophila,Nemophila menziesii
11714869,4/8/18,2018-04-08 22:22:51 UTC,Pacific Time (US & Canada),research,https://www.inaturalist.org/observations/11714869,https://inaturalist-open-data.s3.amazonaws.com/photos/16749463/medium.jpg,,1,0,FALSE,"Chabot Park, Oakland, CA, US",37.73039167,-122.1238028,12,,Oakland,Alameda,Pacific poison oak,Toxicodendron diversilobum,Pacific poison oak,Plantae,51080,Anacardiaceae,Toxicodendron,Toxicodendron diversilobum
11857472,4/8/18,2018-04-08 22:24:39 UTC,Pacific Time (US & Canada),research,https://www.inaturalist.org/observations/11857472,https://inaturalist-open-data.s3.amazonaws.com/photos/16970960/medium.jpg,,1,0,FALSE,"Chabot Park, Oakland, CA, US",37.73030833,-122.1238333,8,,Oakland,Alameda,Pimpernel,Lysimachia arvensis,scarlet pimpernel,Plantae,791928,Primulaceae,Lysimachia,Lysimachia arvensis
11857534,4/8/18,2018-04-08 22:31:31 UTC,Pacific Time (US & Canada),research,https://www.inaturalist.org/observations/11857534,https://inaturalist-open-data.s3.amazonaws.com/photos/16971083/medium.jpg,,1,0,FALSE,"Chabot Park, Oakland, CA, US",37.73196333,-122.1233528,6,,Oakland,Alameda,western blue-eyed grass,Sisyrinchium bellum,western blue-eyed grass,Plantae,49918,Iridaceae,Sisyrinchium,Sisyrinchium bellum
13935156,4/8/18,2018-04-08 23:31:06 UTC,Pacific Time (US & Canada),research,https://www.inaturalist.org/observations/13935156,https://inaturalist-open-data.s3.amazonaws.com/photos/20592360/medium.jpg,,1,0,FALSE,"Lake Chabot Golf Course, Oakland, CA, US",37.74613667,-122.1154112,4,,,Alameda,Sun Cup,Taraxia ovata,Sun Cup,Plantae,68182,Onagraceae,Taraxia,Taraxia ovata
10732491,4/9/18,2018-04-09 17:23:04 UTC,Pacific Time (US & Canada),research,https://www.inaturalist.org/observations/10732491,https://static.inaturalist.org/photos/14996971/medium.jpg,,1,0,FALSE,"Anthony Chabot Regional Park, San Leandro, CA, US",37.7139712,-122.1091437,16,,Castro Valley,Alameda,wild radish,Raphanus sativus,wild radish,Plantae,55410,Brassicaceae,Raphanus,Raphanus sativus
10733101,4/9/18,2018-04-09 17:51:27 UTC,Pacific Time (US & Canada),research,https://www.inaturalist.org/observations/10733101,https://static.inaturalist.org/photos/14998091/medium.jpg,,2,0,FALSE,"Anthony Chabot Regional Park, San Leandro, CA, US",37.71656632,-122.1123186,24,,Castro Valley,Alameda,Sun Cup,Taraxia ovata,Sun Cup,Plantae,68182,Onagraceae,Taraxia,Taraxia ovata
10861684,4/9/18,2018-04-10 00:04:27 UTC,Pacific Time (US & Canada),research,https://www.inaturalist.org/observations/10861684,https://inaturalist-open-data.s3.amazonaws.com/photos/15240332/medium.jpg,,1,0,FALSE,"Anthony Chabot Regional Park, Oakland, CA, US",37.79148696,-122.1423883,5,,,Alameda,common cowparsnip,Heracleum maximum,common cowparsnip,Plantae,53094,Apiaceae,Heracleum,Heracleum maximum
10861701,4/9/18,2018-04-10 00:14:14 UTC,Pacific Time (US & Canada),research,https://www.inaturalist.org/observations/10861701,https://inaturalist-open-data.s3.amazonaws.com/photos/15240361/medium.jpg,,1,0,FALSE,"Anthony Chabot Regional Park, Oakland, CA, US",37.79182902,-122.1423781,10,,,Alameda,Rose Clover,Trifolium hirtum,Rose Clover,Plantae,57078,Fabaceae,Trifolium,Trifolium hirtum
10861731,4/9/18,2018-04-10 00:27:09 UTC,Pacific Time (US & Canada),research,https://www.inaturalist.org/observations/10861731,https://inaturalist-open-data.s3.amazonaws.com/photos/15240427/medium.jpg,,1,0,FALSE,"Anthony Chabot Regional Park, Oakland, CA, US",37.79081888,-122.1394784,5,,,Alameda,Sheep's sorrel,Rumex acetosella,Sheep's sorrel,Plantae,53195,Polygonaceae,Rumex,Rumex acetosella
10861747,4/9/18,2018-04-10 00:35:07 UTC,Pacific Time (US & Canada),research,https://www.inaturalist.org/observations/10861747,https://inaturalist-open-data.s3.amazonaws.com/photos/15240466/medium.jpg,,1,0,FALSE,"Anthony Chabot Regional Park, Oakland, CA, US",37.78880009,-122.1356591,5,,,Alameda,California bee plant,Scrophularia californica,California beeplant,Plantae,50812,Scrophulariaceae,Scrophularia,Scrophularia californica
11784700,4/9/18,2018-04-10 01:34:07 UTC,Pacific Time (US & Canada),research,https://www.inaturalist.org/observations/11784700,https://inaturalist-open-data.s3.amazonaws.com/photos/16855210/medium.jpg,,1,0,FALSE,"Anthony Chabot Regional Park, San Leandro, CA, US",37.71727833,-122.1138612,6,,Castro Valley,Alameda,narrowleaf mule-ears,Wyethia angustifolia,narrowleaf mule-ears,Plantae,56987,Asteraceae,Wyethia,Wyethia angustifolia
11784838,4/9/18,2018-04-10 01:49:29 UTC,Pacific Time (US & Canada),research,https://www.inaturalist.org/observations/11784838,https://inaturalist-open-data.s3.amazonaws.com/photos/16855366/medium.jpg,,2,0,FALSE,"Anthony Chabot Regional Park, San Leandro, CA, US",37.71832167,-122.1149833,6,,Castro Valley,Alameda,California sheepburr,Acaena pinnatifida californica,California sheepburr,Plantae,61224,Rosaceae,Acaena,Acaena pinnatifida
11784914,4/9/18,2018-04-10 01:26:08 UTC,Pacific Time (US & Canada),research,https://www.inaturalist.org/observations/11784914,https://inaturalist-open-data.s3.amazonaws.com/photos/16855466/medium.jpg,,1,0,FALSE,"Anthony Chabot Regional Park, San Leandro, CA, US",37.71625,-122.1132888,8,,Castro Valley,Alameda,western blue-eyed grass,Sisyrinchium bellum,western blue-eyed grass,Plantae,49918,Iridaceae,Sisyrinchium,Sisyrinchium bellum
11784992,4/9/18,2018-04-10 01:34:47 UTC,Pacific Time (US & Canada),research,https://www.inaturalist.org/observations/11784992,https://inaturalist-open-data.s3.amazonaws.com/photos/16855565/medium.jpg,,1,0,FALSE,"Anthony Chabot Regional Park, San Leandro, CA, US",37.71733,-122.1138445,6,,Castro Valley,Alameda,Purple Sanicle,Sanicula bipinnatifida,Purple Sanicle,Plantae,56840,Apiaceae,Sanicula,Sanicula bipinnatifida
10790437,4/11/18,2018-04-11 19:12:39 UTC,Pacific Time (US & Canada),research,https://www.inaturalist.org/observations/10790437,https://static.inaturalist.org/photos/15100206/medium.jpg,,2,0,FALSE,"Anthony Chabot Regional Park, Alameda County, US-CA, US",37.761689,-122.117891,10,,,Alameda,broadleaf forget-me-not,Myosotis latifolia,broadleaf forget-me-not,Plantae,49132,Boraginaceae,Myosotis,Myosotis latifolia
10861802,4/11/18,2018-04-11 20:01:49 UTC,Pacific Time (US & Canada),research,https://www.inaturalist.org/observations/10861802,https://inaturalist-open-data.s3.amazonaws.com/photos/15240617/medium.jpg,,1,0,FALSE,"Anthony Chabot Regional Park, Castro Valley, CA, US",37.77533842,-122.1216904,5,,,Alameda,western blue-eyed grass,Sisyrinchium bellum,western blue-eyed grass,Plantae,49918,Iridaceae,Sisyrinchium,Sisyrinchium bellum
10824440,4/12/18,2018-04-12 18:37:35 UTC,Pacific Time (US & Canada),research,https://www.inaturalist.org/observations/10824440,https://static.inaturalist.org/photos/15165420/medium.jpg,,1,0,FALSE,"Anthony Chabot Regional Park, Oakland, CA, US",37.77773292,-122.1255592,158,,,Alameda,Harlequin flower,Sparaxis tricolor,Harlequin flower,Plantae,50843,Iridaceae,Sparaxis,Sparaxis tricolor
10824580,4/12/18,2018-04-12 19:03:53 UTC,Pacific Time (US & Canada),research,https://www.inaturalist.org/observations/10824580,https://static.inaturalist.org/photos/15165649/medium.jpg,,1,0,FALSE,"Anthony Chabot Regional Park, Oakland, CA, US",37.78477641,-122.1327547,762,,,Alameda,Sun Cup,Taraxia ovata,Sun Cup,Plantae,68182,Onagraceae,Taraxia,Taraxia ovata
11785168,4/12/18,2018-04-13 01:47:21 UTC,Pacific Time (US & Canada),research,https://www.inaturalist.org/observations/11785168,https://inaturalist-open-data.s3.amazonaws.com/photos/16855923/medium.jpg,,1,0,FALSE,"Anthony Chabot Regional Park, Castro Valley, CA, US",37.71263,-122.1039667,4,,Castro Valley,Alameda,purple owl's-clover,Castilleja exserta,purple owl's-clover,Plantae,49343,Orobanchaceae,Castilleja,Castilleja exserta
11785252,4/12/18,2018-04-13 02:00:37 UTC,Pacific Time (US & Canada),research,https://www.inaturalist.org/observations/11785252,https://inaturalist-open-data.s3.amazonaws.com/photos/16855979/medium.jpg,,1,0,FALSE,"Anthony Chabot Regional Park, Castro Valley, CA, US",37.71256333,-122.1042333,8,,Castro Valley,Alameda,Dipterostemon capitatus,Dipterostemon capitatus,Blue Dicks,Plantae,1196784,Asparagaceae,Dipterostemon,Dipterostemon capitatus
11222699,4/20/18,2018-04-20 17:51:22 UTC,Pacific Time (US & Canada),research,https://www.inaturalist.org/observations/11222699,https://inaturalist-open-data.s3.amazonaws.com/photos/15922384/medium.jpg,,1,0,FALSE,"Anthony Chabot Regional Park, Oakland, CA, US",37.79046499,-122.1363517,5,,,Alameda,chamise,Adenostoma fasciculatum,chamise,Plantae,47146,Rosaceae,Adenostoma,Adenostoma fasciculatum
11230651,4/20/18,2018-04-20 17:41:56 UTC,Pacific Time (US & Canada),research,https://www.inaturalist.org/observations/11230651,https://inaturalist-open-data.s3.amazonaws.com/photos/15938387/medium.jpg,,1,0,FALSE,"Anthony Chabot Regional Park, Oakland, CA, US",37.79031167,-122.1367112,5,,,Alameda,Indian Warrior,Pedicularis densiflora,Warrior's Plume,Plantae,49645,Orobanchaceae,Pedicularis,Pedicularis densiflora
11231532,4/20/18,2018-04-20 17:57:51 UTC,Pacific Time (US & Canada),research,https://www.inaturalist.org/observations/11231532,https://inaturalist-open-data.s3.amazonaws.com/photos/15940254/medium.jpg,,2,0,FALSE,"Anthony Chabot Regional Park, Oakland, CA, US",37.79050833,-122.1363222,5,,,Alameda,Brittleleaf Manzanita,Arctostaphylos crustacea,Brittleleaf Manzanita,Plantae,75507,Ericaceae,Arctostaphylos,Arctostaphylos crustacea
15702646,4/25/18,2018-04-25 21:41:00 UTC,Pacific Time (US & Canada),research,https://www.inaturalist.org/observations/15702646,https://inaturalist-open-data.s3.amazonaws.com/photos/23436961/medium.jpg,"Anthony Chabot Regional Park, Castro Valley, CA",1,0,FALSE,"Alameda County, CA, USA",37.76980581,-122.127667,31,,,Alameda,Greater Quaking Grass,Briza maxima,Greater Quaking Grass,Plantae,57157,Poaceae,Briza,Briza maxima
15706677,4/25/18,2018-04-25 23:25:00 UTC,Pacific Time (US & Canada),research,https://www.inaturalist.org/observations/15706677,https://inaturalist-open-data.s3.amazonaws.com/photos/23443198/medium.jpg,"Anthony Chabot Regional Park, Castro Valley, CA",1,0,FALSE,"Alameda County, CA, USA",37.75850439,-122.1154833,61,,,Alameda,Caper Spurge,Euphorbia lathyris,caper spurge,Plantae,77114,Euphorbiaceae,Euphorbia,Euphorbia lathyris
15725708,4/25/18,2018-04-25 15:53:00 UTC,Pacific Time (US & Canada),research,https://www.inaturalist.org/observations/15725708,https://inaturalist-open-data.s3.amazonaws.com/photos/23478276/medium.jpg,"Brandon Trail, Anthony Chabot Regional Park, Oakland, C",1,0,FALSE,"Alameda County, CA, USA",37.7693649,-122.1222878,61,,,Alameda,twinberry honeysuckle,Lonicera involucrata,twinberry honeysuckle,Plantae,60881,Caprifoliaceae,Lonicera,Lonicera involucrata
11540867,4/27/18,2018-04-27 18:48:04 UTC,Pacific Time (US & Canada),research,https://www.inaturalist.org/observations/11540867,https://inaturalist-open-data.s3.amazonaws.com/photos/16477078/medium.jpg,,1,0,FALSE,"Anthony Chabot Regional Park, Oakland, CA, US",37.79311888,-122.1423911,66,,,Alameda,orange bush monkeyflower,Diplacus aurantiacus,orange bush monkeyflower,Plantae,777371,Phrymaceae,Diplacus,Diplacus aurantiacus
11540908,4/27/18,2018-04-27 18:48:46 UTC,Pacific Time (US & Canada),research,https://www.inaturalist.org/observations/11540908,https://inaturalist-open-data.s3.amazonaws.com/photos/16477152/medium.jpg,,1,0,FALSE,"Anthony Chabot Regional Park, Oakland, CA, US",37.79302587,-122.1422708,30,,,Alameda,coyote brush,Baccharis pilularis,coyote brush,Plantae,53359,Asteraceae,Baccharis,Baccharis pilularis
11541016,4/27/18,2018-04-27 18:50:45 UTC,Pacific Time (US & Canada),research,https://www.inaturalist.org/observations/11541016,https://inaturalist-open-data.s3.amazonaws.com/photos/16477320/medium.jpg,,1,0,FALSE,"Anthony Chabot Regional Park, Oakland, CA, US",37.79303635,-122.1420834,10,,,Alameda,Pacific poison oak,Toxicodendron diversilobum,Pacific poison oak,Plantae,51080,Anacardiaceae,Toxicodendron,Toxicodendron diversilobum
11541082,4/27/18,2018-04-27 18:52:28 UTC,Pacific Time (US & Canada),research,https://www.inaturalist.org/observations/11541082,https://inaturalist-open-data.s3.amazonaws.com/photos/16477390/medium.jpg,,1,0,FALSE,"Anthony Chabot Regional Park, Oakland, CA, US",37.79281295,-122.1424328,874,,,Alameda,coffeeberry,Frangula californica,coffeeberry,Plantae,53423,Rhamnaceae,Frangula,Frangula californica
11541283,4/27/18,2018-04-27 18:58:36 UTC,Pacific Time (US & Canada),research,https://www.inaturalist.org/observations/11541283,https://inaturalist-open-data.s3.amazonaws.com/photos/16477675/medium.jpg,,2,0,FALSE,"Anthony Chabot Regional Park, Oakland, CA, US",37.79249157,-122.1422045,30,,,Alameda,California bay,Umbellularia californica,California bay,Plantae,48807,Lauraceae,Umbellularia,Umbellularia californica
11541855,4/27/18,2018-04-27 19:21:41 UTC,Pacific Time (US & Canada),research,https://www.inaturalist.org/observations/11541855,https://inaturalist-open-data.s3.amazonaws.com/photos/16478330/medium.jpg,,1,0,FALSE,"Anthony Chabot Regional Park, Oakland, CA, US",37.79157517,-122.1421394,10,,,Alameda,California bee plant,Scrophularia californica,California beeplant,Plantae,50812,Scrophulariaceae,Scrophularia,Scrophularia californica
11542000,4/27/18,2018-04-27 19:24:19 UTC,Pacific Time (US & Canada),research,https://www.inaturalist.org/observations/11542000,https://inaturalist-open-data.s3.amazonaws.com/photos/16478608/medium.jpg,,1,0,FALSE,"Anthony Chabot Regional Park, Oakland, CA, US",37.79136806,-122.1422428,5,,,Alameda,common cowparsnip,Heracleum maximum,common cowparsnip,Plantae,53094,Apiaceae,Heracleum,Heracleum maximum
11542356,4/27/18,2018-04-27 19:40:39 UTC,Pacific Time (US & Canada),research,https://www.inaturalist.org/observations/11542356,https://inaturalist-open-data.s3.amazonaws.com/photos/16479137/medium.jpg,,1,0,FALSE,"Anthony Chabot Regional Park, Oakland, CA, US",37.79060857,-122.138371,5,,,Alameda,Sun Cup,Taraxia ovata,Sun Cup,Plantae,68182,Onagraceae,Taraxia,Taraxia ovata
11542465,4/27/18,2018-04-27 19:50:43 UTC,Pacific Time (US & Canada),research,https://www.inaturalist.org/observations/11542465,https://inaturalist-open-data.s3.amazonaws.com/photos/16479316/medium.jpg,,2,0,FALSE,"Anthony Chabot Regional Park, Oakland, CA, US",37.78875052,-122.1355014,5,,,Alameda,blue elder,Sambucus cerulea,blue elder,Plantae,143799,Viburnaceae,Sambucus,Sambucus cerulea
11542574,4/27/18,2018-04-27 19:58:28 UTC,Pacific Time (US & Canada),research,https://www.inaturalist.org/observations/11542574,https://inaturalist-open-data.s3.amazonaws.com/photos/16479478/medium.jpg,,1,0,FALSE,"Anthony Chabot Regional Park, Oakland, CA, US",37.78829986,-122.135072,5,,,Alameda,western blue-eyed grass,Sisyrinchium bellum,western blue-eyed grass,Plantae,49918,Iridaceae,Sisyrinchium,Sisyrinchium bellum
11670129,4/28/18,2018-04-28 18:59:50 UTC,Pacific Time (US & Canada),research,https://www.inaturalist.org/observations/11670129,https://static.inaturalist.org/photos/16676309/medium.jpg,,1,0,FALSE,"9999 Redwood Rd, Oakland, CA, US",37.75202167,-122.1172417,5,,,Alameda,Salsify,Tragopogon porrifolius,purple salsify,Plantae,54141,Asteraceae,Tragopogon,Tragopogon porrifolius
11708747,4/28/18,2018-04-28 20:17:19 UTC,Pacific Time (US & Canada),research,https://www.inaturalist.org/observations/11708747,https://inaturalist-open-data.s3.amazonaws.com/photos/16738790/medium.jpg,,1,0,FALSE,"Anthony Chabot Regional Park, Oakland, CA, US",37.74267716,-122.0935235,5,,,Alameda,California poppy,Eschscholzia californica,California poppy,Plantae,48225,Papaveraceae,Eschscholzia,Eschscholzia californica
11708790,4/28/18,2018-04-28 20:21:26 UTC,Pacific Time (US & Canada),research,https://www.inaturalist.org/observations/11708790,https://inaturalist-open-data.s3.amazonaws.com/photos/16738890/medium.jpg,,1,0,FALSE,"Anthony Chabot Regional Park, Oakland, CA, US",37.74282816,-122.0939992,10,,,Alameda,orange bush monkeyflower,Diplacus aurantiacus,orange bush monkeyflower,Plantae,777371,Phrymaceae,Diplacus,Diplacus aurantiacus
11708838,4/28/18,2018-04-28 20:21:42 UTC,Pacific Time (US & Canada),research,https://www.inaturalist.org/observations/11708838,https://inaturalist-open-data.s3.amazonaws.com/photos/16738971/medium.jpg,,1,0,FALSE,"Anthony Chabot Regional Park, Oakland, CA, US",37.74280134,-122.0939771,5,,,Alameda,Mediterranean Stork's-bill,Erodium botrys,Mediterranean Stork's-bill,Plantae,57090,Geraniaceae,Erodium,Erodium botrys
11708885,4/28/18,2018-04-28 20:22:07 UTC,Pacific Time (US & Canada),research,https://www.inaturalist.org/observations/11708885,https://inaturalist-open-data.s3.amazonaws.com/photos/16739234/medium.jpg,,1,0,FALSE,"Anthony Chabot Regional Park, Oakland, CA, US",37.74271065,-122.0940292,5,,,Alameda,California sagebrush,Artemisia californica,California sagebrush,Plantae,53357,Asteraceae,Artemisia,Artemisia californica
11709051,4/28/18,2018-04-28 20:22:39 UTC,Pacific Time (US & Canada),research,https://www.inaturalist.org/observations/11709051,https://inaturalist-open-data.s3.amazonaws.com/photos/16739313/medium.jpg,,1,0,FALSE,"Anthony Chabot Regional Park, Oakland, CA, US",37.74284878,-122.0940955,5,,,Alameda,coyote brush,Baccharis pilularis,coyote brush,Plantae,53359,Asteraceae,Baccharis,Baccharis pilularis
11709086,4/28/18,2018-04-28 20:23:31 UTC,Pacific Time (US & Canada),research,https://www.inaturalist.org/observations/11709086,https://inaturalist-open-data.s3.amazonaws.com/photos/16739377/medium.jpg,,1,0,FALSE,"Anthony Chabot Regional Park, Oakland, CA, US",37.74279153,-122.094062,10,,,Alameda,Rose Clover,Trifolium hirtum,Rose Clover,Plantae,57078,Fabaceae,Trifolium,Trifolium hirtum
11709120,4/28/18,2018-04-28 20:24:20 UTC,Pacific Time (US & Canada),research,https://www.inaturalist.org/observations/11709120,https://inaturalist-open-data.s3.amazonaws.com/photos/16739463/medium.jpg,,2,0,FALSE,"Anthony Chabot Regional Park, Oakland, CA, US",37.74298235,-122.0942064,5,,,Alameda,French broom,Genista monspessulana,French broom,Plantae,53403,Fabaceae,Genista,Genista monspessulana
11709186,4/28/18,2018-04-28 20:38:26 UTC,Pacific Time (US & Canada),research,https://www.inaturalist.org/observations/11709186,https://inaturalist-open-data.s3.amazonaws.com/photos/16739629/medium.jpg,,1,0,FALSE,"Anthony Chabot Regional Park, Oakland, CA, US",37.74409169,-122.0939231,5,,,Alameda,Pacific poison oak,Toxicodendron diversilobum,Pacific poison oak,Plantae,51080,Anacardiaceae,Toxicodendron,Toxicodendron diversilobum
11709209,4/28/18,2018-04-28 20:38:49 UTC,Pacific Time (US & Canada),research,https://www.inaturalist.org/observations/11709209,https://inaturalist-open-data.s3.amazonaws.com/photos/16739674/medium.jpg,,1,0,FALSE,"Anthony Chabot Regional Park, Oakland, CA, US",37.74414266,-122.0939202,5,,,Alameda,trailing blackberry,Rubus ursinus,trailing blackberry,Plantae,53445,Rosaceae,Rubus,Rubus ursinus
11709257,4/28/18,2018-04-28 20:43:27 UTC,Pacific Time (US & Canada),research,https://www.inaturalist.org/observations/11709257,https://inaturalist-open-data.s3.amazonaws.com/photos/16739737/medium.jpg,,1,0,FALSE,"Anthony Chabot Regional Park, Oakland, CA, US",37.74452227,-122.0945334,10,,,Alameda,bigleaf maple,Acer macrophyllum,bigleaf maple,Plantae,48227,Sapindaceae,Acer,Acer macrophyllum
11709427,4/28/18,2018-04-28 20:49:12 UTC,Pacific Time (US & Canada),research,https://www.inaturalist.org/observations/11709427,https://inaturalist-open-data.s3.amazonaws.com/photos/16740012/medium.jpg,,1,0,FALSE,"Anthony Chabot Regional Park, Oakland, CA, US",37.74404828,-122.0939002,10,,,Alameda,Sun Cup,Taraxia ovata,Sun Cup,Plantae,68182,Onagraceae,Taraxia,Taraxia ovata
11709698,4/28/18,2018-04-28 21:29:37 UTC,Pacific Time (US & Canada),research,https://www.inaturalist.org/observations/11709698,https://inaturalist-open-data.s3.amazonaws.com/photos/16740476/medium.jpg,,1,0,FALSE,"Anthony Chabot Regional Park, Castro Valley, CA, US",37.73968549,-122.0930821,5,,,Alameda,western blue-eyed grass,Sisyrinchium bellum,western blue-eyed grass,Plantae,49918,Iridaceae,Sisyrinchium,Sisyrinchium bellum
11709863,4/28/18,2018-04-28 21:33:25 UTC,Pacific Time (US & Canada),research,https://www.inaturalist.org/observations/11709863,https://inaturalist-open-data.s3.amazonaws.com/photos/16740799/medium.jpg,,1,0,FALSE,"Anthony Chabot Regional Park, Oakland, CA, US",37.73915794,-122.092334,5,,,Alameda,orange bush monkeyflower,Diplacus aurantiacus,orange bush monkeyflower,Plantae,777371,Phrymaceae,Diplacus,Diplacus aurantiacus
11709973,4/28/18,2018-04-28 22:20:43 UTC,Pacific Time (US & Canada),research,https://www.inaturalist.org/observations/11709973,https://inaturalist-open-data.s3.amazonaws.com/photos/16741135/medium.jpg,,1,0,FALSE,"Anthony Chabot Regional Park, Castro Valley, CA, US",37.73475916,-122.0843469,5,,,Alameda,Toyon,Heteromeles arbutifolia,Toyon,Plantae,53405,Rosaceae,Heteromeles,Heteromeles arbutifolia
11710084,4/28/18,2018-04-28 22:55:14 UTC,Pacific Time (US & Canada),research,https://www.inaturalist.org/observations/11710084,https://inaturalist-open-data.s3.amazonaws.com/photos/16741216/medium.jpg,,1,0,FALSE,"Anthony Chabot Regional Park, Castro Valley, CA, US",37.73079146,-122.0849303,5,,,Alameda,common yarrow,Achillea millefolium,common yarrow,Plantae,52821,Asteraceae,Achillea,Achillea millefolium
11799967,4/29/18,2018-04-29 21:29:24 UTC,Pacific Time (US & Canada),research,https://www.inaturalist.org/observations/11799967,https://static.inaturalist.org/photos/16878905/medium.jpg,"Blue eyed grass?
",1,0,FALSE,"Anthony Chabot Regional Park, Castro Valley, CA, US",37.73014667,-122.1205,32,,Castro Valley,Alameda,western blue-eyed grass,Sisyrinchium bellum,western blue-eyed grass,Plantae,49918,Iridaceae,Sisyrinchium,Sisyrinchium bellum
11799985,4/29/18,2018-04-29 21:36:29 UTC,Pacific Time (US & Canada),research,https://www.inaturalist.org/observations/11799985,https://static.inaturalist.org/photos/16878940/medium.jpg,,1,0,FALSE,"Anthony Chabot Regional Park, Alameda County, US-CA, US",37.729845,-122.119475,32,,Castro Valley,Alameda,broadleaf lupine,Lupinus latifolius,Broadleaf Lupine,Plantae,67379,Fabaceae,Lupinus,Lupinus latifolius
11830373,4/29/18,2018-04-29 20:41:20 UTC,Pacific Time (US & Canada),research,https://www.inaturalist.org/observations/11830373,https://inaturalist-open-data.s3.amazonaws.com/photos/16927151/medium.jpg,,1,0,FALSE,"Anthony Chabot Regional Park, Castro Valley, CA, US",37.72411343,-122.0810622,10,,Castro Valley,Alameda,Western Star Flower,Lysimachia latifolia,Western Starflower,Plantae,496537,Primulaceae,Lysimachia,Lysimachia latifolia
11830706,4/29/18,2018-04-29 20:47:22 UTC,Pacific Time (US & Canada),research,https://www.inaturalist.org/observations/11830706,https://inaturalist-open-data.s3.amazonaws.com/photos/16927708/medium.jpg,,1,0,FALSE,"Anthony Chabot Regional Park, Castro Valley, CA, US",37.72392907,-122.0816973,5,,Castro Valley,Alameda,California bee plant,Scrophularia californica,California beeplant,Plantae,50812,Scrophulariaceae,Scrophularia,Scrophularia californica
11830828,4/29/18,2018-04-29 20:49:48 UTC,Pacific Time (US & Canada),research,https://www.inaturalist.org/observations/11830828,https://inaturalist-open-data.s3.amazonaws.com/photos/16927833/medium.jpg,,1,0,FALSE,"Anthony Chabot Regional Park, Castro Valley, CA, US",37.72407403,-122.0824303,10,,Castro Valley,Alameda,Wild strawberry,Fragaria vesca,woodland strawberry,Plantae,50298,Rosaceae,Fragaria,Fragaria vesca
11831021,4/29/18,2018-04-29 20:52:04 UTC,Pacific Time (US & Canada),research,https://www.inaturalist.org/observations/11831021,https://inaturalist-open-data.s3.amazonaws.com/photos/16928017/medium.jpg,,1,0,FALSE,"Anthony Chabot Regional Park, Castro Valley, CA, US",37.72387329,-122.0834348,10,,Castro Valley,Alameda,Three-cornered Leek,Allium triquetrum,Three-cornered garlic,Plantae,55505,Amaryllidaceae,Allium,Allium triquetrum
11831216,4/29/18,2018-04-29 20:55:17 UTC,Pacific Time (US & Canada),research,https://www.inaturalist.org/observations/11831216,https://inaturalist-open-data.s3.amazonaws.com/photos/16928188/medium.jpg,,2,0,FALSE,"Anthony Chabot Regional Park, Castro Valley, CA, US",37.72382928,-122.0844096,5,,Castro Valley,Alameda,star-flowered lily-of-the-valley,Maianthemum stellatum,star-flowered lily-of-the-valley,Plantae,53268,Asparagaceae,Maianthemum,Maianthemum stellatum
11831418,4/29/18,2018-04-29 20:58:19 UTC,Pacific Time (US & Canada),research,https://www.inaturalist.org/observations/11831418,https://inaturalist-open-data.s3.amazonaws.com/photos/16928405/medium.jpg,,2,0,FALSE,"Anthony Chabot Regional Park, Castro Valley, CA, US",37.72419586,-122.0848685,5,,Castro Valley,Alameda,hillside woodland star,Lithophragma heterophyllum,hillside woodland star,Plantae,53124,Saxifragaceae,Lithophragma,Lithophragma heterophyllum
11831509,4/29/18,2018-04-29 21:00:08 UTC,Pacific Time (US & Canada),research,https://www.inaturalist.org/observations/11831509,https://inaturalist-open-data.s3.amazonaws.com/photos/16928683/medium.jpg,,3,0,FALSE,"Anthony Chabot Regional Park, Castro Valley, CA, US",37.72419905,-122.0849706,5,,Castro Valley,Alameda,false Solomon's-seal,Maianthemum racemosum,Solomon's plume,Plantae,51062,Asparagaceae,Maianthemum,Maianthemum racemosum
11831789,4/29/18,2018-04-29 21:11:27 UTC,Pacific Time (US & Canada),research,https://www.inaturalist.org/observations/11831789,https://inaturalist-open-data.s3.amazonaws.com/photos/16929344/medium.jpg,,1,0,FALSE,"4488 Hillsborough Dr, Castro Valley, CA, US",37.72522026,-122.0883009,10,,Castro Valley,Alameda,stinging nettle,Urtica dioica,great stinging nettle,Plantae,51884,Urticaceae,Urtica,Urtica dioica
11831898,4/29/18,2018-04-29 21:14:30 UTC,Pacific Time (US & Canada),research,https://www.inaturalist.org/observations/11831898,https://inaturalist-open-data.s3.amazonaws.com/photos/16929480/medium.jpg,,4,0,FALSE,"4480 Hillsborough Dr, Castro Valley, CA, US",37.72505643,-122.0894949,10,,Castro Valley,Alameda,blue elder,Sambucus cerulea,blue elder,Plantae,143799,Viburnaceae,Sambucus,Sambucus cerulea
11832030,4/29/18,2018-04-29 21:17:50 UTC,Pacific Time (US & Canada),research,https://www.inaturalist.org/observations/11832030,https://inaturalist-open-data.s3.amazonaws.com/photos/16929720/medium.jpg,,1,0,FALSE,"17465 Redwood Rd, Castro Valley, CA, US",37.725657,-122.0891051,10,,Castro Valley,Alameda,common cowparsnip,Heracleum maximum,common cowparsnip,Plantae,53094,Apiaceae,Heracleum,Heracleum maximum
11832077,4/29/18,2018-04-29 21:20:24 UTC,Pacific Time (US & Canada),research,https://www.inaturalist.org/observations/11832077,https://inaturalist-open-data.s3.amazonaws.com/photos/16929875/medium.jpg,,1,0,FALSE,"52005298 Canyon Hill Ct, Castro Valley, CA, US",37.72628941,-122.0882764,10,,Castro Valley,Alameda,western blue-eyed grass,Sisyrinchium bellum,western blue-eyed grass,Plantae,49918,Iridaceae,Sisyrinchium,Sisyrinchium bellum
11832144,4/29/18,2018-04-29 21:21:15 UTC,Pacific Time (US & Canada),research,https://www.inaturalist.org/observations/11832144,https://inaturalist-open-data.s3.amazonaws.com/photos/16929958/medium.jpg,,2,0,FALSE,"Anthony Chabot Regional Park, Castro Valley, CA, US",37.72663651,-122.0883045,50,,Castro Valley,Alameda,common yarrow,Achillea millefolium,common yarrow,Plantae,52821,Asteraceae,Achillea,Achillea millefolium
11832533,4/29/18,2018-04-29 21:33:26 UTC,Pacific Time (US & Canada),research,https://www.inaturalist.org/observations/11832533,https://inaturalist-open-data.s3.amazonaws.com/photos/16930817/medium.jpg,,1,0,FALSE,"Anthony Chabot Regional Park, Castro Valley, CA, US",37.72867469,-122.0900146,10,,,Alameda,Pacific ninebark,Physocarpus capitatus,Pacific ninebark,Plantae,57249,Rosaceae,Physocarpus,Physocarpus capitatus
11832828,4/29/18,2018-04-29 21:43:08 UTC,Pacific Time (US & Canada),research,https://www.inaturalist.org/observations/11832828,https://inaturalist-open-data.s3.amazonaws.com/photos/16931267/medium.jpg,,2,0,FALSE,"Anthony Chabot Regional Park, Castro Valley, CA, US",37.7299026,-122.0934741,10,,,Alameda,watercress,Nasturtium officinale,watercress,Plantae,78174,Brassicaceae,Nasturtium,Nasturtium officinale
11832959,4/29/18,2018-04-29 21:53:05 UTC,Pacific Time (US & Canada),research,https://www.inaturalist.org/observations/11832959,https://inaturalist-open-data.s3.amazonaws.com/photos/16931492/medium.jpg,,2,0,FALSE,"Anthony Chabot Regional Park, Castro Valley, CA, US",37.72758747,-122.095354,10,,Castro Valley,Alameda,White Globe Lily,Calochortus albus,White Globe Lily,Plantae,51315,Liliaceae,Calochortus,Calochortus albus
11840046,4/29/18,2018-04-29 16:30:29 UTC,Pacific Time (US & Canada),research,https://www.inaturalist.org/observations/11840046,https://static.inaturalist.org/photos/16943949/medium.jpg,,2,0,FALSE,"Anthony Chabot Regional Park, Oakland, CA, US",37.78169667,-122.1371472,50,,,Alameda,thimbleberry,Rubus parviflorus,thimbleberry,Plantae,51646,Rosaceae,Rubus,Rubus parviflorus
12013247,5/1/18,2018-05-01 22:04:20 UTC,Pacific Time (US & Canada),research,https://www.inaturalist.org/observations/12013247,https://static.inaturalist.org/photos/17218906/medium.jpg,,2,0,FALSE,"Anthony Chabot Regional Park, Castro Valley, CA, US",37.72063393,-122.1039515,10,,Castro Valley,Alameda,hillside woodland star,Lithophragma heterophyllum,hillside woodland star,Plantae,53124,Saxifragaceae,Lithophragma,Lithophragma heterophyllum
12187840,5/2/18,2018-05-03 01:40:55 UTC,Pacific Time (US & Canada),research,https://www.inaturalist.org/observations/12187840,https://inaturalist-open-data.s3.amazonaws.com/photos/17503132/medium.jpg,,1,0,FALSE,"Anthony Chabot Regional Park, Castro Valley, CA, US",37.726905,-122.10135,8,,Castro Valley,Alameda,tomcat clover,Trifolium willdenovii,tomcat clover,Plantae,57081,Fabaceae,Trifolium,Trifolium willdenovii
12187847,5/2/18,2018-05-03 01:24:54 UTC,Pacific Time (US & Canada),research,https://www.inaturalist.org/observations/12187847,https://inaturalist-open-data.s3.amazonaws.com/photos/17503145/medium.jpg,,1,0,FALSE,"Anthony Chabot Regional Park, Castro Valley, CA, US",37.722775,-122.1029667,32,,Castro Valley,Alameda,common cowparsnip,Heracleum maximum,common cowparsnip,Plantae,53094,Apiaceae,Heracleum,Heracleum maximum
12187858,5/2/18,2018-05-03 01:19:52 UTC,Pacific Time (US & Canada),research,https://www.inaturalist.org/observations/12187858,https://inaturalist-open-data.s3.amazonaws.com/photos/17503166/medium.jpg,,1,0,FALSE,"Anthony Chabot Regional Park, Castro Valley, CA, US",37.72028333,-122.1037222,32,,Castro Valley,Alameda,Wild strawberry,Fragaria vesca,woodland strawberry,Plantae,50298,Rosaceae,Fragaria,Fragaria vesca
12110664,5/3/18,2018-05-03 23:35:18 UTC,Pacific Time (US & Canada),research,https://www.inaturalist.org/observations/12110664,https://static.inaturalist.org/photos/17372879/medium.jpg,,2,0,FALSE,"Anthony Chabot Regional Park, Castro Valley, CA, US",37.72752021,-122.1163035,5,,,Alameda,common cowparsnip,Heracleum maximum,common cowparsnip,Plantae,53094,Apiaceae,Heracleum,Heracleum maximum
12550101,5/5/18,2018-05-05 23:35:48 UTC,Pacific Time (US & Canada),research,https://www.inaturalist.org/observations/12550101,https://inaturalist-open-data.s3.amazonaws.com/photos/18129277/medium.jpg,,2,0,FALSE,"Anthony Chabot Regional Park, Castro Valley, CA, US",37.72017,-122.1041195,5,,Castro Valley,Alameda,California bay,Umbellularia californica,California bay,Plantae,48807,Lauraceae,Umbellularia,Umbellularia californica
13107425,5/7/18,2018-05-07 21:44:28 UTC,Central Time (US & Canada),research,https://www.inaturalist.org/observations/13107425,https://static.inaturalist.org/photos/19103203/medium.jpg,,1,0,FALSE,"Anthony Chabot Regional Park, Oakland, CA, US",37.77305333,-122.1287778,5,,,Alameda,common cowparsnip,Heracleum maximum,common cowparsnip,Plantae,53094,Apiaceae,Heracleum,Heracleum maximum
13107477,5/7/18,2018-05-07 21:51:22 UTC,Central Time (US & Canada),research,https://www.inaturalist.org/observations/13107477,https://static.inaturalist.org/photos/19103314/medium.jpg,,1,0,FALSE,"Anthony Chabot Regional Park, Oakland, CA, US",37.77403833,-122.1271528,5,,,Alameda,Pimpernel,Lysimachia arvensis,scarlet pimpernel,Plantae,791928,Primulaceae,Lysimachia,Lysimachia arvensis
12356961,5/11/18,2018-05-11 14:46:21 UTC,Pacific Time (US & Canada),research,https://www.inaturalist.org/observations/12356961,https://static.inaturalist.org/photos/17797884/medium.jpg,,2,0,FALSE,"Anthony Chabot Regional Park, Oakland, CA, US",37.77084914,-122.1235953,426,,,Alameda,twinberry honeysuckle,Lonicera involucrata,twinberry honeysuckle,Plantae,60881,Caprifoliaceae,Lonicera,Lonicera involucrata
12357187,5/11/18,2018-05-11 15:02:22 UTC,Pacific Time (US & Canada),research,https://www.inaturalist.org/observations/12357187,https://static.inaturalist.org/photos/17798362/medium.jpg,,2,0,FALSE,"Anthony Chabot Regional Park, Oakland, CA, US",37.76170333,-122.1176,10,,,Alameda,boxelder,Acer negundo,box elder,Plantae,47726,Sapindaceae,Acer,Acer negundo
12481628,5/14/18,2018-05-14 18:25:38 UTC,Pacific Time (US & Canada),research,https://www.inaturalist.org/observations/12481628,https://static.inaturalist.org/photos/18013398/medium.jpg,,2,0,FALSE,"Anthony Chabot Regional Park, Castro Valley, CA, US",37.72079167,-122.0939472,5,,Castro Valley,Alameda,blue elder,Sambucus cerulea,blue elder,Plantae,143799,Viburnaceae,Sambucus,Sambucus cerulea
12616211,5/19/18,2018-05-19 20:58:36 UTC,Pacific Time (US & Canada),research,https://www.inaturalist.org/observations/12616211,https://static.inaturalist.org/photos/18243919/medium.jpeg,,2,0,FALSE,"Castro Valley, CA, USA",37.71907387,-122.1048967,8,,Castro Valley,Alameda,California buckeye,Aesculus californica,California buckeye,Plantae,53348,Sapindaceae,Aesculus,Aesculus californica
12731414,5/21/18,2018-05-22 00:53:25 UTC,Pacific Time (US & Canada),research,https://www.inaturalist.org/observations/12731414,https://inaturalist-open-data.s3.amazonaws.com/photos/18440799/medium.jpg,,1,0,FALSE,"Anthony Chabot Regional Park, Castro Valley, CA, US",37.71913,-122.1050555,8,,Castro Valley,Alameda,California buckeye,Aesculus californica,California buckeye,Plantae,53348,Sapindaceae,Aesculus,Aesculus californica
12731447,5/21/18,2018-05-22 00:58:34 UTC,Pacific Time (US & Canada),research,https://www.inaturalist.org/observations/12731447,https://inaturalist-open-data.s3.amazonaws.com/photos/18440810/medium.jpg,,3,0,FALSE,"Anthony Chabot Regional Park, Castro Valley, CA, US",37.720475,-122.1043555,24,,Castro Valley,Alameda,White Globe Lily,Calochortus albus,White Globe Lily,Plantae,51315,Liliaceae,Calochortus,Calochortus albus
12731468,5/21/18,2018-05-22 01:18:01 UTC,Pacific Time (US & Canada),research,https://www.inaturalist.org/observations/12731468,https://inaturalist-open-data.s3.amazonaws.com/photos/18440886/medium.jpg,,1,0,FALSE,"Anthony Chabot Regional Park, Castro Valley, CA, US",37.72485333,-122.1027667,8,,Castro Valley,Alameda,yerba buena,Clinopodium douglasii,yerba buena,Plantae,53203,Lamiaceae,Clinopodium,Clinopodium douglasii
12731477,5/21/18,2018-05-22 01:29:21 UTC,Pacific Time (US & Canada),research,https://www.inaturalist.org/observations/12731477,https://inaturalist-open-data.s3.amazonaws.com/photos/18440905/medium.jpg,,1,0,FALSE,"Anthony Chabot Regional Park, Castro Valley, CA, US",37.727325,-122.1007833,8,,Castro Valley,Alameda,California bee plant,Scrophularia californica,California beeplant,Plantae,50812,Scrophulariaceae,Scrophularia,Scrophularia californica
12731483,5/21/18,2018-05-22 01:13:17 UTC,Pacific Time (US & Canada),research,https://www.inaturalist.org/observations/12731483,https://inaturalist-open-data.s3.amazonaws.com/photos/18440922/medium.jpg,,1,0,FALSE,"Anthony Chabot Regional Park, Castro Valley, CA, US",37.724395,-122.1031028,8,,Castro Valley,Alameda,California oat grass,Danthonia californica,California oat grass,Plantae,57165,Poaceae,Danthonia,Danthonia californica
12731489,5/21/18,2018-05-22 01:07:47 UTC,Pacific Time (US & Canada),research,https://www.inaturalist.org/observations/12731489,https://inaturalist-open-data.s3.amazonaws.com/photos/18440940/medium.jpg,,1,0,FALSE,"Anthony Chabot Regional Park, Castro Valley, CA, US",37.72263,-122.1036528,8,,Castro Valley,Alameda,Pink Honeysuckle,Lonicera hispidula,Pink Honeysuckle,Plantae,53416,Caprifoliaceae,Lonicera,Lonicera hispidula
12818790,5/21/18,2018-05-21 20:45:28 UTC,Pacific Time (US & Canada),research,https://www.inaturalist.org/observations/12818790,https://static.inaturalist.org/photos/18592062/medium.jpg,,1,0,FALSE,"Anthony Chabot Regional Park, Castro Valley, CA, US",37.72599748,-122.1014328,1219,,Castro Valley,Alameda,hillside woodland star,Lithophragma heterophyllum,hillside woodland star,Plantae,53124,Saxifragaceae,Lithophragma,Lithophragma heterophyllum
12818855,5/21/18,2018-05-21 21:02:14 UTC,Pacific Time (US & Canada),research,https://www.inaturalist.org/observations/12818855,https://static.inaturalist.org/photos/18592191/medium.jpg,,1,0,FALSE,"Lake Chabot, Castro Valley, CA, US",37.72845995,-122.1014672,1425,,,Alameda,Pink Honeysuckle,Lonicera hispidula,Pink Honeysuckle,Plantae,53416,Caprifoliaceae,Lonicera,Lonicera hispidula
12818864,5/21/18,2018-05-21 21:16:24 UTC,Pacific Time (US & Canada),research,https://www.inaturalist.org/observations/12818864,https://static.inaturalist.org/photos/18592213/medium.jpg,,2,0,FALSE,"Lake Chabot, Castro Valley, CA, US",37.72909733,-122.1006613,1209,,,Alameda,turkey tangle frogfruit,Phyla nodiflora,turkey tangle frogfruit,Plantae,59040,Verbenaceae,Phyla,Phyla nodiflora
12818873,5/21/18,2018-05-21 21:17:31 UTC,Pacific Time (US & Canada),research,https://www.inaturalist.org/observations/12818873,https://static.inaturalist.org/photos/18592226/medium.jpg,,1,0,FALSE,"Anthony Chabot Regional Park, Alameda County, US-CA, US",37.7296889,-122.097646,2104,,,Alameda,California bee plant,Scrophularia californica,California beeplant,Plantae,50812,Scrophulariaceae,Scrophularia,Scrophularia californica
12818901,5/21/18,2018-05-21 21:28:53 UTC,Pacific Time (US & Canada),research,https://www.inaturalist.org/observations/12818901,https://static.inaturalist.org/photos/18592272/medium.jpg,,1,0,FALSE,"Lake Chabot, Castro Valley, CA, US",37.72713848,-122.1016005,420,,,Alameda,Fiesta Flower,Pholistoma auritum,Fiesta Flower,Plantae,55437,Boraginaceae,Pholistoma,Pholistoma auritum
12818904,5/21/18,2018-05-21 21:30:22 UTC,Pacific Time (US & Canada),research,https://www.inaturalist.org/observations/12818904,https://static.inaturalist.org/photos/18592279/medium.jpg,,2,0,FALSE,"Lake Chabot, Castro Valley, CA, US",37.72329911,-122.1037704,653,,Castro Valley,Alameda,Pacific ninebark,Physocarpus capitatus,Pacific ninebark,Plantae,57249,Rosaceae,Physocarpus,Physocarpus capitatus
12818948,5/21/18,2018-05-21 21:04:36 UTC,Pacific Time (US & Canada),research,https://www.inaturalist.org/observations/12818948,https://static.inaturalist.org/photos/18592397/medium.jpg,,1,0,FALSE,"Anthony Chabot Regional Park, Castro Valley, CA, US",37.72672023,-122.1009297,662,,Castro Valley,Alameda,orange bush monkeyflower,Diplacus aurantiacus,orange bush monkeyflower,Plantae,777371,Phrymaceae,Diplacus,Diplacus aurantiacus
15697712,5/23/18,2018-05-23 19:58:00 UTC,Pacific Time (US & Canada),research,https://www.inaturalist.org/observations/15697712,https://inaturalist-open-data.s3.amazonaws.com/photos/23429084/medium.jpg,"Proctor Trail, A. Chabot Regional Park, Castro Valley, CA",1,0,FALSE,"Castro Valley, CA, USA",37.72531195,-122.0873319,31,,Castro Valley,Alameda,Pacific ninebark,Physocarpus capitatus,Pacific ninebark,Plantae,57249,Rosaceae,Physocarpus,Physocarpus capitatus
15698170,5/23/18,2018-05-23 20:10:00 UTC,Pacific Time (US & Canada),research,https://www.inaturalist.org/observations/15698170,https://inaturalist-open-data.s3.amazonaws.com/photos/23429813/medium.jpg,"Brandon Trail, A. Chabot Regional Park, Castro Valley, CA",1,0,FALSE,"Alameda County, CA, USA",37.73761249,-122.0893796,8,,,Alameda,poison hemlock,Conium maculatum,poison hemlock,Plantae,52998,Apiaceae,Conium,Conium maculatum
15699457,5/23/18,2018-05-23 20:40:00 UTC,Pacific Time (US & Canada),research,https://www.inaturalist.org/observations/15699457,https://inaturalist-open-data.s3.amazonaws.com/photos/23432038/medium.jpg,"Honker Bay Trail, A. Chabot Regional Park, CA",1,0,FALSE,"Alameda County, CA, USA",37.72914433,-122.0977983,31,,,Alameda,orange bush monkeyflower,Diplacus aurantiacus,orange bush monkeyflower,Plantae,777371,Phrymaceae,Diplacus,Diplacus aurantiacus
15699888,5/23/18,2018-05-23 20:50:00 UTC,Pacific Time (US & Canada),research,https://www.inaturalist.org/observations/15699888,https://inaturalist-open-data.s3.amazonaws.com/photos/23432785/medium.jpg,"Proctor Trail, A. Chabot Regional Park, Castro Valley, CA",2,0,FALSE,"Castro Valley, CA, USA",37.72536247,-122.0873523,31,,Castro Valley,Alameda,blue elder,Sambucus cerulea,blue elder,Plantae,143799,Viburnaceae,Sambucus,Sambucus cerulea
15701653,5/23/18,2018-05-23 21:37:00 UTC,Pacific Time (US & Canada),research,https://www.inaturalist.org/observations/15701653,https://inaturalist-open-data.s3.amazonaws.com/photos/23435763/medium.jpg,"Proctor Trail, A. Chabot Regional Park, Castro Valley, CA
",1,0,FALSE,"Castro Valley, CA, USA",37.7253036,-122.0874994,31,,Castro Valley,Alameda,thimbleberry,Rubus parviflorus,thimbleberry,Plantae,51646,Rosaceae,Rubus,Rubus parviflorus
12775301,5/24/18,2018-05-24 17:45:03 UTC,Pacific Time (US & Canada),research,https://www.inaturalist.org/observations/12775301,https://static.inaturalist.org/photos/18515038/medium.jpg,,2,0,FALSE,"Anthony Chabot Regional Park, San Leandro, CA, US",37.71512056,-122.1096901,6,,Castro Valley,Alameda,Yellow Mariposa Lily,Calochortus luteus,Yellow Mariposa Lily,Plantae,51077,Liliaceae,Calochortus,Calochortus luteus
12819150,5/25/18,2018-05-25 20:45:18 UTC,Pacific Time (US & Canada),research,https://www.inaturalist.org/observations/12819150,https://static.inaturalist.org/photos/18592854/medium.jpg,,1,0,FALSE,"Anthony Chabot Regional Park, Castro Valley, CA, US",37.72675051,-122.1010529,628,,Castro Valley,Alameda,Mediterranean Stork's-bill,Erodium botrys,Mediterranean Stork's-bill,Plantae,57090,Geraniaceae,Erodium,Erodium botrys
12911905,5/28/18,2018-05-28 21:53:49 UTC,Pacific Time (US & Canada),research,https://www.inaturalist.org/observations/12911905,https://static.inaturalist.org/photos/18755074/medium.jpg,,1,0,FALSE,"Anthony Chabot Regional Park, Castro Valley, CA, US",37.73390833,-122.112525,10,,,Alameda,deerweed,Acmispon glaber,deerweed,Plantae,53134,Fabaceae,Acmispon,Acmispon glaber
12911926,5/28/18,2018-05-28 21:06:09 UTC,Pacific Time (US & Canada),research,https://www.inaturalist.org/observations/12911926,https://static.inaturalist.org/photos/18755095/medium.jpg,,1,0,FALSE,"Anthony Chabot Regional Park, Oakland, CA, US",37.735275,-122.1181195,10,,Oakland,Alameda,Pimpernel,Lysimachia arvensis,scarlet pimpernel,Plantae,791928,Primulaceae,Lysimachia,Lysimachia arvensis
12911972,5/28/18,2018-05-28 20:57:40 UTC,Pacific Time (US & Canada),research,https://www.inaturalist.org/observations/12911972,https://static.inaturalist.org/photos/18755216/medium.jpg,,1,0,FALSE,"Chabot Park, Oakland, CA, US",37.73356667,-122.1218028,50,,Oakland,Alameda,Golden Yarrow,Eriophyllum confertiflorum,Golden Yarrow,Plantae,53395,Asteraceae,Eriophyllum,Eriophyllum confertiflorum
12911984,5/28/18,2018-05-28 20:55:48 UTC,Pacific Time (US & Canada),research,https://www.inaturalist.org/observations/12911984,https://static.inaturalist.org/photos/18755238/medium.jpg,,1,0,FALSE,"Anthony Chabot Regional Park, Oakland, CA, US",37.73422167,-122.1224667,5,,Oakland,Alameda,reddish tufted vetch,Vicia benghalensis,reddish tufted vetch,Plantae,53333,Fabaceae,Vicia,Vicia benghalensis
12912067,5/28/18,2018-05-28 20:23:29 UTC,Pacific Time (US & Canada),research,https://www.inaturalist.org/observations/12912067,https://static.inaturalist.org/photos/18755346/medium.jpg,,1,0,FALSE,"Chabot Park, Oakland, CA, US",37.73037167,-122.1243362,10,,Oakland,Alameda,French broom,Genista monspessulana,French broom,Plantae,53403,Fabaceae,Genista,Genista monspessulana
12912115,5/28/18,2018-05-28 20:06:44 UTC,Pacific Time (US & Canada),research,https://www.inaturalist.org/observations/12912115,https://static.inaturalist.org/photos/18755485/medium.jpg,,2,0,FALSE,"Anthony Chabot Regional Park, Castro Valley, CA, US",37.72765333,-122.1156612,10,,,Alameda,Ithuriel's Spear,Triteleia laxa,Ithuriel's Spear,Plantae,51085,Asparagaceae,Triteleia,Triteleia laxa
12912129,5/28/18,2018-05-28 20:02:05 UTC,Pacific Time (US & Canada),research,https://www.inaturalist.org/observations/12912129,https://static.inaturalist.org/photos/18755535/medium.jpg,,2,0,FALSE,"Lake Chabot, Castro Valley, CA, US",37.72562833,-122.1138445,10,,Castro Valley,Alameda,Pale pink-sorrel,Oxalis incarnata,Pale pink-sorrel,Plantae,61776,Oxalidaceae,Oxalis,Oxalis incarnata
12912167,5/28/18,2018-05-28 19:52:35 UTC,Pacific Time (US & Canada),research,https://www.inaturalist.org/observations/12912167,https://static.inaturalist.org/photos/18755610/medium.jpg,,2,0,FALSE,"Anthony Chabot Regional Park, Castro Valley, CA, US",37.72189667,-122.1093445,10,,Castro Valley,Alameda,orange bush monkeyflower,Diplacus aurantiacus,orange bush monkeyflower,Plantae,777371,Phrymaceae,Diplacus,Diplacus aurantiacus
12912201,5/28/18,2018-05-28 19:50:22 UTC,Pacific Time (US & Canada),research,https://www.inaturalist.org/observations/12912201,https://static.inaturalist.org/photos/18755678/medium.jpg,,1,0,FALSE,"Anthony Chabot Regional Park, Castro Valley, CA, US",37.72053833,-122.1086667,5,,Castro Valley,Alameda,Red Valerian,Centranthus ruber,Red Valerian,Plantae,57283,Caprifoliaceae,Centranthus,Centranthus ruber
12912295,5/28/18,2018-05-28 19:33:47 UTC,Pacific Time (US & Canada),research,https://www.inaturalist.org/observations/12912295,https://static.inaturalist.org/photos/18755784/medium.jpg,,1,0,FALSE,"Anthony Chabot Regional Park, Castro Valley, CA, US",37.71502833,-122.1025305,65,,Castro Valley,Alameda,wild radish,Raphanus sativus,wild radish,Plantae,55410,Brassicaceae,Raphanus,Raphanus sativus
12917582,5/28/18,2018-05-28 22:52:11 UTC,Pacific Time (US & Canada),research,https://www.inaturalist.org/observations/12917582,https://inaturalist-open-data.s3.amazonaws.com/photos/18764638/medium.jpg,,1,0,FALSE,"Anthony Chabot Regional Park, Oakland, CA, US",37.7681,-122.1210472,12,,,Alameda,spotted coralroot,Corallorhiza maculata,spotted coralroot,Plantae,49475,Orchidaceae,Corallorhiza,Corallorhiza maculata
12917599,5/28/18,2018-05-28 23:06:15 UTC,Pacific Time (US & Canada),research,https://www.inaturalist.org/observations/12917599,https://inaturalist-open-data.s3.amazonaws.com/photos/18764658/medium.jpg,,1,0,FALSE,"Anthony Chabot Regional Park, Oakland, CA, US",37.76613833,-122.1175222,8,,,Alameda,yerba buena,Clinopodium douglasii,yerba buena,Plantae,53203,Lamiaceae,Clinopodium,Clinopodium douglasii
12917606,5/28/18,2018-05-28 22:50:59 UTC,Pacific Time (US & Canada),research,https://www.inaturalist.org/observations/12917606,https://inaturalist-open-data.s3.amazonaws.com/photos/18764688/medium.jpg,,2,0,FALSE,"Anthony Chabot Regional Park, Oakland, CA, US",37.76791167,-122.1211305,48,,,Alameda,twinberry honeysuckle,Lonicera involucrata,twinberry honeysuckle,Plantae,60881,Caprifoliaceae,Lonicera,Lonicera involucrata
12917639,5/28/18,2018-05-28 22:45:38 UTC,Pacific Time (US & Canada),research,https://www.inaturalist.org/observations/12917639,https://inaturalist-open-data.s3.amazonaws.com/photos/18764728/medium.jpg,,1,0,FALSE,"Anthony Chabot Regional Park, Oakland, CA, US",37.76718833,-122.1210945,16,,,Alameda,Salsify,Tragopogon porrifolius,purple salsify,Plantae,54141,Asteraceae,Tragopogon,Tragopogon porrifolius
12917677,5/28/18,2018-05-28 22:43:46 UTC,Pacific Time (US & Canada),research,https://www.inaturalist.org/observations/12917677,https://inaturalist-open-data.s3.amazonaws.com/photos/18764779/medium.jpg,,1,0,FALSE,"Anthony Chabot Regional Park, Oakland, CA, US",37.76651167,-122.1206445,12,,,Alameda,broad-leaved sweet pea,Lathyrus latifolius,broad-leaved sweet pea,Plantae,61009,Fabaceae,Lathyrus,Lathyrus latifolius
12933844,5/28/18,2018-05-28 23:14:47 UTC,Pacific Time (US & Canada),research,https://www.inaturalist.org/observations/12933844,https://static.inaturalist.org/photos/18793928/medium.jpg,,1,0,FALSE,"Anthony Chabot Regional Park, Castro Valley, CA, US",37.72218,-122.1038667,5,,Castro Valley,Alameda,Common Vetch,Vicia sativa,Common Vetch,Plantae,53324,Fabaceae,Vicia,Vicia sativa
12958982,5/30/18,2018-05-30 17:51:46 UTC,Pacific Time (US & Canada),research,https://www.inaturalist.org/observations/12958982,https://static.inaturalist.org/photos/18838336/medium.jpg,,2,0,FALSE,"Anthony Chabot Regional Park, Oakland, CA, US",37.75749667,-122.1201862,10,,,Alameda,Wolliges Honiggras,Holcus lanatus,Yorkshire fog,Plantae,52793,Poaceae,Holcus,Holcus lanatus
12976310,5/30/18,2018-05-31 01:19:42 UTC,Pacific Time (US & Canada),research,https://www.inaturalist.org/observations/12976310,https://inaturalist-open-data.s3.amazonaws.com/photos/18868352/medium.jpg,,1,0,FALSE,"Anthony Chabot Regional Park, Castro Valley, CA, US",37.718395,-122.1062305,12,,Castro Valley,Alameda,sticky cinquefoil,Drymocallis glandulosa,sticky cinquefoil,Plantae,76716,Rosaceae,Drymocallis,Drymocallis glandulosa
12988029,5/30/18,2018-05-30 20:18:29 UTC,Pacific Time (US & Canada),research,https://www.inaturalist.org/observations/12988029,https://static.inaturalist.org/photos/18889177/medium.jpeg,,2,0,FALSE,"Castro Valley, CA, USA",37.71530533,-122.1104813,,,Castro Valley,Alameda,Yellow Mariposa Lily,Calochortus luteus,Yellow Mariposa Lily,Plantae,51077,Liliaceae,Calochortus,Calochortus luteus
12988125,5/30/18,2018-05-30 20:28:07 UTC,Pacific Time (US & Canada),research,https://www.inaturalist.org/observations/12988125,https://static.inaturalist.org/photos/115348481/medium.jpeg,,1,0,FALSE,"Castro Valley, CA, USA",37.71543503,-122.1093216,,,Castro Valley,Alameda,harvest brodiaea,Brodiaea elegans,harvest brodiaea,Plantae,51752,Asparagaceae,Brodiaea,Brodiaea elegans
13062097,6/1/18,2018-06-01 22:23:08 UTC,Pacific Time (US & Canada),research,https://www.inaturalist.org/observations/13062097,https://static.inaturalist.org/photos/19019959/medium.jpeg,,2,0,FALSE,"Castro Valley, CA, USA",37.71992493,-122.1027603,,,Castro Valley,Alameda,Stinking iris,Iris foetidissima,Stinking iris,Plantae,64331,Iridaceae,Iris,Iris foetidissima
13069980,6/1/18,2018-06-01 09:17:19 UTC,Pacific Time (US & Canada),research,https://www.inaturalist.org/observations/13069980,https://static.inaturalist.org/photos/19035455/medium.jpeg,,1,0,FALSE,"Castro Valley, CA, USA",37.7267226,-122.0947971,1032,,Castro Valley,Alameda,thimbleberry,Rubus parviflorus,thimbleberry,Plantae,51646,Rosaceae,Rubus,Rubus parviflorus
13162397,6/1/18,2018-06-01 20:42:41 UTC,Pacific Time (US & Canada),research,https://www.inaturalist.org/observations/13162397,https://static.inaturalist.org/photos/19211808/medium.jpeg,,2,0,FALSE,"Unnamed Road, Castro Valley, CA 94546, USA",37.72239685,-122.1038666,,,Castro Valley,Alameda,Pink Honeysuckle,Lonicera hispidula,Pink Honeysuckle,Plantae,53416,Caprifoliaceae,Lonicera,Lonicera hispidula
13162407,6/1/18,2018-06-01 20:57:54 UTC,Pacific Time (US & Canada),research,https://www.inaturalist.org/observations/13162407,https://static.inaturalist.org/photos/19211843/medium.jpeg,,2,0,FALSE,"Castro Valley, CA, USA",37.72623444,-122.0996628,,,Castro Valley,Alameda,Pacific ninebark,Physocarpus capitatus,Pacific ninebark,Plantae,57249,Rosaceae,Physocarpus,Physocarpus capitatus
15375928,6/2/18,2018-06-02 17:11:00 UTC,Pacific Time (US & Canada),research,https://www.inaturalist.org/observations/15375928,https://inaturalist-open-data.s3.amazonaws.com/photos/23040124/medium.jpg,,2,0,FALSE,"Alameda County, CA, USA",37.72809,-122.10103,,,,Alameda,orange bush monkeyflower,Diplacus aurantiacus,orange bush monkeyflower,Plantae,777371,Phrymaceae,Diplacus,Diplacus aurantiacus
15375934,6/2/18,2018-06-02 17:58:00 UTC,Pacific Time (US & Canada),research,https://www.inaturalist.org/observations/15375934,https://inaturalist-open-data.s3.amazonaws.com/photos/23040159/medium.jpg,,2,0,FALSE,"Alameda County, CA, USA",37.73938667,-122.0926983,,,,Alameda,California poppy,Eschscholzia californica,California poppy,Plantae,48225,Papaveraceae,Eschscholzia,Eschscholzia californica
15375935,6/2/18,2018-06-02 19:51:00 UTC,Pacific Time (US & Canada),research,https://www.inaturalist.org/observations/15375935,https://inaturalist-open-data.s3.amazonaws.com/photos/23040170/medium.jpg,,1,0,FALSE,"Anthony Chabot Regional Park, Alameda, California, United States",37.744475,-122.114455,,,,Alameda,broad-leaved sweet pea,Lathyrus latifolius,broad-leaved sweet pea,Plantae,61009,Fabaceae,Lathyrus,Lathyrus latifolius
15375937,6/2/18,2018-06-02 20:11:00 UTC,Pacific Time (US & Canada),research,https://www.inaturalist.org/observations/15375937,https://inaturalist-open-data.s3.amazonaws.com/photos/23040184/medium.jpg,,1,0,FALSE,"Anthony Chabot Regional Park, Alameda, California, United States",37.73536667,-122.117195,,,Oakland,Alameda,Chick Lupine,Lupinus microcarpus,chick lupine,Plantae,57069,Fabaceae,Lupinus,Lupinus microcarpus
15375949,6/2/18,2018-06-02 20:22:00 UTC,Pacific Time (US & Canada),research,https://www.inaturalist.org/observations/15375949,https://inaturalist-open-data.s3.amazonaws.com/photos/23040216/medium.jpg,,1,0,FALSE,"Oakland, CA, USA",37.73351833,-122.1233133,,,Oakland,Alameda,Italian thistle,Carduus pycnocephalus,Italian thistle,Plantae,52990,Asteraceae,Carduus,Carduus pycnocephalus
15375952,6/2/18,2018-06-02 20:35:00 UTC,Pacific Time (US & Canada),research,https://www.inaturalist.org/observations/15375952,https://inaturalist-open-data.s3.amazonaws.com/photos/23040248/medium.jpg,,2,0,FALSE,"Castro Valley, CA, USA",37.73004833,-122.11961,,,Castro Valley,Alameda,bluehead gilia,Gilia capitata,bluehead gilia,Plantae,57793,Polemoniaceae,Gilia,Gilia capitata
15375959,6/2/18,2018-06-02 20:39:00 UTC,Pacific Time (US & Canada),research,https://www.inaturalist.org/observations/15375959,https://inaturalist-open-data.s3.amazonaws.com/photos/23040264/medium.jpg,,1,0,FALSE,"Anthony Chabot Regional Park, Alameda, California, United States",37.72868667,-122.1177633,,,Castro Valley,Alameda,western columbine,Aquilegia formosa,western columbine,Plantae,48244,Ranunculaceae,Aquilegia,Aquilegia formosa
15375960,6/2/18,2018-06-02 20:40:00 UTC,Pacific Time (US & Canada),research,https://www.inaturalist.org/observations/15375960,https://inaturalist-open-data.s3.amazonaws.com/photos/23040278/medium.jpg,,1,0,FALSE,"Anthony Chabot Regional Park, Alameda, California, United States",37.72764,-122.11676,,,Castro Valley,Alameda,Common Vetch,Vicia sativa,Common Vetch,Plantae,53324,Fabaceae,Vicia,Vicia sativa
15375962,6/2/18,2018-06-02 20:43:00 UTC,Pacific Time (US & Canada),research,https://www.inaturalist.org/observations/15375962,https://inaturalist-open-data.s3.amazonaws.com/photos/23040289/medium.jpg,,1,0,FALSE,"Anthony Chabot Regional Park, Alameda, California, United States",37.72672167,-122.1158467,,,Castro Valley,Alameda,California buckeye,Aesculus californica,California buckeye,Plantae,53348,Sapindaceae,Aesculus,Aesculus californica
15375968,6/2/18,2018-06-02 20:47:00 UTC,Pacific Time (US & Canada),research,https://www.inaturalist.org/observations/15375968,https://inaturalist-open-data.s3.amazonaws.com/photos/23040297/medium.jpg,,1,0,FALSE,"Anthony Chabot Regional Park, Alameda, California, United States",37.725025,-122.1133767,,,Castro Valley,Alameda,Pale pink-sorrel,Oxalis incarnata,Pale pink-sorrel,Plantae,61776,Oxalidaceae,Oxalis,Oxalis incarnata
15376283,6/2/18,2018-06-02 18:18:00 UTC,Pacific Time (US & Canada),research,https://www.inaturalist.org/observations/15376283,https://inaturalist-open-data.s3.amazonaws.com/photos/23041374/medium.jpg,,1,0,FALSE,"Alameda County, CA, USA",37.74446667,-122.1051817,,,,Alameda,Greater Quaking Grass,Briza maxima,Greater Quaking Grass,Plantae,57157,Poaceae,Briza,Briza maxima
13125113,6/4/18,2018-06-04 21:57:26 UTC,Pacific Time (US & Canada),research,https://www.inaturalist.org/observations/13125113,https://static.inaturalist.org/photos/19136310/medium.jpg,,2,0,FALSE,"Anthony Chabot Regional Park, Castro Valley, CA, US",37.72447545,-122.1028887,278,,Castro Valley,Alameda,Indian teasel,Dipsacus sativus,fuller's teasel,Plantae,53028,Caprifoliaceae,Dipsacus,Dipsacus sativus
13163151,6/5/18,2018-06-06 01:46:33 UTC,Pacific Time (US & Canada),research,https://www.inaturalist.org/observations/13163151,https://static.inaturalist.org/photos/19213773/medium.jpg,,1,0,FALSE,"MacDonald Trail, Oakland, CA 94619, USA",37.78472137,-122.1313858,,,,Alameda,Skunkweed,Navarretia squarrosa,Skunkweed,Plantae,53157,Polemoniaceae,Navarretia,Navarretia squarrosa
13184736,6/5/18,2018-06-06 02:59:19 UTC,Pacific Time (US & Canada),research,https://www.inaturalist.org/observations/13184736,https://static.inaturalist.org/photos/19270475/medium.jpeg,,1,0,FALSE,"Castro Valley, CA, USA",37.71682739,-122.1133881,,,Castro Valley,Alameda,Narrow-leaved clover,Trifolium angustifolium,Narrow-leaved clover,Plantae,69939,Fabaceae,Trifolium,Trifolium angustifolium
13204718,6/6/18,2018-06-06 21:25:07 UTC,Pacific Time (US & Canada),research,https://www.inaturalist.org/observations/13204718,https://static.inaturalist.org/photos/19306806/medium.jpg,,2,0,FALSE,"Anthony Chabot Regional Park, Castro Valley, CA, US",37.7396,-122.0930167,5,,,Alameda,Yellow Mariposa Lily,Calochortus luteus,Yellow Mariposa Lily,Plantae,51077,Liliaceae,Calochortus,Calochortus luteus
15704277,6/6/18,2018-06-06 22:26:00 UTC,Pacific Time (US & Canada),research,https://www.inaturalist.org/observations/15704277,https://inaturalist-open-data.s3.amazonaws.com/photos/23439151/medium.jpg,"Brandon Trail, Anthony Chabot Regional Park, Castro Valley, CA",2,0,FALSE,"Alameda County, CA, USA",37.7373284,-122.0890748,61,,,Alameda,western vervain,Verbena lasiostachys,western vervain,Plantae,53316,Verbenaceae,Verbena,Verbena lasiostachys
15792933,6/6/18,2018-06-06 20:25:00 UTC,Pacific Time (US & Canada),research,https://www.inaturalist.org/observations/15792933,https://inaturalist-open-data.s3.amazonaws.com/photos/23601048/medium.jpg,"Brandon Trail, Anthony Chabot Regional Park, Castro Valley, CA",1,0,FALSE,"Alameda County, CA, USA",37.75926961,-122.1164432,15,,,Alameda,Pink Honeysuckle,Lonicera hispidula,Pink Honeysuckle,Plantae,53416,Caprifoliaceae,Lonicera,Lonicera hispidula
16059216,6/6/18,,Pacific Time (US & Canada),research,https://www.inaturalist.org/observations/16059216,https://inaturalist-open-data.s3.amazonaws.com/photos/24043322/medium.jpg,,1,0,FALSE,"Alameda County, CA, USA",37.74094103,-122.0954436,15,,,Alameda,Sheep's sorrel,Rumex acetosella,Sheep's sorrel,Plantae,53195,Polygonaceae,Rumex,Rumex acetosella
13321911,6/10/18,2018-06-10 21:07:22 UTC,Pacific Time (US & Canada),research,https://www.inaturalist.org/observations/13321911,https://static.inaturalist.org/photos/19515177/medium.jpg,,1,0,FALSE,"Anthony Chabot Regional Park, Alameda County, US-CA, US",37.77969785,-122.1291165,10,,,Alameda,California buckeye,Aesculus californica,California buckeye,Plantae,53348,Sapindaceae,Aesculus,Aesculus californica
13324118,6/10/18,2018-06-11 02:48:02 UTC,Pacific Time (US & Canada),research,https://www.inaturalist.org/observations/13324118,https://inaturalist-open-data.s3.amazonaws.com/photos/19519225/medium.jpg,,2,0,FALSE,"Chabot Park, Oakland, CA, US",37.730605,-122.1248028,32,,Oakland,Alameda,bluehead gilia,Gilia capitata,bluehead gilia,Plantae,57793,Polemoniaceae,Gilia,Gilia capitata
13324157,6/10/18,2018-06-11 02:22:50 UTC,Pacific Time (US & Canada),research,https://www.inaturalist.org/observations/13324157,https://inaturalist-open-data.s3.amazonaws.com/photos/19519353/medium.jpg,,1,0,FALSE,"Anthony Chabot Regional Park, Oakland, CA, US",37.73372167,-122.1200555,8,,Oakland,Alameda,forest scurfpea,Rupertia physodes,forest scurfpea,Plantae,53198,Fabaceae,Rupertia,Rupertia physodes
13324244,6/10/18,2018-06-11 01:37:55 UTC,Pacific Time (US & Canada),research,https://www.inaturalist.org/observations/13324244,https://inaturalist-open-data.s3.amazonaws.com/photos/19519502/medium.jpg,,1,0,FALSE,"Anthony Chabot Regional Park, Oakland, CA, US",37.747745,-122.1138917,6,,,Alameda,western vervain,Verbena lasiostachys,western vervain,Plantae,53316,Verbenaceae,Verbena,Verbena lasiostachys
13324505,6/10/18,2018-06-10 23:51:51 UTC,Pacific Time (US & Canada),research,https://www.inaturalist.org/observations/13324505,https://inaturalist-open-data.s3.amazonaws.com/photos/19519849/medium.jpg,,1,0,FALSE,"Anthony Chabot Regional Park, Castro Valley, CA, US",37.739395,-122.1143417,12,,,Alameda,Pink Honeysuckle,Lonicera hispidula,Pink Honeysuckle,Plantae,53416,Caprifoliaceae,Lonicera,Lonicera hispidula
13324911,6/10/18,2018-06-10 23:48:28 UTC,Pacific Time (US & Canada),research,https://www.inaturalist.org/observations/13324911,https://inaturalist-open-data.s3.amazonaws.com/photos/19520685/medium.jpg,,1,0,FALSE,"Anthony Chabot Regional Park, Castro Valley, CA, US",37.73927,-122.1145028,16,,,Alameda,Coyote Mint,Monardella villosa,Coyote Mint,Plantae,52181,Lamiaceae,Monardella,Monardella villosa
13324950,6/10/18,2018-06-10 23:38:55 UTC,Pacific Time (US & Canada),research,https://www.inaturalist.org/observations/13324950,https://inaturalist-open-data.s3.amazonaws.com/photos/19520758/medium.jpg,,1,0,FALSE,"Anthony Chabot Regional Park, Oakland, CA, US",37.74112833,-122.1136555,2000,,,Alameda,Pacific poison oak,Toxicodendron diversilobum,Pacific poison oak,Plantae,51080,Anacardiaceae,Toxicodendron,Toxicodendron diversilobum
13324995,6/10/18,2018-06-10 23:21:01 UTC,Pacific Time (US & Canada),research,https://www.inaturalist.org/observations/13324995,https://inaturalist-open-data.s3.amazonaws.com/photos/19520858/medium.jpg,,1,0,FALSE,"Anthony Chabot Regional Park, Oakland, CA, US",37.74010833,-122.1149305,16,,,Alameda,stinging nettle,Urtica dioica,great stinging nettle,Plantae,51884,Urticaceae,Urtica,Urtica dioica
13325039,6/10/18,2018-06-10 23:19:59 UTC,Pacific Time (US & Canada),research,https://www.inaturalist.org/observations/13325039,https://inaturalist-open-data.s3.amazonaws.com/photos/19520923/medium.jpg,,1,0,FALSE,"Anthony Chabot Regional Park, Oakland, CA, US",37.74008833,-122.1148612,12,,,Alameda,Rosilla,Helenium puberulum,Rosilla,Plantae,53092,Asteraceae,Helenium,Helenium puberulum
13325057,6/10/18,2018-06-10 23:02:20 UTC,Pacific Time (US & Canada),research,https://www.inaturalist.org/observations/13325057,https://inaturalist-open-data.s3.amazonaws.com/photos/19520971/medium.jpg,,1,0,FALSE,"Anthony Chabot Regional Park, Oakland, CA, US",37.73731167,-122.1160972,6,,Oakland,Alameda,California buckeye,Aesculus californica,California buckeye,Plantae,53348,Sapindaceae,Aesculus,Aesculus californica
13325185,6/10/18,2018-06-10 22:53:18 UTC,Pacific Time (US & Canada),research,https://www.inaturalist.org/observations/13325185,https://inaturalist-open-data.s3.amazonaws.com/photos/19521204/medium.jpg,,2,0,FALSE,"Anthony Chabot Regional Park, Oakland, CA, US",37.73653333,-122.1163945,8,,Oakland,Alameda,Ithuriel's Spear,Triteleia laxa,Ithuriel's Spear,Plantae,51085,Asparagaceae,Triteleia,Triteleia laxa
13325189,6/10/18,2018-06-10 22:35:30 UTC,Pacific Time (US & Canada),research,https://www.inaturalist.org/observations/13325189,https://inaturalist-open-data.s3.amazonaws.com/photos/19521221/medium.jpg,,2,0,FALSE,"Lake Chabot Golf Course, Oakland, CA, US",37.7359,-122.1197805,6,,Oakland,Alameda,Yellow Mariposa Lily,Calochortus luteus,Yellow Mariposa Lily,Plantae,51077,Liliaceae,Calochortus,Calochortus luteus
13325215,6/10/18,2018-06-10 22:23:59 UTC,Pacific Time (US & Canada),research,https://www.inaturalist.org/observations/13325215,https://inaturalist-open-data.s3.amazonaws.com/photos/19521237/medium.jpg,,1,0,FALSE,"Anthony Chabot Regional Park, Oakland, CA, US",37.734325,-122.1205583,6,,Oakland,Alameda,harvest brodiaea,Brodiaea elegans,harvest brodiaea,Plantae,51752,Asparagaceae,Brodiaea,Brodiaea elegans
13934467,6/10/18,2018-06-11 01:38:08 UTC,Pacific Time (US & Canada),research,https://www.inaturalist.org/observations/13934467,https://inaturalist-open-data.s3.amazonaws.com/photos/20591191/medium.jpg,,1,0,FALSE,"Anthony Chabot Regional Park, Oakland, CA, US",37.747805,-122.1140222,16,,,Alameda,milk thistle,Silybum marianum,milk thistle,Plantae,52586,Asteraceae,Silybum,Silybum marianum
13934564,6/10/18,2018-06-11 00:10:35 UTC,Pacific Time (US & Canada),research,https://www.inaturalist.org/observations/13934564,https://inaturalist-open-data.s3.amazonaws.com/photos/20591333/medium.jpg,,1,0,FALSE,"Anthony Chabot Regional Park, Castro Valley, CA, US",37.736105,-122.1128,12,,,Alameda,Greater Quaking Grass,Briza maxima,Greater Quaking Grass,Plantae,57157,Poaceae,Briza,Briza maxima
13339201,6/11/18,2018-06-11 17:56:54 UTC,Pacific Time (US & Canada),research,https://www.inaturalist.org/observations/13339201,https://static.inaturalist.org/photos/19545929/medium.jpg,,2,0,FALSE,"Anthony Chabot Regional Park, San Leandro, CA, US",37.71466583,-122.1080492,6,,Castro Valley,Alameda,clay mariposa lily,Calochortus argillosus,clay mariposa lily,Plantae,64330,Liliaceae,Calochortus,Calochortus argillosus
13339984,6/11/18,2018-06-11 18:29:26 UTC,Pacific Time (US & Canada),research,https://www.inaturalist.org/observations/13339984,https://static.inaturalist.org/photos/19547447/medium.jpg,,3,1,FALSE,"Anthony Chabot Regional Park, Castro Valley, CA, US",37.71847693,-122.1127118,24,,Castro Valley,Alameda,Sweet scabious,Sixalix atropurpurea,Sweet scabious,Plantae,372376,Caprifoliaceae,Sixalix,Sixalix atropurpurea
13454473,6/15/18,2018-06-15 17:14:39 UTC,Pacific Time (US & Canada),research,https://www.inaturalist.org/observations/13454473,https://static.inaturalist.org/photos/19749584/medium.jpg,,1,0,FALSE,"Anthony Chabot Regional Park, San Leandro, CA, US",37.71544852,-122.1097478,24,,Castro Valley,Alameda,California Aster,Corethrogyne filaginifolia,California Aster,Plantae,58014,Asteraceae,Corethrogyne,Corethrogyne filaginifolia
13541223,6/16/18,2018-06-16 18:04:26 UTC,Pacific Time (US & Canada),research,https://www.inaturalist.org/observations/13541223,https://static.inaturalist.org/photos/19903144/medium.jpg,,2,0,FALSE,"Anthony Chabot Regional Park, Alameda County, US-CA, US",37.72721363,-122.1071027,6,,,Alameda,orange bush monkeyflower,Diplacus aurantiacus,orange bush monkeyflower,Plantae,777371,Phrymaceae,Diplacus,Diplacus aurantiacus
13541231,6/16/18,2018-06-16 18:07:23 UTC,Pacific Time (US & Canada),research,https://www.inaturalist.org/observations/13541231,https://static.inaturalist.org/photos/19903156/medium.jpg,,1,0,FALSE,"Anthony Chabot Regional Park, Alameda County, US-CA, US",37.72691535,-122.105522,8,,,Alameda,Pacific poison oak,Toxicodendron diversilobum,Pacific poison oak,Plantae,51080,Anacardiaceae,Toxicodendron,Toxicodendron diversilobum
13541232,6/16/18,2018-06-16 18:08:00 UTC,Pacific Time (US & Canada),research,https://www.inaturalist.org/observations/13541232,https://static.inaturalist.org/photos/19903171/medium.jpg,,2,0,FALSE,"Anthony Chabot Regional Park, Alameda County, US-CA, US",37.72704462,-122.1053596,6,,,Alameda,California poppy,Eschscholzia californica,California poppy,Plantae,48225,Papaveraceae,Eschscholzia,Eschscholzia californica
13581130,6/18/18,2018-06-19 01:31:19 UTC,Pacific Time (US & Canada),research,https://www.inaturalist.org/observations/13581130,https://static.inaturalist.org/photos/19973926/medium.jpeg,,1,0,FALSE,"Columbine Trail, Castro Valley, CA 94552, USA",37.74183655,-122.1138229,,,,Alameda,Greater celandine,Chelidonium majus,Greater celandine,Plantae,55757,Papaveraceae,Chelidonium,Chelidonium majus
13581348,6/18/18,2018-06-19 01:25:18 UTC,Pacific Time (US & Canada),research,https://www.inaturalist.org/observations/13581348,https://static.inaturalist.org/photos/19974322/medium.jpeg,,2,0,FALSE,"Columbine Trail, Oakland, CA 94605, USA",37.74366379,-122.1126938,,,,Alameda,Armenian Blackberry,Rubus armeniacus,Armenian Blackberry,Plantae,61317,Rosaceae,Rubus,Rubus armeniacus
13581351,6/18/18,2018-06-19 01:10:01 UTC,Pacific Time (US & Canada),research,https://www.inaturalist.org/observations/13581351,https://static.inaturalist.org/photos/19974331/medium.jpeg,,1,0,FALSE,"Goldenrod Trail, Oakland, CA 94605, USA",37.74562454,-122.1151581,,,,Alameda,broad-leaved sweet pea,Lathyrus latifolius,broad-leaved sweet pea,Plantae,61009,Fabaceae,Lathyrus,Lathyrus latifolius
13581354,6/18/18,2018-06-19 01:08:27 UTC,Pacific Time (US & Canada),research,https://www.inaturalist.org/observations/13581354,https://static.inaturalist.org/photos/19974341/medium.jpeg,,1,0,FALSE,"Goldenrod Trail, Oakland, CA 94605, USA",37.74491119,-122.1144104,,,,Alameda,Pacific pea,Lathyrus vestitus,Pacific pea,Plantae,50320,Fabaceae,Lathyrus,Lathyrus vestitus
13581356,6/18/18,2018-06-19 00:58:02 UTC,Pacific Time (US & Canada),research,https://www.inaturalist.org/observations/13581356,https://static.inaturalist.org/photos/19974343/medium.jpeg,,1,0,FALSE,"Goldenrod Trail, Oakland, CA 94605, USA",37.73975754,-122.1163559,,,Oakland,Alameda,coast Indian paintbrush,Castilleja affinis,Coast Paintbrush,Plantae,50042,Orobanchaceae,Castilleja,Castilleja affinis
13581358,6/18/18,2018-06-19 00:50:52 UTC,Pacific Time (US & Canada),research,https://www.inaturalist.org/observations/13581358,https://static.inaturalist.org/photos/19974350/medium.jpeg,,1,0,FALSE,"Bass Cove Trail, Oakland, CA 94605, USA",37.73604202,-122.1162415,,,Oakland,Alameda,bird's-foot trefoil,Lotus corniculatus,bird's-foot trefoil,Plantae,47435,Fabaceae,Lotus,Lotus corniculatus
13581362,6/18/18,2018-06-19 00:50:26 UTC,Pacific Time (US & Canada),research,https://www.inaturalist.org/observations/13581362,https://static.inaturalist.org/photos/19974351/medium.jpeg,,1,0,FALSE,"Bass Cove Trail, Oakland, CA 94605, USA",37.73600006,-122.1162338,,,Oakland,Alameda,Chick Lupine,Lupinus microcarpus,chick lupine,Plantae,57069,Fabaceae,Lupinus,Lupinus microcarpus
13581369,6/18/18,2018-06-19 00:48:57 UTC,Pacific Time (US & Canada),research,https://www.inaturalist.org/observations/13581369,https://static.inaturalist.org/photos/19974355/medium.jpeg,,1,0,FALSE,"Bass Cove Trail, Oakland, CA 94605, USA",37.73563766,-122.1164932,,,Oakland,Alameda,wavy-leafed soap plant,Chlorogalum pomeridianum,wavy-leafed soap plant,Plantae,47597,Asparagaceae,Chlorogalum,Chlorogalum pomeridianum
13581376,6/18/18,2018-06-19 00:46:56 UTC,Pacific Time (US & Canada),research,https://www.inaturalist.org/observations/13581376,https://static.inaturalist.org/photos/19974358/medium.jpeg,,1,0,FALSE,"Bass Cove Trail, Oakland, CA 94605, USA",37.73530197,-122.1178741,,,Oakland,Alameda,Shortpod Mustard,Hirschfeldia incana,Shortpod Mustard,Plantae,53097,Brassicaceae,Hirschfeldia,Hirschfeldia incana
13581382,6/18/18,2018-06-19 00:41:52 UTC,Pacific Time (US & Canada),research,https://www.inaturalist.org/observations/13581382,https://static.inaturalist.org/photos/19974359/medium.jpeg,,1,0,FALSE,"Bass Cove Trail, Oakland, CA 94605, USA",37.73332214,-122.1209488,,,Oakland,Alameda,Pink Honeysuckle,Lonicera hispidula,Pink Honeysuckle,Plantae,53416,Caprifoliaceae,Lonicera,Lonicera hispidula
13581387,6/18/18,2018-06-19 00:41:07 UTC,Pacific Time (US & Canada),research,https://www.inaturalist.org/observations/13581387,https://static.inaturalist.org/photos/19974368/medium.jpeg,,1,0,FALSE,"Bass Cove Trail, Oakland, CA 94605, USA",37.73324585,-122.1214905,,,Oakland,Alameda,Coyote Mint,Monardella villosa,Coyote Mint,Plantae,52181,Lamiaceae,Monardella,Monardella villosa
13581393,6/18/18,2018-06-19 00:38:20 UTC,Pacific Time (US & Canada),research,https://www.inaturalist.org/observations/13581393,https://static.inaturalist.org/photos/19974380/medium.jpeg,,2,0,FALSE,"Bass Cove Trail, Oakland, CA 94605, USA",37.73416138,-122.1226807,,,Oakland,Alameda,blue elder,Sambucus cerulea,blue elder,Plantae,143799,Viburnaceae,Sambucus,Sambucus cerulea
13581403,6/18/18,2018-06-19 00:17:05 UTC,Pacific Time (US & Canada),research,https://www.inaturalist.org/observations/13581403,https://static.inaturalist.org/photos/19974388/medium.jpeg,,1,0,FALSE,"West Shore Trail, Castro Valley, CA 94546, USA",37.72563934,-122.1142273,,,Castro Valley,Alameda,Pale pink-sorrel,Oxalis incarnata,Pale pink-sorrel,Plantae,61776,Oxalidaceae,Oxalis,Oxalis incarnata
13581411,6/18/18,2018-06-19 00:11:08 UTC,Pacific Time (US & Canada),research,https://www.inaturalist.org/observations/13581411,https://static.inaturalist.org/photos/19974402/medium.jpeg,,1,0,FALSE,"West Shore Trail, Castro Valley, CA 94546, USA",37.72295761,-122.1103287,,,Castro Valley,Alameda,Maltese star-thistle,Centaurea melitensis,Maltese star-thistle,Plantae,57922,Asteraceae,Centaurea,Centaurea melitensis
13581413,6/18/18,2018-06-19 00:05:43 UTC,Pacific Time (US & Canada),research,https://www.inaturalist.org/observations/13581413,https://static.inaturalist.org/photos/19974408/medium.jpeg,,1,0,FALSE,"West Shore Trail, Castro Valley, CA 94546, USA",37.72093582,-122.1091537,,,Castro Valley,Alameda,Red Valerian,Centranthus ruber,Red Valerian,Plantae,57283,Caprifoliaceae,Centranthus,Centranthus ruber
13581415,6/18/18,2018-06-19 00:08:28 UTC,Pacific Time (US & Canada),research,https://www.inaturalist.org/observations/13581415,https://static.inaturalist.org/photos/19974418/medium.jpeg,,1,0,FALSE,"West Shore Trail, Castro Valley, CA 94546, USA",37.72273636,-122.1102753,,,Castro Valley,Alameda,poison hemlock,Conium maculatum,poison hemlock,Plantae,52998,Apiaceae,Conium,Conium maculatum
13601324,6/19/18,2018-06-19 17:17:30 UTC,Pacific Time (US & Canada),research,https://www.inaturalist.org/observations/13601324,https://static.inaturalist.org/photos/20010922/medium.jpg,,2,0,FALSE,"Lake Chabot, Castro Valley, CA, US",37.72470833,-122.112175,10,,Castro Valley,Alameda,spotted coralroot,Corallorhiza maculata,spotted coralroot,Plantae,49475,Orchidaceae,Corallorhiza,Corallorhiza maculata
13931549,6/19/18,2018-06-19 21:29:13 UTC,Pacific Time (US & Canada),research,https://www.inaturalist.org/observations/13931549,https://inaturalist-open-data.s3.amazonaws.com/photos/20585878/medium.jpg,,2,0,FALSE,"Anthony Chabot Regional Park, Oakland, CA, US",37.79047618,-122.1379578,5,,,Alameda,Brodiaea elegans elegans,Brodiaea elegans elegans,,Plantae,57127,Asparagaceae,Brodiaea,Brodiaea elegans
13931570,6/19/18,2018-06-19 21:35:02 UTC,Pacific Time (US & Canada),research,https://www.inaturalist.org/observations/13931570,https://inaturalist-open-data.s3.amazonaws.com/photos/20585913/medium.jpg,,2,0,FALSE,"Anthony Chabot Regional Park, Oakland, CA, US",37.79016211,-122.1367145,10,,,Alameda,yerba buena,Clinopodium douglasii,yerba buena,Plantae,53203,Lamiaceae,Clinopodium,Clinopodium douglasii
15690898,6/20/18,2018-06-20 17:00:00 UTC,Pacific Time (US & Canada),research,https://www.inaturalist.org/observations/15690898,https://inaturalist-open-data.s3.amazonaws.com/photos/23417104/medium.jpg,"Lake Chabot, Honker Bay Trail, 062018",1,0,FALSE,"17600 Lake Chabot Rd, Castro Valley, CA 94546, USA",37.7151183,-122.1022667,189,,Castro Valley,Alameda,Sweet scabious,Sixalix atropurpurea,Sweet scabious,Plantae,372376,Caprifoliaceae,Sixalix,Sixalix atropurpurea
15704270,6/20/18,2018-06-20 22:26:00 UTC,Pacific Time (US & Canada),research,https://www.inaturalist.org/observations/15704270,https://inaturalist-open-data.s3.amazonaws.com/photos/23439125/medium.jpg,"Lake Chabot, Honker Bay Trail, Castro Valley, CA",1,0,FALSE,"Alameda County, CA, USA",37.72817816,-122.1037282,244,,,Alameda,tall flatsedge,Cyperus eragrostis,tall flatsedge,Plantae,59055,Cyperaceae,Cyperus,Cyperus eragrostis
15725790,6/20/18,2018-06-20 15:57:00 UTC,Pacific Time (US & Canada),research,https://www.inaturalist.org/observations/15725790,https://inaturalist-open-data.s3.amazonaws.com/photos/23478554/medium.jpg,"Lake Chabot Regional Park, Honkers Bay Trail, Castro Valley, CA",1,0,FALSE,"Alameda County, CA, USA",37.72884782,-122.0981933,31,,,Alameda,water smartweed,Persicaria amphibia,water smartweed,Plantae,78450,Polygonaceae,Persicaria,Persicaria amphibia
15735821,6/20/18,2018-06-20 21:22:00 UTC,Pacific Time (US & Canada),research,https://www.inaturalist.org/observations/15735821,https://inaturalist-open-data.s3.amazonaws.com/photos/23495572/medium.jpg,"Honkers Bay Trail, Lake Chabot Regional Park, Castro Valley, CA",1,0,FALSE,"Alameda County, CA, USA",37.73010365,-122.0961603,61,,,Alameda,Naked Buckwheat,Eriogonum nudum,Naked Buckwheat,Plantae,53046,Polygonaceae,Eriogonum,Eriogonum nudum
13683041,6/22/18,2018-06-22 22:41:17 UTC,Pacific Time (US & Canada),research,https://www.inaturalist.org/observations/13683041,https://static.inaturalist.org/photos/20207192/medium.jpg,,2,0,FALSE,"Lake Chabot, Castro Valley, CA, US",37.71864822,-122.1065911,10,,Castro Valley,Alameda,longroot smartweed,Persicaria amphibia emersa,longroot smartweed,Plantae,553505,Polygonaceae,Persicaria,Persicaria amphibia
13725973,6/23/18,2018-06-23 21:42:32 UTC,Pacific Time (US & Canada),research,https://www.inaturalist.org/observations/13725973,https://static.inaturalist.org/photos/20224876/medium.jpg,,1,0,FALSE,"Anthony Chabot Regional Park, Castro Valley, CA, US",37.7181572,-122.107109,338,,Castro Valley,Alameda,Coyote Mint,Monardella villosa,Coyote Mint,Plantae,52181,Lamiaceae,Monardella,Monardella villosa
13858708,6/27/18,2018-06-28 02:07:40 UTC,Pacific Time (US & Canada),research,https://www.inaturalist.org/observations/13858708,https://inaturalist-open-data.s3.amazonaws.com/photos/20456089/medium.jpg,,1,0,FALSE,"Anthony Chabot Regional Park, Oakland, CA, US",37.74271667,-122.09375,8,,,Alameda,coast tarweed,Madia sativa,coast tarweed,Plantae,53143,Asteraceae,Madia,Madia sativa
13858747,6/27/18,2018-06-28 02:26:13 UTC,Pacific Time (US & Canada),research,https://www.inaturalist.org/observations/13858747,https://inaturalist-open-data.s3.amazonaws.com/photos/20456119/medium.jpg,,1,0,FALSE,"Anthony Chabot Regional Park, Oakland, CA, US",37.74263333,-122.0936805,6,,,Alameda,Yorkshire fog,Holcus lanatus,Yorkshire fog,Plantae,52793,Poaceae,Holcus,Holcus lanatus
13858776,6/27/18,2018-06-28 02:21:12 UTC,Pacific Time (US & Canada),research,https://www.inaturalist.org/observations/13858776,https://inaturalist-open-data.s3.amazonaws.com/photos/20456161/medium.jpg,,1,0,FALSE,"Anthony Chabot Regional Park, Oakland, CA, US",37.742625,-122.09375,6,,,Alameda,California cudweed,Pseudognaphalium californicum,California cudweed,Plantae,53077,Asteraceae,Pseudognaphalium,Pseudognaphalium californicum
13858785,6/27/18,2018-06-28 02:28:47 UTC,Pacific Time (US & Canada),research,https://www.inaturalist.org/observations/13858785,https://inaturalist-open-data.s3.amazonaws.com/photos/20472589/medium.jpg,,1,0,FALSE,"Anthony Chabot Regional Park, Oakland, CA, US",37.74255333,-122.093475,8,,,Alameda,Turkey Mullein,Croton setiger,turkey mullein,Plantae,154156,Euphorbiaceae,Croton,Croton setiger
20131468,7/1/18,2018-07-01 19:48:18 UTC,Pacific Time (US & Canada),research,https://www.inaturalist.org/observations/20131468,https://static.inaturalist.org/photos/31046981/medium.jpg,,2,0,FALSE,"Anthony Chabot Regional Park, Alameda County, US-CA, US",37.76481058,-122.1201679,5,,,Alameda,broad-leaved sweet pea,Lathyrus latifolius,broad-leaved sweet pea,Plantae,61009,Fabaceae,Lathyrus,Lathyrus latifolius
14087597,7/5/18,2018-07-05 21:26:13 UTC,Pacific Time (US & Canada),research,https://www.inaturalist.org/observations/14087597,https://static.inaturalist.org/photos/20858373/medium.jpeg,,1,0,FALSE,"Chabot Park, Oakland, CA, USA",37.73551559,-122.1228714,,,Oakland,Alameda,eggleaf spurge,Euphorbia oblongata,eggleaf spurge,Plantae,77117,Euphorbiaceae,Euphorbia,Euphorbia oblongata
14087599,7/5/18,2018-07-05 20:58:27 UTC,Pacific Time (US & Canada),research,https://www.inaturalist.org/observations/14087599,https://static.inaturalist.org/photos/20858386/medium.jpeg,,2,0,FALSE,"Bass Cove Trail, Oakland, CA 94605, USA",37.73484039,-122.1165161,,,Oakland,Alameda,fringed willowherb,Epilobium ciliatum,fringed willowherb,Plantae,53050,Onagraceae,Epilobium,Epilobium ciliatum
14087601,7/5/18,2018-07-05 20:57:25 UTC,Pacific Time (US & Canada),research,https://www.inaturalist.org/observations/14087601,https://static.inaturalist.org/photos/20858394/medium.jpeg,,1,0,FALSE,"Bass Cove Trail, Oakland, CA 94605, USA",37.73495865,-122.116745,,,Oakland,Alameda,Muehlenberg's Centaury,Zeltnera muehlenbergii,Muehlenberg's Centaury,Plantae,79550,Gentianaceae,Zeltnera,Zeltnera muehlenbergii
14182547,7/8/18,2018-07-08 22:23:56 UTC,Pacific Time (US & Canada),research,https://www.inaturalist.org/observations/14182547,https://static.inaturalist.org/photos/21029671/medium.jpg,,1,0,FALSE,"Anthony Chabot Regional Park, Oakland, CA, US",37.75316565,-122.1157056,10,,,Alameda,broad-leaved helleborine,Epipactis helleborine,Broad-leafed Helleborine,Plantae,50717,Orchidaceae,Epipactis,Epipactis helleborine
14624067,7/22/18,2018-07-22 23:28:09 UTC,Pacific Time (US & Canada),research,https://www.inaturalist.org/observations/14624067,https://static.inaturalist.org/photos/21806423/medium.jpg,,1,0,FALSE,"Anthony Chabot Regional Park, Oakland, CA, US",37.73320591,-122.1214571,10,,Oakland,Alameda,Coyote Mint,Monardella villosa,Coyote Mint,Plantae,52181,Lamiaceae,Monardella,Monardella villosa
14730236,7/25/18,2018-07-25 17:38:42 UTC,Pacific Time (US & Canada),research,https://www.inaturalist.org/observations/14730236,https://inaturalist-open-data.s3.amazonaws.com/photos/21972057/medium.jpg,,1,0,FALSE,"Anthony Chabot Regional Park, Oakland, CA, US",37.758995,-122.1077805,50,,,Alameda,pink everlasting,Pseudognaphalium ramosissimum,pink everlasting,Plantae,53088,Asteraceae,Pseudognaphalium,Pseudognaphalium ramosissimum
14887455,7/28/18,2018-07-29 01:26:58 UTC,Pacific Time (US & Canada),research,https://www.inaturalist.org/observations/14887455,https://static.inaturalist.org/photos/22218652/medium.jpg,,1,0,FALSE,"Anthony Chabot Regional Park, Oakland, CA, US",37.77758077,-122.1249993,72,,,Alameda,Artichoke Thistle,Cynara cardunculus,Artichoke Thistle,Plantae,57563,Asteraceae,Cynara,Cynara cardunculus
14887776,7/28/18,2018-07-29 02:08:41 UTC,Pacific Time (US & Canada),research,https://www.inaturalist.org/observations/14887776,https://static.inaturalist.org/photos/22219238/medium.jpg,,1,0,FALSE,"Anthony Chabot Regional Park, Oakland, CA, US",37.76691152,-122.1102913,568,,,Alameda,Cardre  lainer,Dipsacus sativus,fuller's teasel,Plantae,53028,Caprifoliaceae,Dipsacus,Dipsacus sativus
14887861,7/28/18,2018-07-29 02:09:13 UTC,Pacific Time (US & Canada),research,https://www.inaturalist.org/observations/14887861,https://static.inaturalist.org/photos/22219401/medium.jpg,,1,0,FALSE,"Anthony Chabot Regional Park, Oakland, CA, US",37.77843293,-122.1243573,112,,,Alameda,bull thistle,Cirsium vulgare,Bull Thistle,Plantae,52989,Asteraceae,Cirsium,Cirsium vulgare
14905965,7/29/18,2018-07-29 21:49:54 UTC,Pacific Time (US & Canada),research,https://www.inaturalist.org/observations/14905965,https://static.inaturalist.org/photos/22250166/medium.jpeg,All along Lake Chabot,2,0,FALSE,"Castro Valley, CA, USA",37.72580108,-122.1019393,9,,Castro Valley,Alameda,Pacific poison oak,Toxicodendron diversilobum,Pacific poison oak,Plantae,51080,Anacardiaceae,Toxicodendron,Toxicodendron diversilobum
14936673,7/29/18,2018-07-29 21:44:43 UTC,Pacific Time (US & Canada),research,https://www.inaturalist.org/observations/14936673,https://static.inaturalist.org/photos/22283768/medium.jpg,,1,0,FALSE,"Anthony Chabot Regional Park, Oakland, CA, US",37.79743667,-122.147675,10,,,Alameda,coffeeberry,Frangula californica,coffeeberry,Plantae,53423,Rhamnaceae,Frangula,Frangula californica
14937109,7/29/18,2018-07-29 21:02:39 UTC,Pacific Time (US & Canada),research,https://www.inaturalist.org/observations/14937109,https://static.inaturalist.org/photos/22283984/medium.jpg,,3,0,FALSE,"Anthony Chabot Regional Park, Oakland, CA, US",37.79548333,-122.1483833,30,,,Alameda,blue elder,Sambucus cerulea,blue elder,Plantae,143799,Viburnaceae,Sambucus,Sambucus cerulea
15066905,8/2/18,2018-08-03 01:55:00 UTC,Pacific Time (US & Canada),research,https://www.inaturalist.org/observations/15066905,https://inaturalist-open-data.s3.amazonaws.com/photos/22497606/medium.jpeg,,1,0,FALSE,"Castro Valley, CA, USA",37.72067502,-122.1160556,280,,Castro Valley,Alameda,Sweet scabious,Sixalix atropurpurea,Sweet scabious,Plantae,372376,Caprifoliaceae,Sixalix,Sixalix atropurpurea
15151663,8/5/18,2018-08-05 21:38:46 UTC,Pacific Time (US & Canada),research,https://www.inaturalist.org/observations/15151663,https://inaturalist-open-data.s3.amazonaws.com/photos/22650047/medium.jpg,,1,0,FALSE,"Anthony Chabot Regional Park, Oakland, CA, US",37.79013333,-122.1383833,5,,,Alameda,Turkey Mullein,Croton setiger,turkey mullein,Plantae,154156,Euphorbiaceae,Croton,Croton setiger
15167731,8/6/18,2018-08-06 13:53:18 UTC,Pacific Time (US & Canada),research,https://www.inaturalist.org/observations/15167731,https://static.inaturalist.org/photos/22679869/medium.jpeg,,1,0,FALSE,"Castro Valley, CA, USA",37.7153511,-122.1106491,,,Castro Valley,Alameda,Turkey Mullein,Croton setiger,turkey mullein,Plantae,154156,Euphorbiaceae,Croton,Croton setiger
15204484,8/7/18,2018-08-07 17:45:58 UTC,Pacific Time (US & Canada),research,https://www.inaturalist.org/observations/15204484,https://inaturalist-open-data.s3.amazonaws.com/photos/22744349/medium.jpg,Leaves thick and stiff,1,0,FALSE,"Anthony Chabot Regional Park, Alameda County, US-CA, US",37.79826835,-122.1529252,16,,,Alameda,European holly,Ilex aquifolium,European holly,Plantae,53856,Aquifoliaceae,Ilex,Ilex aquifolium
15204521,8/7/18,2018-08-07 17:51:23 UTC,Pacific Time (US & Canada),research,https://www.inaturalist.org/observations/15204521,https://inaturalist-open-data.s3.amazonaws.com/photos/22744369/medium.jpg,,1,0,FALSE,"Anthony Chabot Regional Park, Alameda County, US-CA, US",37.79803573,-122.1523522,16,,,Alameda,bull thistle,Cirsium vulgare,Bull Thistle,Plantae,52989,Asteraceae,Cirsium,Cirsium vulgare
15204540,8/7/18,2018-08-07 17:55:18 UTC,Pacific Time (US & Canada),research,https://www.inaturalist.org/observations/15204540,https://inaturalist-open-data.s3.amazonaws.com/photos/22744407/medium.jpg,,1,0,FALSE,"Anthony Chabot Regional Park, Alameda County, US-CA, US",37.79814817,-122.1519141,16,,,Alameda,Pacific poison oak,Toxicodendron diversilobum,Pacific poison oak,Plantae,51080,Anacardiaceae,Toxicodendron,Toxicodendron diversilobum
15204593,8/7/18,2018-08-07 18:02:35 UTC,Pacific Time (US & Canada),research,https://www.inaturalist.org/observations/15204593,https://inaturalist-open-data.s3.amazonaws.com/photos/22744477/medium.jpg,,1,0,FALSE,"Anthony Chabot Regional Park, Alameda County, US-CA, US",37.7979728,-122.1515502,16,,,Alameda,greater periwinkle,Vinca major,greater periwinkle,Plantae,53326,Apocynaceae,Vinca,Vinca major
15204597,8/7/18,2018-08-07 18:03:22 UTC,Pacific Time (US & Canada),research,https://www.inaturalist.org/observations/15204597,https://inaturalist-open-data.s3.amazonaws.com/photos/22744483/medium.jpg,,2,0,FALSE,"Anthony Chabot Regional Park, Alameda County, US-CA, US",37.79796388,-122.1511559,16,,,Alameda,Armenian Blackberry,Rubus armeniacus,Armenian Blackberry,Plantae,61317,Rosaceae,Rubus,Rubus armeniacus
15204722,8/7/18,2018-08-07 18:37:01 UTC,Pacific Time (US & Canada),research,https://www.inaturalist.org/observations/15204722,https://inaturalist-open-data.s3.amazonaws.com/photos/22744753/medium.jpg,,1,0,FALSE,"Anthony Chabot Regional Park, Alameda County, US-CA, US",37.79766051,-122.1503795,16,,,Alameda,Stinking chamomile,Anthemis cotula,Stinking chamomile,Plantae,52841,Asteraceae,Anthemis,Anthemis cotula
15451786,8/15/18,2018-08-15 15:45:25 UTC,Mountain Time (US & Canada),research,https://www.inaturalist.org/observations/15451786,https://inaturalist-open-data.s3.amazonaws.com/photos/23180240/medium.jpeg,,2,0,FALSE,"Anthony Chabot Regional Park, Alameda County, US-CA, US",37.72581292,-122.1150383,18,,Castro Valley,Alameda,Pacific poison oak,Toxicodendron diversilobum,Pacific poison oak,Plantae,51080,Anacardiaceae,Toxicodendron,Toxicodendron diversilobum
15451806,8/15/18,2018-08-15 15:47:24 UTC,Mountain Time (US & Canada),research,https://www.inaturalist.org/observations/15451806,https://inaturalist-open-data.s3.amazonaws.com/photos/23180282/medium.jpeg,,2,0,FALSE,"17600 Lake Chabot Rd, Castro Valley, CA 94546, USA",37.7173165,-122.1044283,60,,Castro Valley,Alameda,Pacific poison oak,Toxicodendron diversilobum,Pacific poison oak,Plantae,51080,Anacardiaceae,Toxicodendron,Toxicodendron diversilobum
15930989,8/26/18,2018-08-26 23:28:53 UTC,Pacific Time (US & Canada),research,https://www.inaturalist.org/observations/15930989,https://inaturalist-open-data.s3.amazonaws.com/photos/23833933/medium.jpg,,1,0,FALSE,"Anthony Chabot Regional Park, Castro Valley, CA, US",37.74249167,-122.1129222,24,,,Alameda,feverfew,Tanacetum parthenium,feverfew,Plantae,54520,Asteraceae,Tanacetum,Tanacetum parthenium
16175593,9/3/18,2018-09-03 17:47:47 UTC,Pacific Time (US & Canada),research,https://www.inaturalist.org/observations/16175593,https://static.inaturalist.org/photos/24256478/medium.jpeg,,1,0,FALSE,"Castro Valley, CA, USA",37.71697617,-122.1118393,,,Castro Valley,Alameda,Hayfield Tarweed,Hemizonia congesta,Hayfield Tarweed,Plantae,56960,Asteraceae,Hemizonia,Hemizonia congesta
16187063,9/3/18,2018-09-03 20:04:08 UTC,Pacific Time (US & Canada),research,https://www.inaturalist.org/observations/16187063,https://inaturalist-open-data.s3.amazonaws.com/photos/24277899/medium.jpg,,1,0,FALSE,"Anthony Chabot Regional Park, Oakland, CA, US",37.767355,-122.1194083,10,,,Alameda,liseron des champs,Convolvulus arvensis,field bindweed,Plantae,53021,Convolvulaceae,Convolvulus,Convolvulus arvensis
16471544,9/12/18,2018-09-12 18:36:05 UTC,Pacific Time (US & Canada),research,https://www.inaturalist.org/observations/16471544,https://inaturalist-open-data.s3.amazonaws.com/photos/24787009/medium.jpg,,2,0,FALSE,"Anthony Chabot Regional Park, Castro Valley, CA, US",37.75533432,-122.1121427,709,,,Alameda,Sweet scabious,Sixalix atropurpurea,Sweet scabious,Plantae,372376,Caprifoliaceae,Sixalix,Sixalix atropurpurea
16474778,9/12/18,2018-09-12 23:35:00 UTC,Pacific Time (US & Canada),research,https://www.inaturalist.org/observations/16474778,https://inaturalist-open-data.s3.amazonaws.com/photos/24787543/medium.jpg,,2,0,FALSE,"Castro Valley, CA, USA",37.72276855,-122.1102963,31,,Castro Valley,Alameda,blue elder,Sambucus cerulea,blue elder,Plantae,143799,Viburnaceae,Sambucus,Sambucus cerulea
16474780,9/12/18,2018-09-12 23:35:00 UTC,Pacific Time (US & Canada),research,https://www.inaturalist.org/observations/16474780,https://inaturalist-open-data.s3.amazonaws.com/photos/24787555/medium.jpg,,1,0,FALSE,"Castro Valley, CA, USA",37.72572291,-122.1147966,31,,Castro Valley,Alameda,Red Valerian,Centranthus ruber,Red Valerian,Plantae,57283,Caprifoliaceae,Centranthus,Centranthus ruber
16474783,9/12/18,2018-09-12 23:35:00 UTC,Pacific Time (US & Canada),research,https://www.inaturalist.org/observations/16474783,https://inaturalist-open-data.s3.amazonaws.com/photos/24787567/medium.jpg,,1,0,FALSE,"Castro Valley, CA, USA",37.72635137,-122.1156135,15,,Castro Valley,Alameda,Pink Honeysuckle,Lonicera hispidula,Pink Honeysuckle,Plantae,53416,Caprifoliaceae,Lonicera,Lonicera hispidula
16474784,9/12/18,2018-09-12 23:35:00 UTC,Pacific Time (US & Canada),research,https://www.inaturalist.org/observations/16474784,https://inaturalist-open-data.s3.amazonaws.com/photos/24787571/medium.jpg,,1,0,FALSE,"Oakland, CA, USA",37.73062074,-122.1240207,31,,Oakland,Alameda,Belladonna Lily,Amaryllis belladonna,Belladonna Lily,Plantae,61827,Amaryllidaceae,Amaryllis,Amaryllis belladonna
16474786,9/12/18,2018-09-12 23:35:00 UTC,Pacific Time (US & Canada),research,https://www.inaturalist.org/observations/16474786,https://inaturalist-open-data.s3.amazonaws.com/photos/24787573/medium.jpg,,1,0,FALSE,"Alameda County, CA, USA",37.74740433,-122.1128828,31,,,Alameda,Greater celandine,Chelidonium majus,Greater celandine,Plantae,55757,Papaveraceae,Chelidonium,Chelidonium majus
16475493,9/12/18,2018-09-13 01:32:00 UTC,Pacific Time (US & Canada),research,https://www.inaturalist.org/observations/16475493,https://inaturalist-open-data.s3.amazonaws.com/photos/24793416/medium.jpg,,1,0,FALSE,"Castro Valley, CA, USA",37.72453847,-122.1119012,189,,Castro Valley,Alameda,stinging nettle,Urtica dioica,great stinging nettle,Plantae,51884,Urticaceae,Urtica,Urtica dioica
16475494,9/12/18,2018-09-13 01:32:00 UTC,Pacific Time (US & Canada),research,https://www.inaturalist.org/observations/16475494,https://inaturalist-open-data.s3.amazonaws.com/photos/24793418/medium.jpg,,1,0,FALSE,"Alameda County, CA, USA",37.7475457,-122.1133103,61,,,Alameda,Lemon Balm,Melissa officinalis,lemon balm,Plantae,59901,Lamiaceae,Melissa,Melissa officinalis
16475495,9/12/18,2018-09-13 01:32:00 UTC,Pacific Time (US & Canada),research,https://www.inaturalist.org/observations/16475495,https://inaturalist-open-data.s3.amazonaws.com/photos/24793422/medium.jpg,,1,0,FALSE,"Oakland, CA, USA",37.73368192,-122.1200183,122,,Oakland,Alameda,bristly dogtail grass,Cynosurus echinatus,bristly dogtail grass,Plantae,47695,Poaceae,Cynosurus,Cynosurus echinatus
16475496,9/12/18,2018-09-13 01:32:00 UTC,Pacific Time (US & Canada),research,https://www.inaturalist.org/observations/16475496,https://inaturalist-open-data.s3.amazonaws.com/photos/24793423/medium.jpg,,1,0,FALSE,"Oakland, CA, USA",37.73541042,-122.117134,31,,Oakland,Alameda,Greater Quaking Grass,Briza maxima,Greater Quaking Grass,Plantae,57157,Poaceae,Briza,Briza maxima
16475497,9/12/18,2018-09-13 01:32:00 UTC,Pacific Time (US & Canada),research,https://www.inaturalist.org/observations/16475497,https://inaturalist-open-data.s3.amazonaws.com/photos/24793424/medium.jpg,,1,0,FALSE,"Oakland, CA, USA",37.73611708,-122.1162266,15,,Oakland,Alameda,California fuchsia,Epilobium canum,California fuchsia,Plantae,53051,Onagraceae,Epilobium,Epilobium canum
16475498,9/12/18,2018-09-13 01:32:00 UTC,Pacific Time (US & Canada),research,https://www.inaturalist.org/observations/16475498,https://inaturalist-open-data.s3.amazonaws.com/photos/24793426/medium.jpg,,1,0,FALSE,"Alameda County, CA, USA",37.73179094,-122.110709,61,,,Alameda,Eurabbie,Eucalyptus globulus,Eurabbie,Plantae,53398,Myrtaceae,Eucalyptus,Eucalyptus globulus
16475500,9/12/18,2018-09-13 01:32:00 UTC,Pacific Time (US & Canada),research,https://www.inaturalist.org/observations/16475500,https://inaturalist-open-data.s3.amazonaws.com/photos/24793428/medium.jpg,,1,0,FALSE,"Alameda County, CA, USA",37.72999204,-122.10307,61,,,Alameda,velvety goldenrod,Solidago velutina,velvety goldenrod,Plantae,79155,Asteraceae,Solidago,Solidago velutina
16488072,9/12/18,2018-09-12 15:11:00 UTC,Pacific Time (US & Canada),research,https://www.inaturalist.org/observations/16488072,https://inaturalist-open-data.s3.amazonaws.com/photos/24815424/medium.jpg,,1,0,FALSE,"Alameda County, CA, USA",37.72922262,-122.0978022,15,,,Alameda,coyote brush,Baccharis pilularis,coyote brush,Plantae,53359,Asteraceae,Baccharis,Baccharis pilularis
16488073,9/12/18,2018-09-12 15:11:00 UTC,Pacific Time (US & Canada),research,https://www.inaturalist.org/observations/16488073,https://inaturalist-open-data.s3.amazonaws.com/photos/24815428/medium.jpg,,1,0,FALSE,"Alameda County, CA, USA",37.73081427,-122.0946755,31,,,Alameda,Narrow-leaved clover,Trifolium angustifolium,Narrow-leaved clover,Plantae,69939,Fabaceae,Trifolium,Trifolium angustifolium
16488074,9/12/18,2018-09-12 15:11:00 UTC,Pacific Time (US & Canada),research,https://www.inaturalist.org/observations/16488074,https://inaturalist-open-data.s3.amazonaws.com/photos/24815432/medium.jpg,,1,0,FALSE,"Alameda County, CA, USA",37.72887299,-122.0975469,8,,,Alameda,Sweet scabious,Sixalix atropurpurea,Sweet scabious,Plantae,372376,Caprifoliaceae,Sixalix,Sixalix atropurpurea
16488075,9/12/18,2018-09-12 15:11:00 UTC,Pacific Time (US & Canada),research,https://www.inaturalist.org/observations/16488075,https://inaturalist-open-data.s3.amazonaws.com/photos/24815436/medium.jpg,,1,0,FALSE,"Alameda County, CA, USA",37.72894141,-122.097416,15,,,Alameda,Sweet scabious,Sixalix atropurpurea,Sweet scabious,Plantae,372376,Caprifoliaceae,Sixalix,Sixalix atropurpurea
16488077,9/12/18,2018-09-12 15:11:00 UTC,Pacific Time (US & Canada),research,https://www.inaturalist.org/observations/16488077,https://inaturalist-open-data.s3.amazonaws.com/photos/24815440/medium.jpg,,1,0,FALSE,"Alameda County, CA, USA",37.72878686,-122.0976868,8,,,Alameda,Sweet scabious,Sixalix atropurpurea,Sweet scabious,Plantae,372376,Caprifoliaceae,Sixalix,Sixalix atropurpurea
16488079,9/12/18,2018-09-12 15:11:00 UTC,Pacific Time (US & Canada),research,https://www.inaturalist.org/observations/16488079,https://inaturalist-open-data.s3.amazonaws.com/photos/24815451/medium.jpg,,1,0,FALSE,"Alameda County, CA, USA",37.72933327,-122.0969733,15,,,Alameda,turkey tangle frogfruit,Phyla nodiflora,turkey tangle frogfruit,Plantae,59040,Verbenaceae,Phyla,Phyla nodiflora
16488080,9/12/18,2018-09-12 15:11:00 UTC,Pacific Time (US & Canada),research,https://www.inaturalist.org/observations/16488080,https://inaturalist-open-data.s3.amazonaws.com/photos/24815453/medium.jpg,,1,0,FALSE,"Alameda County, CA, USA",37.72954861,-122.0968079,15,,,Alameda,bull thistle,Cirsium vulgare,Bull Thistle,Plantae,52989,Asteraceae,Cirsium,Cirsium vulgare
16488082,9/12/18,2018-09-12 15:11:00 UTC,Pacific Time (US & Canada),research,https://www.inaturalist.org/observations/16488082,https://inaturalist-open-data.s3.amazonaws.com/photos/24815457/medium.jpg,,1,0,FALSE,"Alameda County, CA, USA",37.73039716,-122.0960461,15,,,Alameda,tall flatsedge,Cyperus eragrostis,tall flatsedge,Plantae,59055,Cyperaceae,Cyperus,Cyperus eragrostis
16488084,9/12/18,2018-09-12 15:11:00 UTC,Pacific Time (US & Canada),research,https://www.inaturalist.org/observations/16488084,https://inaturalist-open-data.s3.amazonaws.com/photos/24815461/medium.jpg,,1,0,FALSE,"Alameda County, CA, USA",37.72982656,-122.0966058,15,,,Alameda,Rosilla,Helenium puberulum,Rosilla,Plantae,53092,Asteraceae,Helenium,Helenium puberulum
16488085,9/12/18,2018-09-12 15:11:00 UTC,Pacific Time (US & Canada),research,https://www.inaturalist.org/observations/16488085,https://inaturalist-open-data.s3.amazonaws.com/photos/24815463/medium.jpg,,1,0,FALSE,"Alameda County, CA, USA",37.73014486,-122.0962659,15,,,Alameda,water smartweed,Persicaria amphibia,water smartweed,Plantae,78450,Polygonaceae,Persicaria,Persicaria amphibia
16488086,9/12/18,2018-09-12 15:11:00 UTC,Pacific Time (US & Canada),research,https://www.inaturalist.org/observations/16488086,https://inaturalist-open-data.s3.amazonaws.com/photos/24815469/medium.jpg,,1,0,FALSE,"Alameda County, CA, USA",37.73090827,-122.0928588,8,,,Alameda,Naked Buckwheat,Eriogonum nudum,Naked Buckwheat,Plantae,53046,Polygonaceae,Eriogonum,Eriogonum nudum
16488087,9/12/18,2018-09-12 15:11:00 UTC,Pacific Time (US & Canada),research,https://www.inaturalist.org/observations/16488087,https://inaturalist-open-data.s3.amazonaws.com/photos/24815471/medium.jpg,,1,0,FALSE,"Alameda County, CA, USA",37.73074402,-122.0921584,31,,,Alameda,Pennyroyal,Mentha pulegium,Pennyroyal,Plantae,57116,Lamiaceae,Mentha,Mentha pulegium
16491005,9/12/18,2018-09-12 16:39:00 UTC,Pacific Time (US & Canada),research,https://www.inaturalist.org/observations/16491005,https://inaturalist-open-data.s3.amazonaws.com/photos/24820738/medium.jpg,,1,0,FALSE,"Alameda County, CA, USA",37.73061369,-122.1022297,31,,,Alameda,common teasel,Dipsacus fullonum,wild teasel,Plantae,56002,Caprifoliaceae,Dipsacus,Dipsacus fullonum
16491006,9/12/18,2018-09-12 16:39:00 UTC,Pacific Time (US & Canada),research,https://www.inaturalist.org/observations/16491006,https://inaturalist-open-data.s3.amazonaws.com/photos/24820743/medium.jpg,,1,0,FALSE,"Alameda County, CA, USA",37.72962109,-122.0929868,31,,,Alameda,Symphoricarpos albus laevigatus,Symphoricarpos albus laevigatus,garden snowberry,Plantae,48525,Caprifoliaceae,Symphoricarpos,Symphoricarpos albus
16491007,9/12/18,2018-09-12 16:39:00 UTC,Pacific Time (US & Canada),research,https://www.inaturalist.org/observations/16491007,https://inaturalist-open-data.s3.amazonaws.com/photos/24820741/medium.jpg,,1,0,FALSE,"Alameda County, CA, USA",37.72818894,-122.0955539,15,,,Alameda,Armenian Blackberry,Rubus armeniacus,Armenian Blackberry,Plantae,61317,Rosaceae,Rubus,Rubus armeniacus
16491011,9/12/18,2018-09-12 16:39:00 UTC,Pacific Time (US & Canada),research,https://www.inaturalist.org/observations/16491011,https://inaturalist-open-data.s3.amazonaws.com/photos/24820746/medium.jpg,,1,0,FALSE,"Castro Valley, CA, USA",37.72758454,-122.0957323,31,,Castro Valley,Alameda,Pacific poison oak,Toxicodendron diversilobum,Pacific poison oak,Plantae,51080,Anacardiaceae,Toxicodendron,Toxicodendron diversilobum
16491012,9/12/18,2018-09-12 16:39:00 UTC,Pacific Time (US & Canada),research,https://www.inaturalist.org/observations/16491012,https://inaturalist-open-data.s3.amazonaws.com/photos/24820749/medium.jpg,,1,0,FALSE,"Castro Valley, CA, USA",37.72405014,-122.1033068,31,,Castro Valley,Alameda,bird's-foot trefoil,Lotus corniculatus,bird's-foot trefoil,Plantae,47435,Fabaceae,Lotus,Lotus corniculatus
16731740,9/20/18,2018-09-20 19:26:54 UTC,Pacific Time (US & Canada),research,https://www.inaturalist.org/observations/16731740,https://static.inaturalist.org/photos/25247179/medium.jpeg,Not sure? ,1,0,FALSE,"Goldenrod Trail, Oakland, CA 94619, USA",37.77484848,-122.1299903,132,,,Alameda,coffeeberry,Frangula californica,coffeeberry,Plantae,53423,Rhamnaceae,Frangula,Frangula californica
16735167,9/20/18,2018-09-20 19:00:18 UTC,Pacific Time (US & Canada),research,https://www.inaturalist.org/observations/16735167,https://inaturalist-open-data.s3.amazonaws.com/photos/25254154/medium.jpg,,1,0,FALSE,"Anthony Chabot Regional Park, Oakland, CA, US",37.79824667,-122.1532055,30,,,Alameda,bigleaf maple,Acer macrophyllum,bigleaf maple,Plantae,48227,Sapindaceae,Acer,Acer macrophyllum
16813616,9/22/18,2018-09-22 23:49:33 UTC,Pacific Time (US & Canada),research,https://www.inaturalist.org/observations/16813616,https://inaturalist-open-data.s3.amazonaws.com/photos/25386298/medium.jpeg,,2,0,FALSE,"Brandon Trail, Castro Valley, CA 94552, USA",37.73525913,-122.0842264,7,,,Alameda,trailing blackberry,Rubus ursinus,trailing blackberry,Plantae,53445,Rosaceae,Rubus,Rubus ursinus
17179589,10/2/18,2018-10-02 18:50:27 UTC,Pacific Time (US & Canada),research,https://www.inaturalist.org/observations/17179589,https://static.inaturalist.org/photos/26035271/medium.jpg,,2,0,FALSE,"Anthony Chabot Regional Park, Castro Valley, CA, US",37.72827833,-122.0880667,10,,,Alameda,Pink Honeysuckle,Lonicera hispidula,Pink Honeysuckle,Plantae,53416,Caprifoliaceae,Lonicera,Lonicera hispidula
17944858,10/29/18,2018-10-29 21:35:15 UTC,Pacific Time (US & Canada),research,https://www.inaturalist.org/observations/17944858,https://static.inaturalist.org/photos/27418069/medium.jpg,,2,0,FALSE,"Anthony Chabot Regional Park, Castro Valley, CA, US",37.71802556,-122.1055364,22,,Castro Valley,Alameda,trailing blackberry,Rubus ursinus,trailing blackberry,Plantae,53445,Rosaceae,Rubus,Rubus ursinus
18138237,11/4/18,2018-11-04 18:50:45 UTC,Pacific Time (US & Canada),research,https://www.inaturalist.org/observations/18138237,https://static.inaturalist.org/photos/27725896/medium.jpg,,2,0,FALSE,"Anthony Chabot Regional Park, Castro Valley, CA, US",37.75761349,-122.1116959,700,,,Alameda,Cardre  lainer,Dipsacus sativus,fuller's teasel,Plantae,53028,Caprifoliaceae,Dipsacus,Dipsacus sativus
18678063,11/27/18,2018-11-27 19:13:47 UTC,Pacific Time (US & Canada),research,https://www.inaturalist.org/observations/18678063,https://static.inaturalist.org/photos/28594042/medium.jpg,,2,0,FALSE,"1352413530 Lake Chabot Rd, Castro Valley, CA, US",37.72953989,-122.1191785,12,,Castro Valley,Alameda,Toyon,Heteromeles arbutifolia,Toyon,Plantae,53405,Rosaceae,Heteromeles,Heteromeles arbutifolia
19001279,12/12/18,2018-12-12 21:34:21 UTC,Pacific Time (US & Canada),research,https://www.inaturalist.org/observations/19001279,https://static.inaturalist.org/photos/29137058/medium.jpg,,1,0,FALSE,"Anthony Chabot Regional Park, Oakland, CA, US",37.75825,-122.1171195,5,,,Alameda,French broom,Genista monspessulana,French broom,Plantae,53403,Fabaceae,Genista,Genista monspessulana
19264266,12/27/18,2018-12-28 00:03:54 UTC,Pacific Time (US & Canada),research,https://www.inaturalist.org/observations/19264266,https://inaturalist-open-data.s3.amazonaws.com/photos/29603442/medium.jpeg,Very fragrant,2,0,FALSE,"Honker Bay Trail, Castro Valley, CA 94552, USA",37.72942768,-122.098348,526,,,Alameda,California sagebrush,Artemisia californica,California sagebrush,Plantae,53357,Asteraceae,Artemisia,Artemisia californica
19339209,12/31/18,2018-12-31 20:34:09 UTC,Pacific Time (US & Canada),research,https://www.inaturalist.org/observations/19339209,https://inaturalist-open-data.s3.amazonaws.com/photos/29735489/medium.jpeg,,1,0,FALSE,"Cottontail Trail, Castro Valley, CA 94552, USA",37.75753021,-122.1108246,,,,Alameda,common yarrow,Achillea millefolium,common yarrow,Plantae,52821,Asteraceae,Achillea,Achillea millefolium
19341685,12/31/18,2018-12-31 22:12:49 UTC,Pacific Time (US & Canada),research,https://www.inaturalist.org/observations/19341685,https://inaturalist-open-data.s3.amazonaws.com/photos/29740693/medium.jpeg,,1,0,FALSE,"Anthony Chabot Regional Park, Alameda County, US-CA, US",37.75296021,-122.1029434,,,,Alameda,Toyon,Heteromeles arbutifolia,Toyon,Plantae,53405,Rosaceae,Heteromeles,Heteromeles arbutifolia
19341748,12/31/18,2018-12-31 23:00:33 UTC,Pacific Time (US & Canada),research,https://www.inaturalist.org/observations/19341748,https://inaturalist-open-data.s3.amazonaws.com/photos/29740896/medium.jpeg,,1,0,FALSE,"11110 Lochard St, Oakland, CA 94605, USA",37.75793839,-122.1042557,,,,Alameda,yerba buena,Clinopodium douglasii,yerba buena,Plantae,53203,Lamiaceae,Clinopodium,Clinopodium douglasii
19342538,12/31/18,2018-12-31 22:45:16 UTC,Pacific Time (US & Canada),research,https://www.inaturalist.org/observations/19342538,https://inaturalist-open-data.s3.amazonaws.com/photos/29742279/medium.jpeg,,1,0,FALSE,"Redwood Rd, Castro Valley, CA 94552, USA",37.75616837,-122.1021423,,,,Alameda,yerba buena,Clinopodium douglasii,yerba buena,Plantae,53203,Lamiaceae,Clinopodium,Clinopodium douglasii
19342871,12/31/18,2018-12-31 22:28:09 UTC,Pacific Time (US & Canada),research,https://www.inaturalist.org/observations/19342871,https://inaturalist-open-data.s3.amazonaws.com/photos/29742916/medium.jpeg,,1,0,FALSE,"Redtail Trail, Castro Valley, CA 94552, USA",37.75501251,-122.1023941,,,,Alameda,coyote brush,Baccharis pilularis,coyote brush,Plantae,53359,Asteraceae,Baccharis,Baccharis pilularis
19342886,12/31/18,2018-12-31 22:26:44 UTC,Pacific Time (US & Canada),research,https://www.inaturalist.org/observations/19342886,https://inaturalist-open-data.s3.amazonaws.com/photos/29742959/medium.jpeg,,1,0,FALSE,"Redtail Trail, Castro Valley, CA 94552, USA",37.75479889,-122.1023178,,,,Alameda,orange bush monkeyflower,Diplacus aurantiacus,orange bush monkeyflower,Plantae,777371,Phrymaceae,Diplacus,Diplacus aurantiacus
19342888,12/31/18,2018-12-31 22:26:22 UTC,Pacific Time (US & Canada),research,https://www.inaturalist.org/observations/19342888,https://inaturalist-open-data.s3.amazonaws.com/photos/29742969/medium.jpeg,,1,0,FALSE,"Redtail Trail, Castro Valley, CA 94552, USA",37.75455093,-122.1022186,,,,Alameda,coffeeberry,Frangula californica,coffeeberry,Plantae,53423,Rhamnaceae,Frangula,Frangula californica
19342891,12/31/18,2018-12-31 22:24:57 UTC,Pacific Time (US & Canada),research,https://www.inaturalist.org/observations/19342891,https://inaturalist-open-data.s3.amazonaws.com/photos/29742977/medium.jpeg,,1,0,FALSE,"Deer Canyon Trail, Castro Valley, CA 94552, USA",37.75287247,-122.1028137,,,,Alameda,Pacific Sanicle,Sanicula crassicaulis,Pacific Sanicle,Plantae,53201,Apiaceae,Sanicula,Sanicula crassicaulis
19343095,12/31/18,2018-12-31 21:36:47 UTC,Pacific Time (US & Canada),research,https://www.inaturalist.org/observations/19343095,https://inaturalist-open-data.s3.amazonaws.com/photos/29743164/medium.jpeg,,1,0,FALSE,"Brandon Trail, Castro Valley, CA 94552, USA",37.75396347,-122.1113739,,,,Alameda,coast live oak,Quercus agrifolia,coast live oak,Plantae,47850,Fagaceae,Quercus,Quercus agrifolia
19343106,12/31/18,2018-12-31 21:27:12 UTC,Pacific Time (US & Canada),research,https://www.inaturalist.org/observations/19343106,https://inaturalist-open-data.s3.amazonaws.com/photos/29743191/medium.jpeg,,1,0,FALSE,"Brandon Trail, Castro Valley, CA 94552, USA",37.75549316,-122.1117325,,,,Alameda,Ocean spray,Holodiscus discolor,Ocean spray,Plantae,53414,Rosaceae,Holodiscus,Holodiscus discolor
19343117,12/31/18,2018-12-31 21:26:56 UTC,Pacific Time (US & Canada),research,https://www.inaturalist.org/observations/19343117,https://inaturalist-open-data.s3.amazonaws.com/photos/29743203/medium.jpeg,,1,0,FALSE,"Brandon Trail, Castro Valley, CA 94552, USA",37.7557373,-122.1119385,,,,Alameda,Toyon,Heteromeles arbutifolia,Toyon,Plantae,53405,Rosaceae,Heteromeles,Heteromeles arbutifolia
19343132,12/31/18,2018-12-31 21:24:01 UTC,Pacific Time (US & Canada),research,https://www.inaturalist.org/observations/19343132,https://inaturalist-open-data.s3.amazonaws.com/photos/29743227/medium.jpeg,,1,0,FALSE,"Brandon Trail, Castro Valley, CA 94552, USA",37.7551384,-122.1117477,,,,Alameda,beaked hazelnut,Corylus cornuta,beaked hazelnut,Plantae,53374,Betulaceae,Corylus,Corylus cornuta
19343139,12/31/18,2018-12-31 21:20:14 UTC,Pacific Time (US & Canada),research,https://www.inaturalist.org/observations/19343139,https://inaturalist-open-data.s3.amazonaws.com/photos/29743247/medium.jpeg,,1,0,FALSE,"Brandon Trail, Castro Valley, CA 94552, USA",37.75540924,-122.1108017,,,,Alameda,California mugwort,Artemisia douglasiana,California mugwort,Plantae,52854,Asteraceae,Artemisia,Artemisia douglasiana
19343165,12/31/18,2018-12-31 21:07:37 UTC,Pacific Time (US & Canada),research,https://www.inaturalist.org/observations/19343165,https://inaturalist-open-data.s3.amazonaws.com/photos/29743258/medium.jpeg,,1,0,FALSE,"Brandon Trail, Castro Valley, CA 94552, USA",37.75590134,-122.1133804,,,,Alameda,Pacific madrone,Arbutus menziesii,Pacific madrone,Plantae,51046,Ericaceae,Arbutus,Arbutus menziesii
19343168,12/31/18,2018-12-31 21:05:40 UTC,Pacific Time (US & Canada),research,https://www.inaturalist.org/observations/19343168,https://inaturalist-open-data.s3.amazonaws.com/photos/29743261/medium.jpeg,,1,0,FALSE,"Brandon Trail, Castro Valley, CA 94552, USA",37.75570297,-122.1138535,,,,Alameda,California sagebrush,Artemisia californica,California sagebrush,Plantae,53357,Asteraceae,Artemisia,Artemisia californica
19343177,12/31/18,2018-12-31 21:08:50 UTC,Pacific Time (US & Canada),research,https://www.inaturalist.org/observations/19343177,https://inaturalist-open-data.s3.amazonaws.com/photos/29743275/medium.jpeg,,1,0,FALSE,"Brandon Trail, Castro Valley, CA 94552, USA",37.75579834,-122.113121,,,,Alameda,Toyon,Heteromeles arbutifolia,Toyon,Plantae,53405,Rosaceae,Heteromeles,Heteromeles arbutifolia
19343183,12/31/18,2018-12-31 21:17:04 UTC,Pacific Time (US & Canada),research,https://www.inaturalist.org/observations/19343183,https://inaturalist-open-data.s3.amazonaws.com/photos/29743284/medium.jpeg,,1,0,FALSE,"Brandon Trail, Castro Valley, CA 94552, USA",37.75571442,-122.1108246,,,,Alameda,tall flatsedge,Cyperus eragrostis,tall flatsedge,Plantae,59055,Cyperaceae,Cyperus,Cyperus eragrostis
19343197,12/31/18,2018-12-31 21:07:07 UTC,Pacific Time (US & Canada),research,https://www.inaturalist.org/observations/19343197,https://inaturalist-open-data.s3.amazonaws.com/photos/29743294/medium.jpeg,,1,0,FALSE,"Brandon Trail, Castro Valley, CA 94552, USA",37.7559166,-122.1135788,,,,Alameda,wavy-leafed soap plant,Chlorogalum pomeridianum,wavy-leafed soap plant,Plantae,47597,Asparagaceae,Chlorogalum,Chlorogalum pomeridianum
19343218,12/31/18,2018-12-31 20:29:20 UTC,Pacific Time (US & Canada),research,https://www.inaturalist.org/observations/19343218,https://inaturalist-open-data.s3.amazonaws.com/photos/29743304/medium.jpeg,,1,0,FALSE,"Cottontail Trail, Castro Valley, CA 94552, USA",37.75960541,-122.1101837,,,,Alameda,Pacific poison oak,Toxicodendron diversilobum,Pacific poison oak,Plantae,51080,Anacardiaceae,Toxicodendron,Toxicodendron diversilobum
19343224,12/31/18,2018-12-31 20:26:15 UTC,Pacific Time (US & Canada),research,https://www.inaturalist.org/observations/19343224,https://inaturalist-open-data.s3.amazonaws.com/photos/29743323/medium.jpeg,,1,0,FALSE,"Cottontail Trail, Castro Valley, CA 94552, USA",37.76026535,-122.1091232,,,,Alameda,California bay,Umbellularia californica,California bay,Plantae,48807,Lauraceae,Umbellularia,Umbellularia californica
19343231,12/31/18,2018-12-31 20:25:58 UTC,Pacific Time (US & Canada),research,https://www.inaturalist.org/observations/19343231,https://inaturalist-open-data.s3.amazonaws.com/photos/29743335/medium.jpeg,,1,0,FALSE,"Cottontail Trail, Castro Valley, CA 94552, USA",37.76059341,-122.1088409,,,,Alameda,ribwort plantain,Plantago lanceolata,ribwort plantain,Plantae,53178,Plantaginaceae,Plantago,Plantago lanceolata
19343238,12/31/18,2018-12-31 20:14:01 UTC,Pacific Time (US & Canada),research,https://www.inaturalist.org/observations/19343238,https://inaturalist-open-data.s3.amazonaws.com/photos/29743344/medium.jpeg,,1,0,FALSE,"Redwood Rd, Castro Valley, CA 94552, USA",37.76088333,-122.1066132,,,,Alameda,Pink Honeysuckle,Lonicera hispidula,Pink Honeysuckle,Plantae,53416,Caprifoliaceae,Lonicera,Lonicera hispidula
19343239,12/31/18,2018-12-31 20:13:53 UTC,Pacific Time (US & Canada),research,https://www.inaturalist.org/observations/19343239,https://inaturalist-open-data.s3.amazonaws.com/photos/29743349/medium.jpeg,,1,0,FALSE,"Cottontail Trail, Castro Valley, CA 94552, USA",37.76080704,-122.1068192,,,,Alameda,Stinking iris,Iris foetidissima,Stinking iris,Plantae,64331,Iridaceae,Iris,Iris foetidissima
19362188,1/1/19,2019-01-01 22:43:55 UTC,Pacific Time (US & Canada),research,https://www.inaturalist.org/observations/19362188,https://static.inaturalist.org/photos/29775585/medium.jpg,,1,0,FALSE,"Anthony Chabot Regional Park, Oakland, CA, US",37.749175,-122.1156833,32,,,Alameda,Tasmanian blackwood,Acacia melanoxylon,blackwood,Plantae,53344,Fabaceae,Acacia,Acacia melanoxylon
19365272,1/1/19,2019-01-01 21:17:00 UTC,Pacific Time (US & Canada),research,https://www.inaturalist.org/observations/19365272,https://inaturalist-open-data.s3.amazonaws.com/photos/29780656/medium.jpg,                               ,1,0,FALSE,"Anthony Chabot Regional Park, Alameda, California, United States",37.79761667,-122.153525,,,,Alameda,Toyon,Heteromeles arbutifolia,Toyon,Plantae,53405,Rosaceae,Heteromeles,Heteromeles arbutifolia
19365274,1/1/19,2019-01-01 21:25:00 UTC,Pacific Time (US & Canada),research,https://www.inaturalist.org/observations/19365274,https://inaturalist-open-data.s3.amazonaws.com/photos/29780667/medium.jpg,                               ,1,0,FALSE,"Anthony Chabot Regional Park, Alameda, California, United States",37.79812,-122.15443,,,,Alameda,wavy-leafed soap plant,Chlorogalum pomeridianum,wavy-leafed soap plant,Plantae,47597,Asparagaceae,Chlorogalum,Chlorogalum pomeridianum
19365314,1/1/19,2019-01-01 21:38:00 UTC,Pacific Time (US & Canada),research,https://www.inaturalist.org/observations/19365314,https://inaturalist-open-data.s3.amazonaws.com/photos/29780721/medium.jpg,                               ,2,0,FALSE,"Anthony Chabot Regional Park, Alameda, California, United States",37.79819,-122.15264,,,,Alameda,European holly,Ilex aquifolium,European holly,Plantae,53856,Aquifoliaceae,Ilex,Ilex aquifolium
20199449,1/13/19,2019-01-13 23:48:12 UTC,Pacific Time (US & Canada),research,https://www.inaturalist.org/observations/20199449,https://static.inaturalist.org/photos/31177296/medium.jpg,,1,0,FALSE,"Anthony Chabot Regional Park, Castro Valley, CA, US",37.75578333,-122.1128612,8,,,Alameda,Cotoneaster pannosus,Cotoneaster pannosus,silverleaf cotoneaster,Plantae,53375,Rosaceae,Cotoneaster,Cotoneaster pannosus
19796026,1/18/19,2019-01-18 17:16:11 UTC,Pacific Time (US & Canada),research,https://www.inaturalist.org/observations/19796026,https://static.inaturalist.org/photos/30510610/medium.jpeg,,2,0,FALSE,"3718 September Ct, Castro Valley, CA 94546, USA",37.71941778,-122.0956671,132,,Castro Valley,Alameda,Cardre  lainer,Dipsacus sativus,fuller's teasel,Plantae,53028,Caprifoliaceae,Dipsacus,Dipsacus sativus
19976672,1/30/19,2019-01-30 22:49:00 UTC,Pacific Time (US & Canada),research,https://www.inaturalist.org/observations/19976672,https://inaturalist-open-data.s3.amazonaws.com/photos/30828038/medium.jpg,,3,0,FALSE,"17600 Lake Chabot Rd, Castro Valley, CA 94546, USA",37.7151183,-122.1022667,189,,Castro Valley,Alameda,Stinking iris,Iris foetidissima,Stinking iris,Plantae,64331,Iridaceae,Iris,Iris foetidissima
19977378,1/30/19,2019-01-30 20:54:10 UTC,Pacific Time (US & Canada),research,https://www.inaturalist.org/observations/19977378,https://inaturalist-open-data.s3.amazonaws.com/photos/30830079/medium.jpeg,,1,0,FALSE,"Bass Cove Trail, Oakland, CA 94605, USA",37.7374649,-122.1161804,,,Oakland,Alameda,Pacific Sanicle,Sanicula crassicaulis,Pacific Sanicle,Plantae,53201,Apiaceae,Sanicula,Sanicula crassicaulis
20145217,2/5/19,2019-02-06 02:02:00 UTC,Pacific Time (US & Canada),research,https://www.inaturalist.org/observations/20145217,https://inaturalist-open-data.s3.amazonaws.com/photos/31068511/medium.jpg,,2,0,FALSE,"17600 Lake Chabot Rd, Castro Valley, CA 94546, USA",37.7151183,-122.1022667,189,,Castro Valley,Alameda,star-flowered lily-of-the-valley,Maianthemum stellatum,star-flowered lily-of-the-valley,Plantae,53268,Asparagaceae,Maianthemum,Maianthemum stellatum
20145237,2/5/19,2019-02-06 02:02:00 UTC,Pacific Time (US & Canada),research,https://www.inaturalist.org/observations/20145237,https://inaturalist-open-data.s3.amazonaws.com/photos/31068634/medium.jpg,,1,0,FALSE,"17600 Lake Chabot Rd, Castro Valley, CA 94546, USA",37.7151183,-122.1022667,189,,Castro Valley,Alameda,California bee plant,Scrophularia californica,California beeplant,Plantae,50812,Scrophulariaceae,Scrophularia,Scrophularia californica
20145238,2/5/19,2019-02-06 02:02:00 UTC,Pacific Time (US & Canada),research,https://www.inaturalist.org/observations/20145238,https://inaturalist-open-data.s3.amazonaws.com/photos/31068644/medium.jpg,,1,0,FALSE,"17600 Lake Chabot Rd, Castro Valley, CA 94546, USA",37.7151183,-122.1022667,189,,Castro Valley,Alameda,greater periwinkle,Vinca major,greater periwinkle,Plantae,53326,Apocynaceae,Vinca,Vinca major
20145239,2/5/19,2019-02-06 02:02:00 UTC,Pacific Time (US & Canada),research,https://www.inaturalist.org/observations/20145239,https://inaturalist-open-data.s3.amazonaws.com/photos/31068647/medium.jpg,,1,0,FALSE,"17600 Lake Chabot Rd, Castro Valley, CA 94546, USA",37.7151183,-122.1022667,189,,Castro Valley,Alameda,poison hemlock,Conium maculatum,poison hemlock,Plantae,52998,Apiaceae,Conium,Conium maculatum
20145242,2/5/19,2019-02-06 02:02:00 UTC,Pacific Time (US & Canada),research,https://www.inaturalist.org/observations/20145242,https://inaturalist-open-data.s3.amazonaws.com/photos/31068656/medium.jpg,,1,0,FALSE,"17600 Lake Chabot Rd, Castro Valley, CA 94546, USA",37.7151183,-122.1022667,189,,Castro Valley,Alameda,Sun Cup,Taraxia ovata,Sun Cup,Plantae,68182,Onagraceae,Taraxia,Taraxia ovata
20145257,2/5/19,2019-02-06 02:02:00 UTC,Pacific Time (US & Canada),research,https://www.inaturalist.org/observations/20145257,https://inaturalist-open-data.s3.amazonaws.com/photos/31068726/medium.jpg,,1,0,FALSE,"17600 Lake Chabot Rd, Castro Valley, CA 94546, USA",37.7151183,-122.1022667,189,,Castro Valley,Alameda,common cowparsnip,Heracleum maximum,common cowparsnip,Plantae,53094,Apiaceae,Heracleum,Heracleum maximum
20241086,2/9/19,2019-02-09 22:57:00 UTC,Pacific Time (US & Canada),research,https://www.inaturalist.org/observations/20241086,https://inaturalist-open-data.s3.amazonaws.com/photos/31237772/medium.jpg,,1,0,FALSE,"17600 Lake Chabot Rd, Castro Valley, CA 94546, USA",37.7151183,-122.1022667,189,,Castro Valley,Alameda,Stinking iris,Iris foetidissima,Stinking iris,Plantae,64331,Iridaceae,Iris,Iris foetidissima
20241087,2/9/19,2019-02-09 22:57:00 UTC,Pacific Time (US & Canada),research,https://www.inaturalist.org/observations/20241087,https://inaturalist-open-data.s3.amazonaws.com/photos/31237774/medium.jpg,,1,0,FALSE,"17600 Lake Chabot Rd, Castro Valley, CA 94546, USA",37.7151183,-122.1022667,189,,Castro Valley,Alameda,blue elder,Sambucus cerulea,blue elder,Plantae,143799,Viburnaceae,Sambucus,Sambucus cerulea
20241089,2/9/19,2019-02-09 22:57:00 UTC,Pacific Time (US & Canada),research,https://www.inaturalist.org/observations/20241089,https://inaturalist-open-data.s3.amazonaws.com/photos/31237785/medium.jpg,,2,0,FALSE,"17600 Lake Chabot Rd, Castro Valley, CA 94546, USA",37.7151183,-122.1022667,189,,Castro Valley,Alameda,star-flowered lily-of-the-valley,Maianthemum stellatum,star-flowered lily-of-the-valley,Plantae,53268,Asparagaceae,Maianthemum,Maianthemum stellatum
20241097,2/9/19,2019-02-09 22:57:00 UTC,Pacific Time (US & Canada),research,https://www.inaturalist.org/observations/20241097,https://inaturalist-open-data.s3.amazonaws.com/photos/31237837/medium.jpg,,1,0,FALSE,"17600 Lake Chabot Rd, Castro Valley, CA 94546, USA",37.7151183,-122.1022667,189,,Castro Valley,Alameda,California buckeye,Aesculus californica,California buckeye,Plantae,53348,Sapindaceae,Aesculus,Aesculus californica
20241132,2/9/19,2019-02-09 18:46:00 UTC,Pacific Time (US & Canada),research,https://www.inaturalist.org/observations/20241132,https://inaturalist-open-data.s3.amazonaws.com/photos/31239941/medium.jpg,,1,0,FALSE,"Anthony Chabot Regional Park, Alameda County, CA, USA",37.75833056,-122.1165694,,,,Alameda,Pacific ninebark,Physocarpus capitatus,Pacific ninebark,Plantae,57249,Rosaceae,Physocarpus,Physocarpus capitatus
20241133,2/9/19,2019-02-09 18:49:00 UTC,Pacific Time (US & Canada),research,https://www.inaturalist.org/observations/20241133,https://inaturalist-open-data.s3.amazonaws.com/photos/31239947/medium.jpg,,1,0,FALSE,"Anthony Chabot Regional Park, Alameda County, CA, USA",37.75778889,-122.1162167,,,,Alameda,Pholistoma auritum auritum,Pholistoma auritum auritum,,Plantae,58926,Boraginaceae,Pholistoma,Pholistoma auritum
20241136,2/9/19,2019-02-09 19:18:00 UTC,Pacific Time (US & Canada),research,https://www.inaturalist.org/observations/20241136,https://inaturalist-open-data.s3.amazonaws.com/photos/31239967/medium.jpg,,1,0,FALSE,"Anthony Chabot Regional Park, Alameda County, CA, USA",37.75106111,-122.1142028,,,,Alameda,arroyo lupine,Lupinus succulentus,arroyo lupine,Plantae,56759,Fabaceae,Lupinus,Lupinus succulentus
20241138,2/9/19,2019-02-09 19:26:00 UTC,Pacific Time (US & Canada),research,https://www.inaturalist.org/observations/20241138,https://inaturalist-open-data.s3.amazonaws.com/photos/31239996/medium.jpg,,2,0,FALSE,"Anthony Chabot Regional Park, Alameda County, CA, USA",37.74945556,-122.1137778,,,,Alameda,Pacific hound's tongue,Adelinia grande,Pacific hound's tongue,Plantae,769151,Boraginaceae,Adelinia,Adelinia grande
20241139,2/9/19,2019-02-09 19:34:00 UTC,Pacific Time (US & Canada),research,https://www.inaturalist.org/observations/20241139,https://inaturalist-open-data.s3.amazonaws.com/photos/31240004/medium.jpg,,2,0,FALSE,"Anthony Chabot Regional Park, Alameda County, CA, USA",37.74651389,-122.1126694,,,,Alameda,California bay,Umbellularia californica,California bay,Plantae,48807,Lauraceae,Umbellularia,Umbellularia californica
20241140,2/9/19,2019-02-09 19:38:00 UTC,Pacific Time (US & Canada),research,https://www.inaturalist.org/observations/20241140,https://inaturalist-open-data.s3.amazonaws.com/photos/31240012/medium.jpg,,1,0,FALSE,"Anthony Chabot Regional Park, Alameda County, CA, USA",37.74586667,-122.1129472,,,,Alameda,giant wakerobin,Trillium chloropetalum,giant wakerobin,Plantae,50823,Melanthiaceae,Trillium,Trillium chloropetalum
20241148,2/9/19,2019-02-09 20:40:00 UTC,Pacific Time (US & Canada),research,https://www.inaturalist.org/observations/20241148,https://inaturalist-open-data.s3.amazonaws.com/photos/31240078/medium.jpg,,1,0,FALSE,"Anthony Chabot Regional Park, Alameda County, CA, USA",37.744575,-122.1051611,,,,Alameda,hillside gooseberry,Ribes californicum,hillside gooseberry,Plantae,47129,Grossulariaceae,Ribes,Ribes californicum
20241150,2/9/19,2019-02-09 20:45:00 UTC,Pacific Time (US & Canada),research,https://www.inaturalist.org/observations/20241150,https://inaturalist-open-data.s3.amazonaws.com/photos/31240082/medium.jpg,,1,0,FALSE,"Anthony Chabot Regional Park, Alameda County, CA, USA",37.74656944,-122.1032111,,,,Alameda,Fremont's Deathcamas,Toxicoscordion fremontii,Common star lily,Plantae,49649,Melanthiaceae,Toxicoscordion,Toxicoscordion fremontii
20247631,2/9/19,2019-02-09 19:32:54 UTC,Pacific Time (US & Canada),research,https://www.inaturalist.org/observations/20247631,https://inaturalist-open-data.s3.amazonaws.com/photos/31252115/medium.jpg,,2,0,FALSE,"Anthony Chabot Regional Park, Castro Valley, CA, US",37.72953333,-122.0927722,16,,,Alameda,star-flowered lily-of-the-valley,Maianthemum stellatum,star-flowered lily-of-the-valley,Plantae,53268,Asparagaceae,Maianthemum,Maianthemum stellatum
20274060,2/9/19,2019-02-09 19:10:00 UTC,Pacific Time (US & Canada),research,https://www.inaturalist.org/observations/20274060,https://inaturalist-open-data.s3.amazonaws.com/photos/31295940/medium.jpg,,1,0,FALSE,"Anthony Chabot Regional Park, Alameda County, CA, USA",37.75310167,-122.115805,,,,Alameda,Osoberry,Oemleria cerasiformis,Osoberry,Plantae,53419,Rosaceae,Oemleria,Oemleria cerasiformis
20266510,2/10/19,2019-02-10 22:55:21 UTC,Pacific Time (US & Canada),research,https://www.inaturalist.org/observations/20266510,https://inaturalist-open-data.s3.amazonaws.com/photos/31282819/medium.jpeg,,1,0,FALSE,"12740 Brookpark Rd, Oakland, CA 94619, USA",37.79603195,-122.1517181,,,Oakland,Alameda,yerba buena,Clinopodium douglasii,yerba buena,Plantae,53203,Lamiaceae,Clinopodium,Clinopodium douglasii
20267400,2/10/19,2019-02-10 22:00:03 UTC,Pacific Time (US & Canada),research,https://www.inaturalist.org/observations/20267400,https://inaturalist-open-data.s3.amazonaws.com/photos/31284319/medium.jpeg,,1,0,FALSE,"MacDonald Trail, Oakland, CA 94619, USA",37.79305649,-122.1423645,,,,Alameda,coffeeberry,Frangula californica,coffeeberry,Plantae,53423,Rhamnaceae,Frangula,Frangula californica
20267612,2/10/19,2019-02-10 21:54:23 UTC,Pacific Time (US & Canada),research,https://www.inaturalist.org/observations/20267612,https://inaturalist-open-data.s3.amazonaws.com/photos/31284747/medium.jpeg,,1,0,FALSE,"5199 Parkridge Dr, Oakland, CA 94619, USA",37.79202271,-122.1424942,,,,Alameda,wavy-leafed soap plant,Chlorogalum pomeridianum,wavy-leafed soap plant,Plantae,47597,Asparagaceae,Chlorogalum,Chlorogalum pomeridianum
20267719,2/10/19,2019-02-10 21:57:17 UTC,Pacific Time (US & Canada),research,https://www.inaturalist.org/observations/20267719,https://inaturalist-open-data.s3.amazonaws.com/photos/31284927/medium.jpeg,,1,0,FALSE,"MacDonald Trail, Oakland, CA 94619, USA",37.79238892,-122.1424484,,,,Alameda,common cowparsnip,Heracleum maximum,common cowparsnip,Plantae,53094,Apiaceae,Heracleum,Heracleum maximum
20267753,2/10/19,2019-02-10 21:59:11 UTC,Pacific Time (US & Canada),research,https://www.inaturalist.org/observations/20267753,https://inaturalist-open-data.s3.amazonaws.com/photos/31284991/medium.jpeg,,1,0,FALSE,"MacDonald Trail, Oakland, CA 94619, USA",37.79294586,-122.1423416,,,,Alameda,coffeeberry,Frangula californica,coffeeberry,Plantae,53423,Rhamnaceae,Frangula,Frangula californica
20267759,2/10/19,2019-02-10 21:59:38 UTC,Pacific Time (US & Canada),research,https://www.inaturalist.org/observations/20267759,https://inaturalist-open-data.s3.amazonaws.com/photos/31284997/medium.jpeg,,1,0,FALSE,"MacDonald Trail, Oakland, CA 94619, USA",37.79302597,-122.1423569,,,,Alameda,California bay,Umbellularia californica,California bay,Plantae,48807,Lauraceae,Umbellularia,Umbellularia californica
20267797,2/10/19,2019-02-10 21:59:45 UTC,Pacific Time (US & Canada),research,https://www.inaturalist.org/observations/20267797,https://inaturalist-open-data.s3.amazonaws.com/photos/31285064/medium.png,,1,0,FALSE,"MacDonald Trail, Oakland, CA 94619, USA",37.79302597,-122.1423569,,,,Alameda,coffeeberry,Frangula californica,coffeeberry,Plantae,53423,Rhamnaceae,Frangula,Frangula californica
20474617,2/18/19,2019-02-18 22:34:42 UTC,Pacific Time (US & Canada),research,https://www.inaturalist.org/observations/20474617,https://inaturalist-open-data.s3.amazonaws.com/photos/31606615/medium.jpg,,2,0,FALSE,"Anthony Chabot Regional Park, Castro Valley, CA, US",37.75471121,-122.1156747,197,,,Alameda,Pacific hound's tongue,Adelinia grande,Pacific hound's tongue,Plantae,769151,Boraginaceae,Adelinia,Adelinia grande
20731339,2/23/19,2019-02-23 21:44:17 UTC,Pacific Time (US & Canada),research,https://www.inaturalist.org/observations/20731339,https://static.inaturalist.org/photos/31963554/medium.jpeg,,3,0,FALSE,"Redtail Trail, Castro Valley, CA 94552, USA",37.76409531,-122.1138306,,,,Alameda,Wild strawberry,Fragaria vesca,woodland strawberry,Plantae,50298,Rosaceae,Fragaria,Fragaria vesca
20731382,2/23/19,2019-02-23 20:30:11 UTC,Pacific Time (US & Canada),research,https://www.inaturalist.org/observations/20731382,https://static.inaturalist.org/photos/31963582/medium.jpeg,,2,0,FALSE,"519 Redwood Rd, Castro Valley, CA 94552, USA",37.77080917,-122.1144104,,,,Alameda,Pacific madrone,Arbutus menziesii,Pacific madrone,Plantae,51046,Ericaceae,Arbutus,Arbutus menziesii
21219001,3/1/19,2019-03-01 22:32:19 UTC,Pacific Time (US & Canada),research,https://www.inaturalist.org/observations/21219001,https://inaturalist-open-data.s3.amazonaws.com/photos/32800101/medium.jpg,,1,0,FALSE,"Anthony Chabot Regional Park, Oakland, CA, US",37.79015553,-122.1373108,12,,,Alameda,common chickweed,Stellaria media,common chickweed,Plantae,53298,Caryophyllaceae,Stellaria,Stellaria media
20947995,3/3/19,2019-03-04 00:47:40 UTC,Pacific Time (US & Canada),research,https://www.inaturalist.org/observations/20947995,https://inaturalist-open-data.s3.amazonaws.com/photos/32338686/medium.jpeg,,2,0,FALSE,"MacDonald Trail, Oakland, CA 94619, USA",37.79555511,-122.1483307,,,,Alameda,giant wakerobin,Trillium chloropetalum,giant wakerobin,Plantae,50823,Melanthiaceae,Trillium,Trillium chloropetalum
20948007,3/3/19,2019-03-04 00:46:13 UTC,Pacific Time (US & Canada),research,https://www.inaturalist.org/observations/20948007,https://inaturalist-open-data.s3.amazonaws.com/photos/32338721/medium.jpeg,,2,0,FALSE,"MacDonald Trail, Oakland, CA 94619, USA",37.79555511,-122.148613,,,,Alameda,giant wakerobin,Trillium chloropetalum,giant wakerobin,Plantae,50823,Melanthiaceae,Trillium,Trillium chloropetalum
20953199,3/3/19,2019-03-04 00:51:57 UTC,Pacific Time (US & Canada),research,https://www.inaturalist.org/observations/20953199,https://inaturalist-open-data.s3.amazonaws.com/photos/32347921/medium.jpeg,,1,0,FALSE,"MacDonald Trail, Oakland, CA 94619, USA",37.79583359,-122.148056,,,,Alameda,Osoberry,Oemleria cerasiformis,Osoberry,Plantae,53419,Rosaceae,Oemleria,Oemleria cerasiformis
20953222,3/3/19,2019-03-04 00:46:13 UTC,Pacific Time (US & Canada),research,https://www.inaturalist.org/observations/20953222,https://inaturalist-open-data.s3.amazonaws.com/photos/32347980/medium.jpeg,,2,0,FALSE,"MacDonald Trail, Oakland, CA 94619, USA",37.79555511,-122.148613,,,,Alameda,giant wakerobin,Trillium chloropetalum,giant wakerobin,Plantae,50823,Melanthiaceae,Trillium,Trillium chloropetalum
20953280,3/3/19,2019-03-04 00:42:18 UTC,Pacific Time (US & Canada),research,https://www.inaturalist.org/observations/20953280,https://inaturalist-open-data.s3.amazonaws.com/photos/32348045/medium.jpeg,,1,0,FALSE,"MacDonald Trail, Oakland, CA 94619, USA",37.79583359,-122.1488876,,,,Alameda,broadleaf forget-me-not,Myosotis latifolia,broadleaf forget-me-not,Plantae,49132,Boraginaceae,Myosotis,Myosotis latifolia
20953380,3/3/19,2019-03-04 00:36:49 UTC,Pacific Time (US & Canada),research,https://www.inaturalist.org/observations/20953380,https://inaturalist-open-data.s3.amazonaws.com/photos/32348288/medium.jpeg,,1,0,FALSE,"MacDonald Gate Staging Area, MacDonald Trail, Oakland, CA 94619, USA",37.79666519,-122.1497192,,,,Alameda,Osoberry,Oemleria cerasiformis,Osoberry,Plantae,53419,Rosaceae,Oemleria,Oemleria cerasiformis
20953473,3/3/19,2019-03-04 00:33:58 UTC,Pacific Time (US & Canada),research,https://www.inaturalist.org/observations/20953473,https://inaturalist-open-data.s3.amazonaws.com/photos/32348488/medium.jpeg,,2,0,FALSE,"MacDonald Gate Staging Area, MacDonald Trail, Oakland, CA 94619, USA",37.79666519,-122.1500015,,,,Alameda,Western Leatherwood,Dirca occidentalis,Western Leatherwood,Plantae,50315,Thymelaeaceae,Dirca,Dirca occidentalis
21219046,3/5/19,2019-03-05 23:52:25 UTC,Pacific Time (US & Canada),research,https://www.inaturalist.org/observations/21219046,https://inaturalist-open-data.s3.amazonaws.com/photos/32800184/medium.jpg,,2,0,FALSE,"Anthony Chabot Regional Park, Castro Valley, CA, US",37.72536197,-122.1141785,8,,Castro Valley,Alameda,Pacific hound's tongue,Adelinia grande,Pacific hound's tongue,Plantae,769151,Boraginaceae,Adelinia,Adelinia grande
21096076,3/9/19,2019-03-10 00:04:42 UTC,Pacific Time (US & Canada),research,https://www.inaturalist.org/observations/21096076,https://inaturalist-open-data.s3.amazonaws.com/photos/32601878/medium.jpg,,1,0,FALSE,"Anthony Chabot Regional Park, Castro Valley, CA, US",37.71667824,-122.104344,6,,Castro Valley,Alameda,common daisy,Bellis perennis,common daisy,Plantae,55563,Asteraceae,Bellis,Bellis perennis
21164563,3/9/19,2019-03-09 19:24:40 UTC,Pacific Time (US & Canada),research,https://www.inaturalist.org/observations/21164563,https://static.inaturalist.org/photos/32713193/medium.jpeg,,1,0,FALSE,"Honker Bay Trail, Castro Valley, CA 94552, USA",37.72624588,-122.1019287,,,Castro Valley,Alameda,Fremont's Deathcamas,Toxicoscordion fremontii,Common star lily,Plantae,49649,Melanthiaceae,Toxicoscordion,Toxicoscordion fremontii
21217111,3/13/19,2019-03-13 20:44:29 UTC,Pacific Time (US & Canada),research,https://www.inaturalist.org/observations/21217111,https://static.inaturalist.org/photos/32796699/medium.jpeg,,2,0,FALSE,"Brandon Trail, Castro Valley, CA 94552, USA",37.73255539,-122.0846786,,,,Alameda,Pacific hound's tongue,Adelinia grande,Pacific hound's tongue,Plantae,769151,Boraginaceae,Adelinia,Adelinia grande
21217714,3/13/19,2019-03-13 18:45:32 UTC,Pacific Time (US & Canada),research,https://www.inaturalist.org/observations/21217714,https://static.inaturalist.org/photos/32797661/medium.jpg,,2,0,FALSE,"Anthony Chabot Regional Park, Oakland, CA, US",37.78531862,-122.1299007,467,,,Alameda,Sun Cup,Taraxia ovata,Sun Cup,Plantae,68182,Onagraceae,Taraxia,Taraxia ovata
22734772,3/18/19,2019-03-19 01:49:59 UTC,Pacific Time (US & Canada),research,https://www.inaturalist.org/observations/22734772,https://inaturalist-open-data.s3.amazonaws.com/photos/35231840/medium.jpeg,Redwood forest. Riparian.,1,0,FALSE,"MacDonald Gate Staging Area, MacDonald Trail, Oakland, CA 94619, USA",37.79797761,-122.150588,66,,,Alameda,Osoberry,Oemleria cerasiformis,Osoberry,Plantae,53419,Rosaceae,Oemleria,Oemleria cerasiformis
21482672,3/19/19,2019-03-19 23:34:34 UTC,Pacific Time (US & Canada),research,https://www.inaturalist.org/observations/21482672,https://inaturalist-open-data.s3.amazonaws.com/photos/33242232/medium.jpg,,1,0,FALSE,"Anthony Chabot Regional Park, Oakland, CA, US",37.7882796,-122.1350971,16,,,Alameda,Sun Cup,Taraxia ovata,Sun Cup,Plantae,68182,Onagraceae,Taraxia,Taraxia ovata
21435201,3/20/19,2019-03-20 22:43:27 UTC,Pacific Time (US & Canada),research,https://www.inaturalist.org/observations/21435201,https://static.inaturalist.org/photos/33163379/medium.jpeg,,1,0,FALSE,"17500 Lake Chabot Rd, Castro Valley, CA 94546, USA",37.72021103,-122.1141281,,,Castro Valley,Alameda,Purple Sanicle,Sanicula bipinnatifida,Purple Sanicle,Plantae,56840,Apiaceae,Sanicula,Sanicula bipinnatifida
21436571,3/20/19,2019-03-20 22:36:51 UTC,Pacific Time (US & Canada),research,https://www.inaturalist.org/observations/21436571,https://static.inaturalist.org/photos/33165739/medium.jpeg,,1,0,FALSE,"17500 Lake Chabot Rd, Castro Valley, CA 94546, USA",37.71923065,-122.1116943,,,Castro Valley,Alameda,Sisyrinchium bellum,Sisyrinchium bellum,western blue-eyed grass,Plantae,49918,Iridaceae,Sisyrinchium,Sisyrinchium bellum
21437582,3/20/19,2019-03-20 22:39:29 UTC,Pacific Time (US & Canada),research,https://www.inaturalist.org/observations/21437582,https://static.inaturalist.org/photos/33167422/medium.jpeg,,2,0,FALSE,"17500 Lake Chabot Rd, Castro Valley, CA 94546, USA",37.72030258,-122.1121216,,,Castro Valley,Alameda,Mediterranean Stork's-bill,Erodium botrys,Mediterranean Stork's-bill,Plantae,57090,Geraniaceae,Erodium,Erodium botrys
21443126,3/20/19,2019-03-20 20:20:38 UTC,Pacific Time (US & Canada),research,https://www.inaturalist.org/observations/21443126,https://static.inaturalist.org/photos/33176266/medium.jpg,,1,0,FALSE,"Anthony Chabot Regional Park, Castro Valley, CA, US",37.72759167,-122.116525,5,,,Alameda,giant wakerobin,Trillium chloropetalum,giant wakerobin,Plantae,50823,Melanthiaceae,Trillium,Trillium chloropetalum
21534358,3/23/19,2019-03-23 22:50:09 UTC,Pacific Time (US & Canada),research,https://www.inaturalist.org/observations/21534358,https://inaturalist-open-data.s3.amazonaws.com/photos/33325671/medium.jpg,,1,0,FALSE,"Anthony Chabot Regional Park, Oakland, CA, US",37.77843667,-122.1267695,5,,,Alameda,Sun Cup,Taraxia ovata,Sun Cup,Plantae,68182,Onagraceae,Taraxia,Taraxia ovata
21534380,3/23/19,2019-03-23 22:26:43 UTC,Pacific Time (US & Canada),research,https://www.inaturalist.org/observations/21534380,https://inaturalist-open-data.s3.amazonaws.com/photos/33325694/medium.jpg,,2,0,FALSE,"Anthony Chabot Regional Park, Oakland, CA, US",37.768275,-122.1214445,5,,,Alameda,twinberry honeysuckle,Lonicera involucrata,twinberry honeysuckle,Plantae,60881,Caprifoliaceae,Lonicera,Lonicera involucrata
21534399,3/23/19,2019-03-23 22:21:56 UTC,Pacific Time (US & Canada),research,https://www.inaturalist.org/observations/21534399,https://inaturalist-open-data.s3.amazonaws.com/photos/33325717/medium.jpg,,1,0,FALSE,"Anthony Chabot Regional Park, Oakland, CA, US",37.76578667,-122.1204445,10,,,Alameda,beaked hazelnut,Corylus cornuta,beaked hazelnut,Plantae,53374,Betulaceae,Corylus,Corylus cornuta
21534434,3/23/19,2019-03-23 21:59:03 UTC,Pacific Time (US & Canada),research,https://www.inaturalist.org/observations/21534434,https://inaturalist-open-data.s3.amazonaws.com/photos/33325750/medium.jpg,,1,0,FALSE,"Anthony Chabot Regional Park, Oakland, CA, US",37.76216167,-122.1177528,5,,,Alameda,miner's lettuce,Claytonia perfoliata,miner's lettuce,Plantae,52994,Montiaceae,Claytonia,Claytonia perfoliata
21534454,3/23/19,2019-03-23 21:21:10 UTC,Pacific Time (US & Canada),research,https://www.inaturalist.org/observations/21534454,https://inaturalist-open-data.s3.amazonaws.com/photos/33325780/medium.jpg,,1,0,FALSE,"Anthony Chabot Regional Park, Oakland, CA, US",37.77823667,-122.1257862,5,,,Alameda,California manroot,Marah fabacea,California manroot,Plantae,205330,Cucurbitaceae,Marah,Marah fabacea
21536646,3/23/19,2019-03-23 21:41:18 UTC,Pacific Time (US & Canada),research,https://www.inaturalist.org/observations/21536646,https://static.inaturalist.org/photos/33329463/medium.jpeg,,1,0,FALSE,"Columbine Trail, Oakland, CA 94605, USA",37.74879456,-122.1135483,,,,Alameda,giant wakerobin,Trillium chloropetalum,giant wakerobin,Plantae,50823,Melanthiaceae,Trillium,Trillium chloropetalum
21536670,3/23/19,2019-03-23 21:39:13 UTC,Pacific Time (US & Canada),research,https://www.inaturalist.org/observations/21536670,https://static.inaturalist.org/photos/33329546/medium.jpeg,,1,0,FALSE,"Brandon Trail, Castro Valley, CA 94552, USA",37.75533295,-122.1109009,,,,Alameda,Hooker's fairybells,Prosartes hookeri,Hooker's fairybells,Plantae,51071,Liliaceae,Prosartes,Prosartes hookeri
21536720,3/23/19,2019-03-23 21:38:33 UTC,Pacific Time (US & Canada),research,https://www.inaturalist.org/observations/21536720,https://static.inaturalist.org/photos/33329701/medium.jpeg,,2,0,FALSE,"Columbine Trail, Oakland, CA 94605, USA",37.74893951,-122.1134186,,,,Alameda,milkmaids,Cardamine californica,milkmaids,Plantae,49651,Brassicaceae,Cardamine,Cardamine californica
21536772,3/23/19,2019-03-23 21:17:39 UTC,Pacific Time (US & Canada),research,https://www.inaturalist.org/observations/21536772,https://static.inaturalist.org/photos/33329766/medium.jpeg,,1,0,FALSE,"Columbine Trail, Castro Valley, CA 94552, USA",37.74194717,-122.1141586,,,,Alameda,ribwort plantain,Plantago lanceolata,ribwort plantain,Plantae,53178,Plantaginaceae,Plantago,Plantago lanceolata
21538664,3/23/19,2019-03-23 20:52:19 UTC,Pacific Time (US & Canada),research,https://www.inaturalist.org/observations/21538664,https://static.inaturalist.org/photos/33333148/medium.jpeg,,1,0,FALSE,"Bass Cove Trail, Oakland, CA 94605, USA",37.73922348,-122.1164856,,,Oakland,Alameda,hairy bittercress,Cardamine hirsuta,hairy bittercress,Plantae,55829,Brassicaceae,Cardamine,Cardamine hirsuta
21538703,3/23/19,2019-03-23 20:51:27 UTC,Pacific Time (US & Canada),research,https://www.inaturalist.org/observations/21538703,https://static.inaturalist.org/photos/33333212/medium.jpeg,,1,0,FALSE,"Bass Cove Trail, Oakland, CA 94605, USA",37.73921967,-122.1163559,,,Oakland,Alameda,Pacific pea,Lathyrus vestitus,Pacific pea,Plantae,50320,Fabaceae,Lathyrus,Lathyrus vestitus
21538758,3/23/19,2019-03-23 19:41:10 UTC,Pacific Time (US & Canada),research,https://www.inaturalist.org/observations/21538758,https://static.inaturalist.org/photos/33333363/medium.jpeg,,1,0,FALSE,"295 Lake Chabot Rd, Castro Valley, CA 94546, USA",37.72347641,-122.1155167,,,Castro Valley,Alameda,Menzies' baby blue eyes,Nemophila menziesii,Menzies' baby blue eyes,Plantae,50648,Boraginaceae,Nemophila,Nemophila menziesii
21545555,3/23/19,2019-03-23 23:40:38 UTC,Pacific Time (US & Canada),research,https://www.inaturalist.org/observations/21545555,https://inaturalist-open-data.s3.amazonaws.com/photos/33345346/medium.jpg,,0,0,FALSE,"Anthony Chabot Regional Park, Oakland, CA, US",37.796905,-122.1532222,64,,,Alameda,Fremont's Deathcamas,Toxicoscordion fremontii,Common star lily,Plantae,49649,Melanthiaceae,Toxicoscordion,Toxicoscordion fremontii
21644818,3/23/19,2019-03-23 22:33:48 UTC,Pacific Time (US & Canada),research,https://www.inaturalist.org/observations/21644818,https://static.inaturalist.org/photos/33510008/medium.jpeg,,1,0,FALSE,"Bass Cove Trail, Oakland, CA 94605, USA",37.73555266,-122.117901,263,,Oakland,Alameda,Henderson's shooting star,Primula hendersonii,Henderson's shooting star,Plantae,487175,Primulaceae,Primula,Primula hendersonii
21644866,3/23/19,2019-03-23 22:41:57 UTC,Pacific Time (US & Canada),research,https://www.inaturalist.org/observations/21644866,https://static.inaturalist.org/photos/33510081/medium.jpeg,,2,0,FALSE,"Bass Cove Trail, Oakland, CA 94605, USA",37.73265105,-122.1233244,263,,Oakland,Alameda,greater periwinkle,Vinca major,greater periwinkle,Plantae,53326,Apocynaceae,Vinca,Vinca major
21644909,3/23/19,2019-03-23 22:10:02 UTC,Pacific Time (US & Canada),research,https://www.inaturalist.org/observations/21644909,https://static.inaturalist.org/photos/33510130/medium.jpeg,,1,0,FALSE,"Columbine Trail, Oakland, CA 94605, USA",37.74830029,-122.1132453,263,,,Alameda,broadleaf forget-me-not,Myosotis latifolia,broadleaf forget-me-not,Plantae,49132,Boraginaceae,Myosotis,Myosotis latifolia
21644996,3/23/19,2019-03-23 22:20:56 UTC,Pacific Time (US & Canada),research,https://www.inaturalist.org/observations/21644996,https://static.inaturalist.org/photos/33510276/medium.jpeg,,2,1,FALSE,"Columbine Trail, Oakland, CA 94605, USA",37.7483716,-122.1131199,263,,,Alameda,western blue-eyed grass,Sisyrinchium bellum,western blue-eyed grass,Plantae,49918,Iridaceae,Sisyrinchium,Sisyrinchium bellum
21813327,3/23/19,2019-03-23 23:41:48 UTC,Pacific Time (US & Canada),research,https://www.inaturalist.org/observations/21813327,https://inaturalist-open-data.s3.amazonaws.com/photos/33791116/medium.jpg,,1,0,FALSE,"Anthony Chabot Regional Park, Oakland, CA, US",37.79761333,-122.154275,8,,,Alameda,milkmaids,Cardamine californica,milkmaids,Plantae,49651,Brassicaceae,Cardamine,Cardamine californica
21564034,3/24/19,2019-03-24 18:56:39 UTC,Pacific Time (US & Canada),research,https://www.inaturalist.org/observations/21564034,https://static.inaturalist.org/photos/33376504/medium.jpg,,1,0,FALSE,"Knowland Park, Oakland, CA, US",37.76426002,-122.1248071,10,,Oakland,Alameda,miner's lettuce,Claytonia perfoliata,miner's lettuce,Plantae,52994,Montiaceae,Claytonia,Claytonia perfoliata
21564096,3/24/19,2019-03-24 18:57:32 UTC,Pacific Time (US & Canada),research,https://www.inaturalist.org/observations/21564096,https://static.inaturalist.org/photos/33376530/medium.jpg,,1,0,FALSE,"Anthony Chabot Regional Park, Oakland, CA, US",37.76425013,-122.1247299,5,,Oakland,Alameda,Bermuda buttercup,Oxalis pes-caprae,Bermuda buttercup,Plantae,53169,Oxalidaceae,Oxalis,Oxalis pes-caprae
21577413,3/24/19,2019-03-24 21:06:04 UTC,Pacific Time (US & Canada),research,https://www.inaturalist.org/observations/21577413,https://inaturalist-open-data.s3.amazonaws.com/photos/33398679/medium.jpg,,2,0,FALSE,"Anthony Chabot Regional Park, Oakland, CA, US",37.78789659,-122.1345204,22,,,Alameda,Redmaids,Calandrinia menziesii,redmaids,Plantae,400267,Montiaceae,Calandrinia,Calandrinia menziesii
21682740,3/25/19,2019-03-25 21:45:40 UTC,Pacific Time (US & Canada),research,https://www.inaturalist.org/observations/21682740,https://static.inaturalist.org/photos/33573408/medium.jpg,Philip Coffin on Columbine trail in Anthony Chabot,2,0,FALSE,"Anthony Chabot Regional Park, Oakland, CA, US",37.75368667,-122.1160805,5,,,Alameda,checker lily,Fritillaria affinis,checker lily,Plantae,50618,Liliaceae,Fritillaria,Fritillaria affinis
21678395,3/27/19,2019-03-27 17:00:45 UTC,Pacific Time (US & Canada),research,https://www.inaturalist.org/observations/21678395,https://inaturalist-open-data.s3.amazonaws.com/photos/33565998/medium.jpg,Several colors in large patch ...,1,0,FALSE,"Anthony Chabot Regional Park, Oakland, CA, US",37.77813667,-122.1284167,32,,,Alameda,giant wakerobin,Trillium chloropetalum,giant wakerobin,Plantae,50823,Melanthiaceae,Trillium,Trillium chloropetalum
21678405,3/27/19,2019-03-27 17:07:17 UTC,Pacific Time (US & Canada),research,https://www.inaturalist.org/observations/21678405,https://inaturalist-open-data.s3.amazonaws.com/photos/33566046/medium.jpg,,1,0,FALSE,"Anthony Chabot Regional Park, Oakland, CA, US",37.777,-122.1267472,96,,,Alameda,twinberry honeysuckle,Lonicera involucrata,twinberry honeysuckle,Plantae,60881,Caprifoliaceae,Lonicera,Lonicera involucrata
21986078,4/4/19,2019-04-04 16:57:33 UTC,Pacific Time (US & Canada),research,https://www.inaturalist.org/observations/21986078,https://static.inaturalist.org/photos/34078096/medium.jpg,,2,0,FALSE,"Anthony Chabot Regional Park, Castro Valley, CA, US",37.71305278,-122.103935,8,,Castro Valley,Alameda,Dwarf Checkermallow,Sidalcea malviflora,Dwarf Checkermallow,Plantae,48795,Malvaceae,Sidalcea,Sidalcea malviflora
22116621,4/6/19,2019-04-06 22:38:58 UTC,Pacific Time (US & Canada),research,https://www.inaturalist.org/observations/22116621,https://static.inaturalist.org/photos/34237133/medium.jpeg,,2,0,FALSE,"231 Lake Chabot Rd, Castro Valley, CA 94546, USA",37.7172699,-122.1114197,,,Castro Valley,Alameda,narrowleaf mule-ears,Wyethia angustifolia,narrowleaf mule-ears,Plantae,56987,Asteraceae,Wyethia,Wyethia angustifolia
22116631,4/6/19,2019-04-06 22:40:18 UTC,Pacific Time (US & Canada),research,https://www.inaturalist.org/observations/22116631,https://static.inaturalist.org/photos/34237146/medium.jpeg,,1,0,FALSE,"231 Lake Chabot Rd, Castro Valley, CA 94546, USA",37.71752548,-122.1112976,,,Castro Valley,Alameda,Field madder,Sherardia arvensis,Field madder,Plantae,47691,Rubiaceae,Sherardia,Sherardia arvensis
22116646,4/6/19,2019-04-06 22:43:37 UTC,Pacific Time (US & Canada),research,https://www.inaturalist.org/observations/22116646,https://static.inaturalist.org/photos/34237172/medium.jpeg,,1,0,FALSE,"231 Lake Chabot Rd, Castro Valley, CA 94546, USA",37.71780014,-122.1115875,,,Castro Valley,Alameda,dwarf orthocarpus,Triphysaria pusilla,dwarf orthocarpus,Plantae,57276,Orobanchaceae,Triphysaria,Triphysaria pusilla
32626063,4/6/19,2019-04-06 21:12:25 UTC,Pacific Time (US & Canada),research,https://www.inaturalist.org/observations/32626063,https://static.inaturalist.org/photos/51187511/medium.jpg,,1,0,FALSE,"Anthony Chabot Regional Park, Castro Valley, CA, US",37.72784667,-122.0956945,30,,,Alameda,Sun Cup,Taraxia ovata,Sun Cup,Plantae,68182,Onagraceae,Taraxia,Taraxia ovata
22373697,4/8/19,2019-04-08 19:32:16 UTC,Pacific Time (US & Canada),research,https://www.inaturalist.org/observations/22373697,https://static.inaturalist.org/photos/34652473/medium.jpg,,2,0,FALSE,"Lake Chabot Regional Park, Castro Valley, CA, US",37.72114721,-122.0948836,179,,Castro Valley,Alameda,star-flowered lily-of-the-valley,Maianthemum stellatum,star-flowered lily-of-the-valley,Plantae,53268,Asparagaceae,Maianthemum,Maianthemum stellatum
22276052,4/9/19,2019-04-09 23:01:00 UTC,Pacific Time (US & Canada),research,https://www.inaturalist.org/observations/22276052,https://inaturalist-open-data.s3.amazonaws.com/photos/34497314/medium.jpeg,,1,0,FALSE,"Anthony Chabot Regional Park, Alameda County, US-CA, US",37.79802678,-122.1471119,9,,,Alameda,spotted coralroot,Corallorhiza maculata,spotted coralroot,Plantae,49475,Orchidaceae,Corallorhiza,Corallorhiza maculata
22276058,4/9/19,2019-04-09 23:03:59 UTC,Pacific Time (US & Canada),research,https://www.inaturalist.org/observations/22276058,https://inaturalist-open-data.s3.amazonaws.com/photos/34497327/medium.jpeg,,2,0,FALSE,"Anthony Chabot Regional Park, Alameda County, US-CA, US",37.79793398,-122.1471122,9,,,Alameda,Fremont's Deathcamas,Toxicoscordion fremontii,Common star lily,Plantae,49649,Melanthiaceae,Toxicoscordion,Toxicoscordion fremontii
22276080,4/9/19,2019-04-09 23:24:18 UTC,Pacific Time (US & Canada),research,https://www.inaturalist.org/observations/22276080,https://inaturalist-open-data.s3.amazonaws.com/photos/34497372/medium.jpeg,,1,0,FALSE,"Anthony Chabot Regional Park, Alameda County, US-CA, US",37.797389,-122.1457531,5,,,Alameda,California bay,Umbellularia californica,California bay,Plantae,48807,Lauraceae,Umbellularia,Umbellularia californica
22276127,4/9/19,2019-04-09 23:52:00 UTC,Pacific Time (US & Canada),research,https://www.inaturalist.org/observations/22276127,https://inaturalist-open-data.s3.amazonaws.com/photos/34497409/medium.jpeg,,2,0,FALSE,"Anthony Chabot Regional Park, Alameda County, US-CA, US",37.79836866,-122.1469292,8,,,Alameda,Indian Warrior,Pedicularis densiflora,Warrior's Plume,Plantae,49645,Orobanchaceae,Pedicularis,Pedicularis densiflora
22276147,4/9/19,2019-04-10 00:08:24 UTC,Pacific Time (US & Canada),research,https://www.inaturalist.org/observations/22276147,https://inaturalist-open-data.s3.amazonaws.com/photos/34497420/medium.jpeg,,1,0,FALSE,"Anthony Chabot Regional Park, Alameda County, US-CA, US",37.79499264,-122.1434818,5,,,Alameda,spotted coralroot,Corallorhiza maculata,spotted coralroot,Plantae,49475,Orchidaceae,Corallorhiza,Corallorhiza maculata
22276149,4/9/19,2019-04-10 00:19:06 UTC,Pacific Time (US & Canada),research,https://www.inaturalist.org/observations/22276149,https://inaturalist-open-data.s3.amazonaws.com/photos/34497427/medium.jpeg,,1,0,FALSE,"Anthony Chabot Regional Park, Alameda County, US-CA, US",37.7917232,-122.1421281,6,,,Alameda,Sun Cup,Taraxia ovata,Sun Cup,Plantae,68182,Onagraceae,Taraxia,Taraxia ovata
22276175,4/9/19,2019-04-10 01:46:00 UTC,Pacific Time (US & Canada),research,https://www.inaturalist.org/observations/22276175,https://inaturalist-open-data.s3.amazonaws.com/photos/34497460/medium.jpeg,,1,0,FALSE,"Anthony Chabot Regional Park, Alameda County, US-CA, US",37.78702707,-122.1330322,5,,,Alameda,Purple Sanicle,Sanicula bipinnatifida,Purple Sanicle,Plantae,56840,Apiaceae,Sanicula,Sanicula bipinnatifida
22276179,4/9/19,2019-04-10 01:50:00 UTC,Pacific Time (US & Canada),research,https://www.inaturalist.org/observations/22276179,https://inaturalist-open-data.s3.amazonaws.com/photos/34497463/medium.jpeg,,2,0,FALSE,"Anthony Chabot Regional Park, Alameda County, US-CA, US",37.78644653,-122.1324631,3,,,Alameda,Indian Warrior,Pedicularis densiflora,Warrior's Plume,Plantae,49645,Orobanchaceae,Pedicularis,Pedicularis densiflora
22276204,4/9/19,2019-04-10 03:08:54 UTC,Pacific Time (US & Canada),research,https://www.inaturalist.org/observations/22276204,https://inaturalist-open-data.s3.amazonaws.com/photos/34497483/medium.jpeg,,1,0,FALSE,"Anthony Chabot Regional Park, Alameda County, US-CA, US",37.79358237,-122.142779,9,,,Alameda,Pacific poison oak,Toxicodendron diversilobum,Pacific poison oak,Plantae,51080,Anacardiaceae,Toxicodendron,Toxicodendron diversilobum
22299294,4/10/19,2019-04-10 18:09:54 UTC,Pacific Time (US & Canada),research,https://www.inaturalist.org/observations/22299294,https://static.inaturalist.org/photos/34534576/medium.jpg,,2,0,FALSE,"Anthony Chabot Regional Park, Castro Valley, CA, US",37.71973,-122.1085138,6,,Castro Valley,Alameda,Annual Honesty,Lunaria annua,Annual Honesty,Plantae,55886,Brassicaceae,Lunaria,Lunaria annua
22299311,4/10/19,2019-04-10 17:53:22 UTC,Pacific Time (US & Canada),research,https://www.inaturalist.org/observations/22299311,https://static.inaturalist.org/photos/34534633/medium.jpg,,2,0,FALSE,"Anthony Chabot Regional Park, Castro Valley, CA, US",37.72468,-122.1116722,6,,,Alameda,spotted coralroot,Corallorhiza maculata,spotted coralroot,Plantae,49475,Orchidaceae,Corallorhiza,Corallorhiza maculata
22299344,4/10/19,2019-04-10 17:57:03 UTC,Pacific Time (US & Canada),research,https://www.inaturalist.org/observations/22299344,https://static.inaturalist.org/photos/34549972/medium.jpg,,2,0,FALSE,"Anthony Chabot Regional Park, Castro Valley, CA, US",37.72397167,-122.11045,6,,,Alameda,Mediterranean Stork's-bill,Erodium botrys,Mediterranean Stork's-bill,Plantae,57090,Geraniaceae,Erodium,Erodium botrys
22302588,4/10/19,2019-04-10 21:15:46 UTC,Pacific Time (US & Canada),research,https://www.inaturalist.org/observations/22302588,https://static.inaturalist.org/photos/34539884/medium.jpg,,2,0,FALSE,"Anthony Chabot Regional Park, Oakland, CA, US",37.76999667,-122.1219112,5,,,Alameda,French broom,Genista monspessulana,French broom,Plantae,53403,Fabaceae,Genista,Genista monspessulana
22302629,4/10/19,2019-04-10 21:38:02 UTC,Pacific Time (US & Canada),research,https://www.inaturalist.org/observations/22302629,https://static.inaturalist.org/photos/34539963/medium.jpg,,3,1,FALSE,"Anthony Chabot Regional Park, Oakland, CA, US",37.76884667,-122.1217722,10,,,Alameda,scarlet pimpernel,Lysimachia arvensis,scarlet pimpernel,Plantae,791928,Primulaceae,Lysimachia,Lysimachia arvensis
22302695,4/10/19,2019-04-10 21:52:06 UTC,Pacific Time (US & Canada),research,https://www.inaturalist.org/observations/22302695,https://static.inaturalist.org/photos/34540079/medium.jpg,,1,0,FALSE,"Anthony Chabot Regional Park, Castro Valley, CA, US",37.75565558,-122.1114608,1053,,,Alameda,twinberry honeysuckle,Lonicera involucrata,twinberry honeysuckle,Plantae,60881,Caprifoliaceae,Lonicera,Lonicera involucrata
22302709,4/10/19,2019-04-10 21:53:39 UTC,Pacific Time (US & Canada),research,https://www.inaturalist.org/observations/22302709,https://static.inaturalist.org/photos/34540108/medium.jpg,,1,0,FALSE,"Anthony Chabot Regional Park, Oakland, CA, US",37.77718333,-122.1272362,5,,,Alameda,Pampas Grass,Cortaderia selloana,Pampas Grass,Plantae,64240,Poaceae,Cortaderia,Cortaderia selloana
22302734,4/10/19,2019-04-10 21:57:47 UTC,Pacific Time (US & Canada),research,https://www.inaturalist.org/observations/22302734,https://static.inaturalist.org/photos/34540148/medium.jpg,,1,0,FALSE,"Anthony Chabot Regional Park, Oakland, CA, US",37.778655,-122.1291055,10,,,Alameda,greater periwinkle,Vinca major,greater periwinkle,Plantae,53326,Apocynaceae,Vinca,Vinca major
22308690,4/10/19,2019-04-10 16:56:19 UTC,Pacific Time (US & Canada),research,https://www.inaturalist.org/observations/22308690,https://static.inaturalist.org/photos/34549985/medium.jpg,,3,0,FALSE,"Anthony Chabot Regional Park, Castro Valley, CA, US",37.72553667,-122.1140583,10,,Castro Valley,Alameda,false Solomon's seal,Maianthemum racemosum,Solomon's plume,Plantae,51062,Asparagaceae,Maianthemum,Maianthemum racemosum
22500330,4/10/19,2019-04-10 19:17:14 UTC,Pacific Time (US & Canada),research,https://www.inaturalist.org/observations/22500330,https://inaturalist-open-data.s3.amazonaws.com/photos/34858183/medium.jpeg,,1,0,FALSE,"Anthony Chabot Regional Park, Alameda County, US-CA, US",37.71759269,-122.1142459,9,,Castro Valley,Alameda,narrowleaf mule-ears,Wyethia angustifolia,narrowleaf mule-ears,Plantae,56987,Asteraceae,Wyethia,Wyethia angustifolia
71139813,4/10/19,2019-04-11 01:57:31 UTC,Pacific Time (US & Canada),research,https://www.inaturalist.org/observations/71139813,https://inaturalist-open-data.s3.amazonaws.com/photos/115774361/medium.jpg,,1,0,FALSE,"Anthony Chabot Regional Park, Oakland, CA, US",37.73123,-122.1274555,24,,Oakland,Alameda,Fiesta Flower,Pholistoma auritum,Fiesta Flower,Plantae,55437,Boraginaceae,Pholistoma,Pholistoma auritum
22544355,4/13/19,2019-04-14 02:02:36 UTC,Pacific Time (US & Canada),research,https://www.inaturalist.org/observations/22544355,https://static.inaturalist.org/photos/34928748/medium.jpeg,,1,0,FALSE,"Unnamed Road, Castro Valley, CA 94546, USA",37.71601486,-122.1115799,,,Castro Valley,Alameda,Dwarf Nettle,Urtica urens,Dwarf Nettle,Plantae,53315,Urticaceae,Urtica,Urtica urens
107914576,4/13/19,2019-04-13 20:45:05 UTC,Pacific Time (US & Canada),research,https://www.inaturalist.org/observations/107914576,https://static.inaturalist.org/photos/181590216/medium.jpg,,1,0,FALSE,"Anthony Chabot Regional Park, Castro Valley, CA, US",37.73613333,-122.1135167,5,,,Alameda,Blue Dicks,Dipterostemon capitatus,Blue Dicks,Plantae,1196784,Asparagaceae,Dipterostemon,Dipterostemon capitatus
107914610,4/13/19,2019-04-13 21:30:56 UTC,Pacific Time (US & Canada),research,https://www.inaturalist.org/observations/107914610,https://static.inaturalist.org/photos/181590292/medium.jpg,,1,0,FALSE,"Anthony Chabot Regional Park, Castro Valley, CA, US",37.72963,-122.1087945,10,,,Alameda,Eurabbie,Eucalyptus globulus,Eurabbie,Plantae,53398,Myrtaceae,Eucalyptus,Eucalyptus globulus
107914924,4/13/19,2019-04-13 21:49:22 UTC,Pacific Time (US & Canada),research,https://www.inaturalist.org/observations/107914924,https://static.inaturalist.org/photos/181590661/medium.jpg,,1,0,FALSE,"Anthony Chabot Regional Park, Castro Valley, CA, US",37.72686667,-122.1059805,10,,,Alameda,California poppy,Eschscholzia californica,California poppy,Plantae,48225,Papaveraceae,Eschscholzia,Eschscholzia californica
107915093,4/13/19,2019-04-13 22:10:25 UTC,Pacific Time (US & Canada),research,https://www.inaturalist.org/observations/107915093,https://static.inaturalist.org/photos/181590848/medium.jpg,,1,0,FALSE,"Anthony Chabot Regional Park, Castro Valley, CA, US",37.72948333,-122.0967472,,,,Alameda,western blue-eyed grass,Sisyrinchium bellum,western blue-eyed grass,Plantae,49918,Iridaceae,Sisyrinchium,Sisyrinchium bellum
107915500,4/13/19,2019-04-13 23:11:14 UTC,Pacific Time (US & Canada),research,https://www.inaturalist.org/observations/107915500,https://static.inaturalist.org/photos/181591800/medium.jpg,,1,0,FALSE,"Anthony Chabot Regional Park, Castro Valley, CA, US",37.71878333,-122.1045917,5,,Castro Valley,Alameda,wild radish,Raphanus sativus,wild radish,Plantae,55410,Brassicaceae,Raphanus,Raphanus sativus
22498457,4/14/19,2019-04-14 23:37:30 UTC,Pacific Time (US & Canada),research,https://www.inaturalist.org/observations/22498457,https://inaturalist-open-data.s3.amazonaws.com/photos/34862115/medium.jpg,,1,0,FALSE,"Anthony Chabot Regional Park, Oakland, CA, US",37.75713333,-122.1166167,12,,,Alameda,forest scurfpea,Rupertia physodes,forest scurfpea,Plantae,53198,Fabaceae,Rupertia,Rupertia physodes
22515547,4/14/19,2019-04-14 23:04:32 UTC,Pacific Time (US & Canada),research,https://www.inaturalist.org/observations/22515547,https://inaturalist-open-data.s3.amazonaws.com/photos/34885662/medium.jpg,,1,0,FALSE,"Anthony Chabot Regional Park, Castro Valley, CA, US",37.74801667,-122.1128778,3995,,,Alameda,Fremont's Deathcamas,Toxicoscordion fremontii,Common star lily,Plantae,49649,Melanthiaceae,Toxicoscordion,Toxicoscordion fremontii
22517253,4/14/19,2019-04-14 23:01:30 UTC,Pacific Time (US & Canada),research,https://www.inaturalist.org/observations/22517253,https://inaturalist-open-data.s3.amazonaws.com/photos/34885672/medium.jpg,,1,0,FALSE,"Anthony Chabot Regional Park, Castro Valley, CA, US",37.74924667,-122.1135112,24,,,Alameda,giant vetch,Vicia gigantea,giant vetch,Plantae,53322,Fabaceae,Vicia,Vicia gigantea
22517262,4/14/19,2019-04-14 22:58:58 UTC,Pacific Time (US & Canada),research,https://www.inaturalist.org/observations/22517262,https://inaturalist-open-data.s3.amazonaws.com/photos/34885688/medium.jpg,,3,0,FALSE,"Anthony Chabot Regional Park, Castro Valley, CA, US",37.749925,-122.1138445,48,,,Alameda,Pacific hound's tongue,Adelinia grande,Pacific hound's tongue,Plantae,769151,Boraginaceae,Adelinia,Adelinia grande
22517302,4/14/19,2019-04-14 22:42:59 UTC,Pacific Time (US & Canada),research,https://www.inaturalist.org/observations/22517302,https://inaturalist-open-data.s3.amazonaws.com/photos/34886140/medium.jpg,,2,0,FALSE,"Anthony Chabot Regional Park, Oakland, CA, US",37.75326167,-122.1161112,96,,,Alameda,false Solomon's seal,Maianthemum racemosum,Solomon's plume,Plantae,51062,Asparagaceae,Maianthemum,Maianthemum racemosum
22517885,4/14/19,2019-04-14 22:40:51 UTC,Pacific Time (US & Canada),research,https://www.inaturalist.org/observations/22517885,https://inaturalist-open-data.s3.amazonaws.com/photos/34886602/medium.jpg,,1,0,FALSE,"Anthony Chabot Regional Park, Oakland, CA, US",37.75368,-122.1161028,8,,,Alameda,forest scurfpea,Rupertia physodes,forest scurfpea,Plantae,53198,Fabaceae,Rupertia,Rupertia physodes
22517891,4/14/19,2019-04-14 22:39:36 UTC,Pacific Time (US & Canada),research,https://www.inaturalist.org/observations/22517891,https://inaturalist-open-data.s3.amazonaws.com/photos/34887263/medium.jpg,,2,0,FALSE,"Anthony Chabot Regional Park, Oakland, CA, US",37.75368667,-122.1162195,64,,,Alameda,checker lily,Fritillaria affinis,checker lily,Plantae,50618,Liliaceae,Fritillaria,Fritillaria affinis
22519270,4/14/19,2019-04-14 22:31:58 UTC,Pacific Time (US & Canada),research,https://www.inaturalist.org/observations/22519270,https://inaturalist-open-data.s3.amazonaws.com/photos/34888380/medium.jpg,,2,0,FALSE,"Anthony Chabot Regional Park, Oakland, CA, US",37.75601667,-122.1161888,24,,,Alameda,star-flowered lily-of-the-valley,Maianthemum stellatum,star-flowered lily-of-the-valley,Plantae,53268,Asparagaceae,Maianthemum,Maianthemum stellatum
22519285,4/14/19,2019-04-14 22:11:34 UTC,Pacific Time (US & Canada),research,https://www.inaturalist.org/observations/22519285,https://inaturalist-open-data.s3.amazonaws.com/photos/34888440/medium.jpg,,2,0,FALSE,"Anthony Chabot Regional Park, Oakland, CA, US",37.75769167,-122.1167917,16,,,Alameda,White Globe Lily,Calochortus albus,White Globe Lily,Plantae,51315,Liliaceae,Calochortus,Calochortus albus
22519357,4/14/19,2019-04-14 22:12:24 UTC,Pacific Time (US & Canada),research,https://www.inaturalist.org/observations/22519357,https://inaturalist-open-data.s3.amazonaws.com/photos/34888551/medium.jpg,,1,0,FALSE,"Anthony Chabot Regional Park, Oakland, CA, US",37.75761167,-122.1167917,16,,,Alameda,Fendler's Meadow-rue,Thalictrum fendleri,Fendler's Meadow-rue,Plantae,53299,Ranunculaceae,Thalictrum,Thalictrum fendleri
22519390,4/14/19,2019-04-14 22:09:41 UTC,Pacific Time (US & Canada),research,https://www.inaturalist.org/observations/22519390,https://inaturalist-open-data.s3.amazonaws.com/photos/34888603/medium.jpg,,1,0,FALSE,"Anthony Chabot Regional Park, Oakland, CA, US",37.75713667,-122.1167972,12,,,Alameda,forest scurfpea,Rupertia physodes,forest scurfpea,Plantae,53198,Fabaceae,Rupertia,Rupertia physodes
22519418,4/14/19,2019-04-14 21:20:00 UTC,Pacific Time (US & Canada),research,https://www.inaturalist.org/observations/22519418,https://inaturalist-open-data.s3.amazonaws.com/photos/34888646/medium.jpg,,1,0,FALSE,"Anthony Chabot Regional Park, Oakland, CA, US",37.76958,-122.1225278,24,,,Alameda,Pacific ninebark,Physocarpus capitatus,Pacific ninebark,Plantae,57249,Rosaceae,Physocarpus,Physocarpus capitatus
22519429,4/14/19,2019-04-14 21:13:04 UTC,Pacific Time (US & Canada),research,https://www.inaturalist.org/observations/22519429,https://inaturalist-open-data.s3.amazonaws.com/photos/34888662/medium.jpg,,1,0,FALSE,"Anthony Chabot Regional Park, Oakland, CA, US",37.77163333,-122.1237638,8,,,Alameda,forest scurfpea,Rupertia physodes,forest scurfpea,Plantae,53198,Fabaceae,Rupertia,Rupertia physodes
22594513,4/14/19,2019-04-14 22:54:13 UTC,Pacific Time (US & Canada),research,https://www.inaturalist.org/observations/22594513,https://inaturalist-open-data.s3.amazonaws.com/photos/35008082/medium.jpg,,1,0,FALSE,"Anthony Chabot Regional Park, Castro Valley, CA, US",37.751495,-122.1138695,16,,,Alameda,western columbine,Aquilegia formosa,western columbine,Plantae,48244,Ranunculaceae,Aquilegia,Aquilegia formosa
22594637,4/14/19,2019-04-14 22:48:12 UTC,Pacific Time (US & Canada),research,https://www.inaturalist.org/observations/22594637,https://inaturalist-open-data.s3.amazonaws.com/photos/35008257/medium.jpg,,1,0,FALSE,"Anthony Chabot Regional Park, Castro Valley, CA, US",37.75232,-122.1149138,48,,,Alameda,western columbine,Aquilegia formosa,western columbine,Plantae,48244,Ranunculaceae,Aquilegia,Aquilegia formosa
22594643,4/14/19,2019-04-14 22:44:00 UTC,Pacific Time (US & Canada),research,https://www.inaturalist.org/observations/22594643,https://inaturalist-open-data.s3.amazonaws.com/photos/35008285/medium.jpg,,1,0,FALSE,"Anthony Chabot Regional Park, Oakland, CA, US",37.75336167,-122.1158305,6,,,Alameda,western columbine,Aquilegia formosa,western columbine,Plantae,48244,Ranunculaceae,Aquilegia,Aquilegia formosa
22594659,4/14/19,2019-04-14 22:46:24 UTC,Pacific Time (US & Canada),research,https://www.inaturalist.org/observations/22594659,https://inaturalist-open-data.s3.amazonaws.com/photos/35008294/medium.jpg,,2,0,FALSE,"Anthony Chabot Regional Park, Castro Valley, CA, US",37.75282,-122.1150805,6,,,Alameda,Trillium chloropetalum giganteum,Trillium chloropetalum giganteum,,Plantae,243295,Melanthiaceae,Trillium,Trillium chloropetalum
22594666,4/14/19,2019-04-14 22:07:09 UTC,Pacific Time (US & Canada),research,https://www.inaturalist.org/observations/22594666,https://inaturalist-open-data.s3.amazonaws.com/photos/35008331/medium.jpg,,2,0,FALSE,"Anthony Chabot Regional Park, Oakland, CA, US",37.75711333,-122.1167612,24,,,Alameda,San Francisco woodland-star,Lithophragma affine,San Francisco woodland-star,Plantae,50803,Saxifragaceae,Lithophragma,Lithophragma affine
22594675,4/14/19,2019-04-14 22:06:27 UTC,Pacific Time (US & Canada),research,https://www.inaturalist.org/observations/22594675,https://inaturalist-open-data.s3.amazonaws.com/photos/35008340/medium.jpg,,1,0,FALSE,"Anthony Chabot Regional Park, Oakland, CA, US",37.75722167,-122.1168833,32,,,Alameda,ribwort plantain,Plantago lanceolata,ribwort plantain,Plantae,53178,Plantaginaceae,Plantago,Plantago lanceolata
22594818,4/14/19,2019-04-14 22:03:42 UTC,Pacific Time (US & Canada),research,https://www.inaturalist.org/observations/22594818,https://inaturalist-open-data.s3.amazonaws.com/photos/35008521/medium.jpg,,2,0,FALSE,"Anthony Chabot Regional Park, Oakland, CA, US",37.76058833,-122.1192862,24,,,Alameda,star-flowered lily-of-the-valley,Maianthemum stellatum,star-flowered lily-of-the-valley,Plantae,53268,Asparagaceae,Maianthemum,Maianthemum stellatum
22594832,4/14/19,2019-04-14 21:21:53 UTC,Pacific Time (US & Canada),research,https://www.inaturalist.org/observations/22594832,https://inaturalist-open-data.s3.amazonaws.com/photos/35008541/medium.jpg,,1,0,FALSE,"Anthony Chabot Regional Park, Oakland, CA, US",37.76901167,-122.1220778,64,,,Alameda,Pacific ninebark,Physocarpus capitatus,Pacific ninebark,Plantae,57249,Rosaceae,Physocarpus,Physocarpus capitatus
22594880,4/14/19,2019-04-14 21:09:42 UTC,Pacific Time (US & Canada),research,https://www.inaturalist.org/observations/22594880,https://inaturalist-open-data.s3.amazonaws.com/photos/35008658/medium.jpg,,1,0,FALSE,"Anthony Chabot Regional Park, Oakland, CA, US",37.7716,-122.1239555,6,,,Alameda,Subterranean Clover,Trifolium subterraneum,Subterranean Clover,Plantae,60201,Fabaceae,Trifolium,Trifolium subterraneum
22594900,4/14/19,2019-04-14 21:06:11 UTC,Pacific Time (US & Canada),research,https://www.inaturalist.org/observations/22594900,https://inaturalist-open-data.s3.amazonaws.com/photos/35008702/medium.jpg,,1,0,FALSE,"Anthony Chabot Regional Park, Oakland, CA, US",37.77288,-122.1246112,16,,,Alameda,California poppy,Eschscholzia californica,California poppy,Plantae,48225,Papaveraceae,Eschscholzia,Eschscholzia californica
22594918,4/14/19,2019-04-14 20:57:42 UTC,Pacific Time (US & Canada),research,https://www.inaturalist.org/observations/22594918,https://inaturalist-open-data.s3.amazonaws.com/photos/35008714/medium.jpg,,1,0,FALSE,"Anthony Chabot Regional Park, Oakland, CA, US",37.77550833,-122.1261278,8,,,Alameda,twinberry honeysuckle,Lonicera involucrata,twinberry honeysuckle,Plantae,60881,Caprifoliaceae,Lonicera,Lonicera involucrata
22594954,4/14/19,2019-04-14 20:41:17 UTC,Pacific Time (US & Canada),research,https://www.inaturalist.org/observations/22594954,https://inaturalist-open-data.s3.amazonaws.com/photos/35008787/medium.jpg,,1,0,FALSE,"Anthony Chabot Regional Park, Oakland, CA, US",37.778105,-122.1260445,6,,,Alameda,western blue-eyed grass,Sisyrinchium bellum,western blue-eyed grass,Plantae,49918,Iridaceae,Sisyrinchium,Sisyrinchium bellum
22594998,4/14/19,2019-04-14 20:41:48 UTC,Pacific Time (US & Canada),research,https://www.inaturalist.org/observations/22594998,https://inaturalist-open-data.s3.amazonaws.com/photos/35008803/medium.jpg,,1,0,FALSE,"Anthony Chabot Regional Park, Oakland, CA, US",37.77817167,-122.1260528,6,,,Alameda,Sun Cup,Taraxia ovata,Sun Cup,Plantae,68182,Onagraceae,Taraxia,Taraxia ovata
22516317,4/15/19,2019-04-15 16:01:59 UTC,Pacific Time (US & Canada),research,https://www.inaturalist.org/observations/22516317,https://inaturalist-open-data.s3.amazonaws.com/photos/34884253/medium.jpg,,2,0,FALSE,"Anthony Chabot Regional Park, Castro Valley, CA, US",37.74056779,-122.0942864,21,,,Alameda,Sun Cup,Taraxia ovata,Sun Cup,Plantae,68182,Onagraceae,Taraxia,Taraxia ovata
22670094,4/18/19,2019-04-18 19:00:34 UTC,Pacific Time (US & Canada),research,https://www.inaturalist.org/observations/22670094,https://static.inaturalist.org/photos/35126096/medium.jpg,,1,0,FALSE,"Lake Chabot Regional Park, Castro Valley, CA, US",37.72321174,-122.0935003,5,,Castro Valley,Alameda,common cowparsnip,Heracleum maximum,common cowparsnip,Plantae,53094,Apiaceae,Heracleum,Heracleum maximum
22683004,4/18/19,2019-04-18 18:41:00 UTC,Pacific Time (US & Canada),research,https://www.inaturalist.org/observations/22683004,https://inaturalist-open-data.s3.amazonaws.com/photos/35147242/medium.jpg,,1,0,FALSE,"Castro Valley, CA, USA",37.72449911,-122.0931523,15,,Castro Valley,Alameda,Sun Cup,Taraxia ovata,Sun Cup,Plantae,68182,Onagraceae,Taraxia,Taraxia ovata
22778998,4/20/19,2019-04-20 21:29:03 UTC,Pacific Time (US & Canada),research,https://www.inaturalist.org/observations/22778998,https://inaturalist-open-data.s3.amazonaws.com/photos/35383272/medium.jpg,,1,0,FALSE,"Lake Chabot Golf Course, Oakland, CA, US",37.73699,-122.1002554,5,,,Alameda,Sun Cup,Taraxia ovata,Sun Cup,Plantae,68182,Onagraceae,Taraxia,Taraxia ovata
22781029,4/20/19,2019-04-20 22:00:42 UTC,Pacific Time (US & Canada),research,https://www.inaturalist.org/observations/22781029,https://static.inaturalist.org/photos/35304280/medium.jpg,,2,0,FALSE,"Anthony Chabot Regional Park, Castro Valley, CA, US",37.71538171,-122.1022428,5,,Castro Valley,Alameda,bigleaf maple,Acer macrophyllum,bigleaf maple,Plantae,48227,Sapindaceae,Acer,Acer macrophyllum
22829797,4/20/19,2019-04-20 21:29:43 UTC,Pacific Time (US & Canada),research,https://www.inaturalist.org/observations/22829797,https://inaturalist-open-data.s3.amazonaws.com/photos/35383306/medium.jpg,,2,0,FALSE,"Anthony Chabot Regional Park, Castro Valley, CA, US",37.73718593,-122.1004089,10,,,Alameda,western blue-eyed grass,Sisyrinchium bellum,western blue-eyed grass,Plantae,49918,Iridaceae,Sisyrinchium,Sisyrinchium bellum
22854140,4/21/19,2019-04-21 22:51:36 UTC,Pacific Time (US & Canada),research,https://www.inaturalist.org/observations/22854140,https://static.inaturalist.org/photos/35581605/medium.jpeg,,1,0,FALSE,"Anthony Chabot Regional Park, Alameda County, US-CA, US",37.72757842,-122.0953206,9,,Castro Valley,Alameda,White Globe Lily,Calochortus albus,White Globe Lily,Plantae,51315,Liliaceae,Calochortus,Calochortus albus
22970407,4/21/19,2019-04-21 23:15:41 UTC,Pacific Time (US & Canada),research,https://www.inaturalist.org/observations/22970407,https://static.inaturalist.org/photos/35606462/medium.jpg,,1,0,FALSE,"Anthony Chabot Regional Park, Alameda County, US-CA, US",37.77844802,-122.1288046,5,,,Alameda,San Francisco woodland-star,Lithophragma affine,San Francisco woodland-star,Plantae,50803,Saxifragaceae,Lithophragma,Lithophragma affine
22970485,4/21/19,2019-04-21 23:22:36 UTC,Pacific Time (US & Canada),research,https://www.inaturalist.org/observations/22970485,https://static.inaturalist.org/photos/36753446/medium.jpg,,2,0,FALSE,"Anthony Chabot Regional Park, Alameda County, US-CA, US",37.77652132,-122.1266723,5,,,Alameda,twinberry honeysuckle,Lonicera involucrata,twinberry honeysuckle,Plantae,60881,Caprifoliaceae,Lonicera,Lonicera involucrata
22970924,4/21/19,2019-04-21 23:31:07 UTC,Pacific Time (US & Canada),research,https://www.inaturalist.org/observations/22970924,https://static.inaturalist.org/photos/36753809/medium.jpg,,1,0,FALSE,"Anthony Chabot Regional Park, Alameda County, US-CA, US",37.7728472,-122.1247248,5,,,Alameda,California poppy,Eschscholzia californica,California poppy,Plantae,48225,Papaveraceae,Eschscholzia,Eschscholzia californica
22970979,4/21/19,2019-04-21 23:48:22 UTC,Pacific Time (US & Canada),research,https://www.inaturalist.org/observations/22970979,https://static.inaturalist.org/photos/36754322/medium.jpg,,2,0,FALSE,"Anthony Chabot Regional Park, Alameda County, US-CA, US",37.76724607,-122.1192351,10,,,Alameda,wild radish,Raphanus sativus,wild radish,Plantae,55410,Brassicaceae,Raphanus,Raphanus sativus
22972531,4/21/19,2019-04-22 00:20:15 UTC,Pacific Time (US & Canada),research,https://www.inaturalist.org/observations/22972531,https://static.inaturalist.org/photos/35610473/medium.jpg,,2,0,FALSE,"Anthony Chabot Regional Park, Alameda County, US-CA, US",37.77866009,-122.127393,30,,,Alameda,broadleaf forget-me-not,Myosotis latifolia,broadleaf forget-me-not,Plantae,49132,Boraginaceae,Myosotis,Myosotis latifolia
23751710,4/21/19,2019-04-22 00:04:46 UTC,Pacific Time (US & Canada),research,https://www.inaturalist.org/observations/23751710,https://static.inaturalist.org/photos/36754804/medium.jpg,,1,0,FALSE,"Anthony Chabot Regional Park, Alameda County, US-CA, US",37.7724693,-122.1218128,5,,,Alameda,scarlet pimpernel,Lysimachia arvensis,scarlet pimpernel,Plantae,791928,Primulaceae,Lysimachia,Lysimachia arvensis
22909865,4/22/19,2019-04-22 22:05:31 UTC,Pacific Time (US & Canada),research,https://www.inaturalist.org/observations/22909865,https://inaturalist-open-data.s3.amazonaws.com/photos/35509981/medium.jpg,,2,0,FALSE,"Anthony Chabot Regional Park, Castro Valley, CA, US",37.73742452,-122.1142138,10,,,Alameda,White Globe Lily,Calochortus albus,White Globe Lily,Plantae,51315,Liliaceae,Calochortus,Calochortus albus
23067960,4/24/19,2019-04-24 21:23:00 UTC,Pacific Time (US & Canada),research,https://www.inaturalist.org/observations/23067960,https://inaturalist-open-data.s3.amazonaws.com/photos/35761745/medium.jpeg,,1,0,FALSE,"Alameda County, CA, USA",37.75603667,-122.1138267,,,,Alameda,western blue-eyed grass,Sisyrinchium bellum,western blue-eyed grass,Plantae,49918,Iridaceae,Sisyrinchium,Sisyrinchium bellum
23071162,4/24/19,2019-04-24 22:02:00 UTC,Pacific Time (US & Canada),research,https://www.inaturalist.org/observations/23071162,https://inaturalist-open-data.s3.amazonaws.com/photos/35766652/medium.jpeg,,1,0,FALSE,"Alameda County, CA, USA",37.75328333,-122.1159067,,,,Alameda,western columbine,Aquilegia formosa,western columbine,Plantae,48244,Ranunculaceae,Aquilegia,Aquilegia formosa
23082812,4/24/19,2019-04-24 21:57:04 UTC,Pacific Time (US & Canada),research,https://www.inaturalist.org/observations/23082812,https://inaturalist-open-data.s3.amazonaws.com/photos/35784914/medium.jpeg,,1,0,FALSE,"Anthony Chabot Regional Park, Alameda County, US-CA, US",37.75324987,-122.1159241,10,,,Alameda,Trillium chloropetalum giganteum,Trillium chloropetalum giganteum,,Plantae,243295,Melanthiaceae,Trillium,Trillium chloropetalum
23082828,4/24/19,2019-04-24 21:58:31 UTC,Pacific Time (US & Canada),research,https://www.inaturalist.org/observations/23082828,https://inaturalist-open-data.s3.amazonaws.com/photos/35784944/medium.jpeg,,3,0,FALSE,"Anthony Chabot Regional Park, Alameda County, US-CA, US",37.7533266,-122.1158238,9,,,Alameda,western columbine,Aquilegia formosa,western columbine,Plantae,48244,Ranunculaceae,Aquilegia,Aquilegia formosa
23082863,4/24/19,2019-04-24 22:32:51 UTC,Pacific Time (US & Canada),research,https://www.inaturalist.org/observations/23082863,https://inaturalist-open-data.s3.amazonaws.com/photos/35784984/medium.jpeg,,2,0,FALSE,"Anthony Chabot Regional Park, Alameda County, US-CA, US",37.74288439,-122.1131663,7,,,Alameda,California bay,Umbellularia californica,California bay,Plantae,48807,Lauraceae,Umbellularia,Umbellularia californica
23082882,4/24/19,2019-04-24 22:35:13 UTC,Pacific Time (US & Canada),research,https://www.inaturalist.org/observations/23082882,https://inaturalist-open-data.s3.amazonaws.com/photos/35785015/medium.jpeg,,1,0,FALSE,"Anthony Chabot Regional Park, Alameda County, US-CA, US",37.7428242,-122.1132228,10,,,Alameda,common ivy,Hedera helix,common ivy,Plantae,55882,Araliaceae,Hedera,Hedera helix
23082888,4/24/19,2019-04-24 22:37:34 UTC,Pacific Time (US & Canada),research,https://www.inaturalist.org/observations/23082888,https://inaturalist-open-data.s3.amazonaws.com/photos/35785030/medium.jpeg,,1,0,FALSE,"Anthony Chabot Regional Park, Alameda County, US-CA, US",37.74209921,-122.113516,9,,,Alameda,fringe cups,Tellima grandiflora,fringe cups,Plantae,51655,Saxifragaceae,Tellima,Tellima grandiflora
23082904,4/24/19,2019-04-24 22:47:51 UTC,Pacific Time (US & Canada),research,https://www.inaturalist.org/observations/23082904,https://inaturalist-open-data.s3.amazonaws.com/photos/35785047/medium.jpeg,,2,0,FALSE,"Anthony Chabot Regional Park, Alameda County, US-CA, US",37.73876398,-122.1148779,8,,,Alameda,White Globe Lily,Calochortus albus,White Globe Lily,Plantae,51315,Liliaceae,Calochortus,Calochortus albus
23082952,4/24/19,2019-04-24 22:58:08 UTC,Pacific Time (US & Canada),research,https://www.inaturalist.org/observations/23082952,https://inaturalist-open-data.s3.amazonaws.com/photos/35785179/medium.jpeg,,1,0,FALSE,"Anthony Chabot Regional Park, Alameda County, US-CA, US",37.73911704,-122.114169,9,,,Alameda,Pacific poison oak,Toxicodendron diversilobum,Pacific poison oak,Plantae,51080,Anacardiaceae,Toxicodendron,Toxicodendron diversilobum
23082960,4/24/19,2019-04-24 22:58:54 UTC,Pacific Time (US & Canada),research,https://www.inaturalist.org/observations/23082960,https://inaturalist-open-data.s3.amazonaws.com/photos/35785193/medium.jpeg,,1,0,FALSE,"Anthony Chabot Regional Park, Alameda County, US-CA, US",37.73906556,-122.1141266,9,,,Alameda,Common Snowberry,Symphoricarpos albus,Common Snowberry,Plantae,48523,Caprifoliaceae,Symphoricarpos,Symphoricarpos albus
23082969,4/24/19,2019-04-24 23:00:00 UTC,Pacific Time (US & Canada),research,https://www.inaturalist.org/observations/23082969,https://inaturalist-open-data.s3.amazonaws.com/photos/35785216/medium.jpeg,,1,0,FALSE,"Anthony Chabot Regional Park, Alameda County, US-CA, US",37.73910787,-122.1141128,8,,,Alameda,Ocean spray,Holodiscus discolor,Ocean spray,Plantae,53414,Rosaceae,Holodiscus,Holodiscus discolor
23083009,4/24/19,2019-04-24 23:06:30 UTC,Pacific Time (US & Canada),research,https://www.inaturalist.org/observations/23083009,https://inaturalist-open-data.s3.amazonaws.com/photos/35785307/medium.jpeg,,1,0,FALSE,"Anthony Chabot Regional Park, Alameda County, US-CA, US",37.739436,-122.1143519,9,,,Alameda,shade phacelia,Phacelia nemoralis,shade phacelia,Plantae,53173,Boraginaceae,Phacelia,Phacelia nemoralis
23083036,4/24/19,2019-04-24 23:09:17 UTC,Pacific Time (US & Canada),research,https://www.inaturalist.org/observations/23083036,https://inaturalist-open-data.s3.amazonaws.com/photos/35785366/medium.jpeg,,1,0,FALSE,"Anthony Chabot Regional Park, Alameda County, US-CA, US",37.73938026,-122.1144834,9,,,Alameda,orange bush monkeyflower,Diplacus aurantiacus,orange bush monkeyflower,Plantae,777371,Phrymaceae,Diplacus,Diplacus aurantiacus
23083069,4/24/19,2019-04-24 23:35:56 UTC,Pacific Time (US & Canada),research,https://www.inaturalist.org/observations/23083069,https://inaturalist-open-data.s3.amazonaws.com/photos/35785445/medium.jpeg,,1,0,FALSE,"Anthony Chabot Regional Park, Alameda County, US-CA, US",37.74088849,-122.1080502,9,,,Alameda,Rough-fruited buttercup,Ranunculus muricatus,Rough-fruited buttercup,Plantae,57240,Ranunculaceae,Ranunculus,Ranunculus muricatus
23083082,4/24/19,2019-04-24 23:37:15 UTC,Pacific Time (US & Canada),research,https://www.inaturalist.org/observations/23083082,https://inaturalist-open-data.s3.amazonaws.com/photos/35785475/medium.jpeg,,1,0,FALSE,"Anthony Chabot Regional Park, Alameda County, US-CA, US",37.74094837,-122.1081026,10,,,Alameda,Field madder,Sherardia arvensis,Field madder,Plantae,47691,Rubiaceae,Sherardia,Sherardia arvensis
23275484,4/26/19,2019-04-26 23:28:50 UTC,Pacific Time (US & Canada),research,https://www.inaturalist.org/observations/23275484,https://static.inaturalist.org/photos/36064969/medium.jpeg,,1,0,FALSE,"2600 Fairmont Dr, San Leandro, CA 94578, USA",37.71498871,-122.110733,,,Castro Valley,Alameda,lemon balm,Melissa officinalis,lemon balm,Plantae,59901,Lamiaceae,Melissa,Melissa officinalis
23276023,4/26/19,2019-04-26 23:27:29 UTC,Pacific Time (US & Canada),research,https://www.inaturalist.org/observations/23276023,https://static.inaturalist.org/photos/36065688/medium.jpeg,,1,0,FALSE,"2600 Fairmont Dr, San Leandro, CA 94578, USA",37.7150116,-122.110817,,,Castro Valley,Alameda,trailing blackberry,Rubus ursinus,trailing blackberry,Plantae,53445,Rosaceae,Rubus,Rubus ursinus
23276480,4/26/19,2019-04-26 23:21:21 UTC,Pacific Time (US & Canada),research,https://www.inaturalist.org/observations/23276480,https://static.inaturalist.org/photos/36066366/medium.jpeg,,1,0,FALSE,"Castro Valley, CA 94546, USA",37.71620948,-122.1105594,526,,Castro Valley,Alameda,Sun Cup,Taraxia ovata,Sun Cup,Plantae,68182,Onagraceae,Taraxia,Taraxia ovata
23276807,4/26/19,2019-04-26 23:07:53 UTC,Pacific Time (US & Canada),research,https://www.inaturalist.org/observations/23276807,https://static.inaturalist.org/photos/36066918/medium.jpeg,,2,0,FALSE,"17500 Lake Chabot Rd, Castro Valley, CA 94546, USA",37.72037506,-122.1156616,,,Castro Valley,Alameda,Ithuriel's Spear,Triteleia laxa,Ithuriel's Spear,Plantae,51085,Asparagaceae,Triteleia,Triteleia laxa
23276896,4/26/19,2019-04-26 23:05:22 UTC,Pacific Time (US & Canada),research,https://www.inaturalist.org/observations/23276896,https://static.inaturalist.org/photos/36067026/medium.jpeg,,2,0,FALSE,"Unnamed Road, Castro Valley, CA 94546, USA",37.72130585,-122.1164703,,,Castro Valley,Alameda,sweet fennel,Foeniculum vulgare,fennel,Plantae,53052,Apiaceae,Foeniculum,Foeniculum vulgare
23280207,4/26/19,2019-04-26 22:33:05 UTC,Pacific Time (US & Canada),research,https://www.inaturalist.org/observations/23280207,https://static.inaturalist.org/photos/36071753/medium.jpeg,,1,0,FALSE,"231 Lake Chabot Rd, Castro Valley, CA 94546, USA",37.71770096,-122.1112595,,,Castro Valley,Alameda,poison hemlock,Conium maculatum,poison hemlock,Plantae,52998,Apiaceae,Conium,Conium maculatum
23280351,4/26/19,2019-04-26 22:31:37 UTC,Pacific Time (US & Canada),research,https://www.inaturalist.org/observations/23280351,https://static.inaturalist.org/photos/36071975/medium.jpeg,,1,0,FALSE,"231 Lake Chabot Rd, Castro Valley, CA 94546, USA",37.71735764,-122.1116714,,,Castro Valley,Alameda,Dipterostemon capitatus,Dipterostemon capitatus,Blue Dicks,Plantae,1196784,Asparagaceae,Dipterostemon,Dipterostemon capitatus
23280758,4/26/19,2019-04-26 22:25:27 UTC,Pacific Time (US & Canada),research,https://www.inaturalist.org/observations/23280758,https://static.inaturalist.org/photos/36072588/medium.jpeg,,1,0,FALSE,"Unnamed Road, Castro Valley, CA 94546, USA",37.71625137,-122.1108856,,,Castro Valley,Alameda,wavy-leafed soap plant,Chlorogalum pomeridianum,wavy-leafed soap plant,Plantae,47597,Asparagaceae,Chlorogalum,Chlorogalum pomeridianum
23293964,4/26/19,2019-04-26 22:21:50 UTC,Pacific Time (US & Canada),research,https://www.inaturalist.org/observations/23293964,https://static.inaturalist.org/photos/36092929/medium.jpeg,,1,0,FALSE,"2604 Fairmont Dr, Castro Valley, CA 94546, USA",37.71538544,-122.1099091,,,Castro Valley,Alameda,scarlet pimpernel,Lysimachia arvensis,scarlet pimpernel,Plantae,791928,Primulaceae,Lysimachia,Lysimachia arvensis
23294282,4/26/19,2019-04-26 22:21:27 UTC,Pacific Time (US & Canada),research,https://www.inaturalist.org/observations/23294282,https://static.inaturalist.org/photos/36093082/medium.jpeg,,1,0,FALSE,"2604 Fairmont Dr, Castro Valley, CA 94546, USA",37.71538544,-122.1099091,,,Castro Valley,Alameda,orange bush monkeyflower,Diplacus aurantiacus,orange bush monkeyflower,Plantae,777371,Phrymaceae,Diplacus,Diplacus aurantiacus
23294360,4/26/19,2019-04-26 22:21:36 UTC,Pacific Time (US & Canada),research,https://www.inaturalist.org/observations/23294360,https://static.inaturalist.org/photos/36093216/medium.jpeg,,1,0,FALSE,"2604 Fairmont Dr, Castro Valley, CA 94546, USA",37.71538544,-122.1099091,,,Castro Valley,Alameda,coyote brush,Baccharis pilularis,coyote brush,Plantae,53359,Asteraceae,Baccharis,Baccharis pilularis
23294863,4/26/19,2019-04-26 22:21:02 UTC,Pacific Time (US & Canada),research,https://www.inaturalist.org/observations/23294863,https://static.inaturalist.org/photos/36093917/medium.jpeg,,1,0,FALSE,"2604 Fairmont Dr, Castro Valley, CA 94546, USA",37.71514511,-122.1098633,,,Castro Valley,Alameda,California bay,Umbellularia californica,California bay,Plantae,48807,Lauraceae,Umbellularia,Umbellularia californica
23295971,4/26/19,2019-04-26 22:23:18 UTC,Pacific Time (US & Canada),research,https://www.inaturalist.org/observations/23295971,https://static.inaturalist.org/photos/36095557/medium.jpeg,,1,0,FALSE,"Fairmont Dr, Castro Valley, CA 94546, USA",37.71556091,-122.1105652,,,Castro Valley,Alameda,pineapple-weed,Matricaria discoidea,pineapple-weed,Plantae,52992,Asteraceae,Matricaria,Matricaria discoidea
23296190,4/26/19,2019-04-26 22:15:45 UTC,Pacific Time (US & Canada),research,https://www.inaturalist.org/observations/23296190,https://static.inaturalist.org/photos/36095730/medium.jpeg,,1,0,FALSE,"2609 Fairmont Dr, Castro Valley, CA 94546, USA",37.71545792,-122.1093597,,,Castro Valley,Alameda,western blue-eyed grass,Sisyrinchium bellum,western blue-eyed grass,Plantae,49918,Iridaceae,Sisyrinchium,Sisyrinchium bellum
23296321,4/26/19,2019-04-26 22:13:27 UTC,Pacific Time (US & Canada),research,https://www.inaturalist.org/observations/23296321,https://static.inaturalist.org/photos/36096117/medium.jpeg,,1,0,FALSE,"2613 Fairmont Dr, Castro Valley, CA 94546, USA",37.71528244,-122.1092072,,,Castro Valley,Alameda,ribwort plantain,Plantago lanceolata,ribwort plantain,Plantae,53178,Plantaginaceae,Plantago,Plantago lanceolata
23296453,4/26/19,2019-04-26 22:13:40 UTC,Pacific Time (US & Canada),research,https://www.inaturalist.org/observations/23296453,https://static.inaturalist.org/photos/36096182/medium.jpeg,,1,0,FALSE,"2613 Fairmont Dr, Castro Valley, CA 94546, USA",37.71530914,-122.1092072,,,Castro Valley,Alameda,Lesser hop trefoil,Trifolium dubium,Lesser hop trefoil,Plantae,53313,Fabaceae,Trifolium,Trifolium dubium
23296481,4/26/19,2019-04-26 22:11:03 UTC,Pacific Time (US & Canada),research,https://www.inaturalist.org/observations/23296481,https://static.inaturalist.org/photos/36096227/medium.jpeg,,2,0,FALSE,"2609 Fairmont Dr, Castro Valley, CA 94546, USA",37.71508408,-122.1091766,,,Castro Valley,Alameda,Mediterranean Stork's-bill,Erodium botrys,Mediterranean Stork's-bill,Plantae,57090,Geraniaceae,Erodium,Erodium botrys
23296879,4/26/19,2019-04-26 22:05:19 UTC,Pacific Time (US & Canada),research,https://www.inaturalist.org/observations/23296879,https://static.inaturalist.org/photos/36096959/medium.jpeg,,1,0,FALSE,"2651 Fairmont Dr, Castro Valley, CA 94546, USA",37.71443176,-122.1079865,,,Castro Valley,Alameda,California poppy,Eschscholzia californica,California poppy,Plantae,48225,Papaveraceae,Eschscholzia,Eschscholzia californica
23300845,4/26/19,2019-04-26 23:13:14 UTC,Pacific Time (US & Canada),research,https://www.inaturalist.org/observations/23300845,https://static.inaturalist.org/photos/36103229/medium.jpeg,,1,0,FALSE,"2075 Fairmont Dr, Castro Valley, CA 94546, USA",37.71628984,-122.114103,263,,Castro Valley,Alameda,California sagebrush,Artemisia californica,California sagebrush,Plantae,53357,Asteraceae,Artemisia,Artemisia californica
23301932,4/26/19,2019-04-26 22:39:07 UTC,Pacific Time (US & Canada),research,https://www.inaturalist.org/observations/23301932,https://static.inaturalist.org/photos/36104934/medium.jpeg,,1,0,FALSE,"Unnamed Road, Castro Valley, CA 94546, USA",37.71579759,-122.1103298,526,,Castro Valley,Alameda,Shepherd's-needle,Scandix pecten-veneris,Shepherd's-needle,Plantae,56843,Apiaceae,Scandix,Scandix pecten-veneris
23360431,4/26/19,2019-04-26 21:59:55 UTC,Pacific Time (US & Canada),research,https://www.inaturalist.org/observations/23360431,https://static.inaturalist.org/photos/36187513/medium.jpeg,,1,0,FALSE,"2617 Fairmont Dr, Castro Valley, CA 94546, USA",37.71379852,-122.1083832,,,Castro Valley,Alameda,western blue-eyed grass,Sisyrinchium bellum,western blue-eyed grass,Plantae,49918,Iridaceae,Sisyrinchium,Sisyrinchium bellum
23360816,4/26/19,2019-04-26 22:01:09 UTC,Pacific Time (US & Canada),research,https://www.inaturalist.org/observations/23360816,https://static.inaturalist.org/photos/36188038/medium.jpeg,,1,0,FALSE,"2619 Fairmont Dr, Castro Valley, CA 94546, USA",37.71382523,-122.1083984,,,Castro Valley,Alameda,Italian thistle,Carduus pycnocephalus,Italian thistle,Plantae,52990,Asteraceae,Carduus,Carduus pycnocephalus
27051378,4/26/19,2019-04-26 18:02:54 UTC,Pacific Time (US & Canada),research,https://www.inaturalist.org/observations/27051378,https://static.inaturalist.org/photos/42048273/medium.jpg,,2,0,FALSE,"Anthony Chabot Regional Park, Castro Valley, CA, US",37.71075196,-122.1050687,8,,Castro Valley,Alameda,ribwort plantain,Plantago lanceolata,ribwort plantain,Plantae,53178,Plantaginaceae,Plantago,Plantago lanceolata
27167474,4/26/19,2019-04-26 18:11:17 UTC,Pacific Time (US & Canada),research,https://www.inaturalist.org/observations/27167474,https://static.inaturalist.org/photos/42240817/medium.jpg,,1,0,FALSE,"Anthony Chabot Regional Park, San Leandro, CA, US",37.7124834,-122.1084324,6,,Castro Valley,Alameda,narrowleaf mule-ears,Wyethia angustifolia,narrowleaf mule-ears,Plantae,56987,Asteraceae,Wyethia,Wyethia angustifolia
27167494,4/26/19,2019-04-26 18:02:24 UTC,Pacific Time (US & Canada),research,https://www.inaturalist.org/observations/27167494,https://static.inaturalist.org/photos/42240851/medium.jpg,,3,1,FALSE,"Anthony Chabot Regional Park, Castro Valley, CA, US",37.71080668,-122.1050274,6,,Castro Valley,Alameda,Italian thistle,Carduus pycnocephalus,Italian thistle,Plantae,52990,Asteraceae,Carduus,Carduus pycnocephalus
27167504,4/26/19,2019-04-26 18:01:15 UTC,Pacific Time (US & Canada),research,https://www.inaturalist.org/observations/27167504,https://static.inaturalist.org/photos/42240872/medium.jpg,,2,0,FALSE,"Anthony Chabot Regional Park, Castro Valley, CA, US",37.71102466,-122.1050398,6,,Castro Valley,Alameda,Salsify,Tragopogon porrifolius,purple salsify,Plantae,54141,Asteraceae,Tragopogon,Tragopogon porrifolius
23442953,4/27/19,2019-04-27 19:10:13 UTC,Pacific Time (US & Canada),research,https://www.inaturalist.org/observations/23442953,https://inaturalist-open-data.s3.amazonaws.com/photos/36304147/medium.jpg,,2,0,FALSE,"Anthony Chabot Regional Park, Castro Valley, CA, US",37.74191667,-122.1136028,8,,,Alameda,trailing blackberry,Rubus ursinus,trailing blackberry,Plantae,53445,Rosaceae,Rubus,Rubus ursinus
23917815,4/27/19,2019-04-27 20:20:55 UTC,Pacific Time (US & Canada),research,https://www.inaturalist.org/observations/23917815,https://inaturalist-open-data.s3.amazonaws.com/photos/37002757/medium.jpg,,1,0,FALSE,"Anthony Chabot Regional Park, Castro Valley, CA, US",37.73908193,-122.0981418,6,,,Alameda,California poppy,Eschscholzia californica,California poppy,Plantae,48225,Papaveraceae,Eschscholzia,Eschscholzia californica
23923382,4/27/19,2019-04-27 20:27:10 UTC,Pacific Time (US & Canada),research,https://www.inaturalist.org/observations/23923382,https://inaturalist-open-data.s3.amazonaws.com/photos/37010489/medium.jpg,,1,0,FALSE,"Anthony Chabot Regional Park, Castro Valley, CA, US",37.73916259,-122.0983834,6,,,Alameda,Sun Cup,Taraxia ovata,Sun Cup,Plantae,68182,Onagraceae,Taraxia,Taraxia ovata
23923631,4/27/19,2019-04-27 20:28:07 UTC,Pacific Time (US & Canada),research,https://www.inaturalist.org/observations/23923631,https://inaturalist-open-data.s3.amazonaws.com/photos/37010782/medium.jpg,,1,0,FALSE,"Anthony Chabot Regional Park, Castro Valley, CA, US",37.73920222,-122.0983684,4,,,Alameda,coyote brush,Baccharis pilularis,coyote brush,Plantae,53359,Asteraceae,Baccharis,Baccharis pilularis
23923763,4/27/19,2019-04-27 20:29:19 UTC,Pacific Time (US & Canada),research,https://www.inaturalist.org/observations/23923763,https://inaturalist-open-data.s3.amazonaws.com/photos/37011038/medium.jpg,,1,0,FALSE,"Anthony Chabot Regional Park, Castro Valley, CA, US",37.73921869,-122.0983529,4,,,Alameda,orange bush monkeyflower,Diplacus aurantiacus,orange bush monkeyflower,Plantae,777371,Phrymaceae,Diplacus,Diplacus aurantiacus
23924100,4/27/19,2019-04-27 20:31:21 UTC,Pacific Time (US & Canada),research,https://www.inaturalist.org/observations/23924100,https://inaturalist-open-data.s3.amazonaws.com/photos/37011381/medium.jpg,,1,0,FALSE,"Anthony Chabot Regional Park, Castro Valley, CA, US",37.73924606,-122.0982586,4,,,Alameda,Pacific poison oak,Toxicodendron diversilobum,Pacific poison oak,Plantae,51080,Anacardiaceae,Toxicodendron,Toxicodendron diversilobum
23924445,4/27/19,2019-04-27 20:33:01 UTC,Pacific Time (US & Canada),research,https://www.inaturalist.org/observations/23924445,https://inaturalist-open-data.s3.amazonaws.com/photos/37011816/medium.jpg,,2,0,FALSE,"Anthony Chabot Regional Park, Castro Valley, CA, US",37.73926336,-122.0982793,4,,,Alameda,California manroot,Marah fabacea,California manroot,Plantae,205330,Cucurbitaceae,Marah,Marah fabacea
23924940,4/27/19,2019-04-27 20:36:59 UTC,Pacific Time (US & Canada),research,https://www.inaturalist.org/observations/23924940,https://inaturalist-open-data.s3.amazonaws.com/photos/37012179/medium.jpg,,1,0,FALSE,"Anthony Chabot Regional Park, Castro Valley, CA, US",37.73886876,-122.0991364,6,,,Alameda,western blue-eyed grass,Sisyrinchium bellum,western blue-eyed grass,Plantae,49918,Iridaceae,Sisyrinchium,Sisyrinchium bellum
23925489,4/27/19,2019-04-27 20:42:22 UTC,Pacific Time (US & Canada),research,https://www.inaturalist.org/observations/23925489,https://inaturalist-open-data.s3.amazonaws.com/photos/37013048/medium.jpg,,1,0,FALSE,"Anthony Chabot Regional Park, Castro Valley, CA, US",37.7388841,-122.0999504,6,,,Alameda,coast live oak,Quercus agrifolia,coast live oak,Plantae,47850,Fagaceae,Quercus,Quercus agrifolia
23925995,4/27/19,2019-04-27 20:43:49 UTC,Pacific Time (US & Canada),research,https://www.inaturalist.org/observations/23925995,https://inaturalist-open-data.s3.amazonaws.com/photos/37013698/medium.jpg,,2,0,FALSE,"Anthony Chabot Regional Park, Castro Valley, CA, US",37.73891077,-122.0998675,6,,,Alameda,ribwort plantain,Plantago lanceolata,ribwort plantain,Plantae,53178,Plantaginaceae,Plantago,Plantago lanceolata
23935140,4/27/19,2019-04-27 21:25:40 UTC,Pacific Time (US & Canada),research,https://www.inaturalist.org/observations/23935140,https://inaturalist-open-data.s3.amazonaws.com/photos/37026743/medium.jpg,,1,0,FALSE,"Anthony Chabot Regional Park, Castro Valley, CA, US",37.73861982,-122.1056667,32,,,Alameda,Rough-fruited buttercup,Ranunculus muricatus,Rough-fruited buttercup,Plantae,57240,Ranunculaceae,Ranunculus,Ranunculus muricatus
23935794,4/27/19,2019-04-27 21:31:02 UTC,Pacific Time (US & Canada),research,https://www.inaturalist.org/observations/23935794,https://inaturalist-open-data.s3.amazonaws.com/photos/37027431/medium.jpg,,2,0,FALSE,"Anthony Chabot Regional Park, Castro Valley, CA, US",37.73853326,-122.1073014,74,,,Alameda,Armenian Blackberry,Rubus armeniacus,Armenian Blackberry,Plantae,61317,Rosaceae,Rubus,Rubus armeniacus
23937088,4/27/19,2019-04-27 21:36:50 UTC,Pacific Time (US & Canada),research,https://www.inaturalist.org/observations/23937088,https://inaturalist-open-data.s3.amazonaws.com/photos/37029272/medium.jpg,,1,0,FALSE,"Anthony Chabot Regional Park, Castro Valley, CA, US",37.73842048,-122.1081689,48,,,Alameda,Pacific pea,Lathyrus vestitus,Pacific pea,Plantae,50320,Fabaceae,Lathyrus,Lathyrus vestitus
23937951,4/27/19,2019-04-27 21:38:21 UTC,Pacific Time (US & Canada),research,https://www.inaturalist.org/observations/23937951,https://inaturalist-open-data.s3.amazonaws.com/photos/37030442/medium.jpg,,1,0,FALSE,"Anthony Chabot Regional Park, Castro Valley, CA, US",37.73842266,-122.1081891,12,,,Alameda,Ocean spray,Holodiscus discolor,Ocean spray,Plantae,53414,Rosaceae,Holodiscus,Holodiscus discolor
23938355,4/27/19,2019-04-27 21:40:27 UTC,Pacific Time (US & Canada),research,https://www.inaturalist.org/observations/23938355,https://inaturalist-open-data.s3.amazonaws.com/photos/37030961/medium.jpg,,1,0,FALSE,"Lake Chabot Golf Course, Oakland, CA, US",37.73811386,-122.1078779,48,,,Alameda,milkmaids,Cardamine californica,milkmaids,Plantae,49651,Brassicaceae,Cardamine,Cardamine californica
23939091,4/27/19,2019-04-27 21:49:16 UTC,Pacific Time (US & Canada),research,https://www.inaturalist.org/observations/23939091,https://inaturalist-open-data.s3.amazonaws.com/photos/37032272/medium.jpg,,1,0,FALSE,"Anthony Chabot Regional Park, Castro Valley, CA, US",37.73738315,-122.1095245,32,,,Alameda,wavy-leafed soap plant,Chlorogalum pomeridianum,wavy-leafed soap plant,Plantae,47597,Asparagaceae,Chlorogalum,Chlorogalum pomeridianum
23939536,4/27/19,2019-04-27 21:49:37 UTC,Pacific Time (US & Canada),research,https://www.inaturalist.org/observations/23939536,https://inaturalist-open-data.s3.amazonaws.com/photos/37032815/medium.jpg,,2,0,FALSE,"Anthony Chabot Regional Park, Castro Valley, CA, US",37.73732258,-122.1096809,8,,,Alameda,Common Vetch,Vicia sativa,Common Vetch,Plantae,53324,Fabaceae,Vicia,Vicia sativa
23939797,4/27/19,2019-04-27 21:49:59 UTC,Pacific Time (US & Canada),research,https://www.inaturalist.org/observations/23939797,https://inaturalist-open-data.s3.amazonaws.com/photos/37033295/medium.jpg,,1,0,FALSE,"Anthony Chabot Regional Park, Castro Valley, CA, US",37.7372611,-122.109644,6,,,Alameda,orange bush monkeyflower,Diplacus aurantiacus,orange bush monkeyflower,Plantae,777371,Phrymaceae,Diplacus,Diplacus aurantiacus
23940047,4/27/19,2019-04-27 21:50:22 UTC,Pacific Time (US & Canada),research,https://www.inaturalist.org/observations/23940047,https://inaturalist-open-data.s3.amazonaws.com/photos/37033630/medium.jpg,,1,0,FALSE,"Anthony Chabot Regional Park, Castro Valley, CA, US",37.73726403,-122.1096389,6,,,Alameda,western blue-eyed grass,Sisyrinchium bellum,western blue-eyed grass,Plantae,49918,Iridaceae,Sisyrinchium,Sisyrinchium bellum
23940322,4/27/19,2019-04-27 21:50:42 UTC,Pacific Time (US & Canada),research,https://www.inaturalist.org/observations/23940322,https://inaturalist-open-data.s3.amazonaws.com/photos/37034717/medium.jpg,,1,0,FALSE,"Anthony Chabot Regional Park, Castro Valley, CA, US",37.7372527,-122.1096694,6,,,Alameda,wavy-leafed soap plant,Chlorogalum pomeridianum,wavy-leafed soap plant,Plantae,47597,Asparagaceae,Chlorogalum,Chlorogalum pomeridianum
23941022,4/27/19,2019-04-27 21:51:55 UTC,Pacific Time (US & Canada),research,https://www.inaturalist.org/observations/23941022,https://inaturalist-open-data.s3.amazonaws.com/photos/37035192/medium.jpg,,1,0,FALSE,"Anthony Chabot Regional Park, Castro Valley, CA, US",37.7371522,-122.1093849,32,,,Alameda,coyote brush,Baccharis pilularis,coyote brush,Plantae,53359,Asteraceae,Baccharis,Baccharis pilularis
23941252,4/27/19,2019-04-27 21:52:14 UTC,Pacific Time (US & Canada),research,https://www.inaturalist.org/observations/23941252,https://inaturalist-open-data.s3.amazonaws.com/photos/37035473/medium.jpg,,1,0,FALSE,"Anthony Chabot Regional Park, Castro Valley, CA, US",37.73711117,-122.1095344,8,,,Alameda,Blue Dicks,Dipterostemon capitatus,Blue Dicks,Plantae,1196784,Asparagaceae,Dipterostemon,Dipterostemon capitatus
23714178,4/28/19,2019-04-28 19:35:10 UTC,Pacific Time (US & Canada),research,https://www.inaturalist.org/observations/23714178,https://inaturalist-open-data.s3.amazonaws.com/photos/36699750/medium.jpg,,1,0,FALSE,"Anthony Chabot Regional Park, Castro Valley, CA, US",37.71732,-122.1046667,340,,Castro Valley,Alameda,western blue-eyed grass,Sisyrinchium bellum,western blue-eyed grass,Plantae,49918,Iridaceae,Sisyrinchium,Sisyrinchium bellum
23714405,4/28/19,2019-04-28 18:52:38 UTC,Pacific Time (US & Canada),research,https://www.inaturalist.org/observations/23714405,https://inaturalist-open-data.s3.amazonaws.com/photos/36699910/medium.jpg,,0,0,FALSE,"Anthony Chabot Regional Park, Oakland, CA, US",37.74022,-122.1158445,16,,Oakland,Alameda,Blue Dicks,Dipterostemon capitatus,Blue Dicks,Plantae,1196784,Asparagaceae,Dipterostemon,Dipterostemon capitatus
23714678,4/28/19,2019-04-28 18:51:33 UTC,Pacific Time (US & Canada),research,https://www.inaturalist.org/observations/23714678,https://inaturalist-open-data.s3.amazonaws.com/photos/36700327/medium.jpg,,1,0,FALSE,"Anthony Chabot Regional Park, Oakland, CA, US",37.74017,-122.1158528,16,,Oakland,Alameda,White Globe Lily,Calochortus albus,White Globe Lily,Plantae,51315,Liliaceae,Calochortus,Calochortus albus
23836859,4/28/19,2019-04-28 20:01:50 UTC,Pacific Time (US & Canada),research,https://www.inaturalist.org/observations/23836859,https://static.inaturalist.org/photos/36884578/medium.jpg,,1,0,FALSE,"Lake Chabot Regional Park, Castro Valley, CA, US",37.72702833,-122.0970167,8,,Castro Valley,Alameda,Fiesta Flower,Pholistoma auritum,Fiesta Flower,Plantae,55437,Boraginaceae,Pholistoma,Pholistoma auritum
23837139,4/28/19,2019-04-28 20:14:55 UTC,Pacific Time (US & Canada),research,https://www.inaturalist.org/observations/23837139,https://static.inaturalist.org/photos/36884929/medium.jpg,,2,0,FALSE,"Lake Chabot Regional Park, Castro Valley, CA, US",37.72568,-122.1018305,6,,Castro Valley,Alameda,White Globe Lily,Calochortus albus,White Globe Lily,Plantae,51315,Liliaceae,Calochortus,Calochortus albus
23837309,4/28/19,2019-04-28 20:18:10 UTC,Pacific Time (US & Canada),research,https://www.inaturalist.org/observations/23837309,https://static.inaturalist.org/photos/36885246/medium.jpg,,1,0,FALSE,"Lake Chabot Regional Park, Castro Valley, CA, US",37.72433333,-122.10315,6,,Castro Valley,Alameda,western blue-eyed grass,Sisyrinchium bellum,western blue-eyed grass,Plantae,49918,Iridaceae,Sisyrinchium,Sisyrinchium bellum
23951645,4/28/19,2019-04-28 21:09:48 UTC,Pacific Time (US & Canada),research,https://www.inaturalist.org/observations/23951645,https://inaturalist-open-data.s3.amazonaws.com/photos/37051095/medium.jpg,,1,0,FALSE,"5183 Parkridge Dr, Oakland, CA, US",37.79267786,-122.1421488,24,,,Alameda,common cowparsnip,Heracleum maximum,common cowparsnip,Plantae,53094,Apiaceae,Heracleum,Heracleum maximum
23952578,4/28/19,2019-04-28 21:14:37 UTC,Pacific Time (US & Canada),research,https://www.inaturalist.org/observations/23952578,https://inaturalist-open-data.s3.amazonaws.com/photos/37052114/medium.jpg,,2,0,FALSE,"5183 Parkridge Dr, Oakland, CA, US",37.79271961,-122.1422082,16,,,Alameda,trailing blackberry,Rubus ursinus,trailing blackberry,Plantae,53445,Rosaceae,Rubus,Rubus ursinus
23952871,4/28/19,2019-04-28 21:17:08 UTC,Pacific Time (US & Canada),research,https://www.inaturalist.org/observations/23952871,https://inaturalist-open-data.s3.amazonaws.com/photos/37052548/medium.jpg,,1,0,FALSE,"Anthony Chabot Regional Park, Oakland, CA, US",37.79236079,-122.1424342,32,,,Alameda,coast live oak,Quercus agrifolia,coast live oak,Plantae,47850,Fagaceae,Quercus,Quercus agrifolia
23953175,4/28/19,2019-04-28 21:21:18 UTC,Pacific Time (US & Canada),research,https://www.inaturalist.org/observations/23953175,https://inaturalist-open-data.s3.amazonaws.com/photos/37053058/medium.jpg,,1,0,FALSE,"5184 Parkridge Dr, Oakland, CA, US",37.79215467,-122.1423803,6,,,Alameda,Mediterranean Stork's-bill,Erodium botrys,Mediterranean Stork's-bill,Plantae,57090,Geraniaceae,Erodium,Erodium botrys
23953321,4/28/19,2019-04-28 21:23:47 UTC,Pacific Time (US & Canada),research,https://www.inaturalist.org/observations/23953321,https://inaturalist-open-data.s3.amazonaws.com/photos/37053618/medium.jpg,,2,0,FALSE,"Anthony Chabot Regional Park, Oakland, CA, US",37.79221964,-122.1420213,24,,,Alameda,Small-flowered Catchfly,Silene gallica,Small-flowered Catchfly,Plantae,53212,Caryophyllaceae,Silene,Silene gallica
23953836,4/28/19,2019-04-28 21:27:34 UTC,Pacific Time (US & Canada),research,https://www.inaturalist.org/observations/23953836,https://inaturalist-open-data.s3.amazonaws.com/photos/37054073/medium.jpg,,1,0,FALSE,"Anthony Chabot Regional Park, Oakland, CA, US",37.79164427,-122.1421101,16,,,Alameda,Sun Cup,Taraxia ovata,Sun Cup,Plantae,68182,Onagraceae,Taraxia,Taraxia ovata
23954288,4/28/19,2019-04-28 21:45:41 UTC,Pacific Time (US & Canada),research,https://www.inaturalist.org/observations/23954288,https://inaturalist-open-data.s3.amazonaws.com/photos/37054645/medium.jpg,,1,0,FALSE,"Anthony Chabot Regional Park, Alameda County, US-CA, US",37.78817332,-122.1345521,16,,,Alameda,pineapple-weed,Matricaria discoidea,pineapple-weed,Plantae,52992,Asteraceae,Matricaria,Matricaria discoidea
23954636,4/28/19,2019-04-28 21:53:05 UTC,Pacific Time (US & Canada),research,https://www.inaturalist.org/observations/23954636,https://inaturalist-open-data.s3.amazonaws.com/photos/37055101/medium.jpg,,2,0,FALSE,"Anthony Chabot Regional Park, Oakland, CA, US",37.78878641,-122.1355395,8,,,Alameda,blue elder,Sambucus cerulea,blue elder,Plantae,143799,Viburnaceae,Sambucus,Sambucus cerulea
23954841,4/28/19,2019-04-28 21:54:08 UTC,Pacific Time (US & Canada),research,https://www.inaturalist.org/observations/23954841,https://inaturalist-open-data.s3.amazonaws.com/photos/37055781/medium.jpg,,1,0,FALSE,"Anthony Chabot Regional Park, Oakland, CA, US",37.78883179,-122.1354327,32,,,Alameda,Jimbrush,Ceanothus oliganthus sorediatus,Jimbrush,Plantae,53361,Rhamnaceae,Ceanothus,Ceanothus oliganthus
23955447,4/28/19,2019-04-28 21:55:34 UTC,Pacific Time (US & Canada),research,https://www.inaturalist.org/observations/23955447,https://inaturalist-open-data.s3.amazonaws.com/photos/37056077/medium.jpg,,1,0,FALSE,"Anthony Chabot Regional Park, Oakland, CA, US",37.78886423,-122.1355271,48,,,Alameda,California bay,Umbellularia californica,California bay,Plantae,48807,Lauraceae,Umbellularia,Umbellularia californica
23955661,4/28/19,2019-04-28 21:56:31 UTC,Pacific Time (US & Canada),research,https://www.inaturalist.org/observations/23955661,https://inaturalist-open-data.s3.amazonaws.com/photos/37056528/medium.jpg,,2,0,FALSE,"Anthony Chabot Regional Park, Oakland, CA, US",37.78888283,-122.1358187,24,,,Alameda,California manroot,Marah fabacea,California manroot,Plantae,205330,Cucurbitaceae,Marah,Marah fabacea
23956176,4/28/19,2019-04-28 21:58:44 UTC,Pacific Time (US & Canada),research,https://www.inaturalist.org/observations/23956176,https://inaturalist-open-data.s3.amazonaws.com/photos/37057015/medium.jpg,,1,0,FALSE,"Anthony Chabot Regional Park, Oakland, CA, US",37.78892708,-122.1359615,8,,,Alameda,Pacific poison oak,Toxicodendron diversilobum,Pacific poison oak,Plantae,51080,Anacardiaceae,Toxicodendron,Toxicodendron diversilobum
23956312,4/28/19,2019-04-28 21:59:03 UTC,Pacific Time (US & Canada),research,https://www.inaturalist.org/observations/23956312,https://inaturalist-open-data.s3.amazonaws.com/photos/37057316/medium.jpg,,1,0,FALSE,"Anthony Chabot Regional Park, Oakland, CA, US",37.78901934,-122.1359292,6,,,Alameda,miner's lettuce,Claytonia perfoliata,miner's lettuce,Plantae,52994,Montiaceae,Claytonia,Claytonia perfoliata
23956858,4/28/19,2019-04-28 22:02:03 UTC,Pacific Time (US & Canada),research,https://www.inaturalist.org/observations/23956858,https://inaturalist-open-data.s3.amazonaws.com/photos/37057970/medium.jpg,,1,0,FALSE,"Anthony Chabot Regional Park, Oakland, CA, US",37.78984137,-122.1359903,96,,,Alameda,chamise,Adenostoma fasciculatum,chamise,Plantae,47146,Rosaceae,Adenostoma,Adenostoma fasciculatum
23956987,4/28/19,2019-04-28 22:02:55 UTC,Pacific Time (US & Canada),research,https://www.inaturalist.org/observations/23956987,https://inaturalist-open-data.s3.amazonaws.com/photos/37058185/medium.jpg,,2,0,FALSE,"Anthony Chabot Regional Park, Oakland, CA, US",37.78958174,-122.1365161,6,,,Alameda,Brittleleaf Manzanita,Arctostaphylos crustacea,Brittleleaf Manzanita,Plantae,75507,Ericaceae,Arctostaphylos,Arctostaphylos crustacea
23957153,4/28/19,2019-04-28 22:03:19 UTC,Pacific Time (US & Canada),research,https://www.inaturalist.org/observations/23957153,https://inaturalist-open-data.s3.amazonaws.com/photos/37058442/medium.jpg,,1,0,FALSE,"Anthony Chabot Regional Park, Oakland, CA, US",37.78997714,-122.1368507,12,,,Alameda,orange bush monkeyflower,Diplacus aurantiacus,orange bush monkeyflower,Plantae,777371,Phrymaceae,Diplacus,Diplacus aurantiacus
23957316,4/28/19,2019-04-28 22:04:48 UTC,Pacific Time (US & Canada),research,https://www.inaturalist.org/observations/23957316,https://inaturalist-open-data.s3.amazonaws.com/photos/37058654/medium.jpg,,1,0,FALSE,"Anthony Chabot Regional Park, Oakland, CA, US",37.7900838,-122.1370456,24,,,Alameda,Blue Dicks,Dipterostemon capitatus,Blue Dicks,Plantae,1196784,Asparagaceae,Dipterostemon,Dipterostemon capitatus
23957772,4/28/19,2019-04-28 22:07:39 UTC,Pacific Time (US & Canada),research,https://www.inaturalist.org/observations/23957772,https://inaturalist-open-data.s3.amazonaws.com/photos/37060128/medium.jpg,,1,0,FALSE,"Anthony Chabot Regional Park, Oakland, CA, US",37.79053549,-122.1366316,64,,,Alameda,Pacific madrone,Arbutus menziesii,Pacific madrone,Plantae,51046,Ericaceae,Arbutus,Arbutus menziesii
23958350,4/28/19,2019-04-28 22:09:10 UTC,Pacific Time (US & Canada),research,https://www.inaturalist.org/observations/23958350,https://inaturalist-open-data.s3.amazonaws.com/photos/37060371/medium.jpg,,3,0,FALSE,"Anthony Chabot Regional Park, Oakland, CA, US",37.79029719,-122.1367699,6,,,Alameda,Indian Warrior,Pedicularis densiflora,Warrior's Plume,Plantae,49645,Orobanchaceae,Pedicularis,Pedicularis densiflora
23958524,4/28/19,2019-04-28 22:12:31 UTC,Pacific Time (US & Canada),research,https://www.inaturalist.org/observations/23958524,https://inaturalist-open-data.s3.amazonaws.com/photos/37060726/medium.jpg,,2,0,FALSE,"Anthony Chabot Regional Park, Oakland, CA, US",37.79033852,-122.137614,8,,,Alameda,wall barley,Hordeum murinum,wall barley,Plantae,52796,Poaceae,Hordeum,Hordeum murinum
23958849,4/28/19,2019-04-28 22:12:56 UTC,Pacific Time (US & Canada),research,https://www.inaturalist.org/observations/23958849,https://inaturalist-open-data.s3.amazonaws.com/photos/37060921/medium.jpg,,0,0,FALSE,"Anthony Chabot Regional Park, Oakland, CA, US",37.79037192,-122.1376216,12,,,Alameda,Sheep's sorrel,Rumex acetosella,Sheep's sorrel,Plantae,53195,Polygonaceae,Rumex,Rumex acetosella
23959579,4/28/19,2019-04-28 22:15:24 UTC,Pacific Time (US & Canada),research,https://www.inaturalist.org/observations/23959579,https://inaturalist-open-data.s3.amazonaws.com/photos/37061847/medium.jpg,,2,0,FALSE,"Anthony Chabot Regional Park, Oakland, CA, US",37.79043515,-122.1379384,24,,,Alameda,Greater Quaking Grass,Briza maxima,Greater Quaking Grass,Plantae,57157,Poaceae,Briza,Briza maxima
23959743,4/28/19,2019-04-28 22:16:01 UTC,Pacific Time (US & Canada),research,https://www.inaturalist.org/observations/23959743,https://inaturalist-open-data.s3.amazonaws.com/photos/37062015/medium.jpg,,2,0,FALSE,"Anthony Chabot Regional Park, Oakland, CA, US",37.79049328,-122.1379773,24,,,Alameda,Little quaking-grass,Briza minor,Little quaking-grass,Plantae,57162,Poaceae,Briza,Briza minor
23960074,4/28/19,2019-04-28 22:24:23 UTC,Pacific Time (US & Canada),research,https://www.inaturalist.org/observations/23960074,https://inaturalist-open-data.s3.amazonaws.com/photos/37062376/medium.jpg,,1,0,FALSE,"Anthony Chabot Regional Park, Oakland, CA, US",37.79124947,-122.1431067,48,,,Alameda,common hawthorn,Crataegus monogyna,common hawthorn,Plantae,51147,Rosaceae,Crataegus,Crataegus monogyna
24329603,5/1/19,2019-05-01 23:47:00 UTC,Arizona,research,https://www.inaturalist.org/observations/24329603,https://inaturalist-open-data.s3.amazonaws.com/photos/37618555/medium.jpg,Anthony Chabot Regional Park,1,0,FALSE,"Alameda County, CA, USA",37.77264692,-122.1251833,629,,,Alameda,Three-cornered garlic,Allium triquetrum,Three-cornered garlic,Plantae,55505,Amaryllidaceae,Allium,Allium triquetrum
24329605,5/1/19,2019-05-01 23:47:00 UTC,Arizona,research,https://www.inaturalist.org/observations/24329605,https://inaturalist-open-data.s3.amazonaws.com/photos/37618568/medium.jpg,Anthony Chabot Regional Park,1,0,FALSE,"Alameda County, CA, USA",37.77264692,-122.1251833,629,,,Alameda,Common Cat's-ear,Hypochaeris radicata,Common Cat's-ear,Plantae,53104,Asteraceae,Hypochaeris,Hypochaeris radicata
24329606,5/1/19,2019-05-01 23:47:00 UTC,Arizona,research,https://www.inaturalist.org/observations/24329606,https://inaturalist-open-data.s3.amazonaws.com/photos/37618573/medium.jpg,Anthony Chabot Regional Park,0,0,FALSE,"Alameda County, CA, USA",37.77264692,-122.1251833,629,,,Alameda,Sheep's sorrel,Rumex acetosella,Sheep's sorrel,Plantae,53195,Polygonaceae,Rumex,Rumex acetosella
24329612,5/1/19,2019-05-01 23:47:00 UTC,Arizona,research,https://www.inaturalist.org/observations/24329612,https://inaturalist-open-data.s3.amazonaws.com/photos/37618583/medium.jpg,Anthony Chabot Regional Park,1,0,FALSE,"Alameda County, CA, USA",37.77264692,-122.1251833,629,,,Alameda,Fiesta Flower,Pholistoma auritum,Fiesta Flower,Plantae,55437,Boraginaceae,Pholistoma,Pholistoma auritum
24396274,5/2/19,2019-05-02 20:53:36 UTC,Pacific Time (US & Canada),research,https://www.inaturalist.org/observations/24396274,https://static.inaturalist.org/photos/37722188/medium.jpg,,1,0,FALSE,"Anthony Chabot Regional Park, Castro Valley, CA, US",37.72668646,-122.0918427,5,,Castro Valley,Alameda,Purple Sanicle,Sanicula bipinnatifida,Purple Sanicle,Plantae,56840,Apiaceae,Sanicula,Sanicula bipinnatifida
24639260,5/5/19,2019-05-06 00:29:13 UTC,Pacific Time (US & Canada),research,https://www.inaturalist.org/observations/24639260,https://inaturalist-open-data.s3.amazonaws.com/photos/38098704/medium.jpg,,1,0,FALSE,"Anthony Chabot Regional Park, Oakland, CA, US",37.79155,-122.1421805,5,,,Alameda,common cowparsnip,Heracleum maximum,common cowparsnip,Plantae,53094,Apiaceae,Heracleum,Heracleum maximum
24639418,5/5/19,2019-05-06 00:51:54 UTC,Pacific Time (US & Canada),research,https://www.inaturalist.org/observations/24639418,https://inaturalist-open-data.s3.amazonaws.com/photos/38147647/medium.jpg,,2,0,FALSE,"Anthony Chabot Regional Park, Oakland, CA, US",37.79534167,-122.1477362,5,,,Alameda,Pacific madrone,Arbutus menziesii,Pacific madrone,Plantae,51046,Ericaceae,Arbutus,Arbutus menziesii
24642729,5/5/19,2019-05-06 01:20:19 UTC,Pacific Time (US & Canada),research,https://www.inaturalist.org/observations/24642729,https://inaturalist-open-data.s3.amazonaws.com/photos/38104189/medium.jpg,,1,0,FALSE,"Anthony Chabot Regional Park, Oakland, CA, US",37.77431333,-122.1259612,16,,,Alameda,black locust,Robinia pseudoacacia,black locust,Plantae,56088,Fabaceae,Robinia,Robinia pseudoacacia
24642766,5/5/19,2019-05-06 01:26:45 UTC,Pacific Time (US & Canada),research,https://www.inaturalist.org/observations/24642766,https://inaturalist-open-data.s3.amazonaws.com/photos/38104268/medium.jpg,,1,0,FALSE,"Anthony Chabot Regional Park, Oakland, CA, US",37.77334167,-122.1279222,8,,,Alameda,common cowparsnip,Heracleum maximum,common cowparsnip,Plantae,53094,Apiaceae,Heracleum,Heracleum maximum
24642804,5/5/19,2019-05-06 01:17:58 UTC,Pacific Time (US & Canada),research,https://www.inaturalist.org/observations/24642804,https://inaturalist-open-data.s3.amazonaws.com/photos/38104375/medium.jpg,,1,0,FALSE,"Anthony Chabot Regional Park, Oakland, CA, US",37.77617833,-122.1263195,16,,,Alameda,twinberry honeysuckle,Lonicera involucrata,twinberry honeysuckle,Plantae,60881,Caprifoliaceae,Lonicera,Lonicera involucrata
24642890,5/5/19,2019-05-06 01:13:57 UTC,Pacific Time (US & Canada),research,https://www.inaturalist.org/observations/24642890,https://inaturalist-open-data.s3.amazonaws.com/photos/38104529/medium.jpg,,0,0,FALSE,"Anthony Chabot Regional Park, Oakland, CA, US",37.77845,-122.1287083,48,,,Alameda,San Francisco woodland-star,Lithophragma affine,San Francisco woodland-star,Plantae,50803,Saxifragaceae,Lithophragma,Lithophragma affine
24643101,5/5/19,2019-05-06 01:06:35 UTC,Pacific Time (US & Canada),research,https://www.inaturalist.org/observations/24643101,https://inaturalist-open-data.s3.amazonaws.com/photos/38104842/medium.jpg,,2,0,FALSE,"Anthony Chabot Regional Park, Oakland, CA, US",37.78242167,-122.1325,12,,,Alameda,Cardre  lainer,Dipsacus sativus,fuller's teasel,Plantae,53028,Caprifoliaceae,Dipsacus,Dipsacus sativus
24643182,5/5/19,2019-05-06 01:04:54 UTC,Pacific Time (US & Canada),research,https://www.inaturalist.org/observations/24643182,https://inaturalist-open-data.s3.amazonaws.com/photos/38105004/medium.jpg,,1,0,FALSE,"Anthony Chabot Regional Park, Oakland, CA, US",37.78251667,-122.1330417,8,,,Alameda,poison hemlock,Conium maculatum,poison hemlock,Plantae,52998,Apiaceae,Conium,Conium maculatum
24644391,5/5/19,2019-05-06 00:53:52 UTC,Pacific Time (US & Canada),research,https://www.inaturalist.org/observations/24644391,https://inaturalist-open-data.s3.amazonaws.com/photos/38106911/medium.jpg,,1,0,FALSE,"Anthony Chabot Regional Park, Oakland, CA, US",37.783675,-122.1354,6,,,Alameda,common yarrow,Achillea millefolium,common yarrow,Plantae,52821,Asteraceae,Achillea,Achillea millefolium
24645187,5/5/19,2019-05-06 00:56:28 UTC,Pacific Time (US & Canada),research,https://www.inaturalist.org/observations/24645187,https://inaturalist-open-data.s3.amazonaws.com/photos/38108149/medium.jpg,,0,0,FALSE,"Anthony Chabot Regional Park, Oakland, CA, US",37.78355833,-122.1353138,16,,,Alameda,Blue Dicks,Dipterostemon capitatus capitatus,,Plantae,1196824,Asparagaceae,Dipterostemon,Dipterostemon capitatus
24645278,5/5/19,2019-05-06 00:51:51 UTC,Pacific Time (US & Canada),research,https://www.inaturalist.org/observations/24645278,https://inaturalist-open-data.s3.amazonaws.com/photos/38108386/medium.jpg,,1,0,FALSE,"Anthony Chabot Regional Park, Oakland, CA, US",37.78357,-122.1357805,16,,,Alameda,Silver Hairgrass,Aira caryophyllea,Silver Hairgrass,Plantae,52694,Poaceae,Aira,Aira caryophyllea
24645437,5/5/19,2019-05-06 00:42:39 UTC,Pacific Time (US & Canada),research,https://www.inaturalist.org/observations/24645437,https://inaturalist-open-data.s3.amazonaws.com/photos/38108568/medium.jpg,,1,0,FALSE,"Anthony Chabot Regional Park, Oakland, CA, US",37.782825,-122.1372305,24,,,Alameda,fringe cups,Tellima grandiflora,fringe cups,Plantae,51655,Saxifragaceae,Tellima,Tellima grandiflora
24645488,5/5/19,2019-05-06 00:40:21 UTC,Pacific Time (US & Canada),research,https://www.inaturalist.org/observations/24645488,https://inaturalist-open-data.s3.amazonaws.com/photos/38108617/medium.jpg,,1,0,FALSE,"Anthony Chabot Regional Park, Oakland, CA, US",37.78286167,-122.1369167,32,,,Alameda,giant vetch,Vicia gigantea,giant vetch,Plantae,53322,Fabaceae,Vicia,Vicia gigantea
24645630,5/5/19,2019-05-06 00:36:10 UTC,Pacific Time (US & Canada),research,https://www.inaturalist.org/observations/24645630,https://inaturalist-open-data.s3.amazonaws.com/photos/38108942/medium.jpg,,2,0,FALSE,"Anthony Chabot Regional Park, Oakland, CA, US",37.78194167,-122.1369695,16,,,Alameda,star-flowered lily-of-the-valley,Maianthemum stellatum,star-flowered lily-of-the-valley,Plantae,53268,Asparagaceae,Maianthemum,Maianthemum stellatum
24645948,5/5/19,2019-05-06 00:29:38 UTC,Pacific Time (US & Canada),research,https://www.inaturalist.org/observations/24645948,https://inaturalist-open-data.s3.amazonaws.com/photos/38109400/medium.jpg,Variegated mutant.,1,0,FALSE,"Anthony Chabot Regional Park, Oakland, CA, US",37.78169667,-122.1367722,48,,,Alameda,trailing blackberry,Rubus ursinus,trailing blackberry,Plantae,53445,Rosaceae,Rubus,Rubus ursinus
24646081,5/5/19,2019-05-06 00:26:04 UTC,Pacific Time (US & Canada),research,https://www.inaturalist.org/observations/24646081,https://inaturalist-open-data.s3.amazonaws.com/photos/38109601/medium.jpg,,1,0,FALSE,"Anthony Chabot Regional Park, Oakland, CA, US",37.78122833,-122.1368167,8,,,Alameda,Pacific poison oak,Toxicodendron diversilobum,Pacific poison oak,Plantae,51080,Anacardiaceae,Toxicodendron,Toxicodendron diversilobum
24646115,5/5/19,2019-05-06 00:20:41 UTC,Pacific Time (US & Canada),research,https://www.inaturalist.org/observations/24646115,https://inaturalist-open-data.s3.amazonaws.com/photos/38109695/medium.jpg,,1,0,FALSE,"Anthony Chabot Regional Park, Oakland, CA, US",37.78033,-122.1350555,8,,,Alameda,Ookow,Dichelostemma congestum,Ookow,Plantae,56593,Asparagaceae,Dichelostemma,Dichelostemma congestum
24647189,5/5/19,2019-05-06 00:25:37 UTC,Pacific Time (US & Canada),research,https://www.inaturalist.org/observations/24647189,https://inaturalist-open-data.s3.amazonaws.com/photos/38111750/medium.jpg,,2,0,FALSE,"Anthony Chabot Regional Park, Oakland, CA, US",37.78127833,-122.1367638,48,,,Alameda,yerba buena,Clinopodium douglasii,yerba buena,Plantae,53203,Lamiaceae,Clinopodium,Clinopodium douglasii
24647199,5/5/19,2019-05-06 00:21:25 UTC,Pacific Time (US & Canada),research,https://www.inaturalist.org/observations/24647199,https://inaturalist-open-data.s3.amazonaws.com/photos/38111795/medium.jpg,,1,0,FALSE,"Anthony Chabot Regional Park, Oakland, CA, US",37.780555,-122.1353222,6,,,Alameda,forest scurfpea,Rupertia physodes,forest scurfpea,Plantae,53198,Fabaceae,Rupertia,Rupertia physodes
24647314,5/5/19,2019-05-06 00:11:10 UTC,Pacific Time (US & Canada),research,https://www.inaturalist.org/observations/24647314,https://inaturalist-open-data.s3.amazonaws.com/photos/38111920/medium.jpg,,1,0,FALSE,"Anthony Chabot Regional Park, Oakland, CA, US",37.77939167,-122.1353388,16,,,Alameda,Pacific ninebark,Physocarpus capitatus,Pacific ninebark,Plantae,57249,Rosaceae,Physocarpus,Physocarpus capitatus
24647399,5/5/19,2019-05-06 00:09:02 UTC,Pacific Time (US & Canada),research,https://www.inaturalist.org/observations/24647399,https://inaturalist-open-data.s3.amazonaws.com/photos/38112017/medium.jpg,,1,0,FALSE,"Anthony Chabot Regional Park, Oakland, CA, US",37.77922833,-122.1352083,16,,,Alameda,fringe cups,Tellima grandiflora,fringe cups,Plantae,51655,Saxifragaceae,Tellima,Tellima grandiflora
24649137,5/5/19,2019-05-05 18:22:19 UTC,Pacific Time (US & Canada),research,https://www.inaturalist.org/observations/24649137,https://inaturalist-open-data.s3.amazonaws.com/photos/38115256/medium.jpeg,,2,0,FALSE,"Brandon Trail, Castro Valley, CA 94552, USA",37.73991776,-122.094101,,,,Alameda,scarlet pimpernel,Lysimachia arvensis,scarlet pimpernel,Plantae,791928,Primulaceae,Lysimachia,Lysimachia arvensis
24649172,5/5/19,2019-05-05 18:16:13 UTC,Pacific Time (US & Canada),research,https://www.inaturalist.org/observations/24649172,https://inaturalist-open-data.s3.amazonaws.com/photos/38115312/medium.jpeg,,2,0,FALSE,"Towhee Trail, Castro Valley, CA 94552, USA",37.73879242,-122.0940247,,,,Alameda,Mediterranean lineseed,Bellardia trixago,Mediterranean lineseed,Plantae,51286,Orobanchaceae,Bellardia,Bellardia trixago
24649180,5/5/19,2019-05-05 18:16:53 UTC,Pacific Time (US & Canada),research,https://www.inaturalist.org/observations/24649180,https://inaturalist-open-data.s3.amazonaws.com/photos/38115340/medium.jpeg,,2,0,FALSE,"Towhee Trail, Castro Valley, CA 94552, USA",37.73925781,-122.0937729,,,,Alameda,poison hemlock,Conium maculatum,poison hemlock,Plantae,52998,Apiaceae,Conium,Conium maculatum
24649213,5/5/19,2019-05-06 00:04:20 UTC,Pacific Time (US & Canada),research,https://www.inaturalist.org/observations/24649213,https://inaturalist-open-data.s3.amazonaws.com/photos/38115403/medium.jpg,,2,0,FALSE,"14230 Skyline Blvd, Oakland, CA, US",37.77827833,-122.1344917,96,,Oakland,Alameda,yerba buena,Clinopodium douglasii,yerba buena,Plantae,53203,Lamiaceae,Clinopodium,Clinopodium douglasii
24649247,5/5/19,2019-05-06 00:03:26 UTC,Pacific Time (US & Canada),research,https://www.inaturalist.org/observations/24649247,https://inaturalist-open-data.s3.amazonaws.com/photos/38115447/medium.jpg,,1,0,FALSE,"Anthony Chabot Regional Park, Oakland, CA, US",37.77787,-122.1332945,1348,,,Alameda,Evergreen Huckleberry,Vaccinium ovatum,Evergreen Huckleberry,Plantae,48349,Ericaceae,Vaccinium,Vaccinium ovatum
24649935,5/5/19,2019-05-05 23:45:38 UTC,Pacific Time (US & Canada),research,https://www.inaturalist.org/observations/24649935,https://inaturalist-open-data.s3.amazonaws.com/photos/38116473/medium.jpg,,1,0,FALSE,"Anthony Chabot Regional Park, Oakland, CA, US",37.77453667,-122.1299972,8,,,Alameda,Ookow,Dichelostemma congestum,Ookow,Plantae,56593,Asparagaceae,Dichelostemma,Dichelostemma congestum
24650034,5/5/19,2019-05-05 23:40:24 UTC,Pacific Time (US & Canada),research,https://www.inaturalist.org/observations/24650034,https://inaturalist-open-data.s3.amazonaws.com/photos/38116726/medium.jpg,,2,0,FALSE,"Anthony Chabot Regional Park, Oakland, CA, US",37.774045,-122.1302945,12,,,Alameda,Ookow,Dichelostemma congestum,Ookow,Plantae,56593,Asparagaceae,Dichelostemma,Dichelostemma congestum
24669408,5/5/19,2019-05-06 00:55:28 UTC,Pacific Time (US & Canada),research,https://www.inaturalist.org/observations/24669408,https://inaturalist-open-data.s3.amazonaws.com/photos/38147579/medium.jpg,,2,0,FALSE,"Anthony Chabot Regional Park, Oakland, CA, US",37.796905,-122.1495667,5,,,Alameda,trailing blackberry,Rubus ursinus,trailing blackberry,Plantae,53445,Rosaceae,Rubus,Rubus ursinus
24669462,5/5/19,2019-05-06 01:03:50 UTC,Pacific Time (US & Canada),research,https://www.inaturalist.org/observations/24669462,https://inaturalist-open-data.s3.amazonaws.com/photos/38147665/medium.jpg,,1,0,FALSE,"Anthony Chabot Regional Park, Oakland, CA, US",37.79787,-122.1506417,5,,,Alameda,greater periwinkle,Vinca major,greater periwinkle,Plantae,53326,Apocynaceae,Vinca,Vinca major
25034805,5/5/19,2019-05-06 01:20:36 UTC,Pacific Time (US & Canada),research,https://www.inaturalist.org/observations/25034805,https://inaturalist-open-data.s3.amazonaws.com/photos/38737990/medium.jpg,,1,0,FALSE,"Anthony Chabot Regional Park, Oakland, CA, US",37.77434167,-122.1261278,24,,,Alameda,black locust,Robinia pseudoacacia,black locust,Plantae,56088,Fabaceae,Robinia,Robinia pseudoacacia
25034898,5/5/19,2019-05-06 01:00:31 UTC,Pacific Time (US & Canada),research,https://www.inaturalist.org/observations/25034898,https://inaturalist-open-data.s3.amazonaws.com/photos/38738104/medium.jpg,,1,0,FALSE,"Anthony Chabot Regional Park, Oakland, CA, US",37.78327167,-122.1348333,16,,,Alameda,Lesser hop trefoil,Trifolium dubium,Lesser hop trefoil,Plantae,53313,Fabaceae,Trifolium,Trifolium dubium
25034921,5/5/19,2019-05-06 00:59:03 UTC,Pacific Time (US & Canada),research,https://www.inaturalist.org/observations/25034921,https://inaturalist-open-data.s3.amazonaws.com/photos/38738147/medium.jpg,,1,0,FALSE,"Anthony Chabot Regional Park, Oakland, CA, US",37.78329167,-122.1351083,16,,,Alameda,Ookow,Dichelostemma congestum,Ookow,Plantae,56593,Asparagaceae,Dichelostemma,Dichelostemma congestum
25035021,5/5/19,2019-05-06 00:56:47 UTC,Pacific Time (US & Canada),research,https://www.inaturalist.org/observations/25035021,https://inaturalist-open-data.s3.amazonaws.com/photos/38738301/medium.jpg,,1,0,FALSE,"Anthony Chabot Regional Park, Oakland, CA, US",37.78363333,-122.1352083,8,,,Alameda,common yarrow,Achillea millefolium,common yarrow,Plantae,52821,Asteraceae,Achillea,Achillea millefolium
25035097,5/5/19,2019-05-06 00:53:59 UTC,Pacific Time (US & Canada),research,https://www.inaturalist.org/observations/25035097,https://inaturalist-open-data.s3.amazonaws.com/photos/38738441/medium.jpg,,2,0,FALSE,"Anthony Chabot Regional Park, Oakland, CA, US",37.7835,-122.1354362,8,,,Alameda,Ookow,Dichelostemma congestum,Ookow,Plantae,56593,Asparagaceae,Dichelostemma,Dichelostemma congestum
25035151,5/5/19,2019-05-06 00:44:23 UTC,Pacific Time (US & Canada),research,https://www.inaturalist.org/observations/25035151,https://inaturalist-open-data.s3.amazonaws.com/photos/38738540/medium.jpg,,1,0,FALSE,"Anthony Chabot Regional Park, Oakland, CA, US",37.782955,-122.1371612,12,,,Alameda,fringe cups,Tellima grandiflora,fringe cups,Plantae,51655,Saxifragaceae,Tellima,Tellima grandiflora
25035240,5/5/19,2019-05-06 00:40:51 UTC,Pacific Time (US & Canada),research,https://www.inaturalist.org/observations/25035240,https://inaturalist-open-data.s3.amazonaws.com/photos/38738725/medium.jpg,,1,0,FALSE,"Anthony Chabot Regional Park, Oakland, CA, US",37.782895,-122.1369555,6,,,Alameda,giant vetch,Vicia gigantea,giant vetch,Plantae,53322,Fabaceae,Vicia,Vicia gigantea
25035277,5/5/19,2019-05-06 00:39:11 UTC,Pacific Time (US & Canada),research,https://www.inaturalist.org/observations/25035277,https://inaturalist-open-data.s3.amazonaws.com/photos/38738789/medium.jpg,,1,0,FALSE,"Anthony Chabot Regional Park, Oakland, CA, US",37.78257,-122.1369388,8,,,Alameda,Evergreen Huckleberry,Vaccinium ovatum,Evergreen Huckleberry,Plantae,48349,Ericaceae,Vaccinium,Vaccinium ovatum
25148243,5/5/19,2019-05-06 00:31:47 UTC,Pacific Time (US & Canada),research,https://www.inaturalist.org/observations/25148243,https://inaturalist-open-data.s3.amazonaws.com/photos/38926186/medium.jpg,,1,0,FALSE,"Anthony Chabot Regional Park, Oakland, CA, US",37.781825,-122.1370555,8,,,Alameda,thimbleberry,Rubus parviflorus,thimbleberry,Plantae,51646,Rosaceae,Rubus,Rubus parviflorus
25148267,5/5/19,2019-05-06 00:26:30 UTC,Pacific Time (US & Canada),research,https://www.inaturalist.org/observations/25148267,https://inaturalist-open-data.s3.amazonaws.com/photos/38926201/medium.jpg,,1,0,FALSE,"Anthony Chabot Regional Park, Oakland, CA, US",37.78113833,-122.1367333,16,,,Alameda,California bee plant,Scrophularia californica,California beeplant,Plantae,50812,Scrophulariaceae,Scrophularia,Scrophularia californica
25148274,5/5/19,2019-05-06 00:25:13 UTC,Pacific Time (US & Canada),research,https://www.inaturalist.org/observations/25148274,https://inaturalist-open-data.s3.amazonaws.com/photos/38926211/medium.jpg,,1,0,FALSE,"Anthony Chabot Regional Park, Oakland, CA, US",37.781055,-122.1367805,6,,,Alameda,Wild strawberry,Fragaria vesca,woodland strawberry,Plantae,50298,Rosaceae,Fragaria,Fragaria vesca
25148287,5/5/19,2019-05-06 00:24:40 UTC,Pacific Time (US & Canada),research,https://www.inaturalist.org/observations/25148287,https://inaturalist-open-data.s3.amazonaws.com/photos/38926246/medium.jpg,,1,0,FALSE,"Anthony Chabot Regional Park, Oakland, CA, US",37.78069667,-122.13675,24,,,Alameda,common cowparsnip,Heracleum maximum,common cowparsnip,Plantae,53094,Apiaceae,Heracleum,Heracleum maximum
25148294,5/5/19,2019-05-06 00:23:36 UTC,Pacific Time (US & Canada),research,https://www.inaturalist.org/observations/25148294,https://inaturalist-open-data.s3.amazonaws.com/photos/38926258/medium.jpg,,1,0,FALSE,"Anthony Chabot Regional Park, Oakland, CA, US",37.78067833,-122.1361,64,,,Alameda,trailing blackberry,Rubus ursinus,trailing blackberry,Plantae,53445,Rosaceae,Rubus,Rubus ursinus
25148400,5/5/19,2019-05-06 00:12:25 UTC,Pacific Time (US & Canada),research,https://www.inaturalist.org/observations/25148400,https://inaturalist-open-data.s3.amazonaws.com/photos/38926446/medium.jpg,,1,0,FALSE,"Anthony Chabot Regional Park, Oakland, CA, US",37.77928667,-122.1353695,12,,,Alameda,Indian strawberry,Potentilla indica,mock strawberry,Plantae,243824,Rosaceae,Potentilla,Potentilla indica
25148420,5/5/19,2019-05-06 00:09:42 UTC,Pacific Time (US & Canada),research,https://www.inaturalist.org/observations/25148420,https://inaturalist-open-data.s3.amazonaws.com/photos/38926481/medium.jpg,,1,0,FALSE,"Anthony Chabot Regional Park, Oakland, CA, US",37.77931167,-122.1351555,12,,,Alameda,fringe cups,Tellima grandiflora,fringe cups,Plantae,51655,Saxifragaceae,Tellima,Tellima grandiflora
25148435,5/5/19,2019-05-06 00:02:10 UTC,Pacific Time (US & Canada),research,https://www.inaturalist.org/observations/25148435,https://inaturalist-open-data.s3.amazonaws.com/photos/38926504/medium.jpg,,1,0,FALSE,"Anthony Chabot Regional Park, Oakland, CA, US",37.77786667,-122.1332472,6,,,Alameda,ribwort plantain,Plantago lanceolata,ribwort plantain,Plantae,53178,Plantaginaceae,Plantago,Plantago lanceolata
25148527,5/5/19,2019-05-05 23:43:16 UTC,Pacific Time (US & Canada),research,https://www.inaturalist.org/observations/25148527,https://inaturalist-open-data.s3.amazonaws.com/photos/38926678/medium.jpg,,1,0,FALSE,"Anthony Chabot Regional Park, Oakland, CA, US",37.774325,-122.1303167,12,,,Alameda,Greater Quaking Grass,Briza maxima,Greater Quaking Grass,Plantae,57157,Poaceae,Briza,Briza maxima
25148567,5/5/19,2019-05-05 23:40:47 UTC,Pacific Time (US & Canada),research,https://www.inaturalist.org/observations/25148567,https://inaturalist-open-data.s3.amazonaws.com/photos/38926770/medium.jpg,,1,0,FALSE,"Anthony Chabot Regional Park, Oakland, CA, US",37.77427167,-122.1304778,16,,,Alameda,Rose Clover,Trifolium hirtum,Rose Clover,Plantae,57078,Fabaceae,Trifolium,Trifolium hirtum
25148589,5/5/19,2019-05-05 23:40:28 UTC,Pacific Time (US & Canada),research,https://www.inaturalist.org/observations/25148589,https://inaturalist-open-data.s3.amazonaws.com/photos/38926799/medium.jpg,,1,0,FALSE,"Anthony Chabot Regional Park, Oakland, CA, US",37.77421167,-122.130525,16,,,Alameda,Greater Quaking Grass,Briza maxima,Greater Quaking Grass,Plantae,57157,Poaceae,Briza,Briza maxima
25148595,5/5/19,2019-05-05 23:33:34 UTC,Pacific Time (US & Canada),research,https://www.inaturalist.org/observations/25148595,https://inaturalist-open-data.s3.amazonaws.com/photos/38926834/medium.jpg,,1,0,FALSE,"Anthony Chabot Regional Park, Oakland, CA, US",37.77341333,-122.1300138,6,,,Alameda,common cowparsnip,Heracleum maximum,common cowparsnip,Plantae,53094,Apiaceae,Heracleum,Heracleum maximum
26724289,5/5/19,2019-05-05 23:17:06 UTC,Pacific Time (US & Canada),research,https://www.inaturalist.org/observations/26724289,https://static.inaturalist.org/photos/41513389/medium.jpg,,1,0,FALSE,"Anthony Chabot Regional Park, Castro Valley, CA, US",37.7198,-122.1085888,61,,Castro Valley,Alameda,Armenian Blackberry,Rubus armeniacus,Armenian Blackberry,Plantae,61317,Rosaceae,Rubus,Rubus armeniacus
24686134,5/6/19,2019-05-06 19:34:29 UTC,Pacific Time (US & Canada),research,https://www.inaturalist.org/observations/24686134,https://static.inaturalist.org/photos/38174026/medium.jpg,,1,0,FALSE,"Lake Chabot Regional Park, Castro Valley, CA, US",37.72345683,-122.0931026,5,,Castro Valley,Alameda,bigleaf maple,Acer macrophyllum,bigleaf maple,Plantae,48227,Sapindaceae,Acer,Acer macrophyllum
24739367,5/7/19,2019-05-07 16:21:12 UTC,Pacific Time (US & Canada),research,https://www.inaturalist.org/observations/24739367,https://static.inaturalist.org/photos/38258405/medium.jpg,,1,0,FALSE,"Anthony Chabot Regional Park, Oakland, CA, US",37.75761124,-122.1164133,5,,,Alameda,Fiesta Flower,Pholistoma auritum,Fiesta Flower,Plantae,55437,Boraginaceae,Pholistoma,Pholistoma auritum
28617723,5/7/19,,UTC,research,https://www.inaturalist.org/observations/28617723,https://inaturalist-open-data.s3.amazonaws.com/photos/44622837/medium.jpeg,,1,0,FALSE,Castro Valley,37.72173,-122.1094445,,,Castro Valley,Alameda,Red Valerian,Centranthus ruber,Red Valerian,Plantae,57283,Caprifoliaceae,Centranthus,Centranthus ruber
27051288,5/8/19,2019-05-08 18:04:56 UTC,Pacific Time (US & Canada),research,https://www.inaturalist.org/observations/27051288,https://static.inaturalist.org/photos/42048101/medium.jpg,,1,0,FALSE,"Anthony Chabot Regional Park, Castro Valley, CA, US",37.71257848,-122.1035746,6,,Castro Valley,Alameda,Ithuriel's Spear,Triteleia laxa,Ithuriel's Spear,Plantae,51085,Asparagaceae,Triteleia,Triteleia laxa
24976657,5/11/19,2019-05-12 01:31:38 UTC,Pacific Time (US & Canada),research,https://www.inaturalist.org/observations/24976657,https://inaturalist-open-data.s3.amazonaws.com/photos/38642974/medium.jpg,,1,0,FALSE,"Anthony Chabot Regional Park, Oakland, CA, US",37.73466333,-122.1186833,96,,Oakland,Alameda,forest scurfpea,Rupertia physodes,forest scurfpea,Plantae,53198,Fabaceae,Rupertia,Rupertia physodes
24976707,5/11/19,2019-05-12 01:13:34 UTC,Pacific Time (US & Canada),research,https://www.inaturalist.org/observations/24976707,https://inaturalist-open-data.s3.amazonaws.com/photos/38643048/medium.jpg,,2,0,FALSE,"Anthony Chabot Regional Park, Oakland, CA, US",37.740405,-122.1156388,24,,Oakland,Alameda,White Globe Lily,Calochortus albus,White Globe Lily,Plantae,51315,Liliaceae,Calochortus,Calochortus albus
24976859,5/11/19,2019-05-12 01:03:26 UTC,Pacific Time (US & Canada),research,https://www.inaturalist.org/observations/24976859,https://inaturalist-open-data.s3.amazonaws.com/photos/38643258/medium.jpg,,1,0,FALSE,"Anthony Chabot Regional Park, Oakland, CA, US",37.744075,-122.1144722,8,,,Alameda,slender woolly-marbles,Psilocarphus tenellus,slender woolly-marbles,Plantae,53188,Asteraceae,Psilocarphus,Psilocarphus tenellus
24976885,5/11/19,2019-05-12 01:01:44 UTC,Pacific Time (US & Canada),research,https://www.inaturalist.org/observations/24976885,https://inaturalist-open-data.s3.amazonaws.com/photos/38643284/medium.jpg,,1,0,FALSE,"Lake Chabot Golf Course, Oakland, CA, US",37.74485,-122.1144945,8,,,Alameda,Silver Hairgrass,Aira caryophyllea,Silver Hairgrass,Plantae,52694,Poaceae,Aira,Aira caryophyllea
24976901,5/11/19,2019-05-12 01:01:30 UTC,Pacific Time (US & Canada),research,https://www.inaturalist.org/observations/24976901,https://inaturalist-open-data.s3.amazonaws.com/photos/38643310/medium.jpg,,1,0,FALSE,"Anthony Chabot Regional Park, Oakland, CA, US",37.74485333,-122.1144862,32,,,Alameda,Little quaking-grass,Briza minor,Little quaking-grass,Plantae,57162,Poaceae,Briza,Briza minor
24976939,5/11/19,2019-05-12 00:49:05 UTC,Pacific Time (US & Canada),research,https://www.inaturalist.org/observations/24976939,https://inaturalist-open-data.s3.amazonaws.com/photos/38643398/medium.jpg,,1,0,FALSE,"Anthony Chabot Regional Park, Castro Valley, CA, US",37.74744167,-122.1125638,8,,,Alameda,sticky cinquefoil,Drymocallis glandulosa,sticky cinquefoil,Plantae,76716,Rosaceae,Drymocallis,Drymocallis glandulosa
24979286,5/11/19,2019-05-12 00:38:08 UTC,Pacific Time (US & Canada),research,https://www.inaturalist.org/observations/24979286,https://inaturalist-open-data.s3.amazonaws.com/photos/38647429/medium.jpg,,2,0,FALSE,"Anthony Chabot Regional Park, Castro Valley, CA, US",37.74351333,-122.1127778,8,,,Alameda,spreading pellitory,Parietaria judaica,pellitory-of-the-wall,Plantae,57281,Urticaceae,Parietaria,Parietaria judaica
24979418,5/11/19,2019-05-12 00:35:41 UTC,Pacific Time (US & Canada),research,https://www.inaturalist.org/observations/24979418,https://inaturalist-open-data.s3.amazonaws.com/photos/38647680/medium.jpg,,1,0,FALSE,"Anthony Chabot Regional Park, Castro Valley, CA, US",37.74300333,-122.113,65,,,Alameda,common ivy,Hedera helix,common ivy,Plantae,55882,Araliaceae,Hedera,Hedera helix
24979454,5/11/19,2019-05-12 00:31:27 UTC,Pacific Time (US & Canada),research,https://www.inaturalist.org/observations/24979454,https://inaturalist-open-data.s3.amazonaws.com/photos/38647762/medium.jpg,,1,0,FALSE,"Anthony Chabot Regional Park, Oakland, CA, US",37.7412,-122.1143028,16,,,Alameda,fringe cups,Tellima grandiflora,fringe cups,Plantae,51655,Saxifragaceae,Tellima,Tellima grandiflora
24979483,5/11/19,2019-05-12 00:30:46 UTC,Pacific Time (US & Canada),research,https://www.inaturalist.org/observations/24979483,https://inaturalist-open-data.s3.amazonaws.com/photos/38647828/medium.jpg,,1,0,FALSE,"Anthony Chabot Regional Park, Oakland, CA, US",37.74252,-122.1147167,857,,,Alameda,Greater celandine,Chelidonium majus,Greater celandine,Plantae,55757,Papaveraceae,Chelidonium,Chelidonium majus
24979506,5/11/19,2019-05-12 00:29:53 UTC,Pacific Time (US & Canada),research,https://www.inaturalist.org/observations/24979506,https://inaturalist-open-data.s3.amazonaws.com/photos/38647899/medium.jpg,,1,0,FALSE,"Lake Chabot Golf Course, Oakland, CA, US",37.74807833,-122.1151195,1540,,,Alameda,Annual Honesty,Lunaria annua,Annual Honesty,Plantae,55886,Brassicaceae,Lunaria,Lunaria annua
24979550,5/11/19,2019-05-12 00:26:57 UTC,Pacific Time (US & Canada),research,https://www.inaturalist.org/observations/24979550,https://inaturalist-open-data.s3.amazonaws.com/photos/38647977/medium.jpg,,2,0,FALSE,"Anthony Chabot Regional Park, Oakland, CA, US",37.73983833,-122.1156917,24,,Oakland,Alameda,forest scurfpea,Rupertia physodes,forest scurfpea,Plantae,53198,Fabaceae,Rupertia,Rupertia physodes
24979587,5/11/19,2019-05-12 00:24:20 UTC,Pacific Time (US & Canada),research,https://www.inaturalist.org/observations/24979587,https://inaturalist-open-data.s3.amazonaws.com/photos/38648087/medium.jpg,,1,0,FALSE,"Anthony Chabot Regional Park, Oakland, CA, US",37.738275,-122.1159278,16,,Oakland,Alameda,Ookow,Dichelostemma congestum,Ookow,Plantae,56593,Asparagaceae,Dichelostemma,Dichelostemma congestum
24982287,5/11/19,2019-05-12 00:16:12 UTC,Pacific Time (US & Canada),research,https://www.inaturalist.org/observations/24982287,https://inaturalist-open-data.s3.amazonaws.com/photos/38652812/medium.jpg,,1,0,FALSE,"Anthony Chabot Regional Park, Oakland, CA, US",37.7375,-122.1164083,48,,Oakland,Alameda,forest scurfpea,Rupertia physodes,forest scurfpea,Plantae,53198,Fabaceae,Rupertia,Rupertia physodes
24982321,5/11/19,2019-05-12 00:14:13 UTC,Pacific Time (US & Canada),research,https://www.inaturalist.org/observations/24982321,https://inaturalist-open-data.s3.amazonaws.com/photos/38652831/medium.jpg,,1,0,FALSE,"Anthony Chabot Regional Park, Oakland, CA, US",37.73704167,-122.1164388,6,,Oakland,Alameda,common cowparsnip,Heracleum maximum,common cowparsnip,Plantae,53094,Apiaceae,Heracleum,Heracleum maximum
24982795,5/11/19,2019-05-12 00:03:15 UTC,Pacific Time (US & Canada),research,https://www.inaturalist.org/observations/24982795,https://inaturalist-open-data.s3.amazonaws.com/photos/38653466/medium.jpg,,1,0,FALSE,"Anthony Chabot Regional Park, Oakland, CA, US",37.73498,-122.1181945,16,,Oakland,Alameda,Pink Honeysuckle,Lonicera hispidula,Pink Honeysuckle,Plantae,53416,Caprifoliaceae,Lonicera,Lonicera hispidula
24982828,5/11/19,2019-05-12 00:00:37 UTC,Pacific Time (US & Canada),research,https://www.inaturalist.org/observations/24982828,https://inaturalist-open-data.s3.amazonaws.com/photos/38653547/medium.jpg,,2,0,FALSE,"Anthony Chabot Regional Park, Oakland, CA, US",37.734495,-122.1187138,8,,Oakland,Alameda,Ookow,Dichelostemma congestum,Ookow,Plantae,56593,Asparagaceae,Dichelostemma,Dichelostemma congestum
24982872,5/11/19,2019-05-11 23:59:16 UTC,Pacific Time (US & Canada),research,https://www.inaturalist.org/observations/24982872,https://inaturalist-open-data.s3.amazonaws.com/photos/38653605/medium.jpg,,1,0,FALSE,"Anthony Chabot Regional Park, Oakland, CA, US",37.73447833,-122.1187583,4,,Oakland,Alameda,forest scurfpea,Rupertia physodes,forest scurfpea,Plantae,53198,Fabaceae,Rupertia,Rupertia physodes
24983111,5/11/19,2019-05-11 23:44:13 UTC,Pacific Time (US & Canada),research,https://www.inaturalist.org/observations/24983111,https://inaturalist-open-data.s3.amazonaws.com/photos/38654049/medium.jpg,,2,0,FALSE,"Anthony Chabot Regional Park, Oakland, CA, US",37.73418,-122.1229083,128,,Oakland,Alameda,White Globe Lily,Calochortus albus,White Globe Lily,Plantae,51315,Liliaceae,Calochortus,Calochortus albus
25033795,5/11/19,2019-05-12 01:03:23 UTC,Pacific Time (US & Canada),research,https://www.inaturalist.org/observations/25033795,https://inaturalist-open-data.s3.amazonaws.com/photos/38736772/medium.jpg,,1,0,FALSE,"Anthony Chabot Regional Park, Oakland, CA, US",37.74396333,-122.1146,6,,,Alameda,Lathyrus tingitanus,Lathyrus tingitanus,Tangier Pea,Plantae,61821,Fabaceae,Lathyrus,Lathyrus tingitanus
25033820,5/11/19,2019-05-12 01:01:20 UTC,Pacific Time (US & Canada),research,https://www.inaturalist.org/observations/25033820,https://inaturalist-open-data.s3.amazonaws.com/photos/38736830/medium.jpg,,1,0,FALSE,"Lake Chabot Golf Course, Oakland, CA, US",37.74486667,-122.1145333,32,,,Alameda,Small-flowered Catchfly,Silene gallica,Small-flowered Catchfly,Plantae,53212,Caryophyllaceae,Silene,Silene gallica
25034251,5/11/19,2019-05-12 00:37:39 UTC,Pacific Time (US & Canada),research,https://www.inaturalist.org/observations/25034251,https://inaturalist-open-data.s3.amazonaws.com/photos/38737184/medium.jpg,,1,0,FALSE,"Anthony Chabot Regional Park, Castro Valley, CA, US",37.743225,-122.1131362,349,,,Alameda,California bee plant,Scrophularia californica,California beeplant,Plantae,50812,Scrophulariaceae,Scrophularia,Scrophularia californica
25034270,5/11/19,2019-05-12 00:36:23 UTC,Pacific Time (US & Canada),research,https://www.inaturalist.org/observations/25034270,https://inaturalist-open-data.s3.amazonaws.com/photos/38737244/medium.jpg,,2,0,FALSE,"Anthony Chabot Regional Park, Castro Valley, CA, US",37.743155,-122.1129917,24,,,Alameda,Stinking iris,Iris foetidissima,Stinking iris,Plantae,64331,Iridaceae,Iris,Iris foetidissima
25034382,5/11/19,2019-05-12 00:31:01 UTC,Pacific Time (US & Canada),research,https://www.inaturalist.org/observations/25034382,https://inaturalist-open-data.s3.amazonaws.com/photos/38737304/medium.jpg,,1,0,FALSE,"Anthony Chabot Regional Park, Oakland, CA, US",37.74094667,-122.114075,24,,,Alameda,Greater celandine,Chelidonium majus,Greater celandine,Plantae,55757,Papaveraceae,Chelidonium,Chelidonium majus
25034434,5/11/19,2019-05-12 00:20:02 UTC,Pacific Time (US & Canada),research,https://www.inaturalist.org/observations/25034434,https://inaturalist-open-data.s3.amazonaws.com/photos/38737408/medium.jpg,,2,0,FALSE,"Lake Chabot, Oakland, CA, US",37.737495,-122.1155862,16,,Oakland,Alameda,White Globe Lily,Calochortus albus,White Globe Lily,Plantae,51315,Liliaceae,Calochortus,Calochortus albus
25239372,5/11/19,2019-05-12 00:53:48 UTC,Pacific Time (US & Canada),research,https://www.inaturalist.org/observations/25239372,https://static.inaturalist.org/photos/39072463/medium.jpg,,1,0,FALSE,"Anthony Chabot Regional Park, San Leandro, CA, US",37.71907,-122.1124112,6,,Castro Valley,Alameda,Mediterranean lineseed,Bellardia trixago,Mediterranean lineseed,Plantae,51286,Orobanchaceae,Bellardia,Bellardia trixago
26724503,5/13/19,2019-05-14 02:49:56 UTC,Pacific Time (US & Canada),research,https://www.inaturalist.org/observations/26724503,https://static.inaturalist.org/photos/41513744/medium.jpg,,2,0,FALSE,"94577, Oakland, CA, US",37.73331167,-122.1234362,5,,Oakland,Alameda,orange bush monkeyflower,Diplacus aurantiacus,orange bush monkeyflower,Plantae,777371,Phrymaceae,Diplacus,Diplacus aurantiacus
25129374,5/14/19,2019-05-14 20:31:56 UTC,Pacific Time (US & Canada),research,https://www.inaturalist.org/observations/25129374,https://inaturalist-open-data.s3.amazonaws.com/photos/38893716/medium.jpg,,1,0,FALSE,"Anthony Chabot Regional Park, Castro Valley, CA, US",37.72395,-122.0858778,10,,Castro Valley,Alameda,small-leaf spiderwort,Tradescantia fluminensis,small-leaf spiderwort,Plantae,79382,Commelinaceae,Tradescantia,Tradescantia fluminensis
25141690,5/14/19,2019-05-15 01:16:57 UTC,Pacific Time (US & Canada),research,https://www.inaturalist.org/observations/25141690,https://static.inaturalist.org/photos/38914908/medium.jpg,,2,0,FALSE,"Lake Chabot Regional Park, Castro Valley, CA, US",37.72604667,-122.101525,32,,Castro Valley,Alameda,Indian teasel,Dipsacus sativus,fuller's teasel,Plantae,53028,Caprifoliaceae,Dipsacus,Dipsacus sativus
25142075,5/14/19,2019-05-15 00:51:34 UTC,Pacific Time (US & Canada),research,https://www.inaturalist.org/observations/25142075,https://static.inaturalist.org/photos/38915749/medium.jpg,,1,0,FALSE,"Lake Chabot Regional Park, Castro Valley, CA, US",37.726945,-122.0968862,32,,Castro Valley,Alameda,Pacific ninebark,Physocarpus capitatus,Pacific ninebark,Plantae,57249,Rosaceae,Physocarpus,Physocarpus capitatus
25142154,5/14/19,2019-05-15 00:44:48 UTC,Pacific Time (US & Canada),research,https://www.inaturalist.org/observations/25142154,https://static.inaturalist.org/photos/38916028/medium.jpg,,1,0,FALSE,"Lake Chabot Regional Park, Castro Valley, CA, US",37.72714667,-122.1012583,16,,Castro Valley,Alameda,White Globe Lily,Calochortus albus,White Globe Lily,Plantae,51315,Liliaceae,Calochortus,Calochortus albus
25142428,5/14/19,2019-05-15 00:39:54 UTC,Pacific Time (US & Canada),research,https://www.inaturalist.org/observations/25142428,https://static.inaturalist.org/photos/38916237/medium.jpg,,1,0,FALSE,"Lake Chabot Regional Park, Castro Valley, CA, US",37.72530333,-122.1020362,16,,Castro Valley,Alameda,Pacific poison oak,Toxicodendron diversilobum,Pacific poison oak,Plantae,51080,Anacardiaceae,Toxicodendron,Toxicodendron diversilobum
25284009,5/17/19,2019-05-17 21:06:07 UTC,Pacific Time (US & Canada),research,https://www.inaturalist.org/observations/25284009,https://static.inaturalist.org/photos/39144669/medium.jpeg,,2,0,FALSE,"Castro Valley, CA 94546, USA",37.71664047,-122.1099396,,,Castro Valley,Alameda,Yellow Mariposa Lily,Calochortus luteus,Yellow Mariposa Lily,Plantae,51077,Liliaceae,Calochortus,Calochortus luteus
25284327,5/17/19,2019-05-17 20:44:55 UTC,Pacific Time (US & Canada),research,https://www.inaturalist.org/observations/25284327,https://static.inaturalist.org/photos/39146737/medium.jpeg,,2,0,FALSE,"Castro Valley, CA 94546, USA",37.71437454,-122.1073608,,,Castro Valley,Alameda,False Hawkbit,Urospermum picroides,False Hawkbit,Plantae,59361,Asteraceae,Urospermum,Urospermum picroides
25284992,5/17/19,2019-05-17 20:48:11 UTC,Pacific Time (US & Canada),research,https://www.inaturalist.org/observations/25284992,https://static.inaturalist.org/photos/39146768/medium.jpeg,,2,0,FALSE,"Castro Valley, CA 94546, USA",37.71466827,-122.1080475,,,Castro Valley,Alameda,Ithuriel's Spear,Triteleia laxa,Ithuriel's Spear,Plantae,51085,Asparagaceae,Triteleia,Triteleia laxa
25293369,5/17/19,2019-05-17 23:50:58 UTC,Pacific Time (US & Canada),research,https://www.inaturalist.org/observations/25293369,https://inaturalist-open-data.s3.amazonaws.com/photos/39160406/medium.jpeg,A beautiful patch of needlegrass that is totally infiltrated by introduced forbs. I wonder if the bunchgrasses were planted...,1,0,FALSE,"Castro Valley, CA 94546, USA",37.71784424,-122.1113301,5,,Castro Valley,Alameda,purple needlegrass,Nassella pulchra,purple needlegrass,Plantae,165659,Poaceae,Nassella,Nassella pulchra
25293400,5/17/19,2019-05-17 23:55:00 UTC,Pacific Time (US & Canada),research,https://www.inaturalist.org/observations/25293400,https://inaturalist-open-data.s3.amazonaws.com/photos/39160462/medium.jpeg,,1,0,FALSE,"Castro Valley, CA 94546, USA",37.71794888,-122.1109765,4,,Castro Valley,Alameda,Mediterranean lineseed,Bellardia trixago,Mediterranean lineseed,Plantae,51286,Orobanchaceae,Bellardia,Bellardia trixago
25293405,5/17/19,2019-05-17 23:55:16 UTC,Pacific Time (US & Canada),research,https://www.inaturalist.org/observations/25293405,https://inaturalist-open-data.s3.amazonaws.com/photos/39160474/medium.jpeg,,1,0,FALSE,"Castro Valley, CA 94546, USA",37.7179962,-122.1109567,5,,Castro Valley,Alameda,Narrow-leaved clover,Trifolium angustifolium,Narrow-leaved clover,Plantae,69939,Fabaceae,Trifolium,Trifolium angustifolium
25293416,5/17/19,2019-05-17 23:59:52 UTC,Pacific Time (US & Canada),research,https://www.inaturalist.org/observations/25293416,https://inaturalist-open-data.s3.amazonaws.com/photos/39160483/medium.jpeg,"Big ol' fields of the stuff here, mostly gone to seed.",1,0,FALSE,"Castro Valley, CA 94546, USA",37.71877328,-122.111802,7,,Castro Valley,Alameda,False Hawkbit,Urospermum picroides,False Hawkbit,Plantae,59361,Asteraceae,Urospermum,Urospermum picroides
25293424,5/17/19,2019-05-18 00:05:22 UTC,Pacific Time (US & Canada),research,https://www.inaturalist.org/observations/25293424,https://inaturalist-open-data.s3.amazonaws.com/photos/39160505/medium.jpeg,,1,0,FALSE,"Castro Valley, CA 94546, USA",37.72029702,-122.1123762,7,,Castro Valley,Alameda,dot-seed plantain,Plantago erecta,dot-seed plantain,Plantae,53177,Plantaginaceae,Plantago,Plantago erecta
25293432,5/17/19,2019-05-18 00:09:30 UTC,Pacific Time (US & Canada),research,https://www.inaturalist.org/observations/25293432,https://inaturalist-open-data.s3.amazonaws.com/photos/39160518/medium.jpeg,,1,0,FALSE,"Castro Valley, CA 94546, USA",37.72033594,-122.1126363,7,,Castro Valley,Alameda,Ookow,Dichelostemma congestum,Ookow,Plantae,56593,Asparagaceae,Dichelostemma,Dichelostemma congestum
25293437,5/17/19,2019-05-18 00:11:47 UTC,Pacific Time (US & Canada),research,https://www.inaturalist.org/observations/25293437,https://inaturalist-open-data.s3.amazonaws.com/photos/39160530/medium.jpeg,,1,0,FALSE,"Castro Valley, CA 94546, USA",37.72009687,-122.1132014,5,,Castro Valley,Alameda,narrowleaf mule-ears,Wyethia angustifolia,narrowleaf mule-ears,Plantae,56987,Asteraceae,Wyethia,Wyethia angustifolia
25293443,5/17/19,2019-05-18 00:13:32 UTC,Pacific Time (US & Canada),research,https://www.inaturalist.org/observations/25293443,https://inaturalist-open-data.s3.amazonaws.com/photos/39160548/medium.jpeg,,2,0,FALSE,"Castro Valley, CA 94546, USA",37.7202248,-122.1140743,4,,Castro Valley,Alameda,Ithuriel's Spear,Triteleia laxa,Ithuriel's Spear,Plantae,51085,Asparagaceae,Triteleia,Triteleia laxa
25293447,5/17/19,2019-05-18 00:17:45 UTC,Pacific Time (US & Canada),research,https://www.inaturalist.org/observations/25293447,https://inaturalist-open-data.s3.amazonaws.com/photos/39160570/medium.jpeg,Vision wants this to be burnet...,1,0,FALSE,"Castro Valley, CA 94546, USA",37.72062045,-122.1148339,3,,Castro Valley,Alameda,Salad Burnet,Sanguisorba minor,Salad Burnet,Plantae,55736,Rosaceae,Sanguisorba,Sanguisorba minor
25293455,5/17/19,2019-05-18 00:28:16 UTC,Pacific Time (US & Canada),research,https://www.inaturalist.org/observations/25293455,https://inaturalist-open-data.s3.amazonaws.com/photos/39160589/medium.jpeg,"Nice little moment of peace in an otherwise botanically disheartening place. Count d 18 plants while standing in one spot, which probably means there were 50+",2,0,FALSE,"Castro Valley, CA 94546, USA",37.72377685,-122.1157414,8,,Castro Valley,Alameda,spotted coralroot,Corallorhiza maculata,spotted coralroot,Plantae,49475,Orchidaceae,Corallorhiza,Corallorhiza maculata
25391470,5/17/19,,UTC,research,https://www.inaturalist.org/observations/25391470,https://inaturalist-open-data.s3.amazonaws.com/photos/39318100/medium.jpeg,Scattered plants growing in partial shade along trail around Lake Chabot. Some plants had seed pods. ,1,0,FALSE,"Castro Valley, CA, USA",37.72560202,-122.1141739,60,,Castro Valley,Alameda,western columbine,Aquilegia formosa,western columbine,Plantae,48244,Ranunculaceae,Aquilegia,Aquilegia formosa
25391923,5/17/19,,UTC,research,https://www.inaturalist.org/observations/25391923,https://inaturalist-open-data.s3.amazonaws.com/photos/39319415/medium.jpeg,"Several of these plants were growing with Aquilegia along the trail around Lake Chabot. This used to be in the Scroph family. Resembles Lupine, but the leaves are entirely wrong.",1,0,FALSE,"Alameda County, CA, USA",37.7256,-122.1141,60,,Castro Valley,Alameda,Purple Chinese Houses,Collinsia heterophylla,Purple Chinese Houses,Plantae,47325,Plantaginaceae,Collinsia,Collinsia heterophylla
25392814,5/17/19,,UTC,research,https://www.inaturalist.org/observations/25392814,https://inaturalist-open-data.s3.amazonaws.com/photos/39320175/medium.jpeg,I can't see what the difference between G. achilleifolia and G. capitata is. The flowers of this colony were concentrated in clusters at the end of each stem and the leaves were not super fine. Stamens were blue. Calflora shows both species were collected around Lake Chabot.,1,0,FALSE,"Castro Valley, CA, USA",37.7256,-122.1141,60,,Castro Valley,Alameda,bluehead gilia,Gilia capitata,bluehead gilia,Plantae,57793,Polemoniaceae,Gilia,Gilia capitata
25463881,5/20/19,2019-05-20 20:33:01 UTC,Pacific Time (US & Canada),research,https://www.inaturalist.org/observations/25463881,https://static.inaturalist.org/photos/39442177/medium.jpeg,,2,0,FALSE,"Castro Valley, CA 94546, USA",37.7207489,-122.1155548,,,Castro Valley,Alameda,False Hawkbit,Urospermum picroides,False Hawkbit,Plantae,59361,Asteraceae,Urospermum,Urospermum picroides
25464160,5/20/19,2019-05-20 20:36:40 UTC,Pacific Time (US & Canada),research,https://www.inaturalist.org/observations/25464160,https://static.inaturalist.org/photos/39442668/medium.jpeg,Very common at Fairmont ridge,1,0,FALSE,"Castro Valley, CA 94546, USA",37.71965027,-122.1138,,,Castro Valley,Alameda,False Hawkbit,Urospermum picroides,False Hawkbit,Plantae,59361,Asteraceae,Urospermum,Urospermum picroides
25464303,5/20/19,2019-05-20 20:25:13 UTC,Pacific Time (US & Canada),research,https://www.inaturalist.org/observations/25464303,https://static.inaturalist.org/photos/39442954/medium.jpeg,,2,0,FALSE,"Castro Valley, CA 94546, USA",37.72012711,-122.1143494,,,Castro Valley,Alameda,Salsify,Tragopogon porrifolius,purple salsify,Plantae,54141,Asteraceae,Tragopogon,Tragopogon porrifolius
25464574,5/20/19,2019-05-20 20:45:30 UTC,Pacific Time (US & Canada),research,https://www.inaturalist.org/observations/25464574,https://static.inaturalist.org/photos/39443562/medium.jpeg,,2,0,FALSE,"Castro Valley, CA 94546, USA",37.71514511,-122.1111908,,,Castro Valley,Alameda,milk thistle,Silybum marianum,milk thistle,Plantae,52586,Asteraceae,Silybum,Silybum marianum
25464707,5/20/19,2019-05-20 20:48:28 UTC,Pacific Time (US & Canada),research,https://www.inaturalist.org/observations/25464707,https://static.inaturalist.org/photos/39443813/medium.jpeg,Widespread at Fairmont ridge. Lots of cattle grazing.,1,0,FALSE,"Castro Valley, CA 94546, USA",37.71438599,-122.1097412,,,Castro Valley,Alameda,wild radish,Raphanus sativus,wild radish,Plantae,55410,Brassicaceae,Raphanus,Raphanus sativus
25771272,5/24/19,2019-05-24 16:10:33 UTC,Pacific Time (US & Canada),research,https://www.inaturalist.org/observations/25771272,https://inaturalist-open-data.s3.amazonaws.com/photos/39950830/medium.jpeg,,1,0,FALSE,"Anthony Chabot Regional Park, Alameda County, US-CA, US",37.71713587,-122.1137576,9,,Castro Valley,Alameda,purple false-brome,Brachypodium distachyon,purple false-brome,Plantae,57158,Poaceae,Brachypodium,Brachypodium distachyon
25771392,5/24/19,2019-05-24 16:34:52 UTC,Pacific Time (US & Canada),research,https://www.inaturalist.org/observations/25771392,https://inaturalist-open-data.s3.amazonaws.com/photos/39951022/medium.jpeg,,2,0,FALSE,"Anthony Chabot Regional Park, Alameda County, US-CA, US",37.71831068,-122.1150714,9,,Castro Valley,Alameda,California sheepburr,Acaena pinnatifida californica,California sheepburr,Plantae,61224,Rosaceae,Acaena,Acaena pinnatifida
25892441,5/27/19,2019-05-27 18:53:10 UTC,Pacific Time (US & Canada),research,https://www.inaturalist.org/observations/25892441,https://inaturalist-open-data.s3.amazonaws.com/photos/40240211/medium.jpg,,1,0,FALSE,"Anthony Chabot Regional Park, Oakland, CA, US",37.79046167,-122.1363138,5,,,Alameda,chamise,Adenostoma fasciculatum,chamise,Plantae,47146,Rosaceae,Adenostoma,Adenostoma fasciculatum
25899045,5/27/19,2019-05-27 19:39:26 UTC,Pacific Time (US & Canada),research,https://www.inaturalist.org/observations/25899045,https://inaturalist-open-data.s3.amazonaws.com/photos/40166805/medium.jpg,,3,0,FALSE,"Anthony Chabot Regional Park, Oakland, CA, US",37.78877028,-122.1355462,8,,,Alameda,blue elder,Sambucus cerulea,blue elder,Plantae,143799,Viburnaceae,Sambucus,Sambucus cerulea
25901398,5/27/19,2019-05-27 21:06:13 UTC,Pacific Time (US & Canada),research,https://www.inaturalist.org/observations/25901398,https://static.inaturalist.org/photos/40171207/medium.jpg,,1,0,FALSE,"Anthony Chabot Regional Park, Oakland, CA, US",37.78909667,-122.1360945,32,,,Alameda,poison hemlock,Conium maculatum,poison hemlock,Plantae,52998,Apiaceae,Conium,Conium maculatum
25912448,5/27/19,2019-05-27 19:44:14 UTC,Pacific Time (US & Canada),research,https://www.inaturalist.org/observations/25912448,https://static.inaturalist.org/photos/40188928/medium.jpg,,2,0,FALSE,"Lake Chabot Regional Park, Castro Valley, CA, US",37.72747833,-122.0957195,32,,Castro Valley,Alameda,Ithuriel's Spear,Triteleia laxa,Ithuriel's Spear,Plantae,51085,Asparagaceae,Triteleia,Triteleia laxa
25912625,5/27/19,2019-05-27 19:55:23 UTC,Pacific Time (US & Canada),research,https://www.inaturalist.org/observations/25912625,https://static.inaturalist.org/photos/40189217/medium.jpg,,2,0,FALSE,"Lake Chabot Regional Park, Castro Valley, CA, US",37.72678833,-122.0955805,32,,Castro Valley,Alameda,purple foxglove,Digitalis purpurea,purple foxglove,Plantae,53983,Plantaginaceae,Digitalis,Digitalis purpurea
25912720,5/27/19,2019-05-27 20:09:37 UTC,Pacific Time (US & Canada),research,https://www.inaturalist.org/observations/25912720,https://static.inaturalist.org/photos/40189325/medium.jpg,,1,0,FALSE,"Lake Chabot Regional Park, Castro Valley, CA, US",37.72709167,-122.1012112,32,,Castro Valley,Alameda,Common Vetch,Vicia sativa,Common Vetch,Plantae,53324,Fabaceae,Vicia,Vicia sativa
25912784,5/27/19,2019-05-27 19:57:56 UTC,Pacific Time (US & Canada),research,https://www.inaturalist.org/observations/25912784,https://static.inaturalist.org/photos/40189458/medium.jpg,,1,0,FALSE,"Lake Chabot Regional Park, Castro Valley, CA, US",37.726825,-122.0968638,32,,Castro Valley,Alameda,Pacific ninebark,Physocarpus capitatus,Pacific ninebark,Plantae,57249,Rosaceae,Physocarpus,Physocarpus capitatus
25912887,5/27/19,2019-05-27 20:00:07 UTC,Pacific Time (US & Canada),research,https://www.inaturalist.org/observations/25912887,https://static.inaturalist.org/photos/40189683/medium.jpg,,1,0,FALSE,"Lake Chabot Regional Park, Castro Valley, CA, US",37.72613667,-122.0978555,32,,Castro Valley,Alameda,common cowparsnip,Heracleum maximum,common cowparsnip,Plantae,53094,Apiaceae,Heracleum,Heracleum maximum
25912998,5/27/19,2019-05-27 20:04:37 UTC,Pacific Time (US & Canada),research,https://www.inaturalist.org/observations/25912998,https://static.inaturalist.org/photos/40189906/medium.jpg,,1,0,FALSE,"Lake Chabot Regional Park, Castro Valley, CA, US",37.726345,-122.1002417,32,,Castro Valley,Alameda,bigleaf maple,Acer macrophyllum,bigleaf maple,Plantae,48227,Sapindaceae,Acer,Acer macrophyllum
25913148,5/27/19,2019-05-27 20:08:29 UTC,Pacific Time (US & Canada),research,https://www.inaturalist.org/observations/25913148,https://static.inaturalist.org/photos/40190042/medium.jpg,,1,0,FALSE,"Lake Chabot Regional Park, Castro Valley, CA, US",37.72723833,-122.1011583,32,,Castro Valley,Alameda,orange bush monkeyflower,Diplacus aurantiacus,orange bush monkeyflower,Plantae,777371,Phrymaceae,Diplacus,Diplacus aurantiacus
25913209,5/27/19,2019-05-27 20:08:55 UTC,Pacific Time (US & Canada),research,https://www.inaturalist.org/observations/25913209,https://static.inaturalist.org/photos/40190281/medium.jpg,,1,0,FALSE,"Lake Chabot Regional Park, Castro Valley, CA, US",37.72723,-122.1011583,32,,Castro Valley,Alameda,False Hawkbit,Urospermum picroides,False Hawkbit,Plantae,59361,Asteraceae,Urospermum,Urospermum picroides
25913486,5/27/19,2019-05-27 20:33:52 UTC,Pacific Time (US & Canada),research,https://www.inaturalist.org/observations/25913486,https://inaturalist-open-data.s3.amazonaws.com/photos/40190680/medium.jpeg,,0,0,FALSE,"2069 Fairmont Dr, Castro Valley, CA 94546, USA",37.71811295,-122.1149368,,,Castro Valley,Alameda,Diablo helianthella,Helianthella castanea,Diablo helianthella,Plantae,64250,Asteraceae,Helianthella,Helianthella castanea
25913534,5/27/19,2019-05-27 20:40:11 UTC,Pacific Time (US & Canada),research,https://www.inaturalist.org/observations/25913534,https://inaturalist-open-data.s3.amazonaws.com/photos/40190793/medium.jpeg,,1,0,FALSE,"2071 Fairmont Dr, Castro Valley, CA 94546, USA",37.71735382,-122.1143265,,,Castro Valley,Alameda,False Hawkbit,Urospermum picroides,False Hawkbit,Plantae,59361,Asteraceae,Urospermum,Urospermum picroides
25923871,5/27/19,2019-05-27 21:10:26 UTC,Pacific Time (US & Canada),research,https://www.inaturalist.org/observations/25923871,https://static.inaturalist.org/photos/40208732/medium.jpg,,1,0,FALSE,"Anthony Chabot Regional Park, Oakland, CA, US",37.788125,-122.1345138,48,,,Alameda,California mugwort,Artemisia douglasiana,California mugwort,Plantae,52854,Asteraceae,Artemisia,Artemisia douglasiana
25945222,5/27/19,2019-05-27 19:18:39 UTC,Pacific Time (US & Canada),research,https://www.inaturalist.org/observations/25945222,https://inaturalist-open-data.s3.amazonaws.com/photos/40242998/medium.jpg,,1,0,FALSE,"Anthony Chabot Regional Park, Oakland, CA, US",37.7853,-122.13215,5,,,Alameda,Narrow-leaved clover,Trifolium angustifolium,Narrow-leaved clover,Plantae,69939,Fabaceae,Trifolium,Trifolium angustifolium
25945978,5/27/19,2019-05-27 19:14:40 UTC,Pacific Time (US & Canada),research,https://www.inaturalist.org/observations/25945978,https://inaturalist-open-data.s3.amazonaws.com/photos/40244246/medium.jpg,,1,0,FALSE,"Anthony Chabot Regional Park, Oakland, CA, US",37.78566333,-122.13195,10,,,Alameda,western blue-eyed grass,Sisyrinchium bellum,western blue-eyed grass,Plantae,49918,Iridaceae,Sisyrinchium,Sisyrinchium bellum
26030043,5/27/19,2019-05-27 19:12:31 UTC,Pacific Time (US & Canada),research,https://www.inaturalist.org/observations/26030043,https://inaturalist-open-data.s3.amazonaws.com/photos/40680209/medium.jpg,,2,0,FALSE,"Anthony Chabot Regional Park, San Leandro, CA, US",37.71212,-122.1092445,10,,Castro Valley,Alameda,Sweet scabious,Sixalix atropurpurea,Sweet scabious,Plantae,372376,Caprifoliaceae,Sixalix,Sixalix atropurpurea
26481883,5/30/19,2019-05-31 00:30:35 UTC,Pacific Time (US & Canada),research,https://www.inaturalist.org/observations/26481883,https://static.inaturalist.org/photos/41126639/medium.jpg,"Small purple flower, smelled very nice and was in a sunlight area . Very small and tiny and found mostly near a lot of flowers or plants . Have small thin purple stems coming out probably for bees or hummingbirds to suck out the pollen ",2,0,FALSE,"94577, Oakland, CA, US",37.73304045,-122.1233254,22,,Oakland,Alameda,Ookow,Dichelostemma congestum,Ookow,Plantae,56593,Asparagaceae,Dichelostemma,Dichelostemma congestum
26147050,5/31/19,2019-05-31 22:39:04 UTC,Pacific Time (US & Canada),research,https://www.inaturalist.org/observations/26147050,https://inaturalist-open-data.s3.amazonaws.com/photos/40572930/medium.jpg,,2,0,FALSE,"Anthony Chabot Regional Park, Oakland, CA, US",37.76783333,-122.1211388,10,,,Alameda,twinberry honeysuckle,Lonicera involucrata,twinberry honeysuckle,Plantae,60881,Caprifoliaceae,Lonicera,Lonicera involucrata
26147142,5/31/19,2019-05-31 22:55:30 UTC,Pacific Time (US & Canada),research,https://www.inaturalist.org/observations/26147142,https://inaturalist-open-data.s3.amazonaws.com/photos/44552873/medium.jpg,,1,0,FALSE,"Anthony Chabot Regional Park, Oakland, CA, US",37.77527167,-122.1260305,10,,,Alameda,common yarrow,Achillea millefolium,common yarrow,Plantae,52821,Asteraceae,Achillea,Achillea millefolium
26481775,6/1/19,2019-06-01 15:10:27 UTC,Pacific Time (US & Canada),research,https://www.inaturalist.org/observations/26481775,https://static.inaturalist.org/photos/41126481/medium.jpg,"Very small and yellow , there were a lot of them mostly in bunches and groups can be found on the ground and near grass , have small white pedals and a yellow bud . Can be found mostly in a darker environment/wildlife and doesnt need that much sunlight to survive 
",1,0,FALSE,"94577, Oakland, CA, US",37.73270333,-122.1233055,5,,Oakland,Alameda,common yarrow,Achillea millefolium,common yarrow,Plantae,52821,Asteraceae,Achillea,Achillea millefolium
26291601,6/2/19,2019-06-02 23:02:26 UTC,Pacific Time (US & Canada),research,https://www.inaturalist.org/observations/26291601,https://inaturalist-open-data.s3.amazonaws.com/photos/40812050/medium.jpg,,2,0,FALSE,"Lake Chabot Regional Park, Castro Valley, CA, US",37.71597833,-122.102225,6,,Castro Valley,Alameda,Armenian Blackberry,Rubus armeniacus,Armenian Blackberry,Plantae,61317,Rosaceae,Rubus,Rubus armeniacus
26291692,6/2/19,2019-06-02 23:16:43 UTC,Pacific Time (US & Canada),research,https://www.inaturalist.org/observations/26291692,https://inaturalist-open-data.s3.amazonaws.com/photos/40812253/medium.jpg,,2,0,FALSE,"Lake Chabot Regional Park, Castro Valley, CA, US",37.719125,-122.1049417,12,,Castro Valley,Alameda,California buckeye,Aesculus californica,California buckeye,Plantae,53348,Sapindaceae,Aesculus,Aesculus californica
26415357,6/2/19,2019-06-02 23:16:48 UTC,Pacific Time (US & Canada),research,https://www.inaturalist.org/observations/26415357,https://inaturalist-open-data.s3.amazonaws.com/photos/41063907/medium.jpg,Chabot ,2,0,FALSE,"Lake Chabot Regional Park, Castro Valley, CA, US",37.71905,-122.1050112,12,,Castro Valley,Alameda,California buckeye,Aesculus californica,California buckeye,Plantae,53348,Sapindaceae,Aesculus,Aesculus californica
26334807,6/3/19,2019-06-03 17:16:30 UTC,Pacific Time (US & Canada),research,https://www.inaturalist.org/observations/26334807,https://static.inaturalist.org/photos/40885473/medium.jpg,,1,0,FALSE,"Anthony Chabot Regional Park, Castro Valley, CA, US",37.7247,-122.1117638,15,,,Alameda,Ithuriel's Spear,Triteleia laxa,Ithuriel's Spear,Plantae,51085,Asparagaceae,Triteleia,Triteleia laxa
26449873,6/5/19,2019-06-05 17:51:53 UTC,Pacific Time (US & Canada),research,https://www.inaturalist.org/observations/26449873,https://static.inaturalist.org/photos/41072673/medium.jpg,,2,0,FALSE,"Anthony Chabot Regional Park, Castro Valley, CA, US",37.72736667,-122.1156167,8,,,Alameda,Ithuriel's Spear,Triteleia laxa,Ithuriel's Spear,Plantae,51085,Asparagaceae,Triteleia,Triteleia laxa
26449934,6/5/19,2019-06-05 17:49:32 UTC,Pacific Time (US & Canada),research,https://www.inaturalist.org/observations/26449934,https://inaturalist-open-data.s3.amazonaws.com/photos/41072774/medium.jpeg,,3,0,FALSE,"17600 Lake Chabot Rd, Castro Valley, CA 94546, USA",37.7173203,-122.1044006,142,,Castro Valley,Alameda,Ithuriel's Spear,Triteleia laxa,Ithuriel's Spear,Plantae,51085,Asparagaceae,Triteleia,Triteleia laxa
26450133,6/5/19,2019-06-05 17:56:10 UTC,Pacific Time (US & Canada),research,https://www.inaturalist.org/observations/26450133,https://inaturalist-open-data.s3.amazonaws.com/photos/41073087/medium.jpeg,,3,1,FALSE,"West Shore Trail, Castro Valley, CA 94546, USA",37.72737632,-122.1157307,38,,,Alameda,Ithuriel's Spear,Triteleia laxa,Ithuriel's Spear,Plantae,51085,Asparagaceae,Triteleia,Triteleia laxa
26450143,6/5/19,2019-06-05 17:57:54 UTC,Pacific Time (US & Canada),research,https://www.inaturalist.org/observations/26450143,https://static.inaturalist.org/photos/41073132/medium.jpg,,2,0,FALSE,"Anthony Chabot Regional Park, Castro Valley, CA, US",37.72738333,-122.1157528,6,,,Alameda,Ithuriel's Spear,Triteleia laxa,Ithuriel's Spear,Plantae,51085,Asparagaceae,Triteleia,Triteleia laxa
26477106,6/5/19,2019-06-06 02:48:32 UTC,Pacific Time (US & Canada),research,https://www.inaturalist.org/observations/26477106,https://inaturalist-open-data.s3.amazonaws.com/photos/41118475/medium.jpg,,1,0,FALSE,"Anthony Chabot Regional Park, Castro Valley, CA, US",37.718555,-122.1070028,8,,Castro Valley,Alameda,shade phacelia,Phacelia nemoralis,shade phacelia,Plantae,53173,Boraginaceae,Phacelia,Phacelia nemoralis
26478100,6/5/19,2019-06-06 02:46:08 UTC,Pacific Time (US & Canada),research,https://www.inaturalist.org/observations/26478100,https://inaturalist-open-data.s3.amazonaws.com/photos/41120383/medium.jpg,,1,0,FALSE,"Anthony Chabot Regional Park, Castro Valley, CA, US",37.71977167,-122.1084362,8,,Castro Valley,Alameda,Annual Honesty,Lunaria annua,Annual Honesty,Plantae,55886,Brassicaceae,Lunaria,Lunaria annua
26478112,6/5/19,2019-06-06 02:48:21 UTC,Pacific Time (US & Canada),research,https://www.inaturalist.org/observations/26478112,https://inaturalist-open-data.s3.amazonaws.com/photos/41120396/medium.jpg,,1,0,FALSE,"Anthony Chabot Regional Park, Castro Valley, CA, US",37.718625,-122.1070778,64,,Castro Valley,Alameda,orange bush monkeyflower,Diplacus aurantiacus,orange bush monkeyflower,Plantae,777371,Phrymaceae,Diplacus,Diplacus aurantiacus
26478117,6/5/19,2019-06-06 02:43:29 UTC,Pacific Time (US & Canada),research,https://www.inaturalist.org/observations/26478117,https://inaturalist-open-data.s3.amazonaws.com/photos/41120408/medium.jpg,,1,0,FALSE,"Anthony Chabot Regional Park, Castro Valley, CA, US",37.72081167,-122.1092,16,,Castro Valley,Alameda,black sage,Salvia mellifera,black sage,Plantae,50643,Lamiaceae,Salvia,Salvia mellifera
26478147,6/5/19,2019-06-06 02:39:55 UTC,Pacific Time (US & Canada),research,https://www.inaturalist.org/observations/26478147,https://inaturalist-open-data.s3.amazonaws.com/photos/41120443/medium.jpg,,1,0,FALSE,"Anthony Chabot Regional Park, Castro Valley, CA, US",37.72146667,-122.1093612,6,,Castro Valley,Alameda,chamise,Adenostoma fasciculatum,chamise,Plantae,47146,Rosaceae,Adenostoma,Adenostoma fasciculatum
26478179,6/5/19,2019-06-06 02:37:10 UTC,Pacific Time (US & Canada),research,https://www.inaturalist.org/observations/26478179,https://inaturalist-open-data.s3.amazonaws.com/photos/41120474/medium.jpg,,1,0,FALSE,"Anthony Chabot Regional Park, Castro Valley, CA, US",37.72262167,-122.1102528,6,,Castro Valley,Alameda,Rosilla,Helenium puberulum,Rosilla,Plantae,53092,Asteraceae,Helenium,Helenium puberulum
26478204,6/5/19,2019-06-06 02:36:30 UTC,Pacific Time (US & Canada),research,https://www.inaturalist.org/observations/26478204,https://inaturalist-open-data.s3.amazonaws.com/photos/41120522/medium.jpg,,1,0,FALSE,"Anthony Chabot Regional Park, Castro Valley, CA, US",37.7228,-122.1102667,6,,Castro Valley,Alameda,Maltese star-thistle,Centaurea melitensis,Maltese star-thistle,Plantae,57922,Asteraceae,Centaurea,Centaurea melitensis
26478218,6/5/19,2019-06-06 02:31:52 UTC,Pacific Time (US & Canada),research,https://www.inaturalist.org/observations/26478218,https://inaturalist-open-data.s3.amazonaws.com/photos/41120550/medium.jpg,,2,0,FALSE,"Anthony Chabot Regional Park, Castro Valley, CA, US",37.72446333,-122.1120612,16,,Castro Valley,Alameda,yerba buena,Clinopodium douglasii,yerba buena,Plantae,53203,Lamiaceae,Clinopodium,Clinopodium douglasii
26478235,6/5/19,2019-06-06 02:24:32 UTC,Pacific Time (US & Canada),research,https://www.inaturalist.org/observations/26478235,https://inaturalist-open-data.s3.amazonaws.com/photos/41120567/medium.jpg,,1,0,FALSE,"1353213546 Lake Chabot Rd, Castro Valley, CA, US",37.72590333,-122.1149888,8,,Castro Valley,Alameda,Pacific pea,Lathyrus vestitus,Pacific pea,Plantae,50320,Fabaceae,Lathyrus,Lathyrus vestitus
26478297,6/5/19,2019-06-06 02:07:07 UTC,Pacific Time (US & Canada),research,https://www.inaturalist.org/observations/26478297,https://inaturalist-open-data.s3.amazonaws.com/photos/41120709/medium.jpg,,1,0,FALSE,"Anthony Chabot Regional Park, Castro Valley, CA, US",37.72753667,-122.1157695,6,,,Alameda,wavy-leafed soap plant,Chlorogalum pomeridianum,wavy-leafed soap plant,Plantae,47597,Asparagaceae,Chlorogalum,Chlorogalum pomeridianum
26478309,6/5/19,2019-06-06 02:07:59 UTC,Pacific Time (US & Canada),research,https://www.inaturalist.org/observations/26478309,https://inaturalist-open-data.s3.amazonaws.com/photos/41120752/medium.jpg,,1,0,FALSE,"Anthony Chabot Regional Park, Castro Valley, CA, US",37.72762833,-122.1160805,16,,,Alameda,common cowparsnip,Heracleum maximum,common cowparsnip,Plantae,53094,Apiaceae,Heracleum,Heracleum maximum
26478324,6/5/19,2019-06-06 02:06:25 UTC,Pacific Time (US & Canada),research,https://www.inaturalist.org/observations/26478324,https://inaturalist-open-data.s3.amazonaws.com/photos/41120764/medium.jpg,,2,0,FALSE,"Anthony Chabot Regional Park, Castro Valley, CA, US",37.72736167,-122.1156305,6,,,Alameda,Ithuriel's Spear,Triteleia laxa,Ithuriel's Spear,Plantae,51085,Asparagaceae,Triteleia,Triteleia laxa
26952113,6/5/19,2019-06-06 01:58:04 UTC,Pacific Time (US & Canada),research,https://www.inaturalist.org/observations/26952113,https://inaturalist-open-data.s3.amazonaws.com/photos/41885248/medium.jpg,,1,0,FALSE,"Anthony Chabot Regional Park, Castro Valley, CA, US",37.72610833,-122.1153333,16,,Castro Valley,Alameda,Ocean spray,Holodiscus discolor,Ocean spray,Plantae,53414,Rosaceae,Holodiscus,Holodiscus discolor
26952127,6/5/19,2019-06-06 02:02:04 UTC,Pacific Time (US & Canada),research,https://www.inaturalist.org/observations/26952127,https://inaturalist-open-data.s3.amazonaws.com/photos/41885254/medium.jpg,,1,0,FALSE,"Anthony Chabot Regional Park, Castro Valley, CA, US",37.72709667,-122.1157138,32,,,Alameda,Chinook brome,Bromus laevipes,Chinook brome,Plantae,52704,Poaceae,Bromus,Bromus laevipes
26952146,6/5/19,2019-06-06 02:00:44 UTC,Pacific Time (US & Canada),research,https://www.inaturalist.org/observations/26952146,https://inaturalist-open-data.s3.amazonaws.com/photos/41885307/medium.jpg,,1,0,FALSE,"Anthony Chabot Regional Park, Castro Valley, CA, US",37.72702833,-122.1156305,24,,,Alameda,foothill needle grass,Nassella lepida,foothill needle grass,Plantae,165656,Poaceae,Nassella,Nassella lepida
26952176,6/5/19,2019-06-06 01:52:40 UTC,Pacific Time (US & Canada),research,https://www.inaturalist.org/observations/26952176,https://inaturalist-open-data.s3.amazonaws.com/photos/41885353/medium.jpg,,1,0,FALSE,"1354813554 Lake Chabot Rd, Castro Valley, CA, US",37.72485,-122.1130222,12,,Castro Valley,Alameda,Cape-ivy,Delairea odorata,Cape-ivy,Plantae,53208,Asteraceae,Delairea,Delairea odorata
26952182,6/5/19,2019-06-06 01:49:34 UTC,Pacific Time (US & Canada),research,https://www.inaturalist.org/observations/26952182,https://inaturalist-open-data.s3.amazonaws.com/photos/41885378/medium.jpg,,1,0,FALSE,"Anthony Chabot Regional Park, Castro Valley, CA, US",37.724505,-122.1123667,6,,Castro Valley,Alameda,red osier dogwood,Cornus sericea,red osier dogwood,Plantae,53387,Cornaceae,Cornus,Cornus sericea
26952191,6/5/19,2019-06-06 01:47:54 UTC,Pacific Time (US & Canada),research,https://www.inaturalist.org/observations/26952191,https://inaturalist-open-data.s3.amazonaws.com/photos/41885384/medium.jpg,,1,0,FALSE,"Anthony Chabot Regional Park, Castro Valley, CA, US",37.72448333,-122.1124945,12,,Castro Valley,Alameda,spotted coralroot,Corallorhiza maculata,spotted coralroot,Plantae,49475,Orchidaceae,Corallorhiza,Corallorhiza maculata
26952486,6/5/19,2019-06-06 02:38:24 UTC,Pacific Time (US & Canada),research,https://www.inaturalist.org/observations/26952486,https://inaturalist-open-data.s3.amazonaws.com/photos/41885876/medium.jpg,,1,0,FALSE,"Anthony Chabot Regional Park, Castro Valley, CA, US",37.72230833,-122.1097417,6,,Castro Valley,Alameda,Greater Quaking Grass,Briza maxima,Greater Quaking Grass,Plantae,57157,Poaceae,Briza,Briza maxima
26952518,6/5/19,2019-06-06 02:12:54 UTC,Pacific Time (US & Canada),research,https://www.inaturalist.org/observations/26952518,https://inaturalist-open-data.s3.amazonaws.com/photos/41885886/medium.jpg,,1,0,FALSE,"Anthony Chabot Regional Park, Castro Valley, CA, US",37.728445,-122.1177305,6,,Castro Valley,Alameda,Common Vetch,Vicia sativa,Common Vetch,Plantae,53324,Fabaceae,Vicia,Vicia sativa
26952521,6/5/19,2019-06-06 02:25:41 UTC,Pacific Time (US & Canada),research,https://www.inaturalist.org/observations/26952521,https://inaturalist-open-data.s3.amazonaws.com/photos/41885896/medium.jpg,,1,0,FALSE,"Anthony Chabot Regional Park, Castro Valley, CA, US",37.725045,-122.1139445,12,,Castro Valley,Alameda,California bee plant,Scrophularia californica,California beeplant,Plantae,50812,Scrophulariaceae,Scrophularia,Scrophularia californica
26952529,6/5/19,2019-06-06 02:11:53 UTC,Pacific Time (US & Canada),research,https://www.inaturalist.org/observations/26952529,https://inaturalist-open-data.s3.amazonaws.com/photos/41885912/medium.jpg,,2,0,FALSE,"Anthony Chabot Regional Park, Castro Valley, CA, US",37.72803667,-122.1175167,8,,Castro Valley,Alameda,Pink Honeysuckle,Lonicera hispidula,Pink Honeysuckle,Plantae,53416,Caprifoliaceae,Lonicera,Lonicera hispidula
26952534,6/5/19,2019-06-06 02:11:24 UTC,Pacific Time (US & Canada),research,https://www.inaturalist.org/observations/26952534,https://inaturalist-open-data.s3.amazonaws.com/photos/41885943/medium.jpg,,1,0,FALSE,"Anthony Chabot Regional Park, Castro Valley, CA, US",37.72802167,-122.1173778,16,,Castro Valley,Alameda,poison hemlock,Conium maculatum,poison hemlock,Plantae,52998,Apiaceae,Conium,Conium maculatum
26952543,6/5/19,2019-06-06 02:35:43 UTC,Pacific Time (US & Canada),research,https://www.inaturalist.org/observations/26952543,https://inaturalist-open-data.s3.amazonaws.com/photos/41885967/medium.jpg,,1,0,FALSE,"Anthony Chabot Regional Park, Castro Valley, CA, US",37.723205,-122.1103833,8,,Castro Valley,Alameda,Oloptum miliaceum,Oloptum miliaceum,Smilo Grass,Plantae,524183,Poaceae,Oloptum,Oloptum miliaceum
26621188,6/7/19,2019-06-08 03:03:28 UTC,Pacific Time (US & Canada),research,https://www.inaturalist.org/observations/26621188,https://static.inaturalist.org/photos/41347619/medium.jpg,,1,0,FALSE,"Lake Chabot Regional Park, Castro Valley, CA, US",37.71916798,-122.104935,7,,Castro Valley,Alameda,Armenian Blackberry,Rubus armeniacus,Armenian Blackberry,Plantae,61317,Rosaceae,Rubus,Rubus armeniacus
26621799,6/7/19,2019-06-08 03:12:43 UTC,Pacific Time (US & Canada),research,https://www.inaturalist.org/observations/26621799,https://static.inaturalist.org/photos/41348571/medium.jpg,,2,0,FALSE,"Lake Chabot Regional Park, Castro Valley, CA, US",37.72616727,-122.1021688,57,,Castro Valley,Alameda,milk thistle,Silybum marianum,milk thistle,Plantae,52586,Asteraceae,Silybum,Silybum marianum
26622022,6/7/19,2019-06-08 03:10:33 UTC,Pacific Time (US & Canada),research,https://www.inaturalist.org/observations/26622022,https://static.inaturalist.org/photos/41348754/medium.jpg,,2,0,FALSE,"Lake Chabot Regional Park, Castro Valley, CA, US",37.71909722,-122.1050661,17,,Castro Valley,Alameda,California buckeye,Aesculus californica,California buckeye,Plantae,53348,Sapindaceae,Aesculus,Aesculus californica
26636056,6/8/19,2019-06-08 20:39:52 UTC,Pacific Time (US & Canada),research,https://www.inaturalist.org/observations/26636056,https://static.inaturalist.org/photos/41371175/medium.jpg,,1,0,FALSE,"Anthony Chabot Regional Park, Alameda County, US-CA, US",37.79568092,-122.1487348,10,,,Alameda,western columbine,Aquilegia formosa,western columbine,Plantae,48244,Ranunculaceae,Aquilegia,Aquilegia formosa
26636064,6/8/19,2019-06-08 20:56:29 UTC,Pacific Time (US & Canada),research,https://www.inaturalist.org/observations/26636064,https://static.inaturalist.org/photos/41371197/medium.jpg,,2,0,FALSE,"Anthony Chabot Regional Park, Alameda County, US-CA, US",37.79776018,-122.1536396,30,,,Alameda,scarlet pimpernel,Lysimachia arvensis,scarlet pimpernel,Plantae,791928,Primulaceae,Lysimachia,Lysimachia arvensis
26640304,6/8/19,2019-06-08 21:55:01 UTC,Pacific Time (US & Canada),research,https://www.inaturalist.org/observations/26640304,https://static.inaturalist.org/photos/41377730/medium.jpg,,2,0,FALSE,"Anthony Chabot Regional Park, Castro Valley, CA, US",37.72055,-122.109,5,,Castro Valley,Alameda,Red Valerian,Centranthus ruber,Red Valerian,Plantae,57283,Caprifoliaceae,Centranthus,Centranthus ruber
26640324,6/8/19,2019-06-08 22:07:40 UTC,Pacific Time (US & Canada),research,https://www.inaturalist.org/observations/26640324,https://static.inaturalist.org/photos/41377763/medium.jpg,,2,0,FALSE,"Anthony Chabot Regional Park, Castro Valley, CA, US",37.72568,-122.1143722,5,,Castro Valley,Alameda,Pale pink-sorrel,Oxalis incarnata,Pale pink-sorrel,Plantae,61776,Oxalidaceae,Oxalis,Oxalis incarnata
26707109,6/9/19,2019-06-09 22:06:35 UTC,Pacific Time (US & Canada),research,https://www.inaturalist.org/observations/26707109,https://inaturalist-open-data.s3.amazonaws.com/photos/41484177/medium.jpg,,1,0,FALSE,Anthony Chabot regional park,37.754532,-122.105206,,,,Alameda,Tasmanian Blue Gum,Eucalyptus globulus,Eurabbie,Plantae,53398,Myrtaceae,Eucalyptus,Eucalyptus globulus
27059220,6/15/19,2019-06-16 00:40:52 UTC,Pacific Time (US & Canada),research,https://www.inaturalist.org/observations/27059220,https://inaturalist-open-data.s3.amazonaws.com/photos/42061440/medium.jpg,,2,0,FALSE,"Anthony Chabot Regional Park, Castro Valley, CA, US",37.72281168,-122.1102827,5,,Castro Valley,Alameda,poison hemlock,Conium maculatum,poison hemlock,Plantae,52998,Apiaceae,Conium,Conium maculatum
27131070,6/16/19,2019-06-16 22:23:15 UTC,Pacific Time (US & Canada),research,https://www.inaturalist.org/observations/27131070,https://static.inaturalist.org/photos/42181036/medium.jpg,,1,0,FALSE,"Anthony Chabot Regional Park, Oakland, CA, US",37.77386333,-122.1253445,32,,,Alameda,California buckeye,Aesculus californica,California buckeye,Plantae,53348,Sapindaceae,Aesculus,Aesculus californica
27131126,6/16/19,2019-06-16 22:11:50 UTC,Pacific Time (US & Canada),research,https://www.inaturalist.org/observations/27131126,https://static.inaturalist.org/photos/42181124/medium.jpg,,1,0,FALSE,"Anthony Chabot Regional Park, Oakland, CA, US",37.76822833,-122.1214612,32,,,Alameda,twinberry honeysuckle,Lonicera involucrata,twinberry honeysuckle,Plantae,60881,Caprifoliaceae,Lonicera,Lonicera involucrata
27131151,6/16/19,2019-06-16 21:47:36 UTC,Pacific Time (US & Canada),research,https://www.inaturalist.org/observations/27131151,https://static.inaturalist.org/photos/42181159/medium.jpg,,1,0,FALSE,"Anthony Chabot Regional Park, Oakland, CA, US",37.75791167,-122.1169278,32,,,Alameda,common cowparsnip,Heracleum maximum,common cowparsnip,Plantae,53094,Apiaceae,Heracleum,Heracleum maximum
27244431,6/18/19,2019-06-18 21:59:42 UTC,Pacific Time (US & Canada),research,https://www.inaturalist.org/observations/27244431,https://static.inaturalist.org/photos/42369023/medium.jpg,,1,0,FALSE,"Anthony Chabot Regional Park, Oakland, CA, US",37.78987833,-122.1367722,48,,,Alameda,orange bush monkeyflower,Diplacus aurantiacus,orange bush monkeyflower,Plantae,777371,Phrymaceae,Diplacus,Diplacus aurantiacus
27353162,6/20/19,2019-06-20 23:33:31 UTC,Pacific Time (US & Canada),research,https://www.inaturalist.org/observations/27353162,https://static.inaturalist.org/photos/42549176/medium.jpg,,2,0,FALSE,"Anthony Chabot Regional Park, Castro Valley, CA, US",37.72150724,-122.1093377,10,,Castro Valley,Alameda,chamise,Adenostoma fasciculatum,chamise,Plantae,47146,Rosaceae,Adenostoma,Adenostoma fasciculatum
27353206,6/20/19,2019-06-20 23:37:06 UTC,Pacific Time (US & Canada),research,https://www.inaturalist.org/observations/27353206,https://static.inaturalist.org/photos/42549272/medium.jpg,,2,0,FALSE,"3026 Keith Ave, Castro Valley, CA, US",37.72204955,-122.1089233,30,,Castro Valley,Alameda,Toyon,Heteromeles arbutifolia,Toyon,Plantae,53405,Rosaceae,Heteromeles,Heteromeles arbutifolia
27353455,6/20/19,2019-06-20 23:42:38 UTC,Pacific Time (US & Canada),research,https://www.inaturalist.org/observations/27353455,https://static.inaturalist.org/photos/42549708/medium.jpg,,3,0,FALSE,"3162 Aylesbury Ct, Castro Valley, CA, US",37.72287316,-122.1102602,10,,Castro Valley,Alameda,poison hemlock,Conium maculatum,poison hemlock,Plantae,52998,Apiaceae,Conium,Conium maculatum
27410018,6/20/19,2019-06-21 02:02:13 UTC,Pacific Time (US & Canada),research,https://www.inaturalist.org/observations/27410018,https://inaturalist-open-data.s3.amazonaws.com/photos/42645998/medium.jpg,,1,0,FALSE,"Anthony Chabot Regional Park, Castro Valley, CA, US",37.72035159,-122.1087809,121,,Castro Valley,Alameda,California sagebrush,Artemisia californica,California sagebrush,Plantae,53357,Asteraceae,Artemisia,Artemisia californica
27550669,6/23/19,2019-06-24 00:55:11 UTC,Pacific Time (US & Canada),research,https://www.inaturalist.org/observations/27550669,https://inaturalist-open-data.s3.amazonaws.com/photos/42879243/medium.jpg,,2,0,FALSE,"Anthony Chabot Regional Park, Castro Valley, CA, US",37.72472082,-122.1133273,27,,Castro Valley,Alameda,Cape-ivy,Delairea odorata,Cape-ivy,Plantae,53208,Asteraceae,Delairea,Delairea odorata
27550699,6/23/19,2019-06-24 00:55:24 UTC,Pacific Time (US & Canada),research,https://www.inaturalist.org/observations/27550699,https://inaturalist-open-data.s3.amazonaws.com/photos/42879316/medium.jpg,,1,0,FALSE,"Anthony Chabot Regional Park, Castro Valley, CA, US",37.72465833,-122.11335,32,,Castro Valley,Alameda,Western Star Flower,Lysimachia latifolia,Western Starflower,Plantae,496537,Primulaceae,Lysimachia,Lysimachia latifolia
27661891,6/25/19,2019-06-25 19:15:31 UTC,Pacific Time (US & Canada),research,https://www.inaturalist.org/observations/27661891,https://inaturalist-open-data.s3.amazonaws.com/photos/43061912/medium.jpeg,,1,0,FALSE,"Oakland, CA 94619, USA",37.7977066,-122.1548538,,,,Alameda,scarlet monkeyflower,Erythranthe cardinalis,scarlet monkeyflower,Plantae,319974,Phrymaceae,Erythranthe,Erythranthe cardinalis
27720222,6/26/19,2019-06-26 17:21:33 UTC,Pacific Time (US & Canada),research,https://www.inaturalist.org/observations/27720222,https://inaturalist-open-data.s3.amazonaws.com/photos/43158887/medium.jpg,,2,0,FALSE,"Castro Valley, CA 94552, USA",37.73833466,-122.1138916,,,,Alameda,Yellow Mariposa Lily,Calochortus luteus,Yellow Mariposa Lily,Plantae,51077,Liliaceae,Calochortus,Calochortus luteus
27720243,6/26/19,2019-06-26 17:04:35 UTC,Pacific Time (US & Canada),research,https://www.inaturalist.org/observations/27720243,https://inaturalist-open-data.s3.amazonaws.com/photos/43158913/medium.jpeg,,1,0,FALSE,"Oakland, CA 94605, USA",37.74384689,-122.1126099,,,,Alameda,thimbleberry,Rubus parviflorus,thimbleberry,Plantae,51646,Rosaceae,Rubus,Rubus parviflorus
29130329,6/28/19,2019-06-28 18:44:57 UTC,Pacific Time (US & Canada),research,https://www.inaturalist.org/observations/29130329,https://inaturalist-open-data.s3.amazonaws.com/photos/45449330/medium.jpg,,1,0,FALSE,"Anthony Chabot Regional Park, Oakland, CA, US",37.78978577,-122.1368298,8,,,Alameda,Yellow Mariposa Lily,Calochortus luteus,Yellow Mariposa Lily,Plantae,51077,Liliaceae,Calochortus,Calochortus luteus
29130388,6/28/19,2019-06-28 19:01:42 UTC,Pacific Time (US & Canada),research,https://www.inaturalist.org/observations/29130388,https://inaturalist-open-data.s3.amazonaws.com/photos/45449475/medium.jpg,,1,0,FALSE,"Anthony Chabot Regional Park, Oakland, CA, US",37.79293579,-122.1421665,24,,,Alameda,beaked hazelnut,Corylus cornuta,beaked hazelnut,Plantae,53374,Betulaceae,Corylus,Corylus cornuta
27890322,6/29/19,2019-06-29 17:28:50 UTC,Pacific Time (US & Canada),research,https://www.inaturalist.org/observations/27890322,https://inaturalist-open-data.s3.amazonaws.com/photos/43439015/medium.jpeg,,1,0,FALSE,"Oakland, CA 94619, USA",37.79125595,-122.1423264,,,,Alameda,Ocean spray,Holodiscus discolor,Ocean spray,Plantae,53414,Rosaceae,Holodiscus,Holodiscus discolor
28599893,6/29/19,2019-06-30 01:31:44 UTC,Pacific Time (US & Canada),research,https://www.inaturalist.org/observations/28599893,https://inaturalist-open-data.s3.amazonaws.com/photos/44594888/medium.jpg,,1,0,FALSE,"Lake Chabot Regional Park, Castro Valley, CA, US",37.72375833,-122.1032722,5,,Castro Valley,Alameda,coast tarweed,Madia sativa,coast tarweed,Plantae,53143,Asteraceae,Madia,Madia sativa
27956172,6/30/19,2019-06-30 19:48:37 UTC,Pacific Time (US & Canada),research,https://www.inaturalist.org/observations/27956172,https://static.inaturalist.org/photos/43544596/medium.jpg,,1,0,FALSE,"Anthony Chabot Regional Park, San Leandro, CA, US",37.71347057,-122.1088129,22,,Castro Valley,Alameda,California poppy,Eschscholzia californica,California poppy,Plantae,48225,Papaveraceae,Eschscholzia,Eschscholzia californica
27956193,6/30/19,2019-06-30 19:49:07 UTC,Pacific Time (US & Canada),research,https://www.inaturalist.org/observations/27956193,https://static.inaturalist.org/photos/43544629/medium.jpg,,1,0,FALSE,"Anthony Chabot Regional Park, San Leandro, CA, US",37.71346712,-122.1088346,22,,Castro Valley,Alameda,wild radish,Raphanus sativus,wild radish,Plantae,55410,Brassicaceae,Raphanus,Raphanus sativus
27956209,6/30/19,2019-06-30 19:49:42 UTC,Pacific Time (US & Canada),research,https://www.inaturalist.org/observations/27956209,https://static.inaturalist.org/photos/43544657/medium.jpg,,1,0,FALSE,"Anthony Chabot Regional Park, San Leandro, CA, US",37.71343629,-122.1088343,22,,Castro Valley,Alameda,Italian thistle,Carduus pycnocephalus,Italian thistle,Plantae,52990,Asteraceae,Carduus,Carduus pycnocephalus
27956246,6/30/19,2019-06-30 19:52:14 UTC,Pacific Time (US & Canada),research,https://www.inaturalist.org/observations/27956246,https://static.inaturalist.org/photos/43544719/medium.jpg,,1,0,FALSE,"Anthony Chabot Regional Park, San Leandro, CA, US",37.71371543,-122.1090513,22,,Castro Valley,Alameda,coyote brush,Baccharis pilularis,coyote brush,Plantae,53359,Asteraceae,Baccharis,Baccharis pilularis
27956271,6/30/19,2019-06-30 19:53:45 UTC,Pacific Time (US & Canada),research,https://www.inaturalist.org/observations/27956271,https://static.inaturalist.org/photos/43544767/medium.jpg,,1,0,FALSE,"Anthony Chabot Regional Park, San Leandro, CA, US",37.71410068,-122.1092723,22,,Castro Valley,Alameda,Yellow Starthistle,Centaurea solstitialis,Yellow Star-Thistle,Plantae,52588,Asteraceae,Centaurea,Centaurea solstitialis
27956285,6/30/19,2019-06-30 19:54:38 UTC,Pacific Time (US & Canada),research,https://www.inaturalist.org/observations/27956285,https://static.inaturalist.org/photos/43544786/medium.jpg,,1,0,FALSE,"Anthony Chabot Regional Park, San Leandro, CA, US",37.71412544,-122.109465,22,,Castro Valley,Alameda,milk thistle,Silybum marianum,milk thistle,Plantae,52586,Asteraceae,Silybum,Silybum marianum
27956325,6/30/19,2019-06-30 20:00:04 UTC,Pacific Time (US & Canada),research,https://www.inaturalist.org/observations/27956325,https://static.inaturalist.org/photos/43544858/medium.jpg,,1,0,FALSE,"Anthony Chabot Regional Park, San Leandro, CA, US",37.71502024,-122.1112394,30,,Castro Valley,Alameda,coast live oak,Quercus agrifolia,coast live oak,Plantae,47850,Fagaceae,Quercus,Quercus agrifolia
27956398,6/30/19,2019-06-30 20:03:47 UTC,Pacific Time (US & Canada),research,https://www.inaturalist.org/observations/27956398,https://static.inaturalist.org/photos/43544935/medium.jpg,,1,0,FALSE,"Anthony Chabot Regional Park, San Leandro, CA, US",37.71493012,-122.110898,29,,Castro Valley,Alameda,trailing blackberry,Rubus ursinus,trailing blackberry,Plantae,53445,Rosaceae,Rubus,Rubus ursinus
27956421,6/30/19,2019-06-30 20:04:33 UTC,Pacific Time (US & Canada),research,https://www.inaturalist.org/observations/27956421,https://static.inaturalist.org/photos/43544963/medium.jpg,,1,0,FALSE,"Anthony Chabot Regional Park, San Leandro, CA, US",37.71483852,-122.1106272,22,,Castro Valley,Alameda,Pacific poison oak,Toxicodendron diversilobum,Pacific poison oak,Plantae,51080,Anacardiaceae,Toxicodendron,Toxicodendron diversilobum
27956438,6/30/19,2019-06-30 20:05:26 UTC,Pacific Time (US & Canada),research,https://www.inaturalist.org/observations/27956438,https://static.inaturalist.org/photos/43544987/medium.jpg,,2,0,FALSE,"Anthony Chabot Regional Park, San Leandro, CA, US",37.71483688,-122.110544,50,,Castro Valley,Alameda,ribwort plantain,Plantago lanceolata,ribwort plantain,Plantae,53178,Plantaginaceae,Plantago,Plantago lanceolata
27956449,6/30/19,2019-06-30 20:07:48 UTC,Pacific Time (US & Canada),research,https://www.inaturalist.org/observations/27956449,https://static.inaturalist.org/photos/43545014/medium.jpg,,1,0,FALSE,"Anthony Chabot Regional Park, San Leandro, CA, US",37.71488257,-122.1105002,141,,Castro Valley,Alameda,sweet fennel,Foeniculum vulgare,fennel,Plantae,53052,Apiaceae,Foeniculum,Foeniculum vulgare
27956501,6/30/19,2019-06-30 20:14:16 UTC,Pacific Time (US & Canada),research,https://www.inaturalist.org/observations/27956501,https://static.inaturalist.org/photos/43545111/medium.jpg,,1,0,FALSE,"Anthony Chabot Regional Park, San Leandro, CA, US",37.71346569,-122.1083947,149,,Castro Valley,Alameda,Toyon,Heteromeles arbutifolia,Toyon,Plantae,53405,Rosaceae,Heteromeles,Heteromeles arbutifolia
27956517,6/30/19,2019-06-30 20:15:14 UTC,Pacific Time (US & Canada),research,https://www.inaturalist.org/observations/27956517,https://static.inaturalist.org/photos/43545136/medium.jpg,,1,0,FALSE,"Anthony Chabot Regional Park, San Leandro, CA, US",37.71349354,-122.1084422,22,,Castro Valley,Alameda,scarlet pimpernel,Lysimachia arvensis,scarlet pimpernel,Plantae,791928,Primulaceae,Lysimachia,Lysimachia arvensis
28026748,7/1/19,2019-07-01 21:05:19 UTC,Pacific Time (US & Canada),research,https://www.inaturalist.org/observations/28026748,https://inaturalist-open-data.s3.amazonaws.com/photos/43661698/medium.jpeg,,2,0,FALSE,"Castro Valley, CA 94546, USA",37.71760178,-122.1044006,,,Castro Valley,Alameda,Persicaria amphibia emersa,Persicaria amphibia emersa,longroot smartweed,Plantae,553505,Polygonaceae,Persicaria,Persicaria amphibia
28026869,7/1/19,2019-07-01 22:03:46 UTC,Pacific Time (US & Canada),research,https://www.inaturalist.org/observations/28026869,https://inaturalist-open-data.s3.amazonaws.com/photos/43663127/medium.jpg,,1,0,FALSE,"Castro Valley, CA 94546, USA",37.7267952,-122.0968857,,,Castro Valley,Alameda,Bitter lettuce,Lactuca virosa,bitter lettuce,Plantae,53108,Asteraceae,Lactuca,Lactuca virosa
28026890,7/1/19,2019-07-01 22:08:34 UTC,Pacific Time (US & Canada),research,https://www.inaturalist.org/observations/28026890,https://inaturalist-open-data.s3.amazonaws.com/photos/43661939/medium.jpeg,,2,0,FALSE,"Castro Valley, CA 94546, USA",37.72789001,-122.0960007,,,,Alameda,Indian teasel,Dipsacus sativus,fuller's teasel,Plantae,53028,Caprifoliaceae,Dipsacus,Dipsacus sativus
28026952,7/1/19,2019-07-01 22:09:26 UTC,Pacific Time (US & Canada),research,https://www.inaturalist.org/observations/28026952,https://inaturalist-open-data.s3.amazonaws.com/photos/43662051/medium.jpeg,,2,0,FALSE,"Castro Valley, CA 94546, USA",37.72789001,-122.0960007,,,,Alameda,California bulrush,Schoenoplectus californicus,California bulrush,Plantae,47159,Cyperaceae,Schoenoplectus,Schoenoplectus californicus
28297426,7/1/19,2019-07-01 18:09:38 UTC,Pacific Time (US & Canada),research,https://www.inaturalist.org/observations/28297426,https://inaturalist-open-data.s3.amazonaws.com/photos/44100380/medium.jpg,,3,0,FALSE,"Anthony Chabot Regional Park, Alameda County, US-CA, US",37.72823218,-122.0954805,21,,,Alameda,fuller's teasel,Dipsacus sativus,fuller's teasel,Plantae,53028,Caprifoliaceae,Dipsacus,Dipsacus sativus
28637142,7/1/19,2019-07-02 01:00:27 UTC,Pacific Time (US & Canada),research,https://www.inaturalist.org/observations/28637142,https://inaturalist-open-data.s3.amazonaws.com/photos/44654090/medium.jpg,,1,0,FALSE,"Anthony Chabot Regional Park, Castro Valley, CA, US",37.72084667,-122.1091305,48,,Castro Valley,Alameda,Red Valerian,Centranthus ruber,Red Valerian,Plantae,57283,Caprifoliaceae,Centranthus,Centranthus ruber
28637174,7/1/19,2019-07-02 01:04:29 UTC,Pacific Time (US & Canada),research,https://www.inaturalist.org/observations/28637174,https://inaturalist-open-data.s3.amazonaws.com/photos/44654099/medium.jpg,,1,0,FALSE,"Anthony Chabot Regional Park, Castro Valley, CA, US",37.72237833,-122.1097945,8,,Castro Valley,Alameda,Coyote Mint,Monardella villosa,Coyote Mint,Plantae,52181,Lamiaceae,Monardella,Monardella villosa
28538884,7/3/19,2019-07-03 20:15:27 UTC,Pacific Time (US & Canada),research,https://www.inaturalist.org/observations/28538884,https://static.inaturalist.org/photos/44495343/medium.jpg,,1,0,FALSE,"Anthony Chabot Regional Park, Castro Valley, CA, US",37.74743667,-122.0960388,8,,,Alameda,broad-leaved sweet pea,Lathyrus latifolius,broad-leaved sweet pea,Plantae,61009,Fabaceae,Lathyrus,Lathyrus latifolius
28635951,7/3/19,2019-07-03 17:49:06 UTC,Pacific Time (US & Canada),research,https://www.inaturalist.org/observations/28635951,https://static.inaturalist.org/photos/44651665/medium.jpg,,1,0,FALSE,"Anthony Chabot Regional Park, Castro Valley, CA, US",37.72553833,-122.114625,48,,Castro Valley,Alameda,orange bush monkeyflower,Diplacus aurantiacus,orange bush monkeyflower,Plantae,777371,Phrymaceae,Diplacus,Diplacus aurantiacus
28204597,7/4/19,2019-07-04 23:09:01 UTC,Pacific Time (US & Canada),research,https://www.inaturalist.org/observations/28204597,https://static.inaturalist.org/photos/43949676/medium.jpg,,1,0,FALSE,"Anthony Chabot Regional Park, Oakland, CA, US",37.77655,-122.1309055,5,,,Alameda,coffeeberry,Frangula californica,coffeeberry,Plantae,53423,Rhamnaceae,Frangula,Frangula californica
28204714,7/4/19,2019-07-04 22:47:47 UTC,Pacific Time (US & Canada),research,https://www.inaturalist.org/observations/28204714,https://static.inaturalist.org/photos/43950015/medium.jpg,,1,0,FALSE,"Anthony Chabot Regional Park, Oakland, CA, US",37.77677167,-122.1302417,5,,,Alameda,Ocean spray,Holodiscus discolor,Ocean spray,Plantae,53414,Rosaceae,Holodiscus,Holodiscus discolor
28216988,7/4/19,2019-07-04 22:59:12 UTC,Pacific Time (US & Canada),research,https://www.inaturalist.org/observations/28216988,https://inaturalist-open-data.s3.amazonaws.com/photos/43970971/medium.jpeg,,1,0,FALSE,"Castro Valley, CA 94546, USA",37.71699524,-122.1073532,,,Castro Valley,Alameda,Coyote Mint,Monardella villosa,Coyote Mint,Plantae,52181,Lamiaceae,Monardella,Monardella villosa
28543536,7/4/19,2019-07-04 23:01:59 UTC,Pacific Time (US & Canada),research,https://www.inaturalist.org/observations/28543536,https://static.inaturalist.org/photos/44503391/medium.jpg,,1,0,FALSE,"Anthony Chabot Regional Park, Oakland, CA, US",37.778225,-122.1335972,5,,,Alameda,Evergreen Huckleberry,Vaccinium ovatum,Evergreen Huckleberry,Plantae,48349,Ericaceae,Vaccinium,Vaccinium ovatum
28543541,7/4/19,2019-07-04 23:14:25 UTC,Pacific Time (US & Canada),research,https://www.inaturalist.org/observations/28543541,https://static.inaturalist.org/photos/44503408/medium.jpg,,1,0,FALSE,"Anthony Chabot Regional Park, Oakland, CA, US",37.77527,-122.1298305,5,,,Alameda,wavy-leafed soap plant,Chlorogalum pomeridianum,wavy-leafed soap plant,Plantae,47597,Asparagaceae,Chlorogalum,Chlorogalum pomeridianum
28314002,7/6/19,2019-07-06 18:54:51 UTC,Pacific Time (US & Canada),research,https://www.inaturalist.org/observations/28314002,https://inaturalist-open-data.s3.amazonaws.com/photos/44126973/medium.jpg,,2,0,FALSE,"Anthony Chabot Regional Park, Alameda County, US-CA, US",37.77521357,-122.1262081,30,,,Alameda,orange bush monkeyflower,Diplacus aurantiacus,orange bush monkeyflower,Plantae,777371,Phrymaceae,Diplacus,Diplacus aurantiacus
28314048,7/6/19,2019-07-06 18:40:34 UTC,Pacific Time (US & Canada),research,https://www.inaturalist.org/observations/28314048,https://inaturalist-open-data.s3.amazonaws.com/photos/44127025/medium.jpg,,2,0,FALSE,"Anthony Chabot Regional Park, Alameda County, US-CA, US",37.76844238,-122.121526,50,,,Alameda,fuller's teasel,Dipsacus sativus,fuller's teasel,Plantae,53028,Caprifoliaceae,Dipsacus,Dipsacus sativus
28314089,7/6/19,2019-07-06 18:36:50 UTC,Pacific Time (US & Canada),research,https://www.inaturalist.org/observations/28314089,https://inaturalist-open-data.s3.amazonaws.com/photos/44127049/medium.jpg,,2,0,FALSE,"Anthony Chabot Regional Park, Alameda County, US-CA, US",37.76794722,-122.1212096,5,,,Alameda,twinberry honeysuckle,Lonicera involucrata,twinberry honeysuckle,Plantae,60881,Caprifoliaceae,Lonicera,Lonicera involucrata
28328969,7/6/19,2019-07-06 18:52:00 UTC,Pacific Time (US & Canada),research,https://www.inaturalist.org/observations/28328969,https://inaturalist-open-data.s3.amazonaws.com/photos/44150786/medium.jpeg,,1,0,FALSE,"Alameda County, CA, USA",37.77778357,-122.1251728,15,,,Alameda,twinberry honeysuckle,Lonicera involucrata,twinberry honeysuckle,Plantae,60881,Caprifoliaceae,Lonicera,Lonicera involucrata
28328971,7/6/19,2019-07-06 21:02:00 UTC,Pacific Time (US & Canada),research,https://www.inaturalist.org/observations/28328971,https://inaturalist-open-data.s3.amazonaws.com/photos/44151084/medium.jpeg,,1,0,FALSE,"Alameda County, CA, USA",37.77774117,-122.1251191,15,,,Alameda,Ocean spray,Holodiscus discolor,Ocean spray,Plantae,53414,Rosaceae,Holodiscus,Holodiscus discolor
28599234,7/7/19,2019-07-07 23:23:47 UTC,Pacific Time (US & Canada),research,https://www.inaturalist.org/observations/28599234,https://inaturalist-open-data.s3.amazonaws.com/photos/44593964/medium.jpg,,1,0,FALSE,"Anthony Chabot Regional Park, Castro Valley, CA, US",37.72103833,-122.1091778,30,,Castro Valley,Alameda,Red Valerian,Centranthus ruber,Red Valerian,Plantae,57283,Caprifoliaceae,Centranthus,Centranthus ruber
28615681,7/7/19,2019-07-07 23:25:51 UTC,Pacific Time (US & Canada),research,https://www.inaturalist.org/observations/28615681,https://inaturalist-open-data.s3.amazonaws.com/photos/44619586/medium.jpg,,1,0,FALSE,"Anthony Chabot Regional Park, Castro Valley, CA, US",37.72239667,-122.1098333,10,,Castro Valley,Alameda,Coyote Mint,Monardella villosa,Coyote Mint,Plantae,52181,Lamiaceae,Monardella,Monardella villosa
42072760,7/7/19,2019-07-08 04:30:30 UTC,Pacific Time (US & Canada),research,https://www.inaturalist.org/observations/42072760,https://inaturalist-open-data.s3.amazonaws.com/photos/66778025/medium.jpeg,,1,0,FALSE,"Castro Valley, CA 94546, USA",37.72617367,-122.1153042,132,,Castro Valley,Alameda,bristly oxtongue,Helminthotheca echioides,bristly oxtongue,Plantae,61906,Asteraceae,Helminthotheca,Helminthotheca echioides
28637215,7/8/19,2019-07-09 00:45:41 UTC,Pacific Time (US & Canada),research,https://www.inaturalist.org/observations/28637215,https://inaturalist-open-data.s3.amazonaws.com/photos/44654258/medium.jpg,,1,0,FALSE,"Lake Chabot, Castro Valley, CA, US",37.71966167,-122.1055612,48,,Castro Valley,Alameda,Naked Buckwheat,Eriogonum nudum,Naked Buckwheat,Plantae,53046,Polygonaceae,Eriogonum,Eriogonum nudum
28637454,7/8/19,2019-07-09 01:03:47 UTC,Pacific Time (US & Canada),research,https://www.inaturalist.org/observations/28637454,https://inaturalist-open-data.s3.amazonaws.com/photos/44654681/medium.jpg,,1,0,FALSE,"Lake Chabot Regional Park, Castro Valley, CA, US",37.72132833,-122.1040333,12,,Castro Valley,Alameda,Yellow Starthistle,Centaurea solstitialis,Yellow Star-Thistle,Plantae,52588,Asteraceae,Centaurea,Centaurea solstitialis
28637491,7/8/19,2019-07-09 01:04:25 UTC,Pacific Time (US & Canada),research,https://www.inaturalist.org/observations/28637491,https://inaturalist-open-data.s3.amazonaws.com/photos/44654775/medium.jpg,,2,0,FALSE,"Lake Chabot Regional Park, Castro Valley, CA, US",37.72160333,-122.1040195,24,,Castro Valley,Alameda,coast tarweed,Madia sativa,coast tarweed,Plantae,53143,Asteraceae,Madia,Madia sativa
28637523,7/8/19,2019-07-09 01:06:35 UTC,Pacific Time (US & Canada),research,https://www.inaturalist.org/observations/28637523,https://inaturalist-open-data.s3.amazonaws.com/photos/44654842/medium.jpg,,1,0,FALSE,"Lake Chabot, Castro Valley, CA, US",37.72273833,-122.1037,48,,Castro Valley,Alameda,pink everlasting,Pseudognaphalium ramosissimum,pink everlasting,Plantae,53088,Asteraceae,Pseudognaphalium,Pseudognaphalium ramosissimum
28637546,7/8/19,2019-07-09 01:10:52 UTC,Pacific Time (US & Canada),research,https://www.inaturalist.org/observations/28637546,https://inaturalist-open-data.s3.amazonaws.com/photos/44654862/medium.jpg,,1,0,FALSE,"Lake Chabot Regional Park, Castro Valley, CA, US",37.724645,-122.1028445,48,,Castro Valley,Alameda,Toyon,Heteromeles arbutifolia,Toyon,Plantae,53405,Rosaceae,Heteromeles,Heteromeles arbutifolia
28637556,7/8/19,2019-07-09 01:17:49 UTC,Pacific Time (US & Canada),research,https://www.inaturalist.org/observations/28637556,https://inaturalist-open-data.s3.amazonaws.com/photos/44654936/medium.jpg,,1,0,FALSE,"Lake Chabot Regional Park, Castro Valley, CA, US",37.72692167,-122.1014167,48,,Castro Valley,Alameda,bigleaf maple,Acer macrophyllum,bigleaf maple,Plantae,48227,Sapindaceae,Acer,Acer macrophyllum
28637582,7/8/19,2019-07-09 01:22:55 UTC,Pacific Time (US & Canada),research,https://www.inaturalist.org/observations/28637582,https://inaturalist-open-data.s3.amazonaws.com/photos/44654958/medium.jpg,,1,0,FALSE,"Lake Chabot Regional Park, Castro Valley, CA, US",37.726525,-122.1002055,24,,Castro Valley,Alameda,California cudweed,Pseudognaphalium californicum,California cudweed,Plantae,53077,Asteraceae,Pseudognaphalium,Pseudognaphalium californicum
28637611,7/8/19,2019-07-09 01:13:05 UTC,Pacific Time (US & Canada),research,https://www.inaturalist.org/observations/28637611,https://inaturalist-open-data.s3.amazonaws.com/photos/44655039/medium.jpg,,1,0,FALSE,"Lake Chabot Regional Park, Castro Valley, CA, US",37.725175,-122.1020278,16,,Castro Valley,Alameda,Yorkshire fog,Holcus lanatus,Yorkshire fog,Plantae,52793,Poaceae,Holcus,Holcus lanatus
29108929,7/8/19,2019-07-09 00:53:21 UTC,Pacific Time (US & Canada),research,https://www.inaturalist.org/observations/29108929,https://static.inaturalist.org/photos/45415278/medium.jpg,,2,0,FALSE,"Anthony Chabot Regional Park, Castro Valley, CA, US",37.73883991,-122.1084213,431,,,Alameda,broad-leaved sweet pea,Lathyrus latifolius,broad-leaved sweet pea,Plantae,61009,Fabaceae,Lathyrus,Lathyrus latifolius
29109148,7/8/19,2019-07-09 01:41:48 UTC,Pacific Time (US & Canada),research,https://www.inaturalist.org/observations/29109148,https://static.inaturalist.org/photos/45415660/medium.jpg,,2,0,FALSE,"Anthony Chabot Regional Park, Castro Valley, CA, US",37.74335209,-122.1107423,467,,,Alameda,broad-leaved helleborine,Epipactis helleborine,Broad-leafed Helleborine,Plantae,50717,Orchidaceae,Epipactis,Epipactis helleborine
29109215,7/8/19,2019-07-09 01:41:03 UTC,Pacific Time (US & Canada),research,https://www.inaturalist.org/observations/29109215,https://static.inaturalist.org/photos/45415729/medium.jpg,,2,0,FALSE,"Anthony Chabot Regional Park, Oakland, CA, US",37.74147324,-122.1143426,316,,,Alameda,wavy-leafed soap plant,Chlorogalum pomeridianum,wavy-leafed soap plant,Plantae,47597,Asparagaceae,Chlorogalum,Chlorogalum pomeridianum
28637621,7/10/19,2019-07-10 17:25:48 UTC,Pacific Time (US & Canada),research,https://www.inaturalist.org/observations/28637621,https://inaturalist-open-data.s3.amazonaws.com/photos/44655054/medium.jpg,,1,0,FALSE,"Anthony Chabot Regional Park, San Leandro, CA, US",37.71777833,-122.1124195,8,,Castro Valley,Alameda,Hayfield Tarweed,Hemizonia congesta,Hayfield Tarweed,Plantae,56960,Asteraceae,Hemizonia,Hemizonia congesta
28652156,7/11/19,2019-07-12 02:28:48 UTC,Pacific Time (US & Canada),research,https://www.inaturalist.org/observations/28652156,https://inaturalist-open-data.s3.amazonaws.com/photos/44679046/medium.jpg,,1,0,FALSE,"19998 Anita Ave, Castro Valley, CA, US",37.7221415,-122.1039621,5,,Castro Valley,Alameda,wavy-leafed soap plant,Chlorogalum pomeridianum,wavy-leafed soap plant,Plantae,47597,Asparagaceae,Chlorogalum,Chlorogalum pomeridianum
28704477,7/12/19,2019-07-13 00:26:47 UTC,Pacific Time (US & Canada),research,https://www.inaturalist.org/observations/28704477,https://static.inaturalist.org/photos/44763657/medium.jpg,,1,0,FALSE,"Lake Chabot Regional Park, Castro Valley, CA, US",37.72191791,-122.1037883,305,,Castro Valley,Alameda,Pink Honeysuckle,Lonicera hispidula,Pink Honeysuckle,Plantae,53416,Caprifoliaceae,Lonicera,Lonicera hispidula
28704625,7/12/19,2019-07-13 00:29:18 UTC,Pacific Time (US & Canada),research,https://www.inaturalist.org/observations/28704625,https://static.inaturalist.org/photos/44763845/medium.jpg,,1,0,FALSE,"Lake Chabot Regional Park, Castro Valley, CA, US",37.72276507,-122.1034191,5,,Castro Valley,Alameda,orange bush monkeyflower,Diplacus aurantiacus,orange bush monkeyflower,Plantae,777371,Phrymaceae,Diplacus,Diplacus aurantiacus
28704710,7/12/19,2019-07-13 00:30:52 UTC,Pacific Time (US & Canada),research,https://www.inaturalist.org/observations/28704710,https://static.inaturalist.org/photos/44763987/medium.jpg,,1,0,FALSE,"Lake Chabot Regional Park, Castro Valley, CA, US",37.72268293,-122.1032371,10,,Castro Valley,Alameda,Ocean spray,Holodiscus discolor,Ocean spray,Plantae,53414,Rosaceae,Holodiscus,Holodiscus discolor
28704851,7/12/19,2019-07-13 00:34:12 UTC,Pacific Time (US & Canada),research,https://www.inaturalist.org/observations/28704851,https://static.inaturalist.org/photos/44764231/medium.jpg,,1,0,FALSE,"Lake Chabot Regional Park, Castro Valley, CA, US",37.72303975,-122.1029839,20,,Castro Valley,Alameda,orange bush monkeyflower,Diplacus aurantiacus,orange bush monkeyflower,Plantae,777371,Phrymaceae,Diplacus,Diplacus aurantiacus
28704917,7/12/19,2019-07-13 00:35:29 UTC,Pacific Time (US & Canada),research,https://www.inaturalist.org/observations/28704917,https://static.inaturalist.org/photos/44764322/medium.jpg,,1,0,FALSE,"Lake Chabot Regional Park, Castro Valley, CA, US",37.72302307,-122.1029218,5,,Castro Valley,Alameda,turkey tangle frogfruit,Phyla nodiflora,turkey tangle frogfruit,Plantae,59040,Verbenaceae,Phyla,Phyla nodiflora
28705425,7/12/19,2019-07-13 00:46:58 UTC,Pacific Time (US & Canada),research,https://www.inaturalist.org/observations/28705425,https://static.inaturalist.org/photos/44765656/medium.jpg,,1,0,FALSE,"Lake Chabot Regional Park, Castro Valley, CA, US",37.72513962,-122.1024921,5,,Castro Valley,Alameda,poison hemlock,Conium maculatum,poison hemlock,Plantae,52998,Apiaceae,Conium,Conium maculatum
28706115,7/12/19,2019-07-13 00:51:43 UTC,Pacific Time (US & Canada),research,https://www.inaturalist.org/observations/28706115,https://static.inaturalist.org/photos/44766391/medium.jpg,,0,0,FALSE,"Lake Chabot Regional Park, Castro Valley, CA, US",37.72527914,-122.1021084,5,,Castro Valley,Alameda,California bee plant,Scrophularia californica,California beeplant,Plantae,50812,Scrophulariaceae,Scrophularia,Scrophularia californica
28706180,7/12/19,2019-07-13 00:58:11 UTC,Pacific Time (US & Canada),research,https://www.inaturalist.org/observations/28706180,https://static.inaturalist.org/photos/44766453/medium.jpg,,2,0,FALSE,"Lake Chabot, Castro Valley, CA, US",37.72554736,-122.1021709,5,,Castro Valley,Alameda,Rosilla,Helenium puberulum,Rosilla,Plantae,53092,Asteraceae,Helenium,Helenium puberulum
28706295,7/12/19,2019-07-13 01:06:39 UTC,Pacific Time (US & Canada),research,https://www.inaturalist.org/observations/28706295,https://static.inaturalist.org/photos/44766650/medium.jpg,,1,0,FALSE,"Lake Chabot Regional Park, Castro Valley, CA, US",37.72443776,-122.1030877,5,,Castro Valley,Alameda,orange bush monkeyflower,Diplacus aurantiacus,orange bush monkeyflower,Plantae,777371,Phrymaceae,Diplacus,Diplacus aurantiacus
28706506,7/12/19,2019-07-13 01:14:47 UTC,Pacific Time (US & Canada),research,https://www.inaturalist.org/observations/28706506,https://static.inaturalist.org/photos/44767021/medium.jpg,,0,0,FALSE,"Lake Chabot Regional Park, Castro Valley, CA, US",37.72314406,-122.1032866,5,,Castro Valley,Alameda,California sagebrush,Artemisia californica,California sagebrush,Plantae,53357,Asteraceae,Artemisia,Artemisia californica
28706569,7/12/19,2019-07-13 01:15:40 UTC,Pacific Time (US & Canada),research,https://www.inaturalist.org/observations/28706569,https://static.inaturalist.org/photos/44767098/medium.jpg,,2,0,FALSE,"Lake Chabot Regional Park, Castro Valley, CA, US",37.7231607,-122.1033027,5,,Castro Valley,Alameda,Redstem Stork's-bill,Erodium cicutarium,Redstem Stork's-bill,Plantae,47687,Geraniaceae,Erodium,Erodium cicutarium
28706612,7/12/19,2019-07-13 01:17:26 UTC,Pacific Time (US & Canada),research,https://www.inaturalist.org/observations/28706612,https://static.inaturalist.org/photos/44767232/medium.jpg,,1,0,FALSE,"Lake Chabot Regional Park, Castro Valley, CA, US",37.7231788,-122.1032255,10,,Castro Valley,Alameda,poison hemlock,Conium maculatum,poison hemlock,Plantae,52998,Apiaceae,Conium,Conium maculatum
28893114,7/15/19,2019-07-15 16:46:00 UTC,Pacific Time (US & Canada),research,https://www.inaturalist.org/observations/28893114,https://inaturalist-open-data.s3.amazonaws.com/photos/45064100/medium.jpeg,,3,0,FALSE,"Anthony Chabot Regional Park, Alameda County, CA, USA",37.75568187,-122.1104554,1967,,,Alameda,Yellow Mariposa Lily,Calochortus luteus,Yellow Mariposa Lily,Plantae,51077,Liliaceae,Calochortus,Calochortus luteus
29012686,7/17/19,2019-07-17 18:59:02 UTC,Pacific Time (US & Canada),research,https://www.inaturalist.org/observations/29012686,https://static.inaturalist.org/photos/45258337/medium.jpeg,,2,0,FALSE,"Castro Valley, CA 94546, USA",37.71681542,-122.1027503,9,,Castro Valley,Alameda,common daisy,Bellis perennis,common daisy,Plantae,55563,Asteraceae,Bellis,Bellis perennis
29281018,7/21/19,2019-07-21 18:41:35 UTC,Pacific Time (US & Canada),research,https://www.inaturalist.org/observations/29281018,https://inaturalist-open-data.s3.amazonaws.com/photos/45689335/medium.jpg,,1,0,FALSE,"Anthony Chabot Regional Park, Castro Valley, CA, US",37.72857833,-122.0956333,5,,,Alameda,turkey tangle frogfruit,Phyla nodiflora,turkey tangle frogfruit,Plantae,59040,Verbenaceae,Phyla,Phyla nodiflora
29473485,7/23/19,2019-07-24 01:46:56 UTC,Pacific Time (US & Canada),research,https://www.inaturalist.org/observations/29473485,https://static.inaturalist.org/photos/45998358/medium.jpg,,1,0,FALSE,"Anthony Chabot Regional Park, Oakland, CA, US",37.79769167,-122.1547695,10,,,Alameda,scarlet monkeyflower,Erythranthe cardinalis,scarlet monkeyflower,Plantae,319974,Phrymaceae,Erythranthe,Erythranthe cardinalis
29473591,7/23/19,2019-07-24 01:52:55 UTC,Pacific Time (US & Canada),research,https://www.inaturalist.org/observations/29473591,https://static.inaturalist.org/photos/45998532/medium.jpg,,2,0,FALSE,"Anthony Chabot Regional Park, Oakland, CA, US",37.79816167,-122.1543362,10,,,Alameda,wavy-leafed soap plant,Chlorogalum pomeridianum,wavy-leafed soap plant,Plantae,47597,Asparagaceae,Chlorogalum,Chlorogalum pomeridianum
29894638,7/30/19,2019-07-30 21:11:40 UTC,Pacific Time (US & Canada),research,https://www.inaturalist.org/observations/29894638,https://static.inaturalist.org/photos/46680065/medium.jpg,,1,0,FALSE,"Anthony Chabot Regional Park, Castro Valley, CA, US",37.727395,-122.1156612,32,,,Alameda,Pacific madrone,Arbutus menziesii,Pacific madrone,Plantae,51046,Ericaceae,Arbutus,Arbutus menziesii
29894697,7/30/19,2019-07-30 21:32:18 UTC,Pacific Time (US & Canada),research,https://www.inaturalist.org/observations/29894697,https://static.inaturalist.org/photos/46680117/medium.jpg,,1,0,FALSE,"94546, Castro Valley, CA, US",37.72977833,-122.1205138,8,,Castro Valley,Alameda,Greater Quaking Grass,Briza maxima,Greater Quaking Grass,Plantae,57157,Poaceae,Briza,Briza maxima
29894733,7/30/19,2019-07-30 20:59:16 UTC,Pacific Time (US & Canada),research,https://www.inaturalist.org/observations/29894733,https://static.inaturalist.org/photos/47857904/medium.jpg,,2,0,FALSE,"Anthony Chabot Regional Park, Castro Valley, CA, US",37.72283667,-122.1104195,12,,Castro Valley,Alameda,blue elder,Sambucus cerulea,blue elder,Plantae,143799,Viburnaceae,Sambucus,Sambucus cerulea
29895568,7/30/19,2019-07-30 20:54:58 UTC,Pacific Time (US & Canada),research,https://www.inaturalist.org/observations/29895568,https://static.inaturalist.org/photos/46681698/medium.jpg,,1,0,FALSE,"Anthony Chabot Regional Park, Castro Valley, CA, US",37.72098,-122.1091388,12,,Castro Valley,Alameda,Red Valerian,Centranthus ruber,Red Valerian,Plantae,57283,Caprifoliaceae,Centranthus,Centranthus ruber
29943148,7/31/19,2019-07-31 21:37:38 UTC,Pacific Time (US & Canada),research,https://www.inaturalist.org/observations/29943148,https://static.inaturalist.org/photos/46826306/medium.jpeg,Widespread monoculture. ,1,0,FALSE,"Castro Valley, CA 94546, USA",37.71416855,-122.109169,,,Castro Valley,Alameda,Yellow Starthistle,Centaurea solstitialis,Yellow Star-Thistle,Plantae,52588,Asteraceae,Centaurea,Centaurea solstitialis
29986995,7/31/19,2019-07-31 21:27:05 UTC,Pacific Time (US & Canada),research,https://www.inaturalist.org/observations/29986995,https://static.inaturalist.org/photos/46826334/medium.jpeg,,0,0,FALSE,"Castro Valley, CA 94546, USA",37.71666718,-122.1119461,,,Castro Valley,Alameda,coast tarweed,Madia sativa,coast tarweed,Plantae,53143,Asteraceae,Madia,Madia sativa
29987009,7/31/19,2019-07-31 21:24:55 UTC,Pacific Time (US & Canada),research,https://www.inaturalist.org/observations/29987009,https://static.inaturalist.org/photos/46826357/medium.jpeg,,1,0,FALSE,"Castro Valley, CA 94546, USA",37.71619034,-122.1114655,,,Castro Valley,Alameda,Hayfield Tarweed,Hemizonia congesta,Hayfield Tarweed,Plantae,56960,Asteraceae,Hemizonia,Hemizonia congesta
30639491,8/11/19,2019-08-11 18:52:24 UTC,Pacific Time (US & Canada),research,https://www.inaturalist.org/observations/30639491,https://inaturalist-open-data.s3.amazonaws.com/photos/47878199/medium.jpg,,1,0,FALSE,"Anthony Chabot Regional Park, Castro Valley, CA, US",37.72906333,-122.0982362,10,,,Alameda,Sweet scabious,Sixalix atropurpurea,Sweet scabious,Plantae,372376,Caprifoliaceae,Sixalix,Sixalix atropurpurea
30666177,8/11/19,2019-08-11 23:58:36 UTC,Pacific Time (US & Canada),research,https://www.inaturalist.org/observations/30666177,https://inaturalist-open-data.s3.amazonaws.com/photos/47921660/medium.jpg,,2,0,FALSE,"Anthony Chabot Regional Park, Alameda County, US-CA, US",37.77318483,-122.1262507,24,,,Alameda,blue elder,Sambucus cerulea,blue elder,Plantae,143799,Viburnaceae,Sambucus,Sambucus cerulea
30666209,8/11/19,2019-08-12 00:09:23 UTC,Pacific Time (US & Canada),research,https://www.inaturalist.org/observations/30666209,https://inaturalist-open-data.s3.amazonaws.com/photos/47921725/medium.jpg,,2,0,FALSE,"Anthony Chabot Regional Park, Alameda County, US-CA, US",37.77864659,-122.1287804,16,,,Alameda,lemon balm,Melissa officinalis,lemon balm,Plantae,59901,Lamiaceae,Melissa,Melissa officinalis
31070631,8/18/19,2019-08-18 18:23:46 UTC,Pacific Time (US & Canada),research,https://www.inaturalist.org/observations/31070631,https://static.inaturalist.org/photos/48591420/medium.jpg,,2,0,FALSE,"Anthony Chabot Regional Park, Alameda County, US-CA, US",37.79770274,-122.1541154,9,,,Alameda,Cherry-plum,Prunus cerasifera,Cherry-plum,Plantae,55837,Rosaceae,Prunus,Prunus cerasifera
31070704,8/18/19,2019-08-18 18:53:48 UTC,Pacific Time (US & Canada),research,https://www.inaturalist.org/observations/31070704,https://static.inaturalist.org/photos/48591545/medium.jpg,,2,0,FALSE,"Anthony Chabot Regional Park, Oakland, CA, US",37.79604064,-122.1455943,10,,,Alameda,California bay,Umbellularia californica,California bay,Plantae,48807,Lauraceae,Umbellularia,Umbellularia californica
31084140,8/18/19,2019-08-18 21:07:17 UTC,Pacific Time (US & Canada),research,https://www.inaturalist.org/observations/31084140,https://inaturalist-open-data.s3.amazonaws.com/photos/50155393/medium.jpeg,,1,0,FALSE,"Anthony Chabot Regional Park, Alameda County, US-CA, US",37.7513504,-122.1140747,,,,Alameda,California fuchsia,Epilobium canum,California fuchsia,Plantae,53051,Onagraceae,Epilobium,Epilobium canum
31504311,8/25/19,2019-08-25 20:59:53 UTC,Pacific Time (US & Canada),research,https://www.inaturalist.org/observations/31504311,https://inaturalist-open-data.s3.amazonaws.com/photos/49310744/medium.jpg,,1,0,FALSE,"Anthony Chabot Regional Park, Oakland, CA, US",37.79760833,-122.1547555,5,,,Alameda,scarlet monkeyflower,Erythranthe cardinalis,scarlet monkeyflower,Plantae,319974,Phrymaceae,Erythranthe,Erythranthe cardinalis
31937575,9/1/19,,UTC,research,https://www.inaturalist.org/observations/31937575,https://inaturalist-open-data.s3.amazonaws.com/photos/50037713/medium.jpeg,,1,0,FALSE,Castro Valley,37.71713659,-122.1046881,,,Castro Valley,Alameda,Ocean spray,Holodiscus discolor,Ocean spray,Plantae,53414,Rosaceae,Holodiscus,Holodiscus discolor
108151248,9/7/19,2019-09-07 20:10:59 UTC,Pacific Time (US & Canada),research,https://www.inaturalist.org/observations/108151248,https://static.inaturalist.org/photos/182035857/medium.jpg,,1,0,FALSE,"Anthony Chabot Regional Park, Castro Valley, CA, US",37.73454667,-122.0915833,10,,,Alameda,coyote brush,Baccharis pilularis,coyote brush,Plantae,53359,Asteraceae,Baccharis,Baccharis pilularis
32373220,9/8/19,2019-09-08 19:40:31 UTC,Pacific Time (US & Canada),research,https://www.inaturalist.org/observations/32373220,https://inaturalist-open-data.s3.amazonaws.com/photos/50766861/medium.jpg,,2,0,FALSE,"Anthony Chabot Regional Park, Oakland, CA, US",37.79316997,-122.1422769,89,,,Alameda,bull thistle,Cirsium vulgare,Bull Thistle,Plantae,52989,Asteraceae,Cirsium,Cirsium vulgare
32373614,9/8/19,2019-09-08 18:49:31 UTC,Pacific Time (US & Canada),research,https://www.inaturalist.org/observations/32373614,https://inaturalist-open-data.s3.amazonaws.com/photos/50767585/medium.jpg,,1,0,FALSE,"Anthony Chabot Regional Park, Oakland, CA, US",37.79531167,-122.1473222,10,,,Alameda,Pink Honeysuckle,Lonicera hispidula,Pink Honeysuckle,Plantae,53416,Caprifoliaceae,Lonicera,Lonicera hispidula
32384812,9/8/19,2019-09-08 18:55:43 UTC,Pacific Time (US & Canada),research,https://www.inaturalist.org/observations/32384812,https://inaturalist-open-data.s3.amazonaws.com/photos/50787703/medium.jpg,,1,0,FALSE,"Anthony Chabot Regional Park, Oakland, CA, US",37.79732833,-122.147675,65,,,Alameda,coffeeberry,Frangula californica,coffeeberry,Plantae,53423,Rhamnaceae,Frangula,Frangula californica
32393032,9/8/19,2019-09-09 02:12:36 UTC,Pacific Time (US & Canada),research,https://www.inaturalist.org/observations/32393032,https://inaturalist-open-data.s3.amazonaws.com/photos/50801957/medium.jpeg,,2,0,FALSE,"Castro Valley, CA 94546, USA",37.72351456,-122.1033173,,,Castro Valley,Alameda,Sweet scabious,Sixalix atropurpurea,Sweet scabious,Plantae,372376,Caprifoliaceae,Sixalix,Sixalix atropurpurea
32497688,9/10/19,2019-09-10 22:53:21 UTC,Pacific Time (US & Canada),research,https://www.inaturalist.org/observations/32497688,https://static.inaturalist.org/photos/50975304/medium.jpeg,,1,0,FALSE,"Castro Valley, CA 94546, USA",37.7155947,-122.1060367,15,,Castro Valley,Alameda,Pacific Aster,Symphyotrichum chilense,Pacific Aster,Plantae,56861,Asteraceae,Symphyotrichum,Symphyotrichum chilense
32500196,9/10/19,2019-09-10 23:43:11 UTC,Pacific Time (US & Canada),research,https://www.inaturalist.org/observations/32500196,https://static.inaturalist.org/photos/50979761/medium.jpeg,,1,0,FALSE,"Anthony Chabot Regional Park, Alameda County, US-CA, US",37.712739,-122.1056751,8,,Castro Valley,Alameda,coast live oak,Quercus agrifolia,coast live oak,Plantae,47850,Fagaceae,Quercus,Quercus agrifolia
32541348,9/11/19,2019-09-11 18:26:38 UTC,Pacific Time (US & Canada),research,https://www.inaturalist.org/observations/32541348,https://static.inaturalist.org/photos/51049034/medium.jpg,,2,0,FALSE,"Anthony Chabot Regional Park, Castro Valley, CA, US",37.726055,-122.1156612,24,,Castro Valley,Alameda,blue elder,Sambucus cerulea,blue elder,Plantae,143799,Viburnaceae,Sambucus,Sambucus cerulea
38124415,9/13/19,2019-09-13 16:02:51 UTC,Pacific Time (US & Canada),research,https://www.inaturalist.org/observations/38124415,https://inaturalist-open-data.s3.amazonaws.com/photos/60547982/medium.jpeg,,1,0,FALSE,"Anthony Chabot Regional Park, Alameda County, US-CA, US",37.71634873,-122.1040887,9,,Castro Valley,Alameda,California fuchsia,Epilobium canum,California fuchsia,Plantae,53051,Onagraceae,Epilobium,Epilobium canum
32737821,9/14/19,2019-09-15 01:03:25 UTC,Pacific Time (US & Canada),research,https://www.inaturalist.org/observations/32737821,https://inaturalist-open-data.s3.amazonaws.com/photos/51367765/medium.jpg,,2,0,FALSE,"Anthony Chabot Regional Park, Castro Valley, CA, US",37.73453598,-122.0963893,24,,,Alameda,cardo mariano,Silybum marianum,milk thistle,Plantae,52586,Asteraceae,Silybum,Silybum marianum
32801570,9/15/19,2019-09-15 16:27:24 UTC,Pacific Time (US & Canada),research,https://www.inaturalist.org/observations/32801570,https://static.inaturalist.org/photos/51473253/medium.jpg,,1,0,FALSE,"Lake Chabot Regional Park, Castro Valley, CA, US",37.71778833,-122.1035167,6,,Castro Valley,Alameda,bristly oxtongue,Helminthotheca echioides,bristly oxtongue,Plantae,61906,Asteraceae,Helminthotheca,Helminthotheca echioides
33177494,9/21/19,2019-09-21 23:34:10 UTC,Pacific Time (US & Canada),research,https://www.inaturalist.org/observations/33177494,https://static.inaturalist.org/photos/52087025/medium.jpg,,2,0,FALSE,"Anthony Chabot Regional Park, Alameda County, US-CA, US",37.73091733,-122.1236554,8,,Oakland,Alameda,Belladonna Lily,Amaryllis belladonna,Belladonna Lily,Plantae,61827,Amaryllidaceae,Amaryllis,Amaryllis belladonna
33196072,9/21/19,2019-09-21 23:03:00 UTC,Pacific Time (US & Canada),research,https://www.inaturalist.org/observations/33196072,https://static.inaturalist.org/photos/52116500/medium.jpg,,1,0,FALSE,"Alameda County, CA, USA",37.72217312,-122.0949955,15,,Castro Valley,Alameda,Summer Lupine,Lupinus formosus,Summer Lupine,Plantae,57054,Fabaceae,Lupinus,Lupinus formosus
33208086,9/22/19,2019-09-22 18:27:44 UTC,Pacific Time (US & Canada),research,https://www.inaturalist.org/observations/33208086,https://static.inaturalist.org/photos/52136323/medium.jpg,,3,0,FALSE,"Anthony Chabot Regional Park, Castro Valley, CA, US",37.71978099,-122.1084883,5,,Castro Valley,Alameda,blue elder,Sambucus cerulea,blue elder,Plantae,143799,Viburnaceae,Sambucus,Sambucus cerulea
33686809,9/25/19,2019-09-25 19:28:32 UTC,Eastern Time (US & Canada),research,https://www.inaturalist.org/observations/33686809,https://inaturalist-open-data.s3.amazonaws.com/photos/52935483/medium.jpeg,,0,0,FALSE,"17410 Lake Chabot Rd, Castro Valley, CA 94546, USA",37.72611237,-122.1191635,,,Castro Valley,Alameda,Belladonna Lily,Amaryllis belladonna,Belladonna Lily,Plantae,61827,Amaryllidaceae,Amaryllis,Amaryllis belladonna
33443838,9/26/19,2019-09-26 19:23:35 UTC,Pacific Time (US & Canada),research,https://www.inaturalist.org/observations/33443838,https://static.inaturalist.org/photos/52528138/medium.jpg,,1,0,FALSE,"Anthony Chabot Regional Park, Castro Valley, CA, US",37.74095861,-122.0820981,8,,,Alameda,turkey mullein,Croton setiger,turkey mullein,Plantae,154156,Euphorbiaceae,Croton,Croton setiger
33734850,10/1/19,2019-10-01 20:50:39 UTC,Pacific Time (US & Canada),research,https://www.inaturalist.org/observations/33734850,https://static.inaturalist.org/photos/53014371/medium.jpg,,1,0,FALSE,"Anthony Chabot Regional Park, San Leandro, CA, US",37.71423377,-122.1053346,22,,Castro Valley,Alameda,Yellow Starthistle,Centaurea solstitialis,Yellow Star-Thistle,Plantae,52588,Asteraceae,Centaurea,Centaurea solstitialis
33734871,10/1/19,2019-10-01 20:53:13 UTC,Pacific Time (US & Canada),research,https://www.inaturalist.org/observations/33734871,https://static.inaturalist.org/photos/53014436/medium.jpg,,1,0,FALSE,"Anthony Chabot Regional Park, San Leandro, CA, US",37.713842,-122.1057842,22,,Castro Valley,Alameda,coyote brush,Baccharis pilularis,coyote brush,Plantae,53359,Asteraceae,Baccharis,Baccharis pilularis
33734895,10/1/19,2019-10-01 20:55:27 UTC,Pacific Time (US & Canada),research,https://www.inaturalist.org/observations/33734895,https://static.inaturalist.org/photos/53014501/medium.jpg,,1,0,FALSE,"Anthony Chabot Regional Park, San Leandro, CA, US",37.71334106,-122.1054078,22,,Castro Valley,Alameda,fennel,Foeniculum vulgare,fennel,Plantae,53052,Apiaceae,Foeniculum,Foeniculum vulgare
33734908,10/1/19,2019-10-01 20:57:03 UTC,Pacific Time (US & Canada),research,https://www.inaturalist.org/observations/33734908,https://static.inaturalist.org/photos/53014535/medium.jpg,,1,0,FALSE,"Anthony Chabot Regional Park, San Leandro, CA, US",37.71311868,-122.1055129,22,,Castro Valley,Alameda,bristly oxtongue,Helminthotheca echioides,bristly oxtongue,Plantae,61906,Asteraceae,Helminthotheca,Helminthotheca echioides
33734911,10/1/19,2019-10-01 20:58:11 UTC,Pacific Time (US & Canada),research,https://www.inaturalist.org/observations/33734911,https://static.inaturalist.org/photos/53014555/medium.jpg,,1,0,FALSE,"Anthony Chabot Regional Park, San Leandro, CA, US",37.71308078,-122.1053975,22,,Castro Valley,Alameda,poison hemlock,Conium maculatum,poison hemlock,Plantae,52998,Apiaceae,Conium,Conium maculatum
33734919,10/1/19,2019-10-01 20:58:51 UTC,Pacific Time (US & Canada),research,https://www.inaturalist.org/observations/33734919,https://static.inaturalist.org/photos/53014568/medium.jpg,,1,0,FALSE,"Anthony Chabot Regional Park, San Leandro, CA, US",37.71295502,-122.1056444,22,,Castro Valley,Alameda,Armenian Blackberry,Rubus armeniacus,Armenian Blackberry,Plantae,61317,Rosaceae,Rubus,Rubus armeniacus
33734933,10/1/19,2019-10-01 21:00:06 UTC,Pacific Time (US & Canada),research,https://www.inaturalist.org/observations/33734933,https://static.inaturalist.org/photos/53014607/medium.jpg,,1,0,FALSE,"Anthony Chabot Regional Park, San Leandro, CA, US",37.71299421,-122.1056503,22,,Castro Valley,Alameda,California bay,Umbellularia californica,California bay,Plantae,48807,Lauraceae,Umbellularia,Umbellularia californica
33734941,10/1/19,2019-10-01 21:00:42 UTC,Pacific Time (US & Canada),research,https://www.inaturalist.org/observations/33734941,https://static.inaturalist.org/photos/53014631/medium.jpg,,1,0,FALSE,"Anthony Chabot Regional Park, San Leandro, CA, US",37.71289604,-122.1056183,22,,Castro Valley,Alameda,Pacific poison oak,Toxicodendron diversilobum,Pacific poison oak,Plantae,51080,Anacardiaceae,Toxicodendron,Toxicodendron diversilobum
33734947,10/1/19,2019-10-01 21:02:07 UTC,Pacific Time (US & Canada),research,https://www.inaturalist.org/observations/33734947,https://static.inaturalist.org/photos/53014650/medium.jpg,,1,0,FALSE,"Anthony Chabot Regional Park, San Leandro, CA, US",37.71322486,-122.1054189,22,,Castro Valley,Alameda,coast live oak,Quercus agrifolia,coast live oak,Plantae,47850,Fagaceae,Quercus,Quercus agrifolia
33734988,10/1/19,2019-10-01 21:03:21 UTC,Pacific Time (US & Canada),research,https://www.inaturalist.org/observations/33734988,https://static.inaturalist.org/photos/53014711/medium.jpg,,1,0,FALSE,"Anthony Chabot Regional Park, San Leandro, CA, US",37.71367845,-122.1050676,22,,Castro Valley,Alameda,California poppy,Eschscholzia californica,California poppy,Plantae,48225,Papaveraceae,Eschscholzia,Eschscholzia californica
33735004,10/1/19,2019-10-01 21:04:16 UTC,Pacific Time (US & Canada),research,https://www.inaturalist.org/observations/33735004,https://static.inaturalist.org/photos/53014731/medium.jpg,,2,0,FALSE,"Anthony Chabot Regional Park, San Leandro, CA, US",37.71356678,-122.105228,22,,Castro Valley,Alameda,ribwort plantain,Plantago lanceolata,ribwort plantain,Plantae,53178,Plantaginaceae,Plantago,Plantago lanceolata
33971917,10/6/19,2019-10-06 20:17:33 UTC,Pacific Time (US & Canada),research,https://www.inaturalist.org/observations/33971917,https://static.inaturalist.org/photos/53412385/medium.jpg,,2,0,FALSE,"Lake Chabot Regional Park, Castro Valley, CA, US",37.71959839,-122.1050829,5,,Castro Valley,Alameda,California buckeye,Aesculus californica,California buckeye,Plantae,53348,Sapindaceae,Aesculus,Aesculus californica
33990062,10/6/19,2019-10-06 23:22:03 UTC,Pacific Time (US & Canada),research,https://www.inaturalist.org/observations/33990062,https://static.inaturalist.org/photos/53443779/medium.jpeg,,1,0,FALSE,"Castro Valley, CA 94552, USA",37.76264191,-122.1083984,,,,Alameda,Stinkwort,Dittrichia graveolens,Stinkwort,Plantae,58822,Asteraceae,Dittrichia,Dittrichia graveolens
34414713,10/15/19,2019-10-15 16:54:02 UTC,Pacific Time (US & Canada),research,https://www.inaturalist.org/observations/34414713,https://static.inaturalist.org/photos/54160351/medium.jpg,,1,0,FALSE,"Anthony Chabot Regional Park, San Leandro, CA, US",37.71530586,-122.1103718,4,,Castro Valley,Alameda,turkey mullein,Croton setiger,turkey mullein,Plantae,154156,Euphorbiaceae,Croton,Croton setiger
34508472,10/15/19,2019-10-15 17:58:26 UTC,Pacific Time (US & Canada),research,https://www.inaturalist.org/observations/34508472,https://inaturalist-open-data.s3.amazonaws.com/photos/54318646/medium.jpg,,1,0,FALSE,"Anthony Chabot Regional Park, Castro Valley, CA, US",37.72118,-122.1093612,10,,Castro Valley,Alameda,Red Valerian,Centranthus ruber,Red Valerian,Plantae,57283,Caprifoliaceae,Centranthus,Centranthus ruber
35596485,11/11/19,2019-11-11 23:30:58 UTC,Pacific Time (US & Canada),research,https://www.inaturalist.org/observations/35596485,https://inaturalist-open-data.s3.amazonaws.com/photos/56147317/medium.jpeg,,1,0,FALSE,"Castro Valley, CA 94546, USA",37.71915436,-122.1052475,,,Castro Valley,Alameda,California buckeye,Aesculus californica,California buckeye,Plantae,53348,Sapindaceae,Aesculus,Aesculus californica
35596674,11/11/19,2019-11-11 22:53:56 UTC,Pacific Time (US & Canada),research,https://www.inaturalist.org/observations/35596674,https://inaturalist-open-data.s3.amazonaws.com/photos/56147666/medium.jpeg,,1,0,FALSE,"Castro Valley, CA 94546, USA",37.71685791,-122.1004791,,,Castro Valley,Alameda,Pacific poison oak,Toxicodendron diversilobum,Pacific poison oak,Plantae,51080,Anacardiaceae,Toxicodendron,Toxicodendron diversilobum
35596728,11/11/19,2019-11-11 22:45:22 UTC,Pacific Time (US & Canada),research,https://www.inaturalist.org/observations/35596728,https://inaturalist-open-data.s3.amazonaws.com/photos/56147753/medium.jpeg,,1,0,FALSE,"Castro Valley, CA 94546, USA",37.71694183,-122.1003189,,,Castro Valley,Alameda,California bay,Umbellularia californica,California bay,Plantae,48807,Lauraceae,Umbellularia,Umbellularia californica
35597215,11/11/19,2019-11-11 22:36:19 UTC,Pacific Time (US & Canada),research,https://www.inaturalist.org/observations/35597215,https://inaturalist-open-data.s3.amazonaws.com/photos/56148594/medium.jpeg,,2,0,FALSE,"Castro Valley, CA 94546, USA",37.71704102,-122.1020584,,,Castro Valley,Alameda,coast live oak,Quercus agrifolia,coast live oak,Plantae,47850,Fagaceae,Quercus,Quercus agrifolia
35597378,11/11/19,2019-11-11 22:37:10 UTC,Pacific Time (US & Canada),research,https://www.inaturalist.org/observations/35597378,https://inaturalist-open-data.s3.amazonaws.com/photos/56148988/medium.jpeg,,2,0,FALSE,"Castro Valley, CA 94546, USA",37.71704102,-122.1020584,,,Castro Valley,Alameda,coast live oak,Quercus agrifolia,coast live oak,Plantae,47850,Fagaceae,Quercus,Quercus agrifolia
36235285,11/30/19,2019-11-30 15:51:53 UTC,UTC,research,https://www.inaturalist.org/observations/36235285,https://static.inaturalist.org/photos/57254431/medium.jpg,,2,0,FALSE,"Lake Chabot Regional Park, Castro Valley, CA, US",37.71784813,-122.1035811,6,,Castro Valley,Alameda,fuller's teasel,Dipsacus sativus,fuller's teasel,Plantae,53028,Caprifoliaceae,Dipsacus,Dipsacus sativus
36235348,11/30/19,2019-11-30 15:53:53 UTC,UTC,research,https://www.inaturalist.org/observations/36235348,https://static.inaturalist.org/photos/57254694/medium.jpg,,2,0,FALSE,"Lake Chabot Regional Park, Castro Valley, CA, US",37.71845898,-122.104299,6,,Castro Valley,Alameda,coyote brush,Baccharis pilularis,coyote brush,Plantae,53359,Asteraceae,Baccharis,Baccharis pilularis
36235422,11/30/19,2019-11-30 15:55:48 UTC,UTC,research,https://www.inaturalist.org/observations/36235422,https://static.inaturalist.org/photos/57254722/medium.jpg,,2,0,FALSE,"Lake Chabot Regional Park, Castro Valley, CA, US",37.71877951,-122.1046824,4,,Castro Valley,Alameda,Armenian Blackberry,Rubus armeniacus,Armenian Blackberry,Plantae,61317,Rosaceae,Rubus,Rubus armeniacus
36235581,11/30/19,2019-11-30 15:59:20 UTC,UTC,research,https://www.inaturalist.org/observations/36235581,https://static.inaturalist.org/photos/57256572/medium.jpg,,2,0,FALSE,"Lake Chabot Regional Park, Castro Valley, CA, US",37.71940424,-122.1051689,4,,Castro Valley,Alameda,California buckeye,Aesculus californica,California buckeye,Plantae,53348,Sapindaceae,Aesculus,Aesculus californica
36235866,11/30/19,2019-11-30 16:02:36 UTC,UTC,research,https://www.inaturalist.org/observations/36235866,https://static.inaturalist.org/photos/57255328/medium.jpg,,2,0,FALSE,"Lake Chabot Regional Park, Castro Valley, CA, US",37.72047073,-122.1044703,5,,Castro Valley,Alameda,bigleaf maple,Acer macrophyllum,bigleaf maple,Plantae,48227,Sapindaceae,Acer,Acer macrophyllum
36236226,11/30/19,2019-11-30 16:14:42 UTC,UTC,research,https://www.inaturalist.org/observations/36236226,https://static.inaturalist.org/photos/57256620/medium.jpg,,2,0,FALSE,"Lake Chabot Regional Park, Castro Valley, CA, US",37.7231456,-122.1033223,7,,Castro Valley,Alameda,California sagebrush,Artemisia californica,California sagebrush,Plantae,53357,Asteraceae,Artemisia,Artemisia californica
36236233,11/30/19,2019-11-30 16:15:31 UTC,UTC,research,https://www.inaturalist.org/observations/36236233,https://static.inaturalist.org/photos/57256632/medium.jpg,,2,0,FALSE,"Lake Chabot Regional Park, Castro Valley, CA, US",37.72314108,-122.1033547,4,,Castro Valley,Alameda,fennel,Foeniculum vulgare,fennel,Plantae,53052,Apiaceae,Foeniculum,Foeniculum vulgare
36263170,12/1/19,2019-12-01 19:18:15 UTC,Pacific Time (US & Canada),research,https://www.inaturalist.org/observations/36263170,https://static.inaturalist.org/photos/57485643/medium.jpg,,1,0,FALSE,"Anthony Chabot Regional Park, Castro Valley, CA, US",37.72992246,-122.0926357,10,,,Alameda,poison hemlock,Conium maculatum,poison hemlock,Plantae,52998,Apiaceae,Conium,Conium maculatum
37362473,1/5/20,2020-01-05 23:52:00 UTC,Pacific Time (US & Canada),research,https://www.inaturalist.org/observations/37362473,https://inaturalist-open-data.s3.amazonaws.com/photos/59216415/medium.jpeg,,2,0,FALSE,"Alameda County, CA, USA",37.72399444,-122.0846944,5,,Castro Valley,Alameda,broadleaf forget-me-not,Myosotis latifolia,broadleaf forget-me-not,Plantae,49132,Boraginaceae,Myosotis,Myosotis latifolia
37420896,1/6/20,2020-01-06 12:11:32 UTC,UTC,research,https://www.inaturalist.org/observations/37420896,https://static.inaturalist.org/photos/59320095/medium.jpeg,,0,0,FALSE,"Oakland, CA 94619, USA",37.76708221,-122.1195908,,,,Alameda,Bunch-flowered Daffodil,Narcissus tazetta,Bunch-flowered Daffodil,Plantae,56027,Amaryllidaceae,Narcissus,Narcissus tazetta
37502344,1/11/20,2020-01-11 21:10:47 UTC,Pacific Time (US & Canada),research,https://www.inaturalist.org/observations/37502344,https://inaturalist-open-data.s3.amazonaws.com/photos/59462863/medium.jpg,,2,0,FALSE,"Anthony Chabot Regional Park, Oakland, CA, US",37.78234167,-122.1320638,14,,,Alameda,fuller's teasel,Dipsacus sativus,fuller's teasel,Plantae,53028,Caprifoliaceae,Dipsacus,Dipsacus sativus
37502559,1/11/20,2020-01-11 22:41:31 UTC,Pacific Time (US & Canada),research,https://www.inaturalist.org/observations/37502559,https://inaturalist-open-data.s3.amazonaws.com/photos/59463256/medium.jpg,,1,0,FALSE,"Anthony Chabot Regional Park, Oakland, CA, US",37.77317,-122.1284112,11,,,Alameda,poison hemlock,Conium maculatum,poison hemlock,Plantae,52998,Apiaceae,Conium,Conium maculatum
37503880,1/11/20,2020-01-12 00:11:06 UTC,Pacific Time (US & Canada),research,https://www.inaturalist.org/observations/37503880,https://static.inaturalist.org/photos/59470588/medium.jpg,,1,0,FALSE,"Lake Chabot Regional Park, Castro Valley, CA, US",37.72733933,-122.095573,10,,Castro Valley,Alameda,Stinking iris,Iris foetidissima,Stinking iris,Plantae,64331,Iridaceae,Iris,Iris foetidissima
37506740,1/11/20,2020-01-12 00:12:45 UTC,Pacific Time (US & Canada),research,https://www.inaturalist.org/observations/37506740,https://static.inaturalist.org/photos/59470523/medium.jpg,,1,0,FALSE,"Lake Chabot Regional Park, Castro Valley, CA, US",37.72745479,-122.0956313,10,,Castro Valley,Alameda,Fremont's Deathcamas,Toxicoscordion fremontii,Common star lily,Plantae,49649,Melanthiaceae,Toxicoscordion,Toxicoscordion fremontii
37824142,1/20/20,2020-01-20 20:04:06 UTC,Pacific Time (US & Canada),research,https://www.inaturalist.org/observations/37824142,https://inaturalist-open-data.s3.amazonaws.com/photos/60040942/medium.jpeg,,0,0,FALSE,"Anthony Chabot Regional Park, Alameda County, US-CA, US",37.79544857,-122.1465198,194,,,Alameda,Brittleleaf Manzanita,Arctostaphylos crustacea,Brittleleaf Manzanita,Plantae,75507,Ericaceae,Arctostaphylos,Arctostaphylos crustacea
37824189,1/20/20,2020-01-20 21:22:14 UTC,Pacific Time (US & Canada),research,https://www.inaturalist.org/observations/37824189,https://inaturalist-open-data.s3.amazonaws.com/photos/60041027/medium.jpeg,,0,0,FALSE,"Oakland, CA 94619, USA",37.79067956,-122.1360008,185,,,Alameda,Brittleleaf Manzanita,Arctostaphylos crustacea,Brittleleaf Manzanita,Plantae,75507,Ericaceae,Arctostaphylos,Arctostaphylos crustacea
38159866,1/31/20,2020-01-31 13:32:23 UTC,UTC,research,https://www.inaturalist.org/observations/38159866,https://static.inaturalist.org/photos/60608192/medium.jpg,,0,0,FALSE,"Anthony Chabot Regional Park, Castro Valley, CA, US",37.71996333,-122.1084528,24,,Castro Valley,Alameda,California sagebrush,Artemisia californica,California sagebrush,Plantae,53357,Asteraceae,Artemisia,Artemisia californica
38201327,1/31/20,2020-01-31 14:15:05 UTC,UTC,research,https://www.inaturalist.org/observations/38201327,https://static.inaturalist.org/photos/60678992/medium.jpg,,0,0,FALSE,"Anthony Chabot Regional Park, Castro Valley, CA, US",37.72283833,-122.1103528,16,,Castro Valley,Alameda,poison hemlock,Conium maculatum,poison hemlock,Plantae,52998,Apiaceae,Conium,Conium maculatum
38201352,1/31/20,2020-01-31 14:14:59 UTC,UTC,research,https://www.inaturalist.org/observations/38201352,https://static.inaturalist.org/photos/60679039/medium.jpg,,1,0,FALSE,"Anthony Chabot Regional Park, Castro Valley, CA, US",37.72283833,-122.1103138,16,,Castro Valley,Alameda,wavy-leafed soap plant,Chlorogalum pomeridianum,wavy-leafed soap plant,Plantae,47597,Asparagaceae,Chlorogalum,Chlorogalum pomeridianum
38731399,2/16/20,2020-02-16 15:51:02 UTC,UTC,research,https://www.inaturalist.org/observations/38731399,https://static.inaturalist.org/photos/61602689/medium.jpeg,,2,0,FALSE,"Oakland, CA 94619, USA",37.79328156,-122.1414795,,,,Alameda,Warrior's Plume,Pedicularis densiflora,Warrior's Plume,Plantae,49645,Orobanchaceae,Pedicularis,Pedicularis densiflora
38740787,2/16/20,2020-02-16 15:15:09 UTC,UTC,research,https://www.inaturalist.org/observations/38740787,https://static.inaturalist.org/photos/61619058/medium.jpeg,,1,0,FALSE,"Lake Chabot, CA 94546, USA",37.72849267,-122.0954971,5,,,Alameda,California buckeye,Aesculus californica,California buckeye,Plantae,53348,Sapindaceae,Aesculus,Aesculus californica
38740994,2/16/20,2020-02-16 15:03:52 UTC,UTC,research,https://www.inaturalist.org/observations/38740994,https://static.inaturalist.org/photos/61619545/medium.jpeg,,2,0,FALSE,"Lake Chabot, CA 94546, USA",37.72969816,-122.092827,5,,,Alameda,California bay,Umbellularia californica,California bay,Plantae,48807,Lauraceae,Umbellularia,Umbellularia californica
38741124,2/16/20,2020-02-16 15:03:31 UTC,UTC,research,https://www.inaturalist.org/observations/38741124,https://static.inaturalist.org/photos/61619805/medium.jpeg,,2,0,FALSE,"Lake Chabot, CA 94546, USA",37.72969816,-122.092827,5,,,Alameda,common daisy,Bellis perennis,common daisy,Plantae,55563,Asteraceae,Bellis,Bellis perennis
38775401,2/17/20,2020-02-17 13:46:58 UTC,UTC,research,https://www.inaturalist.org/observations/38775401,https://inaturalist-open-data.s3.amazonaws.com/photos/61679622/medium.jpeg,,1,0,FALSE,"Castro Valley, CA 94546, USA",37.7241179,-122.091864,5,,Castro Valley,Alameda,Bermuda buttercup,Oxalis pes-caprae,Bermuda buttercup,Plantae,53169,Oxalidaceae,Oxalis,Oxalis pes-caprae
38815933,2/18/20,2020-02-18 17:38:53 UTC,UTC,research,https://www.inaturalist.org/observations/38815933,https://inaturalist-open-data.s3.amazonaws.com/photos/61747838/medium.jpg,"Interesting looking plant. 

",2,0,FALSE,"Anthony Chabot Regional Park, Castro Valley, CA, US",37.71109499,-122.1048507,5,,Castro Valley,Alameda,California manroot,Marah fabacea,California manroot,Plantae,205330,Cucurbitaceae,Marah,Marah fabacea
40544229,2/22/20,2020-02-22 10:17:00 UTC,UTC,research,https://www.inaturalist.org/observations/40544229,https://static.inaturalist.org/photos/64254877/medium.jpg,,2,0,FALSE,"Anthony Chabot Regional Park, Alameda County, US-CA, US",37.77856458,-122.1272775,20,,,Alameda,French broom,Genista monspessulana,French broom,Plantae,53403,Fabaceae,Genista,Genista monspessulana
40544259,2/22/20,2020-02-22 11:39:21 UTC,UTC,research,https://www.inaturalist.org/observations/40544259,https://static.inaturalist.org/photos/64254936/medium.jpg,,2,0,FALSE,"Anthony Chabot Regional Park, Alameda County, US-CA, US",37.76234262,-122.118097,30,,,Alameda,Toyon,Heteromeles arbutifolia,Toyon,Plantae,53405,Rosaceae,Heteromeles,Heteromeles arbutifolia
39096744,2/23/20,2020-02-23 10:05:33 UTC,UTC,research,https://www.inaturalist.org/observations/39096744,https://inaturalist-open-data.s3.amazonaws.com/photos/62033881/medium.jpeg,,1,0,FALSE,"Castro Valley, CA 94546, USA",37.71725531,-122.1045665,5,,Castro Valley,Alameda,Cardre  lainer,Dipsacus sativus,fuller's teasel,Plantae,53028,Caprifoliaceae,Dipsacus,Dipsacus sativus
39394750,2/23/20,2020-02-23 19:38:58 UTC,Pacific Time (US & Canada),research,https://www.inaturalist.org/observations/39394750,https://inaturalist-open-data.s3.amazonaws.com/photos/62494398/medium.jpg,,2,0,FALSE,"Lake Chabot Regional Park, Castro Valley, CA, US",37.72552167,-122.0964055,10,,Castro Valley,Alameda,Pacific poison oak,Toxicodendron diversilobum,Pacific poison oak,Plantae,51080,Anacardiaceae,Toxicodendron,Toxicodendron diversilobum
39175195,2/24/20,2020-02-24 18:41:35 UTC,Pacific Time (US & Canada),research,https://www.inaturalist.org/observations/39175195,https://inaturalist-open-data.s3.amazonaws.com/photos/62116096/medium.jpg,,2,0,FALSE,"Anthony Chabot Regional Park, Alameda County, US-CA, US",37.74030111,-122.1156774,38,,Oakland,Alameda,Fremont's Deathcamas,Toxicoscordion fremontii,Common star lily,Plantae,49649,Melanthiaceae,Toxicoscordion,Toxicoscordion fremontii
39177610,2/24/20,2020-02-24 10:19:37 UTC,UTC,research,https://www.inaturalist.org/observations/39177610,https://static.inaturalist.org/photos/62120001/medium.jpg,,1,0,FALSE,"Anthony Chabot Regional Park, Alameda County, US-CA, US",37.73748223,-122.1160143,5,,Oakland,Alameda,Pacific Sanicle,Sanicula crassicaulis,Pacific Sanicle,Plantae,53201,Apiaceae,Sanicula,Sanicula crassicaulis
39177680,2/24/20,2020-02-24 10:27:05 UTC,UTC,research,https://www.inaturalist.org/observations/39177680,https://static.inaturalist.org/photos/62120102/medium.jpg,,1,0,FALSE,"Anthony Chabot Regional Park, Oakland, CA, US",37.73990045,-122.1162802,5,,Oakland,Alameda,Fremont's Deathcamas,Toxicoscordion fremontii,Common star lily,Plantae,49649,Melanthiaceae,Toxicoscordion,Toxicoscordion fremontii
39253982,2/26/20,2020-02-26 12:58:22 UTC,UTC,research,https://www.inaturalist.org/observations/39253982,https://inaturalist-open-data.s3.amazonaws.com/photos/62253487/medium.jpg,,2,0,FALSE,"Lake Chabot Regional Park, Castro Valley, CA, US",37.71677833,-122.0983722,5,,Castro Valley,Alameda,Sun Cup,Taraxia ovata,Sun Cup,Plantae,68182,Onagraceae,Taraxia,Taraxia ovata
39254746,2/26/20,2020-02-26 13:21:06 UTC,UTC,research,https://www.inaturalist.org/observations/39254746,https://inaturalist-open-data.s3.amazonaws.com/photos/62254944/medium.jpg,,0,0,FALSE,"Lake Chabot Regional Park, Castro Valley, CA, US",37.72535333,-122.0958417,5,,Castro Valley,Alameda,Fremont's Deathcamas,Toxicoscordion fremontii,Common star lily,Plantae,49649,Melanthiaceae,Toxicoscordion,Toxicoscordion fremontii
39290786,2/27/20,2020-02-27 12:49:17 UTC,UTC,research,https://www.inaturalist.org/observations/39290786,https://static.inaturalist.org/photos/62318190/medium.jpeg,,1,0,FALSE,"Anthony Chabot Regional Park, Alameda County, US-CA, US",37.71641195,-122.1048893,9,,Castro Valley,Alameda,common daisy,Bellis perennis,common daisy,Plantae,55563,Asteraceae,Bellis,Bellis perennis
39291162,2/27/20,2020-02-27 12:56:46 UTC,UTC,research,https://www.inaturalist.org/observations/39291162,https://static.inaturalist.org/photos/62318571/medium.jpeg,,1,0,FALSE,"Castro Valley, CA 94546, USA",37.71608136,-122.1048002,7,,Castro Valley,Alameda,poison hemlock,Conium maculatum,poison hemlock,Plantae,52998,Apiaceae,Conium,Conium maculatum
58490299,2/27/20,2020-02-27 23:39:00 UTC,Pacific Time (US & Canada),research,https://www.inaturalist.org/observations/58490299,https://inaturalist-open-data.s3.amazonaws.com/photos/93387513/medium.jpeg,,2,0,FALSE,"Oakland, CA 94619, USA",37.79058577,-122.1363827,173,,,Alameda,Warrior's Plume,Pedicularis densiflora,Warrior's Plume,Plantae,49645,Orobanchaceae,Pedicularis,Pedicularis densiflora
39381927,2/29/20,2020-02-29 23:08:46 UTC,UTC,research,https://www.inaturalist.org/observations/39381927,https://static.inaturalist.org/photos/62470189/medium.jpeg,,0,0,FALSE,Castro Valley,37.72731667,-122.0886167,,,Castro Valley,Alameda,Sun Cup,Taraxia ovata,Sun Cup,Plantae,68182,Onagraceae,Taraxia,Taraxia ovata
39381970,2/29/20,2020-02-29 22:53:59 UTC,UTC,research,https://www.inaturalist.org/observations/39381970,https://static.inaturalist.org/photos/62470250/medium.jpeg,,1,0,FALSE,Castro Valley,37.72959167,-122.0934,,,,Alameda,coyote brush,Baccharis pilularis,coyote brush,Plantae,53359,Asteraceae,Baccharis,Baccharis pilularis
39381762,3/1/20,2020-03-01 00:20:50 UTC,UTC,research,https://www.inaturalist.org/observations/39381762,https://static.inaturalist.org/photos/62469932/medium.jpeg,,1,0,FALSE,Castro Valley,37.72771167,-122.0952138,,,Castro Valley,Alameda,California buckeye,Aesculus californica,California buckeye,Plantae,53348,Sapindaceae,Aesculus,Aesculus californica
39426518,3/1/20,2020-03-01 15:25:07 UTC,UTC,research,https://www.inaturalist.org/observations/39426518,https://inaturalist-open-data.s3.amazonaws.com/photos/62549670/medium.jpg,Yellow beauty. 1 inch flowers on a flat weed type plant. ,1,0,FALSE,"Anthony Chabot Regional Park, Castro Valley, CA, US",37.71178922,-122.1034829,5,,Castro Valley,Alameda,Sun Cup,Taraxia ovata,Sun Cup,Plantae,68182,Onagraceae,Taraxia,Taraxia ovata
39426605,3/1/20,2020-03-01 15:28:15 UTC,UTC,research,https://www.inaturalist.org/observations/39426605,https://inaturalist-open-data.s3.amazonaws.com/photos/62549868/medium.jpg,Looks itchy to me. Lots of it. Right next to the trail. ,0,0,FALSE,"Anthony Chabot Regional Park, Castro Valley, CA, US",37.71149271,-122.1043508,5,,Castro Valley,Alameda,Pacific poison oak,Toxicodendron diversilobum,Pacific poison oak,Plantae,51080,Anacardiaceae,Toxicodendron,Toxicodendron diversilobum
39437753,3/1/20,2020-03-01 00:20:50 UTC,UTC,research,https://www.inaturalist.org/observations/39437753,https://static.inaturalist.org/photos/62570901/medium.jpg,,1,0,FALSE,Castro Valley,37.72771167,-122.0952138,,,Castro Valley,Alameda,California buckeye,Aesculus californica,California buckeye,Plantae,53348,Sapindaceae,Aesculus,Aesculus californica
39439107,3/1/20,2020-03-02 03:12:25 UTC,Hawaii,research,https://www.inaturalist.org/observations/39439107,https://static.inaturalist.org/photos/62573082/medium.jpg,,0,0,FALSE,"Anthony Chabot Regional Park, Oakland, CA, US",37.75523833,-122.1183612,5,,,Alameda,Shortpod Mustard,Hirschfeldia incana,Shortpod Mustard,Plantae,53097,Brassicaceae,Hirschfeldia,Hirschfeldia incana
39439179,3/1/20,2020-03-02 02:42:52 UTC,Hawaii,research,https://www.inaturalist.org/observations/39439179,https://static.inaturalist.org/photos/62573247/medium.jpg,,2,0,FALSE,"Anthony Chabot Regional Park, Oakland, CA, US",37.76598333,-122.1254805,5,,Oakland,Alameda,California bay,Umbellularia californica,California bay,Plantae,48807,Lauraceae,Umbellularia,Umbellularia californica
39600703,3/2/20,2020-03-02 15:33:36 UTC,UTC,research,https://www.inaturalist.org/observations/39600703,https://static.inaturalist.org/photos/62842595/medium.jpg,,2,0,FALSE,"Anthony Chabot Regional Park, Oakland, CA, US",37.7877,-122.1346805,,,,Alameda,redmaids,Calandrinia menziesii,redmaids,Plantae,400267,Montiaceae,Calandrinia,Calandrinia menziesii
39600721,3/2/20,2020-03-02 15:33:32 UTC,UTC,research,https://www.inaturalist.org/observations/39600721,https://static.inaturalist.org/photos/62842619/medium.jpg,,2,0,FALSE,"Anthony Chabot Regional Park, Oakland, CA, US",37.78768,-122.1346805,,,,Alameda,redmaids,Calandrinia menziesii,redmaids,Plantae,400267,Montiaceae,Calandrinia,Calandrinia menziesii
39721591,3/8/20,2020-03-08 21:32:30 UTC,Pacific Time (US & Canada),research,https://www.inaturalist.org/observations/39721591,https://inaturalist-open-data.s3.amazonaws.com/photos/63046590/medium.jpg,,0,0,FALSE,"Anthony Chabot Regional Park, San Leandro, CA, US",37.71278097,-122.1057449,5,,Castro Valley,Alameda,poison hemlock,Conium maculatum,poison hemlock,Plantae,52998,Apiaceae,Conium,Conium maculatum
39724078,3/8/20,2020-03-08 22:16:55 UTC,Pacific Time (US & Canada),research,https://www.inaturalist.org/observations/39724078,https://inaturalist-open-data.s3.amazonaws.com/photos/63051395/medium.jpg,,1,0,FALSE,"Anthony Chabot Regional Park, Castro Valley, CA, US",37.71111201,-122.1051317,10,,Castro Valley,Alameda,Sun Cup,Taraxia ovata,Sun Cup,Plantae,68182,Onagraceae,Taraxia,Taraxia ovata
39724453,3/8/20,2020-03-08 22:20:48 UTC,Pacific Time (US & Canada),research,https://www.inaturalist.org/observations/39724453,https://inaturalist-open-data.s3.amazonaws.com/photos/63051596/medium.jpg,"Near a ravine. Maybe wild plum? 
",1,0,FALSE,"Anthony Chabot Regional Park, San Leandro, CA, US",37.71250826,-122.1055837,5,,Castro Valley,Alameda,Cherry-plum,Prunus cerasifera,Cherry-plum,Plantae,55837,Rosaceae,Prunus,Prunus cerasifera
39752997,3/8/20,2020-03-08 17:47:59 UTC,Pacific Time (US & Canada),research,https://www.inaturalist.org/observations/39752997,https://static.inaturalist.org/photos/63101914/medium.jpg,,0,0,FALSE,"Lake Chabot Regional Park, Castro Valley, CA, US",37.71647,-122.0983972,16,,Castro Valley,Alameda,Sun Cup,Taraxia ovata,Sun Cup,Plantae,68182,Onagraceae,Taraxia,Taraxia ovata
39769880,3/9/20,2020-03-09 21:11:31 UTC,Pacific Time (US & Canada),research,https://www.inaturalist.org/observations/39769880,https://static.inaturalist.org/photos/63140068/medium.jpeg,Unknown herb-id needed,2,0,FALSE,"Oakland, CA 94605, USA",37.75171746,-122.1163537,8,,,Alameda, ,Silybum marianum,milk thistle,Plantae,52586,Asteraceae,Silybum,Silybum marianum
46838507,3/9/20,2020-03-09 21:17:01 UTC,Pacific Time (US & Canada),research,https://www.inaturalist.org/observations/46838507,https://inaturalist-open-data.s3.amazonaws.com/photos/74283288/medium.jpg,,1,0,FALSE,"Anthony Chabot Regional Park, Oakland, CA, US",37.77528629,-122.1294584,5,,,Alameda,Fremont's Deathcamas,Toxicoscordion fremontii,Common star lily,Plantae,49649,Melanthiaceae,Toxicoscordion,Toxicoscordion fremontii
39924633,3/11/20,2020-03-12 00:44:29 UTC,Pacific Time (US & Canada),research,https://www.inaturalist.org/observations/39924633,https://inaturalist-open-data.s3.amazonaws.com/photos/63391852/medium.jpeg,,1,0,FALSE,"Castro Valley, CA 94546, USA",37.7274187,-122.0818108,34,,Castro Valley,Alameda,Cardre  lainer,Dipsacus sativus,fuller's teasel,Plantae,53028,Caprifoliaceae,Dipsacus,Dipsacus sativus
39910415,3/12/20,2020-03-13 01:35:15 UTC,Pacific Time (US & Canada),research,https://www.inaturalist.org/observations/39910415,https://static.inaturalist.org/photos/63367875/medium.jpeg,,2,0,FALSE,"Oakland, CA 94619, USA",37.78522794,-122.1308044,29,,,Alameda,broadleaf forget-me-not,Myosotis latifolia,broadleaf forget-me-not,Plantae,49132,Boraginaceae,Myosotis,Myosotis latifolia
39910583,3/12/20,2020-03-13 01:25:29 UTC,Pacific Time (US & Canada),research,https://www.inaturalist.org/observations/39910583,https://static.inaturalist.org/photos/63368303/medium.jpeg,,1,0,FALSE,"Oakland, CA 94619, USA",37.78703318,-122.1329874,68,,,Alameda,coastal manroot,Marah oregana,coastal manroot,Plantae,77960,Cucurbitaceae,Marah,Marah oregana
39943418,3/13/20,2020-03-13 22:44:36 UTC,Pacific Time (US & Canada),research,https://www.inaturalist.org/observations/39943418,https://static.inaturalist.org/photos/63424541/medium.jpeg,,1,0,FALSE,"Castro Valley, CA 94546, USA",37.7200348,-122.0931839,50,,Castro Valley,Alameda,Chasmanthe floribunda,Chasmanthe floribunda,African flag,Plantae,56028,Iridaceae,Chasmanthe,Chasmanthe floribunda
39943453,3/13/20,2020-03-13 22:48:06 UTC,Pacific Time (US & Canada),research,https://www.inaturalist.org/observations/39943453,https://static.inaturalist.org/photos/63424657/medium.jpeg,,1,0,FALSE,"Castro Valley, CA 94546, USA",37.72105527,-122.09349,12,,Castro Valley,Alameda,fuller's teasel,Dipsacus sativus,fuller's teasel,Plantae,53028,Caprifoliaceae,Dipsacus,Dipsacus sativus
39943479,3/13/20,2020-03-13 22:49:54 UTC,Pacific Time (US & Canada),research,https://www.inaturalist.org/observations/39943479,https://static.inaturalist.org/photos/63424700/medium.jpeg,,1,0,FALSE,"Castro Valley, CA 94546, USA",37.72171144,-122.0936379,19,,Castro Valley,Alameda,bull thistle,Cirsium vulgare,Bull Thistle,Plantae,52989,Asteraceae,Cirsium,Cirsium vulgare
39944640,3/13/20,2020-03-13 23:17:14 UTC,Pacific Time (US & Canada),research,https://www.inaturalist.org/observations/39944640,https://static.inaturalist.org/photos/63426949/medium.jpeg,,1,0,FALSE,"Castro Valley, CA 94546, USA",37.72147297,-122.0947511,9,,Castro Valley,Alameda,Common Cat's-ear,Hypochaeris radicata,Common Cat's-ear,Plantae,53104,Asteraceae,Hypochaeris,Hypochaeris radicata
39945720,3/13/20,2020-03-13 22:13:53 UTC,Pacific Time (US & Canada),research,https://www.inaturalist.org/observations/39945720,https://static.inaturalist.org/photos/63428969/medium.jpg,,1,0,FALSE,"Anthony Chabot Regional Park, Oakland, CA, US",37.73465333,-122.124375,6,,Oakland,Alameda,western blue-eyed grass,Sisyrinchium bellum,western blue-eyed grass,Plantae,49918,Iridaceae,Sisyrinchium,Sisyrinchium bellum
39947831,3/13/20,2020-03-14 00:44:03 UTC,Pacific Time (US & Canada),research,https://www.inaturalist.org/observations/39947831,https://static.inaturalist.org/photos/63432139/medium.jpg,,1,0,FALSE,"Chabot Park, Oakland, CA, US",37.73314771,-122.1236069,555,,Oakland,Alameda,Pacific poison oak,Toxicodendron diversilobum,Pacific poison oak,Plantae,51080,Anacardiaceae,Toxicodendron,Toxicodendron diversilobum
40051941,3/15/20,2020-03-15 21:36:21 UTC,Pacific Time (US & Canada),research,https://www.inaturalist.org/observations/40051941,https://inaturalist-open-data.s3.amazonaws.com/photos/63609527/medium.jpg,,1,0,FALSE,"Anthony Chabot Regional Park, Oakland, CA, US",37.77545333,-122.1246805,5,,,Alameda,Sun Cup,Taraxia ovata,Sun Cup,Plantae,68182,Onagraceae,Taraxia,Taraxia ovata
40052668,3/15/20,2020-03-15 21:41:38 UTC,Pacific Time (US & Canada),research,https://www.inaturalist.org/observations/40052668,https://inaturalist-open-data.s3.amazonaws.com/photos/63609572/medium.jpg,,1,0,FALSE,"Anthony Chabot Regional Park, Oakland, CA, US",37.77267833,-122.1222305,5,,,Alameda,Mediterranean Stork's-bill,Erodium botrys,Mediterranean Stork's-bill,Plantae,57090,Geraniaceae,Erodium,Erodium botrys
40052686,3/15/20,2020-03-15 22:03:26 UTC,Pacific Time (US & Canada),research,https://www.inaturalist.org/observations/40052686,https://inaturalist-open-data.s3.amazonaws.com/photos/63609599/medium.jpg,,1,0,FALSE,"Anthony Chabot Regional Park, Oakland, CA, US",37.76027167,-122.1171722,10,,,Alameda,broadleaf forget-me-not,Myosotis latifolia,broadleaf forget-me-not,Plantae,49132,Boraginaceae,Myosotis,Myosotis latifolia
40052700,3/15/20,2020-03-15 22:03:58 UTC,Pacific Time (US & Canada),research,https://www.inaturalist.org/observations/40052700,https://inaturalist-open-data.s3.amazonaws.com/photos/63609613/medium.jpg,,1,0,FALSE,"Anthony Chabot Regional Park, Oakland, CA, US",37.76029667,-122.1173028,5,,,Alameda,giant wakerobin,Trillium chloropetalum,giant wakerobin,Plantae,50823,Melanthiaceae,Trillium,Trillium chloropetalum
40052709,3/15/20,2020-03-15 22:17:49 UTC,Pacific Time (US & Canada),research,https://www.inaturalist.org/observations/40052709,https://inaturalist-open-data.s3.amazonaws.com/photos/63609647/medium.jpg,,1,0,FALSE,"Anthony Chabot Regional Park, Oakland, CA, US",37.76827,-122.121375,10,,,Alameda,twinberry honeysuckle,Lonicera involucrata,twinberry honeysuckle,Plantae,60881,Caprifoliaceae,Lonicera,Lonicera involucrata
40052718,3/15/20,2020-03-15 22:24:54 UTC,Pacific Time (US & Canada),research,https://www.inaturalist.org/observations/40052718,https://inaturalist-open-data.s3.amazonaws.com/photos/63609668/medium.jpg,,1,0,FALSE,"Anthony Chabot Regional Park, Oakland, CA, US",37.77139167,-122.1235195,10,,,Alameda,giant wakerobin,Trillium chloropetalum,giant wakerobin,Plantae,50823,Melanthiaceae,Trillium,Trillium chloropetalum
40052802,3/15/20,2020-03-15 22:32:35 UTC,Pacific Time (US & Canada),research,https://www.inaturalist.org/observations/40052802,https://inaturalist-open-data.s3.amazonaws.com/photos/63609770/medium.jpg,,1,0,FALSE,"Anthony Chabot Regional Park, Oakland, CA, US",37.77538,-122.1260083,10,,,Alameda,wild strawberry,Fragaria vesca,woodland strawberry,Plantae,50298,Rosaceae,Fragaria,Fragaria vesca
40189530,3/18/20,2020-03-18 16:27:37 UTC,Pacific Time (US & Canada),research,https://www.inaturalist.org/observations/40189530,https://static.inaturalist.org/photos/63839395/medium.jpg,,1,0,FALSE,"Lake Chabot Regional Park, Castro Valley, CA, US",37.72734167,-122.1009917,8,,Castro Valley,Alameda,Pacific pea,Lathyrus vestitus,Pacific pea,Plantae,50320,Fabaceae,Lathyrus,Lathyrus vestitus
40189625,3/18/20,2020-03-18 16:41:19 UTC,Pacific Time (US & Canada),research,https://www.inaturalist.org/observations/40189625,https://static.inaturalist.org/photos/63839548/medium.jpg,,1,0,FALSE,"Lake Chabot Regional Park, Castro Valley, CA, US",37.72716167,-122.0955362,32,,Castro Valley,Alameda,broadleaf forget-me-not,Myosotis latifolia,broadleaf forget-me-not,Plantae,49132,Boraginaceae,Myosotis,Myosotis latifolia
40189640,3/18/20,2020-03-18 16:53:37 UTC,Pacific Time (US & Canada),research,https://www.inaturalist.org/observations/40189640,https://static.inaturalist.org/photos/63839574/medium.jpg,,1,0,FALSE,"Lake Chabot Regional Park, Castro Valley, CA, US",37.727355,-122.1010138,16,,Castro Valley,Alameda,Fremont's Deathcamas,Toxicoscordion fremontii,Common star lily,Plantae,49649,Melanthiaceae,Toxicoscordion,Toxicoscordion fremontii
40199091,3/18/20,2020-03-18 19:45:21 UTC,Pacific Time (US & Canada),research,https://www.inaturalist.org/observations/40199091,https://inaturalist-open-data.s3.amazonaws.com/photos/63855354/medium.jpg,,1,0,FALSE,"Anthony Chabot Regional Park, Oakland, CA, US",37.79030333,-122.1366888,24,,,Alameda,Warrior's Plume,Pedicularis densiflora,Warrior's Plume,Plantae,49645,Orobanchaceae,Pedicularis,Pedicularis densiflora
40548440,3/18/20,2020-03-19 01:30:36 UTC,Pacific Time (US & Canada),research,https://www.inaturalist.org/observations/40548440,https://inaturalist-open-data.s3.amazonaws.com/photos/64261194/medium.jpg,,1,0,FALSE,"Country Hospital, San Leandro, CA, US",37.716155,-122.1131972,8,,Castro Valley,Alameda,Sun Cup,Taraxia ovata,Sun Cup,Plantae,68182,Onagraceae,Taraxia,Taraxia ovata
40548335,3/19/20,2020-03-20 01:59:31 UTC,Pacific Time (US & Canada),research,https://www.inaturalist.org/observations/40548335,https://inaturalist-open-data.s3.amazonaws.com/photos/64261044/medium.jpg,,2,0,FALSE,"Lake Chabot Regional Park, Castro Valley, CA, US",37.72043833,-122.1038583,64,,Castro Valley,Alameda,checker lily,Fritillaria affinis,checker lily,Plantae,50618,Liliaceae,Fritillaria,Fritillaria affinis
40336953,3/20/20,2020-03-20 23:44:34 UTC,Pacific Time (US & Canada),research,https://www.inaturalist.org/observations/40336953,https://inaturalist-open-data.s3.amazonaws.com/photos/64067845/medium.jpeg,,3,0,FALSE,"Oakland, CA 94605, USA",37.7536306,-122.1160899,,,,Alameda,checker lily,Fritillaria affinis,checker lily,Plantae,50618,Liliaceae,Fritillaria,Fritillaria affinis
40336982,3/20/20,2020-03-20 23:26:39 UTC,Pacific Time (US & Canada),research,https://www.inaturalist.org/observations/40336982,https://inaturalist-open-data.s3.amazonaws.com/photos/64067934/medium.jpeg,,3,0,FALSE,"Oakland, CA 94605, USA",37.7437481,-122.1125703,,,,Alameda,giant wakerobin,Trillium chloropetalum,giant wakerobin,Plantae,50823,Melanthiaceae,Trillium,Trillium chloropetalum
40337082,3/20/20,2020-03-20 23:16:00 UTC,Pacific Time (US & Canada),research,https://www.inaturalist.org/observations/40337082,https://inaturalist-open-data.s3.amazonaws.com/photos/64068115/medium.jpeg,,2,0,FALSE,"Oakland, CA 94605, USA",37.7407786,-122.1146524,,,,Alameda,Greater celandine,Chelidonium majus,Greater celandine,Plantae,55757,Papaveraceae,Chelidonium,Chelidonium majus
40337241,3/20/20,2020-03-20 23:09:43 UTC,Pacific Time (US & Canada),research,https://www.inaturalist.org/observations/40337241,https://inaturalist-open-data.s3.amazonaws.com/photos/64068378/medium.jpeg,,1,0,FALSE,"Oakland, CA 94605, USA",37.7399338,-122.1150626,,,Oakland,Alameda,stinging nettle,Urtica dioica,great stinging nettle,Plantae,51884,Urticaceae,Urtica,Urtica dioica
40337437,3/20/20,2020-03-20 23:10:21 UTC,Pacific Time (US & Canada),research,https://www.inaturalist.org/observations/40337437,https://inaturalist-open-data.s3.amazonaws.com/photos/64068639/medium.jpeg,,1,0,FALSE,"Anthony Chabot Regional Park, Alameda County, US-CA, US",37.740118,-122.1148827,,,,Alameda,poison hemlock,Conium maculatum,poison hemlock,Plantae,52998,Apiaceae,Conium,Conium maculatum
40337647,3/20/20,2020-03-20 22:33:28 UTC,Pacific Time (US & Canada),research,https://www.inaturalist.org/observations/40337647,https://inaturalist-open-data.s3.amazonaws.com/photos/64068938/medium.jpeg,,1,0,FALSE,"Anthony Chabot Regional Park, Alameda County, US-CA, US",37.7337616,-122.1225484,,,Oakland,Alameda,Hartweg's umbrellawort,Tauschia hartwegii,Hartweg's umbrellawort,Plantae,54948,Apiaceae,Tauschia,Tauschia hartwegii
40337903,3/20/20,2020-03-20 21:54:48 UTC,Pacific Time (US & Canada),research,https://www.inaturalist.org/observations/40337903,https://inaturalist-open-data.s3.amazonaws.com/photos/64069506/medium.jpeg,,1,0,FALSE,"Chabot Park, Oakland, CA 94605, USA",37.7357614,-122.1199677,,,Oakland,Alameda,California sagebrush,Artemisia californica,California sagebrush,Plantae,53357,Asteraceae,Artemisia,Artemisia californica
40338008,3/20/20,2020-03-20 21:53:08 UTC,Pacific Time (US & Canada),research,https://www.inaturalist.org/observations/40338008,https://inaturalist-open-data.s3.amazonaws.com/photos/64069626/medium.jpeg,,1,0,FALSE,"Chabot Park, Oakland, CA 94605, USA",37.7365333,-122.1197755,,,Oakland,Alameda,Pacific poison oak,Toxicodendron diversilobum,Pacific poison oak,Plantae,51080,Anacardiaceae,Toxicodendron,Toxicodendron diversilobum
40338052,3/20/20,2020-03-20 21:21:57 UTC,Pacific Time (US & Canada),research,https://www.inaturalist.org/observations/40338052,https://inaturalist-open-data.s3.amazonaws.com/photos/64069676/medium.jpeg,,1,0,FALSE,"Oakland, CA 94605, USA",37.7447196,-122.1144316,,,,Alameda,California mugwort,Artemisia douglasiana,California mugwort,Plantae,52854,Asteraceae,Artemisia,Artemisia douglasiana
40338135,3/20/20,2020-03-20 21:23:38 UTC,Pacific Time (US & Canada),research,https://www.inaturalist.org/observations/40338135,https://inaturalist-open-data.s3.amazonaws.com/photos/64069773/medium.jpeg,,1,0,FALSE,"Oakland, CA 94605, USA",37.7437786,-122.1148082,,,,Alameda,California manroot,Marah fabacea,California manroot,Plantae,205330,Cucurbitaceae,Marah,Marah fabacea
40338158,3/20/20,2020-03-20 21:21:49 UTC,Pacific Time (US & Canada),research,https://www.inaturalist.org/observations/40338158,https://inaturalist-open-data.s3.amazonaws.com/photos/64069811/medium.jpeg,,1,0,FALSE,"Oakland, CA 94605, USA",37.7446967,-122.1144459,,,,Alameda,common yarrow,Achillea millefolium,common yarrow,Plantae,52821,Asteraceae,Achillea,Achillea millefolium
40338308,3/20/20,2020-03-20 21:18:17 UTC,Pacific Time (US & Canada),research,https://www.inaturalist.org/observations/40338308,https://inaturalist-open-data.s3.amazonaws.com/photos/64070022/medium.jpeg,,2,0,FALSE,"Oakland, CA 94605, USA",37.7463901,-122.1154193,,,,Alameda,Sun Cup,Taraxia ovata,Sun Cup,Plantae,68182,Onagraceae,Taraxia,Taraxia ovata
40338324,3/20/20,2020-03-20 21:18:00 UTC,Pacific Time (US & Canada),research,https://www.inaturalist.org/observations/40338324,https://inaturalist-open-data.s3.amazonaws.com/photos/64070103/medium.jpeg,,1,0,FALSE,"Oakland, CA 94605, USA",37.7464009,-122.1153486,,,,Alameda,western blue-eyed grass,Sisyrinchium bellum,western blue-eyed grass,Plantae,49918,Iridaceae,Sisyrinchium,Sisyrinchium bellum
43017715,3/20/20,2020-03-20 23:18:48 UTC,Pacific Time (US & Canada),research,https://www.inaturalist.org/observations/43017715,https://inaturalist-open-data.s3.amazonaws.com/photos/68304502/medium.jpg,,1,0,FALSE,"Anthony Chabot Regional Park, Castro Valley, CA, US",37.7121,-122.1027305,5,,Castro Valley,Alameda,California poppy,Eschscholzia californica,California poppy,Plantae,48225,Papaveraceae,Eschscholzia,Eschscholzia californica
40405074,3/21/20,2020-03-21 22:47:58 UTC,Pacific Time (US & Canada),research,https://www.inaturalist.org/observations/40405074,https://static.inaturalist.org/photos/64168769/medium.jpg,,1,0,FALSE,"Anthony Chabot Regional Park, Castro Valley, CA, US",37.72376667,-122.0853417,5,,Castro Valley,Alameda,greater periwinkle,Vinca major,greater periwinkle,Plantae,53326,Apocynaceae,Vinca,Vinca major
40413726,3/21/20,2020-03-21 22:42:15 UTC,Pacific Time (US & Canada),research,https://www.inaturalist.org/observations/40413726,https://inaturalist-open-data.s3.amazonaws.com/photos/64162439/medium.jpg,,1,0,FALSE,"Anthony Chabot Regional Park, Oakland, CA, US",37.77050833,-122.1276167,31,,,Alameda,Sun Cup,Taraxia ovata,Sun Cup,Plantae,68182,Onagraceae,Taraxia,Taraxia ovata
40414029,3/21/20,2020-03-21 22:47:17 UTC,Pacific Time (US & Canada),research,https://www.inaturalist.org/observations/40414029,https://inaturalist-open-data.s3.amazonaws.com/photos/64181156/medium.jpg,,2,0,FALSE,"Anthony Chabot Regional Park, Oakland, CA, US",37.76963,-122.1277778,30,,,Alameda,coastal manroot,Marah oregana,coastal manroot,Plantae,77960,Cucurbitaceae,Marah,Marah oregana
40436492,3/21/20,2020-03-21 23:39:05 UTC,Pacific Time (US & Canada),research,https://www.inaturalist.org/observations/40436492,https://static.inaturalist.org/photos/64177954/medium.jpg,,1,0,FALSE,"Anthony Chabot Regional Park, Castro Valley, CA, US",37.72420833,-122.0848472,4,,Castro Valley,Alameda,giant wakerobin,Trillium chloropetalum,giant wakerobin,Plantae,50823,Melanthiaceae,Trillium,Trillium chloropetalum
40457855,3/21/20,2020-03-21 16:57:22 UTC,Pacific Time (US & Canada),research,https://www.inaturalist.org/observations/40457855,https://static.inaturalist.org/photos/64185806/medium.jpg,,1,0,FALSE,"Anthony Chabot Regional Park, Oakland, CA, US",37.77771667,-122.1330195,16,,,Alameda,red deadnettle,Lamium purpureum,red deadnettle,Plantae,55851,Lamiaceae,Lamium,Lamium purpureum
40461664,3/21/20,2020-03-22 00:00:47 UTC,Pacific Time (US & Canada),research,https://www.inaturalist.org/observations/40461664,https://static.inaturalist.org/photos/64187715/medium.jpg,,1,0,FALSE,"Anthony Chabot Regional Park, Castro Valley, CA, US",37.72247833,-122.0779028,4,,Castro Valley,Alameda,Sun Cup,Taraxia ovata,Sun Cup,Plantae,68182,Onagraceae,Taraxia,Taraxia ovata
40529033,3/21/20,2020-03-21 15:42:54 UTC,Pacific Time (US & Canada),research,https://www.inaturalist.org/observations/40529033,https://inaturalist-open-data.s3.amazonaws.com/photos/64229660/medium.jpg,,2,0,FALSE,"Anthony Chabot Regional Park, Oakland, CA, US",37.79802167,-122.1515195,7,,,Alameda,Red-flowering Currant,Ribes sanguineum,Red-flowering Currant,Plantae,53435,Grossulariaceae,Ribes,Ribes sanguineum
40529219,3/21/20,2020-03-21 15:52:01 UTC,Pacific Time (US & Canada),research,https://www.inaturalist.org/observations/40529219,https://inaturalist-open-data.s3.amazonaws.com/photos/64229923/medium.jpg,,1,0,FALSE,"Anthony Chabot Regional Park, Oakland, CA, US",37.79652833,-122.1475305,5,,,Alameda,Silver Lupine,Lupinus albifrons,Silver Lupine,Plantae,51691,Fabaceae,Lupinus,Lupinus albifrons
40529306,3/21/20,2020-03-21 16:17:43 UTC,Pacific Time (US & Canada),research,https://www.inaturalist.org/observations/40529306,https://inaturalist-open-data.s3.amazonaws.com/photos/64230059/medium.jpg,,2,0,FALSE,"Anthony Chabot Regional Park, Oakland, CA, US",37.78560333,-122.1323862,4,,,Alameda,California poppy,Eschscholzia californica,California poppy,Plantae,48225,Papaveraceae,Eschscholzia,Eschscholzia californica
40530269,3/21/20,2020-03-21 16:49:18 UTC,Pacific Time (US & Canada),research,https://www.inaturalist.org/observations/40530269,https://inaturalist-open-data.s3.amazonaws.com/photos/64231650/medium.jpg,,2,0,FALSE,"Anthony Chabot Regional Park, Oakland, CA, US",37.76743333,-122.1193305,4,,,Alameda,scarlet pimpernel,Lysimachia arvensis,scarlet pimpernel,Plantae,791928,Primulaceae,Lysimachia,Lysimachia arvensis
40530503,3/21/20,2020-03-21 18:35:16 UTC,Pacific Time (US & Canada),research,https://www.inaturalist.org/observations/40530503,https://inaturalist-open-data.s3.amazonaws.com/photos/64232041/medium.jpg,,2,0,FALSE,"Anthony Chabot Regional Park, Castro Valley, CA, US",37.73051167,-122.084725,5,,,Alameda,Woolly Indian Paintbrush,Castilleja foliolosa,Woolly Indian Paintbrush,Plantae,56760,Orobanchaceae,Castilleja,Castilleja foliolosa
40531364,3/21/20,2020-03-21 18:36:01 UTC,Pacific Time (US & Canada),research,https://www.inaturalist.org/observations/40531364,https://inaturalist-open-data.s3.amazonaws.com/photos/64233913/medium.jpg,,2,0,FALSE,"Anthony Chabot Regional Park, Castro Valley, CA, US",37.73094167,-122.0849612,4,,,Alameda,Sun Cup,Taraxia ovata,Sun Cup,Plantae,68182,Onagraceae,Taraxia,Taraxia ovata
42804364,3/21/20,2020-03-21 19:01:12 UTC,Pacific Time (US & Canada),research,https://www.inaturalist.org/observations/42804364,https://static.inaturalist.org/photos/67976560/medium.jpg,,1,0,FALSE,"Anthony Chabot Regional Park, Oakland, CA, US",37.77268924,-122.1293907,7,,,Alameda,Sun Cup,Taraxia ovata,Sun Cup,Plantae,68182,Onagraceae,Taraxia,Taraxia ovata
40560362,3/22/20,2020-03-22 21:54:20 UTC,Pacific Time (US & Canada),research,https://www.inaturalist.org/observations/40560362,https://static.inaturalist.org/photos/64282059/medium.jpg,,1,0,FALSE,"Anthony Chabot Regional Park, Oakland, CA, US",37.77648,-122.1317528,10,,,Alameda,California manroot,Marah fabacea,California manroot,Plantae,205330,Cucurbitaceae,Marah,Marah fabacea
40560392,3/22/20,2020-03-22 22:18:30 UTC,Pacific Time (US & Canada),research,https://www.inaturalist.org/observations/40560392,https://static.inaturalist.org/photos/64282127/medium.jpg,,1,0,FALSE,"Anthony Chabot Regional Park, Oakland, CA, US",37.77960333,-122.1319667,5,,,Alameda,coyote brush,Baccharis pilularis,coyote brush,Plantae,53359,Asteraceae,Baccharis,Baccharis pilularis
40674127,3/22/20,2020-03-22 22:22:43 UTC,Pacific Time (US & Canada),research,https://www.inaturalist.org/observations/40674127,https://inaturalist-open-data.s3.amazonaws.com/photos/64475505/medium.jpg,,1,0,FALSE,"Anthony Chabot Regional Park, San Leandro, CA, US",37.720395,-122.114175,8,,Castro Valley,Alameda,Purple Sanicle,Sanicula bipinnatifida,Purple Sanicle,Plantae,56840,Apiaceae,Sanicula,Sanicula bipinnatifida
40674567,3/22/20,2020-03-22 22:09:41 UTC,Pacific Time (US & Canada),research,https://www.inaturalist.org/observations/40674567,https://inaturalist-open-data.s3.amazonaws.com/photos/64476169/medium.jpg,,1,0,FALSE,"Anthony Chabot Regional Park, San Leandro, CA, US",37.71784167,-122.11135,8,,Castro Valley,Alameda,dwarf orthocarpus,Triphysaria pusilla,dwarf orthocarpus,Plantae,57276,Orobanchaceae,Triphysaria,Triphysaria pusilla
40674740,3/22/20,2020-03-22 21:58:04 UTC,Pacific Time (US & Canada),research,https://www.inaturalist.org/observations/40674740,https://inaturalist-open-data.s3.amazonaws.com/photos/64476522/medium.jpg,,1,0,FALSE,"Anthony Chabot Regional Park, San Leandro, CA, US",37.71467167,-122.1082,4,,Castro Valley,Alameda,western blue-eyed grass,Sisyrinchium bellum,western blue-eyed grass,Plantae,49918,Iridaceae,Sisyrinchium,Sisyrinchium bellum
40674771,3/22/20,2020-03-22 21:57:17 UTC,Pacific Time (US & Canada),research,https://www.inaturalist.org/observations/40674771,https://inaturalist-open-data.s3.amazonaws.com/photos/64476582/medium.jpg,,1,0,FALSE,"Anthony Chabot Regional Park, San Leandro, CA, US",37.71464167,-122.1081167,6,,Castro Valley,Alameda,dot-seed plantain,Plantago erecta,dot-seed plantain,Plantae,53177,Plantaginaceae,Plantago,Plantago erecta
40675255,3/22/20,2020-03-22 21:57:03 UTC,Pacific Time (US & Canada),research,https://www.inaturalist.org/observations/40675255,https://inaturalist-open-data.s3.amazonaws.com/photos/64477529/medium.jpg,,1,0,FALSE,"Anthony Chabot Regional Park, San Leandro, CA, US",37.714645,-122.1081,4,,Castro Valley,Alameda,Hesperevax sparsiflora sparsiflora,Hesperevax sparsiflora sparsiflora,,Plantae,61172,Asteraceae,Hesperevax,Hesperevax sparsiflora
40587453,3/23/20,2020-03-23 15:38:20 UTC,Pacific Time (US & Canada),research,https://www.inaturalist.org/observations/40587453,https://static.inaturalist.org/photos/64606077/medium.jpg,,1,0,FALSE,"Lake Chabot Regional Park, Castro Valley, CA, US",37.72052,-122.10405,6,,Castro Valley,Alameda,checker lily,Fritillaria affinis,checker lily,Plantae,50618,Liliaceae,Fritillaria,Fritillaria affinis
40607166,3/23/20,2020-03-23 17:25:43 UTC,Pacific Time (US & Canada),research,https://www.inaturalist.org/observations/40607166,https://inaturalist-open-data.s3.amazonaws.com/photos/65862546/medium.jpg,,1,0,FALSE,"Anthony Chabot Regional Park, Alameda County, US-CA, US",37.72717358,-122.0963153,10,,Castro Valley,Alameda,milkmaids,Cardamine californica,milkmaids,Plantae,49651,Brassicaceae,Cardamine,Cardamine californica
40756430,3/23/20,2020-03-23 16:24:53 UTC,Pacific Time (US & Canada),research,https://www.inaturalist.org/observations/40756430,https://static.inaturalist.org/photos/64606759/medium.jpg,,2,0,FALSE,"Lake Chabot Regional Park, Castro Valley, CA, US",37.718955,-122.1048667,6,,Castro Valley,Alameda,Mediterranean Stork's-bill,Erodium botrys,Mediterranean Stork's-bill,Plantae,57090,Geraniaceae,Erodium,Erodium botrys
40668438,3/24/20,2020-03-24 23:23:28 UTC,Pacific Time (US & Canada),research,https://www.inaturalist.org/observations/40668438,https://inaturalist-open-data.s3.amazonaws.com/photos/64466456/medium.jpeg,,1,0,FALSE,"Oakland, CA 94619, USA",37.79644167,-122.1477556,,,,Alameda,greater periwinkle,Vinca major,greater periwinkle,Plantae,53326,Apocynaceae,Vinca,Vinca major
40669074,3/24/20,2020-03-24 23:02:07 UTC,Pacific Time (US & Canada),research,https://www.inaturalist.org/observations/40669074,https://inaturalist-open-data.s3.amazonaws.com/photos/64467294/medium.jpeg,,1,0,FALSE,"Oakland, CA 94619, USA",37.797375,-122.1475639,,,,Alameda,scarlet pimpernel,Lysimachia arvensis,scarlet pimpernel,Plantae,791928,Primulaceae,Lysimachia,Lysimachia arvensis
40669186,3/24/20,2020-03-24 22:29:26 UTC,Pacific Time (US & Canada),research,https://www.inaturalist.org/observations/40669186,https://inaturalist-open-data.s3.amazonaws.com/photos/64467482/medium.jpeg,,1,0,FALSE,"Oakland, CA 94619, USA",37.79698889,-122.1474861,,,,Alameda,Fremont's Deathcamas,Toxicoscordion fremontii,Common star lily,Plantae,49649,Melanthiaceae,Toxicoscordion,Toxicoscordion fremontii
40669270,3/24/20,2020-03-24 22:36:40 UTC,Pacific Time (US & Canada),research,https://www.inaturalist.org/observations/40669270,https://inaturalist-open-data.s3.amazonaws.com/photos/64467607/medium.jpeg,,1,0,FALSE,"Anthony Chabot Regional Park, Alameda County, US-CA, US",37.79613056,-122.1460611,,,,Alameda,Sun Cup,Taraxia ovata,Sun Cup,Plantae,68182,Onagraceae,Taraxia,Taraxia ovata
40669360,3/24/20,2020-03-24 22:31:33 UTC,Pacific Time (US & Canada),research,https://www.inaturalist.org/observations/40669360,https://inaturalist-open-data.s3.amazonaws.com/photos/64467825/medium.jpeg,,1,0,FALSE,"Oakland, CA 94619, USA",37.796725,-122.1477556,,,,Alameda,trailing blackberry,Rubus ursinus,trailing blackberry,Plantae,53445,Rosaceae,Rubus,Rubus ursinus
40669379,3/24/20,2020-03-24 22:20:39 UTC,Pacific Time (US & Canada),research,https://www.inaturalist.org/observations/40669379,https://inaturalist-open-data.s3.amazonaws.com/photos/64467855/medium.jpeg,,1,0,FALSE,"Oakland, CA 94619, USA",37.79631111,-122.1483778,,,,Alameda,Wild strawberry,Fragaria vesca,woodland strawberry,Plantae,50298,Rosaceae,Fragaria,Fragaria vesca
40669492,3/24/20,2020-03-24 22:36:22 UTC,Pacific Time (US & Canada),research,https://www.inaturalist.org/observations/40669492,https://inaturalist-open-data.s3.amazonaws.com/photos/64468106/medium.jpeg,,1,0,FALSE,"Oakland, CA 94619, USA",37.79613056,-122.1460611,,,,Alameda,Mediterranean Stork's-bill,Erodium botrys,Mediterranean Stork's-bill,Plantae,57090,Geraniaceae,Erodium,Erodium botrys
40669791,3/24/20,2020-03-24 22:11:57 UTC,Pacific Time (US & Canada),research,https://www.inaturalist.org/observations/40669791,https://inaturalist-open-data.s3.amazonaws.com/photos/64468388/medium.jpeg,,1,0,FALSE,"Oakland, CA 94619, USA",37.79801111,-122.1520028,,,,Alameda,California bay,Umbellularia californica,California bay,Plantae,48807,Lauraceae,Umbellularia,Umbellularia californica
40756352,3/24/20,2020-03-24 16:10:42 UTC,Pacific Time (US & Canada),research,https://www.inaturalist.org/observations/40756352,https://static.inaturalist.org/photos/64606658/medium.jpg,,1,0,FALSE,"Castro Valley, CA, US",37.72961167,-122.1210028,32,,Castro Valley,Alameda,French broom,Genista monspessulana,French broom,Plantae,53403,Fabaceae,Genista,Genista monspessulana
40942451,3/26/20,2020-03-27 01:38:01 UTC,Pacific Time (US & Canada),research,https://www.inaturalist.org/observations/40942451,https://inaturalist-open-data.s3.amazonaws.com/photos/64913682/medium.jpg,,1,0,FALSE,"Anthony Chabot Regional Park, Castro Valley, CA, US",37.71208833,-122.1030888,6,,Castro Valley,Alameda,redmaids,Calandrinia menziesii,redmaids,Plantae,400267,Montiaceae,Calandrinia,Calandrinia menziesii
40942522,3/26/20,2020-03-27 01:34:35 UTC,Pacific Time (US & Canada),research,https://www.inaturalist.org/observations/40942522,https://inaturalist-open-data.s3.amazonaws.com/photos/64913783/medium.jpg,,1,0,FALSE,"Anthony Chabot Regional Park, Castro Valley, CA, US",37.71230833,-122.1032555,6,,Castro Valley,Alameda,jeweled onion,Allium serra,jeweled onion,Plantae,59784,Amaryllidaceae,Allium,Allium serra
40942582,3/26/20,2020-03-27 01:26:55 UTC,Pacific Time (US & Canada),research,https://www.inaturalist.org/observations/40942582,https://inaturalist-open-data.s3.amazonaws.com/photos/64913943/medium.jpg,,1,0,FALSE,"Anthony Chabot Regional Park, Castro Valley, CA, US",37.71244667,-122.1036,6,,Castro Valley,Alameda,Chile trefoil,Acmispon wrangelianus,Chile trefoil,Plantae,57050,Fabaceae,Acmispon,Acmispon wrangelianus
40942598,3/26/20,2020-03-27 01:32:59 UTC,Pacific Time (US & Canada),research,https://www.inaturalist.org/observations/40942598,https://inaturalist-open-data.s3.amazonaws.com/photos/64913967/medium.jpg,,1,0,FALSE,"Anthony Chabot Regional Park, Castro Valley, CA, US",37.71226167,-122.103325,12,,Castro Valley,Alameda,Blue Dicks,Dipterostemon capitatus capitatus,,Plantae,1196824,Asparagaceae,Dipterostemon,Dipterostemon capitatus
40942693,3/26/20,2020-03-27 01:40:15 UTC,Pacific Time (US & Canada),research,https://www.inaturalist.org/observations/40942693,https://inaturalist-open-data.s3.amazonaws.com/photos/64914214/medium.jpg,,1,0,FALSE,"Anthony Chabot Regional Park, Castro Valley, CA, US",37.7121,-122.102775,16,,Castro Valley,Alameda,purple needlegrass,Nassella pulchra,purple needlegrass,Plantae,165659,Poaceae,Nassella,Nassella pulchra
40942910,3/26/20,2020-03-27 01:50:14 UTC,Pacific Time (US & Canada),research,https://www.inaturalist.org/observations/40942910,https://inaturalist-open-data.s3.amazonaws.com/photos/64914619/medium.jpg,,1,0,FALSE,"Anthony Chabot Regional Park, Castro Valley, CA, US",37.71196333,-122.1030278,6,,Castro Valley,Alameda,California poppy,Eschscholzia californica,California poppy,Plantae,48225,Papaveraceae,Eschscholzia,Eschscholzia californica
40942912,3/26/20,2020-03-27 01:55:42 UTC,Pacific Time (US & Canada),research,https://www.inaturalist.org/observations/40942912,https://inaturalist-open-data.s3.amazonaws.com/photos/64914634/medium.jpg,,1,0,FALSE,"Anthony Chabot Regional Park, Castro Valley, CA, US",37.71126167,-122.1046528,16,,Castro Valley,Alameda,narrowleaf milkweed,Asclepias fascicularis,narrowleaf milkweed,Plantae,56851,Apocynaceae,Asclepias,Asclepias fascicularis
40942917,3/26/20,2020-03-27 02:01:28 UTC,Pacific Time (US & Canada),research,https://www.inaturalist.org/observations/40942917,https://inaturalist-open-data.s3.amazonaws.com/photos/64914655/medium.jpg,,1,0,FALSE,"Anthony Chabot Regional Park, Castro Valley, CA, US",37.71250333,-122.1051555,8,,Castro Valley,Alameda,Subterranean Clover,Trifolium subterraneum,Subterranean Clover,Plantae,60201,Fabaceae,Trifolium,Trifolium subterraneum
41059028,3/26/20,2020-03-27 01:20:08 UTC,Pacific Time (US & Canada),research,https://www.inaturalist.org/observations/41059028,https://inaturalist-open-data.s3.amazonaws.com/photos/65099097/medium.jpeg,,1,0,FALSE,"Oakland, CA 94619, USA",37.7953949,-122.1433216,,,,Alameda,Warrior's Plume,Pedicularis densiflora,Warrior's Plume,Plantae,49645,Orobanchaceae,Pedicularis,Pedicularis densiflora
40827325,3/27/20,2020-03-27 16:08:15 UTC,Pacific Time (US & Canada),research,https://www.inaturalist.org/observations/40827325,https://static.inaturalist.org/photos/64723624/medium.jpg,,1,0,FALSE,"Anthony Chabot Regional Park, Castro Valley, CA, US",37.721925,-122.1094195,16,,Castro Valley,Alameda,Jimbrush,Ceanothus oliganthus sorediatus,Jimbrush,Plantae,53361,Rhamnaceae,Ceanothus,Ceanothus oliganthus
40840218,3/27/20,2020-03-27 21:07:53 UTC,Pacific Time (US & Canada),research,https://www.inaturalist.org/observations/40840218,https://inaturalist-open-data.s3.amazonaws.com/photos/64744754/medium.jpg,,2,0,FALSE,"Redwood Rd, Castro Valley, CA, US",37.72374667,-122.0852972,5,,Castro Valley,Alameda,greater periwinkle,Vinca major,greater periwinkle,Plantae,53326,Apocynaceae,Vinca,Vinca major
40858854,3/27/20,2020-03-28 01:01:34 UTC,Pacific Time (US & Canada),research,https://www.inaturalist.org/observations/40858854,https://static.inaturalist.org/photos/64776959/medium.jpeg,,1,0,FALSE,"Castro Valley, CA 94552, USA",37.75001111,-122.110775,,,,Alameda,Purple Sanicle,Sanicula bipinnatifida,Purple Sanicle,Plantae,56840,Apiaceae,Sanicula,Sanicula bipinnatifida
40907335,3/28/20,2020-03-28 17:28:26 UTC,Pacific Time (US & Canada),research,https://www.inaturalist.org/observations/40907335,https://inaturalist-open-data.s3.amazonaws.com/photos/64854901/medium.jpg,,1,0,FALSE,"Anthony Chabot Regional Park, Oakland, CA, US",37.79666167,-122.1477278,5,,,Alameda,Fremont's Deathcamas,Toxicoscordion fremontii,Common star lily,Plantae,49649,Melanthiaceae,Toxicoscordion,Toxicoscordion fremontii
40907352,3/28/20,2020-03-28 17:29:52 UTC,Pacific Time (US & Canada),research,https://www.inaturalist.org/observations/40907352,https://inaturalist-open-data.s3.amazonaws.com/photos/64854957/medium.jpg,,1,0,FALSE,"Anthony Chabot Regional Park, Oakland, CA, US",37.79794667,-122.1476222,5,,,Alameda,Sun Cup,Taraxia ovata,Sun Cup,Plantae,68182,Onagraceae,Taraxia,Taraxia ovata
40938627,3/28/20,2020-03-28 23:38:00 UTC,Pacific Time (US & Canada),research,https://www.inaturalist.org/observations/40938627,https://inaturalist-open-data.s3.amazonaws.com/photos/64903149/medium.jpeg,,1,0,FALSE,"Alameda County, CA, USA",37.77589421,-122.1250063,50,,,Alameda,Cherry-plum,Prunus cerasifera,Cherry-plum,Plantae,55837,Rosaceae,Prunus,Prunus cerasifera
40942686,3/28/20,2020-03-29 05:00:36 UTC,Pacific Time (US & Canada),research,https://www.inaturalist.org/observations/40942686,https://inaturalist-open-data.s3.amazonaws.com/photos/64914783/medium.jpg,,1,0,FALSE,"Anthony Chabot Regional Park, Castro Valley, CA, US",37.7120553,-122.1044965,48,,Castro Valley,Alameda,purple owl's-clover,Castilleja exserta,purple owl's-clover,Plantae,49343,Orobanchaceae,Castilleja,Castilleja exserta
40943594,3/28/20,2020-03-28 18:05:26 UTC,Pacific Time (US & Canada),research,https://www.inaturalist.org/observations/40943594,https://inaturalist-open-data.s3.amazonaws.com/photos/64915585/medium.jpg,,1,0,FALSE,"Anthony Chabot Regional Park, Oakland, CA, US",37.78560333,-122.1324388,5,,,Alameda,California poppy,Eschscholzia californica,California poppy,Plantae,48225,Papaveraceae,Eschscholzia,Eschscholzia californica
46838645,3/28/20,2020-03-28 19:45:35 UTC,Pacific Time (US & Canada),research,https://www.inaturalist.org/observations/46838645,https://inaturalist-open-data.s3.amazonaws.com/photos/74283487/medium.jpg,,1,0,FALSE,"Anthony Chabot Regional Park, Oakland, CA, US",37.75288024,-122.1149932,5,,,Alameda,Pacific hound's tongue,Adelinia grande,Pacific hound's tongue,Plantae,769151,Boraginaceae,Adelinia,Adelinia grande
46838667,3/28/20,2020-03-28 19:49:19 UTC,Pacific Time (US & Canada),research,https://www.inaturalist.org/observations/46838667,https://inaturalist-open-data.s3.amazonaws.com/photos/74283523/medium.jpg,,2,0,FALSE,"Anthony Chabot Regional Park, Alameda County, US-CA, US",37.75321464,-122.1158044,5,,,Alameda,Trillium chloropetalum giganteum,Trillium chloropetalum giganteum,,Plantae,243295,Melanthiaceae,Trillium,Trillium chloropetalum
46838676,3/28/20,2020-03-28 19:51:25 UTC,Pacific Time (US & Canada),research,https://www.inaturalist.org/observations/46838676,https://inaturalist-open-data.s3.amazonaws.com/photos/74283573/medium.jpg,,2,0,FALSE,"Anthony Chabot Regional Park, Oakland, CA, US",37.75367996,-122.1159366,5,,,Alameda,checker lily,Fritillaria affinis,checker lily,Plantae,50618,Liliaceae,Fritillaria,Fritillaria affinis
70282744,3/28/20,2020-03-28 16:34:03 UTC,Pacific Time (US & Canada),research,https://www.inaturalist.org/observations/70282744,https://inaturalist-open-data.s3.amazonaws.com/photos/114223045/medium.jpg,,2,0,FALSE,"Anthony Chabot Regional Park, Castro Valley, CA, US",37.76054419,-122.1121718,3179,,,Alameda,greater periwinkle,Vinca major,greater periwinkle,Plantae,53326,Apocynaceae,Vinca,Vinca major
40994993,3/29/20,2020-03-29 20:31:09 UTC,Pacific Time (US & Canada),research,https://www.inaturalist.org/observations/40994993,https://inaturalist-open-data.s3.amazonaws.com/photos/65004059/medium.jpg,,2,0,FALSE,"Anthony Chabot Regional Park, Alameda County, US-CA, US",37.76755256,-122.1196128,5,,,Alameda,ribwort plantain,Plantago lanceolata,ribwort plantain,Plantae,53178,Plantaginaceae,Plantago,Plantago lanceolata
40995287,3/29/20,2020-03-29 22:06:16 UTC,Pacific Time (US & Canada),research,https://www.inaturalist.org/observations/40995287,https://inaturalist-open-data.s3.amazonaws.com/photos/65007096/medium.jpg,,1,0,FALSE,"Lake Chabot Regional Park, Castro Valley, CA, US",37.71899667,-122.095375,,,Castro Valley,Alameda,California poppy,Eschscholzia californica,California poppy,Plantae,48225,Papaveraceae,Eschscholzia,Eschscholzia californica
41004867,3/29/20,2020-03-29 22:10:20 UTC,Pacific Time (US & Canada),research,https://www.inaturalist.org/observations/41004867,https://static.inaturalist.org/photos/65019984/medium.jpg,,1,0,FALSE,"Anthony Chabot Regional Park, Castro Valley, CA, US",37.75525333,-122.11135,10,,,Alameda, ,Heracleum maximum,common cowparsnip,Plantae,53094,Apiaceae,Heracleum,Heracleum maximum
41004900,3/29/20,2020-03-29 23:22:11 UTC,Pacific Time (US & Canada),research,https://www.inaturalist.org/observations/41004900,https://static.inaturalist.org/photos/65025025/medium.jpg,,1,0,FALSE,"Anthony Chabot Regional Park, Castro Valley, CA, US",37.75371167,-122.1104195,10,,,Alameda,Sun Cup,Taraxia ovata,Sun Cup,Plantae,68182,Onagraceae,Taraxia,Taraxia ovata
41016816,3/29/20,2020-03-29 21:40:56 UTC,Pacific Time (US & Canada),research,https://www.inaturalist.org/observations/41016816,https://inaturalist-open-data.s3.amazonaws.com/photos/65041816/medium.jpg,,1,0,FALSE,"Lake Chabot Regional Park, Castro Valley, CA, US",37.720045,-122.1039888,16,,Castro Valley,Alameda,milkmaids,Cardamine californica,milkmaids,Plantae,49651,Brassicaceae,Cardamine,Cardamine californica
41016837,3/29/20,2020-03-29 21:42:16 UTC,Pacific Time (US & Canada),research,https://www.inaturalist.org/observations/41016837,https://inaturalist-open-data.s3.amazonaws.com/photos/65041867/medium.jpg,,1,0,FALSE,"Lake Chabot Regional Park, Castro Valley, CA, US",37.719875,-122.1039278,48,,Castro Valley,Alameda,Pacific Sanicle,Sanicula crassicaulis,Pacific Sanicle,Plantae,53201,Apiaceae,Sanicula,Sanicula crassicaulis
41016869,3/29/20,2020-03-29 21:57:40 UTC,Pacific Time (US & Canada),research,https://www.inaturalist.org/observations/41016869,https://inaturalist-open-data.s3.amazonaws.com/photos/65041891/medium.jpg,,1,0,FALSE,"Lake Chabot Regional Park, Castro Valley, CA, US",37.71808833,-122.0999362,8,,Castro Valley,Alameda,California brome,Bromus carinatus,California brome,Plantae,52700,Poaceae,Bromus,Bromus carinatus
41016971,3/29/20,2020-03-29 22:35:07 UTC,Pacific Time (US & Canada),research,https://www.inaturalist.org/observations/41016971,https://inaturalist-open-data.s3.amazonaws.com/photos/65042094/medium.jpg,,1,0,FALSE,"Lake Chabot Regional Park, Castro Valley, CA, US",37.72664667,-122.0951305,24,,Castro Valley,Alameda,Pacific pea,Lathyrus vestitus,Pacific pea,Plantae,50320,Fabaceae,Lathyrus,Lathyrus vestitus
41020131,3/29/20,2020-03-29 21:25:36 UTC,Pacific Time (US & Canada),research,https://www.inaturalist.org/observations/41020131,https://static.inaturalist.org/photos/65047622/medium.jpg,,1,0,FALSE,"Anthony Chabot Regional Park, Castro Valley, CA, US",37.720805,-122.0805583,10,,Castro Valley,Alameda,Sun Cup,Taraxia ovata,Sun Cup,Plantae,68182,Onagraceae,Taraxia,Taraxia ovata
41020153,3/29/20,2020-03-29 21:41:47 UTC,Pacific Time (US & Canada),research,https://www.inaturalist.org/observations/41020153,https://static.inaturalist.org/photos/65047643/medium.jpg,,1,0,FALSE,"Anthony Chabot Regional Park, Castro Valley, CA, US",37.72388333,-122.0857695,10,,Castro Valley,Alameda,bigleaf maple,Acer macrophyllum,bigleaf maple,Plantae,48227,Sapindaceae,Acer,Acer macrophyllum
41020166,3/29/20,2020-03-29 21:52:52 UTC,Pacific Time (US & Canada),research,https://www.inaturalist.org/observations/41020166,https://static.inaturalist.org/photos/65047663/medium.jpg,,1,0,FALSE,"Anthony Chabot Regional Park, Castro Valley, CA, US",37.72439167,-122.0859388,10,,Castro Valley,Alameda,miner's lettuce,Claytonia perfoliata,miner's lettuce,Plantae,52994,Montiaceae,Claytonia,Claytonia perfoliata
41020198,3/29/20,2020-03-29 21:55:17 UTC,Pacific Time (US & Canada),research,https://www.inaturalist.org/observations/41020198,https://static.inaturalist.org/photos/65047698/medium.jpg,,1,0,FALSE,"Anthony Chabot Regional Park, Castro Valley, CA, US",37.72416667,-122.0846472,10,,Castro Valley,Alameda,Trillium chloropetalum giganteum,Trillium chloropetalum giganteum,,Plantae,243295,Melanthiaceae,Trillium,Trillium chloropetalum
41058216,3/29/20,2020-03-30 00:59:34 UTC,Pacific Time (US & Canada),research,https://www.inaturalist.org/observations/41058216,https://inaturalist-open-data.s3.amazonaws.com/photos/65097711/medium.jpeg,,4,0,FALSE,"Castro Valley, CA 94552, USA",37.7444201,-122.1123183,,,,Alameda,star-flowered lily-of-the-valley,Maianthemum stellatum,star-flowered lily-of-the-valley,Plantae,53268,Asparagaceae,Maianthemum,Maianthemum stellatum
41058280,3/29/20,2020-03-30 01:03:49 UTC,Pacific Time (US & Canada),research,https://www.inaturalist.org/observations/41058280,https://inaturalist-open-data.s3.amazonaws.com/photos/65097848/medium.jpeg,,1,0,FALSE,"Oakland, CA 94605, USA",37.7434411,-122.1129897,,,,Alameda,California bee plant,Scrophularia californica,California beeplant,Plantae,50812,Scrophulariaceae,Scrophularia,Scrophularia californica
41058908,3/29/20,2020-03-29 23:47:44 UTC,Pacific Time (US & Canada),research,https://www.inaturalist.org/observations/41058908,https://inaturalist-open-data.s3.amazonaws.com/photos/65098939/medium.jpeg,,2,0,FALSE,"Anthony Chabot Regional Park, Alameda County, US-CA, US",37.7204546,-122.1040925,17,,Castro Valley,Alameda,checker lily,Fritillaria affinis,checker lily,Plantae,50618,Liliaceae,Fritillaria,Fritillaria affinis
41058958,3/29/20,2020-03-30 00:04:01 UTC,Pacific Time (US & Canada),research,https://www.inaturalist.org/observations/41058958,https://inaturalist-open-data.s3.amazonaws.com/photos/65098978/medium.jpeg,,2,0,FALSE,"Castro Valley, CA 94546, USA",37.72190801,-122.1040267,13,,Castro Valley,Alameda,western blue-eyed grass,Sisyrinchium bellum,western blue-eyed grass,Plantae,49918,Iridaceae,Sisyrinchium,Sisyrinchium bellum
41058993,3/29/20,2020-03-30 00:24:02 UTC,Pacific Time (US & Canada),research,https://www.inaturalist.org/observations/41058993,https://inaturalist-open-data.s3.amazonaws.com/photos/65099037/medium.jpeg,,2,0,FALSE,"Anthony Chabot Regional Park, Alameda County, US-CA, US",37.72304486,-122.1030147,6,,Castro Valley,Alameda,miner's lettuce,Claytonia perfoliata,miner's lettuce,Plantae,52994,Montiaceae,Claytonia,Claytonia perfoliata
41076079,3/29/20,2020-03-29 23:12:32 UTC,Pacific Time (US & Canada),research,https://www.inaturalist.org/observations/41076079,https://inaturalist-open-data.s3.amazonaws.com/photos/65128186/medium.jpeg,,1,0,FALSE,"Castro Valley, CA 94546, USA",37.72079478,-122.1066442,,,Castro Valley,Alameda,California poppy,Eschscholzia californica,California poppy,Plantae,48225,Papaveraceae,Eschscholzia,Eschscholzia californica
42804418,3/29/20,2020-03-29 23:53:20 UTC,Pacific Time (US & Canada),research,https://www.inaturalist.org/observations/42804418,https://static.inaturalist.org/photos/67976658/medium.jpg,,1,0,FALSE,"Anthony Chabot Regional Park, Oakland, CA, US",37.77693861,-122.1305503,30,,,Alameda,California manroot,Marah fabacea,California manroot,Plantae,205330,Cucurbitaceae,Marah,Marah fabacea
41053360,3/30/20,2020-03-30 15:26:51 UTC,Pacific Time (US & Canada),research,https://www.inaturalist.org/observations/41053360,https://static.inaturalist.org/photos/65090527/medium.jpg,,1,0,FALSE,"Lake Chabot Regional Park, Castro Valley, CA, US",37.718655,-122.1044917,6,,Castro Valley,Alameda,purple needlegrass,Nassella pulchra,purple needlegrass,Plantae,165659,Poaceae,Nassella,Nassella pulchra
41120790,3/30/20,2020-03-31 00:00:34 UTC,Pacific Time (US & Canada),research,https://www.inaturalist.org/observations/41120790,https://inaturalist-open-data.s3.amazonaws.com/photos/65204383/medium.jpg,,1,0,FALSE,"Anthony Chabot Regional Park, Alameda County, US-CA, US",37.77535745,-122.1297863,5,,,Alameda,Sun Cup,Taraxia ovata,Sun Cup,Plantae,68182,Onagraceae,Taraxia,Taraxia ovata
41122816,3/31/20,2020-03-31 19:20:35 UTC,Pacific Time (US & Canada),research,https://www.inaturalist.org/observations/41122816,https://static.inaturalist.org/photos/65207630/medium.jpeg,,3,0,FALSE,"Anthony Chabot Regional Park, Alameda County, US-CA, US",37.72401596,-122.0839697,6,,Castro Valley,Alameda,star-flowered lily-of-the-valley,Maianthemum stellatum,star-flowered lily-of-the-valley,Plantae,53268,Asparagaceae,Maianthemum,Maianthemum stellatum
