id,observed_on,time_observed_at,time_zone,quality_grade,url,image_url,description,num_identification_agreements,num_identification_disagreements,captive_cultivated,place_guess,latitude,longitude,positional_accuracy,geoprivacy,place_town_name,place_county_name,species_guess,scientific_name,common_name,iconic_taxon_name,taxon_id,taxon_family_name,taxon_genus_name,taxon_species_name
4631807,11/24/16,2016-11-24 17:55:23 UTC,Pacific Time (US & Canada),research,http://www.inaturalist.org/observations/4631807,https://inaturalist-open-data.s3.amazonaws.com/photos/5604066/medium.jpg,,1,0,FALSE,"Garin Regional Park, Hayward, CA, US",37.64121767,-122.0092603,8,,,Alameda,Coast live oak,Quercus agrifolia,coast live oak,Plantae,47850,Fagaceae,Quercus,Quercus agrifolia
4631813,11/24/16,2016-11-24 18:00:58 UTC,Pacific Time (US & Canada),research,http://www.inaturalist.org/observations/4631813,https://inaturalist-open-data.s3.amazonaws.com/photos/5604078/medium.jpg,,1,0,FALSE,"Garin Regional Park, Hayward, CA, US",37.64016824,-122.0100884,65,,Hayward,Alameda,California Sagebrush,Artemisia californica,California sagebrush,Plantae,53357,Asteraceae,Artemisia,Artemisia californica
4631814,11/24/16,2016-11-24 18:01:29 UTC,Pacific Time (US & Canada),research,http://www.inaturalist.org/observations/4631814,https://inaturalist-open-data.s3.amazonaws.com/photos/5604080/medium.jpg,,1,0,FALSE,"Garin Regional Park, Hayward, CA, US",37.64020808,-122.0100637,6,,Hayward,Alameda,orange bush monkeyflower,Diplacus aurantiacus,orange bush monkeyflower,Plantae,777371,Phrymaceae,Diplacus,Diplacus aurantiacus
4631816,11/24/16,2016-11-24 18:02:17 UTC,Pacific Time (US & Canada),research,http://www.inaturalist.org/observations/4631816,https://inaturalist-open-data.s3.amazonaws.com/photos/5604083/medium.jpg,,1,0,FALSE,"Garin Regional Park, Hayward, CA, US",37.64016829,-122.0101944,16,,Hayward,Alameda,Coyote Brush,Baccharis pilularis,coyote brush,Plantae,53359,Asteraceae,Baccharis,Baccharis pilularis
4631825,11/24/16,2016-11-24 18:04:03 UTC,Pacific Time (US & Canada),research,http://www.inaturalist.org/observations/4631825,https://inaturalist-open-data.s3.amazonaws.com/photos/5604100/medium.jpg,,1,0,FALSE,"Garin Regional Park, Hayward, CA, US",37.64026668,-122.0101524,6,,Hayward,Alameda,Turkey Mullein,Croton setiger,turkey mullein,Plantae,154156,Euphorbiaceae,Croton,Croton setiger
4631830,11/24/16,2016-11-24 18:13:21 UTC,Pacific Time (US & Canada),research,http://www.inaturalist.org/observations/4631830,https://inaturalist-open-data.s3.amazonaws.com/photos/5604110/medium.jpg,,2,0,FALSE,"Garin Regional Park, Hayward, CA, US",37.64070039,-122.0099325,183,,Hayward,Alameda,California bay,Umbellularia californica,California bay,Plantae,48807,Lauraceae,Umbellularia,Umbellularia californica
4632342,11/24/16,2016-11-24 18:24:12 UTC,Pacific Time (US & Canada),research,http://www.inaturalist.org/observations/4632342,https://inaturalist-open-data.s3.amazonaws.com/photos/5605025/medium.jpg,,1,0,FALSE,"94542, Hayward, CA, US",37.6437,-122.0083778,,,Hayward,Alameda,Pacific Sanicle,Sanicula crassicaulis,Pacific Sanicle,Plantae,53201,Apiaceae,Sanicula,Sanicula crassicaulis
4632452,11/24/16,2016-11-24 18:28:24 UTC,Pacific Time (US & Canada),research,http://www.inaturalist.org/observations/4632452,https://inaturalist-open-data.s3.amazonaws.com/photos/5605032/medium.jpg,,1,0,FALSE,"Garin Regional Park, Hayward, CA, US",37.64472802,-122.009079,12,,Hayward,Alameda,Armenian Blackberry,Rubus armeniacus,Armenian Blackberry,Plantae,61317,Rosaceae,Rubus,Rubus armeniacus
4759528,12/11/16,2016-12-11 23:13:05 UTC,Pacific Time (US & Canada),research,http://www.inaturalist.org/observations/4759528,https://inaturalist-open-data.s3.amazonaws.com/photos/5791587/medium.jpeg,,3,0,FALSE,"Unnamed Road Hayward, CA 94544",37.64283502,-122.0396669,8,,,Alameda,California bay,Umbellularia californica,California bay,Plantae,48807,Lauraceae,Umbellularia,Umbellularia californica
5741958,3/25/17,2017-03-25 16:58:12 UTC,Pacific Time (US & Canada),research,https://www.inaturalist.org/observations/5741958,https://inaturalist-open-data.s3.amazonaws.com/photos/7123907/medium.jpg,,1,0,FALSE,"94542, Hayward, CA, US",37.64359667,-122.0079806,,,Hayward,Alameda,catchweed bedstraw,Galium aparine,catchweed bedstraw,Plantae,53059,Rubiaceae,Galium,Galium aparine
5741964,3/25/17,2017-03-25 16:59:09 UTC,Pacific Time (US & Canada),research,https://www.inaturalist.org/observations/5741964,https://inaturalist-open-data.s3.amazonaws.com/photos/7123920/medium.jpg,,1,0,FALSE,"94542, Hayward, CA, US",37.64365333,-122.0078195,,,Hayward,Alameda,Pacific Sanicle,Sanicula crassicaulis,Pacific Sanicle,Plantae,53201,Apiaceae,Sanicula,Sanicula crassicaulis
5742199,3/25/17,2017-03-25 17:01:36 UTC,Pacific Time (US & Canada),research,https://www.inaturalist.org/observations/5742199,https://inaturalist-open-data.s3.amazonaws.com/photos/7124210/medium.jpg,,2,0,FALSE,"Garin Regional Park, Hayward, CA, US",37.642525,-122.0086139,,,Hayward,Alameda,Sun Cup,Taraxia ovata,Sun Cup,Plantae,68182,Onagraceae,Taraxia,Taraxia ovata
5744667,3/25/17,2017-03-25 17:45:54 UTC,Pacific Time (US & Canada),research,https://www.inaturalist.org/observations/5744667,https://inaturalist-open-data.s3.amazonaws.com/photos/7128462/medium.jpg,,1,0,FALSE,"Garin Regional Park, Hayward, CA, US",37.6426,-122.0086278,,,Hayward,Alameda,Purple Sanicle,Sanicula bipinnatifida,Purple Sanicle,Plantae,56840,Apiaceae,Sanicula,Sanicula bipinnatifida
5747329,3/25/17,2017-03-25 17:43:45 UTC,Pacific Time (US & Canada),research,https://www.inaturalist.org/observations/5747329,https://inaturalist-open-data.s3.amazonaws.com/photos/7132545/medium.jpg,,2,0,FALSE,"Garin Regional Park, Hayward, CA, US",37.64225833,-122.0086667,,,Hayward,Alameda,Field madder,Sherardia arvensis,Field madder,Plantae,47691,Rubiaceae,Sherardia,Sherardia arvensis
5747373,3/25/17,2017-03-25 17:36:58 UTC,Pacific Time (US & Canada),research,https://www.inaturalist.org/observations/5747373,https://inaturalist-open-data.s3.amazonaws.com/photos/7132769/medium.jpg,,1,0,FALSE,"Garin Regional Park, Hayward, CA, US",37.64098,-122.009675,,,,Alameda,dwarf orthocarpus,Triphysaria pusilla,dwarf orthocarpus,Plantae,57276,Orobanchaceae,Triphysaria,Triphysaria pusilla
5747555,3/25/17,2017-03-25 17:33:26 UTC,Pacific Time (US & Canada),research,https://www.inaturalist.org/observations/5747555,https://inaturalist-open-data.s3.amazonaws.com/photos/7133008/medium.jpg,,1,0,FALSE,"Garin Regional Park, Hayward, CA, US",37.64055,-122.0101861,,,Hayward,Alameda,Bluewitch Nightshade,Solanum umbelliferum,bluewitch nightshade,Plantae,50639,Solanaceae,Solanum,Solanum umbelliferum
5727959,4/15/17,2017-04-15 18:57:21 UTC,Pacific Time (US & Canada),research,https://www.inaturalist.org/observations/5727959,https://inaturalist-open-data.s3.amazonaws.com/photos/7103544/medium.jpg,,1,0,FALSE,"Garin Regional Park, Hayward, CA, US",37.64539589,-122.0450193,8,,,Alameda,Miniature Lupine,Lupinus bicolor,Miniature Lupine,Plantae,50614,Fabaceae,Lupinus,Lupinus bicolor
5728025,4/15/17,2017-04-15 18:59:11 UTC,Pacific Time (US & Canada),research,https://www.inaturalist.org/observations/5728025,https://inaturalist-open-data.s3.amazonaws.com/photos/7103610/medium.jpg,,2,0,FALSE,"Garin Regional Park, Hayward, CA, US",37.64540631,-122.044468,6,,,Alameda,California Mugwort,Artemisia douglasiana,California mugwort,Plantae,52854,Asteraceae,Artemisia,Artemisia douglasiana
5728037,4/15/17,2017-04-15 18:59:44 UTC,Pacific Time (US & Canada),research,https://www.inaturalist.org/observations/5728037,https://inaturalist-open-data.s3.amazonaws.com/photos/7103616/medium.jpg,,1,0,FALSE,"Garin Regional Park, Hayward, CA, US",37.64541076,-122.0443922,8,,,Alameda,California Poppy,Eschscholzia californica,California poppy,Plantae,48225,Papaveraceae,Eschscholzia,Eschscholzia californica
5728124,4/15/17,2017-04-15 19:00:49 UTC,Pacific Time (US & Canada),research,https://www.inaturalist.org/observations/5728124,https://inaturalist-open-data.s3.amazonaws.com/photos/7103721/medium.jpg,,2,0,FALSE,"Garin Regional Park, Hayward, CA, US",37.6453535,-122.0438773,8,,,Alameda,Pineapple Weed,Matricaria discoidea,pineapple-weed,Plantae,52992,Asteraceae,Matricaria,Matricaria discoidea
5728129,4/15/17,2017-04-15 19:01:45 UTC,Pacific Time (US & Canada),research,https://www.inaturalist.org/observations/5728129,https://inaturalist-open-data.s3.amazonaws.com/photos/7103733/medium.jpg,,1,0,FALSE,"Garin Regional Park, Hayward, CA, US",37.6455607,-122.0437717,16,,,Alameda,Wild Radish,Raphanus sativus,wild radish,Plantae,55410,Brassicaceae,Raphanus,Raphanus sativus
5728134,4/15/17,2017-04-15 19:02:13 UTC,Pacific Time (US & Canada),research,https://www.inaturalist.org/observations/5728134,https://inaturalist-open-data.s3.amazonaws.com/photos/7103748/medium.jpg,,2,0,FALSE,"Garin Regional Park, Hayward, CA, US",37.64555679,-122.0437744,16,,,Alameda,sweet fennel,Foeniculum vulgare,fennel,Plantae,53052,Apiaceae,Foeniculum,Foeniculum vulgare
5728225,4/15/17,2017-04-15 19:04:31 UTC,Pacific Time (US & Canada),research,https://www.inaturalist.org/observations/5728225,https://inaturalist-open-data.s3.amazonaws.com/photos/7103987/medium.jpg,,1,0,FALSE,"Garin Regional Park, Hayward, CA, US",37.64656816,-122.0437307,16,,,Alameda,Pacific Sanicle,Sanicula crassicaulis,Pacific Sanicle,Plantae,53201,Apiaceae,Sanicula,Sanicula crassicaulis
5738407,4/15/17,2017-04-15 19:13:18 UTC,Pacific Time (US & Canada),research,https://www.inaturalist.org/observations/5738407,https://inaturalist-open-data.s3.amazonaws.com/photos/7118685/medium.jpg,,1,0,FALSE,"Garin/Dry Creek Regional Park, Alameda County, US-CA, US",37.64693144,-122.0421385,16,,,Alameda,catchweed bedstraw,Galium aparine,catchweed bedstraw,Plantae,53059,Rubiaceae,Galium,Galium aparine
5738412,4/15/17,2017-04-15 19:20:54 UTC,Pacific Time (US & Canada),research,https://www.inaturalist.org/observations/5738412,https://inaturalist-open-data.s3.amazonaws.com/photos/7118693/medium.jpg,,1,0,FALSE,"Garin/Dry Creek Regional Park, Alameda County, US-CA, US",37.64635514,-122.0390354,12,,,Alameda,California hazelnut,Corylus cornuta californica,California hazelnut,Plantae,53368,Betulaceae,Corylus,Corylus cornuta
5741105,4/15/17,2017-04-15 17:52:00 UTC,Pacific Time (US & Canada),research,https://www.inaturalist.org/observations/5741105,https://inaturalist-open-data.s3.amazonaws.com/photos/7122085/medium.jpeg,,2,0,FALSE,"Alameda County, CA, USA",37.639535,-122.0290167,,,,Alameda,Ithuriel's Spear,Triteleia laxa,Ithuriel's Spear,Plantae,51085,Asparagaceae,Triteleia,Triteleia laxa
5741836,4/15/17,2017-04-15 18:28:00 UTC,Pacific Time (US & Canada),research,https://www.inaturalist.org/observations/5741836,https://inaturalist-open-data.s3.amazonaws.com/photos/7122905/medium.jpeg,,1,0,FALSE,"Mission - Garin, Hayward, CA, USA",37.63890667,-122.0371117,,,,Alameda,Bellardia trixago,Bellardia trixago,Mediterranean lineseed,Plantae,51286,Orobanchaceae,Bellardia,Bellardia trixago
5741838,4/15/17,2017-04-15 17:40:00 UTC,Pacific Time (US & Canada),research,https://www.inaturalist.org/observations/5741838,https://inaturalist-open-data.s3.amazonaws.com/photos/7123422/medium.jpeg,,1,0,FALSE,"Alameda County, CA, USA",37.63975167,-122.0317817,,,,Alameda,California Poppy,Eschscholzia californica,California poppy,Plantae,48225,Papaveraceae,Eschscholzia,Eschscholzia californica
5741840,4/15/17,2017-04-15 17:49:00 UTC,Pacific Time (US & Canada),research,https://www.inaturalist.org/observations/5741840,https://inaturalist-open-data.s3.amazonaws.com/photos/7123525/medium.jpeg,The leaves on this plant were <2 mm wide. Any ideas what it is? Nothing similar found on CalFlora.,2,0,FALSE,"Alameda County, CA, USA",37.639755,-122.029895,,,,Alameda,Shining Pepperweed,Lepidium nitidum,Shining Pepperweed,Plantae,47202,Brassicaceae,Lepidium,Lepidium nitidum
5746942,4/15/17,2017-04-15 19:12:00 UTC,Pacific Time (US & Canada),research,https://www.inaturalist.org/observations/5746942,https://inaturalist-open-data.s3.amazonaws.com/photos/7131884/medium.jpeg,,1,0,FALSE,"Mission - Garin, Hayward, CA, USA",37.646755,-122.0420217,,,,Alameda,Western Columbine,Aquilegia formosa,western columbine,Plantae,48244,Ranunculaceae,Aquilegia,Aquilegia formosa
5747107,4/15/17,2017-04-15 17:13:00 UTC,Pacific Time (US & Canada),research,https://www.inaturalist.org/observations/5747107,https://inaturalist-open-data.s3.amazonaws.com/photos/7132119/medium.jpeg,,1,0,FALSE,"Hayward Highland, Hayward, CA, USA",37.64596833,-122.032705,,,Hayward,Alameda,Hooker's fairybells,Prosartes hookeri,Hooker's fairybells,Plantae,51071,Liliaceae,Prosartes,Prosartes hookeri
5747110,4/15/17,2017-04-15 19:32:04 UTC,Pacific Time (US & Canada),research,https://www.inaturalist.org/observations/5747110,https://inaturalist-open-data.s3.amazonaws.com/photos/7132210/medium.jpg,,1,0,FALSE,"Garin Regional Park, Hayward, CA, US",37.64602164,-122.034629,,,Hayward,Alameda,California Spikenard,Aralia californica,California Spikenard,Plantae,52848,Araliaceae,Aralia,Aralia californica
5747871,4/15/17,2017-04-15 17:59:00 UTC,Pacific Time (US & Canada),research,https://www.inaturalist.org/observations/5747871,https://inaturalist-open-data.s3.amazonaws.com/photos/7133532/medium.jpeg,,1,0,FALSE,"Alameda County, CA, USA",37.63742333,-122.0263333,,,,Alameda,Coast Live Oak,Quercus agrifolia,coast live oak,Plantae,47850,Fagaceae,Quercus,Quercus agrifolia
6696102,6/3/17,2017-06-03 18:30:49 UTC,Pacific Time (US & Canada),research,https://www.inaturalist.org/observations/6696102,https://inaturalist-open-data.s3.amazonaws.com/photos/8491957/medium.jpg,,1,0,FALSE,"Garin Regional Park, Hayward, CA, US",37.64487,-122.0088583,,,Hayward,Alameda,Tall Flatsedge,Cyperus eragrostis,tall flatsedge,Plantae,59055,Cyperaceae,Cyperus,Cyperus eragrostis
6696106,6/3/17,2017-06-03 18:13:28 UTC,Pacific Time (US & Canada),research,https://www.inaturalist.org/observations/6696106,https://inaturalist-open-data.s3.amazonaws.com/photos/8491961/medium.jpg,,1,0,FALSE,"Garin Regional Park, Hayward, CA, US",37.63945333,-122.0104833,,,Hayward,Alameda,Maltese star-thistle,Centaurea melitensis,Maltese star-thistle,Plantae,57922,Asteraceae,Centaurea,Centaurea melitensis
6700294,6/3/17,2017-06-03 17:51:00 UTC,Pacific Time (US & Canada),research,https://www.inaturalist.org/observations/6700294,https://inaturalist-open-data.s3.amazonaws.com/photos/8498518/medium.jpeg,Possibly Cynosurus echinatus?,1,0,FALSE,"Hayward, CA, USA",37.64348889,-122.0081722,,,Hayward,Alameda,bristly dogtail grass,Cynosurus echinatus,bristly dogtail grass,Plantae,47695,Poaceae,Cynosurus,Cynosurus echinatus
6700494,6/3/17,2017-06-03 17:54:00 UTC,Pacific Time (US & Canada),research,https://www.inaturalist.org/observations/6700494,https://inaturalist-open-data.s3.amazonaws.com/photos/8498825/medium.jpeg,,1,0,FALSE,"Garin Regional Park, Hayward, CA, USA",37.64156389,-122.0089417,,,Hayward,Alameda,Brodiaea elegans elegans,Brodiaea elegans elegans,,Plantae,57127,Asparagaceae,Brodiaea,Brodiaea elegans
6700817,6/3/17,2017-06-03 18:09:00 UTC,Pacific Time (US & Canada),research,https://www.inaturalist.org/observations/6700817,https://inaturalist-open-data.s3.amazonaws.com/photos/8499141/medium.jpeg,,2,0,FALSE,"Hayward, CA, USA",37.63969444,-122.0103833,,,Hayward,Alameda,Brodiaea elegans elegans,Brodiaea elegans elegans,,Plantae,57127,Asparagaceae,Brodiaea,Brodiaea elegans
6700888,6/3/17,2017-06-03 18:23:00 UTC,Pacific Time (US & Canada),research,https://www.inaturalist.org/observations/6700888,https://inaturalist-open-data.s3.amazonaws.com/photos/8499200/medium.jpeg,,2,0,FALSE,"Garin Regional Park, Hayward, CA, USA",37.64236111,-122.0085972,,,Hayward,Alameda,Sheep's sorrel,Rumex acetosella,Sheep's sorrel,Plantae,53195,Polygonaceae,Rumex,Rumex acetosella
6905337,7/2/17,2017-07-02 20:34:15 UTC,Pacific Time (US & Canada),research,https://www.inaturalist.org/observations/6905337,https://inaturalist-open-data.s3.amazonaws.com/photos/8814243/medium.jpg,,1,0,FALSE,"Garin/Dry Creek Regional Park, Alameda County, US-CA, US",37.6251115,-122.0283831,10,,,Alameda,stinging nettle,Urtica dioica,great stinging nettle,Plantae,51884,Urticaceae,Urtica,Urtica dioica
7085890,7/16/17,2017-07-16 21:16:17 UTC,Pacific Time (US & Canada),research,https://www.inaturalist.org/observations/7085890,https://inaturalist-open-data.s3.amazonaws.com/photos/9103651/medium.jpg,,1,0,FALSE,"Garin/Dry Creek Regional Park, Alameda County, US-CA, US",37.63519577,-122.0251228,5,,,Alameda,tall flatsedge,Cyperus eragrostis,tall flatsedge,Plantae,59055,Cyperaceae,Cyperus,Cyperus eragrostis
7162195,7/22/17,2017-07-22 20:31:19 UTC,Pacific Time (US & Canada),research,https://www.inaturalist.org/observations/7162195,https://inaturalist-open-data.s3.amazonaws.com/photos/9244938/medium.jpg,,2,0,FALSE,"Garin/Dry Creek Regional Park, Alameda County, US-CA, US",37.62697006,-122.0280765,5,,,Alameda,Prostrate Capeweed,Arctotheca prostrata,Prostrate Capeweed,Plantae,75549,Asteraceae,Arctotheca,Arctotheca prostrata
7195156,7/24/17,2017-07-24 19:07:10 UTC,Pacific Time (US & Canada),research,https://www.inaturalist.org/observations/7195156,https://static.inaturalist.org/photos/9278232/medium.jpg,,1,0,FALSE,"Garin Regional Park, Union City, CA, US",37.62631764,-122.0282331,248,,,Alameda,Pennyroyal,Mentha pulegium,Pennyroyal,Plantae,57116,Lamiaceae,Mentha,Mentha pulegium
7363985,8/5/17,2017-08-05 19:30:02 UTC,Pacific Time (US & Canada),research,https://www.inaturalist.org/observations/7363985,https://static.inaturalist.org/photos/9549259/medium.jpg,,1,0,FALSE,"Garin Regional Park, Union City, CA, US",37.62562582,-122.0271283,413,,,Alameda,common duckweed,Lemna minor,common duckweed,Plantae,54518,Araceae,Lemna,Lemna minor
7364143,8/5/17,2017-08-05 19:12:42 UTC,Pacific Time (US & Canada),research,https://www.inaturalist.org/observations/7364143,https://static.inaturalist.org/photos/9549582/medium.jpg,,1,0,FALSE,"Garin Regional Park, Union City, CA, US",37.62644078,-122.027333,727,,,Alameda,field bindweed,Convolvulus arvensis,field bindweed,Plantae,53021,Convolvulaceae,Convolvulus,Convolvulus arvensis
7364535,8/5/17,2017-08-05 19:15:22 UTC,Pacific Time (US & Canada),research,https://www.inaturalist.org/observations/7364535,https://static.inaturalist.org/photos/9550140/medium.jpg,,2,0,FALSE,"Garin Regional Park, Hayward, CA, US",37.62894157,-122.0279498,979,,,Alameda,Milk Thistle,Silybum marianum,milk thistle,Plantae,52586,Asteraceae,Silybum,Silybum marianum
7364565,8/5/17,2017-08-05 19:15:40 UTC,Pacific Time (US & Canada),research,https://www.inaturalist.org/observations/7364565,https://static.inaturalist.org/photos/9550178/medium.jpg,,2,0,FALSE,"Garin Regional Park, Union City, CA, US",37.62784598,-122.0284732,629,,,Alameda,tall flatsedge,Cyperus eragrostis,tall flatsedge,Plantae,59055,Cyperaceae,Cyperus,Cyperus eragrostis
7364591,8/5/17,2017-08-05 19:16:13 UTC,Pacific Time (US & Canada),research,https://www.inaturalist.org/observations/7364591,https://static.inaturalist.org/photos/9550211/medium.jpg,,1,0,FALSE,"Garin Regional Park, Union City, CA, US",37.62706973,-122.0281091,215,,,Alameda,Pimpernel,Lysimachia arvensis,scarlet pimpernel,Plantae,791928,Primulaceae,Lysimachia,Lysimachia arvensis
7364655,8/5/17,2017-08-05 19:21:39 UTC,Pacific Time (US & Canada),research,https://www.inaturalist.org/observations/7364655,https://static.inaturalist.org/photos/9550354/medium.jpg,,1,0,FALSE,"Garin Regional Park, Union City, CA, US",37.62679147,-122.0279386,287,,,Alameda,Fremont cottonwood,Populus fremontii,Fremont Cottonwood,Plantae,52120,Salicaceae,Populus,Populus fremontii
7364748,8/5/17,2017-08-05 19:47:03 UTC,Pacific Time (US & Canada),research,https://www.inaturalist.org/observations/7364748,https://static.inaturalist.org/photos/9550524/medium.jpg,,1,0,FALSE,"Garin Regional Park, Union City, CA, US",37.62718818,-122.0285685,341,,,Alameda,Coast Live Oak,Quercus agrifolia,coast live oak,Plantae,47850,Fagaceae,Quercus,Quercus agrifolia
7577679,8/19/17,2017-08-19 21:58:51 UTC,Pacific Time (US & Canada),research,https://www.inaturalist.org/observations/7577679,https://inaturalist-open-data.s3.amazonaws.com/photos/9897897/medium.jpg,,1,0,FALSE,"Garin Regional Park, Hayward, CA, US",37.63443063,-122.0169065,89,,,Alameda,Arroyo Willow,Salix lasiolepis,Arroyo Willow,Plantae,53452,Salicaceae,Salix,Salix lasiolepis
8297495,9/9/17,2017-09-09 22:04:49 UTC,Pacific Time (US & Canada),research,https://www.inaturalist.org/observations/8297495,https://inaturalist-open-data.s3.amazonaws.com/photos/11011448/medium.jpg,,2,0,FALSE,"Garin Regional Park, Hayward, CA, US",37.62728667,-122.0305028,,,,Alameda,narrowleaf milkweed,Asclepias fascicularis,narrowleaf milkweed,Plantae,56851,Apocynaceae,Asclepias,Asclepias fascicularis
7996246,9/18/17,2017-09-19 01:15:50 UTC,Pacific Time (US & Canada),research,https://www.inaturalist.org/observations/7996246,https://static.inaturalist.org/photos/10578316/medium.jpg,,2,0,FALSE,"Garin/Dry Creek Regional Park, Alameda County, US-CA, US",37.6261726,-122.0281228,4,,,Alameda,trailing blackberry,Rubus ursinus,trailing blackberry,Plantae,53445,Rosaceae,Rubus,Rubus ursinus
8064459,9/23/17,2017-09-23 23:53:58 UTC,Pacific Time (US & Canada),research,https://www.inaturalist.org/observations/8064459,https://static.inaturalist.org/photos/10687729/medium.jpg,,1,0,FALSE,"Garin Regional Park, Union City, CA, US",37.62590833,-122.0279612,,,,Alameda,rabbitfoot grass,Polypogon monspeliensis,rabbitfoot grass,Plantae,57197,Poaceae,Polypogon,Polypogon monspeliensis
8064463,9/23/17,2017-09-23 23:52:45 UTC,Pacific Time (US & Canada),research,https://www.inaturalist.org/observations/8064463,https://static.inaturalist.org/photos/10687744/medium.jpg,,1,0,FALSE,"Garin Regional Park, Union City, CA, US",37.625805,-122.0280305,,,,Alameda,tall flatsedge,Cyperus eragrostis,tall flatsedge,Plantae,59055,Cyperaceae,Cyperus,Cyperus eragrostis
8064469,9/23/17,2017-09-23 23:52:30 UTC,Pacific Time (US & Canada),research,https://www.inaturalist.org/observations/8064469,https://static.inaturalist.org/photos/10687767/medium.jpg,,1,0,FALSE,"Garin Regional Park, Union City, CA, US",37.62581667,-122.0279917,,,,Alameda,Pennyroyal,Mentha pulegium,Pennyroyal,Plantae,57116,Lamiaceae,Mentha,Mentha pulegium
8064474,9/23/17,2017-09-23 23:10:46 UTC,Pacific Time (US & Canada),research,https://www.inaturalist.org/observations/8064474,https://static.inaturalist.org/photos/10687777/medium.jpg,,1,0,FALSE,"Garin Regional Park, Hayward, CA, US",37.62506333,-122.0284362,,,,Alameda,Armenian Blackberry,Rubus armeniacus,Armenian Blackberry,Plantae,61317,Rosaceae,Rubus,Rubus armeniacus
8923981,11/24/17,2017-11-24 23:36:21 UTC,Pacific Time (US & Canada),research,https://www.inaturalist.org/observations/8923981,https://inaturalist-open-data.s3.amazonaws.com/photos/12017839/medium.jpg,,1,0,FALSE,"Garin Regional Park, Hayward, CA, US",37.62636667,-122.028625,24,,,Alameda,California poppy,Eschscholzia californica,California poppy,Plantae,48225,Papaveraceae,Eschscholzia,Eschscholzia californica
8924018,11/24/17,2017-11-24 23:34:11 UTC,Pacific Time (US & Canada),research,https://www.inaturalist.org/observations/8924018,https://inaturalist-open-data.s3.amazonaws.com/photos/12017874/medium.jpg,,1,0,FALSE,"Garin Regional Park, Hayward, CA, US",37.625225,-122.0285195,8,,,Alameda,fringed willowherb,Epilobium ciliatum,fringed willowherb,Plantae,53050,Onagraceae,Epilobium,Epilobium ciliatum
8924022,11/24/17,2017-11-24 23:33:19 UTC,Pacific Time (US & Canada),research,https://www.inaturalist.org/observations/8924022,https://inaturalist-open-data.s3.amazonaws.com/photos/12017885/medium.jpg,,1,0,FALSE,"Garin Regional Park, Hayward, CA, US",37.62510333,-122.0284583,16,,,Alameda,Northern California Black Walnut,Juglans hindsii,northern California black walnut,Plantae,54502,Juglandaceae,Juglans,Juglans hindsii
8924302,11/24/17,2017-11-24 23:22:04 UTC,Pacific Time (US & Canada),research,https://www.inaturalist.org/observations/8924302,https://inaturalist-open-data.s3.amazonaws.com/photos/12018449/medium.jpg,,1,0,FALSE,"Garin Regional Park, Hayward, CA, US",37.62412,-122.0279167,6,,,Alameda,California Buckeye,Aesculus californica,California buckeye,Plantae,53348,Sapindaceae,Aesculus,Aesculus californica
8924388,11/24/17,2017-11-24 23:18:24 UTC,Pacific Time (US & Canada),research,https://www.inaturalist.org/observations/8924388,https://inaturalist-open-data.s3.amazonaws.com/photos/12018568/medium.jpg,,1,0,FALSE,"Garin Regional Park, Hayward, CA, US",37.62442833,-122.0281528,12,,,Alameda,Wavy-leafed Soap Plant,Chlorogalum pomeridianum,wavy-leafed soap plant,Plantae,47597,Asparagaceae,Chlorogalum,Chlorogalum pomeridianum
8924419,11/24/17,2017-11-24 23:16:43 UTC,Pacific Time (US & Canada),research,https://www.inaturalist.org/observations/8924419,https://inaturalist-open-data.s3.amazonaws.com/photos/12018582/medium.jpg,,1,0,FALSE,"Garin Regional Park, Hayward, CA, US",37.624775,-122.0281972,6,,,Alameda,Pacific Poison Oak,Toxicodendron diversilobum,Pacific poison oak,Plantae,51080,Anacardiaceae,Toxicodendron,Toxicodendron diversilobum
8924421,11/24/17,2017-11-24 23:16:36 UTC,Pacific Time (US & Canada),research,https://www.inaturalist.org/observations/8924421,https://inaturalist-open-data.s3.amazonaws.com/photos/12018588/medium.jpg,,1,0,FALSE,"Garin Regional Park, Hayward, CA, US",37.62478667,-122.0281917,6,,,Alameda,Coast Live Oak,Quercus agrifolia,coast live oak,Plantae,47850,Fagaceae,Quercus,Quercus agrifolia
8924429,11/24/17,2017-11-24 23:16:26 UTC,Pacific Time (US & Canada),research,https://www.inaturalist.org/observations/8924429,https://inaturalist-open-data.s3.amazonaws.com/photos/12018609/medium.jpg,,1,0,FALSE,"Garin Regional Park, Hayward, CA, US",37.624775,-122.0281972,6,,,Alameda,trailing blackberry,Rubus ursinus,trailing blackberry,Plantae,53445,Rosaceae,Rubus,Rubus ursinus
8924435,11/24/17,2017-11-24 23:15:42 UTC,Pacific Time (US & Canada),research,https://www.inaturalist.org/observations/8924435,https://inaturalist-open-data.s3.amazonaws.com/photos/12018657/medium.jpg,,1,0,FALSE,"Garin Regional Park, Hayward, CA, US",37.62499167,-122.0283805,6,,,Alameda,giant reed,Arundo donax,giant reed,Plantae,64017,Poaceae,Arundo,Arundo donax
8925784,11/24/17,2017-11-24 23:10:51 UTC,Pacific Time (US & Canada),research,https://www.inaturalist.org/observations/8925784,https://inaturalist-open-data.s3.amazonaws.com/photos/12020853/medium.jpg,,1,0,FALSE,"Garin Regional Park, Hayward, CA, US",37.626175,-122.0286167,128,,,Alameda,watercress,Nasturtium officinale,watercress,Plantae,78174,Brassicaceae,Nasturtium,Nasturtium officinale
8925797,11/24/17,2017-11-24 23:09:35 UTC,Pacific Time (US & Canada),research,https://www.inaturalist.org/observations/8925797,https://inaturalist-open-data.s3.amazonaws.com/photos/12020907/medium.jpg,,1,0,FALSE,"Garin Regional Park, Hayward, CA, US",37.62647,-122.0285333,16,,,Alameda,western sycamore,Platanus racemosa,western sycamore,Plantae,58231,Platanaceae,Platanus,Platanus racemosa
10385329,3/17/18,2018-03-17 19:00:05 UTC,Central Time (US & Canada),research,https://www.inaturalist.org/observations/10385329,https://inaturalist-open-data.s3.amazonaws.com/photos/14414728/medium.jpg,,1,0,FALSE,"Garin Regional Park, Hayward, CA, US",37.62802,-122.029625,499,,,Alameda,Eschscholzia californica californica,Eschscholzia californica californica,California Poppy,Plantae,48224,Papaveraceae,Eschscholzia,Eschscholzia californica
10704635,4/8/18,2018-04-08 16:22:13 UTC,Pacific Time (US & Canada),research,https://www.inaturalist.org/observations/10704635,https://static.inaturalist.org/photos/14970047/medium.jpg,,1,0,FALSE,"Garin Regional Park, Union City, CA, US",37.63392911,-122.0259587,6,,,Alameda,Seep Monkeyflower,Erythranthe guttata,seep monkeyflower,Plantae,470643,Phrymaceae,Erythranthe,Erythranthe guttata
10705894,4/8/18,2018-04-08 17:33:03 UTC,Pacific Time (US & Canada),research,https://www.inaturalist.org/observations/10705894,https://static.inaturalist.org/photos/14953498/medium.jpg,,1,0,FALSE,"Garin Regional Park, Hayward, CA, US",37.63777349,-122.0316163,12,,,Alameda,Purple Sanicle,Sanicula bipinnatifida,Purple Sanicle,Plantae,56840,Apiaceae,Sanicula,Sanicula bipinnatifida
11342802,4/18/18,2018-04-18 19:17:49 UTC,Pacific Time (US & Canada),research,https://www.inaturalist.org/observations/11342802,https://inaturalist-open-data.s3.amazonaws.com/photos/16156244/medium.jpg,,2,0,FALSE,"Garin Regional Park, Hayward, CA, US",37.64636201,-122.0418141,50,,,Alameda,western columbine,Aquilegia formosa,western columbine,Plantae,48244,Ranunculaceae,Aquilegia,Aquilegia formosa
11385534,4/22/18,2018-04-23 00:42:57 UTC,Pacific Time (US & Canada),research,https://www.inaturalist.org/observations/11385534,https://static.inaturalist.org/photos/16228086/medium.jpg,,1,0,FALSE,"Garin Regional Park, Union City, CA, US",37.63246667,-122.0261388,5,,,Alameda,wild radish,Raphanus sativus,wild radish,Plantae,55410,Brassicaceae,Raphanus,Raphanus sativus
11385580,4/22/18,2018-04-23 00:54:49 UTC,Pacific Time (US & Canada),research,https://www.inaturalist.org/observations/11385580,https://static.inaturalist.org/photos/16228139/medium.jpg,,1,0,FALSE,"Garin Regional Park, Union City, CA, US",37.63017,-122.0282222,5,,,Alameda,wild radish,Raphanus sativus,wild radish,Plantae,55410,Brassicaceae,Raphanus,Raphanus sativus
11385584,4/22/18,2018-04-23 00:50:34 UTC,Pacific Time (US & Canada),research,https://www.inaturalist.org/observations/11385584,https://static.inaturalist.org/photos/16228141/medium.jpg,,1,0,FALSE,"Garin Regional Park, Hayward, CA, US",37.63151167,-122.027175,10,,,Alameda,trailing blackberry,Rubus ursinus,trailing blackberry,Plantae,53445,Rosaceae,Rubus,Rubus ursinus
12045193,5/1/18,2018-05-02 00:51:50 UTC,Pacific Time (US & Canada),research,https://www.inaturalist.org/observations/12045193,https://static.inaturalist.org/photos/17268174/medium.jpg,,2,0,FALSE,"Garin/Dry Creek Regional Park, Alameda County, US-CA, US",37.64683806,-122.0426435,5,,,Alameda,California hazelnut,Corylus cornuta californica,California hazelnut,Plantae,53368,Betulaceae,Corylus,Corylus cornuta
13084404,6/2/18,2018-06-02 22:42:00 UTC,Pacific Time (US & Canada),research,https://www.inaturalist.org/observations/13084404,https://inaturalist-open-data.s3.amazonaws.com/photos/19060019/medium.jpg,,1,0,FALSE,Garin Regional Park,37.62607597,-122.028593,,,,Alameda,Italian thistle,Carduus pycnocephalus,Italian thistle,Plantae,52990,Asteraceae,Carduus,Carduus pycnocephalus
13084409,6/2/18,2018-06-02 23:09:00 UTC,Pacific Time (US & Canada),research,https://www.inaturalist.org/observations/13084409,https://inaturalist-open-data.s3.amazonaws.com/photos/19060032/medium.jpg,,1,0,FALSE,Garin Regional Park,37.62409497,-122.027614,,,,Alameda,milk thistle,Silybum marianum,milk thistle,Plantae,52586,Asteraceae,Silybum,Silybum marianum
13238573,6/8/18,2018-06-08 17:41:02 UTC,Pacific Time (US & Canada),research,https://www.inaturalist.org/observations/13238573,https://static.inaturalist.org/photos/19419484/medium.jpg,,1,0,FALSE,"Garin/Dry Creek Regional Park, Alameda County, US-CA, US",37.62756228,-122.0284461,5,,,Alameda,Tanoak,Notholithocarpus densiflorus,Tanoak,Plantae,69823,Fagaceae,Notholithocarpus,Notholithocarpus densiflorus
13338659,6/8/18,2018-06-08 19:11:36 UTC,Pacific Time (US & Canada),research,https://www.inaturalist.org/observations/13338659,https://static.inaturalist.org/photos/19551939/medium.jpg,,1,0,FALSE,"Garin/Dry Creek Regional Park, Alameda County, US-CA, US",37.62716247,-122.0281646,30,,,Alameda,Prostrate Capeweed,Arctotheca prostrata,Prostrate Capeweed,Plantae,75549,Asteraceae,Arctotheca,Arctotheca prostrata
14064571,7/4/18,2018-07-05 01:41:57 UTC,Pacific Time (US & Canada),research,https://www.inaturalist.org/observations/14064571,https://static.inaturalist.org/photos/20815896/medium.jpg,,1,0,FALSE,"Garin Regional Park, Union City, CA, US",37.625825,-122.0284722,24,,,Alameda,rabbitfoot grass,Polypogon monspeliensis,rabbitfoot grass,Plantae,57197,Poaceae,Polypogon,Polypogon monspeliensis
15619996,8/18/18,2018-08-18 15:08:31 UTC,Pacific Time (US & Canada),research,https://www.inaturalist.org/observations/15619996,https://inaturalist-open-data.s3.amazonaws.com/photos/24739044/medium.jpg,,1,0,FALSE,"Garin/Dry Creek Regional Park, Alameda County, US-CA, US",37.6324416,-122.0271317,22,,,Alameda,common fig,Ficus carica,common fig,Plantae,60218,Moraceae,Ficus,Ficus carica
17594072,10/16/18,2018-10-16 18:51:13 UTC,Pacific Time (US & Canada),research,https://www.inaturalist.org/observations/17594072,https://static.inaturalist.org/photos/26788916/medium.jpg,,2,0,FALSE,"Garin/Dry Creek Regional Park, Alameda County, US-CA, US",37.64641218,-122.0345605,10,,Hayward,Alameda,Pink Honeysuckle,Lonicera hispidula,Pink Honeysuckle,Plantae,53416,Caprifoliaceae,Lonicera,Lonicera hispidula
17594076,10/16/18,2018-10-16 18:51:41 UTC,Pacific Time (US & Canada),research,https://www.inaturalist.org/observations/17594076,https://static.inaturalist.org/photos/26788921/medium.jpg,,2,0,FALSE,"Garin/Dry Creek Regional Park, Alameda County, US-CA, US",37.64652768,-122.0347798,10,,Hayward,Alameda,Pink Honeysuckle,Lonicera hispidula,Pink Honeysuckle,Plantae,53416,Caprifoliaceae,Lonicera,Lonicera hispidula
17772008,10/23/18,2018-10-23 16:26:41 UTC,Pacific Time (US & Canada),research,https://www.inaturalist.org/observations/17772008,https://static.inaturalist.org/photos/27111382/medium.jpg,,2,0,FALSE,"Garin/Dry Creek Regional Park, Alameda County, US-CA, US",37.64679641,-122.0366674,5,,Hayward,Alameda,Stinkwort,Dittrichia graveolens,Stinkwort,Plantae,58822,Asteraceae,Dittrichia,Dittrichia graveolens
18603962,11/24/18,2018-11-24 20:05:03 UTC,Pacific Time (US & Canada),research,https://www.inaturalist.org/observations/18603962,https://inaturalist-open-data.s3.amazonaws.com/photos/28472273/medium.jpg,,1,0,FALSE,"94542, Hayward, CA, US",37.64505333,-122.0116722,4,,Hayward,Alameda,California sagebrush,Artemisia californica,California sagebrush,Plantae,53357,Asteraceae,Artemisia,Artemisia californica
18603988,11/24/18,2018-11-24 19:56:42 UTC,Pacific Time (US & Canada),research,https://www.inaturalist.org/observations/18603988,https://inaturalist-open-data.s3.amazonaws.com/photos/28472344/medium.jpg,,1,0,FALSE,"94587, Hayward, CA, US",37.643545,-122.0075528,8,,Hayward,Alameda,yerba buena,Clinopodium douglasii,yerba buena,Plantae,53203,Lamiaceae,Clinopodium,Clinopodium douglasii
18807063,11/30/18,2018-11-30 18:38:08 UTC,Pacific Time (US & Canada),research,https://www.inaturalist.org/observations/18807063,https://static.inaturalist.org/photos/28805990/medium.jpg,,1,0,FALSE,"Garin Regional Park, Union City, CA, US",37.63277181,-122.011817,482,,,Alameda,coyote brush,Baccharis pilularis,coyote brush,Plantae,53359,Asteraceae,Baccharis,Baccharis pilularis
19642592,1/12/19,2019-01-12 19:58:00 UTC,Pacific Time (US & Canada),research,https://www.inaturalist.org/observations/19642592,https://inaturalist-open-data.s3.amazonaws.com/photos/30246068/medium.jpeg,,1,0,FALSE,"Garin/Dry Creek Regional Park, Alameda, California, United States",37.62888611,-122.0245528,5,,,Alameda,milk thistle,Silybum marianum,milk thistle,Plantae,52586,Asteraceae,Silybum,Silybum marianum
19645454,1/12/19,2019-01-13 00:47:00 UTC,Pacific Time (US & Canada),research,https://www.inaturalist.org/observations/19645454,https://inaturalist-open-data.s3.amazonaws.com/photos/30249729/medium.jpeg,,1,0,FALSE,"Alameda County, CA, USA",37.62718889,-122.0281917,5,,,Alameda,Prostrate Capeweed,Arctotheca prostrata,Prostrate Capeweed,Plantae,75549,Asteraceae,Arctotheca,Arctotheca prostrata
20988058,3/5/19,2019-03-05 22:21:54 UTC,Pacific Time (US & Canada),research,https://www.inaturalist.org/observations/20988058,https://static.inaturalist.org/photos/32413795/medium.jpg,,1,0,FALSE,"94542, Hayward, CA, US",37.641895,-122.0093083,10,,,Alameda,Fremont's Deathcamas,Toxicoscordion fremontii,Common star lily,Plantae,49649,Melanthiaceae,Toxicoscordion,Toxicoscordion fremontii
22113668,4/6/19,2019-04-06 18:57:01 UTC,Pacific Time (US & Canada),research,https://www.inaturalist.org/observations/22113668,https://inaturalist-open-data.s3.amazonaws.com/photos/34231840/medium.jpg,,1,0,FALSE,"94587, Hayward, CA, US",37.64168,-122.0058972,6,,Hayward,Alameda,Purple Sanicle,Sanicula bipinnatifida,Purple Sanicle,Plantae,56840,Apiaceae,Sanicula,Sanicula bipinnatifida
22113705,4/6/19,2019-04-06 18:57:30 UTC,Pacific Time (US & Canada),research,https://www.inaturalist.org/observations/22113705,https://inaturalist-open-data.s3.amazonaws.com/photos/34231924/medium.jpg,,1,0,FALSE,"94587, Hayward, CA, US",37.64160333,-122.0060417,6,,Hayward,Alameda,Sheep's sorrel,Rumex acetosella,Sheep's sorrel,Plantae,53195,Polygonaceae,Rumex,Rumex acetosella
22113742,4/6/19,2019-04-06 18:57:36 UTC,Pacific Time (US & Canada),research,https://www.inaturalist.org/observations/22113742,https://inaturalist-open-data.s3.amazonaws.com/photos/34231990/medium.jpg,,1,0,FALSE,"94587, Hayward, CA, US",37.64159667,-122.00605,6,,Hayward,Alameda,Sun Cup,Taraxia ovata,Sun Cup,Plantae,68182,Onagraceae,Taraxia,Taraxia ovata
22113774,4/6/19,2019-04-06 19:01:43 UTC,Pacific Time (US & Canada),research,https://www.inaturalist.org/observations/22113774,https://inaturalist-open-data.s3.amazonaws.com/photos/34232078/medium.jpg,,1,0,FALSE,"94587, Hayward, CA, US",37.64053333,-122.007125,6,,Hayward,Alameda,wavy-leafed soap plant,Chlorogalum pomeridianum,wavy-leafed soap plant,Plantae,47597,Asparagaceae,Chlorogalum,Chlorogalum pomeridianum
22113861,4/6/19,2019-04-06 19:04:06 UTC,Pacific Time (US & Canada),research,https://www.inaturalist.org/observations/22113861,https://inaturalist-open-data.s3.amazonaws.com/photos/34232177/medium.jpg,,1,0,FALSE,"94587, Hayward, CA, US",37.64018833,-122.0078278,6,,Hayward,Alameda,California poppy,Eschscholzia californica,California poppy,Plantae,48225,Papaveraceae,Eschscholzia,Eschscholzia californica
22113890,4/6/19,2019-04-06 19:04:43 UTC,Pacific Time (US & Canada),research,https://www.inaturalist.org/observations/22113890,https://inaturalist-open-data.s3.amazonaws.com/photos/34232248/medium.jpg,,2,0,FALSE,"94587, Hayward, CA, US",37.64015333,-122.00805,6,,Hayward,Alameda,California sagebrush,Artemisia californica,California sagebrush,Plantae,53357,Asteraceae,Artemisia,Artemisia californica
22113932,4/6/19,2019-04-06 19:11:40 UTC,Pacific Time (US & Canada),research,https://www.inaturalist.org/observations/22113932,https://inaturalist-open-data.s3.amazonaws.com/photos/34232264/medium.jpg,,2,0,FALSE,"Garin Regional Park, Hayward, CA, US",37.63987,-122.0101695,6,,Hayward,Alameda,Redmaids,Calandrinia menziesii,redmaids,Plantae,400267,Montiaceae,Calandrinia,Calandrinia menziesii
22114018,4/6/19,2019-04-06 19:21:57 UTC,Pacific Time (US & Canada),research,https://www.inaturalist.org/observations/22114018,https://inaturalist-open-data.s3.amazonaws.com/photos/34232441/medium.jpg,,1,0,FALSE,"Garin Regional Park, Hayward, CA, US",37.64038833,-122.010825,6,,Hayward,Alameda,catchweed bedstraw,Galium aparine,catchweed bedstraw,Plantae,53059,Rubiaceae,Galium,Galium aparine
22114053,4/6/19,2019-04-06 19:22:41 UTC,Pacific Time (US & Canada),research,https://www.inaturalist.org/observations/22114053,https://inaturalist-open-data.s3.amazonaws.com/photos/34232495/medium.jpg,,1,0,FALSE,"Garin Regional Park, Hayward, CA, US",37.64047,-122.0108333,6,,Hayward,Alameda,milkmaids,Cardamine californica,milkmaids,Plantae,49651,Brassicaceae,Cardamine,Cardamine californica
22114210,4/6/19,2019-04-06 19:23:41 UTC,Pacific Time (US & Canada),research,https://www.inaturalist.org/observations/22114210,https://inaturalist-open-data.s3.amazonaws.com/photos/34232743/medium.jpg,,1,0,FALSE,"Garin Regional Park, Hayward, CA, US",37.640525,-122.010825,6,,Hayward,Alameda,Fremont's Deathcamas,Toxicoscordion fremontii,Common star lily,Plantae,49649,Melanthiaceae,Toxicoscordion,Toxicoscordion fremontii
22114422,4/6/19,2019-04-06 19:24:41 UTC,Pacific Time (US & Canada),research,https://www.inaturalist.org/observations/22114422,https://inaturalist-open-data.s3.amazonaws.com/photos/34233126/medium.jpg,,1,0,FALSE,"Garin Regional Park, Hayward, CA, US",37.64055333,-122.0108639,6,,Hayward,Alameda,blue elder,Sambucus cerulea,blue elder,Plantae,143799,Viburnaceae,Sambucus,Sambucus cerulea
22114494,4/6/19,2019-04-06 19:26:54 UTC,Pacific Time (US & Canada),research,https://www.inaturalist.org/observations/22114494,https://inaturalist-open-data.s3.amazonaws.com/photos/34233272/medium.jpg,,1,0,FALSE,"Garin Regional Park, Hayward, CA, US",37.640475,-122.0107583,8,,Hayward,Alameda,milkmaids,Cardamine californica,milkmaids,Plantae,49651,Brassicaceae,Cardamine,Cardamine californica
22114541,4/6/19,2019-04-06 19:28:02 UTC,Pacific Time (US & Canada),research,https://www.inaturalist.org/observations/22114541,https://inaturalist-open-data.s3.amazonaws.com/photos/34233326/medium.jpg,,1,0,FALSE,"Garin Regional Park, Hayward, CA, US",37.64063667,-122.0106278,8,,,Alameda,California bee plant,Scrophularia californica,California beeplant,Plantae,50812,Scrophulariaceae,Scrophularia,Scrophularia californica
22432875,4/13/19,2019-04-13 21:30:18 UTC,Pacific Time (US & Canada),research,https://www.inaturalist.org/observations/22432875,https://static.inaturalist.org/photos/34745879/medium.jpg,,2,0,FALSE,"Garin Regional Park, Hayward, CA, US",37.62410609,-122.0295031,5,,,Alameda,California poppy,Eschscholzia californica,California poppy,Plantae,48225,Papaveraceae,Eschscholzia,Eschscholzia californica
22433512,4/13/19,2019-04-13 21:42:03 UTC,Pacific Time (US & Canada),research,https://www.inaturalist.org/observations/22433512,https://static.inaturalist.org/photos/34746869/medium.jpg,,1,0,FALSE,"Garin Regional Park, Hayward, CA, US",37.62685079,-122.0291823,5,,,Alameda,wild radish,Raphanus sativus,wild radish,Plantae,55410,Brassicaceae,Raphanus,Raphanus sativus
22433561,4/13/19,2019-04-13 21:43:06 UTC,Pacific Time (US & Canada),research,https://www.inaturalist.org/observations/22433561,https://static.inaturalist.org/photos/34746971/medium.jpg,,1,0,FALSE,"Garin Regional Park, Union City, CA, US",37.62731393,-122.0294586,5,,,Alameda,California poppy,Eschscholzia californica,California poppy,Plantae,48225,Papaveraceae,Eschscholzia,Eschscholzia californica
22438393,4/13/19,2019-04-13 22:04:29 UTC,Pacific Time (US & Canada),research,https://www.inaturalist.org/observations/22438393,https://static.inaturalist.org/photos/34754279/medium.jpg,,1,0,FALSE,"Garin Regional Park, Hayward, CA, US",37.646125,-122.0377667,10,,Hayward,Alameda,giant wakerobin,Trillium chloropetalum,giant wakerobin,Plantae,50823,Melanthiaceae,Trillium,Trillium chloropetalum
23038593,4/22/19,2019-04-22 17:10:06 UTC,Pacific Time (US & Canada),research,https://www.inaturalist.org/observations/23038593,https://inaturalist-open-data.s3.amazonaws.com/photos/35715878/medium.jpeg,Garin park,1,0,FALSE,"Hayward, CA 94544, USA",37.63690785,-122.0236558,526,,,Alameda,Salsify,Tragopogon porrifolius,purple salsify,Plantae,54141,Asteraceae,Tragopogon,Tragopogon porrifolius
23293916,4/25/19,2019-04-25 19:00:00 UTC,Pacific Time (US & Canada),research,https://www.inaturalist.org/observations/23293916,https://inaturalist-open-data.s3.amazonaws.com/photos/36092572/medium.jpeg,,3,0,FALSE,"1650 Garin Ave, Hayward, CA 94544, USA",37.63161856,-122.0276738,526,,,Alameda,Ithuriel's Spear,Triteleia laxa,Ithuriel's Spear,Plantae,51085,Asparagaceae,Triteleia,Triteleia laxa
24578528,4/26/19,2019-04-27 02:37:00 UTC,Pacific Time (US & Canada),research,https://www.inaturalist.org/observations/24578528,https://inaturalist-open-data.s3.amazonaws.com/photos/38007815/medium.jpg,Purple Sanicle,1,0,FALSE,"Garin/Dry Creek Regional Park, Alameda, California, United States",37.64131,-122.0094567,,,,Alameda,Purple Sanicle,Sanicula bipinnatifida,Purple Sanicle,Plantae,56840,Apiaceae,Sanicula,Sanicula bipinnatifida
24578533,4/26/19,2019-04-27 02:05:00 UTC,Pacific Time (US & Canada),research,https://www.inaturalist.org/observations/24578533,https://inaturalist-open-data.s3.amazonaws.com/photos/38007824/medium.jpg,Woodland star,2,0,FALSE,"Garin/Dry Creek Regional Park, Alameda, California, United States",37.64374,-122.0078333,,,Hayward,Alameda,San Francisco woodland-star,Lithophragma affine,San Francisco woodland-star,Plantae,50803,Saxifragaceae,Lithophragma,Lithophragma affine
24578535,4/26/19,2019-04-27 01:46:00 UTC,Pacific Time (US & Canada),research,https://www.inaturalist.org/observations/24578535,https://inaturalist-open-data.s3.amazonaws.com/photos/38007825/medium.jpg,Subterranean Clover,1,0,FALSE,"Garin/Dry Creek Regional Park, Alameda, California, United States",37.64418333,-122.0080667,,,Hayward,Alameda,Subterranean Clover,Trifolium subterraneum,Subterranean Clover,Plantae,60201,Fabaceae,Trifolium,Trifolium subterraneum
24578537,4/26/19,2019-04-27 01:38:00 UTC,Pacific Time (US & Canada),research,https://www.inaturalist.org/observations/24578537,https://inaturalist-open-data.s3.amazonaws.com/photos/38007831/medium.jpg,,1,0,FALSE,"Garin/Dry Creek Regional Park, Alameda, California, United States",37.64451667,-122.00888,,,Hayward,Alameda,Little-Robin,Geranium purpureum,Little-Robin,Plantae,57643,Geraniaceae,Geranium,Geranium purpureum
24578544,4/26/19,2019-04-27 01:33:00 UTC,Pacific Time (US & Canada),research,https://www.inaturalist.org/observations/24578544,https://inaturalist-open-data.s3.amazonaws.com/photos/38007833/medium.jpg,Field Madder,1,0,FALSE,"Garin/Dry Creek Regional Park, Alameda, California, United States",37.64442167,-122.008815,,,Hayward,Alameda,Field madder,Sherardia arvensis,Field madder,Plantae,47691,Rubiaceae,Sherardia,Sherardia arvensis
25178219,5/10/19,2019-05-10 21:09:32 UTC,Pacific Time (US & Canada),research,https://www.inaturalist.org/observations/25178219,https://static.inaturalist.org/photos/38973423/medium.jpg,,1,0,FALSE,"Garin Regional Park, Union City, CA, US",37.63318333,-122.0298167,16,,,Alameda,western blue-eyed grass,Sisyrinchium bellum,western blue-eyed grass,Plantae,49918,Iridaceae,Sisyrinchium,Sisyrinchium bellum
25037491,5/12/19,2019-05-13 00:48:17 UTC,Pacific Time (US & Canada),research,https://www.inaturalist.org/observations/25037491,https://inaturalist-open-data.s3.amazonaws.com/photos/38742780/medium.jpeg,,1,0,FALSE,"Garin/Dry Creek Regional Park, Alameda County, US-CA, US",37.62844703,-122.0293455,7,,,Alameda,California buckeye,Aesculus californica,California buckeye,Plantae,53348,Sapindaceae,Aesculus,Aesculus californica
25037515,5/12/19,2019-05-13 00:49:21 UTC,Pacific Time (US & Canada),research,https://www.inaturalist.org/observations/25037515,https://inaturalist-open-data.s3.amazonaws.com/photos/38742940/medium.jpeg,,1,0,FALSE,"Garin/Dry Creek Regional Park, Alameda County, US-CA, US",37.62848852,-122.0293181,7,,,Alameda,California buckeye,Aesculus californica,California buckeye,Plantae,53348,Sapindaceae,Aesculus,Aesculus californica
25408425,5/19/19,2019-05-19 20:57:41 UTC,Pacific Time (US & Canada),research,https://www.inaturalist.org/observations/25408425,https://static.inaturalist.org/photos/39347156/medium.jpeg,,2,0,FALSE,"1320 Garin Ave, Hayward, CA 94544, USA",37.62731882,-122.028338,516,,,Alameda,Salsify,Tragopogon porrifolius,purple salsify,Plantae,54141,Asteraceae,Tragopogon,Tragopogon porrifolius
25541749,5/20/19,2019-05-20 21:13:16 UTC,Pacific Time (US & Canada),research,https://www.inaturalist.org/observations/25541749,https://static.inaturalist.org/photos/39575918/medium.jpg,,1,0,FALSE,"94587, Hayward, CA, US",37.64273833,-122.0085139,5,,Hayward,Alameda,narrowleaf mule-ears,Wyethia angustifolia,narrowleaf mule-ears,Plantae,56987,Asteraceae,Wyethia,Wyethia angustifolia
25541815,5/20/19,2019-05-20 21:41:10 UTC,Pacific Time (US & Canada),research,https://www.inaturalist.org/observations/25541815,https://static.inaturalist.org/photos/39575973/medium.jpg,,1,0,FALSE,"94587, Hayward, CA, US",37.642405,-122.0087361,10,,Hayward,Alameda,Greater Quaking Grass,Briza maxima,Greater Quaking Grass,Plantae,57157,Poaceae,Briza,Briza maxima
25541867,5/20/19,2019-05-20 21:25:49 UTC,Pacific Time (US & Canada),research,https://www.inaturalist.org/observations/25541867,https://static.inaturalist.org/photos/39576109/medium.jpg,,2,0,FALSE,"94587, Hayward, CA, US",37.64072833,-122.0096278,5,,Hayward,Alameda,white brodiaea,Triteleia hyacinthina,white brodiaea,Plantae,57132,Asparagaceae,Triteleia,Triteleia hyacinthina
25968745,5/28/19,2019-05-28 20:42:12 UTC,Pacific Time (US & Canada),research,https://www.inaturalist.org/observations/25968745,https://static.inaturalist.org/photos/40281026/medium.jpg,,1,0,FALSE,"Garin Regional Park, Union City, CA, US",37.63525333,-122.025025,10,,,Alameda,Seep Monkeyflower,Erythranthe guttata,seep monkeyflower,Plantae,470643,Phrymaceae,Erythranthe,Erythranthe guttata
26292125,6/2/19,2019-06-02 19:20:00 UTC,Pacific Time (US & Canada),research,https://www.inaturalist.org/observations/26292125,https://inaturalist-open-data.s3.amazonaws.com/photos/40811435/medium.jpg,,2,0,FALSE,"Garin Regional Park, CA, USA",37.64652333,-122.041835,,,,Alameda,White Globe Lily,Calochortus albus,White Globe Lily,Plantae,51315,Liliaceae,Calochortus,Calochortus albus
26292126,6/2/19,2019-06-02 19:23:00 UTC,Pacific Time (US & Canada),research,https://www.inaturalist.org/observations/26292126,https://inaturalist-open-data.s3.amazonaws.com/photos/40811440/medium.jpg,,1,0,FALSE,"Garin Regional Park, CA, USA",37.64653167,-122.0392867,,,,Alameda,broadleaf forget-me-not,Myosotis latifolia,broadleaf forget-me-not,Plantae,49132,Boraginaceae,Myosotis,Myosotis latifolia
26292128,6/2/19,2019-06-02 19:27:00 UTC,Pacific Time (US & Canada),research,https://www.inaturalist.org/observations/26292128,https://inaturalist-open-data.s3.amazonaws.com/photos/40811458/medium.jpg,,2,0,FALSE,"Garin Regional Park, CA, USA",37.64611333,-122.0377967,,,Hayward,Alameda,common cowparsnip,Heracleum maximum,common cowparsnip,Plantae,53094,Apiaceae,Heracleum,Heracleum maximum
26292131,6/2/19,2019-06-02 19:34:00 UTC,Pacific Time (US & Canada),research,https://www.inaturalist.org/observations/26292131,https://inaturalist-open-data.s3.amazonaws.com/photos/40811482/medium.jpg,,1,0,FALSE,"Garin Regional Park, CA, USA",37.64595167,-122.0339383,,,Hayward,Alameda,California Spikenard,Aralia californica,California Spikenard,Plantae,52848,Araliaceae,Aralia,Aralia californica
26292132,6/2/19,2019-06-02 19:35:00 UTC,Pacific Time (US & Canada),research,https://www.inaturalist.org/observations/26292132,https://inaturalist-open-data.s3.amazonaws.com/photos/40811643/medium.jpg,,1,0,FALSE,"Garin Regional Park, CA, USA",37.64571333,-122.03303,,,Hayward,Alameda,Armenian Blackberry,Rubus armeniacus,Armenian Blackberry,Plantae,61317,Rosaceae,Rubus,Rubus armeniacus
26292141,6/2/19,2019-06-02 20:13:00 UTC,Pacific Time (US & Canada),research,https://www.inaturalist.org/observations/26292141,https://inaturalist-open-data.s3.amazonaws.com/photos/40811688/medium.jpg,,2,0,FALSE,"Garin Regional Park, CA, USA",37.63314333,-122.0272017,,,,Alameda,milk thistle,Silybum marianum,milk thistle,Plantae,52586,Asteraceae,Silybum,Silybum marianum
26292146,6/2/19,2019-06-02 20:40:00 UTC,Pacific Time (US & Canada),research,https://www.inaturalist.org/observations/26292146,https://inaturalist-open-data.s3.amazonaws.com/photos/40811712/medium.jpg,"If I look at iNat's suggestions, I can't be sure.  But if I look at the <a href=""https://www.ebparks.org/civicax/filebank/blobdload.aspx?BlobID=23977"">Garin Wildflower Photo Guide</a>, there's only one match.
",1,0,FALSE,"Garin Regional Park, CA, USA",37.63326333,-122.0241867,,,,Alameda,poison hemlock,Conium maculatum,poison hemlock,Plantae,52998,Apiaceae,Conium,Conium maculatum
26427845,6/4/19,2019-06-05 02:55:00 UTC,Pacific Time (US & Canada),research,https://www.inaturalist.org/observations/26427845,https://inaturalist-open-data.s3.amazonaws.com/photos/41037255/medium.jpeg,,1,0,FALSE,"Alameda County, CA, USA",37.62544139,-122.0282342,136,,,Alameda,water smartweed,Persicaria amphibia,water smartweed,Plantae,78450,Polygonaceae,Persicaria,Persicaria amphibia
29935613,7/11/19,2019-07-11 16:36:08 UTC,Pacific Time (US & Canada),research,https://www.inaturalist.org/observations/29935613,https://static.inaturalist.org/photos/46745991/medium.jpg,,2,0,FALSE,"Garin/Dry Creek Regional Park, Alameda County, US-CA, US",37.64697012,-122.0414199,30,,,Alameda,broad-leaved helleborine,Epipactis helleborine,Broad-leafed Helleborine,Plantae,50717,Orchidaceae,Epipactis,Epipactis helleborine
29056358,7/17/19,2019-07-17 19:09:53 UTC,Pacific Time (US & Canada),research,https://www.inaturalist.org/observations/29056358,https://static.inaturalist.org/photos/45330554/medium.jpg,,1,0,FALSE,"Dry Creek Pioneer Regional Park, Union City, CA, US",37.62432833,-122.0266583,30,,,Alameda,ruby chalice clarkia,Clarkia rubicunda,ruby chalice clarkia,Plantae,57148,Onagraceae,Clarkia,Clarkia rubicunda
29077645,7/17/19,2019-07-17 19:12:07 UTC,Pacific Time (US & Canada),research,https://www.inaturalist.org/observations/29077645,https://inaturalist-open-data.s3.amazonaws.com/photos/45365556/medium.jpg,,1,0,FALSE,"Garin Regional Park, Hayward, CA, US",37.63968152,-122.0306342,615,,,Alameda,ruby chalice clarkia,Clarkia rubicunda,ruby chalice clarkia,Plantae,57148,Onagraceae,Clarkia,Clarkia rubicunda
29406269,7/23/19,2019-07-23 16:52:40 UTC,Pacific Time (US & Canada),research,https://www.inaturalist.org/observations/29406269,https://static.inaturalist.org/photos/45892516/medium.jpg,,1,0,FALSE,"Garin Regional Park, Union City, CA, US",37.62982053,-122.028759,22,,,Alameda,sweet fennel,Foeniculum vulgare,fennel,Plantae,53052,Apiaceae,Foeniculum,Foeniculum vulgare
29406287,7/23/19,2019-07-23 16:53:11 UTC,Pacific Time (US & Canada),research,https://www.inaturalist.org/observations/29406287,https://static.inaturalist.org/photos/45892532/medium.jpg,,1,0,FALSE,"Garin Regional Park, Union City, CA, US",37.62981492,-122.028786,22,,,Alameda,wild radish,Raphanus sativus,wild radish,Plantae,55410,Brassicaceae,Raphanus,Raphanus sativus
29406295,7/23/19,2019-07-23 16:53:52 UTC,Pacific Time (US & Canada),research,https://www.inaturalist.org/observations/29406295,https://static.inaturalist.org/photos/45892553/medium.jpg,,1,0,FALSE,"Garin Regional Park, Union City, CA, US",37.62982508,-122.0284508,22,,,Alameda,California buckeye,Aesculus californica,California buckeye,Plantae,53348,Sapindaceae,Aesculus,Aesculus californica
29406312,7/23/19,2019-07-23 16:54:31 UTC,Pacific Time (US & Canada),research,https://www.inaturalist.org/observations/29406312,https://static.inaturalist.org/photos/45892577/medium.jpg,,1,0,FALSE,"Garin Regional Park, Union City, CA, US",37.62995322,-122.028418,22,,,Alameda,coyote brush,Baccharis pilularis,coyote brush,Plantae,53359,Asteraceae,Baccharis,Baccharis pilularis
29406318,7/23/19,2019-07-23 16:55:16 UTC,Pacific Time (US & Canada),research,https://www.inaturalist.org/observations/29406318,https://static.inaturalist.org/photos/45892594/medium.jpg,,1,0,FALSE,"Garin Regional Park, Union City, CA, US",37.62999828,-122.0282428,22,,,Alameda,California Wild Rose,Rosa californica,California Wild Rose,Plantae,53437,Rosaceae,Rosa,Rosa californica
29406329,7/23/19,2019-07-23 16:55:53 UTC,Pacific Time (US & Canada),research,https://www.inaturalist.org/observations/29406329,https://static.inaturalist.org/photos/45892613/medium.jpg,,1,0,FALSE,"Garin Regional Park, Union City, CA, US",37.63013479,-122.0283274,22,,,Alameda,harding grass,Phalaris aquatica,harding grass,Plantae,57188,Poaceae,Phalaris,Phalaris aquatica
29406341,7/23/19,2019-07-23 16:56:22 UTC,Pacific Time (US & Canada),research,https://www.inaturalist.org/observations/29406341,https://static.inaturalist.org/photos/45892633/medium.jpg,,1,0,FALSE,"Garin Regional Park, Union City, CA, US",37.63010787,-122.0281154,100,,,Alameda,western sycamore,Platanus racemosa,western sycamore,Plantae,58231,Platanaceae,Platanus,Platanus racemosa
29406373,7/23/19,2019-07-23 16:57:45 UTC,Pacific Time (US & Canada),research,https://www.inaturalist.org/observations/29406373,https://static.inaturalist.org/photos/45892686/medium.jpg,,2,0,FALSE,"Garin Regional Park, Union City, CA, US",37.63025806,-122.0281398,30,,,Alameda,stinging nettle,Urtica dioica,great stinging nettle,Plantae,51884,Urticaceae,Urtica,Urtica dioica
29406402,7/23/19,2019-07-23 16:58:15 UTC,Pacific Time (US & Canada),research,https://www.inaturalist.org/observations/29406402,https://static.inaturalist.org/photos/45892705/medium.jpg,,1,0,FALSE,"Garin Regional Park, Union City, CA, US",37.63023527,-122.0281968,22,,,Alameda,trailing blackberry,Rubus ursinus,trailing blackberry,Plantae,53445,Rosaceae,Rubus,Rubus ursinus
29406430,7/23/19,2019-07-23 17:00:14 UTC,Pacific Time (US & Canada),research,https://www.inaturalist.org/observations/29406430,https://static.inaturalist.org/photos/45892760/medium.jpg,,2,0,FALSE,"Garin Regional Park, Union City, CA, US",37.63054305,-122.0280133,22,,,Alameda,California bay,Umbellularia californica,California bay,Plantae,48807,Lauraceae,Umbellularia,Umbellularia californica
29406446,7/23/19,2019-07-23 17:01:19 UTC,Pacific Time (US & Canada),research,https://www.inaturalist.org/observations/29406446,https://static.inaturalist.org/photos/45892786/medium.jpg,,1,0,FALSE,"Garin Regional Park, Union City, CA, US",37.63072142,-122.0278284,22,,,Alameda,coast live oak,Quercus agrifolia,coast live oak,Plantae,47850,Fagaceae,Quercus,Quercus agrifolia
29406472,7/23/19,2019-07-23 17:02:41 UTC,Pacific Time (US & Canada),research,https://www.inaturalist.org/observations/29406472,https://static.inaturalist.org/photos/45892834/medium.jpg,,1,0,FALSE,"Garin Regional Park, Union City, CA, US",37.63102983,-122.0274668,22,,,Alameda,Pacific poison oak,Toxicodendron diversilobum,Pacific poison oak,Plantae,51080,Anacardiaceae,Toxicodendron,Toxicodendron diversilobum
29406500,7/23/19,2019-07-23 17:04:45 UTC,Pacific Time (US & Canada),research,https://www.inaturalist.org/observations/29406500,https://static.inaturalist.org/photos/45892873/medium.jpg,,2,0,FALSE,"Garin Regional Park, Hayward, CA, US",37.63151972,-122.0271552,22,,,Alameda,Common Snowberry,Symphoricarpos albus,Common Snowberry,Plantae,48523,Caprifoliaceae,Symphoricarpos,Symphoricarpos albus
29406514,7/23/19,2019-07-23 17:06:34 UTC,Pacific Time (US & Canada),research,https://www.inaturalist.org/observations/29406514,https://static.inaturalist.org/photos/45892894/medium.jpg,,3,1,FALSE,"Garin Regional Park, Hayward, CA, US",37.63245891,-122.0268995,10,,,Alameda,bristly oxtongue,Helminthotheca echioides,bristly oxtongue,Plantae,61906,Asteraceae,Helminthotheca,Helminthotheca echioides
29406569,7/23/19,2019-07-23 17:08:26 UTC,Pacific Time (US & Canada),research,https://www.inaturalist.org/observations/29406569,https://static.inaturalist.org/photos/45892954/medium.jpg,,1,0,FALSE,"Garin Regional Park, Union City, CA, US",37.63276803,-122.0268309,22,,,Alameda,Yellow Starthistle,Centaurea solstitialis,Yellow Star-Thistle,Plantae,52588,Asteraceae,Centaurea,Centaurea solstitialis
29406592,7/23/19,2019-07-23 17:09:26 UTC,Pacific Time (US & Canada),research,https://www.inaturalist.org/observations/29406592,https://static.inaturalist.org/photos/45892981/medium.jpg,,2,0,FALSE,"Garin Regional Park, Union City, CA, US",37.63288006,-122.0268092,22,,,Alameda,Hayfield Tarweed,Hemizonia congesta,Hayfield Tarweed,Plantae,56960,Asteraceae,Hemizonia,Hemizonia congesta
29406676,7/23/19,2019-07-23 17:19:37 UTC,Pacific Time (US & Canada),research,https://www.inaturalist.org/observations/29406676,https://static.inaturalist.org/photos/45893148/medium.jpg,,1,0,FALSE,"Garin Regional Park, Union City, CA, US",37.63267028,-122.0267481,22,,,Alameda,poison hemlock,Conium maculatum,poison hemlock,Plantae,52998,Apiaceae,Conium,Conium maculatum
29406719,7/23/19,2019-07-23 17:24:09 UTC,Pacific Time (US & Canada),research,https://www.inaturalist.org/observations/29406719,https://static.inaturalist.org/photos/45893190/medium.jpg,,1,0,FALSE,"Garin Regional Park, Union City, CA, US",37.63285797,-122.0263952,22,,,Alameda,seep monkeyflower,Erythranthe guttata,seep monkeyflower,Plantae,470643,Phrymaceae,Erythranthe,Erythranthe guttata
29406735,7/23/19,2019-07-23 17:33:29 UTC,Pacific Time (US & Canada),research,https://www.inaturalist.org/observations/29406735,https://static.inaturalist.org/photos/45893224/medium.jpg,,1,0,FALSE,"Garin Regional Park, Hayward, CA, US",37.63228348,-122.0269535,22,,,Alameda,Italian thistle,Carduus pycnocephalus,Italian thistle,Plantae,52990,Asteraceae,Carduus,Carduus pycnocephalus
29406745,7/23/19,2019-07-23 17:38:54 UTC,Pacific Time (US & Canada),research,https://www.inaturalist.org/observations/29406745,https://static.inaturalist.org/photos/45893253/medium.jpg,,2,0,FALSE,"Garin Regional Park, Union City, CA, US",37.63019475,-122.0282123,22,,,Alameda,lemon balm,Melissa officinalis,lemon balm,Plantae,59901,Lamiaceae,Melissa,Melissa officinalis
31090867,8/17/19,2019-08-18 00:15:43 UTC,Pacific Time (US & Canada),research,https://www.inaturalist.org/observations/31090867,https://inaturalist-open-data.s3.amazonaws.com/photos/48624862/medium.jpg,,1,0,FALSE,"Garin Regional Park, Union City, CA, US",37.6269076,-122.0281147,29,,,Alameda,Armenian Blackberry,Rubus armeniacus,Armenian Blackberry,Plantae,61317,Rosaceae,Rubus,Rubus armeniacus
31692454,8/28/19,2019-08-28 18:07:38 UTC,Pacific Time (US & Canada),research,https://www.inaturalist.org/observations/31692454,https://static.inaturalist.org/photos/49627546/medium.jpg,,2,0,FALSE,"Garin Regional Park, Union City, CA, US",37.63373833,-122.0261917,5,,,Alameda,narrowleaf milkweed,Asclepias fascicularis,narrowleaf milkweed,Plantae,56851,Apocynaceae,Asclepias,Asclepias fascicularis
31692529,8/28/19,2019-08-28 19:14:32 UTC,Pacific Time (US & Canada),research,https://www.inaturalist.org/observations/31692529,https://static.inaturalist.org/photos/49627692/medium.jpg,,2,0,FALSE,"Jordan Pond, Union City, CA, US",37.62498833,-122.0270833,10,,,Alameda,water smartweed,Persicaria amphibia,water smartweed,Plantae,78450,Polygonaceae,Persicaria,Persicaria amphibia
32673905,9/7/19,2019-09-07 21:33:10 UTC,Pacific Time (US & Canada),research,https://www.inaturalist.org/observations/32673905,https://inaturalist-open-data.s3.amazonaws.com/photos/51264636/medium.jpg,,2,0,FALSE,"Dry Creek Pioneer Regional Park, Union City, CA, US",37.62847833,-122.0252222,5,,,Alameda,Hayfield Tarweed,Hemizonia congesta,Hayfield Tarweed,Plantae,56960,Asteraceae,Hemizonia,Hemizonia congesta
33911869,10/5/19,2019-10-05 17:48:26 UTC,Pacific Time (US & Canada),research,https://www.inaturalist.org/observations/33911869,https://inaturalist-open-data.s3.amazonaws.com/photos/53312707/medium.jpg,,1,0,FALSE,"Garin Regional Park, Hayward, CA, US",37.64582833,-122.0431583,64,,,Alameda,California fuchsia,Epilobium canum,California fuchsia,Plantae,53051,Onagraceae,Epilobium,Epilobium canum
33914113,10/5/19,2019-10-05 17:05:00 UTC,Pacific Time (US & Canada),research,https://www.inaturalist.org/observations/33914113,https://inaturalist-open-data.s3.amazonaws.com/photos/53316206/medium.jpg,,1,0,FALSE,"Garin Regional Park, Hayward, CA, US",37.64706167,-122.0394445,48,,,Alameda,Common Snowberry,Symphoricarpos albus,Common Snowberry,Plantae,48523,Caprifoliaceae,Symphoricarpos,Symphoricarpos albus
33936691,10/5/19,2019-10-05 17:08:51 UTC,Pacific Time (US & Canada),research,https://www.inaturalist.org/observations/33936691,https://inaturalist-open-data.s3.amazonaws.com/photos/53356265/medium.jpg,,1,0,FALSE,"Garin Regional Park, Hayward, CA, US",37.64698833,-122.0416028,48,,,Alameda,Pacific poison oak,Toxicodendron diversilobum,Pacific poison oak,Plantae,51080,Anacardiaceae,Toxicodendron,Toxicodendron diversilobum
33936723,10/5/19,2019-10-05 17:09:13 UTC,Pacific Time (US & Canada),research,https://www.inaturalist.org/observations/33936723,https://inaturalist-open-data.s3.amazonaws.com/photos/53356332/medium.jpg,,1,0,FALSE,"Garin Regional Park, Hayward, CA, US",37.64692167,-122.0417472,48,,,Alameda,bigleaf maple,Acer macrophyllum,bigleaf maple,Plantae,48227,Sapindaceae,Acer,Acer macrophyllum
33936728,10/5/19,2019-10-05 17:09:19 UTC,Pacific Time (US & Canada),research,https://www.inaturalist.org/observations/33936728,https://inaturalist-open-data.s3.amazonaws.com/photos/53356353/medium.jpg,,1,0,FALSE,"Garin Regional Park, Hayward, CA, US",37.64685833,-122.0417638,12,,,Alameda,Cotoneaster pannosus,Cotoneaster pannosus,silverleaf cotoneaster,Plantae,53375,Rosaceae,Cotoneaster,Cotoneaster pannosus
33936749,10/5/19,2019-10-05 17:09:34 UTC,Pacific Time (US & Canada),research,https://www.inaturalist.org/observations/33936749,https://inaturalist-open-data.s3.amazonaws.com/photos/53356391/medium.jpg,,1,0,FALSE,"Garin Regional Park, Hayward, CA, US",37.64692167,-122.0418083,8,,,Alameda,Toyon,Heteromeles arbutifolia,Toyon,Plantae,53405,Rosaceae,Heteromeles,Heteromeles arbutifolia
33936791,10/5/19,2019-10-05 17:09:47 UTC,Pacific Time (US & Canada),research,https://www.inaturalist.org/observations/33936791,https://inaturalist-open-data.s3.amazonaws.com/photos/53356457/medium.jpg,,1,0,FALSE,"Garin Regional Park, Hayward, CA, US",37.64695333,-122.0418333,8,,,Alameda,Baldhip Rose,Rosa gymnocarpa,Baldhip Rose,Plantae,53441,Rosaceae,Rosa,Rosa gymnocarpa
33936873,10/5/19,2019-10-05 17:12:47 UTC,Pacific Time (US & Canada),research,https://www.inaturalist.org/observations/33936873,https://inaturalist-open-data.s3.amazonaws.com/photos/53356586/medium.jpg,,1,0,FALSE,"Garin Regional Park, Hayward, CA, US",37.64712167,-122.0424195,24,,,Alameda,Hooker's fairybells,Prosartes hookeri,Hooker's fairybells,Plantae,51071,Liliaceae,Prosartes,Prosartes hookeri
33936978,10/5/19,2019-10-05 17:15:08 UTC,Pacific Time (US & Canada),research,https://www.inaturalist.org/observations/33936978,https://inaturalist-open-data.s3.amazonaws.com/photos/53356704/medium.jpg,,2,0,FALSE,"Garin Regional Park, Hayward, CA, US",37.64689167,-122.0427028,8,,,Alameda,yerba buena,Clinopodium douglasii,yerba buena,Plantae,53203,Lamiaceae,Clinopodium,Clinopodium douglasii
33936997,10/5/19,2019-10-05 17:30:29 UTC,Pacific Time (US & Canada),research,https://www.inaturalist.org/observations/33936997,https://inaturalist-open-data.s3.amazonaws.com/photos/53356745/medium.jpg,,1,0,FALSE,"Garin Regional Park, Hayward, CA, US",37.64694667,-122.0426112,24,,,Alameda,beaked hazelnut,Corylus cornuta,beaked hazelnut,Plantae,53374,Betulaceae,Corylus,Corylus cornuta
33937035,10/5/19,2019-10-05 17:33:30 UTC,Pacific Time (US & Canada),research,https://www.inaturalist.org/observations/33937035,https://inaturalist-open-data.s3.amazonaws.com/photos/53356878/medium.jpg,,1,0,FALSE,"Garin Regional Park, Hayward, CA, US",37.6469,-122.0433195,8,,,Alameda,crevice alumroot,Heuchera micrantha,crevice alumroot,Plantae,51274,Saxifragaceae,Heuchera,Heuchera micrantha
33937053,10/5/19,2019-10-05 17:35:44 UTC,Pacific Time (US & Canada),research,https://www.inaturalist.org/observations/33937053,https://inaturalist-open-data.s3.amazonaws.com/photos/53356891/medium.jpg,,1,0,FALSE,"Garin Regional Park, Hayward, CA, US",37.64684167,-122.0439833,32,,,Alameda,Common Snowberry,Symphoricarpos albus,Common Snowberry,Plantae,48523,Caprifoliaceae,Symphoricarpos,Symphoricarpos albus
33937060,10/5/19,2019-10-05 17:36:02 UTC,Pacific Time (US & Canada),research,https://www.inaturalist.org/observations/33937060,https://inaturalist-open-data.s3.amazonaws.com/photos/53356899/medium.jpg,,1,0,FALSE,"Garin Regional Park, Hayward, CA, US",37.64681667,-122.0440667,104,,,Alameda,California mugwort,Artemisia douglasiana,California mugwort,Plantae,52854,Asteraceae,Artemisia,Artemisia douglasiana
33937081,10/5/19,2019-10-05 17:48:35 UTC,Pacific Time (US & Canada),research,https://www.inaturalist.org/observations/33937081,https://inaturalist-open-data.s3.amazonaws.com/photos/53356982/medium.jpg,,1,0,FALSE,"Garin Regional Park, Hayward, CA, US",37.645775,-122.0432972,8,,,Alameda,Naked Buckwheat,Eriogonum nudum,Naked Buckwheat,Plantae,53046,Polygonaceae,Eriogonum,Eriogonum nudum
33937094,10/5/19,2019-10-05 17:58:16 UTC,Pacific Time (US & Canada),research,https://www.inaturalist.org/observations/33937094,https://inaturalist-open-data.s3.amazonaws.com/photos/53357010/medium.jpg,,0,0,FALSE,"Garin Regional Park, Hayward, CA, US",37.645795,-122.043075,16,,,Alameda,coffeeberry,Frangula californica californica,California Coffeeberry,Plantae,53429,Rhamnaceae,Frangula,Frangula californica
33937111,10/5/19,2019-10-05 17:58:26 UTC,Pacific Time (US & Canada),research,https://www.inaturalist.org/observations/33937111,https://inaturalist-open-data.s3.amazonaws.com/photos/53357049/medium.jpg,,1,0,FALSE,"Garin Regional Park, Hayward, CA, US",37.64582,-122.0430612,8,,,Alameda,orange bush monkeyflower,Diplacus aurantiacus,orange bush monkeyflower,Plantae,777371,Phrymaceae,Diplacus,Diplacus aurantiacus
33937120,10/5/19,2019-10-05 18:07:16 UTC,Pacific Time (US & Canada),research,https://www.inaturalist.org/observations/33937120,https://inaturalist-open-data.s3.amazonaws.com/photos/53357073/medium.jpg,,1,0,FALSE,"Garin Regional Park, Hayward, CA, US",37.64572167,-122.0428917,48,,,Alameda,Ocean spray,Holodiscus discolor,Ocean spray,Plantae,53414,Rosaceae,Holodiscus,Holodiscus discolor
33937132,10/5/19,2019-10-05 18:12:24 UTC,Pacific Time (US & Canada),research,https://www.inaturalist.org/observations/33937132,https://inaturalist-open-data.s3.amazonaws.com/photos/53357084/medium.jpg,,2,0,FALSE,"Garin Regional Park, Hayward, CA, US",37.646105,-122.0429833,32,,,Alameda,Toyon,Heteromeles arbutifolia,Toyon,Plantae,53405,Rosaceae,Heteromeles,Heteromeles arbutifolia
33937136,10/5/19,2019-10-05 18:13:23 UTC,Pacific Time (US & Canada),research,https://www.inaturalist.org/observations/33937136,https://inaturalist-open-data.s3.amazonaws.com/photos/53357110/medium.jpg,,1,0,FALSE,"Garin Regional Park, Hayward, CA, US",37.64601167,-122.0430138,16,,,Alameda,Coast silk tassel,Garrya elliptica,Coast silk tassel,Plantae,53399,Garryaceae,Garrya,Garrya elliptica
33937143,10/5/19,2019-10-05 18:14:21 UTC,Pacific Time (US & Canada),research,https://www.inaturalist.org/observations/33937143,https://inaturalist-open-data.s3.amazonaws.com/photos/53357127/medium.jpg,,2,0,FALSE,"Garin Regional Park, Hayward, CA, US",37.646075,-122.0429528,64,,,Alameda,yerba buena,Clinopodium douglasii,yerba buena,Plantae,53203,Lamiaceae,Clinopodium,Clinopodium douglasii
33937147,10/5/19,2019-10-05 18:16:57 UTC,Pacific Time (US & Canada),research,https://www.inaturalist.org/observations/33937147,https://inaturalist-open-data.s3.amazonaws.com/photos/53357136/medium.jpg,,1,0,FALSE,"Garin Regional Park, Hayward, CA, US",37.64595333,-122.0431583,16,,,Alameda,California sagebrush,Artemisia californica,California sagebrush,Plantae,53357,Asteraceae,Artemisia,Artemisia californica
33937151,10/5/19,2019-10-05 18:17:02 UTC,Pacific Time (US & Canada),research,https://www.inaturalist.org/observations/33937151,https://inaturalist-open-data.s3.amazonaws.com/photos/53357141/medium.jpg,,1,0,FALSE,"Garin Regional Park, Hayward, CA, US",37.64595833,-122.0431667,16,,,Alameda,orange bush monkeyflower,Diplacus aurantiacus,orange bush monkeyflower,Plantae,777371,Phrymaceae,Diplacus,Diplacus aurantiacus
33937153,10/5/19,2019-10-05 18:17:07 UTC,Pacific Time (US & Canada),research,https://www.inaturalist.org/observations/33937153,https://inaturalist-open-data.s3.amazonaws.com/photos/53357146/medium.jpg,,1,0,FALSE,"Garin Regional Park, Hayward, CA, US",37.64596167,-122.043175,16,,,Alameda,common yarrow,Achillea millefolium,common yarrow,Plantae,52821,Asteraceae,Achillea,Achillea millefolium
33937161,10/5/19,2019-10-05 18:18:33 UTC,Pacific Time (US & Canada),research,https://www.inaturalist.org/observations/33937161,https://inaturalist-open-data.s3.amazonaws.com/photos/53357151/medium.jpg,,1,0,FALSE,"Garin Regional Park, Hayward, CA, US",37.645895,-122.0430612,6,,,Alameda,coyote brush,Baccharis pilularis,coyote brush,Plantae,53359,Asteraceae,Baccharis,Baccharis pilularis
36460055,12/7/19,2019-12-07 21:53:06 UTC,Pacific Time (US & Canada),research,https://www.inaturalist.org/observations/36460055,https://inaturalist-open-data.s3.amazonaws.com/photos/57635706/medium.jpg,,1,0,FALSE,"Garin Regional Park, Hayward, CA, US",37.64086167,-122.0320583,,,,Alameda,Hayfield Tarweed,Hemizonia congesta,Hayfield Tarweed,Plantae,56960,Asteraceae,Hemizonia,Hemizonia congesta
36460348,12/7/19,2019-12-07 23:42:42 UTC,Pacific Time (US & Canada),research,https://www.inaturalist.org/observations/36460348,https://inaturalist-open-data.s3.amazonaws.com/photos/57636216/medium.jpg,,2,0,FALSE,"Garin Regional Park, Union City, CA, US",37.63652833,-122.0242388,,,,Alameda,western sycamore,Platanus racemosa,western sycamore,Plantae,58231,Platanaceae,Platanus,Platanus racemosa
36460378,12/7/19,2019-12-08 00:14:37 UTC,Pacific Time (US & Canada),research,https://www.inaturalist.org/observations/36460378,https://inaturalist-open-data.s3.amazonaws.com/photos/57636295/medium.jpg,,2,0,FALSE,"Garin Regional Park, Hayward, CA, US",37.64647,-122.0356445,,,Hayward,Alameda,California buckwheat,Eriogonum fasciculatum,California Buckwheat,Plantae,54999,Polygonaceae,Eriogonum,Eriogonum fasciculatum
36590099,12/11/19,2019-12-11 21:42:34 UTC,Hawaii,research,https://www.inaturalist.org/observations/36590099,https://inaturalist-open-data.s3.amazonaws.com/photos/57858657/medium.jpeg,,1,0,FALSE,"Hayward Highland, Hayward, CA, USA",37.64677518,-122.0362267,55,,Hayward,Alameda,California buckwheat,Eriogonum fasciculatum,California Buckwheat,Plantae,54999,Polygonaceae,Eriogonum,Eriogonum fasciculatum
36590258,12/11/19,2019-12-11 21:09:54 UTC,Hawaii,research,https://www.inaturalist.org/observations/36590258,https://inaturalist-open-data.s3.amazonaws.com/photos/57858921/medium.jpeg,,2,0,FALSE,"Hayward Highland, Hayward, CA, USA",37.64638901,-122.0377808,,,Hayward,Alameda,broad-leaved helleborine,Epipactis helleborine,Broad-leafed Helleborine,Plantae,50717,Orchidaceae,Epipactis,Epipactis helleborine
36747169,12/16/19,2019-12-16 22:46:00 UTC,Pacific Time (US & Canada),research,https://www.inaturalist.org/observations/36747169,https://static.inaturalist.org/photos/58137778/medium.jpg,,1,0,FALSE,"Alameda County, CA, USA",37.63556714,-122.0312884,106,,,Alameda,Hayfield Tarweed,Hemizonia congesta,Hayfield Tarweed,Plantae,56960,Asteraceae,Hemizonia,Hemizonia congesta
37439755,1/9/20,2020-01-09 14:16:28 UTC,UTC,research,https://www.inaturalist.org/observations/37439755,https://static.inaturalist.org/photos/59352678/medium.jpg,,1,0,FALSE,"Garin Regional Park, Hayward, CA, US",37.64673667,-122.0363833,5,,Hayward,Alameda,California buckwheat,Eriogonum fasciculatum,California Buckwheat,Plantae,54999,Polygonaceae,Eriogonum,Eriogonum fasciculatum
37506346,1/11/20,2020-01-11 19:54:53 UTC,Pacific Time (US & Canada),research,https://www.inaturalist.org/observations/37506346,https://inaturalist-open-data.s3.amazonaws.com/photos/59469960/medium.jpg,,2,0,FALSE,"Garin Regional Park, Hayward, CA, US",37.646625,-122.0398862,12,,,Alameda,yerba buena,Clinopodium douglasii,yerba buena,Plantae,53203,Lamiaceae,Clinopodium,Clinopodium douglasii
37506358,1/11/20,2020-01-11 20:02:29 UTC,Pacific Time (US & Canada),research,https://www.inaturalist.org/observations/37506358,https://inaturalist-open-data.s3.amazonaws.com/photos/59469980/medium.jpg,,1,0,FALSE,"Garin Regional Park, Hayward, CA, US",37.6465,-122.0435333,16,,,Alameda,wavy-leafed soap plant,Chlorogalum pomeridianum,wavy-leafed soap plant,Plantae,47597,Asparagaceae,Chlorogalum,Chlorogalum pomeridianum
37506377,1/11/20,2020-01-11 20:04:06 UTC,Pacific Time (US & Canada),research,https://www.inaturalist.org/observations/37506377,https://inaturalist-open-data.s3.amazonaws.com/photos/59470015/medium.jpg,,1,0,FALSE,"Garin Regional Park, Hayward, CA, US",37.64639667,-122.0425945,8,,,Alameda,common yarrow,Achillea millefolium,common yarrow,Plantae,52821,Asteraceae,Achillea,Achillea millefolium
37506434,1/11/20,2020-01-11 20:12:30 UTC,Pacific Time (US & Canada),research,https://www.inaturalist.org/observations/37506434,https://inaturalist-open-data.s3.amazonaws.com/photos/59470120/medium.jpg,,0,0,FALSE,"Garin Regional Park, Hayward, CA, US",37.64448833,-122.0385972,8,,,Alameda,hillside gooseberry,Ribes californicum,hillside gooseberry,Plantae,47129,Grossulariaceae,Ribes,Ribes californicum
38350691,2/1/20,2020-02-01 16:25:04 UTC,UTC,research,https://www.inaturalist.org/observations/38350691,https://static.inaturalist.org/photos/60938142/medium.jpg,,0,0,FALSE,"Garin Regional Park, Union City, CA, US",37.62746333,-122.0278778,10,,,Alameda,Prostrate Capeweed,Arctotheca prostrata,Prostrate Capeweed,Plantae,75549,Asteraceae,Arctotheca,Arctotheca prostrata
38722744,2/16/20,2020-02-16 12:15:12 UTC,UTC,research,https://www.inaturalist.org/observations/38722744,https://static.inaturalist.org/photos/138992707/medium.jpg,,2,0,FALSE,"Garin Regional Park, Union City, CA, US",37.6300251,-122.0284163,5,,,Alameda,coyote brush,Baccharis pilularis,coyote brush,Plantae,53359,Asteraceae,Baccharis,Baccharis pilularis
39421364,2/24/20,2020-02-24 23:14:47 UTC,Pacific Time (US & Canada),research,https://www.inaturalist.org/observations/39421364,https://static.inaturalist.org/photos/62540810/medium.jpg,,0,0,FALSE,"Garin Regional Park, Hayward, CA, US",37.62495,-122.0295862,32,,,Alameda,California poppy,Eschscholzia californica,California poppy,Plantae,48225,Papaveraceae,Eschscholzia,Eschscholzia californica
39421398,2/24/20,2020-02-24 23:32:52 UTC,Pacific Time (US & Canada),research,https://www.inaturalist.org/observations/39421398,https://static.inaturalist.org/photos/62540855/medium.jpg,,0,0,FALSE,"Garin Regional Park, Hayward, CA, US",37.62559167,-122.0297555,6,,,Alameda,wild radish,Raphanus sativus,wild radish,Plantae,55410,Brassicaceae,Raphanus,Raphanus sativus
39421431,2/24/20,2020-02-24 22:43:52 UTC,Pacific Time (US & Canada),research,https://www.inaturalist.org/observations/39421431,https://static.inaturalist.org/photos/62540976/medium.jpg,,1,0,FALSE,"Garin Regional Park, Union City, CA, US",37.62486333,-122.0283055,,,,Alameda,California bay,Umbellularia californica,California bay,Plantae,48807,Lauraceae,Umbellularia,Umbellularia californica
39421480,2/24/20,2020-02-24 21:39:13 UTC,Pacific Time (US & Canada),research,https://www.inaturalist.org/observations/39421480,https://static.inaturalist.org/photos/62541069/medium.jpg,,1,0,FALSE,"Garin Regional Park, Union City, CA, US",37.62798,-122.0282667,12,,,Alameda,Cherry-plum,Prunus cerasifera,Cherry-plum,Plantae,55837,Rosaceae,Prunus,Prunus cerasifera
40551906,3/3/20,,UTC,research,https://www.inaturalist.org/observations/40551906,https://static.inaturalist.org/photos/64267198/medium.jpg,"along the Garin Woods Upper Trail near Ziele Creek, Garin Regional Park",2,0,FALSE,"Mission - Garin, Hayward, CA, USA",37.64661667,-122.0433861,,,,Alameda,Warrior's Plume,Pedicularis densiflora,Warrior's Plume,Plantae,49645,Orobanchaceae,Pedicularis,Pedicularis densiflora
39686765,3/7/20,2020-03-08 00:48:46 UTC,Pacific Time (US & Canada),research,https://www.inaturalist.org/observations/39686765,https://inaturalist-open-data.s3.amazonaws.com/photos/62987474/medium.jpeg,,3,0,FALSE,"Garin/Dry Creek Regional Park, Alameda County, US-CA, US",37.6429189,-122.0302655,9,,Hayward,Alameda,star-flowered lily-of-the-valley,Maianthemum stellatum,star-flowered lily-of-the-valley,Plantae,53268,Asparagaceae,Maianthemum,Maianthemum stellatum
39686770,3/7/20,2020-03-08 00:49:19 UTC,Pacific Time (US & Canada),research,https://www.inaturalist.org/observations/39686770,https://inaturalist-open-data.s3.amazonaws.com/photos/62987487/medium.jpeg,,1,0,FALSE,"Garin/Dry Creek Regional Park, Alameda County, US-CA, US",37.64286352,-122.0301997,3,,Hayward,Alameda,giant wakerobin,Trillium chloropetalum,giant wakerobin,Plantae,50823,Melanthiaceae,Trillium,Trillium chloropetalum
39855654,3/11/20,2020-03-11 21:32:47 UTC,Pacific Time (US & Canada),research,https://www.inaturalist.org/observations/39855654,https://inaturalist-open-data.s3.amazonaws.com/photos/63275890/medium.jpg,,1,0,FALSE,"Garin Regional Park, Hayward, CA, US",37.63963503,-122.0101554,10,,Hayward,Alameda,California sagebrush,Artemisia californica,California sagebrush,Plantae,53357,Asteraceae,Artemisia,Artemisia californica
40821493,3/26/20,2020-03-26 22:31:19 UTC,Pacific Time (US & Canada),research,https://www.inaturalist.org/observations/40821493,https://static.inaturalist.org/photos/64714125/medium.jpg,,1,0,FALSE,"Garin Regional Park, Hayward, CA, US",37.639645,-122.0104139,4,,Hayward,Alameda,Purple Sanicle,Sanicula bipinnatifida,Purple Sanicle,Plantae,56840,Apiaceae,Sanicula,Sanicula bipinnatifida
41214249,3/26/20,2020-03-26 22:57:02 UTC,Pacific Time (US & Canada),research,https://www.inaturalist.org/observations/41214249,https://inaturalist-open-data.s3.amazonaws.com/photos/65361670/medium.jpg,,2,0,FALSE,"Garin Regional Park, Hayward, CA, US",37.64607,-122.0337222,8,,Hayward,Alameda,giant wakerobin,Trillium chloropetalum,giant wakerobin,Plantae,50823,Melanthiaceae,Trillium,Trillium chloropetalum
42294540,3/29/20,2020-03-29 18:26:00 UTC,Pacific Time (US & Canada),research,https://www.inaturalist.org/observations/42294540,https://inaturalist-open-data.s3.amazonaws.com/photos/67144808/medium.jpeg,,1,0,FALSE,"Garin/Dry Creek Regional Park, Alameda, California, United States",37.64583611,-122.0347583,16,,Hayward,Alameda,California buckeye,Aesculus californica,California buckeye,Plantae,53348,Sapindaceae,Aesculus,Aesculus californica
42294546,3/29/20,2020-03-29 18:29:00 UTC,Pacific Time (US & Canada),research,https://www.inaturalist.org/observations/42294546,https://inaturalist-open-data.s3.amazonaws.com/photos/67144913/medium.jpeg,,1,0,FALSE,"Garin/Dry Creek Regional Park, Alameda, California, United States",37.64595833,-122.0357806,5,,Hayward,Alameda,milkmaids,Cardamine californica,milkmaids,Plantae,49651,Brassicaceae,Cardamine,Cardamine californica
42294554,3/29/20,2020-03-29 18:38:00 UTC,Pacific Time (US & Canada),research,https://www.inaturalist.org/observations/42294554,https://inaturalist-open-data.s3.amazonaws.com/photos/67144967/medium.jpeg,,1,0,FALSE,"Hayward Highland, Hayward, CA, USA",37.64678056,-122.0385278,91,,Hayward,Alameda,beaked hazelnut,Corylus cornuta,beaked hazelnut,Plantae,53374,Betulaceae,Corylus,Corylus cornuta
42294555,3/29/20,2020-03-29 18:38:00 UTC,Pacific Time (US & Canada),research,https://www.inaturalist.org/observations/42294555,https://inaturalist-open-data.s3.amazonaws.com/photos/67144974/medium.jpeg,,1,0,FALSE,"Garin/Dry Creek Regional Park, Alameda, California, United States",37.64679722,-122.0393972,16,,,Alameda,false Solomon's seal,Maianthemum racemosum,Solomon's plume,Plantae,51062,Asparagaceae,Maianthemum,Maianthemum racemosum
42294558,3/29/20,2020-03-29 18:45:00 UTC,Pacific Time (US & Canada),research,https://www.inaturalist.org/observations/42294558,https://inaturalist-open-data.s3.amazonaws.com/photos/67145015/medium.jpeg,,1,0,FALSE,"Mission - Garin, Hayward, CA, USA",37.64661389,-122.0423361,65,,,Alameda,Hooker's fairybells,Prosartes hookeri,Hooker's fairybells,Plantae,51071,Liliaceae,Prosartes,Prosartes hookeri
42294561,3/29/20,2020-03-29 19:47:00 UTC,Pacific Time (US & Canada),research,https://www.inaturalist.org/observations/42294561,https://inaturalist-open-data.s3.amazonaws.com/photos/67145051/medium.jpeg,,1,0,FALSE,"Mission - Garin, Hayward, CA, USA",37.64537778,-122.0425806,4,,,Alameda,orange bush monkeyflower,Diplacus aurantiacus,orange bush monkeyflower,Plantae,777371,Phrymaceae,Diplacus,Diplacus aurantiacus
42294568,3/29/20,2020-03-29 18:56:00 UTC,Pacific Time (US & Canada),research,https://www.inaturalist.org/observations/42294568,https://inaturalist-open-data.s3.amazonaws.com/photos/67145108/medium.jpeg,,1,0,FALSE,"Garin/Dry Creek Regional Park, Alameda, California, United States",37.64711667,-122.0427861,45,,,Alameda,sticky cinquefoil,Drymocallis glandulosa,sticky cinquefoil,Plantae,76716,Rosaceae,Drymocallis,Drymocallis glandulosa
42294578,3/29/20,2020-03-29 19:01:00 UTC,Pacific Time (US & Canada),research,https://www.inaturalist.org/observations/42294578,https://inaturalist-open-data.s3.amazonaws.com/photos/67145203/medium.jpeg,,1,0,FALSE,"Garin/Dry Creek Regional Park, Alameda, California, United States",37.64631944,-122.042275,16,,,Alameda,Pacific pea,Lathyrus vestitus,Pacific pea,Plantae,50320,Fabaceae,Lathyrus,Lathyrus vestitus
42294582,3/29/20,2020-03-29 19:04:00 UTC,Pacific Time (US & Canada),research,https://www.inaturalist.org/observations/42294582,https://inaturalist-open-data.s3.amazonaws.com/photos/67145221/medium.jpeg,,1,0,FALSE,"Mission - Garin, Hayward, CA, USA",37.64621667,-122.0420528,16,,,Alameda,western columbine,Aquilegia formosa,western columbine,Plantae,48244,Ranunculaceae,Aquilegia,Aquilegia formosa
42294585,3/29/20,2020-03-29 19:05:00 UTC,Pacific Time (US & Canada),research,https://www.inaturalist.org/observations/42294585,https://inaturalist-open-data.s3.amazonaws.com/photos/67145241/medium.jpeg,,1,0,FALSE,"Mission - Garin, Hayward, CA, USA",37.64623889,-122.0419778,6,,,Alameda,milkmaids,Cardamine californica,milkmaids,Plantae,49651,Brassicaceae,Cardamine,Cardamine californica
42294586,3/29/20,2020-03-29 19:05:00 UTC,Pacific Time (US & Canada),research,https://www.inaturalist.org/observations/42294586,https://inaturalist-open-data.s3.amazonaws.com/photos/67145274/medium.jpeg,,2,0,FALSE,"Garin/Dry Creek Regional Park, Alameda, California, United States",37.64626389,-122.0419389,22,,,Alameda,forest scurfpea,Rupertia physodes,forest scurfpea,Plantae,53198,Fabaceae,Rupertia,Rupertia physodes
42294608,3/29/20,2020-03-29 19:13:00 UTC,Pacific Time (US & Canada),research,https://www.inaturalist.org/observations/42294608,https://inaturalist-open-data.s3.amazonaws.com/photos/67145465/medium.jpeg,,1,0,FALSE,"Garin/Dry Creek Regional Park, Alameda, California, United States",37.64656389,-122.0394444,65,,,Alameda,milkmaids,Cardamine californica,milkmaids,Plantae,49651,Brassicaceae,Cardamine,Cardamine californica
42294609,3/29/20,2020-03-29 19:13:00 UTC,Pacific Time (US & Canada),research,https://www.inaturalist.org/observations/42294609,https://inaturalist-open-data.s3.amazonaws.com/photos/67145468/medium.jpeg,,1,0,FALSE,"Hayward Highland, Hayward, CA, USA",37.64741111,-122.0393,40,,Hayward,Alameda,Pacific Sanicle,Sanicula crassicaulis,Pacific Sanicle,Plantae,53201,Apiaceae,Sanicula,Sanicula crassicaulis
42294626,3/29/20,2020-03-29 19:34:00 UTC,Pacific Time (US & Canada),research,https://www.inaturalist.org/observations/42294626,https://inaturalist-open-data.s3.amazonaws.com/photos/67145535/medium.jpeg,,1,0,FALSE,"Garin/Dry Creek Regional Park, Alameda, California, United States",37.64523611,-122.0412,5,,,Alameda,coast live oak,Quercus agrifolia,coast live oak,Plantae,47850,Fagaceae,Quercus,Quercus agrifolia
42294630,3/29/20,2020-03-29 19:35:00 UTC,Pacific Time (US & Canada),research,https://www.inaturalist.org/observations/42294630,https://inaturalist-open-data.s3.amazonaws.com/photos/67145558/medium.jpeg,,1,0,FALSE,"Garin/Dry Creek Regional Park, Alameda, California, United States",37.64541667,-122.0406194,50,,,Alameda,miner's lettuce,Claytonia perfoliata,miner's lettuce,Plantae,52994,Montiaceae,Claytonia,Claytonia perfoliata
42294637,3/29/20,2020-03-29 19:45:00 UTC,Pacific Time (US & Canada),research,https://www.inaturalist.org/observations/42294637,https://inaturalist-open-data.s3.amazonaws.com/photos/67145666/medium.jpeg,,1,0,FALSE,"Mission - Garin, Hayward, CA, USA",37.64553333,-122.0426778,5,,,Alameda,graceful bedstraw,Galium porrigens,graceful bedstraw,Plantae,53063,Rubiaceae,Galium,Galium porrigens
42294639,3/29/20,2020-03-29 19:46:00 UTC,Pacific Time (US & Canada),research,https://www.inaturalist.org/observations/42294639,https://inaturalist-open-data.s3.amazonaws.com/photos/67145687/medium.jpeg,,1,0,FALSE,"Garin/Dry Creek Regional Park, Alameda, California, United States",37.64541944,-122.042625,5,,,Alameda,Redberry Buckthorn,Rhamnus crocea,Redberry Buckthorn,Plantae,57243,Rhamnaceae,Rhamnus,Rhamnus crocea
42294640,3/29/20,2020-03-29 19:46:00 UTC,Pacific Time (US & Canada),research,https://www.inaturalist.org/observations/42294640,https://inaturalist-open-data.s3.amazonaws.com/photos/67145707/medium.jpeg,,1,0,FALSE,"Garin/Dry Creek Regional Park, Alameda, California, United States",37.64540556,-122.0426333,5,,,Alameda,wavy-leafed soap plant,Chlorogalum pomeridianum,wavy-leafed soap plant,Plantae,47597,Asparagaceae,Chlorogalum,Chlorogalum pomeridianum
42294641,3/29/20,2020-03-29 19:47:00 UTC,Pacific Time (US & Canada),research,https://www.inaturalist.org/observations/42294641,https://inaturalist-open-data.s3.amazonaws.com/photos/67145711/medium.jpeg,,1,0,FALSE,"Garin/Dry Creek Regional Park, Alameda, California, United States",37.6454,-122.0426167,4,,,Alameda,Coyote Mint,Monardella villosa,Coyote Mint,Plantae,52181,Lamiaceae,Monardella,Monardella villosa
42294644,3/29/20,2020-03-29 20:48:00 UTC,Pacific Time (US & Canada),research,https://www.inaturalist.org/observations/42294644,https://inaturalist-open-data.s3.amazonaws.com/photos/67145740/medium.jpeg,,1,0,FALSE,"Garin/Dry Creek Regional Park, Alameda, California, United States",37.647175,-122.0378028,25,,Hayward,Alameda,coast live oak,Quercus agrifolia,coast live oak,Plantae,47850,Fagaceae,Quercus,Quercus agrifolia
42294647,3/29/20,2020-03-29 20:50:00 UTC,Pacific Time (US & Canada),research,https://www.inaturalist.org/observations/42294647,https://inaturalist-open-data.s3.amazonaws.com/photos/67145770/medium.jpeg,,1,0,FALSE,"Hayward Highland, Hayward, CA, USA",37.64698333,-122.0372,10,,Hayward,Alameda,sugar bush,Rhus ovata,sugar bush,Plantae,64121,Anacardiaceae,Rhus,Rhus ovata
42294648,3/29/20,2020-03-29 20:51:00 UTC,Pacific Time (US & Canada),research,https://www.inaturalist.org/observations/42294648,https://inaturalist-open-data.s3.amazonaws.com/photos/67145780/medium.jpeg,,1,0,FALSE,"Garin/Dry Creek Regional Park, Alameda, California, United States",37.64693056,-122.0367972,20,,Hayward,Alameda,purple needlegrass,Nassella pulchra,purple needlegrass,Plantae,165659,Poaceae,Nassella,Nassella pulchra
42294650,3/29/20,2020-03-29 19:48:00 UTC,Pacific Time (US & Canada),research,https://www.inaturalist.org/observations/42294650,https://inaturalist-open-data.s3.amazonaws.com/photos/67145811/medium.jpeg,,1,0,FALSE,"Garin/Dry Creek Regional Park, Alameda, California, United States",37.64540556,-122.0425333,57,,,Alameda,coast live oak,Quercus agrifolia,coast live oak,Plantae,47850,Fagaceae,Quercus,Quercus agrifolia
42294652,3/29/20,2020-03-29 19:50:00 UTC,Pacific Time (US & Canada),research,https://www.inaturalist.org/observations/42294652,https://inaturalist-open-data.s3.amazonaws.com/photos/67145843/medium.jpeg,,1,0,FALSE,"Mission - Garin, Hayward, CA, USA",37.64513333,-122.042275,22,,,Alameda,Naked Buckwheat,Eriogonum nudum,Naked Buckwheat,Plantae,53046,Polygonaceae,Eriogonum,Eriogonum nudum
42294653,3/29/20,2020-03-29 19:50:00 UTC,Pacific Time (US & Canada),research,https://www.inaturalist.org/observations/42294653,https://inaturalist-open-data.s3.amazonaws.com/photos/67145832/medium.jpeg,,1,0,FALSE,"Garin/Dry Creek Regional Park, Alameda, California, United States",37.64508889,-122.0421917,5,,,Alameda,Dipterostemon capitatus capitatus,Dipterostemon capitatus capitatus,,Plantae,1196824,Asparagaceae,Dipterostemon,Dipterostemon capitatus
42294654,3/29/20,2020-03-29 19:51:00 UTC,Pacific Time (US & Canada),research,https://www.inaturalist.org/observations/42294654,https://inaturalist-open-data.s3.amazonaws.com/photos/67145870/medium.jpeg,,1,0,FALSE,"Garin/Dry Creek Regional Park, Alameda, California, United States",37.64510278,-122.0421833,4,,,Alameda,California poppy,Eschscholzia californica,California poppy,Plantae,48225,Papaveraceae,Eschscholzia,Eschscholzia californica
42294657,3/29/20,2020-03-29 20:01:00 UTC,Pacific Time (US & Canada),research,https://www.inaturalist.org/observations/42294657,https://inaturalist-open-data.s3.amazonaws.com/photos/67145902/medium.jpeg,,1,0,FALSE,"Garin/Dry Creek Regional Park, Alameda, California, United States",37.64555833,-122.0428306,5,,,Alameda,Frangula californica californica,Frangula californica californica,California Coffeeberry,Plantae,53429,Rhamnaceae,Frangula,Frangula californica
42294658,3/29/20,2020-03-29 20:07:00 UTC,Pacific Time (US & Canada),research,https://www.inaturalist.org/observations/42294658,https://inaturalist-open-data.s3.amazonaws.com/photos/67145933/medium.jpeg,,1,0,FALSE,"Garin/Dry Creek Regional Park, Alameda, California, United States",37.64587778,-122.0429611,7,,,Alameda,milkmaids,Cardamine californica,milkmaids,Plantae,49651,Brassicaceae,Cardamine,Cardamine californica
42294663,3/29/20,2020-03-29 20:26:00 UTC,Pacific Time (US & Canada),research,https://www.inaturalist.org/observations/42294663,https://inaturalist-open-data.s3.amazonaws.com/photos/67146023/medium.jpeg,,1,0,FALSE,"Mission - Garin, Hayward, CA, USA",37.6469,-122.0443194,32,,,Alameda,California manroot,Marah fabacea,California manroot,Plantae,205330,Cucurbitaceae,Marah,Marah fabacea
42294664,3/29/20,2020-03-29 20:27:00 UTC,Pacific Time (US & Canada),research,https://www.inaturalist.org/observations/42294664,https://inaturalist-open-data.s3.amazonaws.com/photos/67146038/medium.jpeg,,1,0,FALSE,"Mission - Garin, Hayward, CA, USA",37.64688611,-122.0441806,13,,,Alameda,common chickweed,Stellaria media,common chickweed,Plantae,53298,Caryophyllaceae,Stellaria,Stellaria media
42294665,3/29/20,2020-03-29 20:29:00 UTC,Pacific Time (US & Canada),research,https://www.inaturalist.org/observations/42294665,https://inaturalist-open-data.s3.amazonaws.com/photos/67146045/medium.jpeg,,1,0,FALSE,"Mission - Garin, Hayward, CA, USA",37.64703333,-122.042975,19,,,Alameda,Hooker's fairybells,Prosartes hookeri,Hooker's fairybells,Plantae,51071,Liliaceae,Prosartes,Prosartes hookeri
42294666,3/29/20,2020-03-29 20:30:00 UTC,Pacific Time (US & Canada),research,https://www.inaturalist.org/observations/42294666,https://inaturalist-open-data.s3.amazonaws.com/photos/67146063/medium.jpeg,,1,0,FALSE,"Garin/Dry Creek Regional Park, Alameda, California, United States",37.64698889,-122.0428389,12,,,Alameda,Pink Honeysuckle,Lonicera hispidula,Pink Honeysuckle,Plantae,53416,Caprifoliaceae,Lonicera,Lonicera hispidula
41086133,3/30/20,2020-03-30 22:57:10 UTC,Pacific Time (US & Canada),research,https://www.inaturalist.org/observations/41086133,https://inaturalist-open-data.s3.amazonaws.com/photos/65145671/medium.jpg,,1,0,FALSE,"Garin Regional Park, Hayward, CA, US",37.64493833,-121.99713,4,,Hayward,Alameda,California poppy,Eschscholzia californica,California poppy,Plantae,48225,Papaveraceae,Eschscholzia,Eschscholzia californica
41214157,4/1/20,2020-04-01 22:36:00 UTC,Pacific Time (US & Canada),research,https://www.inaturalist.org/observations/41214157,https://inaturalist-open-data.s3.amazonaws.com/photos/65361522/medium.jpg,,1,0,FALSE,"Garin Regional Park, Hayward, CA, US",37.64113667,-122.0316555,81,,,Alameda,western blue-eyed grass,Sisyrinchium bellum,western blue-eyed grass,Plantae,49918,Iridaceae,Sisyrinchium,Sisyrinchium bellum
41864568,4/10/20,2020-04-10 17:57:19 UTC,Pacific Time (US & Canada),research,https://www.inaturalist.org/observations/41864568,https://inaturalist-open-data.s3.amazonaws.com/photos/66430509/medium.jpeg,,1,0,FALSE,"Castro Valley, CA 94552, USA",37.64334525,-122.0071505,181,,Hayward,Alameda,ribwort plantain,Plantago lanceolata,ribwort plantain,Plantae,53178,Plantaginaceae,Plantago,Plantago lanceolata
41864829,4/10/20,2020-04-10 17:56:20 UTC,Pacific Time (US & Canada),research,https://www.inaturalist.org/observations/41864829,https://inaturalist-open-data.s3.amazonaws.com/photos/66430869/medium.jpeg,,1,0,FALSE,"Castro Valley, CA 94552, USA",37.64372409,-122.0071515,164,,Hayward,Alameda,western blue-eyed grass,Sisyrinchium bellum,western blue-eyed grass,Plantae,49918,Iridaceae,Sisyrinchium,Sisyrinchium bellum
41865029,4/10/20,2020-04-10 17:55:18 UTC,Pacific Time (US & Canada),research,https://www.inaturalist.org/observations/41865029,https://inaturalist-open-data.s3.amazonaws.com/photos/66431266/medium.jpeg,,1,0,FALSE,"Castro Valley, CA 94552, USA",37.64373046,-122.0071515,263,,Hayward,Alameda,Sky Lupine,Lupinus nanus,Sky Lupine,Plantae,50612,Fabaceae,Lupinus,Lupinus nanus
41865164,4/10/20,2020-04-10 17:27:15 UTC,Pacific Time (US & Canada),research,https://www.inaturalist.org/observations/41865164,https://inaturalist-open-data.s3.amazonaws.com/photos/66431492/medium.jpeg,,1,0,FALSE,"Garin/Dry Creek Regional Park, Alameda County, US-CA, US",37.64373046,-122.0071515,263,,Hayward,Alameda,Mediterranean Stork's-bill,Erodium botrys,Mediterranean Stork's-bill,Plantae,57090,Geraniaceae,Erodium,Erodium botrys
41865331,4/10/20,2020-04-10 17:04:17 UTC,Pacific Time (US & Canada),research,https://www.inaturalist.org/observations/41865331,https://inaturalist-open-data.s3.amazonaws.com/photos/66431830/medium.jpeg,Looks like the covid19 virus,1,0,FALSE,"Castro Valley, CA 94552, USA",37.64373046,-122.0071515,263,,Hayward,Alameda,Purple Sanicle,Sanicula bipinnatifida,Purple Sanicle,Plantae,56840,Apiaceae,Sanicula,Sanicula bipinnatifida
41865632,4/10/20,2020-04-10 16:48:43 UTC,Pacific Time (US & Canada),research,https://www.inaturalist.org/observations/41865632,https://inaturalist-open-data.s3.amazonaws.com/photos/66432313/medium.jpeg,Looks like a wasp on many of the blossoms,1,0,FALSE,"Castro Valley, CA 94552, USA",37.64373046,-122.0071515,263,,Hayward,Alameda,Sun Cup,Taraxia ovata,Sun Cup,Plantae,68182,Onagraceae,Taraxia,Taraxia ovata
41885353,4/10/20,2020-04-10 13:36:44 UTC,Pacific Time (US & Canada),research,https://www.inaturalist.org/observations/41885353,https://static.inaturalist.org/photos/66466711/medium.jpg,,2,0,FALSE,"Garin Regional Park, Hayward, CA, US",37.64609432,-122.0409407,102,,,Alameda,Solomon's plume,Maianthemum racemosum amplexicaule,western Solomon's plume,Plantae,53012,Asparagaceae,Maianthemum,Maianthemum racemosum
41885377,4/10/20,2020-04-10 20:33:02 UTC,Pacific Time (US & Canada),research,https://www.inaturalist.org/observations/41885377,https://static.inaturalist.org/photos/66466733/medium.jpg,,1,0,FALSE,"Garin Regional Park, Hayward, CA, US",37.64656167,-122.0412833,8,,,Alameda,western columbine,Aquilegia formosa,western columbine,Plantae,48244,Ranunculaceae,Aquilegia,Aquilegia formosa
41885681,4/10/20,2020-04-10 14:54:59 UTC,Pacific Time (US & Canada),research,https://www.inaturalist.org/observations/41885681,https://static.inaturalist.org/photos/66467289/medium.jpg,White morph,1,0,FALSE,"Garin Regional Park, Hayward, CA, US",37.64282113,-122.030691,125,,Hayward,Alameda,western blue-eyed grass,Sisyrinchium bellum,western blue-eyed grass,Plantae,49918,Iridaceae,Sisyrinchium,Sisyrinchium bellum
44139666,4/10/20,2020-04-10 22:49:48 UTC,Pacific Time (US & Canada),research,https://www.inaturalist.org/observations/44139666,https://inaturalist-open-data.s3.amazonaws.com/photos/70211433/medium.jpg,,2,0,FALSE,"Garin Regional Park, Hayward, CA, US",37.63757833,-122.0304555,436,,,Alameda,western blue-eyed grass,Sisyrinchium bellum,western blue-eyed grass,Plantae,49918,Iridaceae,Sisyrinchium,Sisyrinchium bellum
42534661,4/18/20,2020-04-18 20:35:59 UTC,Pacific Time (US & Canada),research,https://www.inaturalist.org/observations/42534661,https://static.inaturalist.org/photos/67538610/medium.jpg,,1,0,FALSE,"Dry Creek Pioneer Regional Park, Union City, CA, US",37.626505,-122.027825,5,,,Alameda,wild radish,Raphanus sativus,wild radish,Plantae,55410,Brassicaceae,Raphanus,Raphanus sativus
42537811,4/18/20,2020-04-19 01:23:27 UTC,Pacific Time (US & Canada),research,https://www.inaturalist.org/observations/42537811,https://inaturalist-open-data.s3.amazonaws.com/photos/67544192/medium.jpg,,1,0,FALSE,"Garin/Dry Creek Regional Park, Alameda County, US-CA, US",37.6243995,-122.0282317,5,,,Alameda,Common Vetch,Vicia sativa,Common Vetch,Plantae,53324,Fabaceae,Vicia,Vicia sativa
43349391,4/19/20,2020-04-19 22:38:00 UTC,Pacific Time (US & Canada),research,https://www.inaturalist.org/observations/43349391,https://static.inaturalist.org/photos/68792618/medium.jpg,,1,0,FALSE,"Alameda County, CA, USA",37.62961867,-122.0283022,61,,,Alameda,Zwarte Mosterd,Brassica nigra,Black Mustard,Plantae,53112,Brassicaceae,Brassica,Brassica nigra
43354306,4/19/20,2020-04-19 22:51:00 UTC,Pacific Time (US & Canada),research,https://www.inaturalist.org/observations/43354306,https://static.inaturalist.org/photos/68799818/medium.jpeg,,1,0,FALSE,"Alameda County, CA, USA",37.63281389,-122.0262528,5,,,Alameda,bull thistle,Cirsium vulgare,Bull Thistle,Plantae,52989,Asteraceae,Cirsium,Cirsium vulgare
44342632,4/19/20,2020-04-20 00:27:00 UTC,Pacific Time (US & Canada),research,https://www.inaturalist.org/observations/44342632,https://static.inaturalist.org/photos/70303962/medium.jpg,,1,0,FALSE,"Alameda County, CA, USA",37.62829426,-122.0280882,100,,,Alameda,Carolina Bristlemallow,Modiola caroliniana,Carolina Bristlemallow,Plantae,78087,Malvaceae,Modiola,Modiola caroliniana
44342724,4/19/20,2020-04-20 00:30:00 UTC,Pacific Time (US & Canada),research,https://www.inaturalist.org/observations/44342724,https://static.inaturalist.org/photos/70304348/medium.jpeg,,1,0,FALSE,"Alameda County, CA, USA",37.62796389,-122.0284278,5,,,Alameda,common fig,Ficus carica,common fig,Plantae,60218,Moraceae,Ficus,Ficus carica
44344170,4/20/20,2020-04-21 00:26:00 UTC,Pacific Time (US & Canada),research,https://www.inaturalist.org/observations/44344170,https://static.inaturalist.org/photos/70306593/medium.jpg,,1,0,FALSE,"Mission - Garin, Hayward, CA, USA",37.64118625,-122.0403314,70,,,Alameda,narrowleaf mule-ears,Wyethia angustifolia,narrowleaf mule-ears,Plantae,56987,Asteraceae,Wyethia,Wyethia angustifolia
44344749,4/20/20,2020-04-21 00:31:00 UTC,Pacific Time (US & Canada),research,https://www.inaturalist.org/observations/44344749,https://static.inaturalist.org/photos/70307609/medium.jpg,,2,0,FALSE,"Mission - Garin, Hayward, CA, USA",37.64165932,-122.0401013,54,,,Alameda,Shepherd's-needle,Scandix pecten-veneris,Shepherd's-needle,Plantae,56843,Apiaceae,Scandix,Scandix pecten-veneris
44345025,4/20/20,2020-04-21 00:38:00 UTC,Pacific Time (US & Canada),research,https://www.inaturalist.org/observations/44345025,https://static.inaturalist.org/photos/70308364/medium.jpg,,1,0,FALSE,"Mission - Garin, Hayward, CA, USA",37.64176301,-122.0397845,15,,,Alameda,Purple Sanicle,Sanicula bipinnatifida,Purple Sanicle,Plantae,56840,Apiaceae,Sanicula,Sanicula bipinnatifida
42996077,4/23/20,2020-04-23 18:26:10 UTC,Pacific Time (US & Canada),research,https://www.inaturalist.org/observations/42996077,https://static.inaturalist.org/photos/68269205/medium.jpg,,1,0,FALSE,"Garin Regional Park, Union City, CA, US",37.63283667,-122.0268555,5,,,Alameda,Pale flax,Linum bienne,Pale flax,Plantae,55679,Linaceae,Linum,Linum bienne
44138650,4/23/20,2020-04-24 01:35:58 UTC,Pacific Time (US & Canada),research,https://www.inaturalist.org/observations/44138650,https://inaturalist-open-data.s3.amazonaws.com/photos/69982754/medium.jpg,,1,0,FALSE,"Garin Regional Park, Hayward, CA, US",37.6463,-122.040475,45,,,Alameda,Three-cornered garlic,Allium triquetrum,Three-cornered garlic,Plantae,55505,Amaryllidaceae,Allium,Allium triquetrum
44138961,4/23/20,2020-04-24 01:36:33 UTC,Pacific Time (US & Canada),research,https://www.inaturalist.org/observations/44138961,https://inaturalist-open-data.s3.amazonaws.com/photos/69983062/medium.jpg,,2,0,FALSE,"Garin Regional Park, Hayward, CA, US",37.6465,-122.0404138,6,,,Alameda,star-flowered lily-of-the-valley,Maianthemum stellatum,star-flowered lily-of-the-valley,Plantae,53268,Asparagaceae,Maianthemum,Maianthemum stellatum
44139058,4/23/20,2020-04-24 01:38:02 UTC,Pacific Time (US & Canada),research,https://www.inaturalist.org/observations/44139058,https://inaturalist-open-data.s3.amazonaws.com/photos/69983225/medium.jpg,,1,0,FALSE,"Garin Regional Park, Hayward, CA, US",37.64658333,-122.0394583,7,,,Alameda,western columbine,Aquilegia formosa,western columbine,Plantae,48244,Ranunculaceae,Aquilegia,Aquilegia formosa
44411884,4/25/20,2020-04-25 18:00:00 UTC,Pacific Time (US & Canada),research,https://www.inaturalist.org/observations/44411884,https://inaturalist-open-data.s3.amazonaws.com/photos/70402887/medium.jpeg,,1,0,FALSE,"Garin/Dry Creek Regional Park, Alameda, California, United States",37.64647778,-122.0377667,22,,Hayward,Alameda,mountain sweet cicely,Osmorhiza berteroi,mountain sweet cicely,Plantae,53166,Apiaceae,Osmorhiza,Osmorhiza berteroi
44411889,4/25/20,2020-04-25 18:02:00 UTC,Pacific Time (US & Canada),research,https://www.inaturalist.org/observations/44411889,https://inaturalist-open-data.s3.amazonaws.com/photos/70402918/medium.jpeg,,1,0,FALSE,"Garin/Dry Creek Regional Park, Alameda, California, United States",37.64533889,-122.0378889,9,,,Alameda,Pacific hound's tongue,Adelinia grande,Pacific hound's tongue,Plantae,769151,Boraginaceae,Adelinia,Adelinia grande
44411892,4/25/20,2020-04-25 18:03:00 UTC,Pacific Time (US & Canada),research,https://www.inaturalist.org/observations/44411892,https://inaturalist-open-data.s3.amazonaws.com/photos/70402964/medium.jpeg,,1,0,FALSE,"Garin/Dry Creek Regional Park, Alameda, California, United States",37.64495,-122.0380472,10,,,Alameda,broad-leaved helleborine,Epipactis helleborine,Broad-leafed Helleborine,Plantae,50717,Orchidaceae,Epipactis,Epipactis helleborine
44411906,4/25/20,2020-04-25 18:09:00 UTC,Pacific Time (US & Canada),research,https://www.inaturalist.org/observations/44411906,https://inaturalist-open-data.s3.amazonaws.com/photos/70403069/medium.jpeg,,1,0,FALSE,"Garin/Dry Creek Regional Park, Alameda, California, United States",37.64458056,-122.0386056,7,,,Alameda,Hillside False Bindweed,Calystegia subacaulis,Hillside False Bindweed,Plantae,57012,Convolvulaceae,Calystegia,Calystegia subacaulis
44411907,4/25/20,2020-04-25 18:10:00 UTC,Pacific Time (US & Canada),research,https://www.inaturalist.org/observations/44411907,https://inaturalist-open-data.s3.amazonaws.com/photos/70403099/medium.jpeg,,1,0,FALSE,"Garin/Dry Creek Regional Park, Alameda, California, United States",37.64481111,-122.0386889,5,,,Alameda,purple needlegrass,Nassella pulchra,purple needlegrass,Plantae,165659,Poaceae,Nassella,Nassella pulchra
44411908,4/25/20,2020-04-25 18:20:00 UTC,Pacific Time (US & Canada),research,https://www.inaturalist.org/observations/44411908,https://inaturalist-open-data.s3.amazonaws.com/photos/70403209/medium.jpeg,,2,0,FALSE,"Garin/Dry Creek Regional Park, Alameda, California, United States",37.64591944,-122.0396333,7,,,Alameda,star-flowered lily-of-the-valley,Maianthemum stellatum,star-flowered lily-of-the-valley,Plantae,53268,Asparagaceae,Maianthemum,Maianthemum stellatum
44411910,4/25/20,2020-04-25 18:23:00 UTC,Pacific Time (US & Canada),research,https://www.inaturalist.org/observations/44411910,https://inaturalist-open-data.s3.amazonaws.com/photos/70403230/medium.jpeg,,1,0,FALSE,"Mission - Garin, Hayward, CA, USA",37.64528333,-122.0387417,6,,,Alameda,graceful bedstraw,Galium porrigens,graceful bedstraw,Plantae,53063,Rubiaceae,Galium,Galium porrigens
44411913,4/25/20,2020-04-25 18:32:00 UTC,Pacific Time (US & Canada),research,https://www.inaturalist.org/observations/44411913,https://inaturalist-open-data.s3.amazonaws.com/photos/70403274/medium.jpeg,,1,0,FALSE,"Garin/Dry Creek Regional Park, Alameda, California, United States",37.64358611,-122.0392917,8,,,Alameda,trailing blackberry,Rubus ursinus,trailing blackberry,Plantae,53445,Rosaceae,Rubus,Rubus ursinus
44411922,4/25/20,2020-04-25 19:04:00 UTC,Pacific Time (US & Canada),research,https://www.inaturalist.org/observations/44411922,https://inaturalist-open-data.s3.amazonaws.com/photos/70403406/medium.jpeg,,1,0,FALSE,"Alameda County, CA, USA",37.64296667,-122.0352861,4,,,Alameda,narrowleaf mule-ears,Wyethia angustifolia,narrowleaf mule-ears,Plantae,56987,Asteraceae,Wyethia,Wyethia angustifolia
44411929,4/25/20,2020-04-25 19:10:00 UTC,Pacific Time (US & Canada),research,https://www.inaturalist.org/observations/44411929,https://inaturalist-open-data.s3.amazonaws.com/photos/70403730/medium.jpeg,,1,0,FALSE,"Garin/Dry Creek Regional Park, Alameda, California, United States",37.64314722,-122.0348444,4,,,Alameda,Dwarf Checkermallow,Sidalcea malviflora,Dwarf Checkermallow,Plantae,48795,Malvaceae,Sidalcea,Sidalcea malviflora
44411932,4/25/20,2020-04-25 19:13:00 UTC,Pacific Time (US & Canada),research,https://www.inaturalist.org/observations/44411932,https://inaturalist-open-data.s3.amazonaws.com/photos/70403846/medium.jpeg,,1,0,FALSE,"Garin/Dry Creek Regional Park, Alameda, California, United States",37.64343333,-122.034775,5,,,Alameda,Gray Mule-Ears,Wyethia helenioides,Gray Mule-Ears,Plantae,50799,Asteraceae,Wyethia,Wyethia helenioides
44411939,4/25/20,2020-04-25 19:20:00 UTC,Pacific Time (US & Canada),research,https://www.inaturalist.org/observations/44411939,https://inaturalist-open-data.s3.amazonaws.com/photos/70404039/medium.jpeg,,1,0,FALSE,"Garin/Dry Creek Regional Park, Alameda, California, United States",37.64410833,-122.036025,5,,,Alameda,Gray Mule-Ears,Wyethia helenioides,Gray Mule-Ears,Plantae,50799,Asteraceae,Wyethia,Wyethia helenioides
44411941,4/25/20,2020-04-25 19:25:00 UTC,Pacific Time (US & Canada),research,https://www.inaturalist.org/observations/44411941,https://inaturalist-open-data.s3.amazonaws.com/photos/70404065/medium.jpeg,,1,0,FALSE,"Garin/Dry Creek Regional Park, Alameda, California, United States",37.64414722,-122.0357889,5,,,Alameda,Coyote Mint,Monardella villosa,Coyote Mint,Plantae,52181,Lamiaceae,Monardella,Monardella villosa
44411946,4/25/20,2020-04-25 19:48:00 UTC,Pacific Time (US & Canada),research,https://www.inaturalist.org/observations/44411946,https://inaturalist-open-data.s3.amazonaws.com/photos/70404201/medium.jpeg,,1,0,FALSE,"Hayward, CA, USA",37.64404722,-122.0317528,7,,Hayward,Alameda,hillside gooseberry,Ribes californicum,hillside gooseberry,Plantae,47129,Grossulariaceae,Ribes,Ribes californicum
44411947,4/25/20,2020-04-25 20:07:00 UTC,Pacific Time (US & Canada),research,https://www.inaturalist.org/observations/44411947,https://inaturalist-open-data.s3.amazonaws.com/photos/70404287/medium.jpeg,,1,0,FALSE,"Garin/Dry Creek Regional Park, Alameda, California, United States",37.64479444,-122.03135,10,,Hayward,Alameda,California Spikenard,Aralia californica,California Spikenard,Plantae,52848,Araliaceae,Aralia,Aralia californica
43748495,4/26/20,2020-04-26 21:14:19 UTC,Pacific Time (US & Canada),research,https://www.inaturalist.org/observations/43748495,https://static.inaturalist.org/photos/69388680/medium.jpeg,,2,0,FALSE,"Mission - Garin, Hayward, CA, USA",37.64648497,-122.042356,,,,Alameda,western columbine,Aquilegia formosa,western columbine,Plantae,48244,Ranunculaceae,Aquilegia,Aquilegia formosa
45241075,4/30/20,2020-04-30 18:01:16 UTC,Pacific Time (US & Canada),research,https://www.inaturalist.org/observations/45241075,https://inaturalist-open-data.s3.amazonaws.com/photos/71732282/medium.jpg,,1,0,FALSE,"Garin Regional Park, Hayward, CA, US",37.64657167,-122.0423888,7,,,Alameda,Hooker's fairybells,Prosartes hookeri,Hooker's fairybells,Plantae,51071,Liliaceae,Prosartes,Prosartes hookeri
45241105,4/30/20,2020-04-30 18:00:48 UTC,Pacific Time (US & Canada),research,https://www.inaturalist.org/observations/45241105,https://inaturalist-open-data.s3.amazonaws.com/photos/71732340/medium.jpg,,2,0,FALSE,"Garin Regional Park, Hayward, CA, US",37.64667167,-122.0423195,6,,,Alameda,false Solomon's seal,Maianthemum racemosum,Solomon's plume,Plantae,51062,Asparagaceae,Maianthemum,Maianthemum racemosum
45241143,4/30/20,2020-04-30 18:00:08 UTC,Pacific Time (US & Canada),research,https://www.inaturalist.org/observations/45241143,https://inaturalist-open-data.s3.amazonaws.com/photos/71732457/medium.jpg,,2,0,FALSE,"Garin Regional Park, Hayward, CA, US",37.64657,-122.0421055,42,,,Alameda,western columbine,Aquilegia formosa,western columbine,Plantae,48244,Ranunculaceae,Aquilegia,Aquilegia formosa
45241214,4/30/20,2020-04-30 17:55:03 UTC,Pacific Time (US & Canada),research,https://www.inaturalist.org/observations/45241214,https://inaturalist-open-data.s3.amazonaws.com/photos/71732627/medium.jpg,,1,0,FALSE,"Garin Regional Park, Hayward, CA, US",37.64664167,-122.0394833,12,,,Alameda,Wild strawberry,Fragaria vesca,woodland strawberry,Plantae,50298,Rosaceae,Fragaria,Fragaria vesca
45241225,4/30/20,2020-04-30 17:45:50 UTC,Pacific Time (US & Canada),research,https://www.inaturalist.org/observations/45241225,https://inaturalist-open-data.s3.amazonaws.com/photos/72253530/medium.jpg,,1,0,FALSE,"Garin Regional Park, Hayward, CA, US",37.64610333,-122.0339055,12,,Hayward,Alameda,California bee plant,Scrophularia californica,California beeplant,Plantae,50812,Scrophulariaceae,Scrophularia,Scrophularia californica
44625853,5/2/20,2020-05-02 18:50:46 UTC,Pacific Time (US & Canada),research,https://www.inaturalist.org/observations/44625853,https://inaturalist-open-data.s3.amazonaws.com/photos/70749536/medium.jpg,,1,0,FALSE,"Garin Regional Park, Hayward, CA, US",37.63876667,-122.0355138,4,,,Alameda,Mediterranean lineseed,Bellardia trixago,Mediterranean lineseed,Plantae,51286,Orobanchaceae,Bellardia,Bellardia trixago
44628380,5/2/20,2020-05-02 19:21:18 UTC,Pacific Time (US & Canada),research,https://www.inaturalist.org/observations/44628380,https://inaturalist-open-data.s3.amazonaws.com/photos/70753728/medium.jpg,,1,0,FALSE,"Garin Regional Park, Hayward, CA, US",37.64222,-122.0392138,19,,,Alameda,Sheep's sorrel,Rumex acetosella,Sheep's sorrel,Plantae,53195,Polygonaceae,Rumex,Rumex acetosella
44686953,5/2/20,2020-05-02 17:56:21 UTC,Pacific Time (US & Canada),research,https://www.inaturalist.org/observations/44686953,https://inaturalist-open-data.s3.amazonaws.com/photos/70848181/medium.jpg,,1,0,FALSE,"Garin Regional Park, Hayward, CA, US",37.64603,-122.032975,47,,Hayward,Alameda,common fig,Ficus carica,common fig,Plantae,60218,Moraceae,Ficus,Ficus carica
44687045,5/2/20,2020-05-02 18:15:53 UTC,Pacific Time (US & Canada),research,https://www.inaturalist.org/observations/44687045,https://inaturalist-open-data.s3.amazonaws.com/photos/70848430/medium.jpg,,1,0,FALSE,"Garin Regional Park, Hayward, CA, US",37.64328,-122.0304333,23,,Hayward,Alameda,American yellowrocket,Barbarea orthoceras,American yellowrocket,Plantae,52976,Brassicaceae,Barbarea,Barbarea orthoceras
44687195,5/2/20,2020-05-02 18:39:53 UTC,Pacific Time (US & Canada),research,https://www.inaturalist.org/observations/44687195,https://inaturalist-open-data.s3.amazonaws.com/photos/70848663/medium.jpg,,2,0,FALSE,"Garin Regional Park, Hayward, CA, US",37.63903333,-122.034675,8,,,Alameda,Ithuriel's Spear,Triteleia laxa,Ithuriel's Spear,Plantae,51085,Asparagaceae,Triteleia,Triteleia laxa
44687240,5/2/20,2020-05-02 18:40:05 UTC,Pacific Time (US & Canada),research,https://www.inaturalist.org/observations/44687240,https://inaturalist-open-data.s3.amazonaws.com/photos/70848743/medium.jpg,,1,0,FALSE,"Garin Regional Park, Hayward, CA, US",37.63902167,-122.0346972,7,,,Alameda,common yarrow,Achillea millefolium,common yarrow,Plantae,52821,Asteraceae,Achillea,Achillea millefolium
44687300,5/2/20,2020-05-02 18:49:02 UTC,Pacific Time (US & Canada),research,https://www.inaturalist.org/observations/44687300,https://inaturalist-open-data.s3.amazonaws.com/photos/70848838/medium.jpg,,2,0,FALSE,"Garin Regional Park, Hayward, CA, US",37.63882,-122.0353472,14,,,Alameda,Ithuriel's Spear,Triteleia laxa,Ithuriel's Spear,Plantae,51085,Asparagaceae,Triteleia,Triteleia laxa
44687316,5/2/20,2020-05-02 18:51:45 UTC,Pacific Time (US & Canada),research,https://www.inaturalist.org/observations/44687316,https://inaturalist-open-data.s3.amazonaws.com/photos/70848860/medium.jpg,,1,0,FALSE,"Garin Regional Park, Hayward, CA, US",37.63870333,-122.0354695,36,,,Alameda,narrowleaf mule-ears,Wyethia angustifolia,narrowleaf mule-ears,Plantae,56987,Asteraceae,Wyethia,Wyethia angustifolia
44687729,5/2/20,2020-05-02 18:52:50 UTC,Pacific Time (US & Canada),research,https://www.inaturalist.org/observations/44687729,https://inaturalist-open-data.s3.amazonaws.com/photos/70849503/medium.jpg,,1,0,FALSE,"Garin Regional Park, Hayward, CA, US",37.638595,-122.0356055,9,,,Alameda,Artichoke Thistle,Cynara cardunculus,Artichoke Thistle,Plantae,57563,Asteraceae,Cynara,Cynara cardunculus
44688396,5/2/20,2020-05-02 19:17:02 UTC,Pacific Time (US & Canada),research,https://www.inaturalist.org/observations/44688396,https://inaturalist-open-data.s3.amazonaws.com/photos/70850554/medium.jpg,,1,0,FALSE,"Garin Regional Park, Hayward, CA, US",37.64213833,-122.0391388,4,,,Alameda,graceful bedstraw,Galium porrigens,graceful bedstraw,Plantae,53063,Rubiaceae,Galium,Galium porrigens
44688413,5/2/20,2020-05-02 19:18:37 UTC,Pacific Time (US & Canada),research,https://www.inaturalist.org/observations/44688413,https://inaturalist-open-data.s3.amazonaws.com/photos/70850576/medium.jpg,,1,0,FALSE,"Garin Regional Park, Hayward, CA, US",37.64223667,-122.0389028,9,,,Alameda,Gray Mule-Ears,Wyethia helenioides,Gray Mule-Ears,Plantae,50799,Asteraceae,Wyethia,Wyethia helenioides
44688714,5/2/20,2020-05-02 19:29:33 UTC,Pacific Time (US & Canada),research,https://www.inaturalist.org/observations/44688714,https://inaturalist-open-data.s3.amazonaws.com/photos/70850999/medium.jpg,,1,0,FALSE,"Garin Regional Park, Hayward, CA, US",37.643895,-122.0403278,7,,,Alameda,coast live oak,Quercus agrifolia,coast live oak,Plantae,47850,Fagaceae,Quercus,Quercus agrifolia
44688839,5/2/20,2020-05-02 19:30:32 UTC,Pacific Time (US & Canada),research,https://www.inaturalist.org/observations/44688839,https://inaturalist-open-data.s3.amazonaws.com/photos/70851120/medium.jpg,,1,0,FALSE,"Garin Regional Park, Hayward, CA, US",37.64405833,-122.0402138,75,,,Alameda,goldentop grass,Lamarckia aurea,goldentop grass,Plantae,58379,Poaceae,Lamarckia,Lamarckia aurea
45527320,5/8/20,2020-05-08 15:52:38 UTC,Pacific Time (US & Canada),research,https://www.inaturalist.org/observations/45527320,https://inaturalist-open-data.s3.amazonaws.com/photos/72193180/medium.jpg,,2,0,FALSE,"Garin Regional Park, Hayward, CA, US",37.64652,-122.0421305,5,,,Alameda,western columbine,Aquilegia formosa,western columbine,Plantae,48244,Ranunculaceae,Aquilegia,Aquilegia formosa
45426880,5/9/20,2020-05-09 18:45:00 UTC,Pacific Time (US & Canada),research,https://www.inaturalist.org/observations/45426880,https://inaturalist-open-data.s3.amazonaws.com/photos/72013490/medium.jpeg,,1,0,FALSE,"Hayward, CA, USA",37.64439444,-122.03315,17,,Hayward,Alameda,coast live oak,Quercus agrifolia,coast live oak,Plantae,47850,Fagaceae,Quercus,Quercus agrifolia
45426881,5/9/20,2020-05-09 18:46:00 UTC,Pacific Time (US & Canada),research,https://www.inaturalist.org/observations/45426881,https://inaturalist-open-data.s3.amazonaws.com/photos/72013693/medium.jpeg,,1,0,FALSE,"Hayward, CA, USA",37.64434722,-122.0331333,127,,Hayward,Alameda,trailing blackberry,Rubus ursinus,trailing blackberry,Plantae,53445,Rosaceae,Rubus,Rubus ursinus
45426905,5/9/20,2020-05-09 19:07:00 UTC,Pacific Time (US & Canada),research,https://www.inaturalist.org/observations/45426905,https://inaturalist-open-data.s3.amazonaws.com/photos/72015759/medium.jpeg,,1,0,FALSE,"Hayward, CA, USA",37.64346667,-122.0305111,29,,Hayward,Alameda,catchweed bedstraw,Galium aparine,catchweed bedstraw,Plantae,53059,Rubiaceae,Galium,Galium aparine
45426910,5/9/20,2020-05-09 19:08:00 UTC,Pacific Time (US & Canada),research,https://www.inaturalist.org/observations/45426910,https://inaturalist-open-data.s3.amazonaws.com/photos/72015823/medium.jpeg,,1,0,FALSE,"Hayward, CA, USA",37.64347778,-122.0305028,8,,Hayward,Alameda,broadleaf forget-me-not,Myosotis latifolia,broadleaf forget-me-not,Plantae,49132,Boraginaceae,Myosotis,Myosotis latifolia
45426918,5/9/20,2020-05-09 19:09:00 UTC,Pacific Time (US & Canada),research,https://www.inaturalist.org/observations/45426918,https://inaturalist-open-data.s3.amazonaws.com/photos/72016121/medium.jpeg,,1,0,FALSE,"Hayward, CA, USA",37.64373056,-122.0306778,15,,Hayward,Alameda,stinging nettle,Urtica dioica,great stinging nettle,Plantae,51884,Urticaceae,Urtica,Urtica dioica
45426949,5/9/20,2020-05-09 18:24:00 UTC,Pacific Time (US & Canada),research,https://www.inaturalist.org/observations/45426949,https://inaturalist-open-data.s3.amazonaws.com/photos/72017581/medium.jpeg,,1,0,FALSE,"Hayward, CA, USA",37.64490556,-122.0330806,10,,Hayward,Alameda,poison hemlock,Conium maculatum,poison hemlock,Plantae,52998,Apiaceae,Conium,Conium maculatum
45426958,5/9/20,2020-05-09 18:25:00 UTC,Pacific Time (US & Canada),research,https://www.inaturalist.org/observations/45426958,https://inaturalist-open-data.s3.amazonaws.com/photos/72017759/medium.jpeg,,1,0,FALSE,"Hayward, CA, USA",37.64501944,-122.0330972,9,,Hayward,Alameda,coast live oak,Quercus agrifolia,coast live oak,Plantae,47850,Fagaceae,Quercus,Quercus agrifolia
45426961,5/9/20,2020-05-09 18:25:00 UTC,Pacific Time (US & Canada),research,https://www.inaturalist.org/observations/45426961,https://inaturalist-open-data.s3.amazonaws.com/photos/72017822/medium.jpeg,,1,0,FALSE,"Hayward, CA, USA",37.64507778,-122.03315,6,,Hayward,Alameda,hairy vetch,Vicia villosa,hairy vetch,Plantae,57317,Fabaceae,Vicia,Vicia villosa
45426965,5/9/20,2020-05-09 18:28:00 UTC,Pacific Time (US & Canada),research,https://www.inaturalist.org/observations/45426965,https://inaturalist-open-data.s3.amazonaws.com/photos/72017923/medium.jpeg,,1,0,FALSE,"Garin/Dry Creek Regional Park, Alameda, California, United States",37.64493889,-122.0340194,7,,Hayward,Alameda,coyote brush,Baccharis pilularis,coyote brush,Plantae,53359,Asteraceae,Baccharis,Baccharis pilularis
45426966,5/9/20,2020-05-09 18:29:00 UTC,Pacific Time (US & Canada),research,https://www.inaturalist.org/observations/45426966,https://inaturalist-open-data.s3.amazonaws.com/photos/72017991/medium.jpeg,,2,0,FALSE,"Garin/Dry Creek Regional Park, Alameda, California, United States",37.64523333,-122.0343472,41,,Hayward,Alameda,Ithuriel's Spear,Triteleia laxa,Ithuriel's Spear,Plantae,51085,Asparagaceae,Triteleia,Triteleia laxa
45426973,5/9/20,2020-05-09 18:31:00 UTC,Pacific Time (US & Canada),research,https://www.inaturalist.org/observations/45426973,https://inaturalist-open-data.s3.amazonaws.com/photos/72018114/medium.jpeg,,1,0,FALSE,"Hayward, CA, USA",37.64480278,-122.0342778,5,,Hayward,Alameda,California poppy,Eschscholzia californica,California poppy,Plantae,48225,Papaveraceae,Eschscholzia,Eschscholzia californica
45426983,5/9/20,2020-05-09 18:31:00 UTC,Pacific Time (US & Canada),research,https://www.inaturalist.org/observations/45426983,https://inaturalist-open-data.s3.amazonaws.com/photos/72018164/medium.jpeg,,1,0,FALSE,"Garin/Dry Creek Regional Park, Alameda, California, United States",37.64491667,-122.0343639,14,,Hayward,Alameda,fennel,Foeniculum vulgare,fennel,Plantae,53052,Apiaceae,Foeniculum,Foeniculum vulgare
45426993,5/9/20,2020-05-09 18:39:00 UTC,Pacific Time (US & Canada),research,https://www.inaturalist.org/observations/45426993,https://inaturalist-open-data.s3.amazonaws.com/photos/72018300/medium.jpeg,,1,0,FALSE,"Garin/Dry Creek Regional Park, Alameda, California, United States",37.64473611,-122.0333639,58,,Hayward,Alameda,Pacific poison oak,Toxicodendron diversilobum,Pacific poison oak,Plantae,51080,Anacardiaceae,Toxicodendron,Toxicodendron diversilobum
45426994,5/9/20,2020-05-09 18:39:00 UTC,Pacific Time (US & Canada),research,https://www.inaturalist.org/observations/45426994,https://inaturalist-open-data.s3.amazonaws.com/photos/72018326/medium.jpeg,,1,0,FALSE,"Garin/Dry Creek Regional Park, Alameda, California, United States",37.64470278,-122.0335611,6,,Hayward,Alameda,blue elder,Sambucus cerulea,blue elder,Plantae,143799,Viburnaceae,Sambucus,Sambucus cerulea
45427002,5/9/20,2020-05-09 18:43:00 UTC,Pacific Time (US & Canada),research,https://www.inaturalist.org/observations/45427002,https://inaturalist-open-data.s3.amazonaws.com/photos/72018662/medium.jpeg,,1,0,FALSE,"Garin/Dry Creek Regional Park, Alameda, California, United States",37.644675,-122.0336444,74,,Hayward,Alameda,common yarrow,Achillea millefolium,common yarrow,Plantae,52821,Asteraceae,Achillea,Achillea millefolium
45564263,5/10/20,2020-05-10 21:48:06 UTC,Pacific Time (US & Canada),research,https://www.inaturalist.org/observations/45564263,https://inaturalist-open-data.s3.amazonaws.com/photos/73054947/medium.jpg,,1,0,FALSE,"Gamble Ct, Hayward, CA, US",37.64927833,-122.0417472,65,,Hayward,Alameda,orange bush monkeyflower,Diplacus aurantiacus,orange bush monkeyflower,Plantae,777371,Phrymaceae,Diplacus,Diplacus aurantiacus
61135635,5/14/20,2020-05-14 10:27:00 UTC,UTC,research,https://www.inaturalist.org/observations/61135635,https://static.inaturalist.org/photos/97799473/medium.jpg,"Ukraina, Garin Regional Park",1,0,FALSE,"Hayward, CA, USA",37.64015278,-122.0107278,,,Hayward,Alameda,deerweed,Acmispon glaber,deerweed,Plantae,53134,Fabaceae,Acmispon,Acmispon glaber
46537945,5/19/20,2020-05-19 22:29:53 UTC,Pacific Time (US & Canada),research,https://www.inaturalist.org/observations/46537945,https://inaturalist-open-data.s3.amazonaws.com/photos/73811614/medium.jpg,,1,0,FALSE,"Dry Creek Pioneer Regional Park, Union City, CA, US",37.63021628,-122.0234236,10,,,Alameda,milk thistle,Silybum marianum,milk thistle,Plantae,52586,Asteraceae,Silybum,Silybum marianum
46798763,5/21/20,2020-05-22 01:18:58 UTC,Pacific Time (US & Canada),research,https://www.inaturalist.org/observations/46798763,https://inaturalist-open-data.s3.amazonaws.com/photos/74219595/medium.jpg,,2,0,FALSE,"Garin Regional Park, Hayward, CA, US",37.64213,-122.0387195,12,,,Alameda,Ithuriel's Spear,Triteleia laxa,Ithuriel's Spear,Plantae,51085,Asparagaceae,Triteleia,Triteleia laxa
47895417,5/23/20,2020-05-23 19:20:41 UTC,Pacific Time (US & Canada),research,https://www.inaturalist.org/observations/47895417,https://inaturalist-open-data.s3.amazonaws.com/photos/75975032/medium.jpg,,1,0,FALSE,"Garin Regional Park, Hayward, CA, US",37.625405,-122.0286167,67,,,Alameda,Juncus effusus pacificus,Juncus effusus pacificus,pacific rush,Plantae,57108,Juncaceae,Juncus,Juncus effusus
48415746,6/3/20,2020-06-04 01:21:05 UTC,Pacific Time (US & Canada),research,https://www.inaturalist.org/observations/48415746,https://static.inaturalist.org/photos/76822950/medium.jpg,,1,0,FALSE,"94587, Hayward, CA, US",37.639825,-122.0087667,5,,Hayward,Alameda,harvest brodiaea,Brodiaea elegans,harvest brodiaea,Plantae,51752,Asparagaceae,Brodiaea,Brodiaea elegans
50513661,6/13/20,2020-06-13 18:56:55 UTC,Pacific Time (US & Canada),research,https://www.inaturalist.org/observations/50513661,https://inaturalist-open-data.s3.amazonaws.com/photos/80207971/medium.jpg,,2,0,FALSE,"Garin/Dry Creek Regional Park, Alameda County, US-CA, US",37.644855,-122.031425,5,,Hayward,Alameda,common cowparsnip,Heracleum maximum,common cowparsnip,Plantae,53094,Apiaceae,Heracleum,Heracleum maximum
50513685,6/13/20,2020-06-13 18:57:49 UTC,Pacific Time (US & Canada),research,https://www.inaturalist.org/observations/50513685,https://inaturalist-open-data.s3.amazonaws.com/photos/80208015/medium.jpg,,2,0,FALSE,"Garin/Dry Creek Regional Park, Alameda County, US-CA, US",37.64474167,-122.0314333,9,,Hayward,Alameda,California Spikenard,Aralia californica,California Spikenard,Plantae,52848,Araliaceae,Aralia,Aralia californica
50513701,6/13/20,2020-06-13 19:06:55 UTC,Pacific Time (US & Canada),research,https://www.inaturalist.org/observations/50513701,https://inaturalist-open-data.s3.amazonaws.com/photos/80208042/medium.jpg,,2,0,FALSE,"Garin/Dry Creek Regional Park, Alameda County, US-CA, US",37.64637413,-122.0350798,4,,Hayward,Alameda,Pacific poison oak,Toxicodendron diversilobum,Pacific poison oak,Plantae,51080,Anacardiaceae,Toxicodendron,Toxicodendron diversilobum
50229146,6/19/20,2020-06-19 23:45:22 UTC,Pacific Time (US & Canada),research,https://www.inaturalist.org/observations/50229146,https://static.inaturalist.org/photos/81101347/medium.jpg,,1,0,FALSE,"Garin Regional Park, Union City, CA, US",37.63003,-122.0277778,10,,,Alameda,white clover,Trifolium repens,white clover,Plantae,55745,Fabaceae,Trifolium,Trifolium repens
61138677,6/21/20,2020-06-21 11:37:00 UTC,UTC,research,https://www.inaturalist.org/observations/61138677,https://static.inaturalist.org/photos/97804209/medium.jpg,"Garin Regional Park, on flat-topped hill north-east of Garin Peak.  (The second photo taken later on 4/18/2021 and added to show the flowers.)",1,0,FALSE,"Alameda County, CA, USA",37.64230556,-122.0344528,,,,Alameda,Rupertia physodes,Rupertia physodes,forest scurfpea,Plantae,53198,Fabaceae,Rupertia,Rupertia physodes
52205226,7/2/20,2020-07-02 17:10:56 UTC,Pacific Time (US & Canada),research,https://www.inaturalist.org/observations/52205226,https://static.inaturalist.org/photos/82973988/medium.jpg,,1,0,FALSE,"Garin Regional Park, Hayward, CA, US",37.64088333,-122.0318612,4,,,Alameda,Hayfield Tarweed,Hemizonia congesta,Hayfield Tarweed,Plantae,56960,Asteraceae,Hemizonia,Hemizonia congesta
62604877,7/2/20,2020-07-02 11:26:00 UTC,UTC,research,https://www.inaturalist.org/observations/62604877,https://static.inaturalist.org/photos/100331647/medium.jpg,Lower Garin Woods Trail,1,0,FALSE,"Hayward Highland, Hayward, CA, USA",37.64611389,-122.0369,,,Hayward,Alameda,prickly lettuce,Lactuca serriola,prickly lettuce,Plantae,53107,Asteraceae,Lactuca,Lactuca serriola
57975169,8/29/20,2020-08-29 22:22:12 UTC,Pacific Time (US & Canada),research,https://www.inaturalist.org/observations/57975169,https://static.inaturalist.org/photos/100034173/medium.jpg,,1,0,FALSE,"Garin/Dry Creek Regional Park, Alameda County, US-CA, US",37.6245282,-122.0279697,5,,,Alameda,coast live oak,Quercus agrifolia,coast live oak,Plantae,47850,Fagaceae,Quercus,Quercus agrifolia
62157746,10/9/20,2020-10-09 12:22:00 UTC,UTC,research,https://www.inaturalist.org/observations/62157746,https://static.inaturalist.org/photos/99553773/medium.jpg,edge of dry cattle pond,1,0,FALSE,"Mission - Garin, Hayward, CA, USA",37.64296667,-122.0404,,,,Alameda,spiny cocklebur,Xanthium spinosum,spiny cocklebur,Plantae,58045,Asteraceae,Xanthium,Xanthium spinosum
62159884,10/9/20,2020-10-09 11:51:00 UTC,UTC,research,https://www.inaturalist.org/observations/62159884,https://static.inaturalist.org/photos/99557693/medium.jpg,,1,0,FALSE,"Alameda County, CA, USA",37.64358889,-122.0365167,,,,Alameda,Telegraphweed,Heterotheca grandiflora,Telegraphweed,Plantae,58831,Asteraceae,Heterotheca,Heterotheca grandiflora
62254376,10/9/20,2020-10-09 11:47:00 UTC,UTC,research,https://www.inaturalist.org/observations/62254376,https://static.inaturalist.org/photos/99719670/medium.jpg,,1,0,FALSE,"Alameda County, CA, USA",37.64389444,-122.0366389,,,,Alameda,Bristly Goldenaster,Heterotheca sessiliflora echioides,Bristly Goldenaster,Plantae,58834,Asteraceae,Heterotheca,Heterotheca sessiliflora
62258385,10/9/20,2020-10-09 12:23:00 UTC,UTC,research,https://www.inaturalist.org/observations/62258385,https://static.inaturalist.org/photos/99727240/medium.jpg,,2,0,FALSE,"Mission - Garin, Hayward, CA, USA",37.64306111,-122.0403444,,,,Alameda,Hayfield tarweed,Hemizonia congesta luzulifolia,Woodrush tarweed,Plantae,56956,Asteraceae,Hemizonia,Hemizonia congesta
62248762,10/10/20,2020-10-10 23:16:00 UTC,Pacific Time (US & Canada),research,https://www.inaturalist.org/observations/62248762,https://inaturalist-open-data.s3.amazonaws.com/photos/99709824/medium.jpeg,,2,0,FALSE,"Hayward, CA 94544, USA",37.6353875,-122.0311782,3,,,Alameda,Hayfield Tarweed,Hemizonia congesta,Hayfield Tarweed,Plantae,56960,Asteraceae,Hemizonia,Hemizonia congesta
62356036,10/11/20,2020-10-11 11:29:00 UTC,UTC,research,https://www.inaturalist.org/observations/62356036,https://static.inaturalist.org/photos/99895461/medium.jpg,,1,0,FALSE,"Hayward Highland, Hayward, CA, USA",37.646701,-122.036323,6,,Hayward,Alameda,Eriogonum fasciculatum foliolosum,Eriogonum fasciculatum foliolosum,leafy California buckwheat,Plantae,58980,Polygonaceae,Eriogonum,Eriogonum fasciculatum
63442962,10/20/20,2020-10-20 10:37:00 UTC,UTC,research,https://www.inaturalist.org/observations/63442962,https://static.inaturalist.org/photos/101814524/medium.jpg,,1,0,FALSE,"Mission - Garin, Hayward, CA, USA",37.63645556,-122.0376028,,,,Alameda,tree tobacco,Nicotiana glauca,tree tobacco,Plantae,58334,Solanaceae,Nicotiana,Nicotiana glauca
63443387,10/20/20,2020-10-20 11:36:00 UTC,UTC,research,https://www.inaturalist.org/observations/63443387,https://static.inaturalist.org/photos/101815032/medium.jpg,,1,0,FALSE,"Alameda County, CA, USA",37.63539444,-122.0254167,,,,Alameda,Pasto pampa,Cortaderia selloana,Pampas Grass,Plantae,64240,Poaceae,Cortaderia,Cortaderia selloana
63934197,10/23/20,2020-10-23 18:04:00 UTC,Pacific Time (US & Canada),research,https://www.inaturalist.org/observations/63934197,https://inaturalist-open-data.s3.amazonaws.com/photos/102695772/medium.jpg,,1,0,FALSE,"Hayward, CA, USA",37.63958878,-121.9900539,191,,Hayward,Alameda,Common Madia,Madia elegans,Common Madia,Plantae,56974,Asteraceae,Madia,Madia elegans
63934243,10/23/20,2020-10-23 18:07:00 UTC,Pacific Time (US & Canada),research,https://www.inaturalist.org/observations/63934243,https://inaturalist-open-data.s3.amazonaws.com/photos/102696008/medium.jpg,,2,0,FALSE,"Hayward, CA, USA",37.63965675,-121.9897105,191,,Hayward,Alameda,Common Madia,Madia elegans,Common Madia,Plantae,56974,Asteraceae,Madia,Madia elegans
64830163,10/25/20,2020-10-26 00:52:13 UTC,Pacific Time (US & Canada),research,https://www.inaturalist.org/observations/64830163,https://inaturalist-open-data.s3.amazonaws.com/photos/104290344/medium.jpg,,1,0,FALSE,"Garin & Dry Creek Pioneer Regional Parks, Union City, CA, US",37.62768,-122.0283888,,,,Alameda,American chestnut,Castanea dentata,American chestnut,Plantae,49186,Fagaceae,Castanea,Castanea dentata
64142176,11/3/20,2020-11-03 21:44:00 UTC,Pacific Time (US & Canada),research,https://www.inaturalist.org/observations/64142176,https://inaturalist-open-data.s3.amazonaws.com/photos/103072765/medium.jpg,,1,0,FALSE,"Alameda County, CA, USA",37.62499167,-122.0270722,,,,Alameda,water smartweed,Persicaria amphibia,water smartweed,Plantae,78450,Polygonaceae,Persicaria,Persicaria amphibia
64403174,11/7/20,2020-11-07 22:05:08 UTC,Pacific Time (US & Canada),research,https://www.inaturalist.org/observations/64403174,https://inaturalist-open-data.s3.amazonaws.com/photos/103534135/medium.jpg,,2,0,FALSE,"Garin & Dry Creek Pioneer Regional Parks, Hayward, CA, US",37.64508333,-122.0414362,6,,,Alameda,California fuchsia,Epilobium canum,California fuchsia,Plantae,53051,Onagraceae,Epilobium,Epilobium canum
69574468,12/28/20,2020-12-28 23:19:00 UTC,Pacific Time (US & Canada),research,https://www.inaturalist.org/observations/69574468,https://static.inaturalist.org/photos/112919359/medium.jpeg,,1,0,FALSE,"Alameda County, CA, USA",37.62519167,-122.0273667,5,,,Alameda,Rosilla,Helenium puberulum,Rosilla,Plantae,53092,Asteraceae,Helenium,Helenium puberulum
67325452,12/30/20,2020-12-30 07:03:51 UTC,UTC,research,https://www.inaturalist.org/observations/67325452,https://static.inaturalist.org/photos/108757614/medium.jpg,,1,0,FALSE,"Hayward, CA, US",37.64426236,-122.0066192,76,,Hayward,Alameda,,Centaurea calcitrapa,purple star-thistle,Plantae,56865,Asteraceae,Centaurea,Centaurea calcitrapa
67686533,1/3/21,2021-01-04 00:57:18 UTC,Hawaii,research,https://www.inaturalist.org/observations/67686533,https://inaturalist-open-data.s3.amazonaws.com/photos/109422583/medium.jpg,Smelled pretty peppery  not pictured: small yellowgreen fruits nearby! ,1,0,FALSE,"Garin & Dry Creek Pioneer Regional Parks, Hayward, CA, US",37.64642167,-122.0411138,10,,,Alameda,California bay,Umbellularia californica,California bay,Plantae,48807,Lauraceae,Umbellularia,Umbellularia californica
69755457,2/3/21,2021-02-03 17:17:53 UTC,UTC,research,https://www.inaturalist.org/observations/69755457,https://inaturalist-open-data.s3.amazonaws.com/photos/113261452/medium.jpg,,1,0,FALSE,"Garin & Dry Creek Pioneer Regional Parks, Hayward, CA, US",37.64715333,-122.0423055,11,,,Alameda,wavy-leafed soap plant,Chlorogalum pomeridianum,wavy-leafed soap plant,Plantae,47597,Asparagaceae,Chlorogalum,Chlorogalum pomeridianum
69075486,2/4/21,2021-02-04 15:23:43 UTC,UTC,research,https://www.inaturalist.org/observations/69075486,https://inaturalist-open-data.s3.amazonaws.com/photos/112003440/medium.jpg,,2,0,FALSE,"Garin & Dry Creek Pioneer Regional Parks, Hayward, CA, US",37.64706167,-122.040375,25,,,Alameda,California bay,Umbellularia californica,California bay,Plantae,48807,Lauraceae,Umbellularia,Umbellularia californica
69075521,2/4/21,2021-02-04 15:52:28 UTC,UTC,research,https://www.inaturalist.org/observations/69075521,https://inaturalist-open-data.s3.amazonaws.com/photos/112003471/medium.jpg,,1,0,FALSE,"Garin & Dry Creek Pioneer Regional Parks, Hayward, CA, US",37.64720333,-122.042175,15,,,Alameda,wavy-leafed soap plant,Chlorogalum pomeridianum,wavy-leafed soap plant,Plantae,47597,Asparagaceae,Chlorogalum,Chlorogalum pomeridianum
69707479,2/16/21,2021-02-16 13:47:22 UTC,UTC,research,https://www.inaturalist.org/observations/69707479,https://static.inaturalist.org/photos/113167264/medium.jpg,,1,0,FALSE,"Garin & Dry Creek Pioneer Regional Parks, Hayward, CA, US",37.64548833,-122.0318083,9,,Hayward,Alameda,milkmaids,Cardamine californica,milkmaids,Plantae,49651,Brassicaceae,Cardamine,Cardamine californica
69899224,2/20/21,2021-02-20 15:40:28 UTC,UTC,research,https://www.inaturalist.org/observations/69899224,https://static.inaturalist.org/photos/113530744/medium.jpeg,,1,0,FALSE,"Mission - Garin, Hayward, CA, USA",37.6465639,-122.0428694,,,,Alameda,Pacific hound's tongue,Adelinia grande,Pacific hound's tongue,Plantae,769151,Boraginaceae,Adelinia,Adelinia grande
69899258,2/20/21,2021-02-20 15:50:02 UTC,UTC,research,https://www.inaturalist.org/observations/69899258,https://static.inaturalist.org/photos/113530761/medium.jpeg,,2,0,FALSE,"Mission - Garin, Hayward, CA, USA",37.6459235,-122.0395328,,,,Alameda,checker lily,Fritillaria affinis,checker lily,Plantae,50618,Liliaceae,Fritillaria,Fritillaria affinis
70012642,2/22/21,2021-02-22 23:56:52 UTC,Pacific Time (US & Canada),research,https://www.inaturalist.org/observations/70012642,https://inaturalist-open-data.s3.amazonaws.com/photos/113735686/medium.jpg,CA Poppy with flower,1,0,FALSE,"Garin & Dry Creek Pioneer Regional Parks, Hayward, CA, US",37.62644447,-122.0287833,24,,,Alameda,California poppy,Eschscholzia californica,California poppy,Plantae,48225,Papaveraceae,Eschscholzia,Eschscholzia californica
70013673,2/22/21,2021-02-23 00:12:55 UTC,Pacific Time (US & Canada),research,https://www.inaturalist.org/observations/70013673,https://inaturalist-open-data.s3.amazonaws.com/photos/113737945/medium.jpg,Five to seven ,1,0,FALSE,"Garin & Dry Creek Pioneer Regional Parks, Hayward, CA, US",37.62416626,-122.0281789,24,,,Alameda,California buckeye,Aesculus californica,California buckeye,Plantae,53348,Sapindaceae,Aesculus,Aesculus californica
71188786,3/13/21,2021-03-13 14:22:01 UTC,UTC,research,https://www.inaturalist.org/observations/71188786,https://inaturalist-open-data.s3.amazonaws.com/photos/115862423/medium.jpeg,,1,0,FALSE,"Hayward, CA 94544, USA",37.62471389,-122.02835,,,,Alameda,Abrojo europeo,Helminthotheca echioides,bristly oxtongue,Plantae,61906,Asteraceae,Helminthotheca,Helminthotheca echioides
71188802,3/13/21,2021-03-13 14:22:01 UTC,UTC,research,https://www.inaturalist.org/observations/71188802,https://inaturalist-open-data.s3.amazonaws.com/photos/115862444/medium.jpeg,,1,0,FALSE,"Hayward, CA 94544, USA",37.62471389,-122.02835,,,,Alameda,Pacific poison oak,Toxicodendron diversilobum,Pacific poison oak,Plantae,51080,Anacardiaceae,Toxicodendron,Toxicodendron diversilobum
71188928,3/13/21,2021-03-13 16:48:09 UTC,UTC,research,https://www.inaturalist.org/observations/71188928,https://inaturalist-open-data.s3.amazonaws.com/photos/115862644/medium.jpeg,,1,0,FALSE,"Hayward, CA 94544, USA",37.62704167,-122.0286028,,,,Alameda,Common Mallow,Malva sylvestris,Common Mallow,Plantae,56162,Malvaceae,Malva,Malva sylvestris
71241231,3/14/21,2021-03-14 19:47:56 UTC,Pacific Time (US & Canada),research,https://www.inaturalist.org/observations/71241231,https://inaturalist-open-data.s3.amazonaws.com/photos/116009946/medium.jpg,,1,0,FALSE,"Garin & Dry Creek Pioneer Regional Parks, Hayward, CA, US",37.64675759,-122.0377733,6,,Hayward,Alameda,Pacific poison oak,Toxicodendron diversilobum,Pacific poison oak,Plantae,51080,Anacardiaceae,Toxicodendron,Toxicodendron diversilobum
71252463,3/14/21,2021-03-14 19:53:12 UTC,Pacific Time (US & Canada),research,https://www.inaturalist.org/observations/71252463,https://inaturalist-open-data.s3.amazonaws.com/photos/116009998/medium.jpg,,1,0,FALSE,"Garin & Dry Creek Pioneer Regional Parks, Hayward, CA, US",37.6470857,-122.0404765,6,,,Alameda,Pacific Sanicle,Sanicula crassicaulis,Pacific Sanicle,Plantae,53201,Apiaceae,Sanicula,Sanicula crassicaulis
118668016,3/16/21,2021-03-16 17:00:32 UTC,Pacific Time (US & Canada),research,https://www.inaturalist.org/observations/118668016,https://inaturalist-open-data.s3.amazonaws.com/photos/200523891/medium.jpg,,2,0,FALSE,"Garin/Dry Creek Regional Park, Alameda County, US-CA, US",37.62450403,-122.0279139,49,,,Alameda,California buckeye,Aesculus californica,California buckeye,Plantae,53348,Sapindaceae,Aesculus,Aesculus californica
71568697,3/19/21,2021-03-19 20:08:38 UTC,Pacific Time (US & Canada),research,https://www.inaturalist.org/observations/71568697,https://inaturalist-open-data.s3.amazonaws.com/photos/116541081/medium.jpg,,2,0,FALSE,"Hayward, CA, US",37.64335241,-122.0058661,5,,Hayward,Alameda,Sun Cup,Taraxia ovata,Sun Cup,Plantae,68182,Onagraceae,Taraxia,Taraxia ovata
71603127,3/19/21,2021-03-19 19:11:37 UTC,Pacific Time (US & Canada),research,https://www.inaturalist.org/observations/71603127,https://static.inaturalist.org/photos/116603692/medium.jpeg,,1,0,FALSE,"Hayward, CA 94544, USA",37.62621297,-122.029483,,,,Alameda,Gray Mule-Ears,Wyethia helenioides,Gray Mule-Ears,Plantae,50799,Asteraceae,Wyethia,Wyethia helenioides
71799891,3/21/21,2021-03-22 01:13:25 UTC,Pacific Time (US & Canada),research,https://www.inaturalist.org/observations/71799891,https://inaturalist-open-data.s3.amazonaws.com/photos/116955935/medium.jpg,,1,0,FALSE,"Garin & Dry Creek Pioneer Regional Parks, Hayward, CA, US",37.646125,-122.0363833,14,,Hayward,Alameda,bigleaf maple,Acer macrophyllum,bigleaf maple,Plantae,48227,Sapindaceae,Acer,Acer macrophyllum
71800028,3/21/21,2021-03-22 00:16:39 UTC,Pacific Time (US & Canada),research,https://www.inaturalist.org/observations/71800028,https://inaturalist-open-data.s3.amazonaws.com/photos/116956090/medium.jpg,,4,1,FALSE,"Garin & Dry Creek Pioneer Regional Parks, Hayward, CA, US",37.64291167,-122.0302362,25,,Hayward,Alameda,giant wakerobin,Trillium chloropetalum,giant wakerobin,Plantae,50823,Melanthiaceae,Trillium,Trillium chloropetalum
71800135,3/21/21,2021-03-22 00:14:10 UTC,Pacific Time (US & Canada),research,https://www.inaturalist.org/observations/71800135,https://inaturalist-open-data.s3.amazonaws.com/photos/116956261/medium.jpg,,1,0,FALSE,"Garin & Dry Creek Pioneer Regional Parks, Hayward, CA, US",37.642895,-122.031075,40,,Hayward,Alameda,star-flowered lily-of-the-valley,Maianthemum stellatum,star-flowered lily-of-the-valley,Plantae,53268,Asparagaceae,Maianthemum,Maianthemum stellatum
71800432,3/21/21,2021-03-22 01:05:57 UTC,Pacific Time (US & Canada),research,https://www.inaturalist.org/observations/71800432,https://inaturalist-open-data.s3.amazonaws.com/photos/116956776/medium.jpg,,1,0,FALSE,"Garin & Dry Creek Pioneer Regional Parks, Hayward, CA, US",37.64695,-122.0395805,62,,,Alameda,Pacific hound's tongue,Adelinia grande,Pacific hound's tongue,Plantae,769151,Boraginaceae,Adelinia,Adelinia grande
72312039,3/28/21,2021-03-28 21:16:16 UTC,Pacific Time (US & Canada),research,https://www.inaturalist.org/observations/72312039,https://static.inaturalist.org/photos/117874611/medium.jpg,,1,0,FALSE,"Hayward, CA, US",37.645095,-122.0117722,4,,Hayward,Alameda,Sun Cup,Taraxia ovata,Sun Cup,Plantae,68182,Onagraceae,Taraxia,Taraxia ovata
73156101,4/6/21,2021-04-06 18:58:08 UTC,Pacific Time (US & Canada),research,https://www.inaturalist.org/observations/73156101,https://inaturalist-open-data.s3.amazonaws.com/photos/119399843/medium.jpg,,1,0,FALSE,"Garin & Dry Creek Pioneer Regional Parks, Hayward, CA, US",37.63951333,-122.0335472,,,,Alameda,Blue Dicks,Dipterostemon capitatus,Blue Dicks,Plantae,1196784,Asparagaceae,Dipterostemon,Dipterostemon capitatus
73156313,4/6/21,2021-04-06 22:06:17 UTC,Pacific Time (US & Canada),research,https://www.inaturalist.org/observations/73156313,https://inaturalist-open-data.s3.amazonaws.com/photos/119400270/medium.jpg,,1,0,FALSE,"Garin & Dry Creek Pioneer Regional Parks, Union City, CA, US",37.629845,-122.028825,,,,Alameda,western blue-eyed grass,Sisyrinchium bellum,western blue-eyed grass,Plantae,49918,Iridaceae,Sisyrinchium,Sisyrinchium bellum
74011198,4/14/21,2021-04-15 00:34:52 UTC,Pacific Time (US & Canada),research,https://www.inaturalist.org/observations/74011198,https://inaturalist-open-data.s3.amazonaws.com/photos/120912258/medium.jpg,,1,0,FALSE,"Garin & Dry Creek Pioneer Regional Parks, Hayward, CA, US",37.64732786,-122.0395163,39,,Hayward,Alameda,Common Vetch,Vicia sativa,Common Vetch,Plantae,53324,Fabaceae,Vicia,Vicia sativa
74011769,4/14/21,2021-04-15 00:28:24 UTC,Pacific Time (US & Canada),research,https://www.inaturalist.org/observations/74011769,https://inaturalist-open-data.s3.amazonaws.com/photos/120913615/medium.jpg,,1,0,FALSE,"Garin & Dry Creek Pioneer Regional Parks, Hayward, CA, US",37.64713281,-122.0385689,19,,Hayward,Alameda,Mediterranean Stork's-bill,Erodium botrys,Mediterranean Stork's-bill,Plantae,57090,Geraniaceae,Erodium,Erodium botrys
74012023,4/14/21,2021-04-15 00:21:34 UTC,Pacific Time (US & Canada),research,https://www.inaturalist.org/observations/74012023,https://inaturalist-open-data.s3.amazonaws.com/photos/120914058/medium.jpg,,2,0,FALSE,"Garin & Dry Creek Pioneer Regional Parks, Hayward, CA, US",37.6469989,-122.0386555,19,,Hayward,Alameda,Shepherd's-needle,Scandix pecten-veneris,Shepherd's-needle,Plantae,56843,Apiaceae,Scandix,Scandix pecten-veneris
75383042,4/26/21,2021-04-27 01:29:29 UTC,Pacific Time (US & Canada),research,https://www.inaturalist.org/observations/75383042,https://inaturalist-open-data.s3.amazonaws.com/photos/123325177/medium.jpeg,,1,0,FALSE,"Mission - Garin, Hayward, CA, USA",37.64651701,-122.042015,7,,,Alameda,western columbine,Aquilegia formosa,western columbine,Plantae,48244,Ranunculaceae,Aquilegia,Aquilegia formosa
75386338,4/26/21,2021-04-27 01:33:40 UTC,Pacific Time (US & Canada),research,https://www.inaturalist.org/observations/75386338,https://inaturalist-open-data.s3.amazonaws.com/photos/123325280/medium.jpeg,,2,0,FALSE,"Mission - Garin, Hayward, CA, USA",37.64640294,-122.0400322,15,,,Alameda,Solomon's plume,Maianthemum racemosum amplexicaule,western Solomon's plume,Plantae,53012,Asparagaceae,Maianthemum,Maianthemum racemosum
75386355,4/26/21,2021-04-27 01:34:52 UTC,Pacific Time (US & Canada),research,https://www.inaturalist.org/observations/75386355,https://inaturalist-open-data.s3.amazonaws.com/photos/123325316/medium.jpeg,,1,0,FALSE,"Garin/Dry Creek Regional Park, Alameda County, US-CA, US",37.6465044,-122.0392262,9,,,Alameda,Ocean spray,Holodiscus discolor,Ocean spray,Plantae,53414,Rosaceae,Holodiscus,Holodiscus discolor
75386786,4/26/21,2021-04-27 01:42:52 UTC,Pacific Time (US & Canada),research,https://www.inaturalist.org/observations/75386786,https://inaturalist-open-data.s3.amazonaws.com/photos/123326235/medium.jpeg,,1,0,FALSE,"Garin/Dry Creek Regional Park, Alameda County, US-CA, US",37.6459047,-122.0354917,8,,Hayward,Alameda,thimbleberry,Rubus parviflorus,thimbleberry,Plantae,51646,Rosaceae,Rubus,Rubus parviflorus
76412442,4/30/21,2021-04-30 10:39:00 UTC,UTC,research,https://www.inaturalist.org/observations/76412442,https://inaturalist-open-data.s3.amazonaws.com/photos/124995794/medium.jpg,Probably Thalictrum fendleri var. polycarpum.,1,0,FALSE,"Garin Regional Park, Hayward, CA, USA",37.64318553,-122.03798,,,,Alameda,Fendler's Meadow-rue,Thalictrum fendleri,Fendler's Meadow-rue,Plantae,53299,Ranunculaceae,Thalictrum,Thalictrum fendleri
76318469,5/1/21,2021-05-01 17:44:08 UTC,Pacific Time (US & Canada),research,https://www.inaturalist.org/observations/76318469,https://static.inaturalist.org/photos/124843666/medium.jpg,,1,0,FALSE,"Garin & Dry Creek Pioneer Regional Parks, Union City, CA, US",37.63524667,-122.0113056,662,,,Alameda,purple salsify,Tragopogon porrifolius,purple salsify,Plantae,54141,Asteraceae,Tragopogon,Tragopogon porrifolius
76528991,5/1/21,2021-05-01 08:36:00 UTC,UTC,research,https://www.inaturalist.org/observations/76528991,https://inaturalist-open-data.s3.amazonaws.com/photos/125179249/medium.jpg,,1,0,FALSE,"Alameda County, CA, USA",37.62542108,-122.0278135,8,,,Alameda,purple salsify,Tragopogon porrifolius,purple salsify,Plantae,54141,Asteraceae,Tragopogon,Tragopogon porrifolius
76708722,5/2/21,2021-05-02 08:55:00 UTC,UTC,research,https://www.inaturalist.org/observations/76708722,https://inaturalist-open-data.s3.amazonaws.com/photos/125459254/medium.jpg,,1,0,FALSE,"Garin Regional Park, Hayward, CA, USA",37.63632778,-122.0351583,,,,Alameda,bird's-foot trefoil,Lotus corniculatus,bird's-foot trefoil,Plantae,47435,Fabaceae,Lotus,Lotus corniculatus
77552255,5/5/21,2021-05-05 23:49:27 UTC,Pacific Time (US & Canada),research,https://www.inaturalist.org/observations/77552255,https://inaturalist-open-data.s3.amazonaws.com/photos/126842331/medium.jpg,,2,0,FALSE,"Ziele Creek Trail, Hayward, CA, US",37.64769667,-122.0431278,4,,,Alameda,White Globe Lily,Calochortus albus,White Globe Lily,Plantae,51315,Liliaceae,Calochortus,Calochortus albus
77552454,5/5/21,2021-05-05 23:48:56 UTC,Pacific Time (US & Canada),research,https://www.inaturalist.org/observations/77552454,https://inaturalist-open-data.s3.amazonaws.com/photos/126842509/medium.jpg,,1,0,FALSE,"Ziele Creek Trail, Hayward, CA, US",37.64773,-122.0431667,5,,,Alameda,western blue-eyed grass,Sisyrinchium bellum,western blue-eyed grass,Plantae,49918,Iridaceae,Sisyrinchium,Sisyrinchium bellum
79328415,5/18/21,2021-05-18 19:54:56 UTC,Pacific Time (US & Canada),research,https://www.inaturalist.org/observations/79328415,https://static.inaturalist.org/photos/129925972/medium.jpg,,1,0,FALSE,"Garin & Dry Creek Pioneer Regional Parks, Hayward, CA, US",37.64623667,-122.041825,6,,,Alameda,western columbine,Aquilegia formosa,western columbine,Plantae,48244,Ranunculaceae,Aquilegia,Aquilegia formosa
79356491,5/18/21,2021-05-18 23:37:37 UTC,Pacific Time (US & Canada),research,https://www.inaturalist.org/observations/79356491,https://inaturalist-open-data.s3.amazonaws.com/photos/129977828/medium.jpg,,1,0,FALSE,"Garin & Dry Creek Pioneer Regional Parks, Hayward, CA, US",37.646525,-122.0408167,10,,,Alameda,western columbine,Aquilegia formosa,western columbine,Plantae,48244,Ranunculaceae,Aquilegia,Aquilegia formosa
79356673,5/18/21,2021-05-18 23:35:01 UTC,Pacific Time (US & Canada),research,https://www.inaturalist.org/observations/79356673,https://inaturalist-open-data.s3.amazonaws.com/photos/129978249/medium.jpg,,2,0,FALSE,"Garin & Dry Creek Pioneer Regional Parks, Hayward, CA, US",37.6468,-122.0427472,15,,,Alameda,Maianthemum racemosum amplexicaule,Maianthemum racemosum amplexicaule,western Solomon's plume,Plantae,53012,Asparagaceae,Maianthemum,Maianthemum racemosum
79356837,5/18/21,2021-05-18 23:33:36 UTC,Pacific Time (US & Canada),research,https://www.inaturalist.org/observations/79356837,https://inaturalist-open-data.s3.amazonaws.com/photos/129978569/medium.jpg,,3,0,FALSE,"Garin & Dry Creek Pioneer Regional Parks, Hayward, CA, US",37.646825,-122.0431583,7,,,Alameda,White Globe Lily,Calochortus albus,White Globe Lily,Plantae,51315,Liliaceae,Calochortus,Calochortus albus
79356847,5/18/21,2021-05-18 23:25:25 UTC,Pacific Time (US & Canada),research,https://www.inaturalist.org/observations/79356847,https://inaturalist-open-data.s3.amazonaws.com/photos/129978591/medium.jpg,,1,0,FALSE,"Garin & Dry Creek Pioneer Regional Parks, Hayward, CA, US",37.64695833,-122.0420222,9,,,Alameda,Common Snowberry,Symphoricarpos albus,Common Snowberry,Plantae,48523,Caprifoliaceae,Symphoricarpos,Symphoricarpos albus
93228213,6/12/21,2021-06-12 17:56:23 UTC,Pacific Time (US & Canada),research,https://www.inaturalist.org/observations/93228213,https://static.inaturalist.org/photos/154487752/medium.jpeg,,1,0,FALSE,"Garin/Dry Creek Regional Park, Alameda County, US-CA, US",37.62506788,-122.0271209,9,,,Alameda, ,Ceratophyllum demersum,coontail,Plantae,60997,Ceratophyllaceae,Ceratophyllum,Ceratophyllum demersum
93228224,6/12/21,2021-06-12 18:27:05 UTC,Pacific Time (US & Canada),research,https://www.inaturalist.org/observations/93228224,https://static.inaturalist.org/photos/154487790/medium.jpeg,,1,0,FALSE,"Garin/Dry Creek Regional Park, Alameda County, US-CA, US",37.62421477,-122.0265073,8,,,Alameda,ruby chalice clarkia,Clarkia rubicunda,ruby chalice clarkia,Plantae,57148,Onagraceae,Clarkia,Clarkia rubicunda
83433847,6/17/21,2021-06-17 11:20:00 UTC,UTC,research,https://www.inaturalist.org/observations/83433847,https://inaturalist-open-data.s3.amazonaws.com/photos/137027806/medium.jpg,,2,0,FALSE,"Mission - Garin, Hayward, CA, USA",37.64655833,-122.0422333,,,,Alameda,forest scurfpea,Rupertia physodes,forest scurfpea,Plantae,53198,Fabaceae,Rupertia,Rupertia physodes
83962554,6/19/21,2021-06-20 03:31:01 UTC,Pacific Time (US & Canada),research,https://www.inaturalist.org/observations/83962554,https://static.inaturalist.org/photos/137947173/medium.jpg,,1,0,FALSE,"Hayward, CA, US",37.64460833,-122.0091556,5,,Hayward,Alameda,Ocean spray,Holodiscus discolor,Ocean spray,Plantae,53414,Rosaceae,Holodiscus,Holodiscus discolor
84768243,6/27/21,2021-06-27 16:35:36 UTC,Pacific Time (US & Canada),research,https://www.inaturalist.org/observations/84768243,https://inaturalist-open-data.s3.amazonaws.com/photos/139358867/medium.jpeg,,1,0,FALSE,"Mission - Garin, Hayward, CA, USA",37.63664444,-122.0361389,,,,Alameda,Artichoke Thistle,Cynara cardunculus,Artichoke Thistle,Plantae,57563,Asteraceae,Cynara,Cynara cardunculus
84768497,6/27/21,2021-06-27 16:30:26 UTC,Pacific Time (US & Canada),research,https://www.inaturalist.org/observations/84768497,https://inaturalist-open-data.s3.amazonaws.com/photos/139359277/medium.jpeg,,1,0,FALSE,"Hayward, CA 94544, USA",37.63590556,-122.033425,,,,Alameda,liseron des champs,Convolvulus arvensis,field bindweed,Plantae,53021,Convolvulaceae,Convolvulus,Convolvulus arvensis
84768559,6/27/21,2021-06-27 16:10:43 UTC,Pacific Time (US & Canada),research,https://www.inaturalist.org/observations/84768559,https://inaturalist-open-data.s3.amazonaws.com/photos/139359431/medium.jpeg,,1,0,FALSE,"Hayward, CA 94544, USA",37.63257778,-122.0237389,,,,Alameda,purple salsify,Tragopogon porrifolius,purple salsify,Plantae,54141,Asteraceae,Tragopogon,Tragopogon porrifolius
85514939,7/3/21,2021-07-03 18:38:43 UTC,Pacific Time (US & Canada),research,https://www.inaturalist.org/observations/85514939,https://inaturalist-open-data.s3.amazonaws.com/photos/140709500/medium.jpg,,1,0,FALSE,"Garin & Dry Creek Pioneer Regional Parks, Hayward, CA, US",37.64600333,-122.0346612,7,,Hayward,Alameda,California Spikenard,Aralia californica,California Spikenard,Plantae,52848,Araliaceae,Aralia,Aralia californica
85515174,7/3/21,2021-07-03 17:40:11 UTC,Pacific Time (US & Canada),research,https://www.inaturalist.org/observations/85515174,https://inaturalist-open-data.s3.amazonaws.com/photos/140709691/medium.jpg,,1,0,FALSE,"Garin & Dry Creek Pioneer Regional Parks, Union City, CA, US",37.63014167,-122.0282278,5,,,Alameda,western sycamore,Platanus racemosa,western sycamore,Plantae,58231,Platanaceae,Platanus,Platanus racemosa
86877577,7/9/21,2021-07-09 17:07:01 UTC,Pacific Time (US & Canada),research,https://www.inaturalist.org/observations/86877577,https://inaturalist-open-data.s3.amazonaws.com/photos/143196481/medium.jpeg,,2,0,FALSE,"Hayward, CA 94544, USA",37.634975,-122.0244803,,,,Alameda,blue elder,Sambucus cerulea,blue elder,Plantae,143799,Viburnaceae,Sambucus,Sambucus cerulea
86505119,7/10/21,2021-07-10 19:43:29 UTC,Pacific Time (US & Canada),research,https://www.inaturalist.org/observations/86505119,https://static.inaturalist.org/photos/142517111/medium.jpeg,,1,0,FALSE,"Hayward, CA 94544, USA",37.62885256,-122.0287095,46,,,Alameda,Plume Albizia,Paraserianthes lophantha,Plume Albizia,Plantae,139851,Fabaceae,Paraserianthes,Paraserianthes lophantha
86663359,7/11/21,2021-07-11 18:00:20 UTC,Pacific Time (US & Canada),research,https://www.inaturalist.org/observations/86663359,https://inaturalist-open-data.s3.amazonaws.com/photos/143072319/medium.jpg,,1,0,FALSE,"Garin/Dry Creek Regional Park, Alameda County, US-CA, US",37.64669677,-122.0394888,5,,,Alameda,wild strawberry,Fragaria vesca,woodland strawberry,Plantae,50298,Rosaceae,Fragaria,Fragaria vesca
86663781,7/11/21,2021-07-11 18:38:13 UTC,Pacific Time (US & Canada),research,https://www.inaturalist.org/observations/86663781,https://inaturalist-open-data.s3.amazonaws.com/photos/142806685/medium.jpg,,2,0,FALSE,"Garin & Dry Creek Pioneer Regional Parks, Hayward, CA, US",37.64595333,-122.0332862,6,,Hayward,Alameda,red baneberry,Actaea rubra,red baneberry,Plantae,49870,Ranunculaceae,Actaea,Actaea rubra
91065440,8/2/21,2021-08-03 00:01:00 UTC,Pacific Time (US & Canada),research,https://www.inaturalist.org/observations/91065440,https://inaturalist-open-data.s3.amazonaws.com/photos/150573564/medium.jpeg,,1,0,FALSE,"Hayward, CA, USA",37.64490833,-122.0087889,4,,Hayward,Alameda,Pennyroyal,Mentha pulegium,Pennyroyal,Plantae,57116,Lamiaceae,Mentha,Mentha pulegium
96498289,9/14/21,2021-09-14 18:15:00 UTC,Pacific Time (US & Canada),research,https://www.inaturalist.org/observations/96498289,https://inaturalist-open-data.s3.amazonaws.com/photos/160127849/medium.jpg,,1,0,FALSE,"Garin/Dry Creek Regional Park, Alameda, California, United States",37.62959397,-122.028177,,,,Alameda,Pacific poison oak,Toxicodendron diversilobum,Pacific poison oak,Plantae,51080,Anacardiaceae,Toxicodendron,Toxicodendron diversilobum
96498302,9/14/21,2021-09-14 19:26:00 UTC,Pacific Time (US & Canada),research,https://www.inaturalist.org/observations/96498302,https://inaturalist-open-data.s3.amazonaws.com/photos/160128252/medium.jpg,,1,0,FALSE,"Garin/Dry Creek Regional Park, Alameda, California, United States",37.62429997,-122.027479,,,,Alameda,rough cocklebur,Xanthium strumarium,rough cocklebur,Plantae,57920,Asteraceae,Xanthium,Xanthium strumarium
96498303,9/14/21,2021-09-14 19:28:00 UTC,Pacific Time (US & Canada),research,https://www.inaturalist.org/observations/96498303,https://inaturalist-open-data.s3.amazonaws.com/photos/160128430/medium.jpg,,1,0,FALSE,"Garin/Dry Creek Regional Park, Alameda, California, United States",37.624313,-122.027493,,,,Alameda,Himalayan Blackberry,Rubus bifrons,Himalayan Blackberry,Plantae,168025,Rosaceae,Rubus,Rubus bifrons
96498304,9/14/21,2021-09-14 19:34:00 UTC,Pacific Time (US & Canada),research,https://www.inaturalist.org/observations/96498304,https://inaturalist-open-data.s3.amazonaws.com/photos/160128556/medium.jpg,,1,0,FALSE,"Garin/Dry Creek Regional Park, Alameda, California, United States",37.62483697,-122.028261,,,,Alameda,California bay,Umbellularia californica,California bay,Plantae,48807,Lauraceae,Umbellularia,Umbellularia californica
96498319,9/14/21,2021-09-14 19:39:00 UTC,Pacific Time (US & Canada),research,https://www.inaturalist.org/observations/96498319,https://inaturalist-open-data.s3.amazonaws.com/photos/160128604/medium.jpg,,1,0,FALSE,"Garin/Dry Creek Regional Park, Alameda, California, United States",37.625115,-122.028569,,,,Alameda,giant reed,Arundo donax,giant reed,Plantae,64017,Poaceae,Arundo,Arundo donax
96498325,9/14/21,2021-09-14 18:15:00 UTC,Pacific Time (US & Canada),research,https://www.inaturalist.org/observations/96498325,https://inaturalist-open-data.s3.amazonaws.com/photos/160127797/medium.jpg,,1,0,FALSE,"Garin/Dry Creek Regional Park, Alameda, California, United States",37.629589,-122.028176,,,,Alameda,trailing blackberry,Rubus ursinus,trailing blackberry,Plantae,53445,Rosaceae,Rubus,Rubus ursinus
102856109,11/23/21,2021-11-24 00:13:00 UTC,Pacific Time (US & Canada),research,https://www.inaturalist.org/observations/102856109,https://inaturalist-open-data.s3.amazonaws.com/photos/172026147/medium.jpeg,,1,0,FALSE,"Alameda County, CA, USA",37.63535556,-122.0311139,6,,,Alameda,Artichoke Thistle,Cynara cardunculus,Artichoke Thistle,Plantae,57563,Asteraceae,Cynara,Cynara cardunculus
103379820,12/20/21,2021-12-20 18:59:58 UTC,Pacific Time (US & Canada),research,https://www.inaturalist.org/observations/103379820,https://inaturalist-open-data.s3.amazonaws.com/photos/173022499/medium.jpg,,1,0,FALSE,"Garin/Dry Creek Regional Park, Alameda County, US-CA, US",37.62668356,-122.0287298,1028,,,Alameda,California poppy,Eschscholzia californica,California poppy,Plantae,48225,Papaveraceae,Eschscholzia,Eschscholzia californica
103503184,12/22/21,2021-12-22 22:53:56 UTC,Pacific Time (US & Canada),research,https://www.inaturalist.org/observations/103503184,https://inaturalist-open-data.s3.amazonaws.com/photos/173243315/medium.jpg,,1,0,FALSE,"Garin/Dry Creek Regional Park, Alameda County, US-CA, US",37.63611985,-122.0288342,16,,,Alameda,Coyote Mint,Monardella villosa,Coyote Mint,Plantae,52181,Lamiaceae,Monardella,Monardella villosa
104048219,12/28/21,2021-12-28 20:21:00 UTC,Pacific Time (US & Canada),research,https://www.inaturalist.org/observations/104048219,https://inaturalist-open-data.s3.amazonaws.com/photos/174287784/medium.jpeg,,1,0,FALSE,"Alameda County, CA, USA",37.62933333,-122.0240333,6,,,Alameda,cardo mariano,Silybum marianum,milk thistle,Plantae,52586,Asteraceae,Silybum,Silybum marianum
105874552,1/30/22,2022-01-30 18:27:00 UTC,Pacific Time (US & Canada),research,https://www.inaturalist.org/observations/105874552,https://inaturalist-open-data.s3.amazonaws.com/photos/177743443/medium.jpg,,1,0,FALSE,Garin Regional Park,37.62424833,-122.026705,,,,Alameda,Cretan Tree-mallow,Malva multiflora,Cretan mallow,Plantae,501208,Malvaceae,Malva,Malva multiflora
105874567,1/30/22,2022-01-30 20:18:00 UTC,Pacific Time (US & Canada),research,https://www.inaturalist.org/observations/105874567,https://inaturalist-open-data.s3.amazonaws.com/photos/177743503/medium.jpg,,2,0,FALSE,Garin Regional Park,37.63538667,-122.031105,,,,Alameda,cardo de huerta,Cynara cardunculus,Artichoke Thistle,Plantae,57563,Asteraceae,Cynara,Cynara cardunculus
105874568,1/30/22,2022-01-30 20:28:00 UTC,Pacific Time (US & Canada),research,https://www.inaturalist.org/observations/105874568,https://inaturalist-open-data.s3.amazonaws.com/photos/177743507/medium.jpg,,1,0,FALSE,Garin Regional Park,37.63759,-122.035875,,,,Alameda,scarlet pimpernel,Lysimachia arvensis,scarlet pimpernel,Plantae,791928,Primulaceae,Lysimachia,Lysimachia arvensis
105874570,1/30/22,2022-01-30 20:29:00 UTC,Pacific Time (US & Canada),research,https://www.inaturalist.org/observations/105874570,https://inaturalist-open-data.s3.amazonaws.com/photos/177743516/medium.jpg,,1,0,FALSE,Garin Regional Park,37.637585,-122.0359117,,,,Alameda,California sagebrush,Artemisia californica,California sagebrush,Plantae,53357,Asteraceae,Artemisia,Artemisia californica
105874573,1/30/22,2022-01-30 20:30:00 UTC,Pacific Time (US & Canada),research,https://www.inaturalist.org/observations/105874573,https://inaturalist-open-data.s3.amazonaws.com/photos/177743527/medium.jpg,,1,0,FALSE,Garin Regional Park,37.63764,-122.03602,,,,Alameda,California poppy,Eschscholzia californica,California poppy,Plantae,48225,Papaveraceae,Eschscholzia,Eschscholzia californica
105874577,1/30/22,2022-01-30 20:48:00 UTC,Pacific Time (US & Canada),research,https://www.inaturalist.org/observations/105874577,https://inaturalist-open-data.s3.amazonaws.com/photos/177743537/medium.jpg,,1,0,FALSE,Garin Regional Park,37.64186,-122.0397833,,,,Alameda,Shining Pepperweed,Lepidium nitidum,Shining Pepperweed,Plantae,47202,Brassicaceae,Lepidium,Lepidium nitidum
105874578,1/30/22,2022-01-30 20:51:00 UTC,Pacific Time (US & Canada),research,https://www.inaturalist.org/observations/105874578,https://inaturalist-open-data.s3.amazonaws.com/photos/177743543/medium.jpg,,1,0,FALSE,Garin Regional Park,37.64217,-122.0388633,,,,Alameda,milkmaids,Cardamine californica,milkmaids,Plantae,49651,Brassicaceae,Cardamine,Cardamine californica
105874580,1/30/22,2022-01-30 21:38:00 UTC,Pacific Time (US & Canada),research,https://www.inaturalist.org/observations/105874580,https://inaturalist-open-data.s3.amazonaws.com/photos/177743556/medium.jpg,,1,0,FALSE,Garin Regional Park,37.64656333,-122.039895,,,,Alameda,crevice alumroot,Heuchera micrantha,crevice alumroot,Plantae,51274,Saxifragaceae,Heuchera,Heuchera micrantha
105874584,1/30/22,2022-01-30 21:48:00 UTC,Pacific Time (US & Canada),research,https://www.inaturalist.org/observations/105874584,https://inaturalist-open-data.s3.amazonaws.com/photos/177743562/medium.jpg,,1,0,FALSE,Garin Regional Park,37.64636333,-122.0382133,,,Hayward,Alameda,broadleaf forget-me-not,Myosotis latifolia,broadleaf forget-me-not,Plantae,49132,Boraginaceae,Myosotis,Myosotis latifolia
106643472,2/11/22,2022-02-11 12:17:57 UTC,UTC,research,https://www.inaturalist.org/observations/106643472,https://static.inaturalist.org/photos/179189074/medium.jpg,,2,0,FALSE,"Union City, CA, US",37.62092343,-121.9661789,630,,,Alameda,Bermuda buttercup,Oxalis pes-caprae,Bermuda buttercup,Plantae,53169,Oxalidaceae,Oxalis,Oxalis pes-caprae
108066399,3/6/22,2022-03-06 22:44:50 UTC,Pacific Time (US & Canada),research,https://www.inaturalist.org/observations/108066399,https://inaturalist-open-data.s3.amazonaws.com/photos/181873905/medium.jpeg,,1,0,FALSE,"Hayward, CA 94552, USA",37.64158199,-122.0090475,5,,Hayward,Alameda,Rosy Sandcrocus,Romulea rosea australis,Rosy Sandcrocus,Plantae,68895,Iridaceae,Romulea,Romulea rosea
108066750,3/6/22,2022-03-06 23:15:52 UTC,Pacific Time (US & Canada),research,https://www.inaturalist.org/observations/108066750,https://inaturalist-open-data.s3.amazonaws.com/photos/181874628/medium.jpeg,,1,0,FALSE,"Hayward, CA 94552, USA",37.64436638,-122.0082889,9,,Hayward,Alameda,redmaids,Calandrinia menziesii,redmaids,Plantae,400267,Montiaceae,Calandrinia,Calandrinia menziesii
115820346,3/27/22,2022-03-27 23:19:00 UTC,Pacific Time (US & Canada),research,https://www.inaturalist.org/observations/115820346,https://inaturalist-open-data.s3.amazonaws.com/photos/195475308/medium.jpeg,,1,0,FALSE,"Hayward, CA 94544, USA",37.626665,-122.02911,,,,Alameda,Common Vetch,Vicia sativa,Common Vetch,Plantae,53324,Fabaceae,Vicia,Vicia sativa
115820453,3/27/22,2022-03-27 23:17:33 UTC,Pacific Time (US & Canada),research,https://www.inaturalist.org/observations/115820453,https://inaturalist-open-data.s3.amazonaws.com/photos/195475572/medium.jpeg,,2,0,FALSE,"Hayward, CA 94544, USA",37.62710297,-122.029357,,,,Alameda,wild radish,Raphanus sativus,wild radish,Plantae,55410,Brassicaceae,Raphanus,Raphanus sativus
110722820,4/3/22,2022-04-03 13:20:00 UTC,UTC,research,https://www.inaturalist.org/observations/110722820,https://inaturalist-open-data.s3.amazonaws.com/photos/186830168/medium.jpg,,1,0,FALSE,"Alameda County, CA, USA",37.64060248,-122.0294409,122,,,Alameda,miner's lettuce,Claytonia perfoliata,miner's lettuce,Plantae,52994,Montiaceae,Claytonia,Claytonia perfoliata
112014749,4/17/22,2022-04-17 23:01:00 UTC,Pacific Time (US & Canada),research,https://www.inaturalist.org/observations/112014749,https://static.inaturalist.org/photos/189170233/medium.jpg,Beautiful fennel with some vetch in it,1,0,FALSE,"Mission - Garin, Hayward, CA, USA",37.645513,-122.043763,,,,Alameda,fennel,Foeniculum vulgare,fennel,Plantae,53052,Apiaceae,Foeniculum,Foeniculum vulgare
112014756,4/17/22,2022-04-17 23:11:00 UTC,Pacific Time (US & Canada),research,https://www.inaturalist.org/observations/112014756,https://static.inaturalist.org/photos/189170523/medium.jpg,,3,0,FALSE,"Hayward Highland, Hayward, CA, USA",37.64608469,-122.0354425,197,,Hayward,Alameda,checker lily,Fritillaria affinis,checker lily,Plantae,50618,Liliaceae,Fritillaria,Fritillaria affinis
112014761,4/17/22,2022-04-17 23:21:00 UTC,Pacific Time (US & Canada),research,https://www.inaturalist.org/observations/112014761,https://static.inaturalist.org/photos/189170646/medium.jpg,epicormic sprouts on this bay tree that looks in terrible shape.,1,0,FALSE,"Hayward, CA, USA",37.64576188,-122.0361292,182,,Hayward,Alameda,California bay,Umbellularia californica,California bay,Plantae,48807,Lauraceae,Umbellularia,Umbellularia californica
112014762,4/17/22,2022-04-17 23:27:00 UTC,Pacific Time (US & Canada),research,https://www.inaturalist.org/observations/112014762,https://static.inaturalist.org/photos/189170851/medium.jpg,,2,0,FALSE,"Hayward, CA, USA",37.64584683,-122.0364725,193,,Hayward,Alameda,Purple Sanicle,Sanicula bipinnatifida,Purple Sanicle,Plantae,56840,Apiaceae,Sanicula,Sanicula bipinnatifida
112014763,4/17/22,2022-04-17 23:28:00 UTC,Pacific Time (US & Canada),research,https://www.inaturalist.org/observations/112014763,https://static.inaturalist.org/photos/189170987/medium.jpg,,1,0,FALSE,"Hayward Highland, Hayward, CA, USA",37.64594877,-122.0346701,276,,Hayward,Alameda,Blue Dicks,Dipterostemon capitatus,Blue Dicks,Plantae,1196784,Asparagaceae,Dipterostemon,Dipterostemon capitatus
113157795,4/26/22,2022-04-26 20:13:00 UTC,Pacific Time (US & Canada),research,https://www.inaturalist.org/observations/113157795,https://static.inaturalist.org/photos/191190762/medium.jpg,,1,0,FALSE,"Alameda County, CA, USA",37.62379167,-122.0266028,,,,Alameda,wild radish,Raphanus sativus,wild radish,Plantae,55410,Brassicaceae,Raphanus,Raphanus sativus
113998981,4/30/22,2022-04-30 16:25:00 UTC,Pacific Time (US & Canada),research,https://www.inaturalist.org/observations/113998981,https://inaturalist-open-data.s3.amazonaws.com/photos/192544102/medium.jpeg,,3,0,FALSE,"Mission - Garin, Hayward, CA, USA",37.64764444,-122.0431833,4,,,Alameda,White Globe Lily,Calochortus albus,White Globe Lily,Plantae,51315,Liliaceae,Calochortus,Calochortus albus
114484375,5/1/22,2022-05-01 23:17:54 UTC,Pacific Time (US & Canada),research,https://www.inaturalist.org/observations/114484375,https://inaturalist-open-data.s3.amazonaws.com/photos/193321263/medium.jpg,,1,0,FALSE,"Garin/Dry Creek Pioneer Regional Parks, Hayward, CA, US",37.639545,-122.0104222,3,,Hayward,Alameda,Ithuriel's Spear,Triteleia laxa,Ithuriel's Spear,Plantae,51085,Asparagaceae,Triteleia,Triteleia laxa
115684762,5/5/22,2022-05-06 00:34:40 UTC,Pacific Time (US & Canada),research,https://www.inaturalist.org/observations/115684762,https://inaturalist-open-data.s3.amazonaws.com/photos/195250172/medium.jpg,,1,0,FALSE,"Hayward, CA, US",37.636425,-122.0377583,4,,,Alameda,tree tobacco,Nicotiana glauca,tree tobacco,Plantae,58334,Solanaceae,Nicotiana,Nicotiana glauca
115684790,5/5/22,2022-05-06 00:39:41 UTC,Pacific Time (US & Canada),research,https://www.inaturalist.org/observations/115684790,https://inaturalist-open-data.s3.amazonaws.com/photos/195250219/medium.jpg,,2,0,FALSE,"Hayward, CA, US",37.63592,-122.0371388,4,,,Alameda,Elegant Clarkia,Clarkia unguiculata,Elegant Clarkia,Plantae,51735,Onagraceae,Clarkia,Clarkia unguiculata
115684838,5/5/22,2022-05-06 00:43:47 UTC,Pacific Time (US & Canada),research,https://www.inaturalist.org/observations/115684838,https://inaturalist-open-data.s3.amazonaws.com/photos/195250389/medium.jpg,,1,0,FALSE,"Hayward, CA, US",37.635645,-122.0369638,4,,,Alameda,chia,Salvia columbariae,chia,Plantae,53200,Lamiaceae,Salvia,Salvia columbariae
115689902,5/5/22,2022-05-06 01:04:22 UTC,Pacific Time (US & Canada),research,https://www.inaturalist.org/observations/115689902,https://inaturalist-open-data.s3.amazonaws.com/photos/195259502/medium.jpg,,1,0,FALSE,"Garin/Dry Creek Pioneer Regional Parks, Hayward, CA, US",37.63601667,-122.0321722,3,,,Alameda,Hayfield Tarweed,Hemizonia congesta,Hayfield Tarweed,Plantae,56960,Asteraceae,Hemizonia,Hemizonia congesta
116203411,5/8/22,2022-05-08 20:50:00 UTC,Pacific Time (US & Canada),research,https://www.inaturalist.org/observations/116203411,https://static.inaturalist.org/photos/196128804/medium.jpeg,,1,0,FALSE,"Alameda County, CA, USA",37.63920667,-122.0346033,,,,Alameda,Mediterranean lineseed,Bellardia trixago,Mediterranean lineseed,Plantae,51286,Orobanchaceae,Bellardia,Bellardia trixago
116206375,5/8/22,2022-05-08 21:23:00 UTC,Pacific Time (US & Canada),research,https://www.inaturalist.org/observations/116206375,https://static.inaturalist.org/photos/196133076/medium.jpeg,,1,0,FALSE,"Mission - Garin, Hayward, CA, USA",37.64616667,-122.0419592,,,,Alameda,miner's lettuce,Claytonia perfoliata,miner's lettuce,Plantae,52994,Montiaceae,Claytonia,Claytonia perfoliata
116207959,5/8/22,2022-05-08 21:49:00 UTC,Pacific Time (US & Canada),research,https://www.inaturalist.org/observations/116207959,https://static.inaturalist.org/photos/196136708/medium.jpeg,sapling,1,0,FALSE,"Hayward Highland, Hayward, CA, USA",37.64614,-122.0359744,,,Hayward,Alameda,California buckeye,Aesculus californica,California buckeye,Plantae,53348,Sapindaceae,Aesculus,Aesculus californica
116776987,5/12/22,2022-05-13 01:14:06 UTC,Pacific Time (US & Canada),research,https://www.inaturalist.org/observations/116776987,https://static.inaturalist.org/photos/197151792/medium.jpg,,2,0,FALSE,"Garin/Dry Creek Pioneer Regional Parks, Union City, CA, US",37.63346047,-122.0266931,4,,,Alameda, ,Matricaria discoidea,pineapple-weed,Plantae,52992,Asteraceae,Matricaria,Matricaria discoidea
116927634,5/13/22,2022-05-14 00:41:00 UTC,Pacific Time (US & Canada),research,https://www.inaturalist.org/observations/116927634,https://inaturalist-open-data.s3.amazonaws.com/photos/197410745/medium.jpeg,,2,0,FALSE,"Mission - Garin, Hayward, CA, USA",37.64640002,-122.0429467,26,,,Alameda,checker lily,Fritillaria affinis,checker lily,Plantae,50618,Liliaceae,Fritillaria,Fritillaria affinis
116927640,5/13/22,2022-05-14 00:13:00 UTC,Pacific Time (US & Canada),research,https://www.inaturalist.org/observations/116927640,https://inaturalist-open-data.s3.amazonaws.com/photos/197410853/medium.jpeg,,1,0,FALSE,"Mission - Garin, Hayward, CA, USA",37.64623333,-122.0419472,4,,,Alameda,hillside woodland star,Lithophragma heterophyllum,hillside woodland star,Plantae,53124,Saxifragaceae,Lithophragma,Lithophragma heterophyllum
117168063,5/15/22,2022-05-15 16:49:24 UTC,Pacific Time (US & Canada),research,https://www.inaturalist.org/observations/117168063,https://static.inaturalist.org/photos/197846501/medium.jpeg,,1,0,FALSE,"Hayward, CA 94542, USA",37.64453233,-122.0109615,8,,Hayward,Alameda,Italian thistle,Carduus pycnocephalus,Italian thistle,Plantae,52990,Asteraceae,Carduus,Carduus pycnocephalus
121904752,6/15/22,2022-06-15 16:38:31 UTC,Pacific Time (US & Canada),research,https://www.inaturalist.org/observations/121904752,https://inaturalist-open-data.s3.amazonaws.com/photos/206338992/medium.jpeg,,1,0,FALSE,"Garin/Dry Creek Regional Park, Alameda County, US-CA, US",37.62724397,-122.026915,,,,Alameda,California buckeye,Aesculus californica,California buckeye,Plantae,53348,Sapindaceae,Aesculus,Aesculus californica
122914841,6/15/22,2022-06-15 16:38:31 UTC,Pacific Time (US & Canada),research,https://www.inaturalist.org/observations/122914841,https://inaturalist-open-data.s3.amazonaws.com/photos/208167938/medium.jpeg,,1,0,FALSE,"Garin/Dry Creek Regional Park, Alameda County, US-CA, US",37.62724397,-122.026915,,,,Alameda,Italian thistle,Carduus pycnocephalus,Italian thistle,Plantae,52990,Asteraceae,Carduus,Carduus pycnocephalus
122914855,6/15/22,2022-06-15 16:38:31 UTC,Pacific Time (US & Canada),research,https://www.inaturalist.org/observations/122914855,https://inaturalist-open-data.s3.amazonaws.com/photos/208167960/medium.jpeg,,1,0,FALSE,"Garin/Dry Creek Regional Park, Alameda County, US-CA, US",37.62724397,-122.026915,,,,Alameda,Shortpod Mustard,Hirschfeldia incana,Shortpod Mustard,Plantae,53097,Brassicaceae,Hirschfeldia,Hirschfeldia incana