id,observed_on,time_observed_at,time_zone,quality_grade,url,image_url,description,num_identification_agreements,num_identification_disagreements,captive_cultivated,place_guess,latitude,longitude,positional_accuracy,geoprivacy,place_town_name,place_county_name,species_guess,scientific_name,common_name,iconic_taxon_name,taxon_id,taxon_family_name,taxon_genus_name,taxon_species_name
20196129,2/6/16,2016-02-06 19:32:12 UTC,Pacific Time (US & Canada),research,https://www.inaturalist.org/observations/20196129,https://static.inaturalist.org/photos/31171459/medium.jpg,,1,0,FALSE,"94588, Pleasanton, CA, US",37.649045,-121.9188833,5,,,Alameda,Henderson's shooting star,Primula hendersonii,Henderson's shooting star,Plantae,487175,Primulaceae,Primula,Primula hendersonii
2838617,3/27/16,2016-03-27 18:24:48 UTC,Pacific Time (US & Canada),research,http://www.inaturalist.org/observations/2838617,http://static.inaturalist.org/photos/3234984/medium.jpeg,Found growing within a meter of the trail.,2,0,FALSE,"2880-2998 Sinbad Creek Trail Sunol, CA 94586",37.63881654,-121.9231313,1032,,,Alameda,Checker lily,Fritillaria affinis,checker lily,Plantae,50618,Liliaceae,Fritillaria,Fritillaria affinis
2959366,4/17/16,2016-04-17 21:05:53 UTC,Pacific Time (US & Canada),research,http://www.inaturalist.org/observations/2959366,https://inaturalist-open-data.s3.amazonaws.com/photos/3396261/medium.jpg,"Miners lettuce 
",2,0,FALSE,"94586, Sunol, CA, US",37.61442164,-121.8843668,5,,,Alameda,miner's lettuce,Claytonia perfoliata,miner's lettuce,Plantae,52994,Montiaceae,Claytonia,Claytonia perfoliata
2959435,4/17/16,2016-04-17 21:15:03 UTC,Pacific Time (US & Canada),research,http://www.inaturalist.org/observations/2959435,https://inaturalist-open-data.s3.amazonaws.com/photos/3396337/medium.jpg,,2,0,FALSE,"94586, Sunol, CA, US",37.61407781,-121.8845484,10,,,Alameda,California Hedge Nettle,Stachys bullata,California Hedge Nettle,Plantae,58930,Lamiaceae,Stachys,Stachys bullata
2959718,4/17/16,2016-04-17 21:42:37 UTC,Pacific Time (US & Canada),research,http://www.inaturalist.org/observations/2959718,https://inaturalist-open-data.s3.amazonaws.com/photos/3398020/medium.jpg,,2,0,FALSE,"94586, Sunol, CA, US",37.60788962,-121.8871903,5,,,Alameda,Milk Thistle,Silybum marianum,milk thistle,Plantae,52586,Asteraceae,Silybum,Silybum marianum
3032757,4/25/16,2016-04-25 22:44:12 UTC,Pacific Time (US & Canada),research,http://www.inaturalist.org/observations/3032757,http://static.inaturalist.org/photos/3491142/medium.jpg,,1,0,FALSE,"94586, Sunol, CA, US",37.61463,-121.8843083,,,,Alameda,Dipterostemon capitatus,Dipterostemon capitatus,Blue Dicks,Plantae,1196784,Asparagaceae,Dipterostemon,Dipterostemon capitatus
3032812,4/25/16,2016-04-25 22:51:11 UTC,Pacific Time (US & Canada),research,http://www.inaturalist.org/observations/3032812,http://static.inaturalist.org/photos/3491213/medium.jpg,,2,0,FALSE,"94586, Sunol, CA, US",37.61380333,-121.88485,,,,Alameda,miner's lettuce,Claytonia perfoliata,miner's lettuce,Plantae,52994,Montiaceae,Claytonia,Claytonia perfoliata
3033269,4/25/16,2016-04-25 23:49:37 UTC,Pacific Time (US & Canada),research,http://www.inaturalist.org/observations/3033269,http://static.inaturalist.org/photos/3491747/medium.jpg,,2,0,FALSE,"94586, Sunol, CA, US",37.61297,-121.88482,,,,Alameda,Common Vetch,Vicia sativa,Common Vetch,Plantae,53324,Fabaceae,Vicia,Vicia sativa
3033518,4/25/16,2016-04-26 00:02:58 UTC,Pacific Time (US & Canada),research,http://www.inaturalist.org/observations/3033518,http://static.inaturalist.org/photos/3491965/medium.jpg,,1,0,FALSE,"94586, Sunol, CA, US",37.614995,-121.8830333,,,,Alameda,Milk Thistle,Silybum marianum,milk thistle,Plantae,52586,Asteraceae,Silybum,Silybum marianum
3325788,5/28/16,2016-05-28 21:11:34 UTC,Pacific Time (US & Canada),research,http://www.inaturalist.org/observations/3325788,https://inaturalist-open-data.s3.amazonaws.com/photos/3841786/medium.jpg,,2,0,FALSE,"Pleasanton Ridge Regional Park, Pleasanton, CA, US",37.64808667,-121.9187917,,,,Alameda,Yellow Mariposa Lily,Calochortus luteus,Yellow Mariposa Lily,Plantae,51077,Liliaceae,Calochortus,Calochortus luteus
4439828,10/26/16,2016-10-26 15:45:41 UTC,Pacific Time (US & Canada),research,http://www.inaturalist.org/observations/4439828,http://static.inaturalist.org/photos/5344952/medium.jpg,,2,0,FALSE,"94586, Sunol, CA, US",37.61660324,-121.8855684,5,,,Alameda,California Buckeye,Aesculus californica,California buckeye,Plantae,53348,Sapindaceae,Aesculus,Aesculus californica
4886963,1/2/17,2017-01-02 21:45:00 UTC,Pacific Time (US & Canada),research,https://www.inaturalist.org/observations/4886963,https://inaturalist-open-data.s3.amazonaws.com/photos/5941868/medium.jpeg,,1,0,FALSE,"Pleasanton Ridge Regional Park, Alameda, California, United States",37.63923611,-121.9238583,,,,Alameda,California fescue,Festuca californica,California fescue,Plantae,57169,Poaceae,Festuca,Festuca californica
4886970,1/2/17,2017-01-02 21:40:00 UTC,Pacific Time (US & Canada),research,https://www.inaturalist.org/observations/4886970,https://inaturalist-open-data.s3.amazonaws.com/photos/5941904/medium.jpeg,,2,0,FALSE,"Pleasanton Ridge Regional Park, Alameda, California, United States",37.63756944,-121.9222806,,,,Alameda,California bay,Umbellularia californica,California bay,Plantae,48807,Lauraceae,Umbellularia,Umbellularia californica
4886976,1/2/17,2017-01-02 21:58:00 UTC,Pacific Time (US & Canada),research,https://www.inaturalist.org/observations/4886976,https://inaturalist-open-data.s3.amazonaws.com/photos/5942003/medium.jpeg,,1,0,FALSE,"Sunol, CA, USA",37.63968611,-121.9241722,,,,Alameda,Pink Honeysuckle,Lonicera hispidula,Pink Honeysuckle,Plantae,53416,Caprifoliaceae,Lonicera,Lonicera hispidula
4886979,1/2/17,2017-01-02 22:02:00 UTC,Pacific Time (US & Canada),research,https://www.inaturalist.org/observations/4886979,https://inaturalist-open-data.s3.amazonaws.com/photos/5942024/medium.jpeg,,1,0,FALSE,"Sunol, CA, USA",37.64178056,-121.9257972,,,,Alameda,Pacific Sanicle,Sanicula crassicaulis,Pacific Sanicle,Plantae,53201,Apiaceae,Sanicula,Sanicula crassicaulis
4886980,1/2/17,2017-01-02 22:04:00 UTC,Pacific Time (US & Canada),research,https://www.inaturalist.org/observations/4886980,https://inaturalist-open-data.s3.amazonaws.com/photos/5942056/medium.jpeg,,1,0,FALSE,"Sunol, CA, USA",37.64249444,-121.9264667,,,,Alameda,Western Sycamore,Platanus racemosa,western sycamore,Plantae,58231,Platanaceae,Platanus,Platanus racemosa
4886997,1/2/17,2017-01-02 22:39:00 UTC,Pacific Time (US & Canada),research,https://www.inaturalist.org/observations/4886997,https://inaturalist-open-data.s3.amazonaws.com/photos/5942257/medium.jpeg,,2,0,FALSE,"Sunol, CA, USA",37.64791944,-121.9322194,,,,Alameda,Common Snowberry,Symphoricarpos albus,Common Snowberry,Plantae,48523,Caprifoliaceae,Symphoricarpos,Symphoricarpos albus
4887037,1/2/17,2017-01-02 23:36:00 UTC,Pacific Time (US & Canada),research,https://www.inaturalist.org/observations/4887037,https://inaturalist-open-data.s3.amazonaws.com/photos/5942638/medium.jpeg,,2,0,FALSE,"Hayward, CA, USA",37.65417222,-121.9413917,,,Hayward,Alameda,Redberry Buckthorn,Rhamnus crocea,Redberry Buckthorn,Plantae,57243,Rhamnaceae,Rhamnus,Rhamnus crocea
4887048,1/2/17,2017-01-03 00:18:00 UTC,Pacific Time (US & Canada),research,https://www.inaturalist.org/observations/4887048,https://inaturalist-open-data.s3.amazonaws.com/photos/5942758/medium.jpeg,,1,0,FALSE,"Sunol, CA, USA",37.64758056,-121.9319389,,,,Alameda,Poison hemlock,Conium maculatum,poison hemlock,Plantae,52998,Apiaceae,Conium,Conium maculatum
5940033,4/23/17,2017-04-23 17:42:07 UTC,Pacific Time (US & Canada),research,https://www.inaturalist.org/observations/5940033,https://inaturalist-open-data.s3.amazonaws.com/photos/7415858/medium.jpg,,1,0,FALSE,"pleasanton ridge regional park, ca",37.614653,-121.883231,26,,,Alameda,Fiesta Flower,Pholistoma auritum,Fiesta Flower,Plantae,55437,Boraginaceae,Pholistoma,Pholistoma auritum
5940848,4/23/17,2017-04-23 18:35:23 UTC,Pacific Time (US & Canada),research,https://www.inaturalist.org/observations/5940848,https://inaturalist-open-data.s3.amazonaws.com/photos/7417145/medium.jpg,,1,0,FALSE,"pleasnton ridge regional park, ca",37.614218,-121.889427,104,,,Alameda,California Golden Violet,Viola pedunculata,California Golden Violet,Plantae,50825,Violaceae,Viola,Viola pedunculata
6011312,4/29/17,2017-04-29 19:19:52 UTC,Pacific Time (US & Canada),research,https://www.inaturalist.org/observations/6011312,https://static.inaturalist.org/photos/7519835/medium.jpg,,3,0,FALSE,"Pleasanton Ridge Regional Park, Sunol, CA, US",37.61306075,-121.8848374,5,,,Alameda,Ithuriel's Spear,Triteleia laxa,Ithuriel's Spear,Plantae,51085,Asparagaceae,Triteleia,Triteleia laxa
6011379,4/29/17,2017-04-29 19:26:37 UTC,Pacific Time (US & Canada),research,https://www.inaturalist.org/observations/6011379,https://static.inaturalist.org/photos/7519930/medium.jpg,,2,0,FALSE,"Pleasanton Ridge Regional Park, Sunol, CA, US",37.61316917,-121.8867011,5,,,Alameda,hairy vetch,Vicia villosa,hairy vetch,Plantae,57317,Fabaceae,Vicia,Vicia villosa
6011406,4/29/17,2017-04-29 19:30:13 UTC,Pacific Time (US & Canada),research,https://www.inaturalist.org/observations/6011406,https://static.inaturalist.org/photos/7519982/medium.jpg,,2,0,FALSE,"Pleasanton Ridge Regional Park, Sunol, CA, US",37.61395686,-121.8879032,5,,,Alameda,white horehound,Marrubium vulgare,White Horehound,Plantae,54605,Lamiaceae,Marrubium,Marrubium vulgare
6013908,4/29/17,2017-04-29 20:06:25 UTC,Pacific Time (US & Canada),research,https://www.inaturalist.org/observations/6013908,https://static.inaturalist.org/photos/7523862/medium.jpg,,2,0,FALSE,"94586, Sunol, CA, US",37.61786667,-121.897025,,,,Alameda,Dipterostemon capitatus,Dipterostemon capitatus,Blue Dicks,Plantae,1196784,Asparagaceae,Dipterostemon,Dipterostemon capitatus
6013934,4/29/17,2017-04-29 19:17:04 UTC,Pacific Time (US & Canada),research,https://www.inaturalist.org/observations/6013934,https://static.inaturalist.org/photos/7523893/medium.jpg,,2,0,FALSE,"Pleasanton Ridge Regional Park, Sunol, CA, US",37.61373667,-121.8850417,,,,Alameda,Purple Chinese Houses,Collinsia heterophylla,Purple Chinese Houses,Plantae,47325,Plantaginaceae,Collinsia,Collinsia heterophylla
6021866,4/30/17,2017-04-30 14:23:11 UTC,Pacific Time (US & Canada),research,https://www.inaturalist.org/observations/6021866,https://inaturalist-open-data.s3.amazonaws.com/photos/7536205/medium.jpg,,2,0,FALSE,"Pleasanton Ridge Regional Park, Sunol, CA, US",37.61558023,-121.8841889,5,,,Alameda,Milk Thistle,Silybum marianum,milk thistle,Plantae,52586,Asteraceae,Silybum,Silybum marianum
6025344,4/30/17,2017-04-30 14:24:34 UTC,Pacific Time (US & Canada),research,https://www.inaturalist.org/observations/6025344,https://inaturalist-open-data.s3.amazonaws.com/photos/7541688/medium.jpg,,1,0,FALSE,"Pleasanton Ridge Regional Park, Sunol, CA, US",37.61574657,-121.8841522,5,,,Alameda,Rose Clover,Trifolium hirtum,Rose Clover,Plantae,57078,Fabaceae,Trifolium,Trifolium hirtum
6025522,4/30/17,2017-04-30 17:47:22 UTC,Pacific Time (US & Canada),research,https://www.inaturalist.org/observations/6025522,https://static.inaturalist.org/photos/7541996/medium.jpg,,4,0,FALSE,"Pleasanton Ridge Regional Park, Sunol, CA, US",37.61358667,-121.8850633,,,,Alameda,Calochortus albus,Calochortus albus,White Globe Lily,Plantae,51315,Liliaceae,Calochortus,Calochortus albus
6027062,4/30/17,2017-04-30 17:45:30 UTC,Pacific Time (US & Canada),research,https://www.inaturalist.org/observations/6027062,https://static.inaturalist.org/photos/7544377/medium.jpg,,3,0,FALSE,"Pleasanton Ridge Regional Park, Sunol, CA, US",37.61308333,-121.8848633,,,,Alameda,Ithuriel's Spear,Triteleia laxa,Ithuriel's Spear,Plantae,51085,Asparagaceae,Triteleia,Triteleia laxa
6027092,4/30/17,2017-04-30 17:04:20 UTC,Pacific Time (US & Canada),research,https://www.inaturalist.org/observations/6027092,https://static.inaturalist.org/photos/7544419/medium.jpg,,2,0,FALSE,"94586, Pleasanton, CA, US",37.62343667,-121.901305,,,,Alameda,Mediterranean lineseed,Bellardia trixago,Mediterranean lineseed,Plantae,51286,Orobanchaceae,Bellardia,Bellardia trixago
6027127,4/30/17,2017-04-30 16:56:51 UTC,Pacific Time (US & Canada),research,https://www.inaturalist.org/observations/6027127,https://static.inaturalist.org/photos/7544447/medium.jpg,,2,0,FALSE,"94586, Pleasanton, CA, US",37.62613667,-121.9050217,,,,Alameda,hairy vetch,Vicia villosa,hairy vetch,Plantae,57317,Fabaceae,Vicia,Vicia villosa
6027128,4/30/17,2017-04-30 16:21:55 UTC,Pacific Time (US & Canada),research,https://www.inaturalist.org/observations/6027128,https://static.inaturalist.org/photos/7544451/medium.jpg,,2,0,FALSE,"94586, Pleasanton, CA, US",37.632345,-121.907875,,,,Alameda,Purple Chinese Houses,Collinsia heterophylla,Purple Chinese Houses,Plantae,47325,Plantaginaceae,Collinsia,Collinsia heterophylla
6032215,4/30/17,2017-04-30 14:29:32 UTC,Pacific Time (US & Canada),research,https://www.inaturalist.org/observations/6032215,https://inaturalist-open-data.s3.amazonaws.com/photos/7552417/medium.jpg,,4,0,FALSE,"Pleasanton Ridge Regional Park, Sunol, CA, US",37.61657747,-121.8851009,5,,,Alameda,Purple Chinese Houses,Collinsia heterophylla,Purple Chinese Houses,Plantae,47325,Plantaginaceae,Collinsia,Collinsia heterophylla
6032225,4/30/17,2017-04-30 14:31:08 UTC,Pacific Time (US & Canada),research,https://www.inaturalist.org/observations/6032225,https://inaturalist-open-data.s3.amazonaws.com/photos/7552435/medium.jpg,,2,0,FALSE,"Pleasanton Ridge Regional Park, Sunol, CA, US",37.61668148,-121.8856131,5,,,Alameda,California Buckeye,Aesculus californica,California buckeye,Plantae,53348,Sapindaceae,Aesculus,Aesculus californica
6032584,4/30/17,2017-04-30 14:33:31 UTC,Pacific Time (US & Canada),research,https://www.inaturalist.org/observations/6032584,https://inaturalist-open-data.s3.amazonaws.com/photos/7552981/medium.jpg,,3,0,FALSE,"Pleasanton Ridge Regional Park, Sunol, CA, US",37.6169189,-121.8866437,5,,,Alameda,Ithuriel's Spear,Triteleia laxa,Ithuriel's Spear,Plantae,51085,Asparagaceae,Triteleia,Triteleia laxa
6032591,4/30/17,2017-04-30 14:46:47 UTC,Pacific Time (US & Canada),research,https://www.inaturalist.org/observations/6032591,https://inaturalist-open-data.s3.amazonaws.com/photos/7552995/medium.jpg,,1,0,FALSE,"Pleasanton Ridge Regional Park, Sunol, CA, US",37.61820033,-121.8892477,5,,,Alameda,blue elder,Sambucus cerulea,blue elder,Plantae,143799,Viburnaceae,Sambucus,Sambucus cerulea
6032592,4/30/17,2017-04-30 15:02:51 UTC,Pacific Time (US & Canada),research,https://www.inaturalist.org/observations/6032592,https://inaturalist-open-data.s3.amazonaws.com/photos/7552997/medium.jpg,,1,0,FALSE,"94586, Sunol, CA, US",37.61225509,-121.8907549,5,,,Alameda,Mediterranean lineseed,Bellardia trixago,Mediterranean lineseed,Plantae,51286,Orobanchaceae,Bellardia,Bellardia trixago
6032597,4/30/17,2017-04-30 15:04:01 UTC,Pacific Time (US & Canada),research,https://www.inaturalist.org/observations/6032597,https://inaturalist-open-data.s3.amazonaws.com/photos/7553005/medium.jpg,,2,0,FALSE,"94586, Sunol, CA, US",37.61219616,-121.8908312,5,,,Alameda,Long-beaked Stork's Bill,Erodium botrys,Mediterranean Stork's-bill,Plantae,57090,Geraniaceae,Erodium,Erodium botrys
6032598,4/30/17,2017-04-30 15:12:48 UTC,Pacific Time (US & Canada),research,https://www.inaturalist.org/observations/6032598,https://inaturalist-open-data.s3.amazonaws.com/photos/7553006/medium.jpg,,2,0,FALSE,"94586, Sunol, CA, US",37.61542646,-121.8916085,5,,,Alameda,white horehound,Marrubium vulgare,White Horehound,Plantae,54605,Lamiaceae,Marrubium,Marrubium vulgare
6032627,4/30/17,2017-04-30 15:33:49 UTC,Pacific Time (US & Canada),research,https://www.inaturalist.org/observations/6032627,https://inaturalist-open-data.s3.amazonaws.com/photos/7553018/medium.jpg,,3,0,FALSE,"94566, Pleasanton, CA, US",37.6221565,-121.8984936,5,,,Alameda,Pineapple Weed,Matricaria discoidea,pineapple-weed,Plantae,52992,Asteraceae,Matricaria,Matricaria discoidea
6032640,4/30/17,2017-04-30 15:37:52 UTC,Pacific Time (US & Canada),research,https://www.inaturalist.org/observations/6032640,https://inaturalist-open-data.s3.amazonaws.com/photos/7553025/medium.jpg,,2,0,FALSE,"94566, Pleasanton, CA, US",37.62394,-121.899592,5,,,Alameda,California Poppy,Eschscholzia californica,California poppy,Plantae,48225,Papaveraceae,Eschscholzia,Eschscholzia californica
6032651,4/30/17,2017-04-30 15:39:11 UTC,Pacific Time (US & Canada),research,https://www.inaturalist.org/observations/6032651,https://inaturalist-open-data.s3.amazonaws.com/photos/7553026/medium.jpg,,2,0,FALSE,"94566, Pleasanton, CA, US",37.62429431,-121.8997642,5,,,Alameda,California Poppy,Eschscholzia californica,California poppy,Plantae,48225,Papaveraceae,Eschscholzia,Eschscholzia californica
6032656,4/30/17,2017-04-30 15:40:57 UTC,Pacific Time (US & Canada),research,https://www.inaturalist.org/observations/6032656,https://inaturalist-open-data.s3.amazonaws.com/photos/7553029/medium.jpg,,2,1,FALSE,"94566, Pleasanton, CA, US",37.62469974,-121.9001096,5,,,Alameda,California Golden Violet,Viola pedunculata,California Golden Violet,Plantae,50825,Violaceae,Viola,Viola pedunculata
6032670,4/30/17,2017-04-30 15:45:59 UTC,Pacific Time (US & Canada),research,https://www.inaturalist.org/observations/6032670,https://inaturalist-open-data.s3.amazonaws.com/photos/7553035/medium.jpg,,1,0,FALSE,"94566, Pleasanton, CA, US",37.62566441,-121.9017635,5,,,Alameda,redstem filaree,Erodium cicutarium,Redstem Stork's-bill,Plantae,47687,Geraniaceae,Erodium,Erodium cicutarium
6032706,4/30/17,2017-04-30 15:56:51 UTC,Pacific Time (US & Canada),research,https://www.inaturalist.org/observations/6032706,https://inaturalist-open-data.s3.amazonaws.com/photos/7553044/medium.jpg,,2,0,FALSE,"Pleasanton Ridge Regional Park, Pleasanton, CA, US",37.62710983,-121.9027346,5,,,Alameda,Shining Pepperweed,Lepidium nitidum,Shining Pepperweed,Plantae,47202,Brassicaceae,Lepidium,Lepidium nitidum
6032709,4/30/17,2017-04-30 15:57:25 UTC,Pacific Time (US & Canada),research,https://www.inaturalist.org/observations/6032709,https://inaturalist-open-data.s3.amazonaws.com/photos/7553049/medium.jpg,,2,0,FALSE,"Pleasanton Ridge Regional Park, Pleasanton, CA, US",37.62711637,-121.9027161,5,,,Alameda,Little quaking-grass,Briza minor,Little quaking-grass,Plantae,57162,Poaceae,Briza,Briza minor
6032714,4/30/17,2017-04-30 15:58:59 UTC,Pacific Time (US & Canada),research,https://www.inaturalist.org/observations/6032714,https://inaturalist-open-data.s3.amazonaws.com/photos/7553054/medium.jpg,,1,0,FALSE,"Pleasanton Ridge Regional Park, Pleasanton, CA, US",37.62711674,-121.9027363,5,,,Alameda,Subterranean Clover,Trifolium subterraneum,Subterranean Clover,Plantae,60201,Fabaceae,Trifolium,Trifolium subterraneum
6032715,4/30/17,2017-04-30 16:04:26 UTC,Pacific Time (US & Canada),research,https://www.inaturalist.org/observations/6032715,https://inaturalist-open-data.s3.amazonaws.com/photos/7553058/medium.jpg,,1,0,FALSE,"Pleasanton Ridge Regional Park, Pleasanton, CA, US",37.62871811,-121.9043789,5,,,Alameda,Common Catchfly,Silene gallica,Small-flowered Catchfly,Plantae,53212,Caryophyllaceae,Silene,Silene gallica
6032717,4/30/17,2017-04-30 16:07:57 UTC,Pacific Time (US & Canada),research,https://www.inaturalist.org/observations/6032717,https://inaturalist-open-data.s3.amazonaws.com/photos/7553062/medium.jpg,,2,0,FALSE,"Pleasanton Ridge Regional Park, Pleasanton, CA, US",37.62984862,-121.9056854,5,,,Alameda,Purple Sanicle,Sanicula bipinnatifida,Purple Sanicle,Plantae,56840,Apiaceae,Sanicula,Sanicula bipinnatifida
6032719,4/30/17,2017-04-30 16:13:00 UTC,Pacific Time (US & Canada),research,https://www.inaturalist.org/observations/6032719,https://inaturalist-open-data.s3.amazonaws.com/photos/7553065/medium.jpg,,2,1,FALSE,"Pleasanton Ridge Regional Park, Pleasanton, CA, US",37.63103801,-121.90649,5,,,Alameda,miner's lettuce,Claytonia perfoliata,miner's lettuce,Plantae,52994,Montiaceae,Claytonia,Claytonia perfoliata
6032720,4/30/17,2017-04-30 16:14:05 UTC,Pacific Time (US & Canada),research,https://www.inaturalist.org/observations/6032720,https://inaturalist-open-data.s3.amazonaws.com/photos/7553067/medium.jpg,,1,0,FALSE,"Pleasanton Ridge Regional Park, Pleasanton, CA, US",37.63067729,-121.9061197,5,,,Alameda,common yarrow,Achillea millefolium,common yarrow,Plantae,52821,Asteraceae,Achillea,Achillea millefolium
6032721,4/30/17,2017-04-30 16:16:44 UTC,Pacific Time (US & Canada),research,https://www.inaturalist.org/observations/6032721,https://inaturalist-open-data.s3.amazonaws.com/photos/7553070/medium.jpg,,1,0,FALSE,"Pleasanton Ridge Regional Park, Pleasanton, CA, US",37.63093395,-121.9063041,5,,,Alameda,Cow Parsnip,Heracleum maximum,common cowparsnip,Plantae,53094,Apiaceae,Heracleum,Heracleum maximum
6032722,4/30/17,2017-04-30 16:17:16 UTC,Pacific Time (US & Canada),research,https://www.inaturalist.org/observations/6032722,https://inaturalist-open-data.s3.amazonaws.com/photos/7553075/medium.jpg,,2,0,FALSE,"Pleasanton Ridge Regional Park, Pleasanton, CA, US",37.63096563,-121.9062337,5,,,Alameda,Pacific Poison Oak,Toxicodendron diversilobum,Pacific poison oak,Plantae,51080,Anacardiaceae,Toxicodendron,Toxicodendron diversilobum
6032725,4/30/17,2017-04-30 16:17:53 UTC,Pacific Time (US & Canada),research,https://www.inaturalist.org/observations/6032725,https://inaturalist-open-data.s3.amazonaws.com/photos/7553077/medium.jpg,,2,0,FALSE,"159â€“399 Castlewood Dr, Pleasanton, CA, US",37.63095737,-121.9062491,10,,,Alameda,coyote brush,Baccharis pilularis,coyote brush,Plantae,53359,Asteraceae,Baccharis,Baccharis pilularis
6032728,4/30/17,2017-04-30 16:19:13 UTC,Pacific Time (US & Canada),research,https://www.inaturalist.org/observations/6032728,https://inaturalist-open-data.s3.amazonaws.com/photos/7553086/medium.jpg,,1,0,FALSE,"Pleasanton Ridge Regional Park, Pleasanton, CA, US",37.63107338,-121.906321,5,,,Alameda,Pacific Poison Oak,Toxicodendron diversilobum,Pacific poison oak,Plantae,51080,Anacardiaceae,Toxicodendron,Toxicodendron diversilobum
6032732,4/30/17,2017-04-30 16:19:46 UTC,Pacific Time (US & Canada),research,https://www.inaturalist.org/observations/6032732,https://inaturalist-open-data.s3.amazonaws.com/photos/7553091/medium.jpg,,1,0,FALSE,"94586, Pleasanton, CA, US",37.63116722,-121.9064544,5,,,Alameda,orange bush monkeyflower,Diplacus aurantiacus,orange bush monkeyflower,Plantae,777371,Phrymaceae,Diplacus,Diplacus aurantiacus
6032733,4/30/17,2017-04-30 16:20:15 UTC,Pacific Time (US & Canada),research,https://www.inaturalist.org/observations/6032733,https://inaturalist-open-data.s3.amazonaws.com/photos/7553097/medium.jpg,,1,0,FALSE,"Pleasanton Ridge Regional Park, Pleasanton, CA, US",37.63114488,-121.9064792,5,,,Alameda,orange bush monkeyflower,Diplacus aurantiacus,orange bush monkeyflower,Plantae,777371,Phrymaceae,Diplacus,Diplacus aurantiacus
6032734,4/30/17,2017-04-30 16:27:34 UTC,Pacific Time (US & Canada),research,https://www.inaturalist.org/observations/6032734,https://inaturalist-open-data.s3.amazonaws.com/photos/7553098/medium.jpg,,1,0,FALSE,"8200 Golden Eagle Way, Pleasanton, CA, US",37.63145178,-121.9067329,5,,,Alameda,orange bush monkeyflower,Diplacus aurantiacus,orange bush monkeyflower,Plantae,777371,Phrymaceae,Diplacus,Diplacus aurantiacus
6032741,4/30/17,2017-04-30 16:30:31 UTC,Pacific Time (US & Canada),research,https://www.inaturalist.org/observations/6032741,https://inaturalist-open-data.s3.amazonaws.com/photos/7553100/medium.jpg,,1,0,FALSE,"94586, Pleasanton, CA, US",37.63167507,-121.907144,10,,,Alameda,orange bush monkeyflower,Diplacus aurantiacus,orange bush monkeyflower,Plantae,777371,Phrymaceae,Diplacus,Diplacus aurantiacus
6032750,4/30/17,2017-04-30 16:41:03 UTC,Pacific Time (US & Canada),research,https://www.inaturalist.org/observations/6032750,https://inaturalist-open-data.s3.amazonaws.com/photos/7553124/medium.jpg,,1,0,FALSE,"Pleasanton Ridge Regional Park, Alameda County, US-CA, US",37.6307612,-121.9106415,10,,,Alameda,white brodiaea,Triteleia hyacinthina,white brodiaea,Plantae,57132,Asparagaceae,Triteleia,Triteleia hyacinthina
6032752,4/30/17,2017-04-30 16:42:09 UTC,Pacific Time (US & Canada),research,https://www.inaturalist.org/observations/6032752,https://inaturalist-open-data.s3.amazonaws.com/photos/7553127/medium.jpg,,2,0,FALSE,"Pleasanton Ridge Regional Park, Alameda County, US-CA, US",37.63054465,-121.9105022,5,,,Alameda,Bermuda Buttercup,Oxalis pes-caprae,Bermuda buttercup,Plantae,53169,Oxalidaceae,Oxalis,Oxalis pes-caprae
6032761,4/30/17,2017-04-30 16:49:34 UTC,Pacific Time (US & Canada),research,https://www.inaturalist.org/observations/6032761,https://inaturalist-open-data.s3.amazonaws.com/photos/7553134/medium.jpg,,2,0,FALSE,"Pleasanton Ridge Regional Park, Alameda County, US-CA, US",37.62844678,-121.908226,5,,,Alameda,Mediterranean lineseed,Bellardia trixago,Mediterranean lineseed,Plantae,51286,Orobanchaceae,Bellardia,Bellardia trixago
6032770,4/30/17,2017-04-30 17:04:43 UTC,Pacific Time (US & Canada),research,https://www.inaturalist.org/observations/6032770,https://inaturalist-open-data.s3.amazonaws.com/photos/7553163/medium.jpg,,3,0,FALSE,"94566, Pleasanton, CA, US",37.62347221,-121.9016852,5,,,Alameda,Pimpernel,Lysimachia arvensis,scarlet pimpernel,Plantae,791928,Primulaceae,Lysimachia,Lysimachia arvensis
6032773,4/30/17,2017-04-30 17:07:01 UTC,Pacific Time (US & Canada),research,https://www.inaturalist.org/observations/6032773,https://inaturalist-open-data.s3.amazonaws.com/photos/7553167/medium.jpg,,1,0,FALSE,"94566, Pleasanton, CA, US",37.62377421,-121.9006468,5,,,Alameda,wall barley,Hordeum murinum,wall barley,Plantae,52796,Poaceae,Hordeum,Hordeum murinum
6032782,4/30/17,2017-04-30 17:20:35 UTC,Pacific Time (US & Canada),research,https://www.inaturalist.org/observations/6032782,https://inaturalist-open-data.s3.amazonaws.com/photos/7553179/medium.jpg,,1,0,FALSE,"94586, Sunol, CA, US",37.61784079,-121.8970265,5,,,Alameda,Dipterostemon capitatus,Dipterostemon capitatus,Blue Dicks,Plantae,1196784,Asparagaceae,Dipterostemon,Dipterostemon capitatus
6032791,4/30/17,2017-04-30 17:53:08 UTC,Pacific Time (US & Canada),research,https://www.inaturalist.org/observations/6032791,https://inaturalist-open-data.s3.amazonaws.com/photos/7553196/medium.jpg,,1,0,FALSE,"Pleasanton Ridge Regional Park, Sunol, CA, US",37.61446774,-121.8846939,5,,,Alameda,Pacific Poison Oak,Toxicodendron diversilobum,Pacific poison oak,Plantae,51080,Anacardiaceae,Toxicodendron,Toxicodendron diversilobum
6032793,4/30/17,2017-04-30 17:54:13 UTC,Pacific Time (US & Canada),research,https://www.inaturalist.org/observations/6032793,https://inaturalist-open-data.s3.amazonaws.com/photos/7553200/medium.jpg,,1,0,FALSE,"Pleasanton Ridge Regional Park, Sunol, CA, US",37.61450307,-121.8842402,5,,,Alameda,Cut-leaved Crane's-bill,Geranium dissectum,Cut-leaved crane's-bill,Plantae,53075,Geraniaceae,Geranium,Geranium dissectum
6032794,4/30/17,2017-04-30 17:57:05 UTC,Pacific Time (US & Canada),research,https://www.inaturalist.org/observations/6032794,https://inaturalist-open-data.s3.amazonaws.com/photos/7553220/medium.jpg,,1,0,FALSE,"Pleasanton Ridge Regional Park, Sunol, CA, US",37.61505745,-121.8845461,5,,,Alameda,poison hemlock,Conium maculatum,poison hemlock,Plantae,52998,Apiaceae,Conium,Conium maculatum
6103404,5/5/17,2017-05-05 20:46:34 UTC,Pacific Time (US & Canada),research,https://www.inaturalist.org/observations/6103404,https://static.inaturalist.org/photos/7647830/medium.jpg,,1,0,FALSE,"Pleasanton Ridge Regional Park, Sunol, CA, US",37.61665999,-121.8856123,5,,,Alameda,California Buckeye,Aesculus californica,California buckeye,Plantae,53348,Sapindaceae,Aesculus,Aesculus californica
6111428,5/5/17,2017-05-05 21:21:22 UTC,Pacific Time (US & Canada),research,https://www.inaturalist.org/observations/6111428,https://static.inaturalist.org/photos/7647835/medium.jpg,,2,0,FALSE,"94586, Sunol, CA, US",37.60778091,-121.887098,5,,,Alameda,orange bush monkeyflower,Diplacus aurantiacus,orange bush monkeyflower,Plantae,777371,Phrymaceae,Diplacus,Diplacus aurantiacus
6266464,5/18/17,2017-05-19 00:40:21 UTC,Pacific Time (US & Canada),research,https://www.inaturalist.org/observations/6266464,https://static.inaturalist.org/photos/7882151/medium.jpg,,2,0,FALSE,"Pleasanton Ridge Regional Park, Sunol, CA, US",37.61559485,-121.8841402,5,,,Alameda,Milk Thistle,Silybum marianum,milk thistle,Plantae,52586,Asteraceae,Silybum,Silybum marianum
6277416,5/18/17,2017-05-19 00:43:18 UTC,Pacific Time (US & Canada),research,https://www.inaturalist.org/observations/6277416,https://static.inaturalist.org/photos/7905101/medium.jpg,,3,0,FALSE,"Pleasanton Ridge Regional Park, Sunol, CA, US",37.61512396,-121.8837599,10,,,Alameda,Ithuriel's Spear,Triteleia laxa,Ithuriel's Spear,Plantae,51085,Asparagaceae,Triteleia,Triteleia laxa
6281081,5/18/17,2017-05-19 00:47:14 UTC,Pacific Time (US & Canada),research,https://www.inaturalist.org/observations/6281081,https://static.inaturalist.org/photos/7905102/medium.jpg,,2,0,FALSE,"Pleasanton Ridge Regional Park, Sunol, CA, US",37.61455575,-121.8827579,10,,,Alameda,poison hemlock,Conium maculatum,poison hemlock,Plantae,52998,Apiaceae,Conium,Conium maculatum
6753183,5/26/17,2017-05-26 21:48:26 UTC,Pacific Time (US & Canada),research,https://www.inaturalist.org/observations/6753183,https://inaturalist-open-data.s3.amazonaws.com/photos/8579764/medium.jpg,,2,0,FALSE,"94586, Sunol, CA, US",37.605352,-121.8864246,5,,,Alameda,Yellow Mariposa Lily,Calochortus luteus,Yellow Mariposa Lily,Plantae,51077,Liliaceae,Calochortus,Calochortus luteus
6753191,5/26/17,2017-05-26 21:50:19 UTC,Pacific Time (US & Canada),research,https://www.inaturalist.org/observations/6753191,https://inaturalist-open-data.s3.amazonaws.com/photos/8579772/medium.jpg,,2,0,FALSE,"94586, Sunol, CA, US",37.60532639,-121.8865155,10,,,Alameda,California Aster,Corethrogyne filaginifolia,California Aster,Plantae,58014,Asteraceae,Corethrogyne,Corethrogyne filaginifolia
6753197,5/26/17,2017-05-26 21:51:25 UTC,Pacific Time (US & Canada),research,https://www.inaturalist.org/observations/6753197,https://inaturalist-open-data.s3.amazonaws.com/photos/8579784/medium.jpg,,1,0,FALSE,"94586, Sunol, CA, US",37.60529823,-121.8864622,5,,,Alameda,blue oak,Quercus douglasii,blue oak,Plantae,49009,Fagaceae,Quercus,Quercus douglasii
6753203,5/26/17,2017-05-26 21:51:53 UTC,Pacific Time (US & Canada),research,https://www.inaturalist.org/observations/6753203,https://inaturalist-open-data.s3.amazonaws.com/photos/8579788/medium.jpg,,1,0,FALSE,"94586, Sunol, CA, US",37.60528076,-121.8864065,5,,,Alameda,common yarrow,Achillea millefolium,common yarrow,Plantae,52821,Asteraceae,Achillea,Achillea millefolium
6753209,5/26/17,2017-05-26 22:00:49 UTC,Pacific Time (US & Canada),research,https://www.inaturalist.org/observations/6753209,https://inaturalist-open-data.s3.amazonaws.com/photos/8579795/medium.jpg,,1,0,FALSE,"94586, Sunol, CA, US",37.60626462,-121.8883759,5,,,Alameda,Elegant Clarkia,Clarkia unguiculata,Elegant Clarkia,Plantae,51735,Onagraceae,Clarkia,Clarkia unguiculata
6753211,5/26/17,2017-05-26 22:01:35 UTC,Pacific Time (US & Canada),research,https://www.inaturalist.org/observations/6753211,https://inaturalist-open-data.s3.amazonaws.com/photos/8579803/medium.jpg,,2,0,FALSE,"94586, Sunol, CA, US",37.60629538,-121.8885557,5,,,Alameda,orange bush monkeyflower,Diplacus aurantiacus,orange bush monkeyflower,Plantae,777371,Phrymaceae,Diplacus,Diplacus aurantiacus
6753224,5/26/17,2017-05-26 22:03:18 UTC,Pacific Time (US & Canada),research,https://www.inaturalist.org/observations/6753224,https://inaturalist-open-data.s3.amazonaws.com/photos/8579806/medium.jpg,,1,0,FALSE,"94586, Sunol, CA, US",37.60600826,-121.8885044,5,,,Alameda,Mediterranean lineseed,Bellardia trixago,Mediterranean lineseed,Plantae,51286,Orobanchaceae,Bellardia,Bellardia trixago
6753227,5/26/17,2017-05-26 22:06:15 UTC,Pacific Time (US & Canada),research,https://www.inaturalist.org/observations/6753227,https://inaturalist-open-data.s3.amazonaws.com/photos/8579810/medium.jpg,,2,0,FALSE,"94586, Sunol, CA, US",37.60635942,-121.8892203,5,,,Alameda,Olive,Olea europaea,Olive,Plantae,57140,Oleaceae,Olea,Olea europaea
6753240,5/26/17,2017-05-26 22:07:04 UTC,Pacific Time (US & Canada),research,https://www.inaturalist.org/observations/6753240,https://inaturalist-open-data.s3.amazonaws.com/photos/8579835/medium.jpg,,1,0,FALSE,"94586, Sunol, CA, US",37.60641893,-121.8892309,10,,,Alameda,Coast Live Oak,Quercus agrifolia,coast live oak,Plantae,47850,Fagaceae,Quercus,Quercus agrifolia
6753255,5/26/17,2017-05-26 22:10:07 UTC,Pacific Time (US & Canada),research,https://www.inaturalist.org/observations/6753255,https://inaturalist-open-data.s3.amazonaws.com/photos/8579853/medium.jpg,,1,0,FALSE,"94586, Sunol, CA, US",37.60694456,-121.8897365,10,,,Alameda,Miniature Lupine,Lupinus bicolor,Miniature Lupine,Plantae,50614,Fabaceae,Lupinus,Lupinus bicolor
6753257,5/26/17,2017-05-26 22:17:11 UTC,Pacific Time (US & Canada),research,https://www.inaturalist.org/observations/6753257,https://inaturalist-open-data.s3.amazonaws.com/photos/8579859/medium.jpg,,1,0,FALSE,"94586, Sunol, CA, US",37.60788891,-121.8893712,5,,,Alameda,white horehound,Marrubium vulgare,White Horehound,Plantae,54605,Lamiaceae,Marrubium,Marrubium vulgare
6753262,5/26/17,2017-05-26 22:26:36 UTC,Pacific Time (US & Canada),research,https://www.inaturalist.org/observations/6753262,https://inaturalist-open-data.s3.amazonaws.com/photos/8579873/medium.jpg,Young olive shoots?,2,0,FALSE,"94586, Sunol, CA, US",37.60764328,-121.8885992,5,,,Alameda,Olive,Olea europaea,Olive,Plantae,57140,Oleaceae,Olea,Olea europaea
6753272,5/26/17,2017-05-26 22:28:22 UTC,Pacific Time (US & Canada),research,https://www.inaturalist.org/observations/6753272,https://inaturalist-open-data.s3.amazonaws.com/photos/8579894/medium.jpg,,1,0,FALSE,"94586, Sunol, CA, US",37.60802973,-121.8884903,5,,,Alameda,Milk Thistle,Silybum marianum,milk thistle,Plantae,52586,Asteraceae,Silybum,Silybum marianum
6753288,5/26/17,2017-05-26 22:30:16 UTC,Pacific Time (US & Canada),research,https://www.inaturalist.org/observations/6753288,https://inaturalist-open-data.s3.amazonaws.com/photos/8579909/medium.jpg,,1,0,FALSE,"94586, Sunol, CA, US",37.6081682,-121.887834,10,,,Alameda,deerweed,Acmispon glaber,deerweed,Plantae,53134,Fabaceae,Acmispon,Acmispon glaber
6753298,5/26/17,2017-05-26 22:32:34 UTC,Pacific Time (US & Canada),research,https://www.inaturalist.org/observations/6753298,https://inaturalist-open-data.s3.amazonaws.com/photos/8579918/medium.jpg,,1,0,FALSE,"94586, Sunol, CA, US",37.60812905,-121.8877721,5,,,Alameda,Coyote Mint,Monardella villosa,Coyote Mint,Plantae,52181,Lamiaceae,Monardella,Monardella villosa
6753306,5/26/17,2017-05-26 22:34:53 UTC,Pacific Time (US & Canada),research,https://www.inaturalist.org/observations/6753306,https://inaturalist-open-data.s3.amazonaws.com/photos/8579921/medium.jpg,,3,1,FALSE,"94586, Sunol, CA, US",37.60779851,-121.8872245,5,,,Alameda,Chamise,Adenostoma fasciculatum,chamise,Plantae,47146,Rosaceae,Adenostoma,Adenostoma fasciculatum
6753310,5/26/17,2017-05-26 22:35:28 UTC,Pacific Time (US & Canada),research,https://www.inaturalist.org/observations/6753310,https://inaturalist-open-data.s3.amazonaws.com/photos/8579925/medium.jpg,,1,0,FALSE,"94586, Sunol, CA, US",37.60778757,-121.8871031,10,,,Alameda,California Sagebrush,Artemisia californica,California sagebrush,Plantae,53357,Asteraceae,Artemisia,Artemisia californica
8409061,10/14/17,2017-10-14 18:31:00 UTC,Pacific Time (US & Canada),research,https://www.inaturalist.org/observations/8409061,https://inaturalist-open-data.s3.amazonaws.com/photos/11190944/medium.jpg,,1,0,FALSE,"Sunol, CA, USA",37.64504668,-121.9205255,,,,Alameda,Fitch's tarweed,Centromadia fitchii,Fitch's tarweed,Plantae,58804,Asteraceae,Centromadia,Centromadia fitchii
8409062,10/14/17,2017-10-14 18:31:00 UTC,Pacific Time (US & Canada),research,https://www.inaturalist.org/observations/8409062,https://inaturalist-open-data.s3.amazonaws.com/photos/11190954/medium.jpg,,2,0,FALSE,"Sunol, CA, USA",37.64469806,-121.9206125,,,,Alameda,Vinegar Weed,Trichostema lanceolatum,Vinegar Weed,Plantae,54875,Lamiaceae,Trichostema,Trichostema lanceolatum
8409063,10/14/17,2017-10-14 19:51:00 UTC,Pacific Time (US & Canada),research,https://www.inaturalist.org/observations/8409063,https://inaturalist-open-data.s3.amazonaws.com/photos/11190966/medium.jpg,,1,0,FALSE,"Hayward, CA, USA",37.65827271,-121.9424801,,,Hayward,Alameda,Croton setiger,Croton setiger,turkey mullein,Plantae,154156,Euphorbiaceae,Croton,Croton setiger
8409065,10/14/17,2017-10-14 20:35:00 UTC,Pacific Time (US & Canada),research,https://www.inaturalist.org/observations/8409065,https://inaturalist-open-data.s3.amazonaws.com/photos/11190976/medium.jpg,,1,0,FALSE,"Pleasanton Ridge Regional Park, Alameda, California, United States",37.66067549,-121.9323511,,,Hayward,Alameda,Fitch's tarweed,Centromadia fitchii,Fitch's tarweed,Plantae,58804,Asteraceae,Centromadia,Centromadia fitchii
9194398,12/16/17,2017-12-16 17:45:00 UTC,Pacific Time (US & Canada),research,https://www.inaturalist.org/observations/9194398,https://inaturalist-open-data.s3.amazonaws.com/photos/12445687/medium.jpg,,1,0,FALSE,"Sunol, CA, USA",37.61530594,-121.8956986,,,,Alameda,California sagebrush,Artemisia californica,California sagebrush,Plantae,53357,Asteraceae,Artemisia,Artemisia californica
9194399,12/16/17,2017-12-16 18:02:00 UTC,Pacific Time (US & Canada),research,https://www.inaturalist.org/observations/9194399,https://inaturalist-open-data.s3.amazonaws.com/photos/12445707/medium.jpg,,1,0,FALSE,"Sunol, CA, USA",37.62043174,-121.8989424,,,,Alameda,California Buckeye,Aesculus californica,California buckeye,Plantae,53348,Sapindaceae,Aesculus,Aesculus californica
9194400,12/16/17,2017-12-16 19:35:00 UTC,Pacific Time (US & Canada),research,https://www.inaturalist.org/observations/9194400,https://inaturalist-open-data.s3.amazonaws.com/photos/12445720/medium.jpg,,2,0,FALSE,"Pleasanton Ridge Regional Park, Alameda, California, United States",37.64138855,-121.9253312,,,,Alameda,California Mugwort,Artemisia douglasiana,California mugwort,Plantae,52854,Asteraceae,Artemisia,Artemisia douglasiana
9194401,12/16/17,2017-12-16 22:49:00 UTC,Pacific Time (US & Canada),research,https://www.inaturalist.org/observations/9194401,https://inaturalist-open-data.s3.amazonaws.com/photos/12445733/medium.jpg,,1,0,FALSE,"Sunol, CA, USA",37.61537512,-121.8915636,,,,Alameda,Olive,Olea europaea,Olive,Plantae,57140,Oleaceae,Olea,Olea europaea
10557216,3/31/18,2018-03-31 20:30:15 UTC,Pacific Time (US & Canada),research,https://www.inaturalist.org/observations/10557216,https://static.inaturalist.org/photos/14705459/medium.jpg,,2,0,FALSE,"Pleasanton Ridge Regional Park, Hayward, CA, US",37.66347534,-121.9394786,5,,Hayward,Alameda,California buckeye,Aesculus californica,California buckeye,Plantae,53348,Sapindaceae,Aesculus,Aesculus californica
10559560,4/1/18,2018-04-01 21:35:27 UTC,Pacific Time (US & Canada),research,https://www.inaturalist.org/observations/10559560,https://inaturalist-open-data.s3.amazonaws.com/photos/14709794/medium.jpg,,1,0,FALSE,"Pleasanton Ridge Regional Park, Sunol, CA, US",37.62055212,-121.8881335,5,,,Alameda,western blue-eyed grass,Sisyrinchium bellum,western blue-eyed grass,Plantae,49918,Iridaceae,Sisyrinchium,Sisyrinchium bellum
10559614,4/1/18,2018-04-01 21:36:20 UTC,Pacific Time (US & Canada),research,https://www.inaturalist.org/observations/10559614,https://inaturalist-open-data.s3.amazonaws.com/photos/14709854/medium.jpg,,1,0,FALSE,"Pleasanton Ridge Regional Park, Sunol, CA, US",37.6207237,-121.8885043,5,,,Alameda,California poppy,Eschscholzia californica,California poppy,Plantae,48225,Papaveraceae,Eschscholzia,Eschscholzia californica
10559633,4/1/18,2018-04-01 21:51:42 UTC,Pacific Time (US & Canada),research,https://www.inaturalist.org/observations/10559633,https://inaturalist-open-data.s3.amazonaws.com/photos/14709906/medium.jpg,,2,0,FALSE,"Pleasanton Ridge Regional Park, Sunol, CA, US",37.62136533,-121.8922248,5,,,Alameda,miner's lettuce,Claytonia perfoliata,miner's lettuce,Plantae,52994,Montiaceae,Claytonia,Claytonia perfoliata
10559665,4/1/18,2018-04-01 22:02:10 UTC,Pacific Time (US & Canada),research,https://www.inaturalist.org/observations/10559665,https://inaturalist-open-data.s3.amazonaws.com/photos/14709981/medium.jpg,,1,0,FALSE,"Pleasanton Ridge Regional Park, Sunol, CA, US",37.61815113,-121.8915859,5,,,Alameda,California Golden Violet,Viola pedunculata,California Golden Violet,Plantae,50825,Violaceae,Viola,Viola pedunculata
10673252,4/6/18,,Hawaii,research,https://www.inaturalist.org/observations/10673252,https://inaturalist-open-data.s3.amazonaws.com/photos/14900654/medium.jpeg,,1,0,FALSE,"Sunol, CA, USA",37.61444745,-121.8846846,31,,,Alameda,Fiesta Flower,Pholistoma auritum,Fiesta Flower,Plantae,55437,Boraginaceae,Pholistoma,Pholistoma auritum
10673278,4/6/18,2018-04-07 06:00:00 UTC,Hawaii,research,https://www.inaturalist.org/observations/10673278,https://inaturalist-open-data.s3.amazonaws.com/photos/14900714/medium.jpeg,,1,0,FALSE,"Sunol, CA, USA",37.61426048,-121.8846846,59,,,Alameda,Cut-leaved crane's-bill,Geranium dissectum,Cut-leaved crane's-bill,Plantae,53075,Geraniaceae,Geranium,Geranium dissectum
10712165,4/8/18,2018-04-08 21:20:10 UTC,Pacific Time (US & Canada),research,https://www.inaturalist.org/observations/10712165,https://static.inaturalist.org/photos/14963414/medium.jpeg,,2,0,FALSE,"Olive Grove Trail, Sunol, CA 94586, USA",37.6161924,-121.8933394,9,,,Alameda,white horehound,Marrubium vulgare,White Horehound,Plantae,54605,Lamiaceae,Marrubium,Marrubium vulgare
11826555,4/8/18,2018-04-09 00:46:14 UTC,Pacific Time (US & Canada),research,https://www.inaturalist.org/observations/11826555,https://inaturalist-open-data.s3.amazonaws.com/photos/16920709/medium.jpg,"Courdet Trail, Pleasanton Ridge Regional Park, Alameda County, California",1,0,FALSE,Pleasanton Ridge Regional Park,37.655965,-121.928287,129,,Hayward,Alameda,California buttercup,Ranunculus californicus,California buttercup,Plantae,52173,Ranunculaceae,Ranunculus,Ranunculus californicus
11826563,4/8/18,2018-04-09 00:44:18 UTC,Pacific Time (US & Canada),research,https://www.inaturalist.org/observations/11826563,https://inaturalist-open-data.s3.amazonaws.com/photos/16920724/medium.jpg,"Courdet Trail, Pleasanton Ridge Regional Park, Alameda County, California",1,0,FALSE,Pleasanton Ridge Regional Park,37.655965,-121.928287,129,,Hayward,Alameda,orange bush monkeyflower,Diplacus aurantiacus,orange bush monkeyflower,Plantae,777371,Phrymaceae,Diplacus,Diplacus aurantiacus
11826577,4/8/18,2018-04-09 00:13:26 UTC,Pacific Time (US & Canada),research,https://www.inaturalist.org/observations/11826577,https://inaturalist-open-data.s3.amazonaws.com/photos/16920742/medium.jpg,"Courdet Trail, Pleasanton Ridge Regional Park, Alameda County, California",1,0,FALSE,Pleasanton Ridge Regional Park,37.655965,-121.928287,129,,Hayward,Alameda,Dwarf Checkermallow,Sidalcea malviflora,Dwarf Checkermallow,Plantae,48795,Malvaceae,Sidalcea,Sidalcea malviflora
11826593,4/8/18,2018-04-08 22:58:11 UTC,Pacific Time (US & Canada),research,https://www.inaturalist.org/observations/11826593,https://inaturalist-open-data.s3.amazonaws.com/photos/16920780/medium.jpg,"Courdet Trail, Pleasanton Ridge Regional Park, Alameda County, California",0,0,FALSE,Pleasanton Ridge Regional Park,37.655965,-121.928287,129,,Hayward,Alameda,Dipterostemon capitatus,Dipterostemon capitatus,Blue Dicks,Plantae,1196784,Asparagaceae,Dipterostemon,Dipterostemon capitatus
11826601,4/8/18,2018-04-08 22:37:38 UTC,Pacific Time (US & Canada),research,https://www.inaturalist.org/observations/11826601,https://inaturalist-open-data.s3.amazonaws.com/photos/16920790/medium.jpg,"Courdet Trail, Pleasanton Ridge Regional Park, Alameda County, California",1,0,FALSE,Pleasanton Ridge Regional Park,37.655965,-121.928287,129,,Hayward,Alameda,San Francisco woodland-star,Lithophragma affine,San Francisco woodland-star,Plantae,50803,Saxifragaceae,Lithophragma,Lithophragma affine
11826611,4/8/18,2018-04-08 22:32:28 UTC,Pacific Time (US & Canada),research,https://www.inaturalist.org/observations/11826611,https://inaturalist-open-data.s3.amazonaws.com/photos/16920809/medium.jpg,"Courdet Trail, Pleasanton Ridge Regional Park, Alameda County, California",1,0,FALSE,Pleasanton Ridge Regional Park,37.655965,-121.928287,129,,Hayward,Alameda,White nemophila,Nemophila heterophylla,White nemophila,Plantae,53158,Boraginaceae,Nemophila,Nemophila heterophylla
11826619,4/8/18,2018-04-08 22:25:46 UTC,Pacific Time (US & Canada),research,https://www.inaturalist.org/observations/11826619,https://inaturalist-open-data.s3.amazonaws.com/photos/16920821/medium.jpg,"Courdet Trail, Pleasanton Ridge Regional Park, Alameda County, California",1,0,FALSE,Pleasanton Ridge Regional Park,37.655965,-121.928287,129,,Hayward,Alameda,Miniature Lupine,Lupinus bicolor,Miniature Lupine,Plantae,50614,Fabaceae,Lupinus,Lupinus bicolor
11826630,4/8/18,2018-04-08 22:25:10 UTC,Pacific Time (US & Canada),research,https://www.inaturalist.org/observations/11826630,https://inaturalist-open-data.s3.amazonaws.com/photos/16920837/medium.jpg,"Courdet Trail, Pleasanton Ridge Regional Park, Alameda County, California",1,0,FALSE,Pleasanton Ridge Regional Park,37.655965,-121.928287,129,,Hayward,Alameda,Silver Lupine,Lupinus albifrons,Silver Lupine,Plantae,51691,Fabaceae,Lupinus,Lupinus albifrons
11440405,4/13/18,2018-04-14 01:08:47 UTC,Pacific Time (US & Canada),research,https://www.inaturalist.org/observations/11440405,https://static.inaturalist.org/photos/16318748/medium.jpg,,1,0,FALSE,"Pleasanton Ridge Regional Park, Pleasanton, CA, US",37.62212833,-121.8868117,5,,,Alameda,hairy vetch,Vicia villosa,hairy vetch,Plantae,57317,Fabaceae,Vicia,Vicia villosa
11440558,4/21/18,2018-04-21 22:12:57 UTC,Pacific Time (US & Canada),research,https://www.inaturalist.org/observations/11440558,https://static.inaturalist.org/photos/16318847/medium.jpg,,1,0,FALSE,"Pleasanton Ridge Regional Park, Hayward, CA, US",37.65361301,-121.9360921,1371,,Hayward,Alameda,California poppy,Eschscholzia californica,California poppy,Plantae,48225,Papaveraceae,Eschscholzia,Eschscholzia californica
11588432,4/27/18,2018-04-28 02:31:00 UTC,Pacific Time (US & Canada),research,https://www.inaturalist.org/observations/11588432,https://inaturalist-open-data.s3.amazonaws.com/photos/16553400/medium.jpeg,,1,0,FALSE,"9895 Foothill Rd, Sunol, CA 94586, USA",37.60978352,-121.8875998,45,,,Alameda,Ookow,Dichelostemma congestum,Ookow,Plantae,56593,Asparagaceae,Dichelostemma,Dichelostemma congestum
11589110,4/27/18,2018-04-28 02:06:00 UTC,Pacific Time (US & Canada),research,https://www.inaturalist.org/observations/11589110,https://inaturalist-open-data.s3.amazonaws.com/photos/16554193/medium.jpeg,,1,0,FALSE,"9895 Foothill Rd, Sunol, CA 94586, USA",37.6099705,-121.8875568,191,,,Alameda,poison hemlock,Conium maculatum,poison hemlock,Plantae,52998,Apiaceae,Conium,Conium maculatum
75128945,4/28/18,2018-04-28 18:25:58 UTC,Pacific Time (US & Canada),research,https://www.inaturalist.org/observations/75128945,https://static.inaturalist.org/photos/122871725/medium.jpg,,1,0,FALSE,"Pleasanton, CA, US",37.65328667,-121.9167367,10,,,Alameda,Ithuriel's Spear,Triteleia laxa,Ithuriel's Spear,Plantae,51085,Asparagaceae,Triteleia,Triteleia laxa
75128982,4/28/18,2018-04-28 20:46:35 UTC,Pacific Time (US & Canada),research,https://www.inaturalist.org/observations/75128982,https://static.inaturalist.org/photos/122871817/medium.jpg,,1,0,FALSE,"Pleasanton, CA, US",37.65327167,-121.9168617,5,,,Alameda,orange bush monkeyflower,Diplacus aurantiacus,orange bush monkeyflower,Plantae,777371,Phrymaceae,Diplacus,Diplacus aurantiacus
109824741,4/28/18,2018-04-28 16:54:57 UTC,Pacific Time (US & Canada),research,https://www.inaturalist.org/observations/109824741,https://inaturalist-open-data.s3.amazonaws.com/photos/185172342/medium.jpeg,,1,0,FALSE,Pleasanton,37.65422058,-121.9166641,,,,Alameda,hairy vetch,Vicia villosa,hairy vetch,Plantae,57317,Fabaceae,Vicia,Vicia villosa
12186517,5/5/18,2018-05-06 00:00:00 UTC,Pacific Time (US & Canada),research,https://www.inaturalist.org/observations/12186517,https://inaturalist-open-data.s3.amazonaws.com/photos/17500747/medium.jpeg,,1,0,FALSE,"Pleasanton, CA, USA",37.65927797,-121.9184589,31,,,Alameda,Miniature Lupine,Lupinus bicolor,Miniature Lupine,Plantae,50614,Fabaceae,Lupinus,Lupinus bicolor
14732848,5/13/18,2018-05-13 19:05:00 UTC,Hawaii,research,https://www.inaturalist.org/observations/14732848,https://static.inaturalist.org/photos/21975956/medium.jpeg,"Pleasanton Ridge Regional Park
https://www.ebparks.org/civicax/filebank/blobdload.aspx?BlobID=23763",1,0,FALSE,"Sunol, CA, USA",37.61630756,-121.8858814,122,,,Alameda,Fiesta Flower,Pholistoma auritum,Fiesta Flower,Plantae,55437,Boraginaceae,Pholistoma,Pholistoma auritum
14732849,5/13/18,2018-05-13 19:07:00 UTC,Hawaii,research,https://www.inaturalist.org/observations/14732849,https://static.inaturalist.org/photos/21975958/medium.jpeg,"(Common ridge hedge nettle)
Pleasanton Ridge Regional Park
https://www.ebparks.org/civicax/filebank/blobdload.aspx?BlobID=23763",1,0,FALSE,"Sunol, CA, USA",37.61545522,-121.88241,122,,,Alameda,rough hedgenettle,Stachys rigida rigida,rough hedgenettle,Plantae,53296,Lamiaceae,Stachys,Stachys rigida
14732853,5/13/18,2018-05-13 19:07:00 UTC,Hawaii,research,https://www.inaturalist.org/observations/14732853,https://static.inaturalist.org/photos/21975968/medium.jpeg,"Pleasanton Ridge Regional Park
https://www.ebparks.org/civicax/filebank/blobdload.aspx?BlobID=23763",2,0,FALSE,"Sunol, CA, USA",37.61392795,-121.8877697,122,,,Alameda,Ithuriel's Spear,Triteleia laxa,Ithuriel's Spear,Plantae,51085,Asparagaceae,Triteleia,Triteleia laxa
14732854,5/13/18,2018-05-13 19:17:00 UTC,Hawaii,research,https://www.inaturalist.org/observations/14732854,https://static.inaturalist.org/photos/21975991/medium.jpeg,"Pleasanton Ridge Regional Park
https://www.ebparks.org/civicax/filebank/blobdload.aspx?BlobID=23763",1,0,FALSE,"Sunol, CA, USA",37.61311207,-121.885413,122,,,Alameda,Mediterranean lineseed,Bellardia trixago,Mediterranean lineseed,Plantae,51286,Orobanchaceae,Bellardia,Bellardia trixago
12626509,5/19/18,2018-05-19 17:11:34 UTC,Pacific Time (US & Canada),research,https://www.inaturalist.org/observations/12626509,https://inaturalist-open-data.s3.amazonaws.com/photos/18262510/medium.jpg,,1,0,FALSE,"Alameda County, US-CA, US",37.62319167,-121.9396217,5,,,Alameda,Wight's Paint Brush,Castilleja wightii,Wight's Paintbrush,Plantae,67809,Orobanchaceae,Castilleja,Castilleja wightii
12845433,5/22/18,,UTC,research,https://www.inaturalist.org/observations/12845433,https://static.inaturalist.org/photos/18638524/medium.jpeg,"on Bay Leaf Trail, next to fallen log upstream from culvert.",1,0,FALSE,Pleasanton Ridge Regional Park,37.64865441,-121.9270273,5,,,Alameda,blue skullcap,Scutellaria tuberosa,blue skullcap,Plantae,57122,Lamiaceae,Scutellaria,Scutellaria tuberosa
15699639,5/23/18,2018-05-23 20:45:00 UTC,Pacific Time (US & Canada),research,https://www.inaturalist.org/observations/15699639,https://inaturalist-open-data.s3.amazonaws.com/photos/23432429/medium.jpg,"Pleasanton Ridge Regional Park, Pleasanton, CA",1,0,FALSE,"Foothill Rd, Pleasanton, CA 94588, USA",37.6154094,-121.8823708,203,,,Alameda,Salsify,Tragopogon porrifolius,purple salsify,Plantae,54141,Asteraceae,Tragopogon,Tragopogon porrifolius
13253042,6/8/18,2018-06-09 02:04:00 UTC,Pacific Time (US & Canada),research,https://www.inaturalist.org/observations/13253042,https://inaturalist-open-data.s3.amazonaws.com/photos/19393631/medium.jpeg,,2,0,FALSE,"Sunol, CA, USA",37.61641226,-121.8847204,59,,,Alameda,Ithuriel's Spear,Triteleia laxa,Ithuriel's Spear,Plantae,51085,Asparagaceae,Triteleia,Triteleia laxa
13253127,6/8/18,2018-06-09 02:08:00 UTC,Pacific Time (US & Canada),research,https://www.inaturalist.org/observations/13253127,https://inaturalist-open-data.s3.amazonaws.com/photos/19393796/medium.jpeg,,1,0,FALSE,"Foothill Rd, Pleasanton, CA 94588, USA",37.61515444,-121.8843449,59,,,Alameda,wavy-leafed soap plant,Chlorogalum pomeridianum,wavy-leafed soap plant,Plantae,47597,Asparagaceae,Chlorogalum,Chlorogalum pomeridianum
13661095,6/20/18,2018-06-20 23:03:32 UTC,Pacific Time (US & Canada),research,https://www.inaturalist.org/observations/13661095,https://static.inaturalist.org/photos/20115394/medium.jpeg,,1,0,FALSE,"Woodland Trail, Sunol, CA 94586, USA",37.61391449,-121.8878479,,,,Alameda,western vervain,Verbena lasiostachys,western vervain,Plantae,53316,Verbenaceae,Verbena,Verbena lasiostachys
13701545,6/23/18,2018-06-23 13:54:44 UTC,Pacific Time (US & Canada),research,https://www.inaturalist.org/observations/13701545,https://inaturalist-open-data.s3.amazonaws.com/photos/20186407/medium.jpg,,2,0,FALSE,"94588, Pleasanton, CA, US",37.65391618,-121.9214088,5,,,Alameda,orange bush monkeyflower,Diplacus aurantiacus,orange bush monkeyflower,Plantae,777371,Phrymaceae,Diplacus,Diplacus aurantiacus
13849663,6/27/18,2018-06-27 22:06:00 UTC,Pacific Time (US & Canada),research,https://www.inaturalist.org/observations/13849663,https://inaturalist-open-data.s3.amazonaws.com/photos/20440357/medium.jpg,,1,0,FALSE,Pleasanton Ridge Regional Park - South,37.6154094,-121.8823708,203,,,Alameda,valley oak,Quercus lobata,valley oak,Plantae,49011,Fagaceae,Quercus,Quercus lobata
16241326,9/5/18,,Pacific Time (US & Canada),research,https://www.inaturalist.org/observations/16241326,https://inaturalist-open-data.s3.amazonaws.com/photos/24378456/medium.jpg,,1,0,FALSE,"Hayward, CA, USA",37.65661108,-121.9294995,15,,Hayward,Alameda,Pappose Tarweed,Centromadia parryi,Pappose Tarweed,Plantae,58809,Asteraceae,Centromadia,Centromadia parryi
16241327,9/5/18,,Pacific Time (US & Canada),research,https://www.inaturalist.org/observations/16241327,https://inaturalist-open-data.s3.amazonaws.com/photos/24378457/medium.jpg,,1,0,FALSE,"Hayward, CA, USA",37.65648367,-121.9307441,15,,Hayward,Alameda,Naked Buckwheat,Eriogonum nudum,Naked Buckwheat,Plantae,53046,Polygonaceae,Eriogonum,Eriogonum nudum
16241328,9/5/18,,Pacific Time (US & Canada),research,https://www.inaturalist.org/observations/16241328,https://inaturalist-open-data.s3.amazonaws.com/photos/24378460/medium.jpg,,1,0,FALSE,"Hayward, CA, USA",37.65618446,-121.9288558,31,,Hayward,Alameda,Vinegar Weed,Trichostema lanceolatum,Vinegar Weed,Plantae,54875,Lamiaceae,Trichostema,Trichostema lanceolatum
16241329,9/5/18,,Pacific Time (US & Canada),research,https://www.inaturalist.org/observations/16241329,https://inaturalist-open-data.s3.amazonaws.com/photos/24378462/medium.jpg,,2,0,FALSE,"Hayward, CA, USA",37.65787665,-121.9300682,15,,Hayward,Alameda,narrowleaf milkweed,Asclepias fascicularis,narrowleaf milkweed,Plantae,56851,Apocynaceae,Asclepias,Asclepias fascicularis
16241330,9/5/18,,Pacific Time (US & Canada),research,https://www.inaturalist.org/observations/16241330,https://inaturalist-open-data.s3.amazonaws.com/photos/24378465/medium.jpg,,1,0,FALSE,"Hayward, CA, USA",37.65802954,-121.9309801,15,,Hayward,Alameda,Pacific poison oak,Toxicodendron diversilobum,Pacific poison oak,Plantae,51080,Anacardiaceae,Toxicodendron,Toxicodendron diversilobum
16241331,9/5/18,,Pacific Time (US & Canada),research,https://www.inaturalist.org/observations/16241331,https://inaturalist-open-data.s3.amazonaws.com/photos/24378467/medium.jpg,,1,0,FALSE,"Hayward, CA, USA",37.65802105,-121.9296283,15,,Hayward,Alameda,Pennyroyal,Mentha pulegium,Pennyroyal,Plantae,57116,Lamiaceae,Mentha,Mentha pulegium
16241334,9/5/18,,Pacific Time (US & Canada),research,https://www.inaturalist.org/observations/16241334,https://inaturalist-open-data.s3.amazonaws.com/photos/24378473/medium.jpg,,0,0,FALSE,"Hayward, CA, USA",37.65717167,-121.9293784,15,,Hayward,Alameda,Common Madia,Madia elegans,Common Madia,Plantae,56974,Asteraceae,Madia,Madia elegans
16241336,9/5/18,,Pacific Time (US & Canada),research,https://www.inaturalist.org/observations/16241336,https://inaturalist-open-data.s3.amazonaws.com/photos/24378477/medium.jpg,,1,0,FALSE,"Hayward, CA, USA",37.65668787,-121.930056,31,,Hayward,Alameda,California fuchsia,Epilobium canum,California fuchsia,Plantae,53051,Onagraceae,Epilobium,Epilobium canum
16241337,9/5/18,,Pacific Time (US & Canada),research,https://www.inaturalist.org/observations/16241337,https://inaturalist-open-data.s3.amazonaws.com/photos/24378481/medium.jpg,,1,0,FALSE,"Hayward, CA, USA",37.65780499,-121.9305579,61,,Hayward,Alameda,California black oak,Quercus kelloggii,California black oak,Plantae,49919,Fagaceae,Quercus,Quercus kelloggii
16241410,9/5/18,,Pacific Time (US & Canada),research,https://www.inaturalist.org/observations/16241410,https://inaturalist-open-data.s3.amazonaws.com/photos/24378998/medium.jpg,,1,0,FALSE,"Hayward, CA, USA",37.65642399,-121.9310263,61,,Hayward,Alameda,Yellow Starthistle,Centaurea solstitialis,Yellow Star-Thistle,Plantae,52588,Asteraceae,Centaurea,Centaurea solstitialis
16686847,9/18/18,2018-09-18 22:46:06 UTC,Pacific Time (US & Canada),research,https://www.inaturalist.org/observations/16686847,https://static.inaturalist.org/photos/25169212/medium.jpg,,1,0,FALSE,"94588, Pleasanton, CA, US",37.65321333,-121.9169383,5,,,Alameda,California cudweed,Pseudognaphalium californicum,California cudweed,Plantae,53077,Asteraceae,Pseudognaphalium,Pseudognaphalium californicum
16714027,9/18/18,2018-09-18 22:12:25 UTC,Pacific Time (US & Canada),research,https://www.inaturalist.org/observations/16714027,https://static.inaturalist.org/photos/25217162/medium.jpg,,2,0,FALSE,"94588, Pleasanton, CA, US",37.654975,-121.9215383,50,,,Alameda,California fuchsia,Epilobium canum,California fuchsia,Plantae,53051,Onagraceae,Epilobium,Epilobium canum
16701883,9/19/18,2018-09-19 18:41:00 UTC,Pacific Time (US & Canada),research,https://www.inaturalist.org/observations/16701883,https://inaturalist-open-data.s3.amazonaws.com/photos/25195336/medium.jpg,,1,0,FALSE,"Pleasanton Ridge Regional Park, Alameda, California, United States",37.6467136,-121.930839,,,,Alameda,Pacific poison oak,Toxicodendron diversilobum,Pacific poison oak,Plantae,51080,Anacardiaceae,Toxicodendron,Toxicodendron diversilobum
16701885,9/19/18,2018-09-19 20:20:00 UTC,Pacific Time (US & Canada),research,https://www.inaturalist.org/observations/16701885,https://inaturalist-open-data.s3.amazonaws.com/photos/25195376/medium.jpg,,2,0,FALSE,"Hayward, CA, USA",37.65758868,-121.9290858,,,Hayward,Alameda,narrowleaf milkweed,Asclepias fascicularis,narrowleaf milkweed,Plantae,56851,Apocynaceae,Asclepias,Asclepias fascicularis
16701891,9/19/18,2018-09-19 20:34:00 UTC,Pacific Time (US & Canada),research,https://www.inaturalist.org/observations/16701891,https://inaturalist-open-data.s3.amazonaws.com/photos/25195430/medium.jpg,,2,0,FALSE,"Pleasanton, CA, USA",37.65557474,-121.9235861,,,Hayward,Alameda,Vinegar Weed,Trichostema lanceolatum,Vinegar Weed,Plantae,54875,Lamiaceae,Trichostema,Trichostema lanceolatum
16701892,9/19/18,2018-09-19 20:34:00 UTC,Pacific Time (US & Canada),research,https://www.inaturalist.org/observations/16701892,https://inaturalist-open-data.s3.amazonaws.com/photos/25195401/medium.jpg,,1,0,FALSE,"Pleasanton, CA, USA",37.65563629,-121.9236115,,,Hayward,Alameda,Fitch's tarweed,Centromadia fitchii,Fitch's tarweed,Plantae,58804,Asteraceae,Centromadia,Centromadia fitchii
16947994,9/25/18,2018-09-25 22:20:00 UTC,Pacific Time (US & Canada),research,https://www.inaturalist.org/observations/16947994,https://inaturalist-open-data.s3.amazonaws.com/photos/25613378/medium.jpg,,1,0,FALSE,"Sunol, CA, USA",37.61645698,-121.8891145,31,,,Alameda,Turkey Mullein,Croton setiger,turkey mullein,Plantae,154156,Euphorbiaceae,Croton,Croton setiger
17085879,9/30/18,2018-09-30 18:54:34 UTC,Pacific Time (US & Canada),research,https://www.inaturalist.org/observations/17085879,https://inaturalist-open-data.s3.amazonaws.com/photos/25864290/medium.jpg,,1,0,FALSE,"Pleasanton Ridge Regional Park, Alameda County, US-CA, US",37.64595833,-121.9301533,100,,,Alameda,Pacific poison oak,Toxicodendron diversilobum,Pacific poison oak,Plantae,51080,Anacardiaceae,Toxicodendron,Toxicodendron diversilobum
17085895,9/30/18,2018-09-30 19:30:03 UTC,Pacific Time (US & Canada),research,https://www.inaturalist.org/observations/17085895,https://inaturalist-open-data.s3.amazonaws.com/photos/25864317/medium.jpg,Valley oak,1,0,FALSE,"Pleasanton Ridge Regional Park, Alameda County, US-CA, US",37.645325,-121.9197217,10,,,Alameda,valley oak,Quercus lobata,valley oak,Plantae,49011,Fagaceae,Quercus,Quercus lobata
17085906,9/30/18,2018-09-30 20:11:16 UTC,Pacific Time (US & Canada),research,https://www.inaturalist.org/observations/17085906,https://inaturalist-open-data.s3.amazonaws.com/photos/25981359/medium.jpg,,3,0,FALSE,"Pleasanton Ridge Regional Park, Alameda County, US-CA, US",37.64853333,-121.9187083,5,,,Alameda,Vinegar Weed,Trichostema lanceolatum,Vinegar Weed,Plantae,54875,Lamiaceae,Trichostema,Trichostema lanceolatum
17544372,10/14/18,2018-10-15 00:24:37 UTC,Pacific Time (US & Canada),research,https://www.inaturalist.org/observations/17544372,https://static.inaturalist.org/photos/26710242/medium.jpeg,,1,0,FALSE,"Public Restrooms, Sunol, CA 94586, USA",37.61477661,-121.8821564,,,,Alameda,white horehound,Marrubium vulgare,White Horehound,Plantae,54605,Lamiaceae,Marrubium,Marrubium vulgare
19917085,1/27/19,2019-01-27 20:53:02 UTC,Pacific Time (US & Canada),research,https://www.inaturalist.org/observations/19917085,https://inaturalist-open-data.s3.amazonaws.com/photos/30721717/medium.jpeg,,3,0,FALSE,"Pleasanton Ridge Regional Park, Alameda County, CA, USA",37.658957,-121.917105,462,,,Alameda,Pacific hound's tongue,Adelinia grande,Pacific hound's tongue,Plantae,769151,Boraginaceae,Adelinia,Adelinia grande
19917125,1/27/19,2019-01-27 21:41:35 UTC,Pacific Time (US & Canada),research,https://www.inaturalist.org/observations/19917125,https://inaturalist-open-data.s3.amazonaws.com/photos/30721765/medium.jpeg,,1,0,FALSE,"Pleasanton Ridge Regional Park, Alameda County, US-CA, US",37.65589214,-121.9266567,7,,Hayward,Alameda,Cut-leaved crane's-bill,Geranium dissectum,Cut-leaved crane's-bill,Plantae,53075,Geraniaceae,Geranium,Geranium dissectum
19920888,1/27/19,2019-01-27 22:23:00 UTC,Pacific Time (US & Canada),research,https://www.inaturalist.org/observations/19920888,https://inaturalist-open-data.s3.amazonaws.com/photos/30728882/medium.jpg,,1,0,FALSE,"Pleasanton Ridge Regional Park, Alameda County, CA, USA",37.65141,-121.9332883,,,,Alameda,hillside gooseberry,Ribes californicum,hillside gooseberry,Plantae,47129,Grossulariaceae,Ribes,Ribes californicum
19959196,1/27/19,2019-01-27 20:36:00 UTC,Pacific Time (US & Canada),research,https://www.inaturalist.org/observations/19959196,https://inaturalist-open-data.s3.amazonaws.com/photos/30797296/medium.jpg,,1,0,FALSE,"Pleasanton, CA, USA",37.65900333,-121.9166833,,,,Alameda,California bee plant,Scrophularia californica,California beeplant,Plantae,50812,Scrophulariaceae,Scrophularia,Scrophularia californica
20470009,2/18/19,2019-02-19 01:08:44 UTC,Pacific Time (US & Canada),research,https://www.inaturalist.org/observations/20470009,https://static.inaturalist.org/photos/31598480/medium.jpg,,1,0,FALSE,"Jerlin Pl, Pleasanton, CA, US",37.66102089,-121.9175609,16,,,Alameda,miner's lettuce,Claytonia perfoliata,miner's lettuce,Plantae,52994,Montiaceae,Claytonia,Claytonia perfoliata
20562669,2/22/19,2019-02-22 20:03:37 UTC,Pacific Time (US & Canada),research,https://www.inaturalist.org/observations/20562669,https://inaturalist-open-data.s3.amazonaws.com/photos/33056028/medium.jpeg,,1,0,FALSE,"Thermalito Trail, Sunol, CA 94586, USA",37.6161499,-121.8957596,,,,Alameda,Fremont's Deathcamas,Toxicoscordion fremontii,Common star lily,Plantae,49649,Melanthiaceae,Toxicoscordion,Toxicoscordion fremontii
22012487,3/14/19,2019-03-14 17:00:43 UTC,Pacific Time (US & Canada),research,https://www.inaturalist.org/observations/22012487,https://static.inaturalist.org/photos/34121336/medium.jpg,,1,0,FALSE,"94588, Pleasanton, CA, US",37.65186667,-121.9159383,20,,,Alameda,Henderson's shooting star,Primula hendersonii,Henderson's shooting star,Plantae,487175,Primulaceae,Primula,Primula hendersonii
21291523,3/16/19,2019-03-16 18:21:05 UTC,Pacific Time (US & Canada),research,https://www.inaturalist.org/observations/21291523,https://inaturalist-open-data.s3.amazonaws.com/photos/32922237/medium.jpg,,1,0,FALSE,"94586, Sunol, CA, US",37.62030833,-121.899475,9,,,Alameda,California Golden Violet,Viola pedunculata,California Golden Violet,Plantae,50825,Violaceae,Viola,Viola pedunculata
21345546,3/16/19,2019-03-16 21:33:57 UTC,Pacific Time (US & Canada),research,https://www.inaturalist.org/observations/21345546,https://inaturalist-open-data.s3.amazonaws.com/photos/33013558/medium.jpg,,1,0,FALSE,"94566, Pleasanton, CA, US",37.63151167,-121.9065033,10,,,Alameda,Pacific hound's tongue,Adelinia grande,Pacific hound's tongue,Plantae,769151,Boraginaceae,Adelinia,Adelinia grande
21345589,3/16/19,2019-03-16 21:21:06 UTC,Pacific Time (US & Canada),research,https://www.inaturalist.org/observations/21345589,https://inaturalist-open-data.s3.amazonaws.com/photos/33013648/medium.jpg,,2,0,FALSE,"Pleasanton Ridge Regional Park, Pleasanton, CA, US",37.62957,-121.90542,5,,,Alameda,Redmaids,Calandrinia menziesii,redmaids,Plantae,400267,Montiaceae,Calandrinia,Calandrinia menziesii
21345646,3/16/19,2019-03-16 21:42:54 UTC,Pacific Time (US & Canada),research,https://www.inaturalist.org/observations/21345646,https://inaturalist-open-data.s3.amazonaws.com/photos/33013793/medium.jpg,,1,0,FALSE,"94566, Pleasanton, CA, US",37.63103,-121.910775,5,,,Alameda,Bermuda buttercup,Oxalis pes-caprae,Bermuda buttercup,Plantae,53169,Oxalidaceae,Oxalis,Oxalis pes-caprae
21345814,3/16/19,2019-03-16 20:47:34 UTC,Pacific Time (US & Canada),research,https://www.inaturalist.org/observations/21345814,https://inaturalist-open-data.s3.amazonaws.com/photos/33014108/medium.jpg,,1,0,FALSE,"94586, Sunol, CA, US",37.616295,-121.89422,5,,,Alameda,Rosy sandcrocus,Romulea rosea,Rosy sandcrocus,Plantae,68896,Iridaceae,Romulea,Romulea rosea
21330592,3/17/19,2019-03-17 19:55:16 UTC,Pacific Time (US & Canada),research,https://www.inaturalist.org/observations/21330592,https://static.inaturalist.org/photos/32988092/medium.jpg,,2,0,FALSE,"Pleasanton Ridge Regional Park, Alameda County, US-CA, US",37.61395162,-121.8910501,5,,,Alameda,Rosy Sandcrocus,Romulea rosea australis,Rosy Sandcrocus,Plantae,68895,Iridaceae,Romulea,Romulea rosea
21335657,3/17/19,2019-03-17 22:07:28 UTC,Pacific Time (US & Canada),research,https://www.inaturalist.org/observations/21335657,https://static.inaturalist.org/photos/32996872/medium.jpg,,3,0,FALSE,"Pleasanton Ridge Regional Park, Alameda County, US-CA, US",37.62101732,-121.8964141,5,,,Alameda,Redmaids,Calandrinia menziesii,redmaids,Plantae,400267,Montiaceae,Calandrinia,Calandrinia menziesii
21351625,3/17/19,2019-03-18 01:06:00 UTC,Pacific Time (US & Canada),research,https://www.inaturalist.org/observations/21351625,https://inaturalist-open-data.s3.amazonaws.com/photos/33023734/medium.jpeg,,2,0,FALSE,"Foothill Rd, Pleasanton, CA 94588, USA",37.6154094,-121.8823708,203,,,Alameda,milkmaids,Cardamine californica,milkmaids,Plantae,49651,Brassicaceae,Cardamine,Cardamine californica
21351631,3/17/19,2019-03-18 01:09:00 UTC,Pacific Time (US & Canada),research,https://www.inaturalist.org/observations/21351631,https://inaturalist-open-data.s3.amazonaws.com/photos/33023759/medium.jpeg,,1,0,FALSE,"Foothill Rd, Pleasanton, CA 94588, USA",37.6154094,-121.8823708,203,,,Alameda,miner's lettuce,Claytonia perfoliata,miner's lettuce,Plantae,52994,Montiaceae,Claytonia,Claytonia perfoliata
21351671,3/17/19,2019-03-18 01:12:00 UTC,Pacific Time (US & Canada),research,https://www.inaturalist.org/observations/21351671,https://inaturalist-open-data.s3.amazonaws.com/photos/33023837/medium.jpeg,,1,0,FALSE,"Foothill Rd, Pleasanton, CA 94588, USA",37.6154094,-121.8823708,203,,,Alameda,California buttercup,Ranunculus californicus,California buttercup,Plantae,52173,Ranunculaceae,Ranunculus,Ranunculus californicus
21351724,3/17/19,2019-03-18 01:44:00 UTC,Pacific Time (US & Canada),research,https://www.inaturalist.org/observations/21351724,https://inaturalist-open-data.s3.amazonaws.com/photos/33023997/medium.jpeg,,0,0,FALSE,"Foothill Rd, Pleasanton, CA 94588, USA",37.6154094,-121.8823708,203,,,Alameda,Henderson's shooting star,Primula hendersonii,Henderson's shooting star,Plantae,487175,Primulaceae,Primula,Primula hendersonii
22109776,4/6/19,2019-04-06 20:39:27 UTC,Pacific Time (US & Canada),research,https://www.inaturalist.org/observations/22109776,https://inaturalist-open-data.s3.amazonaws.com/photos/34226130/medium.jpeg,,1,0,FALSE,"10843 Foothill Rd, Sunol, CA 94586, USA",37.60290335,-121.8849977,66,,,Alameda,California Golden Violet,Viola pedunculata,California Golden Violet,Plantae,50825,Violaceae,Viola,Viola pedunculata
22109815,4/6/19,2019-04-06 20:29:41 UTC,Pacific Time (US & Canada),research,https://www.inaturalist.org/observations/22109815,https://inaturalist-open-data.s3.amazonaws.com/photos/34226164/medium.jpeg,,1,0,FALSE,"10843 Foothill Rd, Sunol, CA 94586, USA",37.60276284,-121.8847764,33,,,Alameda,California poppy,Eschscholzia californica,California poppy,Plantae,48225,Papaveraceae,Eschscholzia,Eschscholzia californica
22152870,4/7/19,2019-04-07 18:37:23 UTC,Pacific Time (US & Canada),research,https://www.inaturalist.org/observations/22152870,https://static.inaturalist.org/photos/34296573/medium.jpeg,,1,0,FALSE,"3454 Old Foothill Rd, Pleasanton, CA 94588, USA",37.66008826,-121.9167688,7,,,Alameda,scarlet pimpernel,Lysimachia arvensis,scarlet pimpernel,Plantae,791928,Primulaceae,Lysimachia,Lysimachia arvensis
22153405,4/7/19,2019-04-07 18:49:04 UTC,Pacific Time (US & Canada),research,https://www.inaturalist.org/observations/22153405,https://static.inaturalist.org/photos/34297357/medium.jpeg,,1,0,FALSE,"3466 Foothill Rd, Pleasanton, CA 94588, USA",37.65743041,-121.9170312,6,,,Alameda,Pacific pea,Lathyrus vestitus,Pacific pea,Plantae,50320,Fabaceae,Lathyrus,Lathyrus vestitus
22153610,4/7/19,2019-04-07 18:52:03 UTC,Pacific Time (US & Canada),research,https://www.inaturalist.org/observations/22153610,https://static.inaturalist.org/photos/34297711/medium.jpeg,,1,0,FALSE,"3466 Foothill Rd, Pleasanton, CA 94588, USA",37.65678247,-121.9161231,5,,,Alameda,hairy vetch,Vicia villosa,hairy vetch,Plantae,57317,Fabaceae,Vicia,Vicia villosa
22154878,4/7/19,2019-04-07 19:15:21 UTC,Pacific Time (US & Canada),research,https://www.inaturalist.org/observations/22154878,https://static.inaturalist.org/photos/34299735/medium.jpeg,,1,0,FALSE,"Pleasanton, CA 94588, USA",37.65138184,-121.9169831,12,,,Alameda,Henderson's shooting star,Primula hendersonii,Henderson's shooting star,Plantae,487175,Primulaceae,Primula,Primula hendersonii
22269291,4/7/19,2019-04-07 16:27:49 UTC,Pacific Time (US & Canada),research,https://www.inaturalist.org/observations/22269291,https://static.inaturalist.org/photos/34486208/medium.jpg,,3,1,FALSE,"Pleasanton Ridge Regional Park, Pleasanton, CA, US",37.6562,-121.9240117,5,,Hayward,Alameda,Dwarf Checkermallow,Sidalcea malviflora,Dwarf Checkermallow,Plantae,48795,Malvaceae,Sidalcea,Sidalcea malviflora
22340718,4/11/19,2019-04-11 20:20:19 UTC,Pacific Time (US & Canada),research,https://www.inaturalist.org/observations/22340718,https://static.inaturalist.org/photos/34601118/medium.jpeg,,1,0,FALSE,"Oak Tree Trail, Sunol, CA 94586, USA",37.61517004,-121.8843186,9,,,Alameda,Mediterranean Stork's-bill,Erodium botrys,Mediterranean Stork's-bill,Plantae,57090,Geraniaceae,Erodium,Erodium botrys
22341017,4/11/19,2019-04-11 20:27:01 UTC,Pacific Time (US & Canada),research,https://www.inaturalist.org/observations/22341017,https://static.inaturalist.org/photos/34601600/medium.jpeg,,2,0,FALSE,"Oak Tree Trail, Sunol, CA 94586, USA",37.6164736,-121.8846038,8,,,Alameda,Fiesta Flower,Pholistoma auritum,Fiesta Flower,Plantae,55437,Boraginaceae,Pholistoma,Pholistoma auritum
22342118,4/11/19,2019-04-11 20:55:26 UTC,Pacific Time (US & Canada),research,https://www.inaturalist.org/observations/22342118,https://static.inaturalist.org/photos/34603402/medium.jpeg,,1,0,FALSE,"Oak Tree Trail, Sunol, CA 94586, USA",37.61899247,-121.8892007,9,,,Alameda,Miniature Lupine,Lupinus bicolor,Miniature Lupine,Plantae,50614,Fabaceae,Lupinus,Lupinus bicolor
22342498,4/11/19,2019-04-11 21:05:51 UTC,Pacific Time (US & Canada),research,https://www.inaturalist.org/observations/22342498,https://static.inaturalist.org/photos/34604097/medium.jpeg,,1,0,FALSE,"Oak Tree Trail, Sunol, CA 94586, USA",37.61691084,-121.8888422,7,,,Alameda,coast live oak,Quercus agrifolia,coast live oak,Plantae,47850,Fagaceae,Quercus,Quercus agrifolia
22342957,4/11/19,2019-04-11 21:16:54 UTC,Pacific Time (US & Canada),research,https://www.inaturalist.org/observations/22342957,https://static.inaturalist.org/photos/34604986/medium.jpeg,,1,0,FALSE,"Oak Tree Trail, Sunol, CA 94586, USA",37.6147512,-121.8893948,6,,,Alameda,Rosy sandcrocus,Romulea rosea,Rosy sandcrocus,Plantae,68896,Iridaceae,Romulea,Romulea rosea
22343502,4/11/19,2019-04-11 21:31:15 UTC,Pacific Time (US & Canada),research,https://www.inaturalist.org/observations/22343502,https://static.inaturalist.org/photos/34605931/medium.jpeg,,1,0,FALSE,"Meadow Pond, Woodland Trail, Sunol, CA 94586, United States",37.61395271,-121.8879291,5,,,Alameda,hairy vetch,Vicia villosa,hairy vetch,Plantae,57317,Fabaceae,Vicia,Vicia villosa
22344117,4/11/19,2019-04-11 21:45:34 UTC,Pacific Time (US & Canada),research,https://www.inaturalist.org/observations/22344117,https://static.inaturalist.org/photos/34606816/medium.jpeg,,1,0,FALSE,"Woodland Trail, Sunol, CA 94586, USA",37.61333241,-121.8849072,9,,,Alameda,Dove's-foot crane's-bill,Geranium molle,Dove's-foot crane's-bill,Plantae,53076,Geraniaceae,Geranium,Geranium molle
22344157,4/11/19,2019-04-11 21:46:52 UTC,Pacific Time (US & Canada),research,https://www.inaturalist.org/observations/22344157,https://static.inaturalist.org/photos/34606913/medium.jpeg,,1,0,FALSE,"Woodland Trail, Sunol, CA 94586, USA",37.6135247,-121.8849313,7,,,Alameda,arroyo lupine,Lupinus succulentus,arroyo lupine,Plantae,56759,Fabaceae,Lupinus,Lupinus succulentus
22345510,4/11/19,2019-04-11 22:10:19 UTC,Pacific Time (US & Canada),research,https://www.inaturalist.org/observations/22345510,https://static.inaturalist.org/photos/34608311/medium.jpeg,,1,0,FALSE,"Oak Tree Trail, Sunol, CA 94586, USA",37.6151002,-121.8840164,11,,,Alameda,Pacific Sanicle,Sanicula crassicaulis,Pacific Sanicle,Plantae,53201,Apiaceae,Sanicula,Sanicula crassicaulis
23189978,4/26/19,2019-04-26 18:37:03 UTC,Pacific Time (US & Canada),research,https://www.inaturalist.org/observations/23189978,https://inaturalist-open-data.s3.amazonaws.com/photos/35937889/medium.jpeg,,1,0,FALSE,"Pleasanton, CA 94588, USA",37.6567115,-121.916735,21,,,Alameda,hairy vetch,Vicia villosa,hairy vetch,Plantae,57317,Fabaceae,Vicia,Vicia villosa
23191826,4/26/19,2019-04-26 18:46:28 UTC,Pacific Time (US & Canada),research,https://www.inaturalist.org/observations/23191826,https://inaturalist-open-data.s3.amazonaws.com/photos/35940621/medium.jpeg,,1,0,FALSE,"Pleasanton, CA 94588, USA",37.65267162,-121.9174177,10,,,Alameda,miner's lettuce,Claytonia perfoliata,miner's lettuce,Plantae,52994,Montiaceae,Claytonia,Claytonia perfoliata
23245780,4/26/19,2019-04-26 19:31:01 UTC,Pacific Time (US & Canada),research,https://www.inaturalist.org/observations/23245780,https://inaturalist-open-data.s3.amazonaws.com/photos/36019938/medium.jpeg,,1,0,FALSE,"Pleasanton Ridge Regional Park, Alameda County, US-CA, US",37.65602008,-121.9330634,7,,Hayward,Alameda,California bay,Umbellularia californica,California bay,Plantae,48807,Lauraceae,Umbellularia,Umbellularia californica
24026816,4/29/19,2019-04-29 21:12:19 UTC,Pacific Time (US & Canada),research,https://www.inaturalist.org/observations/24026816,https://inaturalist-open-data.s3.amazonaws.com/photos/37160637/medium.jpg,,1,0,FALSE,"94588, Pleasanton, CA, US",37.66135275,-121.9150857,5,,,Alameda,western blue-eyed grass,Sisyrinchium bellum,western blue-eyed grass,Plantae,49918,Iridaceae,Sisyrinchium,Sisyrinchium bellum
24027158,4/29/19,2019-04-29 21:13:06 UTC,Pacific Time (US & Canada),research,https://www.inaturalist.org/observations/24027158,https://inaturalist-open-data.s3.amazonaws.com/photos/37161298/medium.jpg,,1,0,FALSE,"94588, Pleasanton, CA, US",37.66133918,-121.9151816,5,,,Alameda,Common Vetch,Vicia sativa,Common Vetch,Plantae,53324,Fabaceae,Vicia,Vicia sativa
24599931,5/5/19,2019-05-05 16:25:42 UTC,Pacific Time (US & Canada),research,https://www.inaturalist.org/observations/24599931,https://static.inaturalist.org/photos/38037546/medium.jpg,,1,0,FALSE,"94588, Pleasanton, CA, US",37.65603333,-121.91842,10,,,Alameda,orange bush monkeyflower,Diplacus aurantiacus,orange bush monkeyflower,Plantae,777371,Phrymaceae,Diplacus,Diplacus aurantiacus
24624729,5/5/19,2019-05-05 17:48:51 UTC,Pacific Time (US & Canada),research,https://www.inaturalist.org/observations/24624729,https://static.inaturalist.org/photos/38075448/medium.jpg,,2,0,FALSE,"Pleasanton Ridge Regional Park, Hayward, CA, US",37.65732222,-121.9360123,639,,Hayward,Alameda,Ithuriel's Spear,Triteleia laxa,Ithuriel's Spear,Plantae,51085,Asparagaceae,Triteleia,Triteleia laxa
25018831,5/12/19,2019-05-12 20:28:48 UTC,Pacific Time (US & Canada),research,https://www.inaturalist.org/observations/25018831,https://inaturalist-open-data.s3.amazonaws.com/photos/38711830/medium.jpg,,2,0,FALSE,"Pleasanton Ridge Regional Park, Alameda County, US-CA, US",37.6218242,-121.8980376,24,,,Alameda,scarlet pimpernel,Lysimachia arvensis,scarlet pimpernel,Plantae,791928,Primulaceae,Lysimachia,Lysimachia arvensis
25019168,5/12/19,2019-05-12 20:34:35 UTC,Pacific Time (US & Canada),research,https://www.inaturalist.org/observations/25019168,https://inaturalist-open-data.s3.amazonaws.com/photos/38715092/medium.jpg,,2,0,FALSE,"Pleasanton Ridge Regional Park, Alameda County, US-CA, US",37.62410884,-121.899496,24,,,Alameda,California poppy,Eschscholzia californica,California poppy,Plantae,48225,Papaveraceae,Eschscholzia,Eschscholzia californica
25030720,5/12/19,2019-05-12 17:42:29 UTC,Pacific Time (US & Canada),research,https://www.inaturalist.org/observations/25030720,https://inaturalist-open-data.s3.amazonaws.com/photos/38730970/medium.jpeg,,2,0,FALSE,"Ridgeline Trail, Sunol, CA 94586, USA",37.60778809,-121.8889694,,,,Alameda,California sagebrush,Artemisia californica,California sagebrush,Plantae,53357,Asteraceae,Artemisia,Artemisia californica
25030726,5/12/19,2019-05-12 17:11:29 UTC,Pacific Time (US & Canada),research,https://www.inaturalist.org/observations/25030726,https://inaturalist-open-data.s3.amazonaws.com/photos/38730980/medium.jpeg,,1,0,FALSE,"Ridgeline Trail, Pleasanton, CA 94566, USA",37.63158798,-121.907074,,,,Alameda,Purple Chinese Houses,Collinsia heterophylla,Purple Chinese Houses,Plantae,47325,Plantaginaceae,Collinsia,Collinsia heterophylla
25058110,5/12/19,2019-05-12 17:13:28 UTC,Pacific Time (US & Canada),research,https://www.inaturalist.org/observations/25058110,https://inaturalist-open-data.s3.amazonaws.com/photos/38776949/medium.jpeg,,1,0,FALSE,"Ridgeline Trail, Pleasanton, CA 94566, USA",37.63162231,-121.9070663,,,,Alameda,orange bush monkeyflower,Diplacus aurantiacus,orange bush monkeyflower,Plantae,777371,Phrymaceae,Diplacus,Diplacus aurantiacus
25249330,5/14/19,2019-05-14 22:48:00 UTC,Pacific Time (US & Canada),research,https://www.inaturalist.org/observations/25249330,https://inaturalist-open-data.s3.amazonaws.com/photos/39088835/medium.jpg,,2,0,FALSE,ç¾Žåœ‹åŠ åˆ©ç¦å°¼äºžè˜‡å°¼å¥§çˆ¾,37.61642844,-121.8858388,31,,,Alameda,Common Vetch,Vicia sativa,Common Vetch,Plantae,53324,Fabaceae,Vicia,Vicia sativa
26290854,5/31/19,2019-05-31 23:25:45 UTC,Pacific Time (US & Canada),research,https://www.inaturalist.org/observations/26290854,https://inaturalist-open-data.s3.amazonaws.com/photos/40810735/medium.jpg,,1,0,FALSE,"Pleasanton Ridge Regional Park, Castro Valley, CA, US",37.64789732,-121.9323225,2800,,,Alameda,orange bush monkeyflower,Diplacus aurantiacus,orange bush monkeyflower,Plantae,777371,Phrymaceae,Diplacus,Diplacus aurantiacus
26591320,6/3/19,2019-06-03 16:48:33 UTC,Pacific Time (US & Canada),research,https://www.inaturalist.org/observations/26591320,https://static.inaturalist.org/photos/41301595/medium.jpg,,2,0,FALSE,"94588, Pleasanton, CA, US",37.66103667,-121.9163883,5,,,Alameda,Indian teasel,Dipsacus sativus,fuller's teasel,Plantae,53028,Caprifoliaceae,Dipsacus,Dipsacus sativus
26591229,6/5/19,2019-06-05 15:26:13 UTC,Pacific Time (US & Canada),research,https://www.inaturalist.org/observations/26591229,https://static.inaturalist.org/photos/41301382/medium.jpg,,1,0,FALSE,"94588, Pleasanton, CA, US",37.65666667,-121.92392,5,,Hayward,Alameda,Yellow Mariposa Lily,Calochortus luteus,Yellow Mariposa Lily,Plantae,51077,Liliaceae,Calochortus,Calochortus luteus
26591522,6/5/19,2019-06-05 15:54:22 UTC,Pacific Time (US & Canada),research,https://www.inaturalist.org/observations/26591522,https://static.inaturalist.org/photos/41301980/medium.jpg,,1,0,FALSE,"94588, Pleasanton, CA, US",37.65505333,-121.9168783,5,,,Alameda,Coyote Mint,Monardella villosa,Coyote Mint,Plantae,52181,Lamiaceae,Monardella,Monardella villosa
26618065,6/8/19,2019-06-08 17:29:54 UTC,Pacific Time (US & Canada),research,https://www.inaturalist.org/observations/26618065,https://inaturalist-open-data.s3.amazonaws.com/photos/41343120/medium.jpg,,2,0,FALSE,"94588, Pleasanton, CA, US",37.65648315,-121.9237244,6,,Hayward,Alameda,Yellow Mariposa Lily,Calochortus luteus,Yellow Mariposa Lily,Plantae,51077,Liliaceae,Calochortus,Calochortus luteus
26620614,6/8/19,2019-06-08 18:07:04 UTC,Pacific Time (US & Canada),research,https://www.inaturalist.org/observations/26620614,https://inaturalist-open-data.s3.amazonaws.com/photos/41346841/medium.jpg,,1,0,FALSE,"94588, Pleasanton, CA, US",37.65513485,-121.91681,7,,,Alameda,Coyote Mint,Monardella villosa,Coyote Mint,Plantae,52181,Lamiaceae,Monardella,Monardella villosa
26923091,6/13/19,2019-06-13 17:14:22 UTC,Pacific Time (US & Canada),research,https://www.inaturalist.org/observations/26923091,https://static.inaturalist.org/photos/41835900/medium.jpg,,2,0,FALSE,"94588, Pleasanton, CA, US",37.655025,-121.9167783,10,,,Alameda,Coyote Mint,Monardella villosa,Coyote Mint,Plantae,52181,Lamiaceae,Monardella,Monardella villosa
28170500,7/3/19,2019-07-04 01:21:43 UTC,Pacific Time (US & Canada),research,https://www.inaturalist.org/observations/28170500,https://inaturalist-open-data.s3.amazonaws.com/photos/43896248/medium.jpg,,1,0,FALSE,"Pleasanton Ridge Regional Park, Hayward, CA, US",37.65312772,-121.9381765,816,,Hayward,Alameda,Coyote Mint,Monardella villosa,Coyote Mint,Plantae,52181,Lamiaceae,Monardella,Monardella villosa
28170591,7/3/19,2019-07-04 01:26:03 UTC,Pacific Time (US & Canada),research,https://www.inaturalist.org/observations/28170591,https://inaturalist-open-data.s3.amazonaws.com/photos/43896379/medium.jpg,,2,0,FALSE,"Pleasanton Ridge Regional Park, Hayward, CA, US",37.65203462,-121.9383862,515,,Hayward,Alameda,wavy-leafed soap plant,Chlorogalum pomeridianum,wavy-leafed soap plant,Plantae,47597,Asparagaceae,Chlorogalum,Chlorogalum pomeridianum
32576435,7/6/19,2019-07-06 13:58:00 UTC,Pacific Time (US & Canada),research,https://www.inaturalist.org/observations/32576435,https://inaturalist-open-data.s3.amazonaws.com/photos/51107037/medium.jpeg,,1,0,FALSE,"Sunol, CA, USA",37.61516,-121.889666,,,,Alameda,milk thistle,Silybum marianum,milk thistle,Plantae,52586,Asteraceae,Silybum,Silybum marianum
32576439,7/6/19,2019-07-06 16:30:00 UTC,Pacific Time (US & Canada),research,https://www.inaturalist.org/observations/32576439,https://inaturalist-open-data.s3.amazonaws.com/photos/51107059/medium.jpeg,,1,0,FALSE,"Hayward, CA, USA",37.656125,-121.924948,,,Hayward,Alameda,bull thistle,Cirsium vulgare,Bull Thistle,Plantae,52989,Asteraceae,Cirsium,Cirsium vulgare
28378912,7/7/19,2019-07-07 18:11:25 UTC,Pacific Time (US & Canada),research,https://www.inaturalist.org/observations/28378912,https://inaturalist-open-data.s3.amazonaws.com/photos/44234726/medium.jpg,,1,0,FALSE,"Pleasanton Ridge Regional Park, Sunol, CA, US",37.61989732,-121.8871604,6,,,Alameda,liseron des champs,Convolvulus arvensis,field bindweed,Plantae,53021,Convolvulaceae,Convolvulus,Convolvulus arvensis
28379446,7/7/19,2019-07-07 18:18:39 UTC,Pacific Time (US & Canada),research,https://www.inaturalist.org/observations/28379446,https://inaturalist-open-data.s3.amazonaws.com/photos/44235481/medium.jpg,,1,0,FALSE,"Pleasanton Ridge Regional Park, Sunol, CA, US",37.62074205,-121.8884692,6,,,Alameda,Mediterranean Stork's-bill,Erodium botrys,Mediterranean Stork's-bill,Plantae,57090,Geraniaceae,Erodium,Erodium botrys
28379526,7/7/19,2019-07-07 18:19:41 UTC,Pacific Time (US & Canada),research,https://www.inaturalist.org/observations/28379526,https://inaturalist-open-data.s3.amazonaws.com/photos/44235564/medium.jpg,,1,0,FALSE,"Pleasanton Ridge Regional Park, Sunol, CA, US",37.62071599,-121.8884427,6,,,Alameda,California poppy,Eschscholzia californica,California poppy,Plantae,48225,Papaveraceae,Eschscholzia,Eschscholzia californica
28379791,7/7/19,2019-07-07 18:23:07 UTC,Pacific Time (US & Canada),research,https://www.inaturalist.org/observations/28379791,https://inaturalist-open-data.s3.amazonaws.com/photos/44235989/medium.jpg,,1,0,FALSE,"Pleasanton Ridge Regional Park, Sunol, CA, US",37.62106289,-121.8889147,6,,,Alameda,western sycamore,Platanus racemosa,western sycamore,Plantae,58231,Platanaceae,Platanus,Platanus racemosa
28380591,7/7/19,2019-07-07 18:34:05 UTC,Pacific Time (US & Canada),research,https://www.inaturalist.org/observations/28380591,https://inaturalist-open-data.s3.amazonaws.com/photos/44237274/medium.jpg,,1,0,FALSE,"Pleasanton Ridge Regional Park, Pleasanton, CA, US",37.62171446,-121.8915581,6,,,Alameda,orange bush monkeyflower,Diplacus aurantiacus,orange bush monkeyflower,Plantae,777371,Phrymaceae,Diplacus,Diplacus aurantiacus
28381635,7/7/19,2019-07-07 18:47:50 UTC,Pacific Time (US & Canada),research,https://www.inaturalist.org/observations/28381635,https://inaturalist-open-data.s3.amazonaws.com/photos/44238995/medium.jpg,the same oak trunk as the previous five entries ,1,0,FALSE,"Pleasanton Ridge Regional Park, Sunol, CA, US",37.62162779,-121.8924907,8,,,Alameda,California black oak,Quercus kelloggii,California black oak,Plantae,49919,Fagaceae,Quercus,Quercus kelloggii
28383033,7/7/19,2019-07-07 19:09:02 UTC,Pacific Time (US & Canada),research,https://www.inaturalist.org/observations/28383033,https://inaturalist-open-data.s3.amazonaws.com/photos/44241071/medium.jpg,,1,0,FALSE,"Pleasanton Ridge Regional Park, Pleasanton, CA, US",37.6233033,-121.8936192,12,,,Alameda,milk thistle,Silybum marianum,milk thistle,Plantae,52586,Asteraceae,Silybum,Silybum marianum
28384839,7/7/19,2019-07-07 19:34:10 UTC,Pacific Time (US & Canada),research,https://www.inaturalist.org/observations/28384839,https://inaturalist-open-data.s3.amazonaws.com/photos/44244001/medium.jpg,,1,0,FALSE,"94566, Pleasanton, CA, US",37.62440218,-121.8947015,6,,,Alameda,western vervain,Verbena lasiostachys,western vervain,Plantae,53316,Verbenaceae,Verbena,Verbena lasiostachys
28384911,7/7/19,2019-07-07 19:34:51 UTC,Pacific Time (US & Canada),research,https://www.inaturalist.org/observations/28384911,https://inaturalist-open-data.s3.amazonaws.com/photos/44244107/medium.jpg,,1,0,FALSE,"94566, Pleasanton, CA, US",37.6244088,-121.8947091,6,,,Alameda,poison hemlock,Conium maculatum,poison hemlock,Plantae,52998,Apiaceae,Conium,Conium maculatum
28385298,7/7/19,2019-07-07 19:40:15 UTC,Pacific Time (US & Canada),research,https://www.inaturalist.org/observations/28385298,https://inaturalist-open-data.s3.amazonaws.com/photos/44244670/medium.jpg,,1,0,FALSE,"94566, Pleasanton, CA, US",37.62526871,-121.8946969,6,,,Alameda,coast live oak,Quercus agrifolia,coast live oak,Plantae,47850,Fagaceae,Quercus,Quercus agrifolia
28385399,7/7/19,2019-07-07 19:42:15 UTC,Pacific Time (US & Canada),research,https://www.inaturalist.org/observations/28385399,https://inaturalist-open-data.s3.amazonaws.com/photos/44244905/medium.jpg,,1,0,FALSE,"94566, Pleasanton, CA, US",37.62533993,-121.8946578,6,,,Alameda,Pacific poison oak,Toxicodendron diversilobum,Pacific poison oak,Plantae,51080,Anacardiaceae,Toxicodendron,Toxicodendron diversilobum
28389457,7/7/19,2019-07-07 20:40:21 UTC,Pacific Time (US & Canada),research,https://www.inaturalist.org/observations/28389457,https://inaturalist-open-data.s3.amazonaws.com/photos/44251801/medium.jpg,,1,0,FALSE,"Pleasanton Ridge Regional Park, Sunol, CA, US",37.62093955,-121.891591,6,,,Alameda,bristly dogtail grass,Cynosurus echinatus,bristly dogtail grass,Plantae,47695,Poaceae,Cynosurus,Cynosurus echinatus
28390037,7/7/19,2019-07-07 20:47:06 UTC,Pacific Time (US & Canada),research,https://www.inaturalist.org/observations/28390037,https://inaturalist-open-data.s3.amazonaws.com/photos/44252984/medium.jpg,Large tree hanging over the meadow pond,1,0,FALSE,"Pleasanton Ridge Regional Park, Sunol, CA, US",37.62021192,-121.8912662,6,,,Alameda,Arroyo Willow,Salix lasiolepis,Arroyo Willow,Plantae,53452,Salicaceae,Salix,Salix lasiolepis
31411904,8/24/19,2019-08-24 17:01:17 UTC,Pacific Time (US & Canada),research,https://www.inaturalist.org/observations/31411904,https://inaturalist-open-data.s3.amazonaws.com/photos/49159212/medium.jpg,,1,0,FALSE,"Pleasanton Ridge Regional Park, Pleasanton, CA, US",37.65510506,-121.9234594,4,,Hayward,Alameda,Vinegar Weed,Trichostema lanceolatum,Vinegar Weed,Plantae,54875,Lamiaceae,Trichostema,Trichostema lanceolatum
36147724,9/17/19,2019-09-18 02:00:28 UTC,Pacific Time (US & Canada),research,https://www.inaturalist.org/observations/36147724,https://static.inaturalist.org/photos/57104786/medium.jpg,,2,0,FALSE,"Pleasanton, CA, US",37.64423,-121.9208,,,,Alameda,blue oak,Quercus douglasii,blue oak,Plantae,49009,Fagaceae,Quercus,Quercus douglasii
33038875,9/19/19,2019-09-19 17:57:00 UTC,Pacific Time (US & Canada),research,https://www.inaturalist.org/observations/33038875,https://inaturalist-open-data.s3.amazonaws.com/photos/51858405/medium.jpg,,2,0,FALSE,"Sunol, CA, USA",37.64559853,-121.9181105,,,,Alameda,turkey mullein,Croton setiger,turkey mullein,Plantae,154156,Euphorbiaceae,Croton,Croton setiger
33038876,9/19/19,2019-09-19 17:58:00 UTC,Pacific Time (US & Canada),research,https://www.inaturalist.org/observations/33038876,https://inaturalist-open-data.s3.amazonaws.com/photos/51858434/medium.jpg,,2,0,FALSE,"Sunol, CA, USA",37.64578518,-121.9181116,,,,Alameda,Vinegar Weed,Trichostema lanceolatum,Vinegar Weed,Plantae,54875,Lamiaceae,Trichostema,Trichostema lanceolatum
33038881,9/19/19,2019-09-19 19:41:00 UTC,Pacific Time (US & Canada),research,https://www.inaturalist.org/observations/33038881,https://inaturalist-open-data.s3.amazonaws.com/photos/51858511/medium.jpg,,2,0,FALSE,"Pleasanton Ridge Regional Park, Alameda, California, United States",37.66079172,-121.9331041,,,Hayward,Alameda,Fitch's tarweed,Centromadia fitchii,Fitch's tarweed,Plantae,58804,Asteraceae,Centromadia,Centromadia fitchii
33038882,9/19/19,2019-09-19 19:52:00 UTC,Pacific Time (US & Canada),research,https://www.inaturalist.org/observations/33038882,https://inaturalist-open-data.s3.amazonaws.com/photos/51858558/medium.jpg,,2,0,FALSE,"Pleasanton Ridge Regional Park, Alameda, California, United States",37.65954008,-121.9307721,,,Hayward,Alameda,Vinegar Weed,Trichostema lanceolatum,Vinegar Weed,Plantae,54875,Lamiaceae,Trichostema,Trichostema lanceolatum
33038886,9/19/19,2019-09-19 20:11:00 UTC,Pacific Time (US & Canada),research,https://www.inaturalist.org/observations/33038886,https://inaturalist-open-data.s3.amazonaws.com/photos/51858577/medium.jpg,,1,0,FALSE,"Hayward, CA, USA",37.65624087,-121.9255681,,,Hayward,Alameda,Fitch's tarweed,Centromadia fitchii,Fitch's tarweed,Plantae,58804,Asteraceae,Centromadia,Centromadia fitchii
33038889,9/19/19,2019-09-19 20:19:00 UTC,Pacific Time (US & Canada),research,https://www.inaturalist.org/observations/33038889,https://inaturalist-open-data.s3.amazonaws.com/photos/51858590/medium.jpg,,1,0,FALSE,"Pleasanton Ridge Regional Park, Alameda, California, United States",37.65364635,-121.9230718,,,Hayward,Alameda,Vinegar Weed,Trichostema lanceolatum,Vinegar Weed,Plantae,54875,Lamiaceae,Trichostema,Trichostema lanceolatum
38430687,2/8/20,2020-02-08 10:05:17 UTC,UTC,research,https://www.inaturalist.org/observations/38430687,https://inaturalist-open-data.s3.amazonaws.com/photos/61076124/medium.jpg,,0,0,FALSE,"Pleasanton, CA, US",37.65264584,-121.9174245,6,,,Alameda,California bay,Umbellularia californica,California bay,Plantae,48807,Lauraceae,Umbellularia,Umbellularia californica
38685968,2/15/20,2020-02-15 20:24:26 UTC,Pacific Time (US & Canada),research,https://www.inaturalist.org/observations/38685968,https://inaturalist-open-data.s3.amazonaws.com/photos/61520723/medium.jpg,,2,0,FALSE,"Sunol, CA, US",37.61991254,-121.8982514,5,,,Alameda,California buckeye,Aesculus californica,California buckeye,Plantae,53348,Sapindaceae,Aesculus,Aesculus californica
38692035,2/15/20,2020-02-16 01:22:04 UTC,Hawaii,research,https://www.inaturalist.org/observations/38692035,https://inaturalist-open-data.s3.amazonaws.com/photos/61531732/medium.jpeg,,0,0,FALSE,Sunol,37.61755236,-121.8889432,,,,Alameda,Olive,Olea europaea,Olive,Plantae,57140,Oleaceae,Olea,Olea europaea
38727867,2/16/20,2020-02-16 14:17:50 UTC,UTC,research,https://www.inaturalist.org/observations/38727867,https://inaturalist-open-data.s3.amazonaws.com/photos/61596456/medium.jpg,,2,0,FALSE,"Pleasanton, CA, US",37.65725583,-121.9167528,59,,,Alameda,Pacific hound's tongue,Adelinia grande,Pacific hound's tongue,Plantae,769151,Boraginaceae,Adelinia,Adelinia grande
39178239,2/24/20,2020-02-24 20:25:50 UTC,Pacific Time (US & Canada),research,https://www.inaturalist.org/observations/39178239,https://inaturalist-open-data.s3.amazonaws.com/photos/62120928/medium.jpg,,3,0,FALSE,"Pleasanton, CA, US",37.65278382,-121.9213929,5,,Hayward,Alameda,redmaids,Calandrinia menziesii,redmaids,Plantae,400267,Montiaceae,Calandrinia,Calandrinia menziesii
39178638,2/24/20,2020-02-24 20:34:47 UTC,Pacific Time (US & Canada),research,https://www.inaturalist.org/observations/39178638,https://inaturalist-open-data.s3.amazonaws.com/photos/62556465/medium.jpg,,1,0,FALSE,"Pleasanton Ridge Regional Park, Hayward, CA, US",37.65723958,-121.9247694,5,,Hayward,Alameda,glue-seed,Blennosperma nanum,glue-seed,Plantae,57914,Asteraceae,Blennosperma,Blennosperma nanum
39439213,3/1/20,2020-03-01 17:07:27 UTC,UTC,research,https://www.inaturalist.org/observations/39439213,https://static.inaturalist.org/photos/62573272/medium.jpg,,1,0,FALSE,"Pleasanton Ridge Regional Park, Hayward, CA, US",37.65971369,-121.9367552,1486,,Hayward,Alameda,Cherry-plum,Prunus cerasifera,Cherry-plum,Plantae,55837,Rosaceae,Prunus,Prunus cerasifera
39564723,3/3/20,2020-03-03 09:08:03 UTC,UTC,research,https://www.inaturalist.org/observations/39564723,https://inaturalist-open-data.s3.amazonaws.com/photos/62782297/medium.jpeg,,0,0,FALSE,"Public Restrooms, Sunol, CA 94586, USA",37.61511568,-121.8835613,5,,,Alameda,Pacific poison oak,Toxicodendron diversilobum,Pacific poison oak,Plantae,51080,Anacardiaceae,Toxicodendron,Toxicodendron diversilobum
40213063,3/18/20,2020-03-18 18:23:21 UTC,Pacific Time (US & Canada),research,https://www.inaturalist.org/observations/40213063,https://inaturalist-open-data.s3.amazonaws.com/photos/63879092/medium.jpg,,2,0,FALSE,"Pleasanton Ridge Regional Park, Hayward, CA, US",37.65141333,-121.9367617,5,,Hayward,Alameda,California bay,Umbellularia californica,California bay,Plantae,48807,Lauraceae,Umbellularia,Umbellularia californica
40213410,3/18/20,2020-03-18 18:06:23 UTC,Pacific Time (US & Canada),research,https://www.inaturalist.org/observations/40213410,https://inaturalist-open-data.s3.amazonaws.com/photos/63879555/medium.jpg,,1,0,FALSE,"Pleasanton, CA, US",37.64291667,-121.92858,6,,,Alameda,Pacific hound's tongue,Adelinia grande,Pacific hound's tongue,Plantae,769151,Boraginaceae,Adelinia,Adelinia grande
40213660,3/18/20,2020-03-18 17:43:49 UTC,Pacific Time (US & Canada),research,https://www.inaturalist.org/observations/40213660,https://inaturalist-open-data.s3.amazonaws.com/photos/63879977/medium.jpg,,1,0,FALSE,"Pleasanton, CA, US",37.64141167,-121.9239717,4,,,Alameda,Blue Dicks,Dipterostemon capitatus capitatus,,Plantae,1196824,Asparagaceae,Dipterostemon,Dipterostemon capitatus
40213719,3/18/20,2020-03-18 17:41:28 UTC,Pacific Time (US & Canada),research,https://www.inaturalist.org/observations/40213719,https://inaturalist-open-data.s3.amazonaws.com/photos/63880056/medium.jpg,,1,0,FALSE,"Pleasanton, CA, US",37.64232,-121.9233783,6,,,Alameda,Miniature Lupine,Lupinus bicolor,Miniature Lupine,Plantae,50614,Fabaceae,Lupinus,Lupinus bicolor
40213790,3/18/20,2020-03-18 17:13:57 UTC,Pacific Time (US & Canada),research,https://www.inaturalist.org/observations/40213790,https://inaturalist-open-data.s3.amazonaws.com/photos/63880142/medium.jpg,,1,0,FALSE,"Pleasanton, CA, US",37.65546167,-121.922745,5,,Hayward,Alameda,Blue Dicks,Dipterostemon capitatus capitatus,,Plantae,1196824,Asparagaceae,Dipterostemon,Dipterostemon capitatus
40214064,3/18/20,2020-03-18 16:44:26 UTC,Pacific Time (US & Canada),research,https://www.inaturalist.org/observations/40214064,https://inaturalist-open-data.s3.amazonaws.com/photos/63880546/medium.jpg,,1,0,FALSE,"Pleasanton, CA, US",37.65466333,-121.91655,4,,,Alameda,miner's lettuce,Claytonia perfoliata,miner's lettuce,Plantae,52994,Montiaceae,Claytonia,Claytonia perfoliata
40214106,3/18/20,2020-03-18 16:43:31 UTC,Pacific Time (US & Canada),research,https://www.inaturalist.org/observations/40214106,https://inaturalist-open-data.s3.amazonaws.com/photos/63880650/medium.jpg,,1,0,FALSE,"Pleasanton, CA, US",37.65507833,-121.9167167,4,,,Alameda,Pacific pea,Lathyrus vestitus,Pacific pea,Plantae,50320,Fabaceae,Lathyrus,Lathyrus vestitus
40214189,3/18/20,2020-03-18 16:39:10 UTC,Pacific Time (US & Canada),research,https://www.inaturalist.org/observations/40214189,https://inaturalist-open-data.s3.amazonaws.com/photos/63880789/medium.jpg,,1,0,FALSE,"Pleasanton, CA, US",37.656625,-121.91735,4,,,Alameda,hairy vetch,Vicia villosa,hairy vetch,Plantae,57317,Fabaceae,Vicia,Vicia villosa
40214248,3/18/20,2020-03-18 16:35:50 UTC,Pacific Time (US & Canada),research,https://www.inaturalist.org/observations/40214248,https://inaturalist-open-data.s3.amazonaws.com/photos/63880877/medium.jpg,,1,0,FALSE,"Pleasanton, CA, US",37.65714167,-121.9164717,5,,,Alameda,California buttercup,Ranunculus californicus,California buttercup,Plantae,52173,Ranunculaceae,Ranunculus,Ranunculus californicus
40214266,3/18/20,2020-03-18 16:35:35 UTC,Pacific Time (US & Canada),research,https://www.inaturalist.org/observations/40214266,https://inaturalist-open-data.s3.amazonaws.com/photos/63880915/medium.jpg,,1,0,FALSE,"Pleasanton, CA, US",37.65717,-121.9165417,5,,,Alameda,Pacific hound's tongue,Adelinia grande,Pacific hound's tongue,Plantae,769151,Boraginaceae,Adelinia,Adelinia grande
