id,observed_on,time_observed_at,time_zone,quality_grade,url,image_url,description,num_identification_agreements,num_identification_disagreements,captive_cultivated,place_guess,latitude,longitude,geoprivacy,place_town_name,place_county_name,species_guess,scientific_name,common_name,iconic_taxon_name,taxon_id,taxon_family_name,taxon_genus_name,taxon_species_name
104188607,1/1/22,2022-01-01 21:16:00 UTC,Pacific Time (US & Canada),research,https://www.inaturalist.org/observations/104188607,https://inaturalist-open-data.s3.amazonaws.com/photos/174558650/medium.jpeg,,1,0,FALSE,"Sunol Wilderness Regional Preserve, CA, USA",37.530981,-121.819691,,,Alameda,coyote brush,Baccharis pilularis,coyote brush,Plantae,53359,Asteraceae,Baccharis,Baccharis pilularis
104188609,1/1/22,2022-01-01 21:40:00 UTC,Pacific Time (US & Canada),research,https://www.inaturalist.org/observations/104188609,https://inaturalist-open-data.s3.amazonaws.com/photos/174558689/medium.jpeg,,1,0,FALSE,"Sunol Wilderness Regional Preserve, CA, USA",37.52706,-121.827025,,,Alameda,Shepherd's-Purse,Capsella bursa-pastoris,shepherd's-purse,Plantae,56121,Brassicaceae,Capsella,Capsella bursa-pastoris
104667115,1/8/22,2022-01-08 12:46:02 UTC,UTC,research,https://www.inaturalist.org/observations/104667115,https://static.inaturalist.org/photos/175431146/medium.jpg,,2,0,FALSE,"Sunol Wilderness Regional Preserve, Sunol, CA, US",37.52339505,-121.8332193,,,Alameda,blue elder,Sambucus cerulea,blue elder,Plantae,143799,Viburnaceae,Sambucus,Sambucus cerulea
104681782,1/9/22,2022-01-09 11:15:26 UTC,UTC,research,https://www.inaturalist.org/observations/104681782,https://inaturalist-open-data.s3.amazonaws.com/photos/175458008/medium.jpg,,1,0,FALSE,"Sunol Wilderness Regional Preserve, Sunol, CA, US",37.52003833,-121.8227083,,,Alameda,milkmaids,Cardamine californica,milkmaids,Plantae,49651,Brassicaceae,Cardamine,Cardamine californica
104690215,1/8/22,2022-01-08 23:06:55 UTC,Pacific Time (US & Canada),research,https://www.inaturalist.org/observations/104690215,https://inaturalist-open-data.s3.amazonaws.com/photos/175475965/medium.jpeg,large population amidst cattle grazing slopes,1,0,FALSE,"Sunol Regional Wilderness, Alameda County, US-CA, US",37.50961603,-121.8241447,,,Alameda,redmaids,Calandrinia menziesii,redmaids,Plantae,400267,Montiaceae,Calandrinia,Calandrinia menziesii
104737731,1/10/22,2022-01-10 17:25:00 UTC,Pacific Time (US & Canada),research,https://www.inaturalist.org/observations/104737731,https://inaturalist-open-data.s3.amazonaws.com/photos/175566290/medium.jpg,,1,0,FALSE,"Sunol Regional Wilderness, Alameda, California, United States",37.53108167,-121.819465,,,Alameda,coyote brush,Baccharis pilularis,coyote brush,Plantae,53359,Asteraceae,Baccharis,Baccharis pilularis
104737735,1/10/22,2022-01-10 18:22:00 UTC,Pacific Time (US & Canada),research,https://www.inaturalist.org/observations/104737735,https://inaturalist-open-data.s3.amazonaws.com/photos/175566314/medium.jpg,,1,0,FALSE,"Alameda County, CA, USA",37.531835,-121.8135,,,Alameda,orange bush monkeyflower,Diplacus aurantiacus,orange bush monkeyflower,Plantae,777371,Phrymaceae,Diplacus,Diplacus aurantiacus
104737736,1/10/22,2022-01-10 18:19:00 UTC,Pacific Time (US & Canada),research,https://www.inaturalist.org/observations/104737736,https://inaturalist-open-data.s3.amazonaws.com/photos/175566322/medium.jpg,,1,0,FALSE,"Alameda County, CA, USA",37.532265,-121.8130783,,,Alameda,Common Yarrow,Achillea millefolium,common yarrow,Plantae,52821,Asteraceae,Achillea,Achillea millefolium
105020588,1/15/22,2022-01-15 16:30:15 UTC,Eastern Time (US & Canada),research,https://www.inaturalist.org/observations/105020588,https://inaturalist-open-data.s3.amazonaws.com/photos/176110491/medium.jpg,,1,0,FALSE,"Sunol Wilderness Regional Preserve, Sunol, CA, US",37.520095,-121.8215633,,,Alameda,milkmaids,Cardamine californica,milkmaids,Plantae,49651,Brassicaceae,Cardamine,Cardamine californica
105082798,1/16/22,2022-01-16 13:56:54 UTC,UTC,research,https://www.inaturalist.org/observations/105082798,https://inaturalist-open-data.s3.amazonaws.com/photos/176229756/medium.jpg,,1,0,FALSE,"Sunol Wilderness Regional Preserve, Sunol, CA, US",37.51079805,-121.8228383,,,Alameda,miner's lettuce,Claytonia perfoliata,miner's lettuce,Plantae,52994,Montiaceae,Claytonia,Claytonia perfoliata
105183373,1/17/22,2022-01-17 18:24:01 UTC,Hawaii,research,https://www.inaturalist.org/observations/105183373,https://static.inaturalist.org/photos/176424813/medium.jpg,,1,0,FALSE,"Sunol Regional Wilderness, Alameda County, US-CA, US",37.50780035,-121.8292623,,,Alameda,milkmaids,Cardamine californica,milkmaids,Plantae,49651,Brassicaceae,Cardamine,Cardamine californica
105183380,1/17/22,2022-01-17 19:08:04 UTC,Hawaii,research,https://www.inaturalist.org/observations/105183380,https://static.inaturalist.org/photos/176424848/medium.jpg,,1,0,FALSE,"Sunol Regional Wilderness, Alameda County, US-CA, US",37.50491478,-121.8187228,,,Alameda,California fuchsia,Epilobium canum,California fuchsia,Plantae,53051,Onagraceae,Epilobium,Epilobium canum
105186838,1/13/22,2022-01-13 22:20:04 UTC,Pacific Time (US & Canada),research,https://www.inaturalist.org/observations/105186838,https://inaturalist-open-data.s3.amazonaws.com/photos/176431000/medium.jpeg,,1,0,FALSE,"Sunol, CA 94586, USA",37.53189167,-121.826375,,,Alameda,milkmaids,Cardamine californica,milkmaids,Plantae,49651,Brassicaceae,Cardamine,Cardamine californica
105260902,1/16/22,2022-01-16 19:48:35 UTC,Pacific Time (US & Canada),research,https://www.inaturalist.org/observations/105260902,https://inaturalist-open-data.s3.amazonaws.com/photos/176573014/medium.jpg,Shady area along small stream with overstory of bay laurel and coast live oak,1,0,FALSE,"Sunol Wilderness Regional Preserve, Sunol, CA, US",37.52783833,-121.8108533,,,Alameda,milkmaids,Cardamine californica,milkmaids,Plantae,49651,Brassicaceae,Cardamine,Cardamine californica
105272875,1/19/22,2022-01-19 12:29:00 UTC,UTC,research,https://www.inaturalist.org/observations/105272875,https://inaturalist-open-data.s3.amazonaws.com/photos/176595929/medium.jpg,,1,0,FALSE,"Sunol Wilderness Regional Preserve, Sunol, CA, US",37.50916473,-121.8288675,,,Alameda,California buckwheat,Eriogonum fasciculatum,California Buckwheat,Plantae,54999,Polygonaceae,Eriogonum,Eriogonum fasciculatum
105303288,1/19/22,2022-01-19 17:54:04 UTC,Pacific Time (US & Canada),research,https://www.inaturalist.org/observations/105303288,https://inaturalist-open-data.s3.amazonaws.com/photos/176656612/medium.jpg,,1,0,FALSE,"Sunol Wilderness Regional Preserve, Sunol, CA, US",37.53112,-121.81922,,,Alameda,wavy-leafed soap plant,Chlorogalum pomeridianum,wavy-leafed soap plant,Plantae,47597,Asparagaceae,Chlorogalum,Chlorogalum pomeridianum
105395137,1/22/22,2022-01-22 22:40:57 UTC,Pacific Time (US & Canada),research,https://www.inaturalist.org/observations/105395137,https://static.inaturalist.org/photos/176829113/medium.jpg,,1,0,FALSE,"Sunol Wilderness Regional Preserve, Sunol, CA, US",37.516175,-121.8377383,,,Alameda,California bay,Umbellularia californica,California bay,Plantae,48807,Lauraceae,Umbellularia,Umbellularia californica
105408121,1/22/22,2022-01-22 11:02:31 UTC,UTC,research,https://www.inaturalist.org/observations/105408121,https://inaturalist-open-data.s3.amazonaws.com/photos/176853923/medium.jpg,,2,0,FALSE,"Sunol Regional Wilderness, Alameda County, US-CA, US",37.50427284,-121.8213529,,,Alameda,cardo mariano,Silybum marianum,milk thistle,Plantae,52586,Asteraceae,Silybum,Silybum marianum
105481855,1/22/22,2022-01-22 22:30:37 UTC,Pacific Time (US & Canada),research,https://www.inaturalist.org/observations/105481855,https://static.inaturalist.org/photos/176992972/medium.jpg,,1,0,FALSE,"Sunol Wilderness Regional Preserve, Sunol, CA, US",37.51620833,-121.837905,,,Alameda,geraniums and cranesbills,Geranium,geraniums and cranesbills,Plantae,47701,Geraniaceae,Geranium,
105653650,1/17/22,2022-01-18 00:54:54 UTC,Pacific Time (US & Canada),research,https://www.inaturalist.org/observations/105653650,https://inaturalist-open-data.s3.amazonaws.com/photos/177320092/medium.jpg,Flowering early?,1,0,FALSE,Sunol Regional Wilderness,37.528705,-121.813069,,,Alameda,Silver Lupine,Lupinus albifrons,Silver Bush Lupine,Plantae,51691,Fabaceae,Lupinus,Lupinus albifrons
105739237,1/28/22,2022-01-28 20:15:56 UTC,Pacific Time (US & Canada),research,https://www.inaturalist.org/observations/105739237,https://inaturalist-open-data.s3.amazonaws.com/photos/177482589/medium.jpg,,1,0,FALSE,"Sunol Wilderness Regional Preserve, Sunol, CA, US",37.527795,-121.8107967,,,Alameda,milkmaids,Cardamine californica,milkmaids,Plantae,49651,Brassicaceae,Cardamine,Cardamine californica
105878841,1/30/22,2022-01-30 19:59:45 UTC,Pacific Time (US & Canada),research,https://www.inaturalist.org/observations/105878841,https://inaturalist-open-data.s3.amazonaws.com/photos/177752324/medium.jpg,,1,0,FALSE,"Sunol Wilderness Regional Preserve, Sunol, CA, US",37.52387,-121.8180167,,,Alameda,wavy-leafed soap plant,Chlorogalum pomeridianum,wavy-leafed soap plant,Plantae,47597,Asparagaceae,Chlorogalum,Chlorogalum pomeridianum
105951938,1/31/22,2022-01-31 23:27:42 UTC,Pacific Time (US & Canada),research,https://www.inaturalist.org/observations/105951938,https://inaturalist-open-data.s3.amazonaws.com/photos/177892390/medium.jpeg,,2,0,FALSE,"Sunol, CA 94586, USA",37.50581882,-121.8165806,,,Alameda,Blue Dicks,Dipterostemon capitatus,Blue Dicks,Plantae,1196784,Asparagaceae,Dipterostemon,Dipterostemon capitatus
106139293,2/4/22,2022-02-04 13:48:23 UTC,UTC,research,https://www.inaturalist.org/observations/106139293,https://static.inaturalist.org/photos/178245947/medium.jpg,,1,0,FALSE,"Sunol Wilderness Regional Preserve, Sunol, CA, US",37.529837,-121.8155293,,,Alameda,Silver Lupine,Lupinus albifrons,Silver Bush Lupine,Plantae,51691,Fabaceae,Lupinus,Lupinus albifrons
106144973,2/4/22,2022-02-04 12:28:00 UTC,UTC,research,https://www.inaturalist.org/observations/106144973,https://inaturalist-open-data.s3.amazonaws.com/photos/178256757/medium.jpg,,1,0,FALSE,"Sunol, CA, USA",37.547333,-121.829861,,,Alameda,California mustard,Caulanthus lasiophyllus,California mustard,Plantae,76165,Brassicaceae,Caulanthus,Caulanthus lasiophyllus
106278155,2/6/22,2022-02-06 22:32:51 UTC,Hawaii,research,https://www.inaturalist.org/observations/106278155,https://inaturalist-open-data.s3.amazonaws.com/photos/178508377/medium.jpg,,1,0,FALSE,"Sunol Wilderness Regional Preserve, Sunol, CA, US",37.53074167,-121.816545,,,Alameda,California Golden Violet,Viola pedunculata,California Golden Violet,Plantae,50825,Violaceae,Viola,Viola pedunculata
106278297,2/6/22,2022-02-06 20:59:44 UTC,Hawaii,research,https://www.inaturalist.org/observations/106278297,https://inaturalist-open-data.s3.amazonaws.com/photos/178508684/medium.jpg,,1,0,FALSE,"Sunol Wilderness Regional Preserve, Sunol, CA, US",37.52008333,-121.8217083,,,Alameda,milkmaids,Cardamine californica,milkmaids,Plantae,49651,Brassicaceae,Cardamine,Cardamine californica
106278354,2/6/22,2022-02-06 21:40:08 UTC,Hawaii,research,https://www.inaturalist.org/observations/106278354,https://inaturalist-open-data.s3.amazonaws.com/photos/178508823/medium.jpg,,1,0,FALSE,"Sunol Wilderness Regional Preserve, Sunol, CA, US",37.52206307,-121.8213777,,,Alameda,bluewitch nightshade,Solanum umbelliferum,bluewitch nightshade,Plantae,50639,Solanaceae,Solanum,Solanum umbelliferum
106281397,2/6/22,2022-02-06 22:00:59 UTC,Pacific Time (US & Canada),research,https://www.inaturalist.org/observations/106281397,https://inaturalist-open-data.s3.amazonaws.com/photos/178514746/medium.jpg,,1,0,FALSE,"Sunol Wilderness Regional Preserve, Sunol, CA, US",37.51178667,-121.8165583,,,Alameda,redmaids,Calandrinia menziesii,redmaids,Plantae,400267,Montiaceae,Calandrinia,Calandrinia menziesii
106419366,2/8/22,2022-02-08 19:15:47 UTC,Pacific Time (US & Canada),research,https://www.inaturalist.org/observations/106419366,https://inaturalist-open-data.s3.amazonaws.com/photos/178766097/medium.jpg,,1,0,FALSE,"Sunol Wilderness Regional Preserve, Sunol, CA, US",37.51652,-121.839225,,,Alameda,Pacific hound's tongue,Adelinia grande,Pacific hound's tongue,Plantae,769151,Boraginaceae,Adelinia,Adelinia grande
106644445,2/12/22,2022-02-12 21:16:56 UTC,Pacific Time (US & Canada),research,https://www.inaturalist.org/observations/106644445,https://inaturalist-open-data.s3.amazonaws.com/photos/179190821/medium.jpg,,2,0,FALSE,"Sunol Wilderness Regional Preserve, Sunol, CA, US",37.528505,-121.8111117,,,Alameda,California poppy,Eschscholzia californica,California poppy,Plantae,48225,Papaveraceae,Eschscholzia,Eschscholzia californica
106644481,2/12/22,2022-02-12 20:24:29 UTC,Pacific Time (US & Canada),research,https://www.inaturalist.org/observations/106644481,https://inaturalist-open-data.s3.amazonaws.com/photos/179190934/medium.jpg,,1,0,FALSE,"Sunol Wilderness Regional Preserve, Sunol, CA, US",37.52466167,-121.8108217,,,Alameda,hillside gooseberry,Ribes californicum,hillside gooseberry,Plantae,47129,Grossulariaceae,Ribes,Ribes californicum
106644492,2/12/22,2022-02-12 20:01:09 UTC,Pacific Time (US & Canada),research,https://www.inaturalist.org/observations/106644492,https://inaturalist-open-data.s3.amazonaws.com/photos/179190990/medium.jpg,,1,0,FALSE,"Sunol Wilderness Regional Preserve, Sunol, CA, US",37.52035833,-121.809655,,,Alameda,Dwarf Checkermallow,Sidalcea malviflora,Dwarf Checkermallow,Plantae,48795,Malvaceae,Sidalcea,Sidalcea malviflora
106644543,2/12/22,2022-02-12 19:43:29 UTC,Pacific Time (US & Canada),research,https://www.inaturalist.org/observations/106644543,https://inaturalist-open-data.s3.amazonaws.com/photos/179191101/medium.jpg,,1,0,FALSE,"Sunol Wilderness Regional Preserve, Sunol, CA, US",37.51517167,-121.81057,,,Alameda,Heermann's tarweed,Holocarpha heermannii,Heermann's tarweed,Plantae,62568,Asteraceae,Holocarpha,Holocarpha heermannii
106644588,2/12/22,2022-02-12 19:20:03 UTC,Pacific Time (US & Canada),research,https://www.inaturalist.org/observations/106644588,https://inaturalist-open-data.s3.amazonaws.com/photos/179191249/medium.jpg,,2,0,FALSE,"Sunol Wilderness Regional Preserve, Sunol, CA, US",37.51632167,-121.8051833,,,Alameda,California Golden Violet,Viola pedunculata,California Golden Violet,Plantae,50825,Violaceae,Viola,Viola pedunculata
106644602,2/12/22,2022-02-12 18:57:37 UTC,Pacific Time (US & Canada),research,https://www.inaturalist.org/observations/106644602,https://inaturalist-open-data.s3.amazonaws.com/photos/179191293/medium.jpg,,2,0,FALSE,"Sunol Wilderness Regional Preserve, Sunol, CA, US",37.515295,-121.8016533,,,Alameda,scarlet pimpernel,Lysimachia arvensis,scarlet pimpernel,Plantae,791928,Primulaceae,Lysimachia,Lysimachia arvensis
106644626,2/12/22,2022-02-12 18:56:03 UTC,Pacific Time (US & Canada),research,https://www.inaturalist.org/observations/106644626,https://inaturalist-open-data.s3.amazonaws.com/photos/179192789/medium.jpg,,2,0,FALSE,"Sunol Wilderness Regional Preserve, Sunol, CA, US",37.51522,-121.8012033,,,Alameda,Henderson's shooting star,Primula hendersonii,Henderson's shooting star,Plantae,487175,Primulaceae,Primula,Primula hendersonii
106658784,2/12/22,2022-02-12 17:16:12 UTC,Pacific Time (US & Canada),research,https://www.inaturalist.org/observations/106658784,https://inaturalist-open-data.s3.amazonaws.com/photos/179221435/medium.jpeg,,1,0,FALSE,"Sunol Regional Wilderness, Alameda County, US-CA, US",37.50562466,-121.8163727,,,Alameda,bluewitch nightshade,Solanum umbelliferum,bluewitch nightshade,Plantae,50639,Solanaceae,Solanum,Solanum umbelliferum
106658808,2/12/22,2022-02-12 19:18:59 UTC,Pacific Time (US & Canada),research,https://www.inaturalist.org/observations/106658808,https://inaturalist-open-data.s3.amazonaws.com/photos/179221529/medium.jpeg,,1,0,FALSE,"Sunol Regional Wilderness, Alameda County, US-CA, US",37.51636439,-121.805138,,,Alameda,California Golden Violet,Viola pedunculata,California Golden Violet,Plantae,50825,Violaceae,Viola,Viola pedunculata
106658822,2/12/22,2022-02-12 20:00:47 UTC,Pacific Time (US & Canada),research,https://www.inaturalist.org/observations/106658822,https://inaturalist-open-data.s3.amazonaws.com/photos/179221626/medium.jpeg,,1,0,FALSE,"Sunol, CA 94586, USA",37.52035808,-121.8096166,,,Alameda,Dwarf Checkermallow,Sidalcea malviflora,Dwarf Checkermallow,Plantae,48795,Malvaceae,Sidalcea,Sidalcea malviflora
106658825,2/12/22,2022-02-12 20:37:21 UTC,Pacific Time (US & Canada),research,https://www.inaturalist.org/observations/106658825,https://inaturalist-open-data.s3.amazonaws.com/photos/179221652/medium.jpeg,,2,0,FALSE,"Sunol Regional Wilderness, Alameda County, US-CA, US",37.52755879,-121.8115156,,,Alameda,Pacific Sanicle,Sanicula crassicaulis,Pacific Sanicle,Plantae,53201,Apiaceae,Sanicula,Sanicula crassicaulis
106658845,2/12/22,2022-02-12 21:20:25 UTC,Pacific Time (US & Canada),research,https://www.inaturalist.org/observations/106658845,https://inaturalist-open-data.s3.amazonaws.com/photos/179221697/medium.jpeg,,1,0,FALSE,"Sunol Regional Wilderness, Alameda County, US-CA, US",37.52860937,-121.8128933,,,Alameda,Blue Dicks,Dipterostemon capitatus,Blue Dicks,Plantae,1196784,Asparagaceae,Dipterostemon,Dipterostemon capitatus
106658848,2/12/22,2022-02-12 22:28:06 UTC,Pacific Time (US & Canada),research,https://www.inaturalist.org/observations/106658848,https://inaturalist-open-data.s3.amazonaws.com/photos/179221710/medium.jpeg,,2,0,FALSE,"Sunol Regional Wilderness, Alameda County, US-CA, US",37.52393621,-121.8325293,,,Alameda,purple owl's-clover,Castilleja exserta,purple owl's-clover,Plantae,49343,Orobanchaceae,Castilleja,Castilleja exserta
106659007,2/12/22,2022-02-12 16:32:00 UTC,Pacific Time (US & Canada),research,https://www.inaturalist.org/observations/106659007,https://inaturalist-open-data.s3.amazonaws.com/photos/179221925/medium.jpeg,,2,0,FALSE,"Alameda County, CA, USA",37.50555354,-121.8286145,,,Alameda,milkmaids,Cardamine californica,milkmaids,Plantae,49651,Brassicaceae,Cardamine,Cardamine californica
106659008,2/12/22,2022-02-12 16:39:00 UTC,Pacific Time (US & Canada),research,https://www.inaturalist.org/observations/106659008,https://inaturalist-open-data.s3.amazonaws.com/photos/179221930/medium.jpeg,,2,0,FALSE,"Sunol Regional Wilderness, Alameda, California, United States",37.50483982,-121.8266318,,,Alameda,great mullein,Verbascum thapsus,great mullein,Plantae,59029,Scrophulariaceae,Verbascum,Verbascum thapsus
106659017,2/12/22,2022-02-12 17:13:00 UTC,Pacific Time (US & Canada),research,https://www.inaturalist.org/observations/106659017,https://inaturalist-open-data.s3.amazonaws.com/photos/179221972/medium.jpeg,,2,0,FALSE,"Alameda County, CA, USA",37.50532136,-121.8173459,,,Alameda,Blue Dicks,Dipterostemon capitatus,Blue Dicks,Plantae,1196784,Asparagaceae,Dipterostemon,Dipterostemon capitatus
106659028,2/12/22,2022-02-12 18:36:00 UTC,Pacific Time (US & Canada),research,https://www.inaturalist.org/observations/106659028,https://inaturalist-open-data.s3.amazonaws.com/photos/179221985/medium.jpeg,,1,0,FALSE,"Sunol Regional Wilderness, Alameda, California, United States",37.51222864,-121.7969073,,,Alameda,California sagebrush,Artemisia californica,California sagebrush,Plantae,53357,Asteraceae,Artemisia,Artemisia californica
106659032,2/12/22,2022-02-12 20:40:00 UTC,Pacific Time (US & Canada),research,https://www.inaturalist.org/observations/106659032,https://inaturalist-open-data.s3.amazonaws.com/photos/179221989/medium.jpeg,,2,0,FALSE,"Alameda County, CA, USA",37.5280235,-121.8104995,,,Alameda,Pacific Sanicle,Sanicula crassicaulis,Pacific Sanicle,Plantae,53201,Apiaceae,Sanicula,Sanicula crassicaulis
106659035,2/12/22,2022-02-12 21:46:00 UTC,Pacific Time (US & Canada),research,https://www.inaturalist.org/observations/106659035,https://inaturalist-open-data.s3.amazonaws.com/photos/179222000/medium.jpeg,,2,0,FALSE,"Sunol Regional Wilderness, Alameda, California, United States",37.52876756,-121.8222629,,,Alameda,Pacific hound's tongue,Adelinia grande,Pacific hound's tongue,Plantae,769151,Boraginaceae,Adelinia,Adelinia grande
106659246,2/12/22,2022-02-12 23:18:00 UTC,Pacific Time (US & Canada),research,https://www.inaturalist.org/observations/106659246,https://inaturalist-open-data.s3.amazonaws.com/photos/179222073/medium.jpg,,1,0,FALSE,"Sunol Regional Wilderness, Alameda County, CA, USA",37.519173,-121.832565,,,Alameda,redmaids,Calandrinia menziesii,redmaids,Plantae,400267,Montiaceae,Calandrinia,Calandrinia menziesii
106659718,2/12/22,2022-02-12 17:19:00 UTC,Pacific Time (US & Canada),research,https://www.inaturalist.org/observations/106659718,https://inaturalist-open-data.s3.amazonaws.com/photos/179223415/medium.jpg,,2,0,FALSE,"Sunol Regional Wilderness, Alameda, California, United States",37.50547167,-121.8155383,,,Alameda,woollyfruit desertparsley,Lomatium dasycarpum,woollyfruit desertparsley,Plantae,56825,Apiaceae,Lomatium,Lomatium dasycarpum
106659720,2/12/22,2022-02-12 17:56:00 UTC,Pacific Time (US & Canada),research,https://www.inaturalist.org/observations/106659720,https://inaturalist-open-data.s3.amazonaws.com/photos/179223420/medium.jpg,,2,0,FALSE,"Alameda County, CA, USA",37.507555,-121.8073017,,,Alameda,Blue Dicks,Dipterostemon capitatus,Blue Dicks,Plantae,1196784,Asparagaceae,Dipterostemon,Dipterostemon capitatus
106659721,2/12/22,2022-02-12 18:02:00 UTC,Pacific Time (US & Canada),research,https://www.inaturalist.org/observations/106659721,https://inaturalist-open-data.s3.amazonaws.com/photos/179223430/medium.jpg,,2,0,FALSE,"Sunol Regional Wilderness, Alameda, California, United States",37.50722,-121.8033067,,,Alameda,California manroot,Marah fabacea,California manroot,Plantae,205330,Cucurbitaceae,Marah,Marah fabacea
106659869,2/12/22,2022-02-12 22:42:28 UTC,Pacific Time (US & Canada),research,https://www.inaturalist.org/observations/106659869,https://inaturalist-open-data.s3.amazonaws.com/photos/179190685/medium.jpg,,1,0,FALSE,"Sunol Wilderness Regional Preserve, Sunol, CA, US",37.52298667,-121.8343667,,,Alameda,coast live oak,Quercus agrifolia,coast live oak,Plantae,47850,Fagaceae,Quercus,Quercus agrifolia
106660285,2/12/22,2022-02-12 18:50:00 UTC,Pacific Time (US & Canada),research,https://www.inaturalist.org/observations/106660285,https://inaturalist-open-data.s3.amazonaws.com/photos/179224724/medium.jpg,,1,0,FALSE,"Sunol Regional Wilderness, Alameda, California, United States",37.51564167,-121.7995767,,,Alameda,Western Buttercup,Ranunculus occidentalis,Western Buttercup,Plantae,68057,Ranunculaceae,Ranunculus,Ranunculus occidentalis
106660294,2/12/22,2022-02-12 19:24:00 UTC,Pacific Time (US & Canada),research,https://www.inaturalist.org/observations/106660294,https://inaturalist-open-data.s3.amazonaws.com/photos/179224737/medium.jpg,,1,0,FALSE,"Sunol Regional Wilderness, Alameda, California, United States",37.51713667,-121.8076867,,,Alameda,woollyfruit desertparsley,Lomatium dasycarpum,woollyfruit desertparsley,Plantae,56825,Apiaceae,Lomatium,Lomatium dasycarpum
106660302,2/12/22,2022-02-12 20:20:00 UTC,Pacific Time (US & Canada),research,https://www.inaturalist.org/observations/106660302,https://inaturalist-open-data.s3.amazonaws.com/photos/179224752/medium.jpg,,1,0,FALSE,"Sunol Regional Wilderness, Alameda, California, United States",37.523575,-121.8106133,,,Alameda,Pacific poison oak,Toxicodendron diversilobum,Pacific poison oak,Plantae,51080,Anacardiaceae,Toxicodendron,Toxicodendron diversilobum
106660306,2/12/22,2022-02-12 20:24:00 UTC,Pacific Time (US & Canada),research,https://www.inaturalist.org/observations/106660306,https://inaturalist-open-data.s3.amazonaws.com/photos/179224759/medium.jpg,,1,0,FALSE,"Sunol Regional Wilderness, Alameda, California, United States",37.52450667,-121.8111167,,,Alameda,orange bush monkeyflower,Diplacus aurantiacus,orange bush monkeyflower,Plantae,777371,Phrymaceae,Diplacus,Diplacus aurantiacus
106660307,2/12/22,2022-02-12 21:10:00 UTC,Pacific Time (US & Canada),research,https://www.inaturalist.org/observations/106660307,https://inaturalist-open-data.s3.amazonaws.com/photos/179224762/medium.jpg,,1,0,FALSE,"Sunol Regional Wilderness, Alameda, California, United States",37.52851,-121.8100733,,,Alameda,Silver Lupine,Lupinus albifrons,Silver Bush Lupine,Plantae,51691,Fabaceae,Lupinus,Lupinus albifrons
106660308,2/12/22,2022-02-12 21:48:00 UTC,Pacific Time (US & Canada),research,https://www.inaturalist.org/observations/106660308,https://inaturalist-open-data.s3.amazonaws.com/photos/179224771/medium.jpg,,2,0,FALSE,"Alameda County, CA, USA",37.52874667,-121.8232833,,,Alameda,Woolly Indian Paintbrush,Castilleja foliolosa,Woolly Indian Paintbrush,Plantae,56760,Orobanchaceae,Castilleja,Castilleja foliolosa
106660312,2/12/22,2022-02-12 22:28:00 UTC,Pacific Time (US & Canada),research,https://www.inaturalist.org/observations/106660312,https://inaturalist-open-data.s3.amazonaws.com/photos/179224773/medium.jpg,,1,0,FALSE,"Sunol Regional Wilderness, Alameda, California, United States",37.52379833,-121.832845,,,Alameda,purple owl's-clover,Castilleja exserta,purple owl's-clover,Plantae,49343,Orobanchaceae,Castilleja,Castilleja exserta
106720374,2/12/22,2022-02-12 17:13:00 UTC,Pacific Time (US & Canada),research,https://www.inaturalist.org/observations/106720374,https://inaturalist-open-data.s3.amazonaws.com/photos/179337881/medium.jpg,Observation for the flower,1,0,FALSE,"Alameda County, CA, USA",37.50529667,-121.8177767,,,Alameda,Blue Dicks,Dipterostemon capitatus,Blue Dicks,Plantae,1196784,Asparagaceae,Dipterostemon,Dipterostemon capitatus
106770695,2/12/22,2022-02-12 22:34:11 UTC,Pacific Time (US & Canada),research,https://www.inaturalist.org/observations/106770695,https://inaturalist-open-data.s3.amazonaws.com/photos/179437009/medium.jpeg,,2,0,FALSE,"Sunol, CA 94586, USA",37.52336944,-121.8332722,,,Alameda,California poppy,Eschscholzia californica,California poppy,Plantae,48225,Papaveraceae,Eschscholzia,Eschscholzia californica
106895265,2/16/22,2022-02-16 22:43:05 UTC,Pacific Time (US & Canada),research,https://www.inaturalist.org/observations/106895265,https://inaturalist-open-data.s3.amazonaws.com/photos/179675177/medium.jpeg,,2,0,FALSE,"Sunol, CA 94586, USA",37.528626,-121.823525,,,Alameda,Woolly Indian Paintbrush,Castilleja foliolosa,Woolly Indian Paintbrush,Plantae,56760,Orobanchaceae,Castilleja,Castilleja foliolosa
107042102,2/18/22,2022-02-18 19:16:33 UTC,Pacific Time (US & Canada),research,https://www.inaturalist.org/observations/107042102,https://inaturalist-open-data.s3.amazonaws.com/photos/179952003/medium.jpg,,1,0,FALSE,"Sunol Wilderness Regional Preserve, Sunol, CA, US",37.53216833,-121.8132733,,,Alameda,western blue-eyed grass,Sisyrinchium bellum,western blue-eyed grass,Plantae,49918,Iridaceae,Sisyrinchium,Sisyrinchium bellum
107042966,2/18/22,2022-02-18 17:14:34 UTC,Pacific Time (US & Canada),research,https://www.inaturalist.org/observations/107042966,https://inaturalist-open-data.s3.amazonaws.com/photos/179953515/medium.jpg,,1,0,FALSE,"Sunol Wilderness Regional Preserve, Sunol, CA, US",37.53174167,-121.8136283,,,Alameda,California Golden Violet,Viola pedunculata,California Golden Violet,Plantae,50825,Violaceae,Viola,Viola pedunculata
107126792,2/19/22,2022-02-19 20:38:41 UTC,Pacific Time (US & Canada),research,https://www.inaturalist.org/observations/107126792,https://static.inaturalist.org/photos/180112839/medium.jpeg,,1,0,FALSE,"Sunol, CA 94586, USA",37.5170806,-121.831017,,,Alameda,Persischer Ehrenpreis,Veronica persica,bird's-eye speedwell,Plantae,55666,Plantaginaceae,Veronica,Veronica persica
107151522,2/20/22,2022-02-21 00:06:40 UTC,Pacific Time (US & Canada),research,https://www.inaturalist.org/observations/107151522,https://inaturalist-open-data.s3.amazonaws.com/photos/180159208/medium.jpg,,2,0,FALSE,"Sunol Wilderness Regional Preserve, Sunol, CA, US",37.520305,-121.8207633,,,Alameda,hillside gooseberry,Ribes californicum,hillside gooseberry,Plantae,47129,Grossulariaceae,Ribes,Ribes californicum
107151863,2/20/22,2022-02-20 23:33:35 UTC,Pacific Time (US & Canada),research,https://www.inaturalist.org/observations/107151863,https://inaturalist-open-data.s3.amazonaws.com/photos/180159870/medium.jpg,,1,0,FALSE,"Sunol Wilderness Regional Preserve, Sunol, CA, US",37.52423667,-121.81147,,,Alameda,western blue-eyed grass,Sisyrinchium bellum,western blue-eyed grass,Plantae,49918,Iridaceae,Sisyrinchium,Sisyrinchium bellum
107152034,2/20/22,2022-02-20 23:05:57 UTC,Pacific Time (US & Canada),research,https://www.inaturalist.org/observations/107152034,https://inaturalist-open-data.s3.amazonaws.com/photos/180160210/medium.jpg,,1,0,FALSE,"Sunol Wilderness Regional Preserve, Sunol, CA, US",37.51729167,-121.810875,,,Alameda,California Golden Violet,Viola pedunculata,California Golden Violet,Plantae,50825,Violaceae,Viola,Viola pedunculata
107152180,2/20/22,2022-02-20 22:40:01 UTC,Pacific Time (US & Canada),research,https://www.inaturalist.org/observations/107152180,https://inaturalist-open-data.s3.amazonaws.com/photos/180160541/medium.jpg,,1,0,FALSE,"Sunol Wilderness Regional Preserve, Sunol, CA, US",37.515225,-121.8044667,,,Alameda,bird's-eye gilia,Gilia tricolor,bird's-eye gilia,Plantae,50832,Polemoniaceae,Gilia,Gilia tricolor
107152308,2/20/22,2022-02-20 22:37:43 UTC,Pacific Time (US & Canada),research,https://www.inaturalist.org/observations/107152308,https://inaturalist-open-data.s3.amazonaws.com/photos/180160743/medium.jpg,,1,0,FALSE,"Sunol Wilderness Regional Preserve, Sunol, CA, US",37.51467,-121.80378,,,Alameda,California poppy,Eschscholzia californica,California poppy,Plantae,48225,Papaveraceae,Eschscholzia,Eschscholzia californica
107152349,2/20/22,2022-02-20 22:38:20 UTC,Pacific Time (US & Canada),research,https://www.inaturalist.org/observations/107152349,https://inaturalist-open-data.s3.amazonaws.com/photos/180160814/medium.jpg,,1,0,FALSE,"Sunol Wilderness Regional Preserve, Sunol, CA, US",37.51493667,-121.8038333,,,Alameda,redmaids,Calandrinia menziesii,redmaids,Plantae,400267,Montiaceae,Calandrinia,Calandrinia menziesii
107152523,2/20/22,2022-02-20 22:20:27 UTC,Pacific Time (US & Canada),research,https://www.inaturalist.org/observations/107152523,https://inaturalist-open-data.s3.amazonaws.com/photos/180161112/medium.jpg,,1,0,FALSE,"Sunol Wilderness Regional Preserve, Sunol, CA, US",37.51357833,-121.7991117,,,Alameda,dot-seed plantain,Plantago erecta,dot-seed plantain,Plantae,53177,Plantaginaceae,Plantago,Plantago erecta
107152742,2/20/22,2022-02-20 21:36:09 UTC,Pacific Time (US & Canada),research,https://www.inaturalist.org/observations/107152742,https://inaturalist-open-data.s3.amazonaws.com/photos/180161625/medium.jpg,,3,0,FALSE,"Sunol Wilderness Regional Preserve, Sunol, CA, US",37.50726167,-121.8101633,,,Alameda,Blue Dicks,Dipterostemon capitatus,Blue Dicks,Plantae,1196784,Asparagaceae,Dipterostemon,Dipterostemon capitatus
107152821,2/20/22,2022-02-20 21:24:56 UTC,Pacific Time (US & Canada),research,https://www.inaturalist.org/observations/107152821,https://inaturalist-open-data.s3.amazonaws.com/photos/180161752/medium.jpg,,1,0,FALSE,"Sunol Wilderness Regional Preserve, Sunol, CA, US",37.505555,-121.8162217,,,Alameda,arroyo lupine,Lupinus succulentus,arroyo lupine,Plantae,56759,Fabaceae,Lupinus,Lupinus succulentus
107164282,2/19/22,2022-02-19 21:47:51 UTC,Pacific Time (US & Canada),research,https://www.inaturalist.org/observations/107164282,https://inaturalist-open-data.s3.amazonaws.com/photos/180184280/medium.jpg,,1,0,FALSE,"Sunol Wilderness Regional Preserve, Sunol, CA, US",37.51728,-121.8108283,,,Alameda,California Golden Violet,Viola pedunculata,California Golden Violet,Plantae,50825,Violaceae,Viola,Viola pedunculata
107164298,2/19/22,2022-02-20 01:00:20 UTC,Pacific Time (US & Canada),research,https://www.inaturalist.org/observations/107164298,https://inaturalist-open-data.s3.amazonaws.com/photos/180184327/medium.jpg,,1,0,FALSE,"Sunol Wilderness Regional Preserve, Sunol, CA, US",37.50937,-121.7961967,,,Alameda,Henderson's shooting star,Primula hendersonii,Henderson's shooting star,Plantae,487175,Primulaceae,Primula,Primula hendersonii
107164325,2/19/22,2022-02-20 01:02:23 UTC,Pacific Time (US & Canada),research,https://www.inaturalist.org/observations/107164325,https://inaturalist-open-data.s3.amazonaws.com/photos/180184414/medium.jpg,,1,0,FALSE,"Sunol Wilderness Regional Preserve, Sunol, CA, US",37.51022167,-121.7960583,,,Alameda,Pacific hound's tongue,Adelinia grande,Pacific hound's tongue,Plantae,769151,Boraginaceae,Adelinia,Adelinia grande
107214433,2/21/22,2022-02-21 21:22:48 UTC,Pacific Time (US & Canada),research,https://www.inaturalist.org/observations/107214433,https://inaturalist-open-data.s3.amazonaws.com/photos/180277125/medium.jpeg,,2,0,FALSE,"Sunol, CA 94586, USA",37.51927684,-121.8372909,,,Alameda,redmaids,Calandrinia menziesii,redmaids,Plantae,400267,Montiaceae,Calandrinia,Calandrinia menziesii
107221894,2/21/22,2022-02-21 11:30:26 UTC,UTC,research,https://www.inaturalist.org/observations/107221894,https://inaturalist-open-data.s3.amazonaws.com/photos/180290992/medium.jpeg,,1,0,FALSE,"Sunol, CA 94586, USA",37.51223405,-121.8215531,,,Alameda,orange bush monkeyflower,Diplacus aurantiacus,orange bush monkeyflower,Plantae,777371,Phrymaceae,Diplacus,Diplacus aurantiacus
107222540,2/21/22,2022-02-21 22:39:15 UTC,Pacific Time (US & Canada),research,https://www.inaturalist.org/observations/107222540,https://static.inaturalist.org/photos/180292292/medium.jpg,,1,0,FALSE,"Sunol Wilderness Regional Preserve, Sunol, CA, US",37.519895,-121.8109667,,,Alameda,Pacific hound's tongue,Adelinia grande,Pacific hound's tongue,Plantae,769151,Boraginaceae,Adelinia,Adelinia grande
107222633,2/21/22,2022-02-21 22:04:11 UTC,Pacific Time (US & Canada),research,https://www.inaturalist.org/observations/107222633,https://static.inaturalist.org/photos/180292544/medium.jpg,,1,0,FALSE,"Sunol Wilderness Regional Preserve, Sunol, CA, US",37.515245,-121.8045667,,,Alameda,redmaids,Calandrinia menziesii,redmaids,Plantae,400267,Montiaceae,Calandrinia,Calandrinia menziesii
107222842,2/21/22,2022-02-21 19:43:45 UTC,Pacific Time (US & Canada),research,https://www.inaturalist.org/observations/107222842,https://inaturalist-open-data.s3.amazonaws.com/photos/180292989/medium.jpeg,,1,0,FALSE,"Sunol, CA 94586, USA",37.51354756,-121.823201,,,Alameda,milkmaids,Cardamine californica,milkmaids,Plantae,49651,Brassicaceae,Cardamine,Cardamine californica
107223267,2/21/22,2022-02-21 20:01:21 UTC,Pacific Time (US & Canada),research,https://www.inaturalist.org/observations/107223267,https://static.inaturalist.org/photos/180293937/medium.jpg,,1,0,FALSE,"Ohlone Wilderness Trail, Sunol, CA, US",37.51706333,-121.776795,,,Alameda,Johnnytuck,Triphysaria eriantha,Johnnytuck,Plantae,50792,Orobanchaceae,Triphysaria,Triphysaria eriantha
107224128,2/21/22,2022-02-21 19:31:01 UTC,Pacific Time (US & Canada),research,https://www.inaturalist.org/observations/107224128,https://static.inaturalist.org/photos/180295638/medium.jpg,,1,0,FALSE,"Ohlone Wilderness Trail, Sunol, CA, US",37.51476333,-121.77665,,,Alameda,California Golden Violet,Viola pedunculata,California Golden Violet,Plantae,50825,Violaceae,Viola,Viola pedunculata
107291598,2/21/22,2022-02-21 16:38:23 UTC,Pacific Time (US & Canada),research,https://www.inaturalist.org/observations/107291598,https://inaturalist-open-data.s3.amazonaws.com/photos/180422078/medium.jpeg,,1,0,FALSE,"Sunol, CA 94586, USA",37.51578677,-121.8257739,,,Alameda,White nemophila,Nemophila heterophylla,White nemophila,Plantae,53158,Boraginaceae,Nemophila,Nemophila heterophylla
107359297,2/23/22,2022-02-23 20:37:23 UTC,Pacific Time (US & Canada),research,https://www.inaturalist.org/observations/107359297,https://static.inaturalist.org/photos/180548066/medium.jpg,,1,0,FALSE,"Sunol Wilderness Regional Preserve, Sunol, CA, US",37.506725,-121.8169783,,,Alameda,Mediterranean Stork's-bill,Erodium botrys,Mediterranean Stork's-bill,Plantae,57090,Geraniaceae,Erodium,Erodium botrys
107359306,2/23/22,2022-02-23 20:48:54 UTC,Pacific Time (US & Canada),research,https://www.inaturalist.org/observations/107359306,https://static.inaturalist.org/photos/180548078/medium.jpg,,2,0,FALSE,"Sunol Wilderness Regional Preserve, Sunol, CA, US",37.50609167,-121.8143383,,,Alameda,Blue Dicks,Dipterostemon capitatus,Blue Dicks,Plantae,1196784,Asparagaceae,Dipterostemon,Dipterostemon capitatus
107359324,2/23/22,2022-02-23 21:45:37 UTC,Pacific Time (US & Canada),research,https://www.inaturalist.org/observations/107359324,https://static.inaturalist.org/photos/180548117/medium.jpg,,1,0,FALSE,"Sunol Wilderness Regional Preserve, Sunol, CA, US",37.50813333,-121.8122167,,,Alameda,orange bush monkeyflower,Diplacus aurantiacus,orange bush monkeyflower,Plantae,777371,Phrymaceae,Diplacus,Diplacus aurantiacus
107359327,2/23/22,2022-02-23 21:59:05 UTC,Pacific Time (US & Canada),research,https://www.inaturalist.org/observations/107359327,https://static.inaturalist.org/photos/180548129/medium.jpg,,1,0,FALSE,"Sunol Wilderness Regional Preserve, Sunol, CA, US",37.51095833,-121.8092417,,,Alameda,redmaids,Calandrinia menziesii,redmaids,Plantae,400267,Montiaceae,Calandrinia,Calandrinia menziesii
107393378,2/15/22,2022-02-15 21:10:00 UTC,Pacific Time (US & Canada),research,https://www.inaturalist.org/observations/107393378,https://inaturalist-open-data.s3.amazonaws.com/photos/180613670/medium.jpeg,,2,0,FALSE,"Sunol Regional Wilderness , California",37.509359,-121.828764,,,Alameda,Padre's Shooting Star,Primula clevelandii,Padre's Shooting Star,Plantae,486971,Primulaceae,Primula,Primula clevelandii
107402570,2/15/22,2022-02-15 21:16:00 UTC,Pacific Time (US & Canada),research,https://www.inaturalist.org/observations/107402570,https://inaturalist-open-data.s3.amazonaws.com/photos/180631402/medium.jpeg,,3,0,FALSE,"Sunol Regional Wilderness , California",37.510048,-121.828778,,,Alameda,henbit deadnettle,Lamium amplexicaule,henbit deadnettle,Plantae,55459,Lamiaceae,Lamium,Lamium amplexicaule
107419064,2/24/22,2022-02-24 19:09:09 UTC,Pacific Time (US & Canada),research,https://www.inaturalist.org/observations/107419064,https://inaturalist-open-data.s3.amazonaws.com/photos/180662490/medium.jpg,,2,0,FALSE,"Sunol Regional Wilderness, Alameda County, US-CA, US",37.50389284,-121.8217796,,,Alameda,Blue Dicks,Dipterostemon capitatus,Blue Dicks,Plantae,1196784,Asparagaceae,Dipterostemon,Dipterostemon capitatus
107432043,2/25/22,2022-02-25 18:50:17 UTC,Pacific Time (US & Canada),research,https://www.inaturalist.org/observations/107432043,https://inaturalist-open-data.s3.amazonaws.com/photos/180689196/medium.jpg,,2,0,FALSE,"Sunol Regional Wilderness, Alameda County, US-CA, US",37.53636295,-121.8326527,,,Alameda,California poppy,Eschscholzia californica,California poppy,Plantae,48225,Papaveraceae,Eschscholzia,Eschscholzia californica
107432477,2/25/22,2022-02-25 18:52:02 UTC,Pacific Time (US & Canada),research,https://www.inaturalist.org/observations/107432477,https://inaturalist-open-data.s3.amazonaws.com/photos/180688137/medium.jpg,,1,0,FALSE,"Sunol Regional Wilderness, Alameda County, US-CA, US",37.53619208,-121.8333849,,,Alameda,Mediterranean Stork's-bill,Erodium botrys,Mediterranean Stork's-bill,Plantae,57090,Geraniaceae,Erodium,Erodium botrys
107432567,2/25/22,2022-02-25 19:14:09 UTC,Pacific Time (US & Canada),research,https://www.inaturalist.org/observations/107432567,https://inaturalist-open-data.s3.amazonaws.com/photos/180704414/medium.jpg,,1,0,FALSE,"Sunol Regional Wilderness, Alameda County, US-CA, US",37.53963407,-121.8307025,,,Alameda,California buttercup,Ranunculus californicus,California buttercup,Plantae,52173,Ranunculaceae,Ranunculus,Ranunculus californicus
107441325,2/25/22,2022-02-25 20:06:53 UTC,Pacific Time (US & Canada),research,https://www.inaturalist.org/observations/107441325,https://inaturalist-open-data.s3.amazonaws.com/photos/180704460/medium.jpg,,1,0,FALSE,"Sunol Wilderness Regional Preserve, Sunol, CA, US",37.54821818,-121.8381745,,,Alameda,bird's-eye gilia,Gilia tricolor,bird's-eye gilia,Plantae,50832,Polemoniaceae,Gilia,Gilia tricolor
107451982,2/25/22,2022-02-25 14:40:00 UTC,UTC,research,https://www.inaturalist.org/observations/107451982,https://inaturalist-open-data.s3.amazonaws.com/photos/180725815/medium.jpg,,1,0,FALSE,"Alameda County, CA, USA",37.514984,-121.796941,,,Alameda,cardo de huerta,Cynara cardunculus,Artichoke Thistle,Plantae,57563,Asteraceae,Cynara,Cynara cardunculus
107494779,2/26/22,2022-02-26 18:45:55 UTC,Pacific Time (US & Canada),research,https://www.inaturalist.org/observations/107494779,https://inaturalist-open-data.s3.amazonaws.com/photos/180805194/medium.jpg,,1,0,FALSE,"Ohlone Wilderness Trail, Sunol, CA, US",37.51421023,-121.8593416,,,Alameda,Nemophila menziesii menziesii,Nemophila menziesii menziesii,,Plantae,50650,Boraginaceae,Nemophila,Nemophila menziesii
107604098,2/26/22,2022-02-26 19:16:58 UTC,Pacific Time (US & Canada),research,https://www.inaturalist.org/observations/107604098,https://static.inaturalist.org/photos/181010844/medium.jpg,,1,0,FALSE,"Sunol Wilderness Regional Preserve, Sunol, CA, US",37.51777941,-121.8291775,,,Alameda,,Castilleja exserta,purple owl's-clover,Plantae,49343,Orobanchaceae,Castilleja,Castilleja exserta
107927431,3/4/22,2022-03-04 19:30:51 UTC,Pacific Time (US & Canada),research,https://www.inaturalist.org/observations/107927431,https://inaturalist-open-data.s3.amazonaws.com/photos/181614317/medium.jpg,,1,0,FALSE,"Sunol Regional Wilderness, Alameda County, US-CA, US",37.50919611,-121.8288375,,,Alameda,mule fat,Baccharis salicifolia,mule fat,Plantae,57913,Asteraceae,Baccharis,Baccharis salicifolia
107927496,3/4/22,2022-03-04 19:43:23 UTC,Pacific Time (US & Canada),research,https://www.inaturalist.org/observations/107927496,https://inaturalist-open-data.s3.amazonaws.com/photos/181614453/medium.jpg,,1,0,FALSE,"Sunol Regional Wilderness, Alameda County, US-CA, US",37.50807203,-121.8271949,,,Alameda,California Golden Violet,Viola pedunculata,California Golden Violet,Plantae,50825,Violaceae,Viola,Viola pedunculata
107927713,3/4/22,2022-03-04 20:15:40 UTC,Pacific Time (US & Canada),research,https://www.inaturalist.org/observations/107927713,https://inaturalist-open-data.s3.amazonaws.com/photos/181614966/medium.jpg,,1,0,FALSE,"Sunol Regional Wilderness, Alameda County, US-CA, US",37.50602816,-121.8291485,,,Alameda,common duckweed,Lemna minor,Common Duckweed,Plantae,54518,Araceae,Lemna,Lemna minor
107927938,3/4/22,2022-03-04 20:49:03 UTC,Pacific Time (US & Canada),research,https://www.inaturalist.org/observations/107927938,https://inaturalist-open-data.s3.amazonaws.com/photos/181615265/medium.jpg,,1,0,FALSE,"Sunol Regional Wilderness, Alameda County, US-CA, US",37.50560742,-121.8166175,,,Alameda,orange bush monkeyflower,Diplacus aurantiacus,orange bush monkeyflower,Plantae,777371,Phrymaceae,Diplacus,Diplacus aurantiacus
107927960,3/4/22,2022-03-04 20:49:42 UTC,Pacific Time (US & Canada),research,https://www.inaturalist.org/observations/107927960,https://inaturalist-open-data.s3.amazonaws.com/photos/181615302/medium.jpg,,2,0,FALSE,"Sunol Regional Wilderness, Alameda County, US-CA, US",37.505629,-121.8166082,,,Alameda,Blue Dicks,Dipterostemon capitatus,Blue Dicks,Plantae,1196784,Asparagaceae,Dipterostemon,Dipterostemon capitatus
107929081,3/4/22,2022-03-04 21:27:17 UTC,Pacific Time (US & Canada),research,https://www.inaturalist.org/observations/107929081,https://inaturalist-open-data.s3.amazonaws.com/photos/181617296/medium.jpg,,1,0,FALSE,"Sunol Regional Wilderness, Alameda County, US-CA, US",37.50654358,-121.8173033,,,Alameda,Chile trefoil,Acmispon wrangelianus,Chile trefoil,Plantae,57050,Fabaceae,Acmispon,Acmispon wrangelianus
107929369,3/4/22,2022-03-04 21:56:20 UTC,Pacific Time (US & Canada),research,https://www.inaturalist.org/observations/107929369,https://inaturalist-open-data.s3.amazonaws.com/photos/181617876/medium.jpg,,2,0,FALSE,"Sunol Regional Wilderness, Alameda County, US-CA, US",37.51174948,-121.8241738,,,Alameda,butter-and-eggs,Triphysaria eriantha eriantha,butter-and-eggs,Plantae,59332,Orobanchaceae,Triphysaria,Triphysaria eriantha
107929549,3/4/22,2022-03-04 22:05:04 UTC,Pacific Time (US & Canada),research,https://www.inaturalist.org/observations/107929549,https://inaturalist-open-data.s3.amazonaws.com/photos/181618171/medium.jpg,,1,0,FALSE,"Sunol Regional Wilderness, Alameda County, US-CA, US",37.51321056,-121.8259864,,,Alameda,Henderson's shooting star,Primula hendersonii,Henderson's shooting star,Plantae,487175,Primulaceae,Primula,Primula hendersonii
108007219,3/5/22,2022-03-05 18:12:48 UTC,Pacific Time (US & Canada),research,https://www.inaturalist.org/observations/108007219,https://inaturalist-open-data.s3.amazonaws.com/photos/181763191/medium.jpg,,1,0,FALSE,"Sunol Wilderness Regional Preserve, Sunol, CA, US",37.53082167,-121.8165283,,,Alameda,California Golden Violet,Viola pedunculata,California Golden Violet,Plantae,50825,Violaceae,Viola,Viola pedunculata
108007290,3/5/22,2022-03-05 17:56:06 UTC,Pacific Time (US & Canada),research,https://www.inaturalist.org/observations/108007290,https://inaturalist-open-data.s3.amazonaws.com/photos/181763333/medium.jpg,,1,0,FALSE,"Sunol Wilderness Regional Preserve, Sunol, CA, US",37.52882,-121.82283,,,Alameda,Pacific hound's tongue,Adelinia grande,Pacific hound's tongue,Plantae,769151,Boraginaceae,Adelinia,Adelinia grande
108009621,3/5/22,2022-03-05 22:43:58 UTC,Pacific Time (US & Canada),research,https://www.inaturalist.org/observations/108009621,https://inaturalist-open-data.s3.amazonaws.com/photos/181767876/medium.jpeg,,1,0,FALSE,"Sunol, CA 94586, USA",37.5137,-121.8270722,,,Alameda,Blue Dicks,Dipterostemon capitatus,Blue Dicks,Plantae,1196784,Asparagaceae,Dipterostemon,Dipterostemon capitatus
108009674,3/5/22,2022-03-05 22:52:59 UTC,Pacific Time (US & Canada),research,https://www.inaturalist.org/observations/108009674,https://inaturalist-open-data.s3.amazonaws.com/photos/181767987/medium.jpeg,"plant ascending, branched.  plant purple.  stamens included.  corolla > bract.  flowers yellow (as opposed to white/pink in ssp. rosea)",1,0,FALSE,"Sunol, CA 94586, USA",37.51325,-121.8253083,,,Alameda,butter-and-eggs,Triphysaria eriantha eriantha,butter-and-eggs,Plantae,59332,Orobanchaceae,Triphysaria,Triphysaria eriantha
108009708,3/5/22,2022-03-05 23:27:09 UTC,Pacific Time (US & Canada),research,https://www.inaturalist.org/observations/108009708,https://inaturalist-open-data.s3.amazonaws.com/photos/181768078/medium.jpeg,found growing on a hill of serpentine.,1,0,FALSE,"Sunol, CA 94586, USA",37.50987222,-121.8223278,,,Alameda,redmaids,Calandrinia menziesii,redmaids,Plantae,400267,Montiaceae,Calandrinia,Calandrinia menziesii
108009751,3/5/22,2022-03-05 23:15:35 UTC,Pacific Time (US & Canada),research,https://www.inaturalist.org/observations/108009751,https://inaturalist-open-data.s3.amazonaws.com/photos/181768118/medium.jpeg,,1,0,FALSE,"Sunol, CA 94586, USA",37.51043889,-121.8221111,,,Alameda,wavy-leafed soap plant,Chlorogalum pomeridianum,wavy-leafed soap plant,Plantae,47597,Asparagaceae,Chlorogalum,Chlorogalum pomeridianum
108009762,3/5/22,2022-03-05 23:21:47 UTC,Pacific Time (US & Canada),research,https://www.inaturalist.org/observations/108009762,https://inaturalist-open-data.s3.amazonaws.com/photos/181768154/medium.jpeg,,1,0,FALSE,"Sunol, CA 94586, USA",37.50996667,-121.822325,,,Alameda,purple owl's-clover,Castilleja exserta,purple owl's-clover,Plantae,49343,Orobanchaceae,Castilleja,Castilleja exserta
108009770,3/5/22,2022-03-05 23:31:44 UTC,Pacific Time (US & Canada),research,https://www.inaturalist.org/observations/108009770,https://inaturalist-open-data.s3.amazonaws.com/photos/181768179/medium.jpeg,,1,0,FALSE,"Sunol, CA 94586, USA",37.50948611,-121.8247528,,,Alameda,California poppy,Eschscholzia californica,California poppy,Plantae,48225,Papaveraceae,Eschscholzia,Eschscholzia californica
108009773,3/5/22,2022-03-05 23:37:06 UTC,Pacific Time (US & Canada),research,https://www.inaturalist.org/observations/108009773,https://inaturalist-open-data.s3.amazonaws.com/photos/181768195/medium.jpeg,flowers 2-color.  lower petal > 16mm. lower stem procumbent.  flowers not cleistogamous,1,0,FALSE,"Sunol, CA 94586, USA",37.50835,-121.8268389,,,Alameda,California Golden Violet,Viola pedunculata,California Golden Violet,Plantae,50825,Violaceae,Viola,Viola pedunculata
108021541,3/5/22,2022-03-05 17:43:39 UTC,Pacific Time (US & Canada),research,https://www.inaturalist.org/observations/108021541,https://inaturalist-open-data.s3.amazonaws.com/photos/181791406/medium.jpg,,1,0,FALSE,"Sunol Wilderness Regional Preserve, Sunol, CA, US",37.52867833,-121.8265083,,,Alameda,Pacific poison oak,Toxicodendron diversilobum,Pacific poison oak,Plantae,51080,Anacardiaceae,Toxicodendron,Toxicodendron diversilobum
108021561,3/5/22,2022-03-05 17:12:32 UTC,Pacific Time (US & Canada),research,https://www.inaturalist.org/observations/108021561,https://inaturalist-open-data.s3.amazonaws.com/photos/181791466/medium.jpg,,2,0,FALSE,"Sunol Wilderness Regional Preserve, Sunol, CA, US",37.52396167,-121.832445,,,Alameda,Woolly Indian Paintbrush,Castilleja foliolosa,Woolly Indian Paintbrush,Plantae,56760,Orobanchaceae,Castilleja,Castilleja foliolosa
108021566,3/5/22,2022-03-05 17:12:12 UTC,Pacific Time (US & Canada),research,https://www.inaturalist.org/observations/108021566,https://inaturalist-open-data.s3.amazonaws.com/photos/181791483/medium.jpg,,2,0,FALSE,"Sunol Wilderness Regional Preserve, Sunol, CA, US",37.52398667,-121.8325117,,,Alameda,purple owl's-clover,Castilleja exserta,purple owl's-clover,Plantae,49343,Orobanchaceae,Castilleja,Castilleja exserta
108021576,3/5/22,2022-03-05 16:31:25 UTC,Pacific Time (US & Canada),research,https://www.inaturalist.org/observations/108021576,https://inaturalist-open-data.s3.amazonaws.com/photos/181791517/medium.jpg,,1,0,FALSE,"Sunol Wilderness Regional Preserve, Sunol, CA, US",37.51872,-121.8324967,,,Alameda,valley oak,Quercus lobata,valley oak,Plantae,49011,Fagaceae,Quercus,Quercus lobata
108084818,3/5/22,2022-03-05 20:42:00 UTC,Pacific Time (US & Canada),research,https://www.inaturalist.org/observations/108084818,https://static.inaturalist.org/photos/181922090/medium.jpeg,,1,0,FALSE,"Sunol, CA 94586, USA",37.52921858,-121.8146553,,,Alameda,Lindley's blazingstar,Mentzelia lindleyi,Lindley's blazingstar,Plantae,53923,Loasaceae,Mentzelia,Mentzelia lindleyi
108093045,3/6/22,2022-03-06 23:39:00 UTC,Pacific Time (US & Canada),research,https://www.inaturalist.org/observations/108093045,https://inaturalist-open-data.s3.amazonaws.com/photos/181926288/medium.jpeg,,2,0,FALSE,"Alameda County, CA, USA",37.51650299,-121.828802,,,Alameda,redmaids,Calandrinia menziesii,redmaids,Plantae,400267,Montiaceae,Calandrinia,Calandrinia menziesii
108342383,3/10/22,2022-03-10 22:11:00 UTC,Pacific Time (US & Canada),research,https://www.inaturalist.org/observations/108342383,https://static.inaturalist.org/photos/182393696/medium.jpg,,1,0,FALSE,"Alameda County, CA, USA",37.52340186,-121.8334443,,,Alameda,bird's-eye gilia,Gilia tricolor,bird's-eye gilia,Plantae,50832,Polemoniaceae,Gilia,Gilia tricolor
108344893,3/10/22,2022-03-11 00:58:32 UTC,Pacific Time (US & Canada),research,https://www.inaturalist.org/observations/108344893,https://inaturalist-open-data.s3.amazonaws.com/photos/182398469/medium.jpg,,1,0,FALSE,"Sunol Wilderness Regional Preserve, Sunol, CA, US",37.51378333,-121.82547,,,Alameda,purple owl's-clover,Castilleja exserta,purple owl's-clover,Plantae,49343,Orobanchaceae,Castilleja,Castilleja exserta
108344930,3/10/22,2022-03-11 00:56:44 UTC,Pacific Time (US & Canada),research,https://www.inaturalist.org/observations/108344930,https://inaturalist-open-data.s3.amazonaws.com/photos/182398571/medium.jpg,,2,0,FALSE,"Sunol Wilderness Regional Preserve, Sunol, CA, US",37.513805,-121.8251417,,,Alameda,wavy-leafed soap plant,Chlorogalum pomeridianum,wavy-leafed soap plant,Plantae,47597,Asparagaceae,Chlorogalum,Chlorogalum pomeridianum
108344943,3/10/22,2022-03-11 00:56:33 UTC,Pacific Time (US & Canada),research,https://www.inaturalist.org/observations/108344943,https://inaturalist-open-data.s3.amazonaws.com/photos/182398620/medium.jpg,,2,0,FALSE,"Sunol Wilderness Regional Preserve, Sunol, CA, US",37.51383833,-121.8250667,,,Alameda,purple needlegrass,Nassella pulchra,purple needlegrass,Plantae,165659,Poaceae,Nassella,Nassella pulchra
108345971,3/10/22,2022-03-10 23:41:42 UTC,Pacific Time (US & Canada),research,https://www.inaturalist.org/observations/108345971,https://inaturalist-open-data.s3.amazonaws.com/photos/182400649/medium.jpg,,2,0,FALSE,"Sunol Wilderness Regional Preserve, Sunol, CA, US",37.52128667,-121.8090967,,,Alameda,western blue-eyed grass,Sisyrinchium bellum,western blue-eyed grass,Plantae,49918,Iridaceae,Sisyrinchium,Sisyrinchium bellum
108345993,3/10/22,2022-03-10 23:40:42 UTC,Pacific Time (US & Canada),research,https://www.inaturalist.org/observations/108345993,https://inaturalist-open-data.s3.amazonaws.com/photos/182400751/medium.jpg,,2,0,FALSE,"Sunol Wilderness Regional Preserve, Sunol, CA, US",37.521245,-121.8091283,,,Alameda,California Golden Violet,Viola pedunculata,California Golden Violet,Plantae,50825,Violaceae,Viola,Viola pedunculata
108347898,3/10/22,2022-03-10 20:57:06 UTC,Pacific Time (US & Canada),research,https://www.inaturalist.org/observations/108347898,https://static.inaturalist.org/photos/182404258/medium.jpg,,1,0,FALSE,"Sunol Wilderness Regional Preserve, Sunol, CA, US",37.53253,-121.8197117,,,Alameda,Osoberry,Oemleria cerasiformis,Osoberry,Plantae,53419,Rosaceae,Oemleria,Oemleria cerasiformis
108439412,3/11/22,2022-03-11 08:51:00 UTC,UTC,research,https://www.inaturalist.org/observations/108439412,https://static.inaturalist.org/photos/182575849/medium.jpeg,,1,0,FALSE,"Alameda County, CA, USA",37.53318889,-121.8184278,,,Alameda,Pacific Sanicle,Sanicula crassicaulis,Pacific Sanicle,Plantae,53201,Apiaceae,Sanicula,Sanicula crassicaulis
108480276,3/12/22,2022-03-12 22:14:00 UTC,Pacific Time (US & Canada),research,https://www.inaturalist.org/observations/108480276,https://inaturalist-open-data.s3.amazonaws.com/photos/182650922/medium.jpeg,,1,0,FALSE,"Alameda County, CA, USA",37.51323611,-121.8252639,,,Alameda,Johnnytuck,Triphysaria eriantha,Johnnytuck,Plantae,50792,Orobanchaceae,Triphysaria,Triphysaria eriantha
108480281,3/12/22,2022-03-12 20:44:00 UTC,Pacific Time (US & Canada),research,https://www.inaturalist.org/observations/108480281,https://inaturalist-open-data.s3.amazonaws.com/photos/182650999/medium.jpeg,,2,0,FALSE,"Alameda County, CA, USA",37.50745,-121.8124,,,Alameda,western blue-eyed grass,Sisyrinchium bellum,western blue-eyed grass,Plantae,49918,Iridaceae,Sisyrinchium,Sisyrinchium bellum
108480282,3/12/22,2022-03-12 22:06:00 UTC,Pacific Time (US & Canada),research,https://www.inaturalist.org/observations/108480282,https://inaturalist-open-data.s3.amazonaws.com/photos/182650961/medium.jpeg,,2,0,FALSE,"Alameda County, CA, USA",37.51183056,-121.8239222,,,Alameda,redmaids,Calandrinia menziesii,redmaids,Plantae,400267,Montiaceae,Calandrinia,Calandrinia menziesii
108480283,3/12/22,2022-03-12 20:20:00 UTC,Pacific Time (US & Canada),research,https://www.inaturalist.org/observations/108480283,https://inaturalist-open-data.s3.amazonaws.com/photos/182651072/medium.jpeg,,1,0,FALSE,"Alameda County, CA, USA",37.50761111,-121.8107,,,Alameda,bluewitch nightshade,Solanum umbelliferum,bluewitch nightshade,Plantae,50639,Solanaceae,Solanum,Solanum umbelliferum
108481321,3/11/22,2022-03-11 22:33:19 UTC,Pacific Time (US & Canada),research,https://www.inaturalist.org/observations/108481321,https://inaturalist-open-data.s3.amazonaws.com/photos/182653472/medium.jpg,,1,0,FALSE,"Sunol Wilderness Regional Preserve, Sunol, CA, US",37.51181333,-121.8239133,,,Alameda,redmaids,Calandrinia menziesii,redmaids,Plantae,400267,Montiaceae,Calandrinia,Calandrinia menziesii
108490623,3/10/22,2022-03-10 22:44:50 UTC,Pacific Time (US & Canada),research,https://www.inaturalist.org/observations/108490623,https://inaturalist-open-data.s3.amazonaws.com/photos/182672391/medium.jpg,,1,0,FALSE,"Sunol Wilderness Regional Preserve, Sunol, CA, US",37.51470333,-121.8037717,,,Alameda,California poppy,Eschscholzia californica,California poppy,Plantae,48225,Papaveraceae,Eschscholzia,Eschscholzia californica
108490633,3/10/22,2022-03-10 22:44:45 UTC,Pacific Time (US & Canada),research,https://www.inaturalist.org/observations/108490633,https://inaturalist-open-data.s3.amazonaws.com/photos/182672430/medium.jpg,,1,0,FALSE,"Sunol Wilderness Regional Preserve, Sunol, CA, US",37.514705,-121.803795,,,Alameda,redmaids,Calandrinia menziesii,redmaids,Plantae,400267,Montiaceae,Calandrinia,Calandrinia menziesii
108490651,3/10/22,2022-03-10 21:50:12 UTC,Pacific Time (US & Canada),research,https://www.inaturalist.org/observations/108490651,https://inaturalist-open-data.s3.amazonaws.com/photos/182672500/medium.jpg,,1,0,FALSE,"Sunol Wilderness Regional Preserve, Sunol, CA, US",37.51328667,-121.7936167,,,Alameda,California Goosefoot,Blitum californicum,California Goosefoot,Plantae,878230,Amaranthaceae,Blitum,Blitum californicum
108490743,3/10/22,2022-03-10 21:06:50 UTC,Pacific Time (US & Canada),research,https://www.inaturalist.org/observations/108490743,https://inaturalist-open-data.s3.amazonaws.com/photos/182672637/medium.jpg,,1,0,FALSE,"Sunol Wilderness Regional Preserve, Sunol, CA, US",37.51123833,-121.792375,,,Alameda,California buttercup,Ranunculus californicus,California buttercup,Plantae,52173,Ranunculaceae,Ranunculus,Ranunculus californicus
108490937,3/10/22,2022-03-10 18:38:59 UTC,Pacific Time (US & Canada),research,https://www.inaturalist.org/observations/108490937,https://inaturalist-open-data.s3.amazonaws.com/photos/182672735/medium.jpg,,3,0,FALSE,"Sunol Wilderness Regional Preserve, Sunol, CA, US",37.505355,-121.8276283,,,Alameda,Padre's Shooting Star,Primula clevelandii,Padre's Shooting Star,Plantae,486971,Primulaceae,Primula,Primula clevelandii
108490941,3/10/22,2022-03-10 18:19:28 UTC,Pacific Time (US & Canada),research,https://www.inaturalist.org/observations/108490941,https://inaturalist-open-data.s3.amazonaws.com/photos/182672768/medium.jpg,,1,0,FALSE,"Sunol Wilderness Regional Preserve, Sunol, CA, US",37.51422167,-121.8293383,,,Alameda,California Golden Violet,Viola pedunculata,California Golden Violet,Plantae,50825,Violaceae,Viola,Viola pedunculata
108535231,3/13/22,2022-03-13 19:05:02 UTC,Pacific Time (US & Canada),research,https://www.inaturalist.org/observations/108535231,https://inaturalist-open-data.s3.amazonaws.com/photos/182754605/medium.jpeg,,2,0,FALSE,"Sunol, CA 94586, USA",37.50478889,-121.8198056,,,Alameda,scarlet pimpernel,Lysimachia arvensis,scarlet pimpernel,Plantae,791928,Primulaceae,Lysimachia,Lysimachia arvensis
108535253,3/13/22,2022-03-13 18:59:23 UTC,Pacific Time (US & Canada),research,https://www.inaturalist.org/observations/108535253,https://inaturalist-open-data.s3.amazonaws.com/photos/182754619/medium.jpeg,,2,0,FALSE,"Sunol, CA 94586, USA",37.50588611,-121.8167556,,,Alameda,hairy vetch,Vicia villosa,hairy vetch,Plantae,57317,Fabaceae,Vicia,Vicia villosa
108535592,3/13/22,2022-03-13 18:39:28 UTC,Pacific Time (US & Canada),research,https://www.inaturalist.org/observations/108535592,https://inaturalist-open-data.s3.amazonaws.com/photos/182755294/medium.jpeg,,2,0,FALSE,"Sunol, CA 94586, USA",37.50599167,-121.8170694,,,Alameda,hairy vetch,Vicia villosa,hairy vetch,Plantae,57317,Fabaceae,Vicia,Vicia villosa
108536547,3/13/22,2022-03-13 18:34:28 UTC,Pacific Time (US & Canada),research,https://www.inaturalist.org/observations/108536547,https://inaturalist-open-data.s3.amazonaws.com/photos/182756807/medium.jpeg,,1,0,FALSE,"Sunol, CA 94586, USA",37.50643611,-121.8180667,,,Alameda,Blue Dicks,Dipterostemon capitatus,Blue Dicks,Plantae,1196784,Asparagaceae,Dipterostemon,Dipterostemon capitatus
108536678,3/13/22,2022-03-13 18:21:25 UTC,Pacific Time (US & Canada),research,https://www.inaturalist.org/observations/108536678,https://inaturalist-open-data.s3.amazonaws.com/photos/182757028/medium.jpeg,,1,0,FALSE,"Sunol, CA 94586, USA",37.5085,-121.822325,,,Alameda,chia,Salvia columbariae,Chia,Plantae,53200,Lamiaceae,Salvia,Salvia columbariae
108536985,3/13/22,2022-03-13 17:55:27 UTC,Pacific Time (US & Canada),research,https://www.inaturalist.org/observations/108536985,https://inaturalist-open-data.s3.amazonaws.com/photos/182757477/medium.jpeg,,1,0,FALSE,"Fremont, CA 94539, USA",37.51106389,-121.8284528,,,Alameda,White Horehound,Marrubium vulgare,White Horehound,Plantae,54605,Lamiaceae,Marrubium,Marrubium vulgare
108709057,3/15/22,2022-03-15 20:14:46 UTC,Pacific Time (US & Canada),research,https://www.inaturalist.org/observations/108709057,https://inaturalist-open-data.s3.amazonaws.com/photos/183083796/medium.jpg,,2,0,FALSE,"Sunol Wilderness Regional Preserve, Sunol, CA, US",37.52648147,-121.8236809,,,Alameda,Menzies' baby blue eyes,Nemophila menziesii,Menzies' baby blue eyes,Plantae,50648,Boraginaceae,Nemophila,Nemophila menziesii
108709114,3/15/22,2022-03-15 20:12:33 UTC,Pacific Time (US & Canada),research,https://www.inaturalist.org/observations/108709114,https://inaturalist-open-data.s3.amazonaws.com/photos/183083840/medium.jpg,,2,0,FALSE,"Sunol Wilderness Regional Preserve, Sunol, CA, US",37.52648147,-121.8236809,,,Alameda,hillside woodland star,Lithophragma heterophyllum,hillside woodland star,Plantae,53124,Saxifragaceae,Lithophragma,Lithophragma heterophyllum
108709144,3/15/22,2022-03-15 20:09:40 UTC,Pacific Time (US & Canada),research,https://www.inaturalist.org/observations/108709144,https://inaturalist-open-data.s3.amazonaws.com/photos/183083884/medium.jpg,,1,0,FALSE,"Sunol Wilderness Regional Preserve, Sunol, CA, US",37.52648147,-121.8236809,,,Alameda,white fiesta flower,Pholistoma membranaceum,white fiesta flower,Plantae,57352,Boraginaceae,Pholistoma,Pholistoma membranaceum
108889758,3/17/22,2022-03-17 17:37:23 UTC,Pacific Time (US & Canada),research,https://www.inaturalist.org/observations/108889758,https://static.inaturalist.org/photos/183421871/medium.jpg,,2,0,FALSE,"Sunol Wilderness Regional Preserve, Sunol, CA, US",37.50356333,-121.82502,,,Alameda,Pacific poison oak,Toxicodendron diversilobum,Pacific poison oak,Plantae,51080,Anacardiaceae,Toxicodendron,Toxicodendron diversilobum
108902785,3/13/22,2022-03-13 22:14:12 UTC,Pacific Time (US & Canada),research,https://www.inaturalist.org/observations/108902785,https://inaturalist-open-data.s3.amazonaws.com/photos/183446649/medium.jpeg,,1,0,FALSE,"Sunol Regional Wilderness, Alameda County, US-CA, US",37.51383972,-121.8262939,,,Alameda,California buttercup,Ranunculus californicus,California buttercup,Plantae,52173,Ranunculaceae,Ranunculus,Ranunculus californicus
108902788,3/13/22,2022-03-14 00:06:20 UTC,Pacific Time (US & Canada),research,https://www.inaturalist.org/observations/108902788,https://inaturalist-open-data.s3.amazonaws.com/photos/183446574/medium.jpeg,,1,0,FALSE,"Sunol Regional Wilderness, Alameda County, US-CA, US",37.51407623,-121.8272171,,,Alameda,Johnnytuck,Triphysaria eriantha,Johnnytuck,Plantae,50792,Orobanchaceae,Triphysaria,Triphysaria eriantha
108902790,3/13/22,2022-03-13 22:39:01 UTC,Pacific Time (US & Canada),research,https://www.inaturalist.org/observations/108902790,https://inaturalist-open-data.s3.amazonaws.com/photos/183446638/medium.jpeg,,1,0,FALSE,"Sunol Regional Wilderness, Alameda County, US-CA, US",37.51493835,-121.8243103,,,Alameda,mule fat,Baccharis salicifolia,mule fat,Plantae,57913,Asteraceae,Baccharis,Baccharis salicifolia
108913237,3/18/22,2022-03-18 18:09:14 UTC,Pacific Time (US & Canada),research,https://www.inaturalist.org/observations/108913237,https://inaturalist-open-data.s3.amazonaws.com/photos/183466753/medium.jpeg,,1,0,FALSE,"Sunol, CA 94586, USA",37.51610278,-121.8303472,,,Alameda,California buttercup,Ranunculus californicus,California buttercup,Plantae,52173,Ranunculaceae,Ranunculus,Ranunculus californicus
108913272,3/18/22,2022-03-18 18:15:03 UTC,Pacific Time (US & Canada),research,https://www.inaturalist.org/observations/108913272,https://inaturalist-open-data.s3.amazonaws.com/photos/183466861/medium.jpeg,,1,0,FALSE,"Sunol, CA 94586, USA",37.51436111,-121.8279,,,Alameda,purple owl's-clover,Castilleja exserta,purple owl's-clover,Plantae,49343,Orobanchaceae,Castilleja,Castilleja exserta
108913299,3/18/22,2022-03-18 18:15:53 UTC,Pacific Time (US & Canada),research,https://www.inaturalist.org/observations/108913299,https://inaturalist-open-data.s3.amazonaws.com/photos/183466905/medium.jpeg,,1,0,FALSE,"Sunol, CA 94586, USA",37.51443889,-121.8279639,,,Alameda,Johnnytuck,Triphysaria eriantha,Johnnytuck,Plantae,50792,Orobanchaceae,Triphysaria,Triphysaria eriantha
108913542,3/18/22,2022-03-18 18:17:33 UTC,Pacific Time (US & Canada),research,https://www.inaturalist.org/observations/108913542,https://inaturalist-open-data.s3.amazonaws.com/photos/183467337/medium.jpeg,,1,0,FALSE,"Sunol, CA 94586, USA",37.51445833,-121.8279556,,,Alameda,Redstem Stork's-bill,Erodium cicutarium,Redstem Stork's-bill,Plantae,47687,Geraniaceae,Erodium,Erodium cicutarium
108913568,3/18/22,2022-03-18 18:25:53 UTC,Pacific Time (US & Canada),research,https://www.inaturalist.org/observations/108913568,https://inaturalist-open-data.s3.amazonaws.com/photos/183467366/medium.jpeg,,1,0,FALSE,"Sunol, CA 94586, USA",37.51380833,-121.8257389,,,Alameda,scarlet pimpernel,Lysimachia arvensis,scarlet pimpernel,Plantae,791928,Primulaceae,Lysimachia,Lysimachia arvensis
108913587,3/18/22,2022-03-18 18:29:13 UTC,Pacific Time (US & Canada),research,https://www.inaturalist.org/observations/108913587,https://inaturalist-open-data.s3.amazonaws.com/photos/183467413/medium.jpeg,,1,0,FALSE,"Sunol, CA 94586, USA",37.51383333,-121.8253778,,,Alameda,western blue-eyed grass,Sisyrinchium bellum,western blue-eyed grass,Plantae,49918,Iridaceae,Sisyrinchium,Sisyrinchium bellum
108913714,3/18/22,2022-03-18 18:35:54 UTC,Pacific Time (US & Canada),research,https://www.inaturalist.org/observations/108913714,https://inaturalist-open-data.s3.amazonaws.com/photos/183467463/medium.jpeg,,1,0,FALSE,"Sunol, CA 94586, USA",37.51450556,-121.82445,,,Alameda,hillside woodland star,Lithophragma heterophyllum,hillside woodland star,Plantae,53124,Saxifragaceae,Lithophragma,Lithophragma heterophyllum
108913735,3/18/22,2022-03-18 18:35:54 UTC,Pacific Time (US & Canada),research,https://www.inaturalist.org/observations/108913735,https://inaturalist-open-data.s3.amazonaws.com/photos/183467481/medium.jpeg,,1,0,FALSE,"Sunol, CA 94586, USA",37.51450556,-121.82445,,,Alameda,bird's-eye speedwell,Veronica persica,bird's-eye speedwell,Plantae,55666,Plantaginaceae,Veronica,Veronica persica
108913884,3/18/22,2022-03-18 18:35:04 UTC,Pacific Time (US & Canada),research,https://www.inaturalist.org/observations/108913884,https://inaturalist-open-data.s3.amazonaws.com/photos/183467811/medium.jpeg,,1,0,FALSE,"Sunol, CA 94586, USA",37.51444167,-121.8244389,,,Alameda,White nemophila,Nemophila heterophylla,White nemophila,Plantae,53158,Boraginaceae,Nemophila,Nemophila heterophylla
108913897,3/18/22,2022-03-18 18:37:35 UTC,Pacific Time (US & Canada),research,https://www.inaturalist.org/observations/108913897,https://inaturalist-open-data.s3.amazonaws.com/photos/183467840/medium.jpeg,,1,0,FALSE,"Sunol, CA 94586, USA",37.51452222,-121.8244306,,,Alameda,Cut-leaved crane's-bill,Geranium dissectum,Cut-leaved crane's-bill,Plantae,53075,Geraniaceae,Geranium,Geranium dissectum
108913921,3/18/22,2022-03-18 18:37:35 UTC,Pacific Time (US & Canada),research,https://www.inaturalist.org/observations/108913921,https://inaturalist-open-data.s3.amazonaws.com/photos/183467882/medium.jpeg,,1,0,FALSE,"Sunol, CA 94586, USA",37.51452222,-121.8244306,,,Alameda,California Saxifrage,Micranthes californica,California Saxifrage,Plantae,78023,Saxifragaceae,Micranthes,Micranthes californica
108914001,3/18/22,2022-03-18 18:47:06 UTC,Pacific Time (US & Canada),research,https://www.inaturalist.org/observations/108914001,https://inaturalist-open-data.s3.amazonaws.com/photos/183468071/medium.jpeg,,1,0,FALSE,"Sunol, CA 94586, USA",37.51644722,-121.8245861,,,Alameda,common chickweed,Stellaria media,common chickweed,Plantae,53298,Caryophyllaceae,Stellaria,Stellaria media
108914014,3/18/22,2022-03-18 18:48:46 UTC,Pacific Time (US & Canada),research,https://www.inaturalist.org/observations/108914014,https://inaturalist-open-data.s3.amazonaws.com/photos/183468099/medium.jpeg,,1,0,FALSE,"Sunol, CA 94586, USA",37.51713056,-121.8243167,,,Alameda,Field madder,Sherardia arvensis,Field madder,Plantae,47691,Rubiaceae,Sherardia,Sherardia arvensis
108914153,3/18/22,2022-03-18 20:21:17 UTC,Pacific Time (US & Canada),research,https://www.inaturalist.org/observations/108914153,https://inaturalist-open-data.s3.amazonaws.com/photos/183468363/medium.jpeg,,1,0,FALSE,"Sunol, CA 94586, USA",37.52456111,-121.8135389,,,Alameda,woolly clover,Trifolium tomentosum,woolly clover,Plantae,61024,Fabaceae,Trifolium,Trifolium tomentosum
108914319,3/18/22,2022-03-18 20:54:38 UTC,Pacific Time (US & Canada),research,https://www.inaturalist.org/observations/108914319,https://inaturalist-open-data.s3.amazonaws.com/photos/183468762/medium.jpeg,,1,0,FALSE,"Sunol, CA 94586, USA",37.521275,-121.8091111,,,Alameda,California Golden Violet,Viola pedunculata,California Golden Violet,Plantae,50825,Violaceae,Viola,Viola pedunculata
108914465,3/18/22,2022-03-18 21:57:59 UTC,Pacific Time (US & Canada),research,https://www.inaturalist.org/observations/108914465,https://inaturalist-open-data.s3.amazonaws.com/photos/183468932/medium.jpeg,,1,0,FALSE,"Sunol, CA 94586, USA",37.51061111,-121.8091806,,,Alameda,redmaids,Calandrinia menziesii,redmaids,Plantae,400267,Montiaceae,Calandrinia,Calandrinia menziesii
108914473,3/18/22,2022-03-18 22:04:39 UTC,Pacific Time (US & Canada),research,https://www.inaturalist.org/observations/108914473,https://inaturalist-open-data.s3.amazonaws.com/photos/183468955/medium.jpeg,,1,0,FALSE,"Sunol, CA 94586, USA",37.50879722,-121.8102972,,,Alameda,bluewitch nightshade,Solanum umbelliferum,bluewitch nightshade,Plantae,50639,Solanaceae,Solanum,Solanum umbelliferum
108914531,3/18/22,2022-03-18 22:04:39 UTC,Pacific Time (US & Canada),research,https://www.inaturalist.org/observations/108914531,https://inaturalist-open-data.s3.amazonaws.com/photos/183469061/medium.jpeg,,1,0,FALSE,"Sunol, CA 94586, USA",37.50879722,-121.8102972,,,Alameda,orange bush monkeyflower,Diplacus aurantiacus,orange bush monkeyflower,Plantae,777371,Phrymaceae,Diplacus,Diplacus aurantiacus
108914587,3/18/22,2022-03-18 22:35:29 UTC,Pacific Time (US & Canada),research,https://www.inaturalist.org/observations/108914587,https://inaturalist-open-data.s3.amazonaws.com/photos/183469247/medium.jpeg,,1,0,FALSE,"Sunol, CA 94586, USA",37.50741944,-121.8199389,,,Alameda,bird's-eye gilia,Gilia tricolor,bird's-eye gilia,Plantae,50832,Polemoniaceae,Gilia,Gilia tricolor
108914606,3/18/22,2022-03-18 22:57:59 UTC,Pacific Time (US & Canada),research,https://www.inaturalist.org/observations/108914606,https://inaturalist-open-data.s3.amazonaws.com/photos/183469293/medium.jpeg,,1,0,FALSE,"Sunol, CA 94586, USA",37.51318889,-121.8251583,,,Alameda,Johnnytuck,Triphysaria eriantha,Johnnytuck,Plantae,50792,Orobanchaceae,Triphysaria,Triphysaria eriantha
108965839,3/18/22,2022-03-18 23:03:07 UTC,Pacific Time (US & Canada),research,https://www.inaturalist.org/observations/108965839,https://inaturalist-open-data.s3.amazonaws.com/photos/183565122/medium.jpeg,,1,0,FALSE,"Sunol, CA 94586, USA",37.51312778,-121.8258167,,,Alameda,Henderson's shooting star,Primula hendersonii,Henderson's shooting star,Plantae,487175,Primulaceae,Primula,Primula hendersonii
108975187,3/18/22,2022-03-18 11:10:00 UTC,UTC,research,https://www.inaturalist.org/observations/108975187,https://inaturalist-open-data.s3.amazonaws.com/photos/183582776/medium.jpg,,1,0,FALSE,"Sunol, CA, USA",37.53581723,-121.8391529,,,Alameda,shepherd's-purse,Capsella bursa-pastoris,shepherd's-purse,Plantae,56121,Brassicaceae,Capsella,Capsella bursa-pastoris
108979845,3/18/22,2022-03-18 22:35:43 UTC,Pacific Time (US & Canada),research,https://www.inaturalist.org/observations/108979845,https://inaturalist-open-data.s3.amazonaws.com/photos/183591806/medium.jpeg,,2,0,FALSE,"Sunol, CA 94586, USA",37.50772778,-121.8199833,,,Alameda,bird's-eye gilia,Gilia tricolor,bird's-eye gilia,Plantae,50832,Polemoniaceae,Gilia,Gilia tricolor
108980249,3/18/22,2022-03-18 22:13:27 UTC,Pacific Time (US & Canada),research,https://www.inaturalist.org/observations/108980249,https://inaturalist-open-data.s3.amazonaws.com/photos/183592135/medium.jpeg,,1,0,FALSE,"Sunol, CA 94586, USA",37.50820556,-121.8124694,,,Alameda,California gilia,Gilia achilleifolia,California gilia,Plantae,51098,Polemoniaceae,Gilia,Gilia achilleifolia
108981977,3/18/22,2022-03-18 18:11:05 UTC,Pacific Time (US & Canada),research,https://www.inaturalist.org/observations/108981977,https://static.inaturalist.org/photos/183595488/medium.jpg,,1,0,FALSE,"Sunol Regional Wilderness, Alameda County, US-CA, US",37.51322887,-121.8252289,,,Alameda,butter-and-eggs,Triphysaria eriantha eriantha,butter-and-eggs,Plantae,59332,Orobanchaceae,Triphysaria,Triphysaria eriantha
108982053,3/18/22,2022-03-18 19:28:37 UTC,Pacific Time (US & Canada),research,https://www.inaturalist.org/observations/108982053,https://static.inaturalist.org/photos/183595646/medium.jpg,,1,0,FALSE,"Sunol Regional Wilderness, Alameda County, US-CA, US",37.51238509,-121.8122209,,,Alameda,Winecup Clarkia,Clarkia purpurea,Winecup Clarkia,Plantae,51087,Onagraceae,Clarkia,Clarkia purpurea
108982079,3/18/22,2022-03-18 22:29:09 UTC,Pacific Time (US & Canada),research,https://www.inaturalist.org/observations/108982079,https://static.inaturalist.org/photos/183595716/medium.jpg,,1,0,FALSE,"Sunol Regional Wilderness, Alameda County, US-CA, US",37.51436831,-121.8243463,,,Alameda,purple owl's-clover,Castilleja exserta,purple owl's-clover,Plantae,49343,Orobanchaceae,Castilleja,Castilleja exserta
109014014,3/19/22,2022-03-19 17:54:58 UTC,Pacific Time (US & Canada),research,https://www.inaturalist.org/observations/109014014,https://inaturalist-open-data.s3.amazonaws.com/photos/183654657/medium.jpg,,1,0,FALSE,"Sunol Wilderness Regional Preserve, Sunol, CA, US",37.52514667,-121.8315417,,,Alameda,Mediterranean Stork's-bill,Erodium botrys,Mediterranean Stork's-bill,Plantae,57090,Geraniaceae,Erodium,Erodium botrys
109014902,3/19/22,2022-03-19 19:22:24 UTC,Pacific Time (US & Canada),research,https://www.inaturalist.org/observations/109014902,https://inaturalist-open-data.s3.amazonaws.com/photos/183656747/medium.jpg,,1,0,FALSE,"Sunol Wilderness Regional Preserve, Sunol, CA, US",37.514175,-121.8245467,,,Alameda,Persischer Ehrenpreis,Veronica persica,bird's-eye speedwell,Plantae,55666,Plantaginaceae,Veronica,Veronica persica
109026253,3/18/22,2022-03-18 22:08:55 UTC,Pacific Time (US & Canada),research,https://www.inaturalist.org/observations/109026253,https://inaturalist-open-data.s3.amazonaws.com/photos/183678527/medium.jpeg,,1,0,FALSE,"Sunol, CA 94586, USA",37.50820556,-121.8116,,,Alameda,Pipestem Clematis,Clematis lasiantha,Pipestem Clematis,Plantae,49876,Ranunculaceae,Clematis,Clematis lasiantha
109026276,3/18/22,2022-03-18 22:06:38 UTC,Pacific Time (US & Canada),research,https://www.inaturalist.org/observations/109026276,https://inaturalist-open-data.s3.amazonaws.com/photos/183678530/medium.jpeg,,1,0,FALSE,"Sunol, CA 94586, USA",37.50851667,-121.8103917,,,Alameda,Pacific False Bindweed,Calystegia purpurata,Pacific False Bindweed,Plantae,61319,Convolvulaceae,Calystegia,Calystegia purpurata
109026292,3/18/22,2022-03-18 22:04:17 UTC,Pacific Time (US & Canada),research,https://www.inaturalist.org/observations/109026292,https://inaturalist-open-data.s3.amazonaws.com/photos/183678566/medium.jpeg,,2,0,FALSE,"Sunol, CA 94586, USA",37.50887778,-121.8103917,,,Alameda,bluewitch nightshade,Solanum umbelliferum,bluewitch nightshade,Plantae,50639,Solanaceae,Solanum,Solanum umbelliferum
109026310,3/18/22,2022-03-18 22:04:17 UTC,Pacific Time (US & Canada),research,https://www.inaturalist.org/observations/109026310,https://inaturalist-open-data.s3.amazonaws.com/photos/183678600/medium.jpeg,,2,0,FALSE,"Sunol, CA 94586, USA",37.50887778,-121.8103917,,,Alameda,orange bush monkeyflower,Diplacus aurantiacus,orange bush monkeyflower,Plantae,777371,Phrymaceae,Diplacus,Diplacus aurantiacus
109026321,3/18/22,2022-03-18 22:04:17 UTC,Pacific Time (US & Canada),research,https://www.inaturalist.org/observations/109026321,https://inaturalist-open-data.s3.amazonaws.com/photos/183678622/medium.jpeg,,1,0,FALSE,"Sunol, CA 94586, USA",37.50887778,-121.8103917,,,Alameda,small melilot,Melilotus indicus,small melilot,Plantae,57065,Fabaceae,Melilotus,Melilotus indicus
109026387,3/18/22,2022-03-18 22:03:13 UTC,Pacific Time (US & Canada),research,https://www.inaturalist.org/observations/109026387,https://inaturalist-open-data.s3.amazonaws.com/photos/183678746/medium.jpeg,,1,0,FALSE,"Sunol, CA 94586, USA",37.50925833,-121.8101333,,,Alameda,California cudweed,Pseudognaphalium californicum,California cudweed,Plantae,53077,Asteraceae,Pseudognaphalium,Pseudognaphalium californicum
109106106,3/20/22,2022-03-20 23:20:06 UTC,Pacific Time (US & Canada),research,https://www.inaturalist.org/observations/109106106,https://inaturalist-open-data.s3.amazonaws.com/photos/183826378/medium.jpg,,2,0,FALSE,"Sunol Wilderness Regional Preserve, Sunol, CA, US",37.50557167,-121.8166883,,,Alameda,hairy vetch,Vicia villosa,hairy vetch,Plantae,57317,Fabaceae,Vicia,Vicia villosa
109340533,3/23/22,2022-03-23 21:50:30 UTC,Pacific Time (US & Canada),research,https://www.inaturalist.org/observations/109340533,https://inaturalist-open-data.s3.amazonaws.com/photos/184267691/medium.jpeg,,2,0,FALSE,"Sunol, CA 94586, USA",37.50501667,-121.8181194,,,Alameda,Purple Sanicle,Sanicula bipinnatifida,Purple Sanicle,Plantae,56840,Apiaceae,Sanicula,Sanicula bipinnatifida
109340548,3/23/22,2022-03-23 21:47:38 UTC,Pacific Time (US & Canada),research,https://www.inaturalist.org/observations/109340548,https://inaturalist-open-data.s3.amazonaws.com/photos/184267779/medium.jpeg,,1,0,FALSE,"Sunol, CA 94586, USA",37.50506111,-121.8179611,,,Alameda,western blue-eyed grass,Sisyrinchium bellum,western blue-eyed grass,Plantae,49918,Iridaceae,Sisyrinchium,Sisyrinchium bellum
109340714,3/23/22,2022-03-23 20:27:37 UTC,Pacific Time (US & Canada),research,https://www.inaturalist.org/observations/109340714,https://inaturalist-open-data.s3.amazonaws.com/photos/184268109/medium.jpeg,,1,0,FALSE,"Sunol, CA 94586, USA",37.50579167,-121.8149583,,,Alameda,hillside gooseberry,Ribes californicum,hillside gooseberry,Plantae,47129,Grossulariaceae,Ribes,Ribes californicum
109340740,3/23/22,2022-03-23 20:22:38 UTC,Pacific Time (US & Canada),research,https://www.inaturalist.org/observations/109340740,https://inaturalist-open-data.s3.amazonaws.com/photos/184268160/medium.jpeg,,1,0,FALSE,"Sunol, CA 94586, USA",37.50565833,-121.8167944,,,Alameda,California beeplant,Scrophularia californica,California beeplant,Plantae,50812,Scrophulariaceae,Scrophularia,Scrophularia californica
109343245,3/23/22,2022-03-23 20:22:38 UTC,Pacific Time (US & Canada),research,https://www.inaturalist.org/observations/109343245,https://inaturalist-open-data.s3.amazonaws.com/photos/184272796/medium.jpeg,,1,0,FALSE,"Sunol, CA 94586, USA",37.50565833,-121.8167944,,,Alameda,California chicory,Rafinesquia californica,California chicory,Plantae,53193,Asteraceae,Rafinesquia,Rafinesquia californica
109343298,3/23/22,2022-03-23 20:22:38 UTC,Pacific Time (US & Canada),research,https://www.inaturalist.org/observations/109343298,https://inaturalist-open-data.s3.amazonaws.com/photos/184272890/medium.jpeg,,1,0,FALSE,"Sunol, CA 94586, USA",37.50565833,-121.8167944,,,Alameda,orange bush monkeyflower,Diplacus aurantiacus,orange bush monkeyflower,Plantae,777371,Phrymaceae,Diplacus,Diplacus aurantiacus
109343377,3/23/22,2022-03-23 20:19:41 UTC,Pacific Time (US & Canada),research,https://www.inaturalist.org/observations/109343377,https://inaturalist-open-data.s3.amazonaws.com/photos/184273022/medium.jpeg,,2,0,FALSE,"Sunol, CA 94586, USA",37.50530556,-121.8175889,,,Alameda,Ithuriel's Spear,Triteleia laxa,Ithuriel's Spear,Plantae,51085,Asparagaceae,Triteleia,Triteleia laxa
109343883,3/23/22,2022-03-23 19:57:50 UTC,Pacific Time (US & Canada),research,https://www.inaturalist.org/observations/109343883,https://inaturalist-open-data.s3.amazonaws.com/photos/184274218/medium.jpeg,,1,0,FALSE,"Sunol, CA 94586, USA",37.50491389,-121.8268556,,,Alameda,California poppy,Eschscholzia californica,California poppy,Plantae,48225,Papaveraceae,Eschscholzia,Eschscholzia californica
109343969,3/23/22,2022-03-23 19:51:53 UTC,Pacific Time (US & Canada),research,https://www.inaturalist.org/observations/109343969,https://inaturalist-open-data.s3.amazonaws.com/photos/184274374/medium.jpeg,,2,0,FALSE,"Sunol, CA 94586, USA",37.505975,-121.8287333,,,Alameda,Blue Dicks,Dipterostemon capitatus,Blue Dicks,Plantae,1196784,Asparagaceae,Dipterostemon,Dipterostemon capitatus
109343992,3/23/22,2022-03-23 19:42:59 UTC,Pacific Time (US & Canada),research,https://www.inaturalist.org/observations/109343992,https://inaturalist-open-data.s3.amazonaws.com/photos/184274450/medium.jpeg,,1,0,FALSE,"Sunol, CA 94586, USA",37.50816111,-121.8293611,,,Alameda,California buttercup,Ranunculus californicus,California buttercup,Plantae,52173,Ranunculaceae,Ranunculus,Ranunculus californicus
109709251,3/26/22,2022-03-26 18:41:48 UTC,Pacific Time (US & Canada),research,https://www.inaturalist.org/observations/109709251,https://inaturalist-open-data.s3.amazonaws.com/photos/184951387/medium.jpg,,2,0,FALSE,"Ohlone Wilderness Trail, Sunol, CA, US",37.513755,-121.8552467,,,Alameda,Henderson's shooting star,Primula hendersonii,Henderson's shooting star,Plantae,487175,Primulaceae,Primula,Primula hendersonii
109734649,3/27/22,2022-03-27 23:26:32 UTC,Pacific Time (US & Canada),research,https://www.inaturalist.org/observations/109734649,https://inaturalist-open-data.s3.amazonaws.com/photos/185001741/medium.jpeg,,1,0,FALSE,"Sunol, CA 94586, USA",37.51332164,-121.8265239,,,Alameda,Fiesta Flower,Pholistoma auritum,Fiesta Flower,Plantae,55437,Boraginaceae,Pholistoma,Pholistoma auritum
109734699,3/27/22,2022-03-27 23:26:32 UTC,Pacific Time (US & Canada),research,https://www.inaturalist.org/observations/109734699,https://inaturalist-open-data.s3.amazonaws.com/photos/185001812/medium.jpeg,,2,0,FALSE,"Sunol, CA 94586, USA",37.51332164,-121.8265239,,,Alameda,western blue-eyed grass,Sisyrinchium bellum,western blue-eyed grass,Plantae,49918,Iridaceae,Sisyrinchium,Sisyrinchium bellum
109734714,3/27/22,2022-03-27 23:27:49 UTC,Pacific Time (US & Canada),research,https://www.inaturalist.org/observations/109734714,https://inaturalist-open-data.s3.amazonaws.com/photos/185001857/medium.jpeg,,2,0,FALSE,"Sunol, CA 94586, USA",37.51332067,-121.8264339,,,Alameda,western blue-eyed grass,Sisyrinchium bellum,western blue-eyed grass,Plantae,49918,Iridaceae,Sisyrinchium,Sisyrinchium bellum
109767815,3/27/22,2022-03-27 23:37:00 UTC,Pacific Time (US & Canada),research,https://www.inaturalist.org/observations/109767815,https://inaturalist-open-data.s3.amazonaws.com/photos/185064187/medium.jpeg,,1,0,FALSE,"Sunol, CA 94586, USA",37.51195267,-121.8243523,,,Alameda,jeweled onion,Allium serra,jeweled onion,Plantae,59784,Amaryllidaceae,Allium,Allium serra
109767837,3/27/22,2022-03-28 00:24:05 UTC,Pacific Time (US & Canada),research,https://www.inaturalist.org/observations/109767837,https://inaturalist-open-data.s3.amazonaws.com/photos/185064262/medium.jpeg,,2,0,FALSE,"Sunol, CA 94586, USA",37.50535339,-121.8175296,,,Alameda,Ithuriel's Spear,Triteleia laxa,Ithuriel's Spear,Plantae,51085,Asparagaceae,Triteleia,Triteleia laxa
109866165,3/29/22,2022-03-29 17:56:57 UTC,Pacific Time (US & Canada),research,https://www.inaturalist.org/observations/109866165,https://static.inaturalist.org/photos/185246943/medium.jpg,,1,0,FALSE,"Sunol Regional Wilderness, Alameda County, US-CA, US",37.52524564,-121.8315305,,,Alameda,purple owl's-clover,Castilleja exserta,purple owl's-clover,Plantae,49343,Orobanchaceae,Castilleja,Castilleja exserta
109944264,3/27/22,2022-03-27 18:43:13 UTC,Pacific Time (US & Canada),research,https://www.inaturalist.org/observations/109944264,https://inaturalist-open-data.s3.amazonaws.com/photos/185392452/medium.jpg,,1,0,FALSE,"Sunol Wilderness Regional Preserve, Sunol, CA, US",37.51454167,-121.8278283,,,Alameda,Redstem Stork's-bill,Erodium cicutarium,Redstem Stork's-bill,Plantae,47687,Geraniaceae,Erodium,Erodium cicutarium
109944664,3/27/22,2022-03-27 18:44:02 UTC,Pacific Time (US & Canada),research,https://www.inaturalist.org/observations/109944664,https://inaturalist-open-data.s3.amazonaws.com/photos/185393187/medium.jpg,,1,0,FALSE,"Sunol Wilderness Regional Preserve, Sunol, CA, US",37.51436667,-121.8276217,,,Alameda,purple owl's-clover,Castilleja exserta,purple owl's-clover,Plantae,49343,Orobanchaceae,Castilleja,Castilleja exserta
109945896,3/27/22,2022-03-27 18:56:04 UTC,Pacific Time (US & Canada),research,https://www.inaturalist.org/observations/109945896,https://inaturalist-open-data.s3.amazonaws.com/photos/185395400/medium.jpg,,1,0,FALSE,"Sunol Wilderness Regional Preserve, Sunol, CA, US",37.51525,-121.8246217,,,Alameda,Fiesta Flower,Pholistoma auritum,Fiesta Flower,Plantae,55437,Boraginaceae,Pholistoma,Pholistoma auritum
110047674,3/31/22,2022-03-31 17:11:30 UTC,Pacific Time (US & Canada),research,https://www.inaturalist.org/observations/110047674,https://inaturalist-open-data.s3.amazonaws.com/photos/185580257/medium.jpg,,1,0,FALSE,"Sunol Regional Wilderness, CA, US",37.53283738,-121.8323922,,,Alameda,Fiesta Flower,Pholistoma auritum,Fiesta Flower,Plantae,55437,Boraginaceae,Pholistoma,Pholistoma auritum
110047698,3/31/22,2022-03-31 18:05:19 UTC,Pacific Time (US & Canada),research,https://www.inaturalist.org/observations/110047698,https://inaturalist-open-data.s3.amazonaws.com/photos/185580316/medium.jpg,,1,0,FALSE,"Sunol Regional Wilderness, CA, US",37.5453367,-121.8403679,,,Alameda,white fiesta flower,Pholistoma membranaceum,white fiesta flower,Plantae,57352,Boraginaceae,Pholistoma,Pholistoma membranaceum
110047738,3/31/22,2022-03-31 18:08:04 UTC,Pacific Time (US & Canada),research,https://www.inaturalist.org/observations/110047738,https://inaturalist-open-data.s3.amazonaws.com/photos/185580404/medium.jpg,,1,0,FALSE,"Sunol Regional Wilderness, CA, US",37.54611983,-121.8408243,,,Alameda,chick lupine,Lupinus microcarpus,chick lupine,Plantae,57069,Fabaceae,Lupinus,Lupinus microcarpus
110047791,3/31/22,2022-03-31 18:10:52 UTC,Pacific Time (US & Canada),research,https://www.inaturalist.org/observations/110047791,https://inaturalist-open-data.s3.amazonaws.com/photos/185580443/medium.jpg,,1,0,FALSE,"Sunol Regional Wilderness, CA, US",37.546245,-121.84137,,,Alameda,purple owl's-clover,Castilleja exserta,purple owl's-clover,Plantae,49343,Orobanchaceae,Castilleja,Castilleja exserta
110048316,3/31/22,2022-03-31 19:28:42 UTC,Pacific Time (US & Canada),research,https://www.inaturalist.org/observations/110048316,https://inaturalist-open-data.s3.amazonaws.com/photos/185581796/medium.jpg,,1,0,FALSE,"Sunol Regional Wilderness, CA, US",37.54734768,-121.8298625,,,Alameda,wind poppy,Papaver heterophyllum,wind poppy,Plantae,78344,Papaveraceae,Papaver,Papaver heterophyllum
110048421,3/31/22,2022-03-31 19:37:46 UTC,Pacific Time (US & Canada),research,https://www.inaturalist.org/observations/110048421,https://inaturalist-open-data.s3.amazonaws.com/photos/185582014/medium.jpg,,2,0,FALSE,"Sunol Regional Wilderness, CA, US",37.5445906,-121.8279339,,,Alameda,butter-and-eggs,Triphysaria eriantha eriantha,butter-and-eggs,Plantae,59332,Orobanchaceae,Triphysaria,Triphysaria eriantha
110048449,3/31/22,2022-03-31 19:49:34 UTC,Pacific Time (US & Canada),research,https://www.inaturalist.org/observations/110048449,https://inaturalist-open-data.s3.amazonaws.com/photos/185582057/medium.jpg,,3,0,FALSE,"Sunol Regional Wilderness, CA, US",37.54083264,-121.8289011,,,Alameda,Winecup Clarkia,Clarkia purpurea,Winecup Clarkia,Plantae,51087,Onagraceae,Clarkia,Clarkia purpurea
110048479,3/31/22,2022-03-31 19:53:20 UTC,Pacific Time (US & Canada),research,https://www.inaturalist.org/observations/110048479,https://inaturalist-open-data.s3.amazonaws.com/photos/185582125/medium.jpg,,1,0,FALSE,"Sunol Regional Wilderness, CA, US",37.54000418,-121.8303741,,,Alameda,California gilia,Gilia achilleifolia,California gilia,Plantae,51098,Polemoniaceae,Gilia,Gilia achilleifolia
110048511,3/31/22,2022-03-31 20:04:56 UTC,Pacific Time (US & Canada),research,https://www.inaturalist.org/observations/110048511,https://inaturalist-open-data.s3.amazonaws.com/photos/185582218/medium.jpg,,3,0,FALSE,"Sunol Regional Wilderness, CA, US",37.53729527,-121.8337489,,,Alameda,Ithuriel's Spear,Triteleia laxa,Ithuriel's Spear,Plantae,51085,Asparagaceae,Triteleia,Triteleia laxa
110048539,3/31/22,2022-03-31 20:31:12 UTC,Pacific Time (US & Canada),research,https://www.inaturalist.org/observations/110048539,https://inaturalist-open-data.s3.amazonaws.com/photos/185582279/medium.jpg,,2,0,FALSE,"Sunol Regional Wilderness, CA, US",37.53193546,-121.8244459,,,Alameda,Fiesta Flower,Pholistoma auritum,Fiesta Flower,Plantae,55437,Boraginaceae,Pholistoma,Pholistoma auritum
110048560,3/31/22,2022-03-31 20:33:26 UTC,Pacific Time (US & Canada),research,https://www.inaturalist.org/observations/110048560,https://inaturalist-open-data.s3.amazonaws.com/photos/185582351/medium.jpg,,2,0,FALSE,"Sunol Regional Wilderness, CA, US",37.532225,-121.8235833,,,Alameda,Purple Chinese Houses,Collinsia heterophylla,Purple Chinese Houses,Plantae,47325,Plantaginaceae,Collinsia,Collinsia heterophylla
110048622,3/31/22,2022-03-31 20:43:41 UTC,Pacific Time (US & Canada),research,https://www.inaturalist.org/observations/110048622,https://inaturalist-open-data.s3.amazonaws.com/photos/185582417/medium.jpg,,2,0,FALSE,"Sunol Regional Wilderness, CA, US",37.5328717,-121.8191054,,,Alameda,wind poppy,Papaver heterophyllum,wind poppy,Plantae,78344,Papaveraceae,Papaver,Papaver heterophyllum
110048698,3/31/22,2022-03-31 21:10:01 UTC,Pacific Time (US & Canada),research,https://www.inaturalist.org/observations/110048698,https://inaturalist-open-data.s3.amazonaws.com/photos/185582591/medium.jpg,fused phyllaries,2,0,FALSE,"Sunol Regional Wilderness, CA, US",37.536106,-121.83972,,,Alameda,cupped monolopia,Monolopia major,cupped monolopia,Plantae,56977,Asteraceae,Monolopia,Monolopia major
110114415,3/24/22,2022-03-25 01:27:00 UTC,Pacific Time (US & Canada),research,https://www.inaturalist.org/observations/110114415,https://inaturalist-open-data.s3.amazonaws.com/photos/185688874/medium.jpeg,,1,0,FALSE,"Alameda County, CA, USA",37.50616389,-121.8133889,,,Alameda,Pacific poison oak,Toxicodendron diversilobum,Pacific poison oak,Plantae,51080,Anacardiaceae,Toxicodendron,Toxicodendron diversilobum
110114430,3/24/22,2022-03-24 23:05:00 UTC,Pacific Time (US & Canada),research,https://www.inaturalist.org/observations/110114430,https://inaturalist-open-data.s3.amazonaws.com/photos/185696955/medium.jpeg,,2,0,FALSE,"Alameda County, CA, USA",37.50559167,-121.8161111,,,Alameda,hairy vetch,Vicia villosa,hairy vetch,Plantae,57317,Fabaceae,Vicia,Vicia villosa
110114433,3/24/22,2022-03-24 23:01:00 UTC,Pacific Time (US & Canada),research,https://www.inaturalist.org/observations/110114433,https://inaturalist-open-data.s3.amazonaws.com/photos/185697032/medium.jpeg,,1,0,FALSE,"Alameda County, CA, USA",37.50531389,-121.8180556,,,Alameda,Blue Dicks,Dipterostemon capitatus,Blue Dicks,Plantae,1196784,Asparagaceae,Dipterostemon,Dipterostemon capitatus
110114434,3/24/22,2022-03-24 23:01:00 UTC,Pacific Time (US & Canada),research,https://www.inaturalist.org/observations/110114434,https://inaturalist-open-data.s3.amazonaws.com/photos/185697049/medium.jpeg,,2,0,FALSE,"Alameda County, CA, USA",37.50558414,-121.8276335,,,Alameda,hairy vetch,Vicia villosa,hairy vetch,Plantae,57317,Fabaceae,Vicia,Vicia villosa
110114439,3/24/22,2022-03-24 22:19:00 UTC,Pacific Time (US & Canada),research,https://www.inaturalist.org/observations/110114439,https://inaturalist-open-data.s3.amazonaws.com/photos/185697190/medium.jpeg,,1,0,FALSE,"Alameda County, CA, USA",37.50384444,-121.8232778,,,Alameda,pineapple-weed,Matricaria discoidea,pineapple-weed,Plantae,52992,Asteraceae,Matricaria,Matricaria discoidea
110114444,3/24/22,2022-03-24 22:14:00 UTC,Pacific Time (US & Canada),research,https://www.inaturalist.org/observations/110114444,https://inaturalist-open-data.s3.amazonaws.com/photos/185697264/medium.jpeg,,2,0,FALSE,"Alameda County, CA, USA",37.50488889,-121.8252556,,,Alameda,hairy vetch,Vicia villosa,hairy vetch,Plantae,57317,Fabaceae,Vicia,Vicia villosa
110114445,3/24/22,2022-03-24 22:10:00 UTC,Pacific Time (US & Canada),research,https://www.inaturalist.org/observations/110114445,https://inaturalist-open-data.s3.amazonaws.com/photos/185697306/medium.jpeg,,1,0,FALSE,"Alameda County, CA, USA",37.50491111,-121.8268139,,,Alameda,California poppy,Eschscholzia californica,California poppy,Plantae,48225,Papaveraceae,Eschscholzia,Eschscholzia californica
110191240,3/30/22,2022-03-30 22:46:03 UTC,Pacific Time (US & Canada),research,https://www.inaturalist.org/observations/110191240,https://inaturalist-open-data.s3.amazonaws.com/photos/185844774/medium.jpeg,,1,0,FALSE,"Sunol, CA 94586, USA",37.50530556,-121.8279722,,,Alameda,Toyon,Heteromeles arbutifolia,Toyon,Plantae,53405,Rosaceae,Heteromeles,Heteromeles arbutifolia
110191357,3/30/22,2022-03-30 22:46:03 UTC,Pacific Time (US & Canada),research,https://www.inaturalist.org/observations/110191357,https://inaturalist-open-data.s3.amazonaws.com/photos/185844971/medium.jpeg,,1,0,FALSE,"Sunol, CA 94586, USA",37.50530556,-121.8279722,,,Alameda,Pacific poison oak,Toxicodendron diversilobum,Pacific poison oak,Plantae,51080,Anacardiaceae,Toxicodendron,Toxicodendron diversilobum
110191438,3/30/22,2022-03-30 22:44:34 UTC,Pacific Time (US & Canada),research,https://www.inaturalist.org/observations/110191438,https://inaturalist-open-data.s3.amazonaws.com/photos/185845121/medium.jpeg,,1,0,FALSE,"Sunol, CA 94586, USA",37.50502778,-121.82765,,,Alameda,California poppy,Eschscholzia californica,California poppy,Plantae,48225,Papaveraceae,Eschscholzia,Eschscholzia californica
110191801,3/30/22,2022-03-30 22:35:59 UTC,Pacific Time (US & Canada),research,https://www.inaturalist.org/observations/110191801,https://inaturalist-open-data.s3.amazonaws.com/photos/185845940/medium.jpeg,,1,0,FALSE,"Sunol, CA 94586, USA",37.50525556,-121.8276833,,,Alameda,Dove's-foot crane's-bill,Geranium molle,Dove's-foot crane's-bill,Plantae,53076,Geraniaceae,Geranium,Geranium molle
110239068,4/2/22,2022-04-03 00:01:48 UTC,Pacific Time (US & Canada),research,https://www.inaturalist.org/observations/110239068,https://inaturalist-open-data.s3.amazonaws.com/photos/185931425/medium.jpg,,1,0,FALSE,"Sunol Wilderness Regional Preserve, Sunol, CA, US",37.53284667,-121.8191083,,,Alameda,wind poppy,Papaver heterophyllum,wind poppy,Plantae,78344,Papaveraceae,Papaver,Papaver heterophyllum
110239135,4/2/22,2022-04-03 00:00:02 UTC,Pacific Time (US & Canada),research,https://www.inaturalist.org/observations/110239135,https://inaturalist-open-data.s3.amazonaws.com/photos/185931585/medium.jpg,,1,0,FALSE,"Sunol Wilderness Regional Preserve, Sunol, CA, US",37.53276333,-121.8191217,,,Alameda,Purple Chinese Houses,Collinsia heterophylla,Purple Chinese Houses,Plantae,47325,Plantaginaceae,Collinsia,Collinsia heterophylla
110246014,4/2/22,2022-04-02 23:09:53 UTC,Pacific Time (US & Canada),research,https://www.inaturalist.org/observations/110246014,https://inaturalist-open-data.s3.amazonaws.com/photos/185944369/medium.jpg,,2,0,FALSE,"Sunol Wilderness Regional Preserve, Sunol, CA, US",37.53287167,-121.8296583,,,Alameda,Ithuriel's Spear,Triteleia laxa,Ithuriel's Spear,Plantae,51085,Asparagaceae,Triteleia,Triteleia laxa
110246066,4/2/22,2022-04-02 23:37:46 UTC,Pacific Time (US & Canada),research,https://www.inaturalist.org/observations/110246066,https://inaturalist-open-data.s3.amazonaws.com/photos/185944481/medium.jpg,,1,0,FALSE,"Sunol Wilderness Regional Preserve, Sunol, CA, US",37.53308,-121.8323833,,,Alameda,Scarlet Flax,Linum grandiflorum,Scarlet Flax,Plantae,77781,Linaceae,Linum,Linum grandiflorum
110247675,4/2/22,2022-04-02 22:18:50 UTC,Pacific Time (US & Canada),research,https://www.inaturalist.org/observations/110247675,https://inaturalist-open-data.s3.amazonaws.com/photos/185947821/medium.jpg,,2,0,FALSE,"Sunol Wilderness Regional Preserve, Sunol, CA, US",37.53235333,-121.8264617,,,Alameda,Fiesta Flower,Pholistoma auritum,Fiesta Flower,Plantae,55437,Boraginaceae,Pholistoma,Pholistoma auritum
110255581,4/2/22,2022-04-03 00:12:06 UTC,Pacific Time (US & Canada),research,https://www.inaturalist.org/observations/110255581,https://inaturalist-open-data.s3.amazonaws.com/photos/185963280/medium.jpeg,Purple wildflower,3,0,FALSE,"Sunol Regional Wilderness, Alameda County, US-CA, US",37.50421009,-121.8233841,,,Alameda,hairy vetch,Vicia villosa,hairy vetch,Plantae,57317,Fabaceae,Vicia,Vicia villosa
110354072,4/3/22,2022-04-03 17:40:00 UTC,Pacific Time (US & Canada),research,https://www.inaturalist.org/observations/110354072,https://inaturalist-open-data.s3.amazonaws.com/photos/186142526/medium.jpg,,1,0,FALSE,"Sunol Regional Wilderness, CA, USA",37.51645333,-121.8310533,,,Alameda,Little-Robin,Geranium purpureum,Little-Robin,Plantae,57643,Geraniaceae,Geranium,Geranium purpureum
110354076,4/3/22,2022-04-03 17:48:00 UTC,Pacific Time (US & Canada),research,https://www.inaturalist.org/observations/110354076,https://inaturalist-open-data.s3.amazonaws.com/photos/186142544/medium.jpg,,1,0,FALSE,"Sunol Regional Wilderness, CA, USA",37.51690333,-121.8337317,,,Alameda,  ,Capsella bursa-pastoris,shepherd's-purse,Plantae,56121,Brassicaceae,Capsella,Capsella bursa-pastoris
110354081,4/3/22,2022-04-03 18:16:00 UTC,Pacific Time (US & Canada),research,https://www.inaturalist.org/observations/110354081,https://inaturalist-open-data.s3.amazonaws.com/photos/186142581/medium.jpg,,1,0,FALSE,"Sunol Regional Wilderness, CA, USA",37.52297333,-121.8314883,,,Alameda,Elegant Clarkia,Clarkia unguiculata,Elegant Clarkia,Plantae,51735,Onagraceae,Clarkia,Clarkia unguiculata
110354082,4/3/22,2022-04-03 18:22:00 UTC,Pacific Time (US & Canada),research,https://www.inaturalist.org/observations/110354082,https://inaturalist-open-data.s3.amazonaws.com/photos/186142585/medium.jpg,,1,0,FALSE,"Sunol Regional Wilderness, CA, USA",37.52343,-121.8307983,,,Alameda,California poppy,Eschscholzia californica,California poppy,Plantae,48225,Papaveraceae,Eschscholzia,Eschscholzia californica
110354088,4/3/22,2022-04-03 18:42:00 UTC,Pacific Time (US & Canada),research,https://www.inaturalist.org/observations/110354088,https://inaturalist-open-data.s3.amazonaws.com/photos/186142773/medium.jpg,,1,0,FALSE,"Sunol Regional Wilderness, CA, USA",37.52271667,-121.8359033,,,Alameda,purple owl's-clover,Castilleja exserta,purple owl's-clover,Plantae,49343,Orobanchaceae,Castilleja,Castilleja exserta
110354089,4/3/22,2022-04-03 18:43:00 UTC,Pacific Time (US & Canada),research,https://www.inaturalist.org/observations/110354089,https://inaturalist-open-data.s3.amazonaws.com/photos/186142777/medium.jpg,,1,0,FALSE,"Sunol Regional Wilderness, CA, USA",37.52270167,-121.835925,,,Alameda,small melilot,Melilotus indicus,small melilot,Plantae,57065,Fabaceae,Melilotus,Melilotus indicus
