id,observed_on,time_observed_at,time_zone,quality_grade,url,image_url,description,num_identification_agreements,num_identification_disagreements,captive_cultivated,place_guess,latitude,longitude,positional_accuracy,geoprivacy,place_town_name,place_county_name,species_guess,scientific_name,common_name,iconic_taxon_name,taxon_id,taxon_family_name,taxon_genus_name,taxon_species_name
8246725,10/3/17,2017-10-03 20:46:28 UTC,Pacific Time (US & Canada),research,https://www.inaturalist.org/observations/8246725,https://inaturalist-open-data.s3.amazonaws.com/photos/10938172/medium.jpg,,1,0,FALSE,"Sunol Regional Wilderness Area, Sunol, CA, US",37.51577833,-121.8306417,,,,Alameda,Coast Live Oak,Quercus agrifolia,coast live oak,Plantae,47850,Fagaceae,Quercus,Quercus agrifolia
8246777,10/3/17,2017-10-03 20:47:08 UTC,Pacific Time (US & Canada),research,https://www.inaturalist.org/observations/8246777,https://inaturalist-open-data.s3.amazonaws.com/photos/10938214/medium.jpg,,1,0,FALSE,"Sunol Regional Wilderness Area, Sunol, CA, US",37.51589167,-121.8305883,,,,Alameda,white alder,Alnus rhombifolia,white alder,Plantae,53351,Betulaceae,Alnus,Alnus rhombifolia
8246800,10/3/17,2017-10-03 20:47:30 UTC,Pacific Time (US & Canada),research,https://www.inaturalist.org/observations/8246800,https://inaturalist-open-data.s3.amazonaws.com/photos/10938260/medium.jpg,,1,0,FALSE,"Sunol Regional Wilderness Area, Sunol, CA, US",37.51568833,-121.829925,,,,Alameda,western sycamore,Platanus racemosa,western sycamore,Plantae,58231,Platanaceae,Platanus,Platanus racemosa
8246813,10/3/17,2017-10-03 20:48:23 UTC,Pacific Time (US & Canada),research,https://www.inaturalist.org/observations/8246813,https://inaturalist-open-data.s3.amazonaws.com/photos/10938279/medium.jpg,,1,0,FALSE,"Sunol Regional Wilderness Area, Sunol, CA, US",37.51579667,-121.8304667,,,,Alameda,Northern California Black Walnut,Juglans hindsii,northern California black walnut,Plantae,54502,Juglandaceae,Juglans,Juglans hindsii
8246824,10/3/17,2017-10-03 20:48:55 UTC,Pacific Time (US & Canada),research,https://www.inaturalist.org/observations/8246824,https://inaturalist-open-data.s3.amazonaws.com/photos/10938289/medium.jpg,,1,0,FALSE,"Sunol Regional Wilderness Area, Sunol, CA, US",37.51602167,-121.8304533,,,,Alameda,trailing blackberry,Rubus ursinus,trailing blackberry,Plantae,53445,Rosaceae,Rubus,Rubus ursinus
8246842,10/3/17,2017-10-03 20:48:58 UTC,Pacific Time (US & Canada),research,https://www.inaturalist.org/observations/8246842,https://inaturalist-open-data.s3.amazonaws.com/photos/10938299/medium.jpg,,1,0,FALSE,"Sunol Regional Wilderness Area, Sunol, CA, US",37.51592,-121.8303533,,,,Alameda,Pacific Poison Oak,Toxicodendron diversilobum,Pacific poison oak,Plantae,51080,Anacardiaceae,Toxicodendron,Toxicodendron diversilobum
8246849,10/3/17,2017-10-03 20:50:01 UTC,Pacific Time (US & Canada),research,https://www.inaturalist.org/observations/8246849,https://inaturalist-open-data.s3.amazonaws.com/photos/10938353/medium.jpg,,1,0,FALSE,"Sunol Regional Wilderness Area, Sunol, CA, US",37.51603333,-121.8301383,,,,Alameda,blue elder,Sambucus cerulea,blue elder,Plantae,143799,Viburnaceae,Sambucus,Sambucus cerulea
8246863,10/3/17,2017-10-03 20:50:14 UTC,Pacific Time (US & Canada),research,https://www.inaturalist.org/observations/8246863,https://inaturalist-open-data.s3.amazonaws.com/photos/10938368/medium.jpg,,1,0,FALSE,"Sunol Regional Wilderness Area, Sunol, CA, US",37.516005,-121.830155,,,,Alameda,Valley Oak,Quercus lobata,valley oak,Plantae,49011,Fagaceae,Quercus,Quercus lobata
8246871,10/3/17,2017-10-03 20:50:33 UTC,Pacific Time (US & Canada),research,https://www.inaturalist.org/observations/8246871,https://inaturalist-open-data.s3.amazonaws.com/photos/10938400/medium.jpg,,1,0,FALSE,"Sunol Regional Wilderness Area, Sunol, CA, US",37.516005,-121.830155,,,,Alameda,California Buckeye,Aesculus californica,California buckeye,Plantae,53348,Sapindaceae,Aesculus,Aesculus californica
8246895,10/3/17,2017-10-03 20:51:32 UTC,Pacific Time (US & Canada),research,https://www.inaturalist.org/observations/8246895,https://inaturalist-open-data.s3.amazonaws.com/photos/10938488/medium.jpg,,1,0,FALSE,"Sunol Regional Wilderness Area, Sunol, CA, US",37.51591167,-121.83007,,,,Alameda,California Mugwort,Artemisia douglasiana,California mugwort,Plantae,52854,Asteraceae,Artemisia,Artemisia douglasiana
8246955,10/3/17,2017-10-03 21:01:18 UTC,Pacific Time (US & Canada),research,https://www.inaturalist.org/observations/8246955,https://inaturalist-open-data.s3.amazonaws.com/photos/10938501/medium.jpg,,1,0,FALSE,"Sunol Regional Wilderness Area, Livermore, CA, US",37.51447,-121.8284533,,,,Alameda,Turkey Mullein,Croton setiger,turkey mullein,Plantae,154156,Euphorbiaceae,Croton,Croton setiger
8246973,10/3/17,2017-10-03 21:07:08 UTC,Pacific Time (US & Canada),research,https://www.inaturalist.org/observations/8246973,https://inaturalist-open-data.s3.amazonaws.com/photos/10938510/medium.jpg,,2,0,FALSE,"Sunol Regional Wilderness Area, Livermore, CA, US",37.51371333,-121.8273383,,,,Alameda,California bay,Umbellularia californica,California bay,Plantae,48807,Lauraceae,Umbellularia,Umbellularia californica
8246986,10/3/17,2017-10-03 21:07:35 UTC,Pacific Time (US & Canada),research,https://www.inaturalist.org/observations/8246986,https://inaturalist-open-data.s3.amazonaws.com/photos/10938512/medium.jpg,,1,0,FALSE,"Sunol Regional Wilderness Area, Livermore, CA, US",37.51356333,-121.827295,,,,Alameda,California Sagebrush,Artemisia californica,California sagebrush,Plantae,53357,Asteraceae,Artemisia,Artemisia californica
8246988,10/3/17,2017-10-03 21:07:47 UTC,Pacific Time (US & Canada),research,https://www.inaturalist.org/observations/8246988,https://inaturalist-open-data.s3.amazonaws.com/photos/10938518/medium.jpg,,1,0,FALSE,"Sunol Regional Wilderness Area, Livermore, CA, US",37.51355833,-121.827255,,,,Alameda,Stinkwort,Dittrichia graveolens,Stinkwort,Plantae,58822,Asteraceae,Dittrichia,Dittrichia graveolens
8246989,10/3/17,2017-10-03 21:09:01 UTC,Pacific Time (US & Canada),research,https://www.inaturalist.org/observations/8246989,https://inaturalist-open-data.s3.amazonaws.com/photos/10938523/medium.jpg,,1,0,FALSE,"Sunol Regional Wilderness Area, Livermore, CA, US",37.51346167,-121.8269717,,,,Alameda,deerweed,Acmispon glaber,deerweed,Plantae,53134,Fabaceae,Acmispon,Acmispon glaber
8247002,10/3/17,2017-10-03 21:08:11 UTC,Pacific Time (US & Canada),research,https://www.inaturalist.org/observations/8247002,https://inaturalist-open-data.s3.amazonaws.com/photos/10938531/medium.jpg,,1,0,FALSE,"Sunol Regional Wilderness Area, Livermore, CA, US",37.51351667,-121.8271333,,,,Alameda,orange bush monkeyflower,Diplacus aurantiacus,orange bush monkeyflower,Plantae,777371,Phrymaceae,Diplacus,Diplacus aurantiacus
8247003,10/3/17,2017-10-03 21:10:09 UTC,Pacific Time (US & Canada),research,https://www.inaturalist.org/observations/8247003,https://inaturalist-open-data.s3.amazonaws.com/photos/10938533/medium.jpg,,1,0,FALSE,"Sunol Regional Wilderness Area, Livermore, CA, US",37.513255,-121.8268967,,,,Alameda,California brickellbush,Brickellia californica,California Brickellbush,Plantae,58803,Asteraceae,Brickellia,Brickellia californica
8247006,10/3/17,2017-10-03 21:10:44 UTC,Pacific Time (US & Canada),research,https://www.inaturalist.org/observations/8247006,https://inaturalist-open-data.s3.amazonaws.com/photos/10938539/medium.jpg,,1,0,FALSE,"Sunol Regional Wilderness Area, Livermore, CA, US",37.51315,-121.8269117,,,,Alameda,Toyon,Heteromeles arbutifolia,Toyon,Plantae,53405,Rosaceae,Heteromeles,Heteromeles arbutifolia
8247009,10/3/17,2017-10-03 21:12:14 UTC,Pacific Time (US & Canada),research,https://www.inaturalist.org/observations/8247009,https://inaturalist-open-data.s3.amazonaws.com/photos/10938544/medium.jpg,,1,0,FALSE,"Sunol Regional Wilderness Area, Sunol, CA, US",37.5129,-121.826705,,,,Alameda,Frangula californica californica,Frangula californica californica,California Coffeeberry,Plantae,53429,Rhamnaceae,Frangula,Frangula californica
8247015,10/3/17,2017-10-03 21:24:28 UTC,Pacific Time (US & Canada),research,https://www.inaturalist.org/observations/8247015,https://inaturalist-open-data.s3.amazonaws.com/photos/10938558/medium.jpg,,1,0,FALSE,"Sunol Regional Wilderness Area, Sunol, CA, US",37.5153,-121.82988,,,,Alameda,bigleaf maple,Acer macrophyllum,bigleaf maple,Plantae,48227,Sapindaceae,Acer,Acer macrophyllum
8247019,10/3/17,2017-10-03 21:40:15 UTC,Pacific Time (US & Canada),research,https://www.inaturalist.org/observations/8247019,https://inaturalist-open-data.s3.amazonaws.com/photos/10938561/medium.jpg,,1,0,FALSE,"Sunol Regional Wilderness Area, Sunol, CA, US",37.51688833,-121.8320467,,,,Alameda,Pink Honeysuckle,Lonicera hispidula,Pink Honeysuckle,Plantae,53416,Caprifoliaceae,Lonicera,Lonicera hispidula
8247055,10/3/17,2017-10-03 21:42:41 UTC,Pacific Time (US & Canada),research,https://www.inaturalist.org/observations/8247055,https://inaturalist-open-data.s3.amazonaws.com/photos/10938633/medium.jpg,,1,0,FALSE,"Sunol Regional Wilderness Area, Sunol, CA, US",37.51627833,-121.8338167,,,,Alameda,mule fat,Baccharis salicifolia,mule fat,Plantae,57913,Asteraceae,Baccharis,Baccharis salicifolia
8247063,10/3/17,2017-10-03 21:43:27 UTC,Pacific Time (US & Canada),research,https://www.inaturalist.org/observations/8247063,https://inaturalist-open-data.s3.amazonaws.com/photos/10938653/medium.jpg,,1,0,FALSE,"Sunol Regional Wilderness Area, Sunol, CA, US",37.51621667,-121.8337333,,,,Alameda,California brickellbush,Brickellia californica,California Brickellbush,Plantae,58803,Asteraceae,Brickellia,Brickellia californica
8247066,10/3/17,2017-10-03 21:43:54 UTC,Pacific Time (US & Canada),research,https://www.inaturalist.org/observations/8247066,https://inaturalist-open-data.s3.amazonaws.com/photos/10938656/medium.jpg,,1,0,FALSE,"Sunol Regional Wilderness Area, Sunol, CA, US",37.51622,-121.83377,,,,Alameda,Fremont cottonwood,Populus fremontii,Fremont Cottonwood,Plantae,52120,Salicaceae,Populus,Populus fremontii
8247116,10/3/17,2017-10-03 21:48:46 UTC,Pacific Time (US & Canada),research,https://www.inaturalist.org/observations/8247116,https://inaturalist-open-data.s3.amazonaws.com/photos/10938718/medium.jpg,,1,0,FALSE,"Sunol Regional Wilderness Area, Sunol, CA, US",37.51622,-121.8344417,,,,Alameda,Oloptum miliaceum,Oloptum miliaceum,Smilo Grass,Plantae,524183,Poaceae,Oloptum,Oloptum miliaceum
8403741,10/14/17,2017-10-14 19:32:05 UTC,Pacific Time (US & Canada),research,https://www.inaturalist.org/observations/8403741,https://inaturalist-open-data.s3.amazonaws.com/photos/11181818/medium.jpg,,1,0,FALSE,"Sunol Regional Wilderness Area, Livermore, CA, US",37.507,-121.8085333,,,,Alameda,blue oak,Quercus douglasii,blue oak,Plantae,49009,Fagaceae,Quercus,Quercus douglasii
8952169,11/17/17,2017-11-17 18:39:52 UTC,Pacific Time (US & Canada),research,https://www.inaturalist.org/observations/8952169,https://inaturalist-open-data.s3.amazonaws.com/photos/12064624/medium.jpg,"Leaves kind of sticky, has an odor like coyote mint",1,0,FALSE,"Sunol Regional Wilderness, Alameda County, US-CA, US",37.52479604,-121.8177646,10,,,Alameda,California brickellbush,Brickellia californica,California Brickellbush,Plantae,58803,Asteraceae,Brickellia,Brickellia californica
8952194,11/17/17,2017-11-17 20:53:28 UTC,Pacific Time (US & Canada),research,https://www.inaturalist.org/observations/8952194,https://inaturalist-open-data.s3.amazonaws.com/photos/12064639/medium.jpg,,1,0,FALSE,"Sunol Regional Wilderness, Alameda County, US-CA, US",37.51301947,-121.8252379,5,,,Alameda,blue oak,Quercus douglasii,blue oak,Plantae,49009,Fagaceae,Quercus,Quercus douglasii
8952198,11/17/17,2017-11-17 20:57:42 UTC,Pacific Time (US & Canada),research,https://www.inaturalist.org/observations/8952198,https://inaturalist-open-data.s3.amazonaws.com/photos/12064640/medium.jpg,,1,0,FALSE,"Sunol Regional Wilderness, Alameda County, US-CA, US",37.51217084,-121.8247177,5,,,Alameda,blue oak,Quercus douglasii,blue oak,Plantae,49009,Fagaceae,Quercus,Quercus douglasii
8926145,11/24/17,2017-11-24 21:29:00 UTC,Pacific Time (US & Canada),research,https://www.inaturalist.org/observations/8926145,https://inaturalist-open-data.s3.amazonaws.com/photos/12021358/medium.jpeg,"New plant to me: low-growing plant, has succulent-like thick leaves but fuzzy like a sage; growing sparsely on a hillside exposed to wind and sun",2,0,FALSE,"Alameda County, CA, USA",37.53571217,-121.8364725,1364,,,Alameda,Turkey Mullein,Croton setiger,turkey mullein,Plantae,154156,Euphorbiaceae,Croton,Croton setiger
8929886,11/25/17,2017-11-25 16:37:04 UTC,Pacific Time (US & Canada),research,https://www.inaturalist.org/observations/8929886,https://inaturalist-open-data.s3.amazonaws.com/photos/12027804/medium.jpg,,1,0,FALSE,"Sunol Regional Wilderness Area, Livermore, CA, US",37.54677457,-121.8339768,5,,,Alameda,coyote brush,Baccharis pilularis,coyote brush,Plantae,53359,Asteraceae,Baccharis,Baccharis pilularis
8931898,11/25/17,2017-11-25 19:07:50 UTC,Pacific Time (US & Canada),research,https://www.inaturalist.org/observations/8931898,https://inaturalist-open-data.s3.amazonaws.com/photos/12031057/medium.jpg,,2,0,FALSE,"Sunol Regional Wilderness, Alameda County, US-CA, US",37.51269241,-121.8248524,5,,,Alameda,Toyon,Heteromeles arbutifolia,Toyon,Plantae,53405,Rosaceae,Heteromeles,Heteromeles arbutifolia
8932139,11/25/17,2017-11-25 20:07:36 UTC,Pacific Time (US & Canada),research,https://www.inaturalist.org/observations/8932139,https://inaturalist-open-data.s3.amazonaws.com/photos/12031488/medium.jpg,,2,0,FALSE,"Sunol Regional Wilderness Area, Livermore, CA, US",37.50644458,-121.8176099,5,,,Alameda,Vinegar Weed,Trichostema lanceolatum,Vinegar Weed,Plantae,54875,Lamiaceae,Trichostema,Trichostema lanceolatum
8932240,11/25/17,2017-11-25 18:13:53 UTC,Pacific Time (US & Canada),research,https://www.inaturalist.org/observations/8932240,https://inaturalist-open-data.s3.amazonaws.com/photos/12031611/medium.jpg,,1,0,FALSE,"Sunol Regional Wilderness Area, Livermore, CA, US",37.54001083,-121.8304012,5,,,Alameda,western sycamore,Platanus racemosa,western sycamore,Plantae,58231,Platanaceae,Platanus,Platanus racemosa
9026182,12/2/17,2017-12-02 23:13:00 UTC,Pacific Time (US & Canada),research,https://www.inaturalist.org/observations/9026182,https://inaturalist-open-data.s3.amazonaws.com/photos/12174235/medium.jpg,,1,0,FALSE,"Sunol Regional Wilderness, Alameda, California, United States",37.5091581,-121.8232921,,,,Alameda,Turkey Mullein,Croton setiger,turkey mullein,Plantae,154156,Euphorbiaceae,Croton,Croton setiger
9026194,12/2/17,2017-12-03 00:04:00 UTC,Pacific Time (US & Canada),research,https://www.inaturalist.org/observations/9026194,https://inaturalist-open-data.s3.amazonaws.com/photos/12174280/medium.jpg,,1,0,FALSE,"Sunol Regional Wilderness, Alameda, California, United States",37.5111633,-121.826555,,,,Alameda,Toyon,Heteromeles arbutifolia,Toyon,Plantae,53405,Rosaceae,Heteromeles,Heteromeles arbutifolia
9026204,12/2/17,2017-12-02 22:30:50 UTC,Pacific Time (US & Canada),research,https://www.inaturalist.org/observations/9026204,https://inaturalist-open-data.s3.amazonaws.com/photos/12174429/medium.jpg,,2,0,FALSE,"Sunol Regional Wilderness Area, Sunol, CA, US",37.50972,-121.8288583,6,,,Alameda,great mullein,Verbascum thapsus,great mullein,Plantae,59029,Scrophulariaceae,Verbascum,Verbascum thapsus
9419538,12/16/17,2017-12-16 22:41:26 UTC,Pacific Time (US & Canada),research,https://www.inaturalist.org/observations/9419538,https://inaturalist-open-data.s3.amazonaws.com/photos/12799203/medium.jpg,,3,0,FALSE,"Sunol Regional Wilderness, Alameda County, US-CA, US",37.50976943,-121.8287743,5,,,Alameda,great mullein,Verbascum thapsus,great mullein,Plantae,59029,Scrophulariaceae,Verbascum,Verbascum thapsus
9419544,12/16/17,2017-12-16 22:42:24 UTC,Pacific Time (US & Canada),research,https://www.inaturalist.org/observations/9419544,https://inaturalist-open-data.s3.amazonaws.com/photos/12799224/medium.jpg,,1,0,FALSE,"Sunol Regional Wilderness, Alameda County, US-CA, US",37.50971159,-121.8288756,5,,,Alameda,white horehound,Marrubium vulgare,White Horehound,Plantae,54605,Lamiaceae,Marrubium,Marrubium vulgare
9419566,12/16/17,2017-12-16 22:57:14 UTC,Pacific Time (US & Canada),research,https://www.inaturalist.org/observations/9419566,https://inaturalist-open-data.s3.amazonaws.com/photos/12799249/medium.jpg,,2,0,FALSE,"Sunol Regional Wilderness, Alameda County, US-CA, US",37.50801133,-121.8293385,10,,,Alameda,hollyleaf redberry,Rhamnus ilicifolia,hollyleaf redberry,Plantae,58308,Rhamnaceae,Rhamnus,Rhamnus ilicifolia
9419571,12/16/17,2017-12-16 22:59:34 UTC,Pacific Time (US & Canada),research,https://www.inaturalist.org/observations/9419571,https://inaturalist-open-data.s3.amazonaws.com/photos/12799256/medium.jpg,,2,0,FALSE,"Sunol Regional Wilderness, Alameda County, US-CA, US",37.50810151,-121.8293477,5,,,Alameda,miner's lettuce,Claytonia perfoliata,miner's lettuce,Plantae,52994,Montiaceae,Claytonia,Claytonia perfoliata
9419578,12/16/17,2017-12-16 23:02:39 UTC,Pacific Time (US & Canada),research,https://www.inaturalist.org/observations/9419578,https://inaturalist-open-data.s3.amazonaws.com/photos/12799270/medium.jpg,,1,0,FALSE,"Sunol Regional Wilderness, Alameda County, US-CA, US",37.50775035,-121.8294867,5,,,Alameda,valley oak,Quercus lobata,valley oak,Plantae,49011,Fagaceae,Quercus,Quercus lobata
9419580,12/16/17,2017-12-16 23:02:55 UTC,Pacific Time (US & Canada),research,https://www.inaturalist.org/observations/9419580,https://inaturalist-open-data.s3.amazonaws.com/photos/12799278/medium.jpg,,1,0,FALSE,"Sunol Regional Wilderness, Alameda County, US-CA, US",37.50767131,-121.829624,10,,,Alameda,coast live oak,Quercus agrifolia,coast live oak,Plantae,47850,Fagaceae,Quercus,Quercus agrifolia
9419586,12/16/17,2017-12-16 23:04:55 UTC,Pacific Time (US & Canada),research,https://www.inaturalist.org/observations/9419586,https://inaturalist-open-data.s3.amazonaws.com/photos/12799286/medium.jpg,,3,0,FALSE,"Sunol Regional Wilderness, Alameda County, US-CA, US",37.50776926,-121.829528,5,,,Alameda,California bay,Umbellularia californica,California bay,Plantae,48807,Lauraceae,Umbellularia,Umbellularia californica
9315914,12/30/17,2017-12-30 22:25:00 UTC,Pacific Time (US & Canada),research,https://www.inaturalist.org/observations/9315914,https://static.inaturalist.org/photos/12631337/medium.jpg,,1,0,FALSE,"Alameda County, CA, USA",37.54747833,-121.8355217,,,,Alameda,hollyleaf redberry,Rhamnus ilicifolia,hollyleaf redberry,Plantae,58308,Rhamnaceae,Rhamnus,Rhamnus ilicifolia
9315915,12/30/17,2017-12-30 22:14:00 UTC,Pacific Time (US & Canada),research,https://www.inaturalist.org/observations/9315915,https://static.inaturalist.org/photos/12631338/medium.jpg,,1,0,FALSE,"Sunol Regional Wilderness, Alameda, California, United States",37.546925,-121.8330983,,,,Alameda,coyote brush,Baccharis pilularis,coyote brush,Plantae,53359,Asteraceae,Baccharis,Baccharis pilularis
9315920,12/30/17,2017-12-30 19:53:00 UTC,Pacific Time (US & Canada),research,https://www.inaturalist.org/observations/9315920,https://static.inaturalist.org/photos/12631350/medium.jpg,,1,0,FALSE,"Sunol Regional Wilderness, Alameda, California, United States",37.53584833,-121.8299183,,,,Alameda,orange bush monkeyflower,Diplacus aurantiacus,orange bush monkeyflower,Plantae,777371,Phrymaceae,Diplacus,Diplacus aurantiacus
9315921,12/30/17,2017-12-30 19:52:00 UTC,Pacific Time (US & Canada),research,https://www.inaturalist.org/observations/9315921,https://static.inaturalist.org/photos/12631352/medium.jpg,,1,0,FALSE,"Alameda County, CA, USA",37.53584833,-121.8299183,,,,Alameda,white horehound,Marrubium vulgare,White Horehound,Plantae,54605,Lamiaceae,Marrubium,Marrubium vulgare
12300868,1/27/18,,UTC,research,https://www.inaturalist.org/observations/12300868,https://static.inaturalist.org/photos/17697620/medium.jpg,,1,0,FALSE,"Alameda County, CA, USA",37.50753006,-121.8283877,8,,,Alameda,great mullein,Verbascum thapsus,great mullein,Plantae,59029,Scrophulariaceae,Verbascum,Verbascum thapsus
9813003,2/10/18,2018-02-10 19:22:53 UTC,Pacific Time (US & Canada),research,https://www.inaturalist.org/observations/9813003,https://inaturalist-open-data.s3.amazonaws.com/photos/13429668/medium.jpg,,1,0,FALSE,"Mill Creek Rd, Sunol, CA, US",37.51724902,-121.8648029,5,,,Alameda,hillside gooseberry,Ribes californicum,hillside gooseberry,Plantae,47129,Grossulariaceae,Ribes,Ribes californicum
9814624,2/10/18,2018-02-10 21:38:21 UTC,Pacific Time (US & Canada),research,https://www.inaturalist.org/observations/9814624,https://inaturalist-open-data.s3.amazonaws.com/photos/13436367/medium.jpg,,3,0,FALSE,"Sunol Regional Wilderness Area, Sunol, CA, US",37.51328262,-121.8452497,5,,,Alameda,Adelinia grande,Adelinia grande,Pacific hound's tongue,Plantae,769151,Boraginaceae,Adelinia,Adelinia grande
37601263,2/10/18,2018-02-10 11:31:18 UTC,UTC,research,https://www.inaturalist.org/observations/37601263,https://inaturalist-open-data.s3.amazonaws.com/photos/59639384/medium.jpeg,,2,0,FALSE,Sunol Regional Wilderness,37.51488232,-121.8311507,263,,,Alameda,California bay,Umbellularia californica,California bay,Plantae,48807,Lauraceae,Umbellularia,Umbellularia californica
9827460,2/11/18,2018-02-11 21:11:13 UTC,Pacific Time (US & Canada),research,https://www.inaturalist.org/observations/9827460,https://static.inaturalist.org/photos/13454749/medium.jpg,,1,0,FALSE,"Sunol Regional Wilderness, Alameda County, US-CA, US",37.50826173,-121.8113925,10,,,Alameda,Pacific Sanicle,Sanicula crassicaulis,Pacific Sanicle,Plantae,53201,Apiaceae,Sanicula,Sanicula crassicaulis
9827796,2/11/18,2018-02-11 19:45:58 UTC,Pacific Time (US & Canada),research,https://www.inaturalist.org/observations/9827796,https://static.inaturalist.org/photos/13455251/medium.jpg,,1,0,FALSE,"Sunol Regional Wilderness Area, Sunol, CA, US",37.52542034,-121.8295154,420,,,Alameda,Toyon,Heteromeles arbutifolia,Toyon,Plantae,53405,Rosaceae,Heteromeles,Heteromeles arbutifolia
9827799,2/11/18,2018-02-11 20:17:40 UTC,Pacific Time (US & Canada),research,https://www.inaturalist.org/observations/9827799,https://static.inaturalist.org/photos/13455255/medium.jpg,,3,0,FALSE,"Sunol Regional Wilderness Area, Sunol, CA, US",37.52656403,-121.8269612,484,,,Alameda,milkmaids,Cardamine californica,milkmaids,Plantae,49651,Brassicaceae,Cardamine,Cardamine californica
9827808,2/11/18,2018-02-11 20:18:48 UTC,Pacific Time (US & Canada),research,https://www.inaturalist.org/observations/9827808,https://static.inaturalist.org/photos/13455279/medium.jpg,Flower photographed at 10x zoom. ,1,0,FALSE,"Sunol Regional Wilderness Area, Livermore, CA, US",37.53008193,-121.8232947,582,,,Alameda,bird's-eye speedwell,Veronica persica,bird's-eye speedwell,Plantae,55666,Plantaginaceae,Veronica,Veronica persica
9827824,2/11/18,2018-02-11 20:33:10 UTC,Pacific Time (US & Canada),research,https://www.inaturalist.org/observations/9827824,https://static.inaturalist.org/photos/13455312/medium.jpg,,2,0,FALSE,"Sunol Regional Wilderness Area, Livermore, CA, US",37.52773875,-121.8234654,714,,,Alameda,Dipterostemon capitatus,Dipterostemon capitatus,Blue Dicks,Plantae,1196784,Asparagaceae,Dipterostemon,Dipterostemon capitatus
9827837,2/11/18,2018-02-11 20:41:00 UTC,Pacific Time (US & Canada),research,https://www.inaturalist.org/observations/9827837,https://static.inaturalist.org/photos/13455360/medium.jpg,,1,0,FALSE,"Sunol Regional Wilderness Area, Sunol, CA, US",37.52689679,-121.8324911,419,,,Alameda,California buttercup,Ranunculus californicus,California buttercup,Plantae,52173,Ranunculaceae,Ranunculus,Ranunculus californicus
9827860,2/11/18,2018-02-11 19:46:59 UTC,Pacific Time (US & Canada),research,https://www.inaturalist.org/observations/9827860,https://static.inaturalist.org/photos/13455408/medium.jpg,,1,0,FALSE,"Sunol Regional Wilderness Area, Sunol, CA, US",37.53287408,-121.8385115,671,,,Alameda,hillside gooseberry,Ribes californicum,hillside gooseberry,Plantae,47129,Grossulariaceae,Ribes,Ribes californicum
27727958,2/11/18,2018-02-12 05:36:00 UTC,Hawaii,research,https://www.inaturalist.org/observations/27727958,https://inaturalist-open-data.s3.amazonaws.com/photos/43172194/medium.jpeg,,2,0,FALSE,"1895 Geary Rd, Sunol, CA 94586, USA",37.5148824,-121.8311506,213,,,Alameda,Winecup Clarkia,Clarkia purpurea,Winecup Clarkia,Plantae,51087,Onagraceae,Clarkia,Clarkia purpurea
27728721,2/11/18,2018-02-12 05:16:00 UTC,Hawaii,research,https://www.inaturalist.org/observations/27728721,https://inaturalist-open-data.s3.amazonaws.com/photos/43173599/medium.jpeg,,2,0,FALSE,"1895 Geary Rd, Sunol, CA 94586, USA",37.5148824,-121.8311506,213,,,Alameda,Blow Wives,Achyrachaena mollis,Blow Wives,Plantae,56852,Asteraceae,Achyrachaena,Achyrachaena mollis
27728813,2/11/18,2018-02-12 05:18:00 UTC,Hawaii,research,https://www.inaturalist.org/observations/27728813,https://inaturalist-open-data.s3.amazonaws.com/photos/43173747/medium.jpeg,,1,0,FALSE,"1895 Geary Rd, Sunol, CA 94586, USA",37.5148824,-121.8311506,213,,,Alameda,orange bush monkeyflower,Diplacus aurantiacus,orange bush monkeyflower,Plantae,777371,Phrymaceae,Diplacus,Diplacus aurantiacus
9896388,2/17/18,2018-02-17 17:50:57 UTC,Pacific Time (US & Canada),research,https://www.inaturalist.org/observations/9896388,https://static.inaturalist.org/photos/13568607/medium.jpeg,,1,0,FALSE,"3638 Welch Creek Rd, Sunol, CA 94586, USA",37.51813507,-121.8106613,,,,Alameda,Dwarf Checkermallow,Sidalcea malviflora,Dwarf Checkermallow,Plantae,48795,Malvaceae,Sidalcea,Sidalcea malviflora
9896462,2/17/18,2018-02-17 18:54:57 UTC,Pacific Time (US & Canada),research,https://www.inaturalist.org/observations/9896462,https://static.inaturalist.org/photos/13568693/medium.jpeg,,1,0,FALSE,"Sunol, CA 94586, USA",37.51460648,-121.8244934,,,,Alameda,California buttercup,Ranunculus californicus,California buttercup,Plantae,52173,Ranunculaceae,Ranunculus,Ranunculus californicus
9896470,2/17/18,2018-02-17 18:27:35 UTC,Pacific Time (US & Canada),research,https://www.inaturalist.org/observations/9896470,https://static.inaturalist.org/photos/13568705/medium.jpeg,,1,0,FALSE,"Sunol, CA 94586, USA",37.52473831,-121.8170776,,,,Alameda,milkmaids,Cardamine californica,milkmaids,Plantae,49651,Brassicaceae,Cardamine,Cardamine californica
9896511,2/17/18,2018-02-17 18:25:59 UTC,Pacific Time (US & Canada),research,https://www.inaturalist.org/observations/9896511,https://static.inaturalist.org/photos/13568778/medium.jpeg,,1,0,FALSE,"Sunol, CA 94586, USA",37.52507019,-121.8166733,,,,Alameda,Dipterostemon capitatus,Dipterostemon capitatus,Blue Dicks,Plantae,1196784,Asparagaceae,Dipterostemon,Dipterostemon capitatus
9896579,2/17/18,2018-02-17 18:09:33 UTC,Pacific Time (US & Canada),research,https://www.inaturalist.org/observations/9896579,https://static.inaturalist.org/photos/13568868/medium.jpeg,,1,0,FALSE,"Cave Rocks Road, Sunol, CA 94586, USA",37.52349472,-121.8102722,,,,Alameda,California poppy,Eschscholzia californica,California poppy,Plantae,48225,Papaveraceae,Eschscholzia,Eschscholzia californica
9896618,2/17/18,2018-02-17 17:05:55 UTC,Pacific Time (US & Canada),research,https://www.inaturalist.org/observations/9896618,https://static.inaturalist.org/photos/13568893/medium.jpeg,,1,0,FALSE,"Cerro Este Rd, Sunol, CA 94586, USA",37.5111084,-121.8095093,,,,Alameda,common stork's-bill,Erodium cicutarium,Redstem Stork's-bill,Plantae,47687,Geraniaceae,Erodium,Erodium cicutarium
9896662,2/17/18,2018-02-17 17:00:09 UTC,Pacific Time (US & Canada),research,https://www.inaturalist.org/observations/9896662,https://static.inaturalist.org/photos/13568971/medium.jpeg,Is this blue-witch or purple? ,2,0,FALSE,"Cerro Este Rd, Sunol, CA 94586, USA",37.50828552,-121.8104019,,,,Alameda,bluewitch nightshade,Solanum umbelliferum,bluewitch nightshade,Plantae,50639,Solanaceae,Solanum,Solanum umbelliferum
9896683,2/17/18,2018-02-17 19:05:09 UTC,Pacific Time (US & Canada),research,https://www.inaturalist.org/observations/9896683,https://static.inaturalist.org/photos/13568990/medium.jpeg,,2,0,FALSE,"Geary Rd, Fremont, CA 94539, USA",37.51071548,-121.8279343,,,,Alameda,henbit deadnettle,Lamium amplexicaule,henbit deadnettle,Plantae,55459,Lamiaceae,Lamium,Lamium amplexicaule
9899514,2/17/18,2018-02-18 00:32:00 UTC,Hawaii,research,https://www.inaturalist.org/observations/9899514,https://inaturalist-open-data.s3.amazonaws.com/photos/13573952/medium.jpg,,1,0,FALSE,"Alameda County, CA, USA",37.52011,-121.821876,5,,,Alameda,California buttercup,Ranunculus californicus,California buttercup,Plantae,52173,Ranunculaceae,Ranunculus,Ranunculus californicus
9899549,2/17/18,2018-02-18 00:36:00 UTC,Hawaii,research,https://www.inaturalist.org/observations/9899549,https://inaturalist-open-data.s3.amazonaws.com/photos/13573975/medium.jpg,,1,0,FALSE,"Alameda County, CA, USA",37.52013,-121.821624,5,,,Alameda,milkmaids,Cardamine californica,milkmaids,Plantae,49651,Brassicaceae,Cardamine,Cardamine californica
9939708,2/19/18,2018-02-19 21:52:52 UTC,Pacific Time (US & Canada),research,https://www.inaturalist.org/observations/9939708,https://static.inaturalist.org/photos/13641657/medium.jpg,,3,0,FALSE,"Sunol Regional Wilderness Area, Sunol, CA, US",37.54586167,-121.8356333,10,,,Alameda,white fiesta flower,Pholistoma membranaceum,white fiesta flower,Plantae,57352,Boraginaceae,Pholistoma,Pholistoma membranaceum
9939712,2/19/18,2018-02-19 21:02:39 UTC,Pacific Time (US & Canada),research,https://www.inaturalist.org/observations/9939712,https://static.inaturalist.org/photos/13641660/medium.jpg,,3,0,FALSE,"Sunol Regional Wilderness Area, Sunol, CA, US",37.54665,-121.82978,5,,,Alameda,Redmaids,Calandrinia menziesii,redmaids,Plantae,400267,Montiaceae,Calandrinia,Calandrinia menziesii
9939718,2/19/18,2018-02-19 23:18:20 UTC,Pacific Time (US & Canada),research,https://www.inaturalist.org/observations/9939718,https://static.inaturalist.org/photos/13641668/medium.jpg,,1,0,FALSE,"Sunol, CA  94586, Sunol, CA, US",37.54519167,-121.8405383,10,,,Alameda,California Saxifrage,Micranthes californica,California Saxifrage,Plantae,78023,Saxifragaceae,Micranthes,Micranthes californica
9963635,2/20/18,2018-02-20 20:37:43 UTC,Pacific Time (US & Canada),research,https://www.inaturalist.org/observations/9963635,https://inaturalist-open-data.s3.amazonaws.com/photos/13684671/medium.jpg,,1,0,FALSE,"Sunol Regional Wilderness Area, Sunol, CA, US",37.52490371,-121.8139034,20,,,Alameda,western sycamore,Platanus racemosa,western sycamore,Plantae,58231,Platanaceae,Platanus,Platanus racemosa
9963644,2/20/18,2018-02-20 21:59:49 UTC,Pacific Time (US & Canada),research,https://www.inaturalist.org/observations/9963644,https://inaturalist-open-data.s3.amazonaws.com/photos/13684690/medium.jpg,,2,0,FALSE,"Sunol Regional Wilderness Area, Sunol, CA, US",37.51570475,-121.8313109,65,,,Alameda,milkmaids,Cardamine californica,milkmaids,Plantae,49651,Brassicaceae,Cardamine,Cardamine californica
9963648,2/20/18,2018-02-20 22:25:20 UTC,Pacific Time (US & Canada),research,https://www.inaturalist.org/observations/9963648,https://inaturalist-open-data.s3.amazonaws.com/photos/13684698/medium.jpg,,2,0,FALSE,"Sunol Regional Wilderness Area, Sunol, CA, US",37.51570475,-121.8313109,65,,,Alameda,bluewitch nightshade,Solanum umbelliferum,bluewitch nightshade,Plantae,50639,Solanaceae,Solanum,Solanum umbelliferum
10022706,2/25/18,2018-02-25 20:05:00 UTC,Pacific Time (US & Canada),research,https://www.inaturalist.org/observations/10022706,https://static.inaturalist.org/photos/13783465/medium.jpeg,Found in Sunol regional Park.,1,0,FALSE,"1895 Geary Rd, Sunol, CA 94586, USA",37.51480839,-121.8311778,516,,,Alameda,Pacific poison oak,Toxicodendron diversilobum,Pacific poison oak,Plantae,51080,Anacardiaceae,Toxicodendron,Toxicodendron diversilobum
10087867,3/4/18,2018-03-04 17:10:21 UTC,Pacific Time (US & Canada),research,https://www.inaturalist.org/observations/10087867,https://inaturalist-open-data.s3.amazonaws.com/photos/13897163/medium.jpg,,1,0,FALSE,"Sunol Regional Wilderness Area, Sunol, CA, US",37.51694308,-121.815854,1136,,,Alameda,Padre's Shooting Star,Primula clevelandii,Padre's Shooting Star,Plantae,486971,Primulaceae,Primula,Primula clevelandii
10095691,3/4/18,2018-03-04 23:13:31 UTC,Pacific Time (US & Canada),research,https://www.inaturalist.org/observations/10095691,https://inaturalist-open-data.s3.amazonaws.com/photos/13910061/medium.jpeg,,2,0,FALSE,"Sunol, CA 94586, USA",37.51562119,-121.824585,,,,Alameda,California bay,Umbellularia californica,California bay,Plantae,48807,Lauraceae,Umbellularia,Umbellularia californica
10095709,3/4/18,2018-03-04 22:53:59 UTC,Pacific Time (US & Canada),research,https://www.inaturalist.org/observations/10095709,https://inaturalist-open-data.s3.amazonaws.com/photos/13910134/medium.jpeg,,2,0,FALSE,"Sunol, CA 94586, USA",37.52031326,-121.8217773,,,,Alameda,milkmaids,Cardamine californica,milkmaids,Plantae,49651,Brassicaceae,Cardamine,Cardamine californica
10095721,3/4/18,2018-03-04 22:53:03 UTC,Pacific Time (US & Canada),research,https://www.inaturalist.org/observations/10095721,https://inaturalist-open-data.s3.amazonaws.com/photos/13910164/medium.jpeg,,1,0,FALSE,"Sunol, CA 94586, USA",37.52030182,-121.8216858,,,,Alameda,California buttercup,Ranunculus californicus,California buttercup,Plantae,52173,Ranunculaceae,Ranunculus,Ranunculus californicus
10095764,3/4/18,2018-03-04 22:42:55 UTC,Pacific Time (US & Canada),research,https://www.inaturalist.org/observations/10095764,https://inaturalist-open-data.s3.amazonaws.com/photos/13910218/medium.jpeg,,1,0,FALSE,"Sunol, CA 94586, USA",37.52337646,-121.8185196,,,,Alameda,hillside gooseberry,Ribes californicum,hillside gooseberry,Plantae,47129,Grossulariaceae,Ribes,Ribes californicum
10095815,3/4/18,2018-03-04 21:49:16 UTC,Pacific Time (US & Canada),research,https://www.inaturalist.org/observations/10095815,https://inaturalist-open-data.s3.amazonaws.com/photos/13910279/medium.jpeg,,1,0,FALSE,"3711 Welch Creek Rd, Livermore, CA 94550, USA",37.5172348,-121.8107986,,,,Alameda,California Golden Violet,Viola pedunculata,California Golden Violet,Plantae,50825,Violaceae,Viola,Viola pedunculata
10095833,3/4/18,2018-03-04 21:08:14 UTC,Pacific Time (US & Canada),research,https://www.inaturalist.org/observations/10095833,https://inaturalist-open-data.s3.amazonaws.com/photos/13910335/medium.jpeg,,1,0,FALSE,"Cerro Este Rd, Sunol, CA 94586, USA",37.50838089,-121.8104248,,,,Alameda,woollyfruit desertparsley,Lomatium dasycarpum,woollyfruit desertparsley,Plantae,56825,Apiaceae,Lomatium,Lomatium dasycarpum
10095859,3/4/18,2018-03-04 21:05:11 UTC,Pacific Time (US & Canada),research,https://www.inaturalist.org/observations/10095859,https://inaturalist-open-data.s3.amazonaws.com/photos/13910390/medium.jpeg,,1,0,FALSE,"Cerro Este Rd, Sunol, CA 94586, USA",37.50829697,-121.8115082,,,,Alameda,Pipestem Clematis,Clematis lasiantha,Pipestem Clematis,Plantae,49876,Ranunculaceae,Clematis,Clematis lasiantha
10095944,3/4/18,2018-03-04 20:22:38 UTC,Pacific Time (US & Canada),research,https://www.inaturalist.org/observations/10095944,https://inaturalist-open-data.s3.amazonaws.com/photos/13910677/medium.jpeg,,1,0,FALSE,"Ohlone Rd, Sunol, CA 94586, USA",37.50497055,-121.8268051,,,,Alameda,California sagebrush,Artemisia californica,California sagebrush,Plantae,53357,Asteraceae,Artemisia,Artemisia californica
10095980,3/4/18,2018-03-04 20:01:45 UTC,Pacific Time (US & Canada),research,https://www.inaturalist.org/observations/10095980,https://inaturalist-open-data.s3.amazonaws.com/photos/13910763/medium.jpeg,,1,0,FALSE,"1895 Geary Rd, Sunol, CA 94586, USA",37.51029587,-121.8284225,,,,Alameda,henbit deadnettle,Lamium amplexicaule,henbit deadnettle,Plantae,55459,Lamiaceae,Lamium,Lamium amplexicaule
10096009,3/4/18,2018-03-04 19:55:05 UTC,Pacific Time (US & Canada),research,https://www.inaturalist.org/observations/10096009,https://inaturalist-open-data.s3.amazonaws.com/photos/13910823/medium.jpeg,,2,0,FALSE,"1895 Geary Rd, Sunol, CA 94586, USA",37.51029587,-121.8284225,,,,Alameda,white horehound,Marrubium vulgare,White Horehound,Plantae,54605,Lamiaceae,Marrubium,Marrubium vulgare
10096013,3/4/18,2018-03-04 20:05:25 UTC,Pacific Time (US & Canada),research,https://www.inaturalist.org/observations/10096013,https://inaturalist-open-data.s3.amazonaws.com/photos/13910835/medium.jpeg,,1,0,FALSE,"Geary Rd, Fremont, CA 94539, USA",37.51273346,-121.8271255,,,,Alameda,common yarrow,Achillea millefolium,Common Yarrow,Plantae,52821,Asteraceae,Achillea,Achillea millefolium
10176229,3/10/18,2018-03-10 20:39:19 UTC,Pacific Time (US & Canada),research,https://www.inaturalist.org/observations/10176229,https://static.inaturalist.org/photos/14050140/medium.jpg,lovely lemony sagey smell,1,0,FALSE,"Sunol Regional Wilderness Area, Sunol, CA, US",37.524575,-121.8177633,10,,,Alameda,California mugwort,Artemisia douglasiana,California mugwort,Plantae,52854,Asteraceae,Artemisia,Artemisia douglasiana
10176235,3/10/18,2018-03-10 19:55:49 UTC,Pacific Time (US & Canada),research,https://www.inaturalist.org/observations/10176235,https://static.inaturalist.org/photos/14050154/medium.jpg,,1,0,FALSE,"Sunol Regional Wilderness Area, Sunol, CA, US",37.52455333,-121.817795,10,,,Alameda,Dipterostemon capitatus,Dipterostemon capitatus,Blue Dicks,Plantae,1196784,Asparagaceae,Dipterostemon,Dipterostemon capitatus
10354293,3/17/18,2018-03-17 22:52:05 UTC,Pacific Time (US & Canada),research,https://www.inaturalist.org/observations/10354293,https://inaturalist-open-data.s3.amazonaws.com/photos/14362492/medium.jpg,,1,0,FALSE,"Sunol Regional Wilderness, Alameda County, US-CA, US",37.51383667,-121.82727,10,,,Alameda,Pacific Sanicle,Sanicula crassicaulis,Pacific Sanicle,Plantae,53201,Apiaceae,Sanicula,Sanicula crassicaulis
10354299,3/17/18,2018-03-17 22:56:32 UTC,Pacific Time (US & Canada),research,https://www.inaturalist.org/observations/10354299,https://inaturalist-open-data.s3.amazonaws.com/photos/14362505/medium.jpg,,1,0,FALSE,"Sunol Regional Wilderness, Alameda County, US-CA, US",37.51377372,-121.8270954,10,,,Alameda,California buttercup,Ranunculus californicus,California buttercup,Plantae,52173,Ranunculaceae,Ranunculus,Ranunculus californicus
10354323,3/17/18,2018-03-17 22:57:39 UTC,Pacific Time (US & Canada),research,https://www.inaturalist.org/observations/10354323,https://inaturalist-open-data.s3.amazonaws.com/photos/14362543/medium.jpg,,1,0,FALSE,"Sunol Regional Wilderness, Alameda County, US-CA, US",37.51374019,-121.8271852,5,,,Alameda,bluewitch nightshade,Solanum umbelliferum,bluewitch nightshade,Plantae,50639,Solanaceae,Solanum,Solanum umbelliferum
10354326,3/17/18,2018-03-17 22:58:47 UTC,Pacific Time (US & Canada),research,https://www.inaturalist.org/observations/10354326,https://inaturalist-open-data.s3.amazonaws.com/photos/14362554/medium.jpg,,1,0,FALSE,"Sunol Regional Wilderness, Alameda County, US-CA, US",37.51353085,-121.8270264,10,,,Alameda,Dipterostemon capitatus,Dipterostemon capitatus,Blue Dicks,Plantae,1196784,Asparagaceae,Dipterostemon,Dipterostemon capitatus
10354334,3/17/18,2018-03-17 23:02:25 UTC,Pacific Time (US & Canada),research,https://www.inaturalist.org/observations/10354334,https://inaturalist-open-data.s3.amazonaws.com/photos/14362601/medium.jpg,,1,0,FALSE,"Sunol Regional Wilderness, Alameda County, US-CA, US",37.51328132,-121.8259604,5,,,Alameda,Osoberry,Oemleria cerasiformis,Osoberry,Plantae,53419,Rosaceae,Oemleria,Oemleria cerasiformis
10354406,3/17/18,2018-03-17 23:03:36 UTC,Pacific Time (US & Canada),research,https://www.inaturalist.org/observations/10354406,https://inaturalist-open-data.s3.amazonaws.com/photos/14362617/medium.jpg,,1,0,FALSE,"Sunol Regional Wilderness, Alameda County, US-CA, US",37.51319214,-121.8261077,5,,,Alameda,small baby blue eyes,Nemophila heterophylla,White nemophila,Plantae,53158,Boraginaceae,Nemophila,Nemophila heterophylla
10354426,3/17/18,2018-03-17 23:13:53 UTC,Pacific Time (US & Canada),research,https://www.inaturalist.org/observations/10354426,https://inaturalist-open-data.s3.amazonaws.com/photos/14362621/medium.jpg,,2,0,FALSE,"Sunol Regional Wilderness, Alameda County, US-CA, US",37.51334997,-121.8255384,10,,,Alameda,common stork's-bill,Erodium cicutarium,Redstem Stork's-bill,Plantae,47687,Geraniaceae,Erodium,Erodium cicutarium
10354441,3/17/18,2018-03-17 23:20:03 UTC,Pacific Time (US & Canada),research,https://www.inaturalist.org/observations/10354441,https://inaturalist-open-data.s3.amazonaws.com/photos/14362663/medium.jpg,,2,0,FALSE,"Sunol Regional Wilderness, Alameda County, US-CA, US",37.51200757,-121.8243596,5,,,Alameda,Redmaids,Calandrinia menziesii,redmaids,Plantae,400267,Montiaceae,Calandrinia,Calandrinia menziesii
10354479,3/17/18,2018-03-17 23:21:48 UTC,Pacific Time (US & Canada),research,https://www.inaturalist.org/observations/10354479,https://inaturalist-open-data.s3.amazonaws.com/photos/14362690/medium.jpg,,2,0,FALSE,"Sunol Regional Wilderness, Alameda County, US-CA, US",37.51190602,-121.8242937,5,,,Alameda,Johnnytuck,Triphysaria eriantha,Johnnytuck,Plantae,50792,Orobanchaceae,Triphysaria,Triphysaria eriantha
10685473,3/24/18,2018-03-24 19:17:53 UTC,Pacific Time (US & Canada),research,https://www.inaturalist.org/observations/10685473,https://inaturalist-open-data.s3.amazonaws.com/photos/15060717/medium.jpg,,2,0,FALSE,"Sunol Regional Wilderness, Alameda County, US-CA, US",37.51533732,-121.8304495,30,,,Alameda,Mediterranean Stork's-bill,Erodium botrys,Mediterranean Stork's-bill,Plantae,57090,Geraniaceae,Erodium,Erodium botrys
10769502,3/24/18,2018-03-24 19:22:03 UTC,Pacific Time (US & Canada),research,https://www.inaturalist.org/observations/10769502,https://inaturalist-open-data.s3.amazonaws.com/photos/15060849/medium.jpg,,2,0,FALSE,"Sunol Regional Wilderness, Alameda County, US-CA, US",37.51420685,-121.8294362,5,,,Alameda,California Golden Violet,Viola pedunculata,California Golden Violet,Plantae,50825,Violaceae,Viola,Viola pedunculata
10769541,3/24/18,2018-03-24 19:26:41 UTC,Pacific Time (US & Canada),research,https://www.inaturalist.org/observations/10769541,https://inaturalist-open-data.s3.amazonaws.com/photos/15060933/medium.jpg,,2,0,FALSE,"Sunol Regional Wilderness, Alameda County, US-CA, US",37.51156576,-121.8283245,10,,,Alameda,Lamium amplexicaule,Lamium amplexicaule,henbit deadnettle,Plantae,55459,Lamiaceae,Lamium,Lamium amplexicaule
10432168,3/25/18,2018-03-25 19:16:58 UTC,Pacific Time (US & Canada),research,https://www.inaturalist.org/observations/10432168,https://static.inaturalist.org/photos/14494837/medium.jpg,,1,0,FALSE,"Sunol Regional Wilderness Area, Sunol, CA, US",37.50558833,-121.8168633,5,,,Alameda,hairy vetch,Vicia villosa,hairy vetch,Plantae,57317,Fabaceae,Vicia,Vicia villosa
10432191,3/25/18,2018-03-25 18:51:07 UTC,Pacific Time (US & Canada),research,https://www.inaturalist.org/observations/10432191,https://static.inaturalist.org/photos/14494896/medium.jpg,,1,0,FALSE,"Sunol Regional Wilderness Area, Sunol, CA, US",37.50557167,-121.81668,5,,,Alameda,Canyon Live-forever,Dudleya cymosa,Canyon liveforever,Plantae,58136,Crassulaceae,Dudleya,Dudleya cymosa
10432263,3/25/18,2018-03-25 18:47:04 UTC,Pacific Time (US & Canada),research,https://www.inaturalist.org/observations/10432263,https://static.inaturalist.org/photos/14495001/medium.jpg,,1,0,FALSE,"Sunol Regional Wilderness Area, Sunol, CA, US",37.50531333,-121.81768,10,,,Alameda,bluewitch nightshade,Solanum umbelliferum,bluewitch nightshade,Plantae,50639,Solanaceae,Solanum,Solanum umbelliferum
10432277,3/25/18,2018-03-25 19:20:50 UTC,Pacific Time (US & Canada),research,https://www.inaturalist.org/observations/10432277,https://static.inaturalist.org/photos/14495046/medium.jpg,,1,0,FALSE,"Sunol Regional Wilderness Area, Sunol, CA, US",37.50536667,-121.8189783,10,,,Alameda,orange bush monkeyflower,Diplacus aurantiacus,orange bush monkeyflower,Plantae,777371,Phrymaceae,Diplacus,Diplacus aurantiacus
10599438,3/29/18,2018-03-29 21:32:31 UTC,Pacific Time (US & Canada),research,https://www.inaturalist.org/observations/10599438,https://static.inaturalist.org/photos/14778432/medium.jpg,,2,0,FALSE,"Sunol Regional Wilderness Area, Sunol, CA, US",37.51238333,-121.8266833,5,,,Alameda,miner's lettuce,Claytonia perfoliata,miner's lettuce,Plantae,52994,Montiaceae,Claytonia,Claytonia perfoliata
10599588,3/29/18,2018-03-30 00:19:29 UTC,Pacific Time (US & Canada),research,https://www.inaturalist.org/observations/10599588,https://static.inaturalist.org/photos/14778703/medium.jpg,,1,0,FALSE,"Sunol Regional Wilderness Area, Sunol, CA, US",37.511445,-121.8272867,5,,,Alameda,wavy-leafed soap plant,Chlorogalum pomeridianum,wavy-leafed soap plant,Plantae,47597,Asparagaceae,Chlorogalum,Chlorogalum pomeridianum
10599776,3/30/18,2018-03-30 22:45:44 UTC,Pacific Time (US & Canada),research,https://www.inaturalist.org/observations/10599776,https://static.inaturalist.org/photos/14778962/medium.jpg,,1,0,FALSE,"Sunol Regional Wilderness Area, Sunol, CA, US",37.51189667,-121.8268583,5,,,Alameda,Dipterostemon capitatus,Dipterostemon capitatus,Blue Dicks,Plantae,1196784,Asparagaceae,Dipterostemon,Dipterostemon capitatus
10599902,3/30/18,2018-03-31 01:02:37 UTC,Pacific Time (US & Canada),research,https://www.inaturalist.org/observations/10599902,https://static.inaturalist.org/photos/14779219/medium.jpg,,1,0,FALSE,"Sunol Regional Wilderness Area, Sunol, CA, US",37.51183,-121.8269583,5,,,Alameda,coast live oak,Quercus agrifolia,coast live oak,Plantae,47850,Fagaceae,Quercus,Quercus agrifolia
10599981,3/30/18,2018-03-31 01:49:32 UTC,Pacific Time (US & Canada),research,https://www.inaturalist.org/observations/10599981,https://static.inaturalist.org/photos/14779371/medium.jpg,,1,0,FALSE,"Sunol Regional Wilderness Area, Sunol, CA, US",37.511775,-121.8266833,5,,,Alameda,western sycamore,Platanus racemosa,western sycamore,Plantae,58231,Platanaceae,Platanus,Platanus racemosa
10769735,3/30/18,2018-03-30 22:05:29 UTC,Pacific Time (US & Canada),research,https://www.inaturalist.org/observations/10769735,https://inaturalist-open-data.s3.amazonaws.com/photos/15061251/medium.jpg,,1,0,FALSE,"Sunol Regional Wilderness, Alameda County, US-CA, US",37.51576941,-121.8313923,65,,,Alameda,Purple Sanicle,Sanicula bipinnatifida,Purple Sanicle,Plantae,56840,Apiaceae,Sanicula,Sanicula bipinnatifida
10769801,3/30/18,2018-03-30 22:11:03 UTC,Pacific Time (US & Canada),research,https://www.inaturalist.org/observations/10769801,https://inaturalist-open-data.s3.amazonaws.com/photos/15061288/medium.jpg,,2,0,FALSE,"Sunol Regional Wilderness, Alameda County, US-CA, US",37.51258814,-121.8278084,5,,,Alameda,California Golden Violet,Viola pedunculata,California Golden Violet,Plantae,50825,Violaceae,Viola,Viola pedunculata
10769846,3/30/18,2018-03-30 22:11:27 UTC,Pacific Time (US & Canada),research,https://www.inaturalist.org/observations/10769846,https://inaturalist-open-data.s3.amazonaws.com/photos/15061300/medium.jpg,,2,0,FALSE,"Sunol Regional Wilderness, Alameda County, US-CA, US",37.51258256,-121.8278192,5,,,Alameda,true babystars,Leptosiphon bicolor,true babystars,Plantae,64245,Polemoniaceae,Leptosiphon,Leptosiphon bicolor
10769919,3/30/18,2018-03-30 22:31:44 UTC,Pacific Time (US & Canada),research,https://www.inaturalist.org/observations/10769919,https://inaturalist-open-data.s3.amazonaws.com/photos/15061388/medium.jpg,,1,0,FALSE,"Sunol Regional Wilderness, Alameda County, US-CA, US",37.51117822,-121.8280667,5,,,Alameda,bird's-eye speedwell,Veronica persica,bird's-eye speedwell,Plantae,55666,Plantaginaceae,Veronica,Veronica persica
10769940,3/30/18,2018-03-30 22:39:40 UTC,Pacific Time (US & Canada),research,https://www.inaturalist.org/observations/10769940,https://inaturalist-open-data.s3.amazonaws.com/photos/15061409/medium.jpg,,3,1,FALSE,"Sunol Regional Wilderness, Alameda County, US-CA, US",37.51125257,-121.8282526,5,,,Alameda,western blue-eyed grass,Sisyrinchium bellum,western blue-eyed grass,Plantae,49918,Iridaceae,Sisyrinchium,Sisyrinchium bellum
10769946,3/30/18,2018-03-30 22:44:15 UTC,Pacific Time (US & Canada),research,https://www.inaturalist.org/observations/10769946,https://inaturalist-open-data.s3.amazonaws.com/photos/15061420/medium.jpg,,3,0,FALSE,"Sunol Regional Wilderness, Alameda County, US-CA, US",37.5128067,-121.8292956,5,,,Alameda,Redmaids,Calandrinia menziesii,redmaids,Plantae,400267,Montiaceae,Calandrinia,Calandrinia menziesii
10681112,4/1/18,2018-04-01 23:06:44 UTC,Pacific Time (US & Canada),research,https://www.inaturalist.org/observations/10681112,https://static.inaturalist.org/photos/14913098/medium.jpg,"Meadowfoam (Limnanthaceae) 
Limnanthes douglasii ",2,0,FALSE,"Sunol Regional Wilderness Area, Sunol, CA, US",37.51614056,-121.8342247,22,,,Alameda,Douglas' meadowfoam,Limnanthes douglasii,Douglas' meadowfoam,Plantae,51336,Limnanthaceae,Limnanthes,Limnanthes douglasii
10610218,4/3/18,2018-04-04 01:06:18 UTC,Pacific Time (US & Canada),research,https://www.inaturalist.org/observations/10610218,https://inaturalist-open-data.s3.amazonaws.com/photos/14797073/medium.jpeg,,1,0,FALSE,"Sunol Regional Wilderness, Alameda County, US-CA, US",37.50887688,-121.8247517,12,,,Alameda,valley oak,Quercus lobata,valley oak,Plantae,49011,Fagaceae,Quercus,Quercus lobata
10610219,4/3/18,2018-04-04 01:10:58 UTC,Pacific Time (US & Canada),research,https://www.inaturalist.org/observations/10610219,https://inaturalist-open-data.s3.amazonaws.com/photos/14797074/medium.jpeg,,2,0,FALSE,"Sunol Regional Wilderness, Alameda County, US-CA, US",37.5100189,-121.8227351,7,,,Alameda,Dipterostemon capitatus,Dipterostemon capitatus,Blue Dicks,Plantae,1196784,Asparagaceae,Dipterostemon,Dipterostemon capitatus
10610221,4/3/18,2018-04-04 01:21:17 UTC,Pacific Time (US & Canada),research,https://www.inaturalist.org/observations/10610221,https://inaturalist-open-data.s3.amazonaws.com/photos/14797083/medium.jpeg,,1,0,FALSE,"Sunol Regional Wilderness, Alameda County, US-CA, US",37.51002922,-121.8189308,7,,,Alameda,valley oak,Quercus lobata,valley oak,Plantae,49011,Fagaceae,Quercus,Quercus lobata
10610229,4/3/18,2018-04-04 01:22:35 UTC,Pacific Time (US & Canada),research,https://www.inaturalist.org/observations/10610229,https://inaturalist-open-data.s3.amazonaws.com/photos/14797091/medium.jpeg,,2,0,FALSE,"Sunol Regional Wilderness, Alameda County, US-CA, US",37.51020108,-121.8189578,6,,,Alameda,Dwarf Nettle,Urtica urens,Dwarf Nettle,Plantae,53315,Urticaceae,Urtica,Urtica urens
10610231,4/3/18,2018-04-04 01:32:39 UTC,Pacific Time (US & Canada),research,https://www.inaturalist.org/observations/10610231,https://inaturalist-open-data.s3.amazonaws.com/photos/14797092/medium.jpeg,,1,0,FALSE,"Sunol Regional Wilderness, Alameda County, US-CA, US",37.51333547,-121.8155474,13,,,Alameda,California sagebrush,Artemisia californica,California sagebrush,Plantae,53357,Asteraceae,Artemisia,Artemisia californica
10610232,4/3/18,2018-04-04 01:32:50 UTC,Pacific Time (US & Canada),research,https://www.inaturalist.org/observations/10610232,https://inaturalist-open-data.s3.amazonaws.com/photos/14797094/medium.jpeg,,2,0,FALSE,"Sunol Regional Wilderness, Alameda County, US-CA, US",37.51327198,-121.8155134,13,,,Alameda,orange bush monkeyflower,Diplacus aurantiacus,orange bush monkeyflower,Plantae,777371,Phrymaceae,Diplacus,Diplacus aurantiacus
10610234,4/3/18,2018-04-04 01:33:20 UTC,Pacific Time (US & Canada),research,https://www.inaturalist.org/observations/10610234,https://inaturalist-open-data.s3.amazonaws.com/photos/14797097/medium.jpeg,,2,0,FALSE,"Sunol Regional Wilderness, Alameda County, US-CA, US",37.51316423,-121.8153029,13,,,Alameda,white horehound,Marrubium vulgare,White Horehound,Plantae,54605,Lamiaceae,Marrubium,Marrubium vulgare
10610239,4/3/18,2018-04-04 01:36:28 UTC,Pacific Time (US & Canada),research,https://www.inaturalist.org/observations/10610239,https://inaturalist-open-data.s3.amazonaws.com/photos/14797105/medium.jpeg,,1,0,FALSE,"Sunol Regional Wilderness, Alameda County, US-CA, US",37.51275029,-121.8143677,12,,,Alameda,coast live oak,Quercus agrifolia,coast live oak,Plantae,47850,Fagaceae,Quercus,Quercus agrifolia
10610240,4/3/18,2018-04-04 01:45:33 UTC,Pacific Time (US & Canada),research,https://www.inaturalist.org/observations/10610240,https://inaturalist-open-data.s3.amazonaws.com/photos/14797106/medium.jpeg,,2,0,FALSE,"Sunol Regional Wilderness, Alameda County, US-CA, US",37.51257367,-121.8125279,9,,,Alameda,western sycamore,Platanus racemosa,western sycamore,Plantae,58231,Platanaceae,Platanus,Platanus racemosa
10610243,4/3/18,2018-04-04 01:47:14 UTC,Pacific Time (US & Canada),research,https://www.inaturalist.org/observations/10610243,https://inaturalist-open-data.s3.amazonaws.com/photos/14797110/medium.jpeg,,1,0,FALSE,"Sunol Regional Wilderness, Alameda County, US-CA, US",37.51250811,-121.812297,7,,,Alameda,miner's lettuce,Claytonia perfoliata,miner's lettuce,Plantae,52994,Montiaceae,Claytonia,Claytonia perfoliata
10610244,4/3/18,2018-04-04 01:47:32 UTC,Pacific Time (US & Canada),research,https://www.inaturalist.org/observations/10610244,https://inaturalist-open-data.s3.amazonaws.com/photos/14797112/medium.jpeg,,2,0,FALSE,"Sunol Regional Wilderness, Alameda County, US-CA, US",37.51240378,-121.8122851,9,,,Alameda,hollyleaf redberry,Rhamnus ilicifolia,hollyleaf redberry,Plantae,58308,Rhamnaceae,Rhamnus,Rhamnus ilicifolia
10610248,4/3/18,2018-04-04 01:48:45 UTC,Pacific Time (US & Canada),research,https://www.inaturalist.org/observations/10610248,https://inaturalist-open-data.s3.amazonaws.com/photos/14797116/medium.jpeg,,1,0,FALSE,"Sunol Regional Wilderness, Alameda County, US-CA, US",37.51230425,-121.8119857,7,,,Alameda,California poppy,Eschscholzia californica,California poppy,Plantae,48225,Papaveraceae,Eschscholzia,Eschscholzia californica
10610250,4/3/18,2018-04-04 01:56:07 UTC,Pacific Time (US & Canada),research,https://www.inaturalist.org/observations/10610250,https://inaturalist-open-data.s3.amazonaws.com/photos/14797120/medium.jpeg,,1,0,FALSE,"Sunol Regional Wilderness, Alameda County, US-CA, US",37.51141072,-121.8108669,15,,,Alameda,coast live oak,Quercus agrifolia,coast live oak,Plantae,47850,Fagaceae,Quercus,Quercus agrifolia
10610252,4/3/18,2018-04-04 01:58:34 UTC,Pacific Time (US & Canada),research,https://www.inaturalist.org/observations/10610252,https://inaturalist-open-data.s3.amazonaws.com/photos/14797125/medium.jpeg,,1,0,FALSE,"Sunol Regional Wilderness, Alameda County, US-CA, US",37.5115405,-121.8109678,9,,,Alameda,Dipterostemon capitatus,Dipterostemon capitatus,Blue Dicks,Plantae,1196784,Asparagaceae,Dipterostemon,Dipterostemon capitatus
10610253,4/3/18,2018-04-04 02:10:53 UTC,Pacific Time (US & Canada),research,https://www.inaturalist.org/observations/10610253,https://inaturalist-open-data.s3.amazonaws.com/photos/14797129/medium.jpeg,,1,0,FALSE,"Sunol Regional Wilderness, Alameda County, US-CA, US",37.5134166,-121.8099812,4,,,Alameda,oak mistletoe,Phoradendron leucarpum,American Mistletoe,Plantae,49668,Santalaceae,Phoradendron,Phoradendron leucarpum
10610254,4/3/18,2018-04-04 02:33:47 UTC,Pacific Time (US & Canada),research,https://www.inaturalist.org/observations/10610254,https://inaturalist-open-data.s3.amazonaws.com/photos/14797132/medium.jpeg,,1,0,FALSE,"Sunol Regional Wilderness, Alameda County, US-CA, US",37.50708895,-121.8134208,10,,,Alameda,wavy-leafed soap plant,Chlorogalum pomeridianum,wavy-leafed soap plant,Plantae,47597,Asparagaceae,Chlorogalum,Chlorogalum pomeridianum
10610256,4/3/18,2018-04-04 02:51:32 UTC,Pacific Time (US & Canada),research,https://www.inaturalist.org/observations/10610256,https://inaturalist-open-data.s3.amazonaws.com/photos/14797135/medium.jpeg,,2,0,FALSE,"Sunol Regional Wilderness, Alameda County, US-CA, US",37.50649407,-121.8100439,21,,,Alameda,western sycamore,Platanus racemosa,western sycamore,Plantae,58231,Platanaceae,Platanus,Platanus racemosa
10769952,4/4/18,2018-04-04 17:48:45 UTC,Pacific Time (US & Canada),research,https://www.inaturalist.org/observations/10769952,https://inaturalist-open-data.s3.amazonaws.com/photos/15061454/medium.jpg,,2,0,FALSE,"Sunol Regional Wilderness, Alameda County, US-CA, US",37.51599396,-121.8302206,10,,,Alameda,California buttercup,Ranunculus californicus,California buttercup,Plantae,52173,Ranunculaceae,Ranunculus,Ranunculus californicus
10769956,4/4/18,2018-04-04 17:49:04 UTC,Pacific Time (US & Canada),research,https://www.inaturalist.org/observations/10769956,https://inaturalist-open-data.s3.amazonaws.com/photos/15061461/medium.jpg,,2,0,FALSE,"Sunol Regional Wilderness, Alameda County, US-CA, US",37.51556631,-121.8295767,5,,,Alameda,Cut-leaved crane's-bill,Geranium dissectum,Cut-leaved crane's-bill,Plantae,53075,Geraniaceae,Geranium,Geranium dissectum
10769976,4/4/18,2018-04-04 17:51:22 UTC,Pacific Time (US & Canada),research,https://www.inaturalist.org/observations/10769976,https://inaturalist-open-data.s3.amazonaws.com/photos/15061522/medium.jpg,,2,0,FALSE,"Sunol Regional Wilderness, Alameda County, US-CA, US",37.51552629,-121.8295209,5,,,Alameda,Field madder,Sherardia arvensis,Field madder,Plantae,47691,Rubiaceae,Sherardia,Sherardia arvensis
10769979,4/4/18,2018-04-04 17:54:46 UTC,Pacific Time (US & Canada),research,https://www.inaturalist.org/observations/10769979,https://inaturalist-open-data.s3.amazonaws.com/photos/15061539/medium.jpg,,1,0,FALSE,"Sunol Regional Wilderness, Alameda County, US-CA, US",37.51424415,-121.8282105,5,,,Alameda,American yellowrocket,Barbarea orthoceras,American yellowrocket,Plantae,52976,Brassicaceae,Barbarea,Barbarea orthoceras
10769993,4/4/18,2018-04-04 17:55:58 UTC,Pacific Time (US & Canada),research,https://www.inaturalist.org/observations/10769993,https://inaturalist-open-data.s3.amazonaws.com/photos/15061553/medium.jpg,,2,0,FALSE,"Sunol Regional Wilderness, Alameda County, US-CA, US",37.51421649,-121.8281784,5,,,Alameda,miner's lettuce,Claytonia perfoliata,miner's lettuce,Plantae,52994,Montiaceae,Claytonia,Claytonia perfoliata
10770004,4/4/18,2018-04-04 17:56:28 UTC,Pacific Time (US & Canada),research,https://www.inaturalist.org/observations/10770004,https://inaturalist-open-data.s3.amazonaws.com/photos/15061585/medium.jpg,,2,0,FALSE,"Sunol Regional Wilderness, Alameda County, US-CA, US",37.51412039,-121.8278018,10,,,Alameda,Mediterranean Stork's-bill,Erodium botrys,Mediterranean Stork's-bill,Plantae,57090,Geraniaceae,Erodium,Erodium botrys
10770008,4/4/18,2018-04-04 17:59:35 UTC,Pacific Time (US & Canada),research,https://www.inaturalist.org/observations/10770008,https://inaturalist-open-data.s3.amazonaws.com/photos/15061596/medium.jpg,,2,0,FALSE,"Sunol Regional Wilderness, Alameda County, US-CA, US",37.51390899,-121.8274034,338,,,Alameda,Dipterostemon capitatus,Dipterostemon capitatus,Blue Dicks,Plantae,1196784,Asparagaceae,Dipterostemon,Dipterostemon capitatus
10770012,4/4/18,2018-04-04 18:00:14 UTC,Pacific Time (US & Canada),research,https://www.inaturalist.org/observations/10770012,https://inaturalist-open-data.s3.amazonaws.com/photos/15061608/medium.jpg,,2,0,FALSE,"Sunol Regional Wilderness, Alameda County, US-CA, US",37.51385427,-121.8272812,5,,,Alameda,Little-Robin,Geranium purpureum,Little-Robin,Plantae,57643,Geraniaceae,Geranium,Geranium purpureum
10770015,4/4/18,2018-04-04 18:02:41 UTC,Pacific Time (US & Canada),research,https://www.inaturalist.org/observations/10770015,https://inaturalist-open-data.s3.amazonaws.com/photos/15061648/medium.jpg,,2,0,FALSE,"Sunol Regional Wilderness, Alameda County, US-CA, US",37.51382967,-121.8272502,5,,,Alameda,Pacific Sanicle,Sanicula crassicaulis,Pacific Sanicle,Plantae,53201,Apiaceae,Sanicula,Sanicula crassicaulis
10770049,4/4/18,2018-04-04 18:09:44 UTC,Pacific Time (US & Canada),research,https://www.inaturalist.org/observations/10770049,https://inaturalist-open-data.s3.amazonaws.com/photos/15061700/medium.jpg,,1,0,FALSE,"Sunol Regional Wilderness, Alameda County, US-CA, US",37.5135977,-121.8251343,10,,,Alameda,Fiesta Flower,Pholistoma auritum,Fiesta Flower,Plantae,55437,Boraginaceae,Pholistoma,Pholistoma auritum
10770060,4/4/18,2018-04-04 18:12:02 UTC,Pacific Time (US & Canada),research,https://www.inaturalist.org/observations/10770060,https://inaturalist-open-data.s3.amazonaws.com/photos/15061728/medium.jpg,,1,0,FALSE,"Sunol Regional Wilderness, Alameda County, US-CA, US",37.51385728,-121.8248616,5,,,Alameda,bird's-eye speedwell,Veronica persica,bird's-eye speedwell,Plantae,55666,Plantaginaceae,Veronica,Veronica persica
10770063,4/4/18,2018-04-04 18:14:21 UTC,Pacific Time (US & Canada),research,https://www.inaturalist.org/observations/10770063,https://inaturalist-open-data.s3.amazonaws.com/photos/15061751/medium.jpg,,2,0,FALSE,"Sunol Regional Wilderness, Alameda County, US-CA, US",37.51477858,-121.8244497,5,,,Alameda,hillside woodland star,Lithophragma heterophyllum,hillside woodland star,Plantae,53124,Saxifragaceae,Lithophragma,Lithophragma heterophyllum
10770070,4/4/18,2018-04-04 18:45:29 UTC,Pacific Time (US & Canada),research,https://www.inaturalist.org/observations/10770070,https://inaturalist-open-data.s3.amazonaws.com/photos/15061764/medium.jpg,,1,0,FALSE,"Sunol Regional Wilderness, Alameda County, US-CA, US",37.52248817,-121.8224365,5,,,Alameda,Shining Pepperweed,Lepidium nitidum,Shining Pepperweed,Plantae,47202,Brassicaceae,Lepidium,Lepidium nitidum
10770079,4/4/18,2018-04-04 18:53:43 UTC,Pacific Time (US & Canada),research,https://www.inaturalist.org/observations/10770079,https://inaturalist-open-data.s3.amazonaws.com/photos/15061800/medium.jpg,,1,0,FALSE,"Sunol Regional Wilderness, Alameda County, US-CA, US",37.52104426,-121.8268128,5,,,Alameda,Smooth Cat's Ear,Hypochaeris glabra,Smooth Cat's Ear,Plantae,53103,Asteraceae,Hypochaeris,Hypochaeris glabra
10656186,4/5/18,2018-04-05 23:05:20 UTC,Pacific Time (US & Canada),research,https://www.inaturalist.org/observations/10656186,https://inaturalist-open-data.s3.amazonaws.com/photos/14871378/medium.jpg,,2,0,FALSE,"Sunol Regional Wilderness Area, Sunol, CA, US",37.511945,-121.824255,5,,,Alameda,western blue-eyed grass,Sisyrinchium bellum,western blue-eyed grass,Plantae,49918,Iridaceae,Sisyrinchium,Sisyrinchium bellum
10656213,4/5/18,2018-04-05 22:48:06 UTC,Pacific Time (US & Canada),research,https://www.inaturalist.org/observations/10656213,https://inaturalist-open-data.s3.amazonaws.com/photos/14871437/medium.jpg,,3,0,FALSE,"Sunol Regional Wilderness Area, Sunol, CA, US",37.51305833,-121.82518,5,,,Alameda,butter-and-eggs,Triphysaria eriantha eriantha,butter-and-eggs,Plantae,59332,Orobanchaceae,Triphysaria,Triphysaria eriantha
10656239,4/5/18,2018-04-05 22:50:33 UTC,Pacific Time (US & Canada),research,https://www.inaturalist.org/observations/10656239,https://inaturalist-open-data.s3.amazonaws.com/photos/14871481/medium.jpg,,2,0,FALSE,"Sunol Regional Wilderness Area, Sunol, CA, US",37.512825,-121.8248883,5,,,Alameda,Gray Mule-Ears,Wyethia helenioides,Gray Mule-Ears,Plantae,50799,Asteraceae,Wyethia,Wyethia helenioides
10656245,4/5/18,2018-04-05 22:44:14 UTC,Pacific Time (US & Canada),research,https://www.inaturalist.org/observations/10656245,https://inaturalist-open-data.s3.amazonaws.com/photos/14871498/medium.jpg,,1,0,FALSE,"Sunol Regional Wilderness Area, Sunol, CA, US",37.51324667,-121.8255,5,,,Alameda,Dipterostemon capitatus,Dipterostemon capitatus,Blue Dicks,Plantae,1196784,Asparagaceae,Dipterostemon,Dipterostemon capitatus
10656278,4/5/18,2018-04-05 22:17:30 UTC,Pacific Time (US & Canada),research,https://www.inaturalist.org/observations/10656278,https://inaturalist-open-data.s3.amazonaws.com/photos/14871574/medium.jpg,,1,0,FALSE,"Sunol Regional Wilderness Area, Sunol, CA, US",37.51318333,-121.8269583,5,,,Alameda,purple nightshade,Solanum xanti,purple nightshade,Plantae,79146,Solanaceae,Solanum,Solanum xanti
10705089,4/5/18,2018-04-05 22:55:39 UTC,Pacific Time (US & Canada),research,https://www.inaturalist.org/observations/10705089,https://inaturalist-open-data.s3.amazonaws.com/photos/14951982/medium.jpg,,3,0,FALSE,"Sunol Regional Wilderness Area, Sunol, CA, US",37.511545,-121.8244167,5,,,Alameda,Redmaids,Calandrinia menziesii,redmaids,Plantae,400267,Montiaceae,Calandrinia,Calandrinia menziesii
10705112,4/5/18,2018-04-05 22:38:19 UTC,Pacific Time (US & Canada),research,https://www.inaturalist.org/observations/10705112,https://inaturalist-open-data.s3.amazonaws.com/photos/14952045/medium.jpg,,1,0,FALSE,"Sunol Regional Wilderness Area, Sunol, CA, US",37.51330333,-121.8262033,5,,,Alameda,California buttercup,Ranunculus californicus,California buttercup,Plantae,52173,Ranunculaceae,Ranunculus,Ranunculus californicus
10705167,4/5/18,2018-04-05 22:43:31 UTC,Pacific Time (US & Canada),research,https://www.inaturalist.org/observations/10705167,https://inaturalist-open-data.s3.amazonaws.com/photos/14952175/medium.jpg,,1,0,FALSE,"Sunol Regional Wilderness Area, Sunol, CA, US",37.51326167,-121.8254917,5,,,Alameda,Miniature Lupine,Lupinus bicolor,Miniature Lupine,Plantae,50614,Fabaceae,Lupinus,Lupinus bicolor
10681058,4/6/18,2018-04-06 19:22:50 UTC,Pacific Time (US & Canada),research,https://www.inaturalist.org/observations/10681058,https://static.inaturalist.org/photos/14913009/medium.jpg,,1,0,FALSE,"Sunol Regional Wilderness Area, Sunol, CA, US",37.5159687,-121.8299561,86,,,Alameda,California Golden Violet,Viola pedunculata,California Golden Violet,Plantae,50825,Violaceae,Viola,Viola pedunculata
10685435,4/7/18,2018-04-07 18:50:15 UTC,Pacific Time (US & Canada),research,https://www.inaturalist.org/observations/10685435,https://static.inaturalist.org/photos/14920226/medium.jpg,,3,0,FALSE,"Sunol Regional Wilderness Area, Sunol, CA, US",37.51558875,-121.83173,496,,,Alameda,bird's-eye gilia,Gilia tricolor,bird's-eye gilia,Plantae,50832,Polemoniaceae,Gilia,Gilia tricolor
10685677,4/7/18,2018-04-07 20:15:55 UTC,Pacific Time (US & Canada),research,https://www.inaturalist.org/observations/10685677,https://static.inaturalist.org/photos/14920729/medium.jpg,,1,0,FALSE,"Sunol Regional Wilderness Area, Sunol, CA, US",37.51606907,-121.8318911,8,,,Alameda,California poppy,Eschscholzia californica,California poppy,Plantae,48225,Papaveraceae,Eschscholzia,Eschscholzia californica
10692639,4/7/18,2018-04-07 22:26:56 UTC,Pacific Time (US & Canada),research,https://www.inaturalist.org/observations/10692639,https://static.inaturalist.org/photos/14932240/medium.jpg,,1,0,FALSE,"Sunol Regional Wilderness Area, Sunol, CA, US",37.51282167,-121.8307417,5,,,Alameda,creamcups,Platystemon californicus,creamcups,Plantae,51288,Papaveraceae,Platystemon,Platystemon californicus
10692657,4/7/18,2018-04-07 19:55:00 UTC,Pacific Time (US & Canada),research,https://www.inaturalist.org/observations/10692657,https://static.inaturalist.org/photos/14932292/medium.jpg,,1,0,FALSE,"Sunol Regional Wilderness Area, Sunol, CA, US",37.51605333,-121.8317417,5,,,Alameda,henbit deadnettle,Lamium amplexicaule,henbit deadnettle,Plantae,55459,Lamiaceae,Lamium,Lamium amplexicaule
10693033,4/7/18,2018-04-07 21:20:13 UTC,Pacific Time (US & Canada),research,https://www.inaturalist.org/observations/10693033,https://static.inaturalist.org/photos/14933046/medium.jpg,,1,0,FALSE,"Sunol Regional Wilderness Area, Sunol, CA, US",37.51529667,-121.8306583,5,,,Alameda,bird's-eye speedwell,Veronica persica,bird's-eye speedwell,Plantae,55666,Plantaginaceae,Veronica,Veronica persica
10694462,4/7/18,2018-04-07 21:44:54 UTC,Pacific Time (US & Canada),research,https://www.inaturalist.org/observations/10694462,https://static.inaturalist.org/photos/14935354/medium.jpg,,2,0,FALSE,"Sunol Regional Wilderness Area, Sunol, CA, US",37.513625,-121.830545,5,,,Alameda,Redmaids,Calandrinia menziesii,redmaids,Plantae,400267,Montiaceae,Calandrinia,Calandrinia menziesii
10694524,4/7/18,2018-04-07 20:57:30 UTC,Pacific Time (US & Canada),research,https://www.inaturalist.org/observations/10694524,https://static.inaturalist.org/photos/14935496/medium.jpg,,1,0,FALSE,"Sunol Regional Wilderness Area, Sunol, CA, US",37.515775,-121.8315283,5,,,Alameda,bur clover,Medicago polymorpha,bur clover,Plantae,53151,Fabaceae,Medicago,Medicago polymorpha
10694549,4/7/18,2018-04-07 21:20:48 UTC,Pacific Time (US & Canada),research,https://www.inaturalist.org/observations/10694549,https://static.inaturalist.org/photos/14935518/medium.jpg,,1,0,FALSE,"Sunol Regional Wilderness Area, Sunol, CA, US",37.51531167,-121.8306117,5,,,Alameda,common groundsel,Senecio vulgaris,common groundsel,Plantae,53211,Asteraceae,Senecio,Senecio vulgaris
10694569,4/7/18,2018-04-07 20:32:52 UTC,Pacific Time (US & Canada),research,https://www.inaturalist.org/observations/10694569,https://static.inaturalist.org/photos/14935565/medium.jpg,,2,0,FALSE,"Sunol Regional Wilderness Area, Sunol, CA, US",37.51569667,-121.831505,5,,,Alameda,pineapple-weed,Matricaria discoidea,pineapple-weed,Plantae,52992,Asteraceae,Matricaria,Matricaria discoidea
10697483,4/7/18,2018-04-07 21:50:07 UTC,Pacific Time (US & Canada),research,https://www.inaturalist.org/observations/10697483,https://static.inaturalist.org/photos/14940013/medium.jpg,,1,0,FALSE,"Sunol Regional Wilderness Area, Sunol, CA, US",37.516055,-121.8302167,5,,,Alameda,Cut-leaved crane's-bill,Geranium dissectum,Cut-leaved crane's-bill,Plantae,53075,Geraniaceae,Geranium,Geranium dissectum
10697486,4/7/18,2018-04-07 21:50:26 UTC,Pacific Time (US & Canada),research,https://www.inaturalist.org/observations/10697486,https://static.inaturalist.org/photos/14940030/medium.jpg,,1,0,FALSE,"Sunol Regional Wilderness Area, Sunol, CA, US",37.516055,-121.8302167,5,,,Alameda,Rose Clover,Trifolium hirtum,Rose Clover,Plantae,57078,Fabaceae,Trifolium,Trifolium hirtum
10697497,4/7/18,2018-04-07 21:51:14 UTC,Pacific Time (US & Canada),research,https://www.inaturalist.org/observations/10697497,https://static.inaturalist.org/photos/14940042/medium.jpg,,1,0,FALSE,"Sunol Regional Wilderness Area, Sunol, CA, US",37.51593333,-121.8300467,5,,,Alameda,,Sherardia arvensis,Field madder,Plantae,47691,Rubiaceae,Sherardia,Sherardia arvensis
10697511,4/7/18,2018-04-07 21:52:11 UTC,Pacific Time (US & Canada),research,https://www.inaturalist.org/observations/10697511,https://static.inaturalist.org/photos/14940061/medium.jpg,,1,0,FALSE,"Sunol Regional Wilderness Area, Sunol, CA, US",37.51598333,-121.8301167,5,,,Alameda,,Vicia sativa,Common Vetch,Plantae,53324,Fabaceae,Vicia,Vicia sativa
10697518,4/7/18,2018-04-07 21:54:30 UTC,Pacific Time (US & Canada),research,https://www.inaturalist.org/observations/10697518,https://static.inaturalist.org/photos/14940074/medium.jpg,,2,0,FALSE,"Sunol Regional Wilderness Area, Sunol, CA, US",37.51630333,-121.82943,5,,,Alameda,,Sisyrinchium bellum,western blue-eyed grass,Plantae,49918,Iridaceae,Sisyrinchium,Sisyrinchium bellum
10697519,4/7/18,2018-04-07 21:54:44 UTC,Pacific Time (US & Canada),research,https://www.inaturalist.org/observations/10697519,https://static.inaturalist.org/photos/14940093/medium.jpg,,2,0,FALSE,"Sunol Regional Wilderness Area, Sunol, CA, US",37.51627,-121.8293833,5,,,Alameda,Pimpernel,Lysimachia arvensis,scarlet pimpernel,Plantae,791928,Primulaceae,Lysimachia,Lysimachia arvensis
10697553,4/7/18,2018-04-07 22:01:21 UTC,Pacific Time (US & Canada),research,https://www.inaturalist.org/observations/10697553,https://static.inaturalist.org/photos/14940113/medium.jpg,,1,0,FALSE,"Sunol Regional Wilderness Area, Sunol, CA, US",37.51672833,-121.8295833,5,,,Alameda,,Lupinus bicolor,Miniature Lupine,Plantae,50614,Fabaceae,Lupinus,Lupinus bicolor
10697557,4/7/18,2018-04-07 22:06:29 UTC,Pacific Time (US & Canada),research,https://www.inaturalist.org/observations/10697557,https://static.inaturalist.org/photos/14940119/medium.jpg,,1,0,FALSE,"Sunol Regional Wilderness Area, Sunol, CA, US",37.51660833,-121.82982,5,,,Alameda,,Castilleja exserta,purple owl's-clover,Plantae,49343,Orobanchaceae,Castilleja,Castilleja exserta
10697577,4/7/18,2018-04-07 22:08:00 UTC,Pacific Time (US & Canada),research,https://www.inaturalist.org/observations/10697577,https://static.inaturalist.org/photos/14940150/medium.jpg,,1,0,FALSE,"Sunol Regional Wilderness Area, Sunol, CA, US",37.51663833,-121.8300467,5,,,Alameda,,Wyethia angustifolia,narrowleaf mule-ears,Plantae,56987,Asteraceae,Wyethia,Wyethia angustifolia
10697619,4/7/18,2018-04-07 22:18:39 UTC,Pacific Time (US & Canada),research,https://www.inaturalist.org/observations/10697619,https://static.inaturalist.org/photos/14940195/medium.jpg,,1,0,FALSE,"Sunol Regional Wilderness Area, Sunol, CA, US",37.51722833,-121.8305283,5,,,Alameda,,Nemophila parviflora,small-flowered nemophila,Plantae,57353,Boraginaceae,Nemophila,Nemophila parviflora
10697652,4/7/18,2018-04-07 23:08:18 UTC,Pacific Time (US & Canada),research,https://www.inaturalist.org/observations/10697652,https://static.inaturalist.org/photos/14940251/medium.jpg,,1,0,FALSE,"Sunol Regional Wilderness Area, Sunol, CA, US",37.51648667,-121.8317867,5,,,Alameda,,Veronica persica,bird's-eye speedwell,Plantae,55666,Plantaginaceae,Veronica,Veronica persica
10697687,4/7/18,2018-04-07 23:29:41 UTC,Pacific Time (US & Canada),research,https://www.inaturalist.org/observations/10697687,https://static.inaturalist.org/photos/14940279/medium.jpg,,1,0,FALSE,"Sunol Regional Wilderness Area, Sunol, CA, US",37.51392,-121.8277583,10,,,Alameda,,Lupinus succulentus,arroyo lupine,Plantae,56759,Fabaceae,Lupinus,Lupinus succulentus
10697696,4/7/18,2018-04-07 23:32:54 UTC,Pacific Time (US & Canada),research,https://www.inaturalist.org/observations/10697696,https://static.inaturalist.org/photos/14940298/medium.jpg,,1,0,FALSE,"Sunol Regional Wilderness Area, Sunol, CA, US",37.51381333,-121.8272783,5,,,Alameda,,Solanum umbelliferum,bluewitch nightshade,Plantae,50639,Solanaceae,Solanum,Solanum umbelliferum
10697699,4/7/18,2018-04-07 23:33:41 UTC,Pacific Time (US & Canada),research,https://www.inaturalist.org/observations/10697699,https://static.inaturalist.org/photos/14940304/medium.jpg,,1,0,FALSE,"Sunol Regional Wilderness Area, Sunol, CA, US",37.51386333,-121.8271717,5,,,Alameda,Dipterostemon capitatus,Dipterostemon capitatus,Blue Dicks,Plantae,1196784,Asparagaceae,Dipterostemon,Dipterostemon capitatus
10697700,4/7/18,2018-04-07 23:34:41 UTC,Pacific Time (US & Canada),research,https://www.inaturalist.org/observations/10697700,https://static.inaturalist.org/photos/14940307/medium.jpg,,1,0,FALSE,"Sunol Regional Wilderness Area, Sunol, CA, US",37.51368667,-121.8270417,5,,,Alameda,,Achillea millefolium,Common Yarrow,Plantae,52821,Asteraceae,Achillea,Achillea millefolium
10697704,4/7/18,2018-04-07 23:35:49 UTC,Pacific Time (US & Canada),research,https://www.inaturalist.org/observations/10697704,https://static.inaturalist.org/photos/14940312/medium.jpg,,1,0,FALSE,"Sunol Regional Wilderness Area, Sunol, CA, US",37.513355,-121.8265533,5,,,Alameda,,Pholistoma auritum,Fiesta Flower,Plantae,55437,Boraginaceae,Pholistoma,Pholistoma auritum
10697712,4/7/18,2018-04-07 23:37:36 UTC,Pacific Time (US & Canada),research,https://www.inaturalist.org/observations/10697712,https://static.inaturalist.org/photos/14940329/medium.jpg,,1,0,FALSE,"Sunol Regional Wilderness Area, Sunol, CA, US",37.51325333,-121.8258583,5,,,Alameda,,Delphinium patens,Zigzag Larkspur,Plantae,57237,Ranunculaceae,Delphinium,Delphinium patens
10697716,4/7/18,2018-04-07 23:38:12 UTC,Pacific Time (US & Canada),research,https://www.inaturalist.org/observations/10697716,https://static.inaturalist.org/photos/14940336/medium.jpg,,1,0,FALSE,"Sunol Regional Wilderness Area, Sunol, CA, US",37.51321667,-121.8258967,5,,,Alameda,,Primula hendersonii,Henderson's shooting star,Plantae,487175,Primulaceae,Primula,Primula hendersonii
10697721,4/7/18,2018-04-07 23:42:40 UTC,Pacific Time (US & Canada),research,https://www.inaturalist.org/observations/10697721,https://static.inaturalist.org/photos/14940347/medium.jpg,,2,0,FALSE,"Sunol Regional Wilderness Area, Sunol, CA, US",37.513175,-121.82547,5,,,Alameda,Redstem Stork's-bill,Erodium cicutarium,Redstem Stork's-bill,Plantae,47687,Geraniaceae,Erodium,Erodium cicutarium
10697727,4/7/18,2018-04-07 23:43:02 UTC,Pacific Time (US & Canada),research,https://www.inaturalist.org/observations/10697727,https://static.inaturalist.org/photos/14940354/medium.jpg,,1,0,FALSE,"Sunol Regional Wilderness Area, Sunol, CA, US",37.513175,-121.82547,5,,,Alameda,,Geranium molle,Dove's-foot crane's-bill,Plantae,53076,Geraniaceae,Geranium,Geranium molle
10697730,4/7/18,2018-04-07 23:42:47 UTC,Pacific Time (US & Canada),research,https://www.inaturalist.org/observations/10697730,https://static.inaturalist.org/photos/14940360/medium.jpg,,1,0,FALSE,"Sunol Regional Wilderness Area, Sunol, CA, US",37.513175,-121.82547,5,,,Alameda,Dove's-foot crane's-bill,Geranium molle,Dove's-foot crane's-bill,Plantae,53076,Geraniaceae,Geranium,Geranium molle
10697733,4/7/18,2018-04-07 23:45:07 UTC,Pacific Time (US & Canada),research,https://www.inaturalist.org/observations/10697733,https://static.inaturalist.org/photos/14940366/medium.jpg,,2,0,FALSE,"Sunol Regional Wilderness Area, Sunol, CA, US",37.51328667,-121.8253033,5,,,Alameda,,Triphysaria eriantha,Johnnytuck,Plantae,50792,Orobanchaceae,Triphysaria,Triphysaria eriantha
10697739,4/7/18,2018-04-07 23:53:24 UTC,Pacific Time (US & Canada),research,https://www.inaturalist.org/observations/10697739,https://static.inaturalist.org/photos/14940381/medium.jpg,,1,0,FALSE,"Sunol Regional Wilderness Area, Sunol, CA, US",37.513125,-121.82502,10,,,Alameda,,Collinsia heterophylla,Purple Chinese Houses,Plantae,47325,Plantaginaceae,Collinsia,Collinsia heterophylla
10697749,4/7/18,2018-04-08 00:00:02 UTC,Pacific Time (US & Canada),research,https://www.inaturalist.org/observations/10697749,https://static.inaturalist.org/photos/14940396/medium.jpg,,1,0,FALSE,"Sunol Regional Wilderness Area, Sunol, CA, US",37.51188333,-121.82425,5,,,Alameda,,Gilia tricolor,bird's-eye gilia,Plantae,50832,Polemoniaceae,Gilia,Gilia tricolor
10697758,4/7/18,2018-04-08 00:34:10 UTC,Pacific Time (US & Canada),research,https://www.inaturalist.org/observations/10697758,https://static.inaturalist.org/photos/14940407/medium.jpg,,1,0,FALSE,"Sunol Regional Wilderness Area, Sunol, CA, US",37.50993667,-121.821455,5,,,Alameda,,Vicia villosa,hairy vetch,Plantae,57317,Fabaceae,Vicia,Vicia villosa
10697768,4/7/18,2018-04-08 00:38:34 UTC,Pacific Time (US & Canada),research,https://www.inaturalist.org/observations/10697768,https://static.inaturalist.org/photos/14940423/medium.jpg,,2,0,FALSE,"Sunol Regional Wilderness Area, Sunol, CA, US",37.51104667,-121.8236917,10,,,Alameda,,Calandrinia menziesii,redmaids,Plantae,400267,Montiaceae,Calandrinia,Calandrinia menziesii
10697772,4/7/18,2018-04-08 00:40:19 UTC,Pacific Time (US & Canada),research,https://www.inaturalist.org/observations/10697772,https://static.inaturalist.org/photos/14940430/medium.jpg,,1,0,FALSE,"Sunol Regional Wilderness Area, Sunol, CA, US",37.51162167,-121.824005,30,,,Alameda,,Plantago erecta,dot-seed plantain,Plantae,53177,Plantaginaceae,Plantago,Plantago erecta
10701638,4/7/18,2018-04-08 00:41:50 UTC,Pacific Time (US & Canada),research,https://www.inaturalist.org/observations/10701638,https://static.inaturalist.org/photos/14946405/medium.jpg,White morph,1,0,FALSE,"Sunol Regional Wilderness Area, Sunol, CA, US",37.51155,-121.8240283,10,,,Alameda,,Lupinus bicolor,Miniature Lupine,Plantae,50614,Fabaceae,Lupinus,Lupinus bicolor
10701655,4/7/18,2018-04-08 00:58:02 UTC,Pacific Time (US & Canada),research,https://www.inaturalist.org/observations/10701655,https://static.inaturalist.org/photos/14946411/medium.jpg,,1,0,FALSE,"Sunol Regional Wilderness Area, Sunol, CA, US",37.50911667,-121.8258583,5,,,Alameda,,Viola pedunculata,California Golden Violet,Plantae,50825,Violaceae,Viola,Viola pedunculata
10701656,4/7/18,2018-04-08 01:04:11 UTC,Pacific Time (US & Canada),research,https://www.inaturalist.org/observations/10701656,https://static.inaturalist.org/photos/14946413/medium.jpg,,1,0,FALSE,"Sunol Regional Wilderness Area, Sunol, CA, US",37.50912833,-121.8258667,5,,,Alameda,,Sanicula bipinnatifida,Purple Sanicle,Plantae,56840,Apiaceae,Sanicula,Sanicula bipinnatifida
10701661,4/7/18,2018-04-08 01:07:09 UTC,Pacific Time (US & Canada),research,https://www.inaturalist.org/observations/10701661,https://static.inaturalist.org/photos/14946427/medium.jpg,,1,0,FALSE,"Sunol Regional Wilderness Area, Sunol, CA, US",37.50843833,-121.8266667,5,,,Alameda,,Trifolium dubium,Lesser hop trefoil,Plantae,53313,Fabaceae,Trifolium,Trifolium dubium
10701679,4/7/18,2018-04-08 01:17:46 UTC,Pacific Time (US & Canada),research,https://www.inaturalist.org/observations/10701679,https://static.inaturalist.org/photos/14946454/medium.jpg,,1,0,FALSE,"Sunol Regional Wilderness Area, Sunol, CA, US",37.508295,-121.8285833,5,,,Alameda,small melilot,Melilotus indicus,small melilot,Plantae,57065,Fabaceae,Melilotus,Melilotus indicus
10701701,4/7/18,2018-04-08 01:26:50 UTC,Pacific Time (US & Canada),research,https://www.inaturalist.org/observations/10701701,https://static.inaturalist.org/photos/14946495/medium.jpg,,1,0,FALSE,"Sunol Regional Wilderness Area, Sunol, CA, US",37.51198333,-121.8280633,5,,,Alameda,,Wyethia glabra,smooth mule-ears,Plantae,56988,Asteraceae,Wyethia,Wyethia glabra
10731534,4/7/18,2018-04-07 21:10:29 UTC,Pacific Time (US & Canada),research,https://www.inaturalist.org/observations/10731534,https://static.inaturalist.org/photos/14995533/medium.jpg,,1,0,FALSE,"Sunol Regional Wilderness Area, Sunol, CA, US",37.51611667,-121.8244867,,,,Alameda,mule fat,Baccharis salicifolia,mule fat,Plantae,57913,Asteraceae,Baccharis,Baccharis salicifolia
10731571,4/7/18,2018-04-07 21:36:01 UTC,Pacific Time (US & Canada),research,https://www.inaturalist.org/observations/10731571,https://static.inaturalist.org/photos/14995606/medium.jpg,,4,0,FALSE,"Sunol Regional Wilderness Area, Sunol, CA, US",37.51334667,-121.8252033,,,,Alameda,butter-and-eggs,Triphysaria eriantha eriantha,butter-and-eggs,Plantae,59332,Orobanchaceae,Triphysaria,Triphysaria eriantha
10731627,4/7/18,2018-04-07 20:41:27 UTC,Pacific Time (US & Canada),research,https://www.inaturalist.org/observations/10731627,https://static.inaturalist.org/photos/14995729/medium.jpg,,1,0,FALSE,"Sunol Regional Wilderness Area, Sunol, CA, US",37.51379667,-121.8258533,,,,Alameda,chia,Salvia columbariae,chia,Plantae,53200,Lamiaceae,Salvia,Salvia columbariae
10731642,4/7/18,2018-04-07 20:46:32 UTC,Pacific Time (US & Canada),research,https://www.inaturalist.org/observations/10731642,https://static.inaturalist.org/photos/14995734/medium.jpg,,1,0,FALSE,"Sunol Regional Wilderness Area, Sunol, CA, US",37.51363333,-121.8246917,,,,Alameda,stinging nettle,Urtica dioica,great stinging nettle,Plantae,51884,Urticaceae,Urtica,Urtica dioica
10731676,4/7/18,2018-04-07 21:39:37 UTC,Pacific Time (US & Canada),research,https://www.inaturalist.org/observations/10731676,https://static.inaturalist.org/photos/14995790/medium.jpg,,1,0,FALSE,"Sunol Regional Wilderness Area, Sunol, CA, US",37.51332167,-121.825395,,,,Alameda,Fiesta Flower,Pholistoma auritum,Fiesta Flower,Plantae,55437,Boraginaceae,Pholistoma,Pholistoma auritum
10770085,4/7/18,2018-04-07 20:30:41 UTC,Pacific Time (US & Canada),research,https://www.inaturalist.org/observations/10770085,https://inaturalist-open-data.s3.amazonaws.com/photos/15061856/medium.jpg,,2,0,FALSE,"Sunol Regional Wilderness, Alameda County, US-CA, US",37.51430379,-121.8276855,5,,,Alameda,western blue-eyed grass,Sisyrinchium bellum,western blue-eyed grass,Plantae,49918,Iridaceae,Sisyrinchium,Sisyrinchium bellum
10770101,4/7/18,2018-04-07 20:40:17 UTC,Pacific Time (US & Canada),research,https://www.inaturalist.org/observations/10770101,https://inaturalist-open-data.s3.amazonaws.com/photos/15061918/medium.jpg,,2,0,FALSE,"Sunol Regional Wilderness, Alameda County, US-CA, US",37.51372426,-121.8258035,5,,,Alameda,chia,Salvia columbariae,chia,Plantae,53200,Lamiaceae,Salvia,Salvia columbariae
10770114,4/7/18,2018-04-07 20:43:21 UTC,Pacific Time (US & Canada),research,https://www.inaturalist.org/observations/10770114,https://inaturalist-open-data.s3.amazonaws.com/photos/15061948/medium.jpg,,1,0,FALSE,"Sunol Regional Wilderness, Alameda County, US-CA, US",37.51384148,-121.8255745,5,,,Alameda,Pimpernel,Lysimachia arvensis,scarlet pimpernel,Plantae,791928,Primulaceae,Lysimachia,Lysimachia arvensis
10770118,4/7/18,2018-04-07 20:45:48 UTC,Pacific Time (US & Canada),research,https://www.inaturalist.org/observations/10770118,https://inaturalist-open-data.s3.amazonaws.com/photos/15061960/medium.jpg,,1,0,FALSE,"Sunol Regional Wilderness, Alameda County, US-CA, US",37.51362699,-121.825008,5,,,Alameda,California buttercup,Ranunculus californicus,California buttercup,Plantae,52173,Ranunculaceae,Ranunculus,Ranunculus californicus
10770124,4/7/18,2018-04-07 20:48:17 UTC,Pacific Time (US & Canada),research,https://www.inaturalist.org/observations/10770124,https://inaturalist-open-data.s3.amazonaws.com/photos/15061995/medium.jpg,,2,0,FALSE,"Sunol Regional Wilderness, Alameda County, US-CA, US",37.51408875,-121.8246324,100,,,Alameda,bird's-eye speedwell,Veronica persica,bird's-eye speedwell,Plantae,55666,Plantaginaceae,Veronica,Veronica persica
10770133,4/7/18,2018-04-07 20:50:39 UTC,Pacific Time (US & Canada),research,https://www.inaturalist.org/observations/10770133,https://inaturalist-open-data.s3.amazonaws.com/photos/15062015/medium.jpg,,1,0,FALSE,"Sunol Regional Wilderness, Alameda County, US-CA, US",37.51394584,-121.824788,5,,,Alameda,Shepherd's-purse,Capsella bursa-pastoris,shepherd's-purse,Plantae,56121,Brassicaceae,Capsella,Capsella bursa-pastoris
10770183,4/7/18,2018-04-07 21:03:59 UTC,Pacific Time (US & Canada),research,https://www.inaturalist.org/observations/10770183,https://inaturalist-open-data.s3.amazonaws.com/photos/15062093/medium.jpg,,1,0,FALSE,"Sunol Regional Wilderness, Alameda County, US-CA, US",37.51477133,-121.8245351,30,,,Alameda,Pacific Sanicle,Sanicula crassicaulis,Pacific Sanicle,Plantae,53201,Apiaceae,Sanicula,Sanicula crassicaulis
10770188,4/7/18,2018-04-07 21:04:49 UTC,Pacific Time (US & Canada),research,https://www.inaturalist.org/observations/10770188,https://inaturalist-open-data.s3.amazonaws.com/photos/15062107/medium.jpg,,2,0,FALSE,"Sunol Regional Wilderness, Alameda County, US-CA, US",37.51512735,-121.824725,30,,,Alameda,Little-Robin,Geranium purpureum,Little-Robin,Plantae,57643,Geraniaceae,Geranium,Geranium purpureum
10770201,4/7/18,2018-04-07 21:13:16 UTC,Pacific Time (US & Canada),research,https://www.inaturalist.org/observations/10770201,https://inaturalist-open-data.s3.amazonaws.com/photos/15062147/medium.jpg,,1,0,FALSE,"Sunol Regional Wilderness, Alameda County, US-CA, US",37.51600443,-121.8250319,30,,,Alameda,bluewitch nightshade,Solanum umbelliferum,bluewitch nightshade,Plantae,50639,Solanaceae,Solanum,Solanum umbelliferum
10770209,4/7/18,2018-04-07 21:21:09 UTC,Pacific Time (US & Canada),research,https://www.inaturalist.org/observations/10770209,https://inaturalist-open-data.s3.amazonaws.com/photos/15062204/medium.jpg,,1,0,FALSE,"Sunol Regional Wilderness, Alameda County, US-CA, US",37.51635086,-121.8246813,5,,,Alameda,Purple Chinese Houses,Collinsia heterophylla,Purple Chinese Houses,Plantae,47325,Plantaginaceae,Collinsia,Collinsia heterophylla
10770225,4/7/18,2018-04-07 21:28:41 UTC,Pacific Time (US & Canada),research,https://www.inaturalist.org/observations/10770225,https://inaturalist-open-data.s3.amazonaws.com/photos/15062258/medium.jpg,,1,0,FALSE,"Sunol Regional Wilderness, Alameda County, US-CA, US",37.5138502,-121.8249065,10,,,Alameda,American yellowrocket,Barbarea orthoceras,American yellowrocket,Plantae,52976,Brassicaceae,Barbarea,Barbarea orthoceras
10770252,4/7/18,2018-04-07 21:30:50 UTC,Pacific Time (US & Canada),research,https://www.inaturalist.org/observations/10770252,https://inaturalist-open-data.s3.amazonaws.com/photos/15062353/medium.jpg,,1,0,FALSE,"Sunol Regional Wilderness, Alameda County, US-CA, US",37.51360612,-121.8250472,5,,,Alameda,Fiesta Flower,Pholistoma auritum,Fiesta Flower,Plantae,55437,Boraginaceae,Pholistoma,Pholistoma auritum
10770276,4/7/18,2018-04-07 21:43:47 UTC,Pacific Time (US & Canada),research,https://www.inaturalist.org/observations/10770276,https://inaturalist-open-data.s3.amazonaws.com/photos/15062397/medium.jpg,,1,0,FALSE,"Sunol Regional Wilderness, Alameda County, US-CA, US",37.51329352,-121.8258537,5,,,Alameda,Henderson's shooting star,Primula hendersonii,Henderson's shooting star,Plantae,487175,Primulaceae,Primula,Primula hendersonii
10708752,4/8/18,2018-04-08 19:06:09 UTC,Pacific Time (US & Canada),research,https://www.inaturalist.org/observations/10708752,https://static.inaturalist.org/photos/14957781/medium.jpg,,0,0,FALSE,"Sunol Regional Wilderness Area, Sunol, CA, US",37.53111902,-121.8132701,5,,,Alameda,Dipterostemon capitatus,Dipterostemon capitatus,Blue Dicks,Plantae,1196784,Asparagaceae,Dipterostemon,Dipterostemon capitatus
10708809,4/8/18,2018-04-08 19:07:33 UTC,Pacific Time (US & Canada),research,https://www.inaturalist.org/observations/10708809,https://static.inaturalist.org/photos/14957897/medium.jpg,,2,0,FALSE,"Sunol Regional Wilderness Area, Sunol, CA, US",37.53081714,-121.8134848,5,,,Alameda,California Golden Violet,Viola pedunculata,California Golden Violet,Plantae,50825,Violaceae,Viola,Viola pedunculata
10708889,4/8/18,2018-04-08 19:10:18 UTC,Pacific Time (US & Canada),research,https://www.inaturalist.org/observations/10708889,https://static.inaturalist.org/photos/14958049/medium.jpg,,2,0,FALSE,"Sunol Regional Wilderness Area, Sunol, CA, US",37.53060336,-121.8143925,10,,,Alameda,Dwarf Checkermallow,Sidalcea malviflora,Dwarf Checkermallow,Plantae,48795,Malvaceae,Sidalcea,Sidalcea malviflora
10709279,4/8/18,2018-04-08 19:28:14 UTC,Pacific Time (US & Canada),research,https://www.inaturalist.org/observations/10709279,https://static.inaturalist.org/photos/14958698/medium.jpg,,2,0,FALSE,"Sunol Regional Wilderness Area, Sunol, CA, US",37.52869237,-121.8206346,10,,,Alameda,Pimpernel,Lysimachia arvensis,scarlet pimpernel,Plantae,791928,Primulaceae,Lysimachia,Lysimachia arvensis
10711494,4/8/18,2018-04-08 20:43:18 UTC,Pacific Time (US & Canada),research,https://www.inaturalist.org/observations/10711494,https://static.inaturalist.org/photos/14964001/medium.jpg,,2,0,FALSE,"Sunol Regional Wilderness, Alameda County, US-CA, US",37.52856325,-121.8101343,30,,,Alameda,California gilia,Gilia achilleifolia,California gilia,Plantae,51098,Polemoniaceae,Gilia,Gilia achilleifolia
10721571,4/8/18,2018-04-08 21:15:03 UTC,Pacific Time (US & Canada),research,https://www.inaturalist.org/observations/10721571,https://static.inaturalist.org/photos/14980082/medium.jpg,,3,0,FALSE,"Sunol Regional Wilderness, Alameda County, US-CA, US",37.51472473,-121.830909,5,,,Alameda,,Lamium purpureum,red deadnettle,Plantae,55851,Lamiaceae,Lamium,Lamium purpureum
10722051,4/8/18,2018-04-09 00:25:53 UTC,Pacific Time (US & Canada),research,https://www.inaturalist.org/observations/10722051,https://static.inaturalist.org/photos/14980888/medium.jpg,,1,0,FALSE,"Sunol Regional Wilderness Area, Sunol, CA, US",37.51363333,-121.83245,5,,,Alameda,,Tauschia hartwegii,Hartweg's umbrellawort,Plantae,54948,Apiaceae,Tauschia,Tauschia hartwegii
10722141,4/8/18,2018-04-09 00:28:10 UTC,Pacific Time (US & Canada),research,https://www.inaturalist.org/observations/10722141,https://static.inaturalist.org/photos/14980916/medium.jpg,,1,0,FALSE,"Sunol Regional Wilderness Area, Sunol, CA, US",37.5136,-121.8325583,5,,,Alameda,,Lomatium californicum,California lomatium,Plantae,56824,Apiaceae,Lomatium,Lomatium californicum
10722182,4/8/18,2018-04-09 00:39:57 UTC,Pacific Time (US & Canada),research,https://www.inaturalist.org/observations/10722182,https://static.inaturalist.org/photos/14980927/medium.jpg,,1,0,FALSE,"Sunol Regional Wilderness Area, Sunol, CA, US",37.512875,-121.833595,5,,,Alameda,,Castilleja densiflora,Denseflower Indian Paintbrush,Plantae,55508,Orobanchaceae,Castilleja,Castilleja densiflora
10722236,4/8/18,2018-04-09 00:50:10 UTC,Pacific Time (US & Canada),research,https://www.inaturalist.org/observations/10722236,https://static.inaturalist.org/photos/14980962/medium.jpg,,1,0,FALSE,"Sunol Regional Wilderness Area, Sunol, CA, US",37.51055333,-121.8349917,5,,,Alameda,,Urtica dioica,great stinging nettle,Plantae,51884,Urticaceae,Urtica,Urtica dioica
10722242,4/8/18,2018-04-09 00:50:57 UTC,Pacific Time (US & Canada),research,https://www.inaturalist.org/observations/10722242,https://static.inaturalist.org/photos/14980979/medium.jpg,,1,0,FALSE,"Sunol Regional Wilderness Area, Sunol, CA, US",37.510495,-121.8348217,5,,,Alameda,,Nasturtium officinale,watercress,Plantae,78174,Brassicaceae,Nasturtium,Nasturtium officinale
10722255,4/8/18,2018-04-09 00:52:49 UTC,Pacific Time (US & Canada),research,https://www.inaturalist.org/observations/10722255,https://static.inaturalist.org/photos/14980983/medium.jpg,,1,0,FALSE,"Sunol Regional Wilderness Area, Sunol, CA, US",37.51029667,-121.8353417,5,,,Alameda,,Ribes californicum,hillside gooseberry,Plantae,47129,Grossulariaceae,Ribes,Ribes californicum
10722288,4/8/18,2018-04-09 01:10:44 UTC,Pacific Time (US & Canada),research,https://www.inaturalist.org/observations/10722288,https://static.inaturalist.org/photos/14980988/medium.jpg,,1,0,FALSE,"Sunol Regional Wilderness Area, Sunol, CA, US",37.51235833,-121.8336417,5,,,Alameda,,Astragalus gambelianus,Gambel's milkvetch,Plantae,57042,Fabaceae,Astragalus,Astragalus gambelianus
10723044,4/8/18,2018-04-08 17:41:21 UTC,Pacific Time (US & Canada),research,https://www.inaturalist.org/observations/10723044,https://static.inaturalist.org/photos/14982215/medium.jpg,,1,0,FALSE,"Sunol Regional Wilderness Area, Sunol, CA, US",37.51318667,-121.8252717,5,,,Alameda,butter-and-eggs,Triphysaria eriantha eriantha,butter-and-eggs,Plantae,59332,Orobanchaceae,Triphysaria,Triphysaria eriantha
10723052,4/8/18,2018-04-08 17:46:25 UTC,Pacific Time (US & Canada),research,https://www.inaturalist.org/observations/10723052,https://static.inaturalist.org/photos/14982243/medium.jpg,,3,1,FALSE,"Sunol Regional Wilderness Area, Sunol, CA, US",37.512805,-121.8248283,5,,,Alameda,Dipterostemon capitatus,Dipterostemon capitatus,Blue Dicks,Plantae,1196784,Asparagaceae,Dipterostemon,Dipterostemon capitatus
10723068,4/8/18,2018-04-08 17:46:30 UTC,Pacific Time (US & Canada),research,https://www.inaturalist.org/observations/10723068,https://static.inaturalist.org/photos/14982278/medium.jpg,,1,0,FALSE,"Sunol Regional Wilderness Area, Sunol, CA, US",37.51279667,-121.8248583,5,,,Alameda,California buttercup,Ranunculus californicus,California buttercup,Plantae,52173,Ranunculaceae,Ranunculus,Ranunculus californicus
10723156,4/8/18,2018-04-08 18:49:46 UTC,Pacific Time (US & Canada),research,https://www.inaturalist.org/observations/10723156,https://static.inaturalist.org/photos/14982429/medium.jpg,,1,0,FALSE,"Sunol Regional Wilderness Area, Sunol, CA, US",37.52665833,-121.812195,5,,,Alameda,California Golden Violet,Viola pedunculata,California Golden Violet,Plantae,50825,Violaceae,Viola,Viola pedunculata
10723160,4/8/18,2018-04-08 18:53:46 UTC,Pacific Time (US & Canada),research,https://www.inaturalist.org/observations/10723160,https://static.inaturalist.org/photos/14982483/medium.jpg,,1,0,FALSE,"Sunol Regional Wilderness Area, Sunol, CA, US",37.527275,-121.81157,5,,,Alameda,California buttercup,Ranunculus californicus,California buttercup,Plantae,52173,Ranunculaceae,Ranunculus,Ranunculus californicus
10723180,4/8/18,2018-04-08 18:59:26 UTC,Pacific Time (US & Canada),research,https://www.inaturalist.org/observations/10723180,https://static.inaturalist.org/photos/14982498/medium.jpg,,1,0,FALSE,"Sunol Regional Wilderness Area, Sunol, CA, US",37.52849167,-121.810105,5,,,Alameda,Silver Lupine,Lupinus albifrons,Silver Lupine,Plantae,51691,Fabaceae,Lupinus,Lupinus albifrons
10723183,4/8/18,2018-04-08 18:59:43 UTC,Pacific Time (US & Canada),research,https://www.inaturalist.org/observations/10723183,https://static.inaturalist.org/photos/14982510/medium.jpg,,1,0,FALSE,"Sunol Regional Wilderness Area, Sunol, CA, US",37.52847,-121.81018,5,,,Alameda,California gilia,Gilia achilleifolia,California gilia,Plantae,51098,Polemoniaceae,Gilia,Gilia achilleifolia
10723194,4/8/18,2018-04-08 19:00:24 UTC,Pacific Time (US & Canada),research,https://www.inaturalist.org/observations/10723194,https://static.inaturalist.org/photos/14982542/medium.jpg,,1,0,FALSE,"Sunol Regional Wilderness Area, Sunol, CA, US",37.52842167,-121.81028,5,,,Alameda,chia,Salvia columbariae,chia,Plantae,53200,Lamiaceae,Salvia,Salvia columbariae
10723206,4/8/18,2018-04-08 19:03:44 UTC,Pacific Time (US & Canada),research,https://www.inaturalist.org/observations/10723206,https://static.inaturalist.org/photos/14982597/medium.jpg,,2,0,FALSE,"Sunol Regional Wilderness Area, Sunol, CA, US",37.52836167,-121.8115467,5,,,Alameda,orange bush monkeyflower,Diplacus aurantiacus,orange bush monkeyflower,Plantae,777371,Phrymaceae,Diplacus,Diplacus aurantiacus
10723235,4/8/18,2018-04-08 19:00:58 UTC,Pacific Time (US & Canada),research,https://www.inaturalist.org/observations/10723235,https://static.inaturalist.org/photos/14982634/medium.jpg,,1,0,FALSE,"Sunol Regional Wilderness Area, Sunol, CA, US",37.52837,-121.8104783,5,,,Alameda,California poppy,Eschscholzia californica,California poppy,Plantae,48225,Papaveraceae,Eschscholzia,Eschscholzia californica
10723245,4/8/18,2018-04-08 19:05:27 UTC,Pacific Time (US & Canada),research,https://www.inaturalist.org/observations/10723245,https://static.inaturalist.org/photos/14982653/medium.jpg,,1,0,FALSE,"Sunol Regional Wilderness Area, Sunol, CA, US",37.52853333,-121.8120117,5,,,Alameda,Dipterostemon capitatus,Dipterostemon capitatus,Blue Dicks,Plantae,1196784,Asparagaceae,Dipterostemon,Dipterostemon capitatus
10723252,4/8/18,2018-04-08 19:13:53 UTC,Pacific Time (US & Canada),research,https://www.inaturalist.org/observations/10723252,https://static.inaturalist.org/photos/14982674/medium.jpg,,1,0,FALSE,"Sunol Regional Wilderness Area, Sunol, CA, US",37.53033833,-121.8157883,5,,,Alameda,hairy vetch,Vicia villosa,hairy vetch,Plantae,57317,Fabaceae,Vicia,Vicia villosa
10723258,4/8/18,2018-04-08 19:16:13 UTC,Pacific Time (US & Canada),research,https://www.inaturalist.org/observations/10723258,https://static.inaturalist.org/photos/14982694/medium.jpg,,1,0,FALSE,"Sunol Regional Wilderness Area, Sunol, CA, US",37.53073667,-121.8164367,5,,,Alameda,California Golden Violet,Viola pedunculata,California Golden Violet,Plantae,50825,Violaceae,Viola,Viola pedunculata
10723278,4/8/18,2018-04-08 19:16:44 UTC,Pacific Time (US & Canada),research,https://www.inaturalist.org/observations/10723278,https://static.inaturalist.org/photos/14982755/medium.jpg,,1,0,FALSE,"Sunol Regional Wilderness Area, Sunol, CA, US",37.53072167,-121.8164583,5,,,Alameda,Rancher's fiddleneck,Amsinckia menziesii intermedia,Rancher's fiddleneck,Plantae,49141,Boraginaceae,Amsinckia,Amsinckia menziesii
10723297,4/8/18,2018-04-08 19:18:47 UTC,Pacific Time (US & Canada),research,https://www.inaturalist.org/observations/10723297,https://static.inaturalist.org/photos/14982789/medium.jpg,,1,0,FALSE,"Sunol Regional Wilderness Area, Sunol, CA, US",37.53103833,-121.8172083,5,,,Alameda,western blue-eyed grass,Sisyrinchium bellum,western blue-eyed grass,Plantae,49918,Iridaceae,Sisyrinchium,Sisyrinchium bellum
