id,observed_on,time_observed_at,time_zone,quality_grade,url,image_url,description,num_identification_agreements,num_identification_disagreements,captive_cultivated,place_guess,latitude,longitude,geoprivacy,taxon_geoprivacy,place_town_name,place_county_name,species_guess,scientific_name,common_name,iconic_taxon_name,taxon_id,taxon_family_name,taxon_genus_name,taxon_species_name
104132188,1/1/22,2022-01-01 13:17:59 UTC,UTC,research,https://www.inaturalist.org/observations/104132188,https://static.inaturalist.org/photos/175137924/medium.jpg,,1,0,FALSE,"Tilden Nature Area, Orinda, CA, US",37.91252719,-122.2526461,,open,,Contra Costa,common cowparsnip,Heracleum maximum,common cowparsnip,Plantae,53094,Apiaceae,Heracleum,Heracleum maximum
104139507,1/1/22,2022-01-01 14:54:56 UTC,UTC,research,https://www.inaturalist.org/observations/104139507,https://static.inaturalist.org/photos/177963827/medium.jpg,,1,0,FALSE,"Tilden Regional Park, Orinda, CA, US",37.89728903,-122.2406239,,open,,Contra Costa,common cowparsnip,Heracleum maximum,common cowparsnip,Plantae,53094,Apiaceae,Heracleum,Heracleum maximum
104253911,1/2/22,2022-01-02 16:09:23 UTC,UTC,research,https://www.inaturalist.org/observations/104253911,https://static.inaturalist.org/photos/174666393/medium.jpg,,1,0,FALSE,"Tilden Nature Area, El Sobrante, CA, US",37.91887,-122.2624667,,,,Contra Costa,California beeplant,Scrophularia californica,California beeplant,Plantae,50812,Scrophulariaceae,Scrophularia,Scrophularia californica
104295464,1/3/22,2022-01-03 19:52:11 UTC,Pacific Time (US & Canada),research,https://www.inaturalist.org/observations/104295464,https://inaturalist-open-data.s3.amazonaws.com/photos/174770186/medium.jpeg,,1,0,FALSE,"Orinda, CA 94563, USA",37.8851182,-122.2238579,,,,Contra Costa,California yerba santa,Eriodictyon californicum,California yerba santa,Plantae,57095,Boraginaceae,Eriodictyon,Eriodictyon californicum
104310315,1/3/22,2022-01-03 12:39:05 UTC,UTC,research,https://www.inaturalist.org/observations/104310315,https://inaturalist-open-data.s3.amazonaws.com/photos/174756589/medium.jpg,,1,0,FALSE,"Tilden Regional Park, Orinda, CA, US",37.90208833,-122.24482,,open,,Contra Costa,cardo mariano,Silybum marianum,milk thistle,Plantae,52586,Asteraceae,Silybum,Silybum marianum
104310463,1/3/22,2022-01-03 11:09:11 UTC,UTC,research,https://www.inaturalist.org/observations/104310463,https://inaturalist-open-data.s3.amazonaws.com/photos/174756793/medium.jpg,,1,0,FALSE,"Tilden Regional Park, Orinda, CA, US",37.89006167,-122.2338033,,,,Contra Costa,Common Calamint,Clinopodium menthifolium ascendens,Common Calamint,Plantae,360165,Lamiaceae,Clinopodium,Clinopodium menthifolium
104315065,1/3/22,2022-01-03 23:59:37 UTC,Pacific Time (US & Canada),research,https://www.inaturalist.org/observations/104315065,https://inaturalist-open-data.s3.amazonaws.com/photos/174766043/medium.jpeg,,2,0,FALSE,Vollmer Peak Trail,37.88382241,-122.2247089,,open,,Contra Costa,European holly,Ilex aquifolium,European holly,Plantae,53856,Aquifoliaceae,Ilex,Ilex aquifolium
104342452,1/3/22,2022-01-03 11:10:26 UTC,UTC,research,https://www.inaturalist.org/observations/104342452,https://inaturalist-open-data.s3.amazonaws.com/photos/174818293/medium.jpg,,1,0,FALSE,"Tilden Regional Park, Orinda, CA, US",37.890125,-122.233855,,,,Contra Costa,Wood Calamint,Clinopodium menthifolium,Wood Calamint,Plantae,360164,Lamiaceae,Clinopodium,Clinopodium menthifolium
104349191,1/2/22,2022-01-02 13:58:38 UTC,UTC,research,https://www.inaturalist.org/observations/104349191,https://inaturalist-open-data.s3.amazonaws.com/photos/174831170/medium.jpg,,1,0,FALSE,"Tilden Regional Park, Orinda, CA, US",37.89020539,-122.235379,,,,Contra Costa,Spanish Broom,Spartium junceum,Spanish Broom,Plantae,47406,Fabaceae,Spartium,Spartium junceum
104387754,1/4/22,2022-01-04 23:10:41 UTC,Pacific Time (US & Canada),research,https://www.inaturalist.org/observations/104387754,https://inaturalist-open-data.s3.amazonaws.com/photos/174901156/medium.jpeg,,1,0,FALSE,"Kensington, CA, USA",37.90639975,-122.2640804,,,,Contra Costa,Cardo común,Cirsium vulgare,Bull Thistle,Plantae,52989,Asteraceae,Cirsium,Cirsium vulgare
104485857,1/6/22,2022-01-06 16:48:00 UTC,Eastern Time (US & Canada),research,https://www.inaturalist.org/observations/104485857,https://inaturalist-open-data.s3.amazonaws.com/photos/175084025/medium.jpeg,,1,0,FALSE,"Tilden Regional Park, Contra Costa, California, United States",37.89374833,-122.2432417,,,,Contra Costa,Broad-leafed Helleborine,Epipactis helleborine,Broad-leafed Helleborine,Plantae,50717,Orchidaceae,Epipactis,Epipactis helleborine
104485861,1/6/22,2022-01-06 16:02:00 UTC,Eastern Time (US & Canada),research,https://www.inaturalist.org/observations/104485861,https://inaturalist-open-data.s3.amazonaws.com/photos/175084349/medium.jpeg,,1,0,FALSE,"Contra Costa County, CA, USA",37.89261667,-122.2433083,,,,Contra Costa,Ivy-leaved toadflax,Cymbalaria muralis,Ivy-leaved toadflax,Plantae,55727,Plantaginaceae,Cymbalaria,Cymbalaria muralis
104485863,1/6/22,2022-01-06 16:15:00 UTC,Eastern Time (US & Canada),research,https://www.inaturalist.org/observations/104485863,https://inaturalist-open-data.s3.amazonaws.com/photos/175084441/medium.jpeg,,1,0,FALSE,"Contra Costa County, CA, USA",37.89294722,-122.2440806,,,,Contra Costa,Petty Spurge,Euphorbia peplus,Petty Spurge,Plantae,57036,Euphorbiaceae,Euphorbia,Euphorbia peplus
104688506,1/9/22,2022-01-09 15:46:18 UTC,UTC,research,https://www.inaturalist.org/observations/104688506,https://inaturalist-open-data.s3.amazonaws.com/photos/175472382/medium.jpg,,1,0,FALSE,"Tilden Nature Area, Kensington, CA, US",37.91135,-122.2689367,,,,Contra Costa,trailing blackberry,Rubus ursinus,trailing blackberry,Plantae,53445,Rosaceae,Rubus,Rubus ursinus
104688829,1/9/22,2022-01-09 15:40:08 UTC,UTC,research,https://www.inaturalist.org/observations/104688829,https://inaturalist-open-data.s3.amazonaws.com/photos/175473127/medium.jpg,,1,0,FALSE,"Tilden Nature Area, Kensington, CA, US",37.90987,-122.268005,,,,Contra Costa,Pacific hound's tongue,Adelinia grande,Pacific hound's tongue,Plantae,769151,Boraginaceae,Adelinia,Adelinia grande
104688871,1/9/22,2022-01-09 15:30:33 UTC,UTC,research,https://www.inaturalist.org/observations/104688871,https://inaturalist-open-data.s3.amazonaws.com/photos/175473170/medium.jpg,,1,0,FALSE,"Tilden Nature Area, Kensington, CA, US",37.90968667,-122.2689967,,open,,Contra Costa,stinging nettle,Urtica dioica,great stinging nettle,Plantae,51884,Urticaceae,Urtica,Urtica dioica
104688951,1/9/22,2022-01-09 16:08:44 UTC,UTC,research,https://www.inaturalist.org/observations/104688951,https://inaturalist-open-data.s3.amazonaws.com/photos/175473283/medium.jpg,,1,0,FALSE,"Tilden Nature Area, Kensington, CA, US",37.90832833,-122.265945,,open,,Contra Costa,red-berried elder,Sambucus racemosa,red-berried elder,Plantae,57824,Viburnaceae,Sambucus,Sambucus racemosa
104800068,1/11/22,2022-01-11 17:02:08 UTC,UTC,research,https://www.inaturalist.org/observations/104800068,https://static.inaturalist.org/photos/175687363/medium.jpg,,1,0,FALSE,"Tilden Regional Park, Orinda, CA, US",37.89201333,-122.2283383,,,,Contra Costa,California poppy,Eschscholzia californica,California poppy,Plantae,48225,Papaveraceae,Eschscholzia,Eschscholzia californica
104884769,1/13/22,2022-01-13 12:41:43 UTC,UTC,research,https://www.inaturalist.org/observations/104884769,https://inaturalist-open-data.s3.amazonaws.com/photos/175847704/medium.jpg,,1,0,FALSE,"Tilden Regional Park, Orinda, CA, US",37.88492,-122.223975,,,,Contra Costa,Broad-leafed Helleborine,Epipactis helleborine,Broad-leafed Helleborine,Plantae,50717,Orchidaceae,Epipactis,Epipactis helleborine
105017571,1/15/22,2022-01-15 22:42:02 UTC,Pacific Time (US & Canada),research,https://www.inaturalist.org/observations/105017571,https://inaturalist-open-data.s3.amazonaws.com/photos/176103978/medium.jpg,,2,0,FALSE,"Tilden Regional Park, Orinda, CA, US",37.90867,-122.253845,,,,Contra Costa,coast twinberry,Lonicera involucrata ledebourii,coast twinberry,Plantae,60990,Caprifoliaceae,Lonicera,Lonicera involucrata
105017586,1/15/22,2022-01-15 22:40:27 UTC,Pacific Time (US & Canada),research,https://www.inaturalist.org/observations/105017586,https://inaturalist-open-data.s3.amazonaws.com/photos/176104009/medium.jpg,,1,0,FALSE,"Tilden Regional Park, Orinda, CA, US",37.90866333,-122.2539667,,,,Contra Costa,yerba buena,Clinopodium douglasii,yerba buena,Plantae,53203,Lamiaceae,Clinopodium,Clinopodium douglasii
105018052,1/15/22,2022-01-16 00:40:30 UTC,Hawaii,research,https://www.inaturalist.org/observations/105018052,https://inaturalist-open-data.s3.amazonaws.com/photos/176105231/medium.jpg,,1,0,FALSE,"Tilden Nature Area, Orinda, CA, US",37.91154759,-122.2605401,,,,Contra Costa,yerba buena,Clinopodium douglasii,yerba buena,Plantae,53203,Lamiaceae,Clinopodium,Clinopodium douglasii
105021943,1/15/22,2022-01-15 14:41:13 UTC,UTC,research,https://www.inaturalist.org/observations/105021943,https://static.inaturalist.org/photos/176113376/medium.jpg,,1,0,FALSE,"Tilden Regional Park, Orinda, CA, US",37.90867,-122.2539883,,,,Contra Costa,yerba buena,Clinopodium douglasii,yerba buena,Plantae,53203,Lamiaceae,Clinopodium,Clinopodium douglasii
105129343,1/17/22,2022-01-17 16:49:45 UTC,UTC,research,https://www.inaturalist.org/observations/105129343,https://inaturalist-open-data.s3.amazonaws.com/photos/176330172/medium.jpeg,,1,0,FALSE,Orinda,37.89700699,-122.2554855,,open,,Contra Costa,coast live oak,Quercus agrifolia,coast live oak,Plantae,47850,Fagaceae,Quercus,Quercus agrifolia
105134502,1/16/22,2022-01-16 10:29:08 UTC,UTC,research,https://www.inaturalist.org/observations/105134502,https://inaturalist-open-data.s3.amazonaws.com/photos/176330912/medium.jpg,,1,0,FALSE,"Tilden Regional Park, Orinda, CA, US",37.90097,-122.242395,,,,Contra Costa,Cut-leaved crane's-bill,Geranium dissectum,Cut-leaved crane's-bill,Plantae,53075,Geraniaceae,Geranium,Geranium dissectum
105134510,1/16/22,2022-01-16 10:40:04 UTC,UTC,research,https://www.inaturalist.org/observations/105134510,https://inaturalist-open-data.s3.amazonaws.com/photos/177000110/medium.jpg,,1,0,FALSE,"Tilden Regional Park, Orinda, CA, US",37.897125,-122.238045,,,,Contra Costa,broadleaf forget-me-not,Myosotis latifolia,broadleaf forget-me-not,Plantae,49132,Boraginaceae,Myosotis,Myosotis latifolia
105137597,1/17/22,2022-01-17 22:42:00 UTC,Pacific Time (US & Canada),research,https://www.inaturalist.org/observations/105137597,https://inaturalist-open-data.s3.amazonaws.com/photos/176332953/medium.jpeg,,1,0,FALSE,"Tilden Regional Park, Contra Costa County, US-CA, US",37.90016361,-122.2531261,,,,Contra Costa,broadleaf forget-me-not,Myosotis latifolia,broadleaf forget-me-not,Plantae,49132,Boraginaceae,Myosotis,Myosotis latifolia
105137618,1/17/22,2022-01-17 23:53:00 UTC,Pacific Time (US & Canada),research,https://www.inaturalist.org/observations/105137618,https://inaturalist-open-data.s3.amazonaws.com/photos/176335262/medium.jpeg,,1,0,FALSE,"Contra Costa County, CA, USA",37.89848372,-122.2540588,,,,Contra Costa,Cardo común,Cirsium vulgare,Bull Thistle,Plantae,52989,Asteraceae,Cirsium,Cirsium vulgare
105138246,1/17/22,2022-01-17 16:08:14 UTC,UTC,research,https://www.inaturalist.org/observations/105138246,https://static.inaturalist.org/photos/176339486/medium.jpg,,1,0,FALSE,"Tilden Regional Park, Orinda, CA, US",37.89233833,-122.23002,,,,Contra Costa,Silver Lupine,Lupinus albifrons,Silver Bush Lupine,Plantae,51691,Fabaceae,Lupinus,Lupinus albifrons
105250665,1/15/22,2022-01-15 15:47:18 UTC,UTC,research,https://www.inaturalist.org/observations/105250665,https://static.inaturalist.org/photos/176553769/medium.jpg,,1,0,FALSE,"Tilden Regional Park, Orinda, CA, US",37.90443,-122.2491833,,,,Contra Costa,Cardo abrepuño,Centaurea solstitialis,Yellow Star-Thistle,Plantae,52588,Asteraceae,Centaurea,Centaurea solstitialis
105294813,1/20/22,2022-01-20 16:59:43 UTC,UTC,research,https://www.inaturalist.org/observations/105294813,https://inaturalist-open-data.s3.amazonaws.com/photos/176639154/medium.jpg,,2,0,FALSE,"Tilden Regional Park, Orinda, CA, US",37.90538,-122.2605283,,,,Contra Costa,poison hemlock,Conium maculatum,poison hemlock,Plantae,52998,Apiaceae,Conium,Conium maculatum
105331517,1/21/22,2022-01-21 08:51:33 UTC,UTC,research,https://www.inaturalist.org/observations/105331517,https://inaturalist-open-data.s3.amazonaws.com/photos/176708683/medium.jpg,,1,0,FALSE,"Tilden Regional Park, Orinda, CA, US",37.88672167,-122.2240617,,open,,Contra Costa,California bay,Umbellularia californica,California bay,Plantae,48807,Lauraceae,Umbellularia,Umbellularia californica
105381912,1/22/22,2022-01-22 11:53:52 UTC,UTC,research,https://www.inaturalist.org/observations/105381912,https://static.inaturalist.org/photos/176815426/medium.jpg,,1,0,FALSE,"Tilden Nature Area, Orinda, CA, US",37.91628179,-122.274334,,,,Contra Costa,trailing blackberry,Rubus ursinus,trailing blackberry,Plantae,53445,Rosaceae,Rubus,Rubus ursinus
105401969,1/22/22,2022-01-22 17:05:17 UTC,UTC,research,https://www.inaturalist.org/observations/105401969,https://inaturalist-open-data.s3.amazonaws.com/photos/176869814/medium.jpg,,3,0,FALSE,"Tilden Regional Park, Contra Costa County, US-CA, US",37.89270999,-122.2435982,,,,Contra Costa,greater periwinkle,Vinca major,greater periwinkle,Plantae,53326,Apocynaceae,Vinca,Vinca major
105472460,1/20/22,2022-01-21 01:08:42 UTC,Pacific Time (US & Canada),research,https://www.inaturalist.org/observations/105472460,https://inaturalist-open-data.s3.amazonaws.com/photos/176975250/medium.jpg,,2,0,FALSE,"Tilden Regional Park, Orinda, CA, US",37.90377833,-122.257095,,,,Contra Costa,Pacific Sanicle,Sanicula crassicaulis,Pacific Sanicle,Plantae,53201,Apiaceae,Sanicula,Sanicula crassicaulis
105472539,1/20/22,2022-01-21 01:07:43 UTC,Pacific Time (US & Canada),research,https://www.inaturalist.org/observations/105472539,https://inaturalist-open-data.s3.amazonaws.com/photos/176975283/medium.jpg,,1,0,FALSE,"Tilden Regional Park, Orinda, CA, US",37.90411333,-122.2576617,,open,,Contra Costa,Cherry laurel,Prunus laurocerasus,Cherry laurel,Plantae,61432,Rosaceae,Prunus,Prunus laurocerasus
105472659,1/20/22,2022-01-21 01:03:20 UTC,Pacific Time (US & Canada),research,https://www.inaturalist.org/observations/105472659,https://inaturalist-open-data.s3.amazonaws.com/photos/176975371/medium.jpg,,2,0,FALSE,"Tilden Regional Park, Orinda, CA, US",37.90472,-122.259575,,,,Contra Costa,fuller's teasel,Dipsacus sativus,fuller's teasel,Plantae,53028,Caprifoliaceae,Dipsacus,Dipsacus sativus
105480423,1/23/22,2022-01-23 18:49:57 UTC,Pacific Time (US & Canada),research,https://www.inaturalist.org/observations/105480423,https://static.inaturalist.org/photos/176990316/medium.jpg,,1,0,FALSE,"Tilden Nature Area, El Sobrante, CA, US",37.91888833,-122.2621167,,,,Contra Costa,woodland strawberry,Fragaria vesca,woodland strawberry,Plantae,50298,Rosaceae,Fragaria,Fragaria vesca
105574410,1/24/22,2022-01-24 10:14:36 UTC,UTC,research,https://www.inaturalist.org/observations/105574410,https://inaturalist-open-data.s3.amazonaws.com/photos/177169136/medium.jpg,Super early bloom likely due to heavy early rains,1,0,FALSE,"Tilden Regional Park, Orinda, CA, US",37.89083,-122.2278217,,,,Contra Costa,Blue Dicks,Dipterostemon capitatus,Blue Dicks,Plantae,1196784,Asparagaceae,Dipterostemon,Dipterostemon capitatus
105574435,1/24/22,2022-01-24 09:56:16 UTC,UTC,research,https://www.inaturalist.org/observations/105574435,https://inaturalist-open-data.s3.amazonaws.com/photos/177169221/medium.jpg,,1,0,FALSE,"Tilden Regional Park, Orinda, CA, US",37.88768,-122.224625,,,,Contra Costa,California buckwheat,Eriogonum fasciculatum,California Buckwheat,Plantae,54999,Polygonaceae,Eriogonum,Eriogonum fasciculatum
105636947,1/26/22,2022-01-26 19:27:00 UTC,Pacific Time (US & Canada),research,https://www.inaturalist.org/observations/105636947,https://inaturalist-open-data.s3.amazonaws.com/photos/177285430/medium.jpeg,,1,0,FALSE,"Contra Costa County, CA, USA",37.883758,-122.224678,,open,,Contra Costa,California bay,Umbellularia californica,California bay,Plantae,48807,Lauraceae,Umbellularia,Umbellularia californica
105636950,1/26/22,2022-01-26 19:39:00 UTC,Pacific Time (US & Canada),research,https://www.inaturalist.org/observations/105636950,https://inaturalist-open-data.s3.amazonaws.com/photos/177285472/medium.jpeg,,2,0,FALSE,"El Toyonal, Orinda, CA 94563, USA",37.88715008,-122.2234471,,,,Contra Costa,Gray Mule-Ears,Wyethia helenioides,Gray Mule-Ears,Plantae,50799,Asteraceae,Wyethia,Wyethia helenioides
105636951,1/26/22,2022-01-26 19:56:00 UTC,Pacific Time (US & Canada),research,https://www.inaturalist.org/observations/105636951,https://inaturalist-open-data.s3.amazonaws.com/photos/177285508/medium.jpeg,,1,0,FALSE,"Contra Costa County, CA, USA",37.8925685,-122.2311755,,,,Contra Costa,Silver Lupine,Lupinus albifrons,Silver Bush Lupine,Plantae,51691,Fabaceae,Lupinus,Lupinus albifrons
105637317,1/26/22,2022-01-26 20:41:00 UTC,Pacific Time (US & Canada),research,https://www.inaturalist.org/observations/105637317,https://inaturalist-open-data.s3.amazonaws.com/photos/177285930/medium.jpeg,,1,0,FALSE,"Contra Costa County, CA, USA",37.89920567,-122.250842,,,,Contra Costa,common chickweed,Stellaria media,common chickweed,Plantae,53298,Caryophyllaceae,Stellaria,Stellaria media
105637321,1/26/22,2022-01-26 21:02:00 UTC,Pacific Time (US & Canada),research,https://www.inaturalist.org/observations/105637321,https://inaturalist-open-data.s3.amazonaws.com/photos/177286407/medium.jpeg,,1,0,FALSE,"Contra Costa County, CA, USA",37.893658,-122.2492253,,,,Contra Costa,Oracle Oak,Quercus × morehus,Oracle Oak,Plantae,171031,Fagaceae,Quercus,
105637733,1/26/22,2022-01-26 14:36:15 UTC,UTC,research,https://www.inaturalist.org/observations/105637733,https://static.inaturalist.org/photos/177291607/medium.jpg,,1,0,FALSE,"Tilden Nature Area, Orinda, CA, US",37.91663667,-122.2532967,,,,Contra Costa,Red-flowering Currant,Ribes sanguineum,Red-flowering Currant,Plantae,53435,Grossulariaceae,Ribes,Ribes sanguineum
105642996,1/26/22,2022-01-26 09:51:01 UTC,UTC,research,https://www.inaturalist.org/observations/105642996,https://inaturalist-open-data.s3.amazonaws.com/photos/177298289/medium.jpg,,2,0,FALSE,"Tilden Regional Park, Orinda, CA, US",37.88206167,-122.2228167,,open,,Contra Costa,Western Leatherwood,Dirca occidentalis,Western Leatherwood,Plantae,50315,Thymelaeaceae,Dirca,Dirca occidentalis
105726780,1/28/22,2022-01-28 10:45:49 UTC,UTC,research,https://www.inaturalist.org/observations/105726780,https://static.inaturalist.org/photos/179333209/medium.jpg,,1,0,FALSE,"Tilden Regional Park, Orinda, CA, US",37.90654188,-122.2468582,,,,Contra Costa,Little-Robin,Geranium purpureum,Little-Robin,Plantae,57643,Geraniaceae,Geranium,Geranium purpureum
105749356,1/28/22,2022-01-29 00:41:09 UTC,Pacific Time (US & Canada),research,https://www.inaturalist.org/observations/105749356,https://static.inaturalist.org/photos/177504036/medium.jpg,,1,0,FALSE,"Tilden Nature Area, El Sobrante, CA, US",37.91822418,-122.263528,,,,Contra Costa,Coast Paintbrush,Castilleja affinis affinis,Coast Paintbrush,Plantae,50043,Orobanchaceae,Castilleja,Castilleja affinis
105755034,1/28/22,2022-01-29 00:00:14 UTC,Pacific Time (US & Canada),research,https://www.inaturalist.org/observations/105755034,https://static.inaturalist.org/photos/177514202/medium.jpg,,1,0,FALSE,"Tilden Nature Area, Orinda, CA, US",37.91258826,-122.2599457,,,,Contra Costa,broadleaf forget-me-not,Myosotis latifolia,broadleaf forget-me-not,Plantae,49132,Boraginaceae,Myosotis,Myosotis latifolia
105797036,1/29/22,2022-01-29 14:01:07 UTC,UTC,research,https://www.inaturalist.org/observations/105797036,https://static.inaturalist.org/photos/177739176/medium.jpg,,1,0,FALSE,"Tilden Regional Park, Orinda, CA, US",37.90667833,-122.2474883,,,,Contra Costa,herb Robert,Geranium robertianum,herb Robert,Plantae,55925,Geraniaceae,Geranium,Geranium robertianum
105797170,1/29/22,2022-01-29 13:49:21 UTC,UTC,research,https://www.inaturalist.org/observations/105797170,https://static.inaturalist.org/photos/177595138/medium.jpg,,2,0,FALSE,"Tilden Regional Park, Orinda, CA, US",37.91035833,-122.24945,,,,Contra Costa,California manroot,Marah fabacea,California manroot,Plantae,205330,Cucurbitaceae,Marah,Marah fabacea
105815180,1/29/22,2022-01-29 23:46:42 UTC,Pacific Time (US & Canada),research,https://www.inaturalist.org/observations/105815180,https://inaturalist-open-data.s3.amazonaws.com/photos/177630378/medium.jpeg,,1,0,FALSE,"Orinda, CA 94563, USA",37.8930378,-122.2325554,,,,Contra Costa,Diablo helianthella,Helianthella castanea,Mt. Diablo Helianthella,Plantae,64250,Asteraceae,Helianthella,Helianthella castanea
105815238,1/29/22,2022-01-30 00:25:19 UTC,Pacific Time (US & Canada),research,https://www.inaturalist.org/observations/105815238,https://inaturalist-open-data.s3.amazonaws.com/photos/177630416/medium.jpeg,,1,0,FALSE,"Berkeley, CA 94708, USA",37.8970087,-122.2401765,,,,Contra Costa,woodland strawberry,Fragaria vesca,woodland strawberry,Plantae,50298,Rosaceae,Fragaria,Fragaria vesca
105815342,1/29/22,2022-01-30 00:21:22 UTC,Pacific Time (US & Canada),research,https://www.inaturalist.org/observations/105815342,https://inaturalist-open-data.s3.amazonaws.com/photos/177630580/medium.jpeg,,1,0,FALSE,"Berkeley, CA 94708, USA",37.8957055,-122.2395258,,,,Contra Costa,hairy bittercress,Cardamine hirsuta,hairy bittercress,Plantae,55829,Brassicaceae,Cardamine,Cardamine hirsuta
105886807,1/30/22,2022-01-30 06:41:00 UTC,UTC,research,https://www.inaturalist.org/observations/105886807,https://inaturalist-open-data.s3.amazonaws.com/photos/177767790/medium.jpg,,1,0,FALSE,"Tilden Nature Area, Orinda, CA, US",37.91668,-122.25325,,,,Contra Costa,Red-flowering Currant,Ribes sanguineum,Red-flowering Currant,Plantae,53435,Grossulariaceae,Ribes,Ribes sanguineum
105889607,1/20/22,2022-01-20 17:03:09 UTC,UTC,research,https://www.inaturalist.org/observations/105889607,https://inaturalist-open-data.s3.amazonaws.com/photos/177772908/medium.jpg,,2,0,FALSE,"Tilden Regional Park, Orinda, CA, US",37.90472,-122.2595133,,,,Contra Costa,fuller's teasel,Dipsacus sativus,fuller's teasel,Plantae,53028,Caprifoliaceae,Dipsacus,Dipsacus sativus
105931527,1/29/22,2022-01-29 11:50:58 UTC,UTC,research,https://www.inaturalist.org/observations/105931527,https://static.inaturalist.org/photos/177882217/medium.jpg,,1,0,FALSE,"Tilden Nature Area, Orinda, CA, US",37.911975,-122.2580717,,,,Contra Costa,California beeplant,Scrophularia californica,California beeplant,Plantae,50812,Scrophulariaceae,Scrophularia,Scrophularia californica
105943751,1/31/22,2022-02-01 00:17:35 UTC,Pacific Time (US & Canada),research,https://www.inaturalist.org/observations/105943751,https://inaturalist-open-data.s3.amazonaws.com/photos/177877611/medium.jpeg,,1,0,FALSE,"Berkeley, CA 94708, USA",37.91820053,-122.2636781,,,,Contra Costa,fringed checkerbloom,Sidalcea diploscypha,fringed checkerbloom,Plantae,57139,Malvaceae,Sidalcea,Sidalcea diploscypha
105968381,1/31/22,2022-01-31 14:39:00 UTC,UTC,research,https://www.inaturalist.org/observations/105968381,https://inaturalist-open-data.s3.amazonaws.com/photos/177922414/medium.jpg,,1,0,FALSE,"Tilden Regional Park, Orinda, CA, US",37.89857833,-122.2419583,,,,Contra Costa,California manroot,Marah fabacea,California manroot,Plantae,205330,Cucurbitaceae,Marah,Marah fabacea
105968496,1/31/22,2022-01-31 14:07:13 UTC,UTC,research,https://www.inaturalist.org/observations/105968496,https://inaturalist-open-data.s3.amazonaws.com/photos/177922564/medium.jpg,,1,0,FALSE,"Tilden Regional Park, Orinda, CA, US",37.89404667,-122.2344667,,,,Contra Costa,Silver Lupine,Lupinus albifrons,Silver Bush Lupine,Plantae,51691,Fabaceae,Lupinus,Lupinus albifrons
105968540,1/31/22,2022-01-31 14:06:34 UTC,UTC,research,https://www.inaturalist.org/observations/105968540,https://inaturalist-open-data.s3.amazonaws.com/photos/177922635/medium.jpg,,1,0,FALSE,"Tilden Regional Park, Orinda, CA, US",37.89415833,-122.2345117,,,,Contra Costa,Hartweg's umbrellawort,Tauschia hartwegii,Hartweg's umbrellawort,Plantae,54948,Apiaceae,Tauschia,Tauschia hartwegii
106001952,2/1/22,2022-02-01 23:02:48 UTC,Eastern Time (US & Canada),research,https://www.inaturalist.org/observations/106001952,https://inaturalist-open-data.s3.amazonaws.com/photos/177983917/medium.jpg,,2,0,FALSE,"Tilden Regional Park, Orinda, CA, US",37.88356399,-122.2344881,,open,,Contra Costa,Western Leatherwood,Dirca occidentalis,Western Leatherwood,Plantae,50315,Thymelaeaceae,Dirca,Dirca occidentalis
106053035,2/2/22,2022-02-02 17:47:52 UTC,UTC,research,https://www.inaturalist.org/observations/106053035,https://static.inaturalist.org/photos/178080233/medium.jpg,,1,0,FALSE,"Tilden Regional Park, Orinda, CA, US",37.89233,-122.2300467,,,,Contra Costa,Silver Lupine,Lupinus albifrons,Silver Bush Lupine,Plantae,51691,Fabaceae,Lupinus,Lupinus albifrons
106053123,2/2/22,2022-02-02 16:44:07 UTC,UTC,research,https://www.inaturalist.org/observations/106053123,https://static.inaturalist.org/photos/178080304/medium.jpg,,1,0,FALSE,"Tilden Regional Park, Orinda, CA, US",37.89214667,-122.22867,,,,Contra Costa,Silver Lupine,Lupinus albifrons,Silver Bush Lupine,Plantae,51691,Fabaceae,Lupinus,Lupinus albifrons
106071852,1/31/22,2022-01-31 13:51:24 UTC,UTC,research,https://www.inaturalist.org/observations/106071852,https://inaturalist-open-data.s3.amazonaws.com/photos/178117702/medium.jpg,,1,0,FALSE,"Tilden Regional Park, Orinda, CA, US",37.89578667,-122.23687,,,,Contra Costa,poison hemlock,Conium maculatum,poison hemlock,Plantae,52998,Apiaceae,Conium,Conium maculatum
106071893,1/31/22,2022-01-31 13:47:36 UTC,UTC,research,https://www.inaturalist.org/observations/106071893,https://inaturalist-open-data.s3.amazonaws.com/photos/178117795/medium.jpg,,1,0,FALSE,"Tilden Regional Park, Orinda, CA, US",37.89695333,-122.237725,,,,Contra Costa,trailing blackberry,Rubus ursinus,trailing blackberry,Plantae,53445,Rosaceae,Rubus,Rubus ursinus
106071928,1/31/22,2022-01-31 13:46:48 UTC,UTC,research,https://www.inaturalist.org/observations/106071928,https://inaturalist-open-data.s3.amazonaws.com/photos/178117836/medium.jpg,,1,0,FALSE,"Tilden Regional Park, Orinda, CA, US",37.89710333,-122.2378167,,,,Contra Costa,common chickweed,Stellaria media,common chickweed,Plantae,53298,Caryophyllaceae,Stellaria,Stellaria media
106071950,1/31/22,2022-01-31 13:45:41 UTC,UTC,research,https://www.inaturalist.org/observations/106071950,https://inaturalist-open-data.s3.amazonaws.com/photos/178117901/medium.jpg,,1,0,FALSE,"Grizzly Peak Blvd, Orinda, CA, US",37.89723667,-122.2378533,,,,Contra Costa,miner's lettuce,Claytonia perfoliata,miner's lettuce,Plantae,52994,Montiaceae,Claytonia,Claytonia perfoliata
106072068,1/31/22,2022-01-31 13:42:44 UTC,UTC,research,https://www.inaturalist.org/observations/106072068,https://inaturalist-open-data.s3.amazonaws.com/photos/178118102/medium.jpg,,1,0,FALSE,"Tilden Regional Park, Orinda, CA, US",37.89794167,-122.2388617,,open,,Contra Costa,coffeeberry,Frangula californica,coffeeberry,Plantae,53423,Rhamnaceae,Frangula,Frangula californica
106072107,1/31/22,2022-01-31 13:42:20 UTC,UTC,research,https://www.inaturalist.org/observations/106072107,https://inaturalist-open-data.s3.amazonaws.com/photos/178118134/medium.jpg,,1,0,FALSE,"Grizzly Peak Blvd, Orinda, CA, US",37.89806667,-122.2388217,,,,Contra Costa,California mugwort,Artemisia douglasiana,California mugwort,Plantae,52854,Asteraceae,Artemisia,Artemisia douglasiana
106072121,1/31/22,2022-01-31 13:38:22 UTC,UTC,research,https://www.inaturalist.org/observations/106072121,https://inaturalist-open-data.s3.amazonaws.com/photos/178118182/medium.jpg,,1,0,FALSE,"Tilden Regional Park, Orinda, CA, US",37.89838333,-122.2400967,,,,Contra Costa,coyote brush,Baccharis pilularis,coyote brush,Plantae,53359,Asteraceae,Baccharis,Baccharis pilularis
106072167,1/31/22,2022-01-31 13:37:44 UTC,UTC,research,https://www.inaturalist.org/observations/106072167,https://inaturalist-open-data.s3.amazonaws.com/photos/178118343/medium.jpg,,1,0,FALSE,"Tilden Regional Park, Orinda, CA, US",37.89838333,-122.2400667,,,,Contra Costa,wavy-leafed soap plant,Chlorogalum pomeridianum,wavy-leafed soap plant,Plantae,47597,Asparagaceae,Chlorogalum,Chlorogalum pomeridianum
106072345,1/31/22,2022-01-31 13:33:32 UTC,UTC,research,https://www.inaturalist.org/observations/106072345,https://inaturalist-open-data.s3.amazonaws.com/photos/178118693/medium.jpg,,2,0,FALSE,"Tilden Regional Park, Orinda, CA, US",37.898145,-122.239945,,,,Contra Costa,California beeplant,Scrophularia californica,California beeplant,Plantae,50812,Scrophulariaceae,Scrophularia,Scrophularia californica
106103599,2/3/22,2022-02-03 22:01:46 UTC,Pacific Time (US & Canada),research,https://www.inaturalist.org/observations/106103599,https://static.inaturalist.org/photos/178178563/medium.jpg,,2,0,FALSE,"Tilden Regional Park, Orinda, CA, US",37.90229167,-122.2444083,,,,Contra Costa,broadleaf forget-me-not,Myosotis latifolia,broadleaf forget-me-not,Plantae,49132,Boraginaceae,Myosotis,Myosotis latifolia
106105747,2/3/22,2022-02-03 23:53:57 UTC,Pacific Time (US & Canada),research,https://www.inaturalist.org/observations/106105747,https://inaturalist-open-data.s3.amazonaws.com/photos/178182128/medium.jpeg,,1,0,FALSE,"Berkeley, CA 94708, USA",37.92006658,-122.2591065,,,,Contra Costa,Bermuda buttercup,Oxalis pes-caprae,Bermuda buttercup,Plantae,53169,Oxalidaceae,Oxalis,Oxalis pes-caprae
106106701,2/3/22,2022-02-03 21:59:49 UTC,Pacific Time (US & Canada),research,https://www.inaturalist.org/observations/106106701,https://inaturalist-open-data.s3.amazonaws.com/photos/178183600/medium.jpeg,,1,0,FALSE,"Berkeley, CA 94708, USA",37.91321732,-122.2642074,,,,Contra Costa,Pacific poison oak,Toxicodendron diversilobum,Pacific poison oak,Plantae,51080,Anacardiaceae,Toxicodendron,Toxicodendron diversilobum
106120054,2/3/22,2022-02-03 10:32:31 UTC,UTC,research,https://www.inaturalist.org/observations/106120054,https://inaturalist-open-data.s3.amazonaws.com/photos/178210012/medium.jpg,,1,0,FALSE,"Tilden Nature Area, Orinda, CA, US",37.91621167,-122.25998,,open,,Contra Costa,California buckeye,Aesculus californica,California buckeye,Plantae,53348,Sapindaceae,Aesculus,Aesculus californica
106120217,2/3/22,2022-02-03 10:06:28 UTC,UTC,research,https://www.inaturalist.org/observations/106120217,https://inaturalist-open-data.s3.amazonaws.com/photos/178210301/medium.jpg,,1,0,FALSE,"Tilden Nature Area, Orinda, CA, US",37.91816333,-122.2543117,,,,Contra Costa,fennel,Foeniculum vulgare,fennel,Plantae,53052,Apiaceae,Foeniculum,Foeniculum vulgare
106219959,2/5/22,2022-02-06 01:05:53 UTC,Pacific Time (US & Canada),research,https://www.inaturalist.org/observations/106219959,https://inaturalist-open-data.s3.amazonaws.com/photos/178401475/medium.jpeg,,1,0,FALSE,"Orinda, CA 94563, USA",37.89080147,-122.2263447,,,,Contra Costa,Blue Dicks,Dipterostemon capitatus,Blue Dicks,Plantae,1196784,Asparagaceae,Dipterostemon,Dipterostemon capitatus
106220018,2/5/22,2022-02-06 00:56:44 UTC,Pacific Time (US & Canada),research,https://www.inaturalist.org/observations/106220018,https://inaturalist-open-data.s3.amazonaws.com/photos/178401616/medium.jpeg,,2,0,FALSE,"El Toyonal, Orinda, CA 94563, USA",37.88676261,-122.2232023,,,,Contra Costa,coastal manroot,Marah oregana,coastal manroot,Plantae,77960,Cucurbitaceae,Marah,Marah oregana
106220100,2/5/22,2022-02-06 00:21:32 UTC,Pacific Time (US & Canada),research,https://www.inaturalist.org/observations/106220100,https://inaturalist-open-data.s3.amazonaws.com/photos/178401752/medium.jpeg,,2,0,FALSE,"Orinda, CA 94563, USA",37.88357567,-122.2344729,,open,,Contra Costa,Osoberry,Oemleria cerasiformis,Osoberry,Plantae,53419,Rosaceae,Oemleria,Oemleria cerasiformis
106221863,2/4/22,2022-02-04 16:13:10 UTC,UTC,research,https://www.inaturalist.org/observations/106221863,https://inaturalist-open-data.s3.amazonaws.com/photos/178405332/medium.jpg,,1,0,FALSE,"Tilden Nature Area, El Sobrante, CA, US",37.91817833,-122.263695,,,,Contra Costa,Dwarf Checkermallow,Sidalcea malviflora,Dwarf Checkermallow,Plantae,48795,Malvaceae,Sidalcea,Sidalcea malviflora
106228418,2/5/22,2022-02-05 14:26:08 UTC,UTC,research,https://www.inaturalist.org/observations/106228418,https://static.inaturalist.org/photos/178417359/medium.jpg,,1,0,FALSE,"Tilden Regional Park, Orinda, CA, US",37.88622167,-122.232475,,,,Contra Costa,eggleaf spurge,Euphorbia oblongata,eggleaf spurge,Plantae,77117,Euphorbiaceae,Euphorbia,Euphorbia oblongata
106271057,2/6/22,2022-02-06 14:20:34 UTC,UTC,research,https://www.inaturalist.org/observations/106271057,https://inaturalist-open-data.s3.amazonaws.com/photos/178808018/medium.jpeg,,1,0,FALSE,Orinda,37.88766479,-122.2258759,,,,Contra Costa,redmaids,Calandrinia menziesii,redmaids,Plantae,400267,Montiaceae,Calandrinia,Calandrinia menziesii
106287915,2/6/22,2022-02-06 18:04:03 UTC,Eastern Time (US & Canada),research,https://www.inaturalist.org/observations/106287915,https://inaturalist-open-data.s3.amazonaws.com/photos/178527281/medium.jpg,,3,0,FALSE,"California, US",37.90930757,-122.2673953,,open,,Contra Costa,Western Leatherwood,Dirca occidentalis,Western Leatherwood,Plantae,50315,Thymelaeaceae,Dirca,Dirca occidentalis
106288035,2/6/22,2022-02-06 18:43:33 UTC,Eastern Time (US & Canada),research,https://www.inaturalist.org/observations/106288035,https://inaturalist-open-data.s3.amazonaws.com/photos/178527485/medium.jpg,,1,0,FALSE,"Tilden Regional Park, Contra Costa County, US-CA, US",37.91787882,-122.2641661,,,,Contra Costa,orange bush monkeyflower,Diplacus aurantiacus,orange bush monkeyflower,Plantae,777371,Phrymaceae,Diplacus,Diplacus aurantiacus
106288052,2/6/22,2022-02-06 18:45:52 UTC,Eastern Time (US & Canada),research,https://www.inaturalist.org/observations/106288052,https://inaturalist-open-data.s3.amazonaws.com/photos/178527527/medium.jpg,,1,0,FALSE,"Tilden Regional Park, Contra Costa County, US-CA, US",37.9175223,-122.2634743,,,,Contra Costa,western blue-eyed grass,Sisyrinchium bellum,western blue-eyed grass,Plantae,49918,Iridaceae,Sisyrinchium,Sisyrinchium bellum
106288072,2/6/22,2022-02-06 18:46:37 UTC,Eastern Time (US & Canada),research,https://www.inaturalist.org/observations/106288072,https://inaturalist-open-data.s3.amazonaws.com/photos/178527571/medium.jpg,,1,0,FALSE,"Tilden Regional Park, Contra Costa County, US-CA, US",37.91755704,-122.263472,,,,Contra Costa,Blue Dicks,Dipterostemon capitatus,Blue Dicks,Plantae,1196784,Asparagaceae,Dipterostemon,Dipterostemon capitatus
106288085,2/6/22,2022-02-06 18:47:50 UTC,Eastern Time (US & Canada),research,https://www.inaturalist.org/observations/106288085,https://inaturalist-open-data.s3.amazonaws.com/photos/178527601/medium.jpg,,1,0,FALSE,"Tilden Regional Park, Contra Costa County, US-CA, US",37.91758138,-122.2635451,,open,,Contra Costa,Common Vetch,Vicia sativa,Common Vetch,Plantae,53324,Fabaceae,Vicia,Vicia sativa
106288142,2/6/22,2022-02-06 18:52:34 UTC,Eastern Time (US & Canada),research,https://www.inaturalist.org/observations/106288142,https://inaturalist-open-data.s3.amazonaws.com/photos/178527734/medium.jpg,,1,0,FALSE,"Tilden Regional Park, Contra Costa County, US-CA, US",37.91821429,-122.2636081,,,,Contra Costa,Dwarf Checkermallow,Sidalcea malviflora,Dwarf Checkermallow,Plantae,48795,Malvaceae,Sidalcea,Sidalcea malviflora
106288266,2/6/22,2022-02-06 19:51:36 UTC,Eastern Time (US & Canada),research,https://www.inaturalist.org/observations/106288266,https://inaturalist-open-data.s3.amazonaws.com/photos/178528028/medium.jpg,,1,0,FALSE,"Tilden Regional Park, Contra Costa County, US-CA, US",37.91608847,-122.257086,,,,Contra Costa,Red-flowering Currant,Ribes sanguineum,Red-flowering Currant,Plantae,53435,Grossulariaceae,Ribes,Ribes sanguineum
106290044,2/6/22,2022-02-06 22:13:58 UTC,Pacific Time (US & Canada),research,https://www.inaturalist.org/observations/106290044,https://static.inaturalist.org/photos/178531276/medium.jpg,,1,0,FALSE,"Tilden Nature Area, El Sobrante, CA, US",37.91743333,-122.263725,,,,Contra Costa,scarlet pimpernel,Lysimachia arvensis,scarlet pimpernel,Plantae,791928,Primulaceae,Lysimachia,Lysimachia arvensis
106290125,2/6/22,2022-02-06 22:44:03 UTC,Pacific Time (US & Canada),research,https://www.inaturalist.org/observations/106290125,https://static.inaturalist.org/photos/178531355/medium.jpg,,1,0,FALSE,"Tilden Regional Park, Orinda, CA, US",37.90550333,-122.2669917,,,,Contra Costa,milkmaids,Cardamine californica,milkmaids,Plantae,49651,Brassicaceae,Cardamine,Cardamine californica
106290504,2/6/22,2022-02-06 22:13:24 UTC,Pacific Time (US & Canada),research,https://www.inaturalist.org/observations/106290504,https://static.inaturalist.org/photos/178532168/medium.jpg,,1,0,FALSE,"Tilden Nature Area, El Sobrante, CA, US",37.91751167,-122.2634667,,,,Contra Costa,western blue-eyed grass,Sisyrinchium bellum,western blue-eyed grass,Plantae,49918,Iridaceae,Sisyrinchium,Sisyrinchium bellum
106318507,2/6/22,2022-02-06 09:51:30 UTC,UTC,research,https://www.inaturalist.org/observations/106318507,https://static.inaturalist.org/photos/178578107/medium.jpg,,2,0,FALSE,"Tilden Nature Area, El Sobrante, CA, US",37.91750833,-122.2634883,,,,Contra Costa,western blue-eyed grass,Sisyrinchium bellum,western blue-eyed grass,Plantae,49918,Iridaceae,Sisyrinchium,Sisyrinchium bellum
106371437,2/7/22,2022-02-08 00:23:24 UTC,Pacific Time (US & Canada),research,https://www.inaturalist.org/observations/106371437,https://inaturalist-open-data.s3.amazonaws.com/photos/178678249/medium.jpeg,,2,0,FALSE,"Lake Anza Trails, Lake Anza, California 94708, Berkeley, CA 94708, USA",37.89537306,-122.2489596,,,,Contra Costa,woodland strawberry,Fragaria vesca,woodland strawberry,Plantae,50298,Rosaceae,Fragaria,Fragaria vesca
106371441,2/7/22,2022-02-08 00:22:30 UTC,Pacific Time (US & Canada),research,https://www.inaturalist.org/observations/106371441,https://inaturalist-open-data.s3.amazonaws.com/photos/178678268/medium.jpeg,,1,0,FALSE,"Berkeley, CA 94708, USA",37.89574483,-122.249036,,,,Contra Costa,Common star lily,Toxicoscordion fremontii,Common star lily,Plantae,49649,Melanthiaceae,Toxicoscordion,Toxicoscordion fremontii
106393243,2/7/22,2022-02-08 00:01:00 UTC,Pacific Time (US & Canada),research,https://www.inaturalist.org/observations/106393243,https://inaturalist-open-data.s3.amazonaws.com/photos/178709107/medium.jpeg,,1,0,FALSE,"Tilden Regional Park, Contra Costa, California, United States",37.88074722,-122.2219611,,open,,Contra Costa,Western Leatherwood,Dirca occidentalis,Western Leatherwood,Plantae,50315,Thymelaeaceae,Dirca,Dirca occidentalis
106462436,2/9/22,2022-02-09 18:22:30 UTC,Pacific Time (US & Canada),research,https://www.inaturalist.org/observations/106462436,https://inaturalist-open-data.s3.amazonaws.com/photos/178845978/medium.jpeg,,1,0,FALSE,"Berkeley, CA 94708, USA",37.9174384,-122.263751,,,,Contra Costa,scarlet pimpernel,Lysimachia arvensis,scarlet pimpernel,Plantae,791928,Primulaceae,Lysimachia,Lysimachia arvensis
106462469,2/9/22,2022-02-09 18:28:30 UTC,Pacific Time (US & Canada),research,https://www.inaturalist.org/observations/106462469,https://inaturalist-open-data.s3.amazonaws.com/photos/178846003/medium.jpeg,,1,0,FALSE,"Berkeley, CA 94708, USA",37.9186425,-122.2634642,,,,Contra Costa,Silver Lupine,Lupinus albifrons,Silver Bush Lupine,Plantae,51691,Fabaceae,Lupinus,Lupinus albifrons
106462495,2/9/22,2022-02-09 19:10:29 UTC,Pacific Time (US & Canada),research,https://www.inaturalist.org/observations/106462495,https://inaturalist-open-data.s3.amazonaws.com/photos/178846043/medium.jpeg,,1,0,FALSE,"Berkeley, CA 94708, USA",37.9167519,-122.2532601,,,,Contra Costa,Bicolor Cobra Lily,Chasmanthe bicolor,Bicolor Cobra Lily,Plantae,59948,Iridaceae,Chasmanthe,Chasmanthe bicolor
106462511,2/9/22,2022-02-09 19:26:54 UTC,Pacific Time (US & Canada),research,https://www.inaturalist.org/observations/106462511,https://inaturalist-open-data.s3.amazonaws.com/photos/178846086/medium.jpeg,,1,0,FALSE,"Berkeley, CA 94708, USA",37.9107772,-122.2494327,,,,Contra Costa,Dwarf Checkermallow,Sidalcea malviflora,Dwarf Checkermallow,Plantae,48795,Malvaceae,Sidalcea,Sidalcea malviflora
106462854,2/9/22,2022-02-09 19:34:21 UTC,Pacific Time (US & Canada),research,https://www.inaturalist.org/observations/106462854,https://inaturalist-open-data.s3.amazonaws.com/photos/178846754/medium.jpeg,,1,0,FALSE,"Berkeley, CA 94708, USA",37.9063774,-122.2474159,,,,Contra Costa,California manroot,Marah fabacea,California manroot,Plantae,205330,Cucurbitaceae,Marah,Marah fabacea
106468841,2/9/22,2022-02-09 18:26:37 UTC,Pacific Time (US & Canada),research,https://www.inaturalist.org/observations/106468841,https://inaturalist-open-data.s3.amazonaws.com/photos/178857821/medium.jpeg,,1,0,FALSE,"Berkeley, CA 94708, USA",37.918168,-122.263715,,,,Contra Costa,Coast Paintbrush,Castilleja affinis affinis,Coast Paintbrush,Plantae,50043,Orobanchaceae,Castilleja,Castilleja affinis
106469265,2/9/22,2022-02-09 19:26:54 UTC,Pacific Time (US & Canada),research,https://www.inaturalist.org/observations/106469265,https://inaturalist-open-data.s3.amazonaws.com/photos/178858802/medium.jpeg,,1,0,FALSE,"Berkeley, CA 94708, USA",37.9107772,-122.2494327,,,,Contra Costa,Dwarf Checkermallow,Sidalcea malviflora,Dwarf Checkermallow,Plantae,48795,Malvaceae,Sidalcea,Sidalcea malviflora
106472293,2/9/22,2022-02-10 01:34:35 UTC,Pacific Time (US & Canada),research,https://www.inaturalist.org/observations/106472293,https://static.inaturalist.org/photos/178864766/medium.jpg,,1,0,FALSE,"Tilden Nature Area, Orinda, CA, US",37.9109191,-122.2573391,,,,Contra Costa,Pacific hound's tongue,Adelinia grande,Pacific hound's tongue,Plantae,769151,Boraginaceae,Adelinia,Adelinia grande
106479981,2/9/22,2022-02-09 17:15:51 UTC,UTC,research,https://www.inaturalist.org/observations/106479981,https://static.inaturalist.org/photos/178878814/medium.jpg,,1,0,FALSE,"Tilden Regional Park, Orinda, CA, US",37.898405,-122.2402117,,,,Contra Costa,coastal manroot,Marah oregana,coastal manroot,Plantae,77960,Cucurbitaceae,Marah,Marah oregana
106480023,2/9/22,2022-02-09 16:08:11 UTC,UTC,research,https://www.inaturalist.org/observations/106480023,https://static.inaturalist.org/photos/178878926/medium.jpg,,1,0,FALSE,"Tilden Regional Park, Orinda, CA, US",37.88478,-122.2252283,,,,Contra Costa,California poppy,Eschscholzia californica,California poppy,Plantae,48225,Papaveraceae,Eschscholzia,Eschscholzia californica
106480052,2/9/22,2022-02-09 16:01:34 UTC,UTC,research,https://www.inaturalist.org/observations/106480052,https://static.inaturalist.org/photos/178878988/medium.jpg,,1,0,FALSE,"Tilden Regional Park, Orinda, CA, US",37.88351167,-122.2245033,,,,Contra Costa,French broom,Genista monspessulana,French broom,Plantae,53403,Fabaceae,Genista,Genista monspessulana
106480314,2/9/22,2022-02-09 16:33:22 UTC,UTC,research,https://www.inaturalist.org/observations/106480314,https://static.inaturalist.org/photos/178879493/medium.jpg,…capiatus?,1,0,FALSE,"Tilden Regional Park, Orinda, CA, US",37.88911333,-122.2244633,,,,Contra Costa,Blue Dicks,Dipterostemon capitatus,Blue Dicks,Plantae,1196784,Asparagaceae,Dipterostemon,Dipterostemon capitatus
106563121,2/11/22,2022-02-11 11:16:46 UTC,UTC,research,https://www.inaturalist.org/observations/106563121,https://static.inaturalist.org/photos/179036007/medium.jpg,,2,0,FALSE,"Tilden Regional Park, Orinda, CA, US",37.88352176,-122.2355091,,open,,Contra Costa,Osoberry,Oemleria cerasiformis,Osoberry,Plantae,53419,Rosaceae,Oemleria,Oemleria cerasiformis
106573637,2/11/22,2022-02-11 14:48:35 UTC,UTC,research,https://www.inaturalist.org/observations/106573637,https://static.inaturalist.org/photos/179056934/medium.jpg,,2,0,FALSE,"Tilden Regional Park, Orinda, CA, US",37.908355,-122.247345,,,,Contra Costa,wavy-leafed soap plant,Chlorogalum pomeridianum,wavy-leafed soap plant,Plantae,47597,Asparagaceae,Chlorogalum,Chlorogalum pomeridianum
106573831,2/11/22,2022-02-11 14:48:07 UTC,UTC,research,https://www.inaturalist.org/observations/106573831,https://static.inaturalist.org/photos/179057232/medium.jpg,,1,0,FALSE,"Tilden Regional Park, Orinda, CA, US",37.90831167,-122.2473217,,,,Contra Costa,California manroot,Marah fabacea,California manroot,Plantae,205330,Cucurbitaceae,Marah,Marah fabacea
106575102,2/11/22,2022-02-11 15:16:30 UTC,UTC,research,https://www.inaturalist.org/observations/106575102,https://static.inaturalist.org/photos/179059855/medium.jpg,,2,0,FALSE,"Tilden Regional Park, Orinda, CA, US",37.90856667,-122.2473967,,,,Contra Costa,wavy-leafed soap plant,Chlorogalum pomeridianum,wavy-leafed soap plant,Plantae,47597,Asparagaceae,Chlorogalum,Chlorogalum pomeridianum
106600034,2/11/22,2022-02-11 16:41:21 UTC,UTC,research,https://www.inaturalist.org/observations/106600034,https://inaturalist-open-data.s3.amazonaws.com/photos/179107305/medium.jpg,,1,0,FALSE,"Tilden Regional Park, Orinda, CA, US",37.89569667,-122.2369833,,open,,Contra Costa,Common Vetch,Vicia sativa,Common Vetch,Plantae,53324,Fabaceae,Vicia,Vicia sativa
106611640,2/6/22,2022-02-06 15:39:05 UTC,UTC,research,https://www.inaturalist.org/observations/106611640,https://static.inaturalist.org/photos/179130196/medium.jpg,,3,0,FALSE,"Tilden Nature Area, Orinda, CA, US",37.91484167,-122.259575,,open,,Contra Costa,giant wakerobin,Trillium chloropetalum,giant wakerobin,Plantae,50823,Melanthiaceae,Trillium,Trillium chloropetalum
106695030,2/13/22,2022-02-13 03:23:43 UTC,UTC,research,https://www.inaturalist.org/observations/106695030,https://inaturalist-open-data.s3.amazonaws.com/photos/179313939/medium.jpg,,1,0,FALSE,"Tilden Nature Area, Kensington, CA, US",37.91004167,-122.267325,,,,Contra Costa,Italian arum,Arum italicum,Italian arum,Plantae,61168,Araceae,Arum,Arum italicum
106702574,2/13/22,2022-02-13 21:19:33 UTC,Pacific Time (US & Canada),research,https://www.inaturalist.org/observations/106702574,https://inaturalist-open-data.s3.amazonaws.com/photos/179303849/medium.jpeg,,3,0,FALSE,"Orinda, CA 94563, USA",37.88103048,-122.2220132,,open,,Contra Costa,Western Leatherwood,Dirca occidentalis,Western Leatherwood,Plantae,50315,Thymelaeaceae,Dirca,Dirca occidentalis
106703526,2/13/22,2022-02-13 13:29:29 UTC,UTC,research,https://www.inaturalist.org/observations/106703526,https://inaturalist-open-data.s3.amazonaws.com/photos/179305433/medium.jpg,,1,0,FALSE,"Tilden Regional Park, Orinda, CA, US",37.90678,-122.2574467,,,,Contra Costa,fuller's teasel,Dipsacus sativus,fuller's teasel,Plantae,53028,Caprifoliaceae,Dipsacus,Dipsacus sativus
106705661,2/13/22,2022-02-13 10:14:26 UTC,UTC,research,https://www.inaturalist.org/observations/106705661,https://inaturalist-open-data.s3.amazonaws.com/photos/179309439/medium.jpg,,1,0,FALSE,"Tilden Regional Park, Orinda, CA, US",37.887455,-122.2237467,,,,Contra Costa,California manroot,Marah fabacea,California manroot,Plantae,205330,Cucurbitaceae,Marah,Marah fabacea
106707871,2/13/22,2022-02-13 12:22:19 UTC,UTC,research,https://www.inaturalist.org/observations/106707871,https://inaturalist-open-data.s3.amazonaws.com/photos/179314178/medium.jpg,,1,0,FALSE,"Tilden Nature Area, El Sobrante, CA, US",37.91816333,-122.26368,,,,Contra Costa,Dwarf Checkermallow,Sidalcea malviflora,Dwarf Checkermallow,Plantae,48795,Malvaceae,Sidalcea,Sidalcea malviflora
106708023,2/13/22,2022-02-13 12:10:46 UTC,UTC,research,https://www.inaturalist.org/observations/106708023,https://inaturalist-open-data.s3.amazonaws.com/photos/179314353/medium.jpg,,1,0,FALSE,"Tilden Nature Area, Orinda, CA, US",37.91677833,-122.264245,,,,Contra Costa,cardo de huerta,Cynara cardunculus,Artichoke Thistle,Plantae,57563,Asteraceae,Cynara,Cynara cardunculus
106755145,2/13/22,2022-02-13 10:26:41 UTC,UTC,research,https://www.inaturalist.org/observations/106755145,https://inaturalist-open-data.s3.amazonaws.com/photos/179406878/medium.jpg,,1,0,FALSE,"Tilden Regional Park, Orinda, CA, US",37.889625,-122.2249617,,,,Contra Costa,Pacific pea,Lathyrus vestitus,Pacific pea,Plantae,50320,Fabaceae,Lathyrus,Lathyrus vestitus
106755178,2/13/22,2022-02-13 11:02:56 UTC,UTC,research,https://www.inaturalist.org/observations/106755178,https://inaturalist-open-data.s3.amazonaws.com/photos/179407307/medium.jpg,,1,0,FALSE,"Tilden Regional Park, Orinda, CA, US",37.89398833,-122.2338033,,,,Contra Costa,Coast Paintbrush,Castilleja affinis,Coast Paintbrush,Plantae,50042,Orobanchaceae,Castilleja,Castilleja affinis
106755574,2/13/22,2022-02-13 10:21:09 UTC,UTC,research,https://www.inaturalist.org/observations/106755574,https://inaturalist-open-data.s3.amazonaws.com/photos/179408002/medium.jpg,,1,0,FALSE,"Tilden Regional Park, Orinda, CA, US",37.88908,-122.2243633,,,,Contra Costa,California poppy,Eschscholzia californica,California poppy,Plantae,48225,Papaveraceae,Eschscholzia,Eschscholzia californica
106756016,2/13/22,2022-02-13 10:55:10 UTC,UTC,research,https://www.inaturalist.org/observations/106756016,https://inaturalist-open-data.s3.amazonaws.com/photos/179409203/medium.jpg,,1,0,FALSE,"Tilden Regional Park, Orinda, CA, US",37.89306667,-122.2325883,,,,Contra Costa,Diablo helianthella,Helianthella castanea,Mt. Diablo Helianthella,Plantae,64250,Asteraceae,Helianthella,Helianthella castanea
106756275,2/13/22,2022-02-13 10:09:12 UTC,UTC,research,https://www.inaturalist.org/observations/106756275,https://inaturalist-open-data.s3.amazonaws.com/photos/179409331/medium.jpg,,1,0,FALSE,"Tilden Regional Park, Orinda, CA, US",37.886495,-122.2231617,,,,Contra Costa,Gray Mule-Ears,Wyethia helenioides,Gray Mule-Ears,Plantae,50799,Asteraceae,Wyethia,Wyethia helenioides
106756375,2/13/22,2022-02-13 11:52:36 UTC,UTC,research,https://www.inaturalist.org/observations/106756375,https://inaturalist-open-data.s3.amazonaws.com/photos/179409599/medium.jpg,,1,0,FALSE,"Tilden Regional Park, Orinda, CA, US",37.89426167,-122.2390217,,,,Contra Costa,Fuchsiaflower Gooseberry,Ribes speciosum,Fuchsiaflower Gooseberry,Plantae,50824,Grossulariaceae,Ribes,Ribes speciosum
106812338,2/15/22,2022-02-15 19:30:43 UTC,Pacific Time (US & Canada),research,https://www.inaturalist.org/observations/106812338,https://static.inaturalist.org/photos/179516666/medium.jpg,,1,0,FALSE,"Tilden Regional Park, Orinda, CA, US",37.90386152,-122.2586771,,,,Contra Costa,Red-flowering Currant,Ribes sanguineum,Red-flowering Currant,Plantae,53435,Grossulariaceae,Ribes,Ribes sanguineum
106837389,2/15/22,2022-02-16 01:43:42 UTC,Pacific Time (US & Canada),research,https://www.inaturalist.org/observations/106837389,https://inaturalist-open-data.s3.amazonaws.com/photos/179563841/medium.jpg,,3,0,FALSE,"Tilden Regional Park, Orinda, CA, US",37.88202744,-122.222819,,open,,Contra Costa,Western Leatherwood,Dirca occidentalis,Western Leatherwood,Plantae,50315,Thymelaeaceae,Dirca,Dirca occidentalis
106895430,2/13/22,2022-02-13 20:00:21 UTC,Pacific Time (US & Canada),research,https://www.inaturalist.org/observations/106895430,https://static.inaturalist.org/photos/179675519/medium.jpg,,2,0,FALSE,"Tilden Regional Park, Orinda, CA, US",37.89547242,-122.25116,,,,Contra Costa,common daisy,Bellis perennis,common daisy,Plantae,55563,Asteraceae,Bellis,Bellis perennis
106935389,2/17/22,2022-02-17 17:27:40 UTC,Pacific Time (US & Canada),research,https://www.inaturalist.org/observations/106935389,https://static.inaturalist.org/photos/179752318/medium.jpg,,2,0,FALSE,"Tilden Regional Park, Contra Costa County, US-CA, US",37.9114952,-122.2642025,,open,,Contra Costa,giant wakerobin,Trillium chloropetalum,giant wakerobin,Plantae,50823,Melanthiaceae,Trillium,Trillium chloropetalum
106935450,2/17/22,2022-02-17 17:32:03 UTC,Pacific Time (US & Canada),research,https://www.inaturalist.org/observations/106935450,https://static.inaturalist.org/photos/179752329/medium.jpg,,3,1,FALSE,"Tilden Regional Park, Contra Costa County, US-CA, US",37.90980276,-122.2654036,,,,Contra Costa,redwood sorrel,Oxalis oregana,redwood sorrel,Plantae,47757,Oxalidaceae,Oxalis,Oxalis oregana
106947214,2/17/22,2022-02-17 19:52:06 UTC,Pacific Time (US & Canada),research,https://www.inaturalist.org/observations/106947214,https://inaturalist-open-data.s3.amazonaws.com/photos/179772314/medium.jpeg,,1,0,FALSE,"Berkeley, CA 94708, USA",37.9057074,-122.2476408,,,,Contra Costa,Dwarf Checkermallow,Sidalcea malviflora,Dwarf Checkermallow,Plantae,48795,Malvaceae,Sidalcea,Sidalcea malviflora
106975927,2/17/22,2022-02-17 21:38:33 UTC,Pacific Time (US & Canada),research,https://www.inaturalist.org/observations/106975927,https://inaturalist-open-data.s3.amazonaws.com/photos/179827474/medium.jpg,,1,0,FALSE,"Tilden Regional Park, Orinda, CA, US",37.90986667,-122.2483583,,,,Contra Costa,western blue-eyed grass,Sisyrinchium bellum,western blue-eyed grass,Plantae,49918,Iridaceae,Sisyrinchium,Sisyrinchium bellum
106976092,2/17/22,2022-02-17 21:43:37 UTC,Pacific Time (US & Canada),research,https://www.inaturalist.org/observations/106976092,https://inaturalist-open-data.s3.amazonaws.com/photos/179827713/medium.jpg,,1,0,FALSE,"Tilden Regional Park, Orinda, CA, US",37.91076333,-122.2494583,,,,Contra Costa,Dwarf Checkermallow,Sidalcea malviflora,Dwarf Checkermallow,Plantae,48795,Malvaceae,Sidalcea,Sidalcea malviflora
106976161,2/17/22,2022-02-17 21:45:28 UTC,Pacific Time (US & Canada),research,https://www.inaturalist.org/observations/106976161,https://inaturalist-open-data.s3.amazonaws.com/photos/179827845/medium.jpg,,1,0,FALSE,"Tilden Regional Park, Orinda, CA, US",37.910795,-122.2494667,,,,Contra Costa,Blue Dicks,Dipterostemon capitatus,Blue Dicks,Plantae,1196784,Asparagaceae,Dipterostemon,Dipterostemon capitatus
106976372,2/17/22,2022-02-17 22:13:21 UTC,Pacific Time (US & Canada),research,https://www.inaturalist.org/observations/106976372,https://inaturalist-open-data.s3.amazonaws.com/photos/179828154/medium.jpg,,1,0,FALSE,"Nimitz Way, Orinda, CA, US",37.91215833,-122.2528133,,,,Contra Costa,Chasmanthe bicolor,Chasmanthe bicolor,Bicolor Cobra Lily,Plantae,59948,Iridaceae,Chasmanthe,Chasmanthe bicolor
106991941,2/16/22,2022-02-16 23:30:02 UTC,Pacific Time (US & Canada),research,https://www.inaturalist.org/observations/106991941,https://inaturalist-open-data.s3.amazonaws.com/photos/179858919/medium.jpg,,1,0,FALSE,"Tilden Regional Park, Orinda, CA, US",37.893295,-122.243745,,,,Contra Costa,woodland strawberry,Fragaria vesca,woodland strawberry,Plantae,50298,Rosaceae,Fragaria,Fragaria vesca
106992767,2/18/22,2022-02-18 20:43:14 UTC,Pacific Time (US & Canada),research,https://www.inaturalist.org/observations/106992767,https://inaturalist-open-data.s3.amazonaws.com/photos/179860750/medium.jpg,,2,0,FALSE,"Tilden Nature Area, Orinda, CA, US",37.91263429,-122.2686171,,,,Contra Costa,Bermuda buttercup,Oxalis pes-caprae,Bermuda buttercup,Plantae,53169,Oxalidaceae,Oxalis,Oxalis pes-caprae
106994547,2/18/22,2022-02-18 21:03:51 UTC,Pacific Time (US & Canada),research,https://www.inaturalist.org/observations/106994547,https://inaturalist-open-data.s3.amazonaws.com/photos/179863636/medium.jpg,,2,0,FALSE,"Tilden Nature Area, Orinda, CA, US",37.91604148,-122.2661607,,,,Contra Costa,poison hemlock,Conium maculatum,poison hemlock,Plantae,52998,Apiaceae,Conium,Conium maculatum
106994916,2/18/22,2022-02-18 21:12:54 UTC,Pacific Time (US & Canada),research,https://www.inaturalist.org/observations/106994916,https://inaturalist-open-data.s3.amazonaws.com/photos/179864257/medium.jpg,,1,0,FALSE,"Tilden Nature Area, Orinda, CA, US",37.91685427,-122.2639727,,,,Contra Costa,scarlet pimpernel,Lysimachia arvensis,scarlet pimpernel,Plantae,791928,Primulaceae,Lysimachia,Lysimachia arvensis
106994961,2/18/22,2022-02-18 21:17:55 UTC,Pacific Time (US & Canada),research,https://www.inaturalist.org/observations/106994961,https://inaturalist-open-data.s3.amazonaws.com/photos/179864309/medium.jpg,,2,0,FALSE,"Tilden Nature Area, El Sobrante, CA, US",37.91751913,-122.2634615,,,,Contra Costa,western blue-eyed grass,Sisyrinchium bellum,western blue-eyed grass,Plantae,49918,Iridaceae,Sisyrinchium,Sisyrinchium bellum
106995108,2/18/22,2022-02-18 21:21:51 UTC,Pacific Time (US & Canada),research,https://www.inaturalist.org/observations/106995108,https://inaturalist-open-data.s3.amazonaws.com/photos/179864521/medium.jpg,,2,0,FALSE,"Tilden Nature Area, El Sobrante, CA, US",37.91802645,-122.2636951,,,,Contra Costa,Redstem Stork's-bill,Erodium cicutarium,Redstem Stork's-bill,Plantae,47687,Geraniaceae,Erodium,Erodium cicutarium
107006225,2/18/22,2022-02-18 23:45:41 UTC,Pacific Time (US & Canada),research,https://www.inaturalist.org/observations/107006225,https://inaturalist-open-data.s3.amazonaws.com/photos/179885739/medium.jpg,,1,0,FALSE,"Tilden Regional Park, Orinda, CA, US",37.89400321,-122.2502667,,open,,Contra Costa,giant wakerobin,Trillium chloropetalum,giant wakerobin,Plantae,50823,Melanthiaceae,Trillium,Trillium chloropetalum
107077966,2/19/22,2022-02-20 00:21:33 UTC,Pacific Time (US & Canada),research,https://www.inaturalist.org/observations/107077966,https://inaturalist-open-data.s3.amazonaws.com/photos/180020885/medium.jpg,,3,0,FALSE,"Tilden Nature Area, Kensington, CA, US",37.90878667,-122.2652967,,open,,Contra Costa,Trillium chloropetalum giganteum,Trillium chloropetalum giganteum,,Plantae,243295,Melanthiaceae,Trillium,Trillium chloropetalum
107092267,2/19/22,2022-02-19 22:47:53 UTC,Pacific Time (US & Canada),research,https://www.inaturalist.org/observations/107092267,https://static.inaturalist.org/photos/180047693/medium.jpeg,,2,0,FALSE,"Kensington, CA, USA",37.91013611,-122.2680444,,open,,Contra Costa,giant wakerobin,Trillium chloropetalum,giant wakerobin,Plantae,50823,Melanthiaceae,Trillium,Trillium chloropetalum
107131112,2/20/22,2022-02-20 20:02:00 UTC,Pacific Time (US & Canada),research,https://www.inaturalist.org/observations/107131112,https://static.inaturalist.org/photos/180119258/medium.png,,1,0,FALSE,"Contra Costa County, CA, USA",37.89491379,-122.2463197,,,,Contra Costa,crevice alumroot,Heuchera micrantha,crevice alumroot,Plantae,51274,Saxifragaceae,Heuchera,Heuchera micrantha
107131113,2/20/22,2022-02-20 20:02:00 UTC,Pacific Time (US & Canada),research,https://www.inaturalist.org/observations/107131113,https://static.inaturalist.org/photos/180119260/medium.png,,1,0,FALSE,"Contra Costa County, CA, USA",37.89491379,-122.2463197,,open,,Contra Costa,Bush Poppy,Dendromecon rigida,Bush Poppy,Plantae,58224,Papaveraceae,Dendromecon,Dendromecon rigida
107131116,2/20/22,2022-02-20 20:02:00 UTC,Pacific Time (US & Canada),research,https://www.inaturalist.org/observations/107131116,https://static.inaturalist.org/photos/180119280/medium.png,,1,0,FALSE,"Contra Costa County, CA, USA",37.89491379,-122.2463197,,,,Contra Costa,Pacific hound's tongue,Adelinia grande,Pacific hound's tongue,Plantae,769151,Boraginaceae,Adelinia,Adelinia grande
107131119,2/20/22,2022-02-20 20:02:00 UTC,Pacific Time (US & Canada),research,https://www.inaturalist.org/observations/107131119,https://static.inaturalist.org/photos/180119310/medium.png,,2,0,FALSE,"Contra Costa County, CA, USA",37.89491379,-122.2463197,,open,,Contra Costa,giant wakerobin,Trillium chloropetalum,giant wakerobin,Plantae,50823,Melanthiaceae,Trillium,Trillium chloropetalum
107131123,2/20/22,2022-02-20 20:02:00 UTC,Pacific Time (US & Canada),research,https://www.inaturalist.org/observations/107131123,https://static.inaturalist.org/photos/180119356/medium.png,,1,0,FALSE,"Contra Costa County, CA, USA",37.89491379,-122.2463197,,open,,Contra Costa,European holly,Ilex aquifolium,European holly,Plantae,53856,Aquifoliaceae,Ilex,Ilex aquifolium
107131128,2/20/22,2022-02-20 20:02:00 UTC,Pacific Time (US & Canada),research,https://www.inaturalist.org/observations/107131128,https://static.inaturalist.org/photos/180119421/medium.png,,2,0,FALSE,"Contra Costa County, CA, USA",37.89491379,-122.2463197,,open,,Contra Costa,giant wakerobin,Trillium chloropetalum,giant wakerobin,Plantae,50823,Melanthiaceae,Trillium,Trillium chloropetalum
107131131,2/20/22,2022-02-20 20:02:00 UTC,Pacific Time (US & Canada),research,https://www.inaturalist.org/observations/107131131,https://static.inaturalist.org/photos/180119441/medium.png,,1,0,FALSE,"Contra Costa County, CA, USA",37.89491379,-122.2463197,,,,Contra Costa,California poppy,Eschscholzia californica,California poppy,Plantae,48225,Papaveraceae,Eschscholzia,Eschscholzia californica
107131132,2/20/22,2022-02-20 20:02:00 UTC,Pacific Time (US & Canada),research,https://www.inaturalist.org/observations/107131132,https://static.inaturalist.org/photos/180119445/medium.png,,1,0,FALSE,"Contra Costa County, CA, USA",37.89491379,-122.2463197,,,,Contra Costa,Pacific hound's tongue,Adelinia grande,Pacific hound's tongue,Plantae,769151,Boraginaceae,Adelinia,Adelinia grande
107131141,2/20/22,2022-02-20 20:02:00 UTC,Pacific Time (US & Canada),research,https://www.inaturalist.org/observations/107131141,https://static.inaturalist.org/photos/180119581/medium.png,,1,0,FALSE,"Contra Costa County, CA, USA",37.89491379,-122.2463197,,,,Contra Costa,Pacific hound's tongue,Adelinia grande,Pacific hound's tongue,Plantae,769151,Boraginaceae,Adelinia,Adelinia grande
107131142,2/20/22,2022-02-20 20:02:00 UTC,Pacific Time (US & Canada),research,https://www.inaturalist.org/observations/107131142,https://static.inaturalist.org/photos/180119591/medium.png,,1,0,FALSE,"Contra Costa County, CA, USA",37.89491379,-122.2463197,,,,Contra Costa,Padre's Shooting Star,Primula clevelandii,Padre's Shooting Star,Plantae,486971,Primulaceae,Primula,Primula clevelandii
107131150,2/20/22,2022-02-20 20:02:00 UTC,Pacific Time (US & Canada),research,https://www.inaturalist.org/observations/107131150,https://static.inaturalist.org/photos/180119660/medium.png,,1,0,FALSE,"Contra Costa County, CA, USA",37.89491379,-122.2463197,,,,Contra Costa,woodland strawberry,Fragaria vesca,woodland strawberry,Plantae,50298,Rosaceae,Fragaria,Fragaria vesca
107131190,2/20/22,2022-02-20 20:02:00 UTC,Pacific Time (US & Canada),research,https://www.inaturalist.org/observations/107131190,https://static.inaturalist.org/photos/180120141/medium.png,,1,0,FALSE,"Contra Costa County, CA, USA",37.89491379,-122.2463197,,,,Contra Costa,broadleaf forget-me-not,Myosotis latifolia,broadleaf forget-me-not,Plantae,49132,Boraginaceae,Myosotis,Myosotis latifolia
107132583,2/8/22,2022-02-08 19:56:34 UTC,Pacific Time (US & Canada),research,https://www.inaturalist.org/observations/107132583,https://static.inaturalist.org/photos/180123595/medium.jpg,,1,0,FALSE,"Nimitz Way, Orinda, CA, US",37.91172,-122.25308,,,,Contra Costa,,Dipterostemon capitatus,Blue Dicks,Plantae,1196784,Asparagaceae,Dipterostemon,Dipterostemon capitatus
107141824,2/20/22,2022-02-20 20:03:30 UTC,Pacific Time (US & Canada),research,https://www.inaturalist.org/observations/107141824,https://inaturalist-open-data.s3.amazonaws.com/photos/180140826/medium.jpg,,1,0,FALSE,"Tilden Regional Park, Orinda, CA, US",37.89453667,-122.2434383,,,,Contra Costa,Blue Dicks,Dipterostemon capitatus,Blue Dicks,Plantae,1196784,Asparagaceae,Dipterostemon,Dipterostemon capitatus
107231116,2/21/22,2022-02-21 22:54:07 UTC,Pacific Time (US & Canada),research,https://www.inaturalist.org/observations/107231116,https://inaturalist-open-data.s3.amazonaws.com/photos/180308569/medium.jpg,,1,0,FALSE,"Tilden Regional Park, Orinda, CA, US",37.88023327,-122.2258021,,,,Contra Costa,coyote brush,Baccharis pilularis,coyote brush,Plantae,53359,Asteraceae,Baccharis,Baccharis pilularis
107231226,2/21/22,2022-02-22 00:00:18 UTC,Pacific Time (US & Canada),research,https://www.inaturalist.org/observations/107231226,https://inaturalist-open-data.s3.amazonaws.com/photos/180308789/medium.jpeg,,1,0,FALSE,"Kensington, CA, USA",37.9082234,-122.2657467,,,,Contra Costa,Pacific hound's tongue,Adelinia grande,Pacific hound's tongue,Plantae,769151,Boraginaceae,Adelinia,Adelinia grande
107231250,2/21/22,2022-02-21 22:57:52 UTC,Pacific Time (US & Canada),research,https://www.inaturalist.org/observations/107231250,https://inaturalist-open-data.s3.amazonaws.com/photos/180308845/medium.jpg,,1,0,FALSE,"Tilden Regional Park, Orinda, CA, US",37.88095978,-122.2257362,,,,Contra Costa,wavy-leafed soap plant,Chlorogalum pomeridianum,wavy-leafed soap plant,Plantae,47597,Asparagaceae,Chlorogalum,Chlorogalum pomeridianum
107231263,2/21/22,2022-02-22 00:05:30 UTC,Pacific Time (US & Canada),research,https://www.inaturalist.org/observations/107231263,https://inaturalist-open-data.s3.amazonaws.com/photos/180308862/medium.jpeg,,2,0,FALSE,"Kensington, CA, USA",37.9104752,-122.2681996,,open,,Contra Costa,giant wakerobin,Trillium chloropetalum,giant wakerobin,Plantae,50823,Melanthiaceae,Trillium,Trillium chloropetalum
107231314,2/21/22,2022-02-22 00:21:00 UTC,Pacific Time (US & Canada),research,https://www.inaturalist.org/observations/107231314,https://inaturalist-open-data.s3.amazonaws.com/photos/180308985/medium.jpeg,,1,0,FALSE,"Berkeley, CA 94708, USA",37.9130553,-122.265539,,,,Contra Costa,Pacific poison oak,Toxicodendron diversilobum,Pacific poison oak,Plantae,51080,Anacardiaceae,Toxicodendron,Toxicodendron diversilobum
107231317,2/21/22,2022-02-21 23:00:01 UTC,Pacific Time (US & Canada),research,https://www.inaturalist.org/observations/107231317,https://inaturalist-open-data.s3.amazonaws.com/photos/180308999/medium.jpg,,1,0,FALSE,"Tilden Regional Park, Orinda, CA, US",37.88177817,-122.2260256,,open,,Contra Costa,common cowparsnip,Heracleum maximum,common cowparsnip,Plantae,53094,Apiaceae,Heracleum,Heracleum maximum
107231339,2/21/22,2022-02-21 23:01:07 UTC,Pacific Time (US & Canada),research,https://www.inaturalist.org/observations/107231339,https://inaturalist-open-data.s3.amazonaws.com/photos/180309020/medium.jpg,,1,0,FALSE,"Tilden Regional Park, Orinda, CA, US",37.88212492,-122.2260462,,,,Contra Costa,Common Snowberry,Symphoricarpos albus,Common Snowberry,Plantae,48523,Caprifoliaceae,Symphoricarpos,Symphoricarpos albus
107231351,2/21/22,2022-02-22 00:51:52 UTC,Pacific Time (US & Canada),research,https://www.inaturalist.org/observations/107231351,https://inaturalist-open-data.s3.amazonaws.com/photos/180309070/medium.jpeg,,1,0,FALSE,"Berkeley, CA 94708, USA",37.9104445,-122.2628227,,,,Contra Costa,milkmaids,Cardamine californica,milkmaids,Plantae,49651,Brassicaceae,Cardamine,Cardamine californica
107231423,2/21/22,2022-02-22 01:03:31 UTC,Pacific Time (US & Canada),research,https://www.inaturalist.org/observations/107231423,https://inaturalist-open-data.s3.amazonaws.com/photos/180309191/medium.jpeg,,1,0,FALSE,"Kensington, CA, USA",37.9072063,-122.2651769,,,,Contra Costa,French broom,Genista monspessulana,French broom,Plantae,53403,Fabaceae,Genista,Genista monspessulana
107231496,2/21/22,2022-02-21 23:04:30 UTC,Pacific Time (US & Canada),research,https://www.inaturalist.org/observations/107231496,https://inaturalist-open-data.s3.amazonaws.com/photos/180309261/medium.jpg,,1,0,FALSE,"Tilden Regional Park, Orinda, CA, US",37.88212151,-122.2261361,,,,Contra Costa,Cardo negro,Carduus pycnocephalus,Italian thistle,Plantae,52990,Asteraceae,Carduus,Carduus pycnocephalus
107231541,2/21/22,2022-02-21 23:05:50 UTC,Pacific Time (US & Canada),research,https://www.inaturalist.org/observations/107231541,https://inaturalist-open-data.s3.amazonaws.com/photos/180309362/medium.jpg,,1,0,FALSE,"Tilden Regional Park, Orinda, CA, US",37.88257329,-122.2265775,,,,Contra Costa,woodland strawberry,Fragaria vesca,woodland strawberry,Plantae,50298,Rosaceae,Fragaria,Fragaria vesca
107231656,2/21/22,2022-02-21 23:06:55 UTC,Pacific Time (US & Canada),research,https://www.inaturalist.org/observations/107231656,https://inaturalist-open-data.s3.amazonaws.com/photos/180309494/medium.jpg,,1,0,FALSE,"Tilden Regional Park, Orinda, CA, US",37.88279908,-122.2267149,,,,Contra Costa,miner's lettuce,Claytonia perfoliata,miner's lettuce,Plantae,52994,Montiaceae,Claytonia,Claytonia perfoliata
107232606,2/21/22,2022-02-22 00:59:09 UTC,Pacific Time (US & Canada),research,https://www.inaturalist.org/observations/107232606,https://inaturalist-open-data.s3.amazonaws.com/photos/180311427/medium.jpeg,,1,0,FALSE,"Kensington, CA, USA",37.9085233,-122.266085,,,,Contra Costa,star-flowered lily-of-the-valley,Maianthemum stellatum,star-flowered lily-of-the-valley,Plantae,53268,Asparagaceae,Maianthemum,Maianthemum stellatum
107232688,2/21/22,2022-02-22 00:32:24 UTC,Pacific Time (US & Canada),research,https://www.inaturalist.org/observations/107232688,https://inaturalist-open-data.s3.amazonaws.com/photos/180311660/medium.jpeg,,2,0,FALSE,"Berkeley, CA 94708, USA",37.9149335,-122.2595662,,open,,Contra Costa,giant wakerobin,Trillium chloropetalum,giant wakerobin,Plantae,50823,Melanthiaceae,Trillium,Trillium chloropetalum
107260479,2/21/22,2022-02-21 18:25:44 UTC,Pacific Time (US & Canada),research,https://www.inaturalist.org/observations/107260479,https://static.inaturalist.org/photos/180364466/medium.jpg,,1,0,FALSE,"Tilden Nature Area, Orinda, CA, US",37.91386667,-122.268745,,,,Contra Costa,miner's lettuce,Claytonia perfoliata,miner's lettuce,Plantae,52994,Montiaceae,Claytonia,Claytonia perfoliata
107260507,2/21/22,2022-02-21 17:40:57 UTC,Pacific Time (US & Canada),research,https://www.inaturalist.org/observations/107260507,https://static.inaturalist.org/photos/180364498/medium.jpg,,2,0,FALSE,"Tilden Nature Area, El Sobrante, CA, US",37.91760333,-122.2642633,,,,Contra Costa,Chasmanthe bicolor,Chasmanthe bicolor,Bicolor Cobra Lily,Plantae,59948,Iridaceae,Chasmanthe,Chasmanthe bicolor
107260547,2/21/22,2022-02-21 17:45:47 UTC,Pacific Time (US & Canada),research,https://www.inaturalist.org/observations/107260547,https://static.inaturalist.org/photos/180364585/medium.jpg,,1,0,FALSE,"Tilden Nature Area, El Sobrante, CA, US",37.91808,-122.2636867,,,,Contra Costa,Coast Paintbrush,Castilleja affinis affinis,Coast Paintbrush,Plantae,50043,Orobanchaceae,Castilleja,Castilleja affinis
107260703,2/21/22,2022-02-21 17:30:47 UTC,Pacific Time (US & Canada),research,https://www.inaturalist.org/observations/107260703,https://static.inaturalist.org/photos/180364717/medium.jpg,,1,0,FALSE,"Tilden Nature Area, Orinda, CA, US",37.91558833,-122.2657717,,open,,Contra Costa,common cowparsnip,Heracleum maximum,common cowparsnip,Plantae,53094,Apiaceae,Heracleum,Heracleum maximum
107262882,2/22/22,2022-02-22 17:43:18 UTC,Pacific Time (US & Canada),research,https://www.inaturalist.org/observations/107262882,https://inaturalist-open-data.s3.amazonaws.com/photos/180369866/medium.jpg,,1,0,FALSE,"Tilden Nature Area, Kensington, CA, US",37.90926661,-122.2654303,,,,Contra Costa,redwood sorrel,Oxalis oregana,redwood sorrel,Plantae,47757,Oxalidaceae,Oxalis,Oxalis oregana
107263640,2/22/22,2022-02-22 17:51:59 UTC,Pacific Time (US & Canada),research,https://www.inaturalist.org/observations/107263640,https://inaturalist-open-data.s3.amazonaws.com/photos/180369954/medium.jpg,,1,0,FALSE,"Tilden Nature Area, Kensington, CA, US",37.91150661,-122.2683892,,,,Contra Costa,twinberry honeysuckle,Lonicera involucrata,twinberry honeysuckle,Plantae,60881,Caprifoliaceae,Lonicera,Lonicera involucrata
107263797,2/22/22,2022-02-22 17:55:01 UTC,Pacific Time (US & Canada),research,https://www.inaturalist.org/observations/107263797,https://inaturalist-open-data.s3.amazonaws.com/photos/180370123/medium.jpg,,1,0,FALSE,"Tilden Nature Area, Orinda, CA, US",37.91238044,-122.2686049,,,,Contra Costa,Pacific poison oak,Toxicodendron diversilobum,Pacific poison oak,Plantae,51080,Anacardiaceae,Toxicodendron,Toxicodendron diversilobum
107264024,2/22/22,2022-02-22 17:58:25 UTC,Pacific Time (US & Canada),research,https://www.inaturalist.org/observations/107264024,https://inaturalist-open-data.s3.amazonaws.com/photos/180370522/medium.jpg,,1,0,FALSE,"Tilden Nature Area, Orinda, CA, US",37.91253083,-122.2686692,,,,Contra Costa,Juncus patens,Juncus patens,Spreading Rush,Plantae,52798,Juncaceae,Juncus,Juncus patens
107264059,2/22/22,2022-02-22 18:00:02 UTC,Pacific Time (US & Canada),research,https://www.inaturalist.org/observations/107264059,https://inaturalist-open-data.s3.amazonaws.com/photos/180370539/medium.jpg,,1,0,FALSE,"Tilden Nature Area, Orinda, CA, US",37.91262627,-122.2687318,,,,Contra Costa,Bermuda buttercup,Oxalis pes-caprae,Bermuda buttercup,Plantae,53169,Oxalidaceae,Oxalis,Oxalis pes-caprae
107264187,2/22/22,2022-02-22 18:01:42 UTC,Pacific Time (US & Canada),research,https://www.inaturalist.org/observations/107264187,https://inaturalist-open-data.s3.amazonaws.com/photos/180370787/medium.jpg,,1,0,FALSE,"Tilden Nature Area, Orinda, CA, US",37.91262145,-122.2688571,,open,,Contra Costa,Toyon,Heteromeles arbutifolia,Toyon,Plantae,53405,Rosaceae,Heteromeles,Heteromeles arbutifolia
107264315,2/22/22,2022-02-22 18:03:04 UTC,Pacific Time (US & Canada),research,https://www.inaturalist.org/observations/107264315,https://inaturalist-open-data.s3.amazonaws.com/photos/180371044/medium.jpg,,1,0,FALSE,"Tilden Nature Area, Orinda, CA, US",37.9127914,-122.2689821,,open,,Contra Costa,coffeeberry,Frangula californica,coffeeberry,Plantae,53423,Rhamnaceae,Frangula,Frangula californica
107264714,2/22/22,2022-02-22 18:11:44 UTC,Pacific Time (US & Canada),research,https://www.inaturalist.org/observations/107264714,https://inaturalist-open-data.s3.amazonaws.com/photos/180372052/medium.jpg,,1,0,FALSE,"Tilden Nature Area, Orinda, CA, US",37.91251448,-122.2698215,,,,Contra Costa,thimbleberry,Rubus parviflorus,thimbleberry,Plantae,51646,Rosaceae,Rubus,Rubus parviflorus
107265280,2/22/22,2022-02-22 18:20:40 UTC,Pacific Time (US & Canada),research,https://www.inaturalist.org/observations/107265280,https://inaturalist-open-data.s3.amazonaws.com/photos/180374382/medium.jpg,,1,0,FALSE,"Tilden Nature Area, Orinda, CA, US",37.91314542,-122.2693682,,open,,Contra Costa,Toyon,Heteromeles arbutifolia,Toyon,Plantae,53405,Rosaceae,Heteromeles,Heteromeles arbutifolia
107265465,2/22/22,2022-02-22 18:24:38 UTC,Pacific Time (US & Canada),research,https://www.inaturalist.org/observations/107265465,https://inaturalist-open-data.s3.amazonaws.com/photos/180373361/medium.jpg,,1,0,FALSE,"Wildcat Creek Trail, Orinda, CA, US",37.91332278,-122.2697972,,open,,Contra Costa,California buckeye,Aesculus californica,California buckeye,Plantae,53348,Sapindaceae,Aesculus,Aesculus californica
107266081,2/22/22,2022-02-22 18:28:02 UTC,Pacific Time (US & Canada),research,https://www.inaturalist.org/observations/107266081,https://inaturalist-open-data.s3.amazonaws.com/photos/180374607/medium.jpg,,1,0,FALSE,"Tilden Nature Area, Orinda, CA, US",37.91374167,-122.2688533,,,,Contra Costa,California manroot,Marah fabacea,California manroot,Plantae,205330,Cucurbitaceae,Marah,Marah fabacea
107266590,2/22/22,2022-02-22 18:29:05 UTC,Pacific Time (US & Canada),research,https://www.inaturalist.org/observations/107266590,https://inaturalist-open-data.s3.amazonaws.com/photos/180392990/medium.jpg,,1,0,FALSE,"Tilden Nature Area, Orinda, CA, US",37.91384445,-122.2687327,,,,Contra Costa,miner's lettuce,Claytonia perfoliata,miner's lettuce,Plantae,52994,Montiaceae,Claytonia,Claytonia perfoliata
107268004,2/22/22,2022-02-22 17:56:42 UTC,Pacific Time (US & Canada),research,https://www.inaturalist.org/observations/107268004,https://inaturalist-open-data.s3.amazonaws.com/photos/180380707/medium.jpg,,1,0,FALSE,"Tilden Regional Park, Contra Costa County, US-CA, US",37.91259552,-122.2688905,,open,,Contra Costa,Toyon,Heteromeles arbutifolia,Toyon,Plantae,53405,Rosaceae,Heteromeles,Heteromeles arbutifolia
107269264,2/22/22,2022-02-22 19:08:47 UTC,Pacific Time (US & Canada),research,https://www.inaturalist.org/observations/107269264,https://inaturalist-open-data.s3.amazonaws.com/photos/180380566/medium.jpg,,2,0,FALSE,"Tilden Nature Area, Orinda, CA, US",37.91672226,-122.2645655,,,,Contra Costa,Redstem Stork's-bill,Erodium cicutarium,Redstem Stork's-bill,Plantae,47687,Geraniaceae,Erodium,Erodium cicutarium
107269286,2/22/22,2022-02-22 19:19:39 UTC,Pacific Time (US & Canada),research,https://www.inaturalist.org/observations/107269286,https://inaturalist-open-data.s3.amazonaws.com/photos/180380600/medium.jpg,,1,0,FALSE,"Tilden Nature Area, El Sobrante, CA, US",37.91744906,-122.2636623,,,,Contra Costa,purple needlegrass,Nassella pulchra,purple needlegrass,Plantae,165659,Poaceae,Nassella,Nassella pulchra
107269372,2/22/22,2022-02-22 19:26:52 UTC,Pacific Time (US & Canada),research,https://www.inaturalist.org/observations/107269372,https://inaturalist-open-data.s3.amazonaws.com/photos/180380759/medium.jpg,,1,0,FALSE,"Tilden Nature Area, El Sobrante, CA, US",37.91750772,-122.263539,,,,Contra Costa,Miniature Lupine,Lupinus bicolor,Miniature Lupine,Plantae,50614,Fabaceae,Lupinus,Lupinus bicolor
107269380,2/22/22,2022-02-22 19:27:53 UTC,Pacific Time (US & Canada),research,https://www.inaturalist.org/observations/107269380,https://inaturalist-open-data.s3.amazonaws.com/photos/180381075/medium.jpg,,2,0,FALSE,"Tilden Nature Area, El Sobrante, CA, US",37.91752441,-122.2636191,,,,Contra Costa,Blue Dicks,Dipterostemon capitatus,Blue Dicks,Plantae,1196784,Asparagaceae,Dipterostemon,Dipterostemon capitatus
107269463,2/22/22,2022-02-22 19:28:22 UTC,Pacific Time (US & Canada),research,https://www.inaturalist.org/observations/107269463,https://inaturalist-open-data.s3.amazonaws.com/photos/180381000/medium.jpg,,2,0,FALSE,"Tilden Nature Area, El Sobrante, CA, US",37.91753442,-122.2635916,,,,Contra Costa,western blue-eyed grass,Sisyrinchium bellum,western blue-eyed grass,Plantae,49918,Iridaceae,Sisyrinchium,Sisyrinchium bellum
107269532,2/22/22,2022-02-22 19:31:01 UTC,Pacific Time (US & Canada),research,https://www.inaturalist.org/observations/107269532,https://inaturalist-open-data.s3.amazonaws.com/photos/180381107/medium.jpg,,1,0,FALSE,"Tilden Nature Area, El Sobrante, CA, US",37.91811005,-122.263749,,,,Contra Costa,Coast Paintbrush,Castilleja affinis,Coast Paintbrush,Plantae,50042,Orobanchaceae,Castilleja,Castilleja affinis
107269734,2/22/22,2022-02-22 19:33:37 UTC,Pacific Time (US & Canada),research,https://www.inaturalist.org/observations/107269734,https://inaturalist-open-data.s3.amazonaws.com/photos/180381412/medium.jpg,,1,0,FALSE,"Tilden Nature Area, El Sobrante, CA, US",37.91870301,-122.2636244,,,,Contra Costa,Silver Lupine,Lupinus albifrons,Silver Bush Lupine,Plantae,51691,Fabaceae,Lupinus,Lupinus albifrons
107275379,2/22/22,2022-02-22 20:22:07 UTC,Pacific Time (US & Canada),research,https://www.inaturalist.org/observations/107275379,https://inaturalist-open-data.s3.amazonaws.com/photos/180392032/medium.jpg,,1,0,FALSE,"Tilden Nature Area, Orinda, CA, US",37.91676196,-122.2642675,,,,Contra Costa,Artichoke Thistle,Cynara cardunculus,Artichoke Thistle,Plantae,57563,Asteraceae,Cynara,Cynara cardunculus
107275643,2/22/22,2022-02-22 20:37:11 UTC,Pacific Time (US & Canada),research,https://www.inaturalist.org/observations/107275643,https://inaturalist-open-data.s3.amazonaws.com/photos/180393571/medium.jpg,,2,0,FALSE,"Tilden Nature Area, Orinda, CA, US",37.91435134,-122.2678327,,open,,Contra Costa,giant wakerobin,Trillium chloropetalum,giant wakerobin,Plantae,50823,Melanthiaceae,Trillium,Trillium chloropetalum
107275964,2/22/22,2022-02-22 18:35:25 UTC,Pacific Time (US & Canada),research,https://www.inaturalist.org/observations/107275964,https://inaturalist-open-data.s3.amazonaws.com/photos/180393085/medium.jpg,,1,0,FALSE,"Tilden Nature Area, Orinda, CA, US",37.91482528,-122.2678013,,,,Contra Costa,blue elder,Sambucus cerulea,blue elder,Plantae,143799,Viburnaceae,Sambucus,Sambucus cerulea
107275993,2/22/22,2022-02-22 18:42:44 UTC,Pacific Time (US & Canada),research,https://www.inaturalist.org/observations/107275993,https://inaturalist-open-data.s3.amazonaws.com/photos/180393096/medium.jpg,,1,0,FALSE,"Tilden Nature Area, Orinda, CA, US",37.91551574,-122.2657667,,,,Contra Costa,poison hemlock,Conium maculatum,poison hemlock,Plantae,52998,Apiaceae,Conium,Conium maculatum
107276030,2/22/22,2022-02-22 18:51:06 UTC,Pacific Time (US & Canada),research,https://www.inaturalist.org/observations/107276030,https://inaturalist-open-data.s3.amazonaws.com/photos/180393146/medium.jpg,,1,0,FALSE,"Tilden Nature Area, El Sobrante, CA, US",37.91702,-122.2655417,,open,,Contra Costa,Common Yarrow,Achillea millefolium,common yarrow,Plantae,52821,Asteraceae,Achillea,Achillea millefolium
107276050,2/22/22,2022-02-22 18:50:46 UTC,Pacific Time (US & Canada),research,https://www.inaturalist.org/observations/107276050,https://inaturalist-open-data.s3.amazonaws.com/photos/180393193/medium.jpg,,2,0,FALSE,"Tilden Nature Area, El Sobrante, CA, US",37.917075,-122.26545,,,,Contra Costa,Blue Dicks,Dipterostemon capitatus,Blue Dicks,Plantae,1196784,Asparagaceae,Dipterostemon,Dipterostemon capitatus
107276060,2/22/22,2022-02-22 18:47:25 UTC,Pacific Time (US & Canada),research,https://www.inaturalist.org/observations/107276060,https://inaturalist-open-data.s3.amazonaws.com/photos/180393216/medium.jpg,,1,0,FALSE,"Tilden Nature Area, Orinda, CA, US",37.916455,-122.265525,,,,Contra Costa,orange bush monkeyflower,Diplacus aurantiacus,orange bush monkeyflower,Plantae,777371,Phrymaceae,Diplacus,Diplacus aurantiacus
107276209,2/22/22,2022-02-22 17:59:37 UTC,Pacific Time (US & Canada),research,https://www.inaturalist.org/observations/107276209,https://inaturalist-open-data.s3.amazonaws.com/photos/180393656/medium.jpg,,2,0,FALSE,"Tilden Nature Area, Orinda, CA, US",37.91277011,-122.2690835,,,,Contra Costa,Pacific Sanicle,Sanicula crassicaulis,Pacific Sanicle,Plantae,53201,Apiaceae,Sanicula,Sanicula crassicaulis
107282003,2/22/22,2022-02-22 19:29:00 UTC,Pacific Time (US & Canada),research,https://www.inaturalist.org/observations/107282003,https://static.inaturalist.org/photos/180404490/medium.jpg,,1,0,FALSE,"Tilden Nature Area, Orinda, CA, US",37.91094887,-122.2625237,,,,Contra Costa,Spotted medick,Medicago arabica,Spotted medick,Plantae,61012,Fabaceae,Medicago,Medicago arabica
107282384,2/22/22,2022-02-22 18:58:54 UTC,Pacific Time (US & Canada),research,https://www.inaturalist.org/observations/107282384,https://static.inaturalist.org/photos/180404909/medium.jpg,,1,0,FALSE,"Tilden Nature Area, Orinda, CA, US",37.91094887,-122.2625237,,,,Contra Costa,scarlet pimpernel,Lysimachia arvensis,scarlet pimpernel,Plantae,791928,Primulaceae,Lysimachia,Lysimachia arvensis
107282447,2/22/22,2022-02-22 18:58:19 UTC,Pacific Time (US & Canada),research,https://www.inaturalist.org/observations/107282447,https://static.inaturalist.org/photos/180405025/medium.jpg,,1,0,FALSE,"Tilden Nature Area, Orinda, CA, US",37.91094887,-122.2625237,,,,Contra Costa,cardo de huerta,Cynara cardunculus,Artichoke Thistle,Plantae,57563,Asteraceae,Cynara,Cynara cardunculus
107282484,2/22/22,2022-02-22 18:57:39 UTC,Pacific Time (US & Canada),research,https://www.inaturalist.org/observations/107282484,https://static.inaturalist.org/photos/180405116/medium.jpg,,1,0,FALSE,"Tilden Nature Area, Orinda, CA, US",37.91094887,-122.2625237,,,,Contra Costa,Redstem Stork's-bill,Erodium cicutarium,Redstem Stork's-bill,Plantae,47687,Geraniaceae,Erodium,Erodium cicutarium
107282580,2/22/22,2022-02-22 18:52:04 UTC,Pacific Time (US & Canada),research,https://www.inaturalist.org/observations/107282580,https://static.inaturalist.org/photos/180405241/medium.jpg,,1,0,FALSE,"Tilden Nature Area, Orinda, CA, US",37.91094887,-122.2625237,,,,Contra Costa,Blue Dicks,Dipterostemon capitatus,Blue Dicks,Plantae,1196784,Asparagaceae,Dipterostemon,Dipterostemon capitatus
107300733,2/22/22,2022-02-22 22:18:44 UTC,Pacific Time (US & Canada),research,https://www.inaturalist.org/observations/107300733,https://inaturalist-open-data.s3.amazonaws.com/photos/180440199/medium.jpg,,1,0,FALSE,"Tilden Nature Area, El Sobrante, CA, US",37.91841333,-122.263595,,,,Contra Costa,poison hemlock,Conium maculatum,poison hemlock,Plantae,52998,Apiaceae,Conium,Conium maculatum
107300737,2/22/22,2022-02-22 22:18:10 UTC,Pacific Time (US & Canada),research,https://www.inaturalist.org/observations/107300737,https://inaturalist-open-data.s3.amazonaws.com/photos/180440210/medium.jpg,,2,0,FALSE,"Tilden Nature Area, El Sobrante, CA, US",37.91817833,-122.26368,,open,,Contra Costa,cardo mariano,Silybum marianum,milk thistle,Plantae,52586,Asteraceae,Silybum,Silybum marianum
107300759,2/22/22,2022-02-22 22:04:47 UTC,Pacific Time (US & Canada),research,https://www.inaturalist.org/observations/107300759,https://inaturalist-open-data.s3.amazonaws.com/photos/180440257/medium.jpg,,2,0,FALSE,"Tilden Nature Area, Orinda, CA, US",37.91682,-122.26403,,,,Contra Costa,scarlet pimpernel,Lysimachia arvensis,scarlet pimpernel,Plantae,791928,Primulaceae,Lysimachia,Lysimachia arvensis
107300880,2/22/22,2022-02-22 21:58:06 UTC,Pacific Time (US & Canada),research,https://www.inaturalist.org/observations/107300880,https://inaturalist-open-data.s3.amazonaws.com/photos/180440501/medium.jpg,,2,0,FALSE,"Tilden Nature Area, El Sobrante, CA, US",37.91935126,-122.2629912,,,,Contra Costa,Chasmanthe floribunda,Chasmanthe floribunda,African flag,Plantae,56028,Iridaceae,Chasmanthe,Chasmanthe floribunda
107317073,2/19/22,2022-02-20 00:38:21 UTC,Pacific Time (US & Canada),research,https://www.inaturalist.org/observations/107317073,https://inaturalist-open-data.s3.amazonaws.com/photos/180470052/medium.jpg,,1,0,FALSE,"Tilden Regional Park, Orinda, CA, US",37.90553667,-122.2669967,,open,,Contra Costa,giant wakerobin,Trillium chloropetalum,giant wakerobin,Plantae,50823,Melanthiaceae,Trillium,Trillium chloropetalum
107323319,2/22/22,2022-02-22 21:45:40 UTC,Pacific Time (US & Canada),research,https://www.inaturalist.org/observations/107323319,https://inaturalist-open-data.s3.amazonaws.com/photos/180481263/medium.jpg,,1,0,FALSE,"Tilden Nature Area, Orinda, CA, US",37.91179991,-122.2649996,,,,Contra Costa,miner's lettuce,Claytonia perfoliata,miner's lettuce,Plantae,52994,Montiaceae,Claytonia,Claytonia perfoliata
107323978,2/22/22,2022-02-22 22:03:28 UTC,Pacific Time (US & Canada),research,https://www.inaturalist.org/observations/107323978,https://inaturalist-open-data.s3.amazonaws.com/photos/180482403/medium.jpg,,1,0,FALSE,"Tilden Nature Area, Orinda, CA, US",37.91468504,-122.2668096,,open,,Contra Costa,coast live oak,Quercus agrifolia,coast live oak,Plantae,47850,Fagaceae,Quercus,Quercus agrifolia
107324243,2/22/22,2022-02-22 22:12:28 UTC,Pacific Time (US & Canada),research,https://www.inaturalist.org/observations/107324243,https://inaturalist-open-data.s3.amazonaws.com/photos/180482972/medium.jpg,,1,0,FALSE,"Tilden Nature Area, Orinda, CA, US",37.91672523,-122.2640965,,,,Contra Costa,scarlet pimpernel,Lysimachia arvensis,scarlet pimpernel,Plantae,791928,Primulaceae,Lysimachia,Lysimachia arvensis
107324333,2/22/22,2022-02-22 22:16:11 UTC,Pacific Time (US & Canada),research,https://www.inaturalist.org/observations/107324333,https://inaturalist-open-data.s3.amazonaws.com/photos/180483161/medium.jpg,,1,0,FALSE,"Tilden Nature Area, Orinda, CA, US",37.91598194,-122.2660306,,,,Contra Costa,Bicolor Cobra Lily,Chasmanthe bicolor,Bicolor Cobra Lily,Plantae,59948,Iridaceae,Chasmanthe,Chasmanthe bicolor
107324383,2/22/22,2022-02-22 22:16:59 UTC,Pacific Time (US & Canada),research,https://www.inaturalist.org/observations/107324383,https://inaturalist-open-data.s3.amazonaws.com/photos/180483273/medium.jpg,,1,0,FALSE,"Tilden Nature Area, Orinda, CA, US",37.9168178,-122.2640324,,open,,Contra Costa,Common Yarrow,Achillea millefolium,common yarrow,Plantae,52821,Asteraceae,Achillea,Achillea millefolium
107324470,2/22/22,2022-02-22 22:19:46 UTC,Pacific Time (US & Canada),research,https://www.inaturalist.org/observations/107324470,https://inaturalist-open-data.s3.amazonaws.com/photos/180483396/medium.jpg,,1,0,FALSE,"Tilden Nature Area, Orinda, CA, US",37.91381628,-122.2619466,,,,Contra Costa,western blue-eyed grass,Sisyrinchium bellum,western blue-eyed grass,Plantae,49918,Iridaceae,Sisyrinchium,Sisyrinchium bellum
107324560,2/22/22,2022-02-22 22:22:32 UTC,Pacific Time (US & Canada),research,https://www.inaturalist.org/observations/107324560,https://inaturalist-open-data.s3.amazonaws.com/photos/180483640/medium.jpg,,1,0,FALSE,"Tilden Nature Area, Orinda, CA, US",37.91664685,-122.2655742,,,,Contra Costa,Coast Paintbrush,Castilleja affinis affinis,Coast Paintbrush,Plantae,50043,Orobanchaceae,Castilleja,Castilleja affinis
107347125,2/22/22,2022-02-22 17:51:00 UTC,Pacific Time (US & Canada),research,https://www.inaturalist.org/observations/107347125,https://inaturalist-open-data.s3.amazonaws.com/photos/180524981/medium.jpeg,,2,0,FALSE,"Contra Costa County, CA, USA",37.91166944,-122.2686222,,,,Contra Costa,Red-flowering Currant,Ribes sanguineum,Red-flowering Currant,Plantae,53435,Grossulariaceae,Ribes,Ribes sanguineum
107348248,2/22/22,2022-02-22 18:26:00 UTC,Pacific Time (US & Canada),research,https://www.inaturalist.org/observations/107348248,https://inaturalist-open-data.s3.amazonaws.com/photos/180526928/medium.jpeg,,1,0,FALSE,"Contra Costa County, CA, USA",37.91371944,-122.2688,,,,Contra Costa,miner's lettuce,Claytonia perfoliata,miner's lettuce,Plantae,52994,Montiaceae,Claytonia,Claytonia perfoliata
107348320,2/22/22,2022-02-22 18:31:00 UTC,Pacific Time (US & Canada),research,https://www.inaturalist.org/observations/107348320,https://inaturalist-open-data.s3.amazonaws.com/photos/180527010/medium.jpeg,not sure about the ID,1,0,FALSE,"Contra Costa County, CA, USA",37.91432222,-122.2679972,,,,Contra Costa,coyote brush,Baccharis pilularis,coyote brush,Plantae,53359,Asteraceae,Baccharis,Baccharis pilularis
107348542,2/22/22,2022-02-22 18:47:00 UTC,Pacific Time (US & Canada),research,https://www.inaturalist.org/observations/107348542,https://inaturalist-open-data.s3.amazonaws.com/photos/180527546/medium.jpeg,,1,0,FALSE,"Contra Costa County, CA, USA",37.91666111,-122.2654278,,,,Contra Costa,African flag,Chasmanthe floribunda,African flag,Plantae,56028,Iridaceae,Chasmanthe,Chasmanthe floribunda
107348591,2/22/22,2022-02-22 18:51:00 UTC,Pacific Time (US & Canada),research,https://www.inaturalist.org/observations/107348591,https://inaturalist-open-data.s3.amazonaws.com/photos/180527611/medium.jpeg,,1,0,FALSE,"Contra Costa County, CA, USA",37.91745,-122.2650667,,,,Contra Costa,American vetch,Vicia americana,American vetch,Plantae,53320,Fabaceae,Vicia,Vicia americana
107348640,2/22/22,2022-02-22 18:52:00 UTC,Pacific Time (US & Canada),research,https://www.inaturalist.org/observations/107348640,https://inaturalist-open-data.s3.amazonaws.com/photos/180527743/medium.jpeg,,1,0,FALSE,"Contra Costa County, CA, USA",37.91753056,-122.2651528,,,,Contra Costa,poison hemlock,Conium maculatum,poison hemlock,Plantae,52998,Apiaceae,Conium,Conium maculatum
107352482,2/22/22,2022-02-22 22:58:31 UTC,Pacific Time (US & Canada),research,https://www.inaturalist.org/observations/107352482,https://static.inaturalist.org/photos/180535226/medium.jpg,,1,0,FALSE,"Tilden Regional Park, Orinda, CA, US",37.88311645,-122.2288836,,,,Contra Costa,Common star lily,Toxicoscordion fremontii,Common star lily,Plantae,49649,Melanthiaceae,Toxicoscordion,Toxicoscordion fremontii
107352503,2/22/22,2022-02-22 23:14:26 UTC,Pacific Time (US & Canada),research,https://www.inaturalist.org/observations/107352503,https://static.inaturalist.org/photos/180535268/medium.jpg,,2,0,FALSE,"Tamalpais Ave, El Cerrito, CA, US",37.88241623,-122.2311736,,open,,Contra Costa,giant wakerobin,Trillium chloropetalum,giant wakerobin,Plantae,50823,Melanthiaceae,Trillium,Trillium chloropetalum
107354437,2/22/22,2022-02-22 18:57:32 UTC,Pacific Time (US & Canada),research,https://www.inaturalist.org/observations/107354437,https://inaturalist-open-data.s3.amazonaws.com/photos/180538424/medium.jpg,,2,0,FALSE,"Tilden Nature Area, Orinda, CA, US",37.915975,-122.26632,,,,Contra Costa,Pacific poison oak,Toxicodendron diversilobum,Pacific poison oak,Plantae,51080,Anacardiaceae,Toxicodendron,Toxicodendron diversilobum
107379359,2/22/22,2022-02-22 18:27:00 UTC,Pacific Time (US & Canada),research,https://www.inaturalist.org/observations/107379359,https://inaturalist-open-data.s3.amazonaws.com/photos/180781153/medium.jpg,,2,0,FALSE,"Tilden Nature Area, Orinda, CA, US",37.91388333,-122.2686783,,,,Contra Costa,miner's lettuce,Claytonia perfoliata,miner's lettuce,Plantae,52994,Montiaceae,Claytonia,Claytonia perfoliata
107381011,2/22/22,2022-02-22 22:46:01 UTC,Pacific Time (US & Canada),research,https://www.inaturalist.org/observations/107381011,https://inaturalist-open-data.s3.amazonaws.com/photos/180590293/medium.jpg,,1,0,FALSE,"Tilden Nature Area, Orinda, CA, US",37.91160976,-122.2627238,,,,Contra Costa,miner's lettuce,Claytonia perfoliata,miner's lettuce,Plantae,52994,Montiaceae,Claytonia,Claytonia perfoliata
107381140,2/22/22,2022-02-22 22:36:43 UTC,Pacific Time (US & Canada),research,https://www.inaturalist.org/observations/107381140,https://inaturalist-open-data.s3.amazonaws.com/photos/180590462/medium.jpg,,2,0,FALSE,"Tilden Nature Area, Kensington, CA, US",37.91102382,-122.2663609,,,,Contra Costa,western blue-eyed grass,Sisyrinchium bellum,western blue-eyed grass,Plantae,49918,Iridaceae,Sisyrinchium,Sisyrinchium bellum
107381338,2/22/22,2022-02-22 22:19:58 UTC,Pacific Time (US & Canada),research,https://www.inaturalist.org/observations/107381338,https://inaturalist-open-data.s3.amazonaws.com/photos/180590728/medium.jpg,,2,0,FALSE,"Tilden Nature Area, Orinda, CA, US",37.91582932,-122.2608819,,,,Contra Costa,poison hemlock,Conium maculatum,poison hemlock,Plantae,52998,Apiaceae,Conium,Conium maculatum
107381364,2/22/22,2022-02-22 22:13:30 UTC,Pacific Time (US & Canada),research,https://www.inaturalist.org/observations/107381364,https://inaturalist-open-data.s3.amazonaws.com/photos/180590835/medium.jpg,,1,0,FALSE,"Tilden Nature Area, Orinda, CA, US",37.91174528,-122.2665763,,,,Contra Costa,wavy-leafed soap plant,Chlorogalum pomeridianum,wavy-leafed soap plant,Plantae,47597,Asparagaceae,Chlorogalum,Chlorogalum pomeridianum
107381512,2/22/22,2022-02-22 22:09:56 UTC,Pacific Time (US & Canada),research,https://www.inaturalist.org/observations/107381512,https://inaturalist-open-data.s3.amazonaws.com/photos/180591137/medium.jpg,the purplish fern like plant,2,0,FALSE,"Tilden Nature Area, Orinda, CA, US",37.91549362,-122.2709694,,,,Contra Costa,Redstem Stork's-bill,Erodium cicutarium,Redstem Stork's-bill,Plantae,47687,Geraniaceae,Erodium,Erodium cicutarium
107381527,2/22/22,2022-02-22 22:09:48 UTC,Pacific Time (US & Canada),research,https://www.inaturalist.org/observations/107381527,https://inaturalist-open-data.s3.amazonaws.com/photos/180591157/medium.jpg,,1,0,FALSE,"Tilden Nature Area, Kensington, CA, US",37.91153576,-122.2671698,,,,Contra Costa,scarlet pimpernel,Lysimachia arvensis,scarlet pimpernel,Plantae,791928,Primulaceae,Lysimachia,Lysimachia arvensis
107381770,2/22/22,2022-02-22 22:03:35 UTC,Pacific Time (US & Canada),research,https://www.inaturalist.org/observations/107381770,https://inaturalist-open-data.s3.amazonaws.com/photos/180591637/medium.jpg,,1,0,FALSE,"Tilden Nature Area, El Sobrante, CA, US",37.91840248,-122.2634881,,open,,Contra Costa,Common Yarrow,Achillea millefolium,common yarrow,Plantae,52821,Asteraceae,Achillea,Achillea millefolium
107381923,2/22/22,2022-02-22 21:57:54 UTC,Pacific Time (US & Canada),research,https://www.inaturalist.org/observations/107381923,https://inaturalist-open-data.s3.amazonaws.com/photos/180591878/medium.jpg,,1,0,FALSE,"Tilden Nature Area, Orinda, CA, US",37.91341821,-122.2643452,,,,Contra Costa,coyote brush,Baccharis pilularis,coyote brush,Plantae,53359,Asteraceae,Baccharis,Baccharis pilularis
107381974,2/22/22,2022-02-22 21:53:24 UTC,Pacific Time (US & Canada),research,https://www.inaturalist.org/observations/107381974,https://inaturalist-open-data.s3.amazonaws.com/photos/180592006/medium.jpg,,2,0,FALSE,"Tilden Nature Area, Kensington, CA, US",37.91049335,-122.2665316,,open,,Contra Costa,common cowparsnip,Heracleum maximum,common cowparsnip,Plantae,53094,Apiaceae,Heracleum,Heracleum maximum
107429049,2/25/22,2022-02-25 18:46:27 UTC,Pacific Time (US & Canada),research,https://www.inaturalist.org/observations/107429049,https://static.inaturalist.org/photos/180681731/medium.jpg,,1,0,FALSE,"Tilden Regional Park, Orinda, CA, US",37.90199258,-122.2608609,,,,Contra Costa,Austrália,Acacia melanoxylon,blackwood,Plantae,53344,Fabaceae,Acacia,Acacia melanoxylon
107445414,2/25/22,2022-02-26 00:03:55 UTC,Pacific Time (US & Canada),research,https://www.inaturalist.org/observations/107445414,https://static.inaturalist.org/photos/180712188/medium.jpg,,1,0,FALSE,"Tilden Regional Park, Orinda, CA, US",37.88633333,-122.2273383,,,,Contra Costa,purple owl's-clover,Castilleja exserta,purple owl's-clover,Plantae,49343,Orobanchaceae,Castilleja,Castilleja exserta
107451638,2/25/22,2022-02-26 00:04:28 UTC,Pacific Time (US & Canada),research,https://www.inaturalist.org/observations/107451638,https://inaturalist-open-data.s3.amazonaws.com/photos/180724948/medium.jpg,,1,0,FALSE,"Tilden Regional Park, Orinda, CA, US",37.886345,-122.227325,,,,Contra Costa,purple owl's-clover,Castilleja exserta,purple owl's-clover,Plantae,49343,Orobanchaceae,Castilleja,Castilleja exserta
107451697,2/25/22,2022-02-26 01:04:58 UTC,Pacific Time (US & Canada),research,https://www.inaturalist.org/observations/107451697,https://inaturalist-open-data.s3.amazonaws.com/photos/180725095/medium.jpg,,3,0,FALSE,"Tilden Regional Park, Orinda, CA, US",37.88763833,-122.2311383,,open,,Contra Costa,Maleae,Maleae,,Plantae,723302,Rosaceae,,
107452225,2/25/22,2022-02-26 01:14:45 UTC,Pacific Time (US & Canada),research,https://www.inaturalist.org/observations/107452225,https://inaturalist-open-data.s3.amazonaws.com/photos/180726045/medium.jpg,,1,0,FALSE,"Tilden Regional Park, Orinda, CA, US",37.89789273,-122.2520657,,,,Contra Costa,woodland strawberry,Fragaria vesca,woodland strawberry,Plantae,50298,Rosaceae,Fragaria,Fragaria vesca
107479460,2/22/22,2022-02-22 18:48:17 UTC,Pacific Time (US & Canada),research,https://www.inaturalist.org/observations/107479460,https://static.inaturalist.org/photos/180777395/medium.jpg,,1,0,FALSE,"Tilden Nature Area, Kensington, CA, US",37.90956167,-122.2668217,,,,Contra Costa,,Ribes sanguineum,Red-flowering Currant,Plantae,53435,Grossulariaceae,Ribes,Ribes sanguineum
107481653,2/22/22,2022-02-22 18:58:36 UTC,Pacific Time (US & Canada),research,https://www.inaturalist.org/observations/107481653,https://inaturalist-open-data.s3.amazonaws.com/photos/180781350/medium.jpg,,1,0,FALSE,"Tilden Nature Area, Orinda, CA, US",37.916855,-122.2643367,,,,Contra Costa,Redstem Stork's-bill,Erodium cicutarium,Redstem Stork's-bill,Plantae,47687,Geraniaceae,Erodium,Erodium cicutarium
107506653,2/26/22,2022-02-26 21:01:21 UTC,Pacific Time (US & Canada),research,https://www.inaturalist.org/observations/107506653,https://static.inaturalist.org/photos/180826671/medium.jpg,,1,0,FALSE,"Tilden Regional Park, Orinda, CA, US",37.90757833,-122.24758,,,,Contra Costa,Bermuda buttercup,Oxalis pes-caprae,Bermuda buttercup,Plantae,53169,Oxalidaceae,Oxalis,Oxalis pes-caprae
107536062,1/24/22,2022-01-24 22:59:20 UTC,Pacific Time (US & Canada),research,https://www.inaturalist.org/observations/107536062,https://static.inaturalist.org/photos/180883606/medium.jpg,,1,0,FALSE,"Tilden Regional Park, Orinda, CA, US",37.89666167,-122.2495417,,open,,Contra Costa,Toyon,Heteromeles arbutifolia,Toyon,Plantae,53405,Rosaceae,Heteromeles,Heteromeles arbutifolia
