id,observed_on,time_observed_at,time_zone,quality_grade,url,image_url,description,num_identification_agreements,num_identification_disagreements,captive_cultivated,place_guess,latitude,longitude,positional_accuracy,geoprivacy,place_town_name,place_county_name,species_guess,scientific_name,common_name,iconic_taxon_name,taxon_id,taxon_family_name,taxon_genus_name,taxon_species_name
8242902,10/3/17,2017-10-03 21:15:20 UTC,Pacific Time (US & Canada),research,https://www.inaturalist.org/observations/8242902,https://static.inaturalist.org/photos/10931339/medium.jpg,,1,0,FALSE,"Tilden Regional Park, Berkeley, CA, US",37.910225,-122.2676783,,,,Contra Costa,,Lonicera hispidula,Pink Honeysuckle,Plantae,53416,Caprifoliaceae,Lonicera,Lonicera hispidula
8242944,10/3/17,2017-10-03 21:39:29 UTC,Pacific Time (US & Canada),research,https://www.inaturalist.org/observations/8242944,https://static.inaturalist.org/photos/10931422/medium.jpg,,1,0,FALSE,"Tilden Regional Park, Berkeley, CA, US",37.91228,-122.268975,,,,Contra Costa,False papyrus,Cyperus alternifolius flabelliformis,Umbrella papyrus,Plantae,414284,Cyperaceae,Cyperus,Cyperus alternifolius
8243139,10/3/17,2017-10-03 21:49:20 UTC,Pacific Time (US & Canada),research,https://www.inaturalist.org/observations/8243139,https://static.inaturalist.org/photos/10931709/medium.jpg,,1,0,FALSE,"Tilden Regional Park, Berkeley, CA, US",37.91234667,-122.268905,,,,Contra Costa,,Mentha pulegium,Pennyroyal,Plantae,57116,Lamiaceae,Mentha,Mentha pulegium
8360473,10/7/17,2017-10-07 22:35:57 UTC,Pacific Time (US & Canada),research,https://www.inaturalist.org/observations/8360473,https://inaturalist-open-data.s3.amazonaws.com/photos/11112434/medium.jpg,,2,0,FALSE,"Tilden Regional Park, Berkeley, CA, US",37.90506667,-122.2599867,,,,Contra Costa,Pink Honeysuckle,Lonicera hispidula,Pink Honeysuckle,Plantae,53416,Caprifoliaceae,Lonicera,Lonicera hispidula
8318948,10/8/17,2017-10-08 23:59:18 UTC,Pacific Time (US & Canada),research,https://www.inaturalist.org/observations/8318948,https://static.inaturalist.org/photos/11047662/medium.jpg,,1,0,FALSE,"Tilden Regional Park, Berkeley, CA, US",37.88545195,-122.2460094,10,,,Contra Costa,panicled willowherb,Epilobium brachycarpum,panicled willowherb,Plantae,52971,Onagraceae,Epilobium,Epilobium brachycarpum
8418127,10/15/17,2017-10-15 18:24:13 UTC,Pacific Time (US & Canada),research,https://www.inaturalist.org/observations/8418127,https://static.inaturalist.org/photos/11206248/medium.jpg,,2,0,FALSE,"Tilden Regional Park, Berkeley, CA, US",37.89398833,-122.243125,,,,Contra Costa,coffeeberry,Frangula californica,coffeeberry,Plantae,53423,Rhamnaceae,Frangula,Frangula californica
8624641,10/20/17,2017-10-20 19:10:08 UTC,Pacific Time (US & Canada),research,https://www.inaturalist.org/observations/8624641,https://static.inaturalist.org/photos/11540573/medium.jpg,,1,0,FALSE,"Tilden Regional Park, Berkeley, CA, US",37.88508104,-122.2457203,525,,,Contra Costa,coast silk tassel,Garrya elliptica,Coast silk tassel,Plantae,53399,Garryaceae,Garrya,Garrya elliptica
8541513,10/21/17,2017-10-21 16:22:00 UTC,Pacific Time (US & Canada),research,https://www.inaturalist.org/observations/8541513,https://inaturalist-open-data.s3.amazonaws.com/photos/11409405/medium.jpg,Thistle! Still need to learn how to tell these apart...,3,0,FALSE,"Contra Costa County, CA, USA",37.90824695,-122.2471046,378,,,Contra Costa,Bull Thistle,Cirsium vulgare,Bull Thistle,Plantae,52989,Asteraceae,Cirsium,Cirsium vulgare
8597533,10/27/17,2017-10-27 20:15:00 UTC,Pacific Time (US & Canada),research,https://www.inaturalist.org/observations/8597533,https://static.inaturalist.org/photos/11493624/medium.jpg,,1,0,FALSE,"Contra Costa County, CA, USA",37.91239468,-122.2690129,183,,,Contra Costa,red osier dogwood,Cornus sericea,red osier dogwood,Plantae,53387,Cornaceae,Cornus,Cornus sericea
8597538,10/27/17,2017-10-27 20:17:00 UTC,Pacific Time (US & Canada),research,https://www.inaturalist.org/observations/8597538,https://static.inaturalist.org/photos/11493796/medium.jpg,,1,0,FALSE,"Contra Costa County, CA, USA",37.91222539,-122.2687769,31,,,Contra Costa,marsh baccharis,Baccharis glutinosa,marsh baccharis,Plantae,75727,Asteraceae,Baccharis,Baccharis glutinosa
8883451,10/27/17,2017-10-27 20:26:00 UTC,Pacific Time (US & Canada),research,https://www.inaturalist.org/observations/8883451,https://inaturalist-open-data.s3.amazonaws.com/photos/11947679/medium.jpg,,1,0,FALSE,"Kensington, CA, USA",37.90935081,-122.2673305,,,,Contra Costa,Pink Honeysuckle,Lonicera hispidula,Pink Honeysuckle,Plantae,53416,Caprifoliaceae,Lonicera,Lonicera hispidula
8603093,10/29/17,2017-10-29 16:41:34 UTC,Pacific Time (US & Canada),research,https://www.inaturalist.org/observations/8603093,https://inaturalist-open-data.s3.amazonaws.com/photos/11503652/medium.jpeg,,2,0,FALSE,"Tilden Regional Park, Contra Costa County, US-CA, US",37.8970183,-122.2515005,19,,,Contra Costa,Late cotoneaster,Cotoneaster coriaceus,Late cotoneaster,Plantae,411074,Rosaceae,Cotoneaster,Cotoneaster coriaceus
8603112,10/29/17,2017-10-29 16:56:52 UTC,Pacific Time (US & Canada),research,https://www.inaturalist.org/observations/8603112,https://inaturalist-open-data.s3.amazonaws.com/photos/11503692/medium.jpeg,,1,0,FALSE,"Tilden Regional Park, Contra Costa County, US-CA, US",37.89768578,-122.2506513,9,,,Contra Costa,ribwort plantain,Plantago lanceolata,ribwort plantain,Plantae,53178,Plantaginaceae,Plantago,Plantago lanceolata
8603115,10/29/17,2017-10-29 16:59:06 UTC,Pacific Time (US & Canada),research,https://www.inaturalist.org/observations/8603115,https://inaturalist-open-data.s3.amazonaws.com/photos/11503699/medium.jpeg,,2,0,FALSE,"Tilden Regional Park, Contra Costa County, US-CA, US",37.8947199,-122.2520951,800,,,Contra Costa,fringed willowherb,Epilobium ciliatum,fringed willowherb,Plantae,53050,Onagraceae,Epilobium,Epilobium ciliatum
8603118,10/29/17,2017-10-29 16:59:46 UTC,Pacific Time (US & Canada),research,https://www.inaturalist.org/observations/8603118,https://inaturalist-open-data.s3.amazonaws.com/photos/11503709/medium.jpeg,,1,0,FALSE,"Selby Trail, Berkeley, CA 94708, USA",37.89767056,-122.2505278,9,,,Contra Costa,American brooklime,Veronica americana,American brooklime,Plantae,57277,Plantaginaceae,Veronica,Veronica americana
8603140,10/29/17,2017-10-29 17:03:51 UTC,Pacific Time (US & Canada),research,https://www.inaturalist.org/observations/8603140,https://inaturalist-open-data.s3.amazonaws.com/photos/11503837/medium.jpeg,,1,0,FALSE,"Tilden Regional Park, Contra Costa County, US-CA, US",37.89681562,-122.2496497,7,,,Contra Costa,Pacific Willow,Salix lasiandra,Pacific Willow,Plantae,78943,Salicaceae,Salix,Salix lasiandra
8603223,10/29/17,2017-10-29 17:13:28 UTC,Pacific Time (US & Canada),research,https://www.inaturalist.org/observations/8603223,https://inaturalist-open-data.s3.amazonaws.com/photos/11504079/medium.jpeg,No odor,2,0,FALSE,"Tilden Regional Park, Contra Costa County, US-CA, US",37.89532965,-122.248255,9,,,Contra Costa,scarlet monkeyflower,Erythranthe cardinalis,scarlet monkeyflower,Plantae,319974,Phrymaceae,Erythranthe,Erythranthe cardinalis
8603321,10/29/17,2017-10-29 17:31:48 UTC,Pacific Time (US & Canada),research,https://www.inaturalist.org/observations/8603321,https://inaturalist-open-data.s3.amazonaws.com/photos/11504187/medium.jpeg,,1,0,FALSE,"Tilden Regional Park, Contra Costa County, US-CA, US",37.89526814,-122.2482968,9,,,Contra Costa,Common Snowberry,Symphoricarpos albus,Common Snowberry,Plantae,48523,Caprifoliaceae,Symphoricarpos,Symphoricarpos albus
8603327,10/29/17,2017-10-29 17:33:47 UTC,Pacific Time (US & Canada),research,https://www.inaturalist.org/observations/8603327,https://inaturalist-open-data.s3.amazonaws.com/photos/11504213/medium.jpeg,,1,0,FALSE,"Tilden Regional Park, Contra Costa County, US-CA, US",37.89526451,-122.2484317,9,,,Contra Costa,Crevice Alumroot,Heuchera micrantha,crevice alumroot,Plantae,51274,Saxifragaceae,Heuchera,Heuchera micrantha
8603354,10/29/17,2017-10-29 17:36:57 UTC,Pacific Time (US & Canada),research,https://www.inaturalist.org/observations/8603354,https://inaturalist-open-data.s3.amazonaws.com/photos/11504260/medium.jpeg,,1,0,FALSE,"Tilden Regional Park, Contra Costa County, US-CA, US",37.89518831,-122.2488664,22,,,Contra Costa,Pacific Poison Oak,Toxicodendron diversilobum,Pacific poison oak,Plantae,51080,Anacardiaceae,Toxicodendron,Toxicodendron diversilobum
8603365,10/29/17,2017-10-29 17:38:16 UTC,Pacific Time (US & Canada),research,https://www.inaturalist.org/observations/8603365,https://inaturalist-open-data.s3.amazonaws.com/photos/11504276/medium.jpeg,,1,0,FALSE,"Tilden Regional Park, Contra Costa County, US-CA, US",37.89487144,-122.2496767,9,,,Contra Costa,Armenian Blackberry,Rubus armeniacus,Armenian Blackberry,Plantae,61317,Rosaceae,Rubus,Rubus armeniacus
8603407,10/29/17,2017-10-29 17:56:17 UTC,Pacific Time (US & Canada),research,https://www.inaturalist.org/observations/8603407,https://inaturalist-open-data.s3.amazonaws.com/photos/11504324/medium.jpeg,,1,0,FALSE,"Tilden Regional Park, Contra Costa County, US-CA, US",37.89505074,-122.2507373,9,,,Contra Costa,red osier dogwood,Cornus sericea,red osier dogwood,Plantae,53387,Cornaceae,Cornus,Cornus sericea
8603411,10/29/17,2017-10-29 18:39:29 UTC,Pacific Time (US & Canada),research,https://www.inaturalist.org/observations/8603411,https://static.inaturalist.org/photos/11504339/medium.jpeg,,1,0,FALSE,"Lake Anza Trail, Berkeley, CA 94708, USA",37.89511108,-122.2502213,,,,Contra Costa,snowberry,Symphoricarpos albus laevigatus,garden snowberry,Plantae,48525,Caprifoliaceae,Symphoricarpos,Symphoricarpos albus
8603412,10/29/17,2017-10-29 17:58:08 UTC,Pacific Time (US & Canada),research,https://www.inaturalist.org/observations/8603412,https://inaturalist-open-data.s3.amazonaws.com/photos/11504342/medium.jpeg,,1,0,FALSE,"Tilden Regional Park, Contra Costa County, US-CA, US",37.89508371,-122.2509217,9,,,Contra Costa,California hazelnut,Corylus cornuta californica,California hazelnut,Plantae,53368,Betulaceae,Corylus,Corylus cornuta
8603420,10/29/17,2017-10-29 18:05:46 UTC,Pacific Time (US & Canada),research,https://www.inaturalist.org/observations/8603420,https://inaturalist-open-data.s3.amazonaws.com/photos/11504359/medium.jpeg,,1,0,FALSE,"Tilden Regional Park, Contra Costa County, US-CA, US",37.89483787,-122.2515669,9,,,Contra Costa,Greater plantain,Plantago major,greater plantain,Plantae,58961,Plantaginaceae,Plantago,Plantago major
8603431,10/29/17,2017-10-29 18:24:45 UTC,Pacific Time (US & Canada),research,https://www.inaturalist.org/observations/8603431,https://inaturalist-open-data.s3.amazonaws.com/photos/11504384/medium.jpeg,,1,0,FALSE,"Tilden Regional Park, Contra Costa County, US-CA, US",37.89845546,-122.2520329,7,,,Contra Costa,California hazelnut,Corylus cornuta californica,California hazelnut,Plantae,53368,Betulaceae,Corylus,Corylus cornuta
8603480,10/29/17,2017-10-29 18:28:42 UTC,Pacific Time (US & Canada),research,https://www.inaturalist.org/observations/8603480,https://static.inaturalist.org/photos/11504445/medium.jpeg,,3,0,FALSE,"Tilden Regional Park, Contra Costa County, US-CA, US",37.89515305,-122.2455978,,,,Contra Costa,common selfheal,Prunella vulgaris,common selfheal,Plantae,52764,Lamiaceae,Prunella,Prunella vulgaris
8603578,10/29/17,2017-10-29 17:24:00 UTC,Pacific Time (US & Canada),research,https://www.inaturalist.org/observations/8603578,https://inaturalist-open-data.s3.amazonaws.com/photos/11504477/medium.jpeg,,2,0,FALSE,"Contra Costa County, CA, USA",37.89524333,-122.2488517,,,,Contra Costa,Italian thistle,Carduus pycnocephalus,Italian thistle,Plantae,52990,Asteraceae,Carduus,Carduus pycnocephalus
8603586,10/29/17,2017-10-29 17:39:00 UTC,Pacific Time (US & Canada),research,https://www.inaturalist.org/observations/8603586,https://inaturalist-open-data.s3.amazonaws.com/photos/11504507/medium.jpeg,,1,0,FALSE,"Contra Costa County, CA, USA",37.89550333,-122.2506117,,,,Contra Costa,French Broom,Genista monspessulana,French broom,Plantae,53403,Fabaceae,Genista,Genista monspessulana
8603587,10/29/17,2017-10-29 17:43:00 UTC,Pacific Time (US & Canada),research,https://www.inaturalist.org/observations/8603587,https://inaturalist-open-data.s3.amazonaws.com/photos/11504512/medium.jpeg,,1,0,FALSE,"Contra Costa County, CA, USA",37.89505167,-122.25159,,,,Contra Costa,curly dock,Rumex crispus,curled dock,Plantae,53197,Polygonaceae,Rumex,Rumex crispus
8603589,10/29/17,2017-10-29 17:44:00 UTC,Pacific Time (US & Canada),research,https://www.inaturalist.org/observations/8603589,https://inaturalist-open-data.s3.amazonaws.com/photos/11504517/medium.jpeg,,2,0,FALSE,"Contra Costa County, CA, USA",37.89514,-122.2515233,,,,Contra Costa,bristly oxtongue,Helminthotheca echioides,bristly oxtongue,Plantae,61906,Asteraceae,Helminthotheca,Helminthotheca echioides
8603590,10/29/17,2017-10-29 17:44:00 UTC,Pacific Time (US & Canada),research,https://www.inaturalist.org/observations/8603590,https://inaturalist-open-data.s3.amazonaws.com/photos/11504521/medium.jpeg,,1,0,FALSE,"Contra Costa County, CA, USA",37.89543833,-122.25164,,,,Contra Costa,Armenian Blackberry,Rubus armeniacus,Armenian Blackberry,Plantae,61317,Rosaceae,Rubus,Rubus armeniacus
8603591,10/29/17,2017-10-29 17:45:00 UTC,Pacific Time (US & Canada),research,https://www.inaturalist.org/observations/8603591,https://inaturalist-open-data.s3.amazonaws.com/photos/11504529/medium.jpeg,,2,0,FALSE,"Contra Costa County, CA, USA",37.89543833,-122.25164,,,,Contra Costa,Toyon,Heteromeles arbutifolia,Toyon,Plantae,53405,Rosaceae,Heteromeles,Heteromeles arbutifolia
8603592,10/29/17,2017-10-29 17:45:00 UTC,Pacific Time (US & Canada),research,https://www.inaturalist.org/observations/8603592,https://inaturalist-open-data.s3.amazonaws.com/photos/11504533/medium.jpeg,,1,0,FALSE,"Contra Costa County, CA, USA",37.89543833,-122.25164,,,,Contra Costa,Coast Live Oak,Quercus agrifolia,coast live oak,Plantae,47850,Fagaceae,Quercus,Quercus agrifolia
8603659,10/29/17,2017-10-29 17:01:38 UTC,Pacific Time (US & Canada),research,https://www.inaturalist.org/observations/8603659,https://inaturalist-open-data.s3.amazonaws.com/photos/11504800/medium.jpg,,1,0,FALSE,"Tilden Regional Park, Berkeley, CA, US",37.89798,-122.2516033,,,,Contra Costa,trailing blackberry,Rubus ursinus,trailing blackberry,Plantae,53445,Rosaceae,Rubus,Rubus ursinus
8604071,10/29/17,2017-10-29 17:02:02 UTC,Pacific Time (US & Canada),research,https://www.inaturalist.org/observations/8604071,https://inaturalist-open-data.s3.amazonaws.com/photos/11505540/medium.jpeg,,1,0,FALSE,"Lake Anza Trail, Berkeley, CA 94708, USA",37.89704895,-122.25,,,,Contra Costa,Coast Live Oak,Quercus agrifolia,coast live oak,Plantae,47850,Fagaceae,Quercus,Quercus agrifolia
8605450,10/29/17,2017-10-29 18:40:56 UTC,Pacific Time (US & Canada),research,https://www.inaturalist.org/observations/8605450,https://inaturalist-open-data.s3.amazonaws.com/photos/11507953/medium.jpeg,,1,0,FALSE,"Meadows Canyon Trail, Berkeley, CA 94708, USA",37.904244,-122.2520951,1399,,,Contra Costa,Broad-leaved Helleborine,Epipactis helleborine,Broad-leafed Helleborine,Plantae,50717,Orchidaceae,Epipactis,Epipactis helleborine
8606927,10/29/17,2017-10-29 16:00:00 UTC,Pacific Time (US & Canada),research,https://www.inaturalist.org/observations/8606927,https://inaturalist-open-data.s3.amazonaws.com/photos/11509988/medium.jpeg,,2,0,FALSE,"Contra Costa County, CA, USA",37.89735333,-122.250395,,,,Contra Costa,American brooklime,Veronica americana,American brooklime,Plantae,57277,Plantaginaceae,Veronica,Veronica americana
8606929,10/29/17,2017-10-29 16:02:00 UTC,Pacific Time (US & Canada),research,https://www.inaturalist.org/observations/8606929,https://inaturalist-open-data.s3.amazonaws.com/photos/11509998/medium.jpeg,,1,0,FALSE,"Contra Costa County, CA, USA",37.89728333,-122.2505217,,,,Contra Costa,Ribwort Plantain,Plantago lanceolata,ribwort plantain,Plantae,53178,Plantaginaceae,Plantago,Plantago lanceolata
8606931,10/29/17,2017-10-29 16:07:00 UTC,Pacific Time (US & Canada),research,https://www.inaturalist.org/observations/8606931,https://inaturalist-open-data.s3.amazonaws.com/photos/11510011/medium.jpeg,,2,0,FALSE,"Contra Costa County, CA, USA",37.89651,-122.2503483,,,,Contra Costa,Toyon,Heteromeles arbutifolia,Toyon,Plantae,53405,Rosaceae,Heteromeles,Heteromeles arbutifolia
8606932,10/29/17,2017-10-29 16:10:00 UTC,Pacific Time (US & Canada),research,https://www.inaturalist.org/observations/8606932,https://inaturalist-open-data.s3.amazonaws.com/photos/11510015/medium.jpeg,,2,0,FALSE,"Contra Costa County, CA, USA",37.89673833,-122.2497617,,,,Contra Costa,horseweed,Erigeron canadensis,horseweed,Plantae,76907,Asteraceae,Erigeron,Erigeron canadensis
8606933,10/29/17,2017-10-29 16:11:00 UTC,Pacific Time (US & Canada),research,https://www.inaturalist.org/observations/8606933,https://inaturalist-open-data.s3.amazonaws.com/photos/11510018/medium.jpeg,,2,0,FALSE,"Contra Costa County, CA, USA",37.896765,-122.249595,,,,Contra Costa,Coast Live Oak,Quercus agrifolia,coast live oak,Plantae,47850,Fagaceae,Quercus,Quercus agrifolia
8606939,10/29/17,2017-10-29 16:51:00 UTC,Pacific Time (US & Canada),research,https://www.inaturalist.org/observations/8606939,https://inaturalist-open-data.s3.amazonaws.com/photos/11510045/medium.jpeg,,2,0,FALSE,"Contra Costa County, CA, USA",37.89502833,-122.2465683,,,,Contra Costa,watercress,Nasturtium officinale,watercress,Plantae,78174,Brassicaceae,Nasturtium,Nasturtium officinale
8606940,10/29/17,2017-10-29 16:57:00 UTC,Pacific Time (US & Canada),research,https://www.inaturalist.org/observations/8606940,https://inaturalist-open-data.s3.amazonaws.com/photos/11510047/medium.jpeg,,2,0,FALSE,"Tilden Regional Park, Contra Costa, California, United States",37.89521333,-122.24649,,,,Contra Costa,watercress,Nasturtium officinale,watercress,Plantae,78174,Brassicaceae,Nasturtium,Nasturtium officinale
8608003,10/29/17,2017-10-29 18:08:44 UTC,Pacific Time (US & Canada),research,https://www.inaturalist.org/observations/8608003,https://inaturalist-open-data.s3.amazonaws.com/photos/11512274/medium.jpeg,,2,1,FALSE,"Lake Anza Trail, Berkeley, CA 94708, USA",37.89509964,-122.2516174,,,,Contra Costa,bigleaf maple,Acer macrophyllum,bigleaf maple,Plantae,48227,Sapindaceae,Acer,Acer macrophyllum
8608075,10/29/17,2017-10-29 22:41:09 UTC,Pacific Time (US & Canada),research,https://www.inaturalist.org/observations/8608075,https://inaturalist-open-data.s3.amazonaws.com/photos/11512414/medium.jpeg,,1,0,FALSE,"Tilden Regional Park, Contra Costa County, US-CA, US",37.90148418,-122.2472274,13,,,Contra Costa,coyote brush,Baccharis pilularis,coyote brush,Plantae,53359,Asteraceae,Baccharis,Baccharis pilularis
8608084,10/29/17,2017-10-29 22:45:45 UTC,Pacific Time (US & Canada),research,https://www.inaturalist.org/observations/8608084,https://inaturalist-open-data.s3.amazonaws.com/photos/11512436/medium.jpeg,,2,0,FALSE,"Seaview Trail, Berkeley, CA 94708, USA",37.90193592,-122.2459823,12,,,Contra Costa,California Bay,Umbellularia californica,California bay,Plantae,48807,Lauraceae,Umbellularia,Umbellularia californica
8608088,10/29/17,2017-10-29 22:52:12 UTC,Pacific Time (US & Canada),research,https://www.inaturalist.org/observations/8608088,https://inaturalist-open-data.s3.amazonaws.com/photos/11512442/medium.jpeg,,1,0,FALSE,"Seaview Trail, Orinda, CA 94563, USA",37.90040236,-122.2421711,13,,,Contra Costa,trailing blackberry,Rubus ursinus,trailing blackberry,Plantae,53445,Rosaceae,Rubus,Rubus ursinus
8608091,10/29/17,2017-10-29 22:53:47 UTC,Pacific Time (US & Canada),research,https://www.inaturalist.org/observations/8608091,https://inaturalist-open-data.s3.amazonaws.com/photos/11512452/medium.jpeg,Pungent unpleasant odor,1,0,FALSE,"Tilden Regional Park, Contra Costa County, US-CA, US",37.90051238,-122.2421463,9,,,Contra Costa,poison hemlock,Conium maculatum,poison hemlock,Plantae,52998,Apiaceae,Conium,Conium maculatum
8608094,10/29/17,2017-10-29 22:55:14 UTC,Pacific Time (US & Canada),research,https://www.inaturalist.org/observations/8608094,https://inaturalist-open-data.s3.amazonaws.com/photos/11512468/medium.jpeg,,1,0,FALSE,"Seaview Trail, Orinda, CA 94563, USA",37.9003589,-122.2420626,9,,,Contra Costa,red-berried elder,Sambucus racemosa,red-berried elder,Plantae,57824,Viburnaceae,Sambucus,Sambucus racemosa
8608102,10/29/17,2017-10-29 23:08:33 UTC,Pacific Time (US & Canada),research,https://www.inaturalist.org/observations/8608102,https://inaturalist-open-data.s3.amazonaws.com/photos/11512497/medium.jpeg,Hurts to touch.,1,0,FALSE,"Seaview Trail, Orinda, CA 94563, USA",37.89613876,-122.2371113,19,,,Contra Costa,hoary nettle,Urtica gracilis holosericea,hoary nettle,Plantae,141851,Urticaceae,Urtica,Urtica gracilis
8608107,10/29/17,2017-10-29 23:15:21 UTC,Pacific Time (US & Canada),research,https://www.inaturalist.org/observations/8608107,https://inaturalist-open-data.s3.amazonaws.com/photos/11512518/medium.jpeg,,1,0,FALSE,"Tilden Regional Park, Contra Costa County, US-CA, US",37.89400442,-122.2341581,7,,,Contra Costa,curly dock,Rumex crispus,curled dock,Plantae,53197,Polygonaceae,Rumex,Rumex crispus
8608126,10/29/17,2017-10-29 23:33:30 UTC,Pacific Time (US & Canada),research,https://www.inaturalist.org/observations/8608126,https://inaturalist-open-data.s3.amazonaws.com/photos/11512528/medium.jpeg,,1,0,FALSE,"Tilden Regional Park, Contra Costa County, US-CA, US",37.89040407,-122.2322722,6,,,Contra Costa,Coast Live Oak,Quercus agrifolia,coast live oak,Plantae,47850,Fagaceae,Quercus,Quercus agrifolia
8634199,10/29/17,2017-10-29 16:44:00 UTC,Pacific Time (US & Canada),research,https://www.inaturalist.org/observations/8634199,https://inaturalist-open-data.s3.amazonaws.com/photos/11540751/medium.jpeg,,1,0,FALSE,"Contra Costa County, CA, USA",37.89718611,-122.2514194,,,,Contra Costa,Ribwort Plantain,Plantago lanceolata,ribwort plantain,Plantae,53178,Plantaginaceae,Plantago,Plantago lanceolata
8634201,10/29/17,2017-10-29 16:48:00 UTC,Pacific Time (US & Canada),research,https://www.inaturalist.org/observations/8634201,https://inaturalist-open-data.s3.amazonaws.com/photos/11540756/medium.jpeg,,1,0,FALSE,"Contra Costa County, CA, USA",37.89721389,-122.2513194,,,,Contra Costa,Coast Live Oak,Quercus agrifolia,coast live oak,Plantae,47850,Fagaceae,Quercus,Quercus agrifolia
8634209,10/29/17,2017-10-29 17:01:00 UTC,Pacific Time (US & Canada),research,https://www.inaturalist.org/observations/8634209,https://inaturalist-open-data.s3.amazonaws.com/photos/11540784/medium.jpeg,,2,0,FALSE,"Contra Costa County, CA, USA",37.89798056,-122.2516028,,,,Contra Costa,Armenian Blackberry,Rubus armeniacus,Armenian Blackberry,Plantae,61317,Rosaceae,Rubus,Rubus armeniacus
8634211,10/29/17,2017-10-29 17:09:00 UTC,Pacific Time (US & Canada),research,https://www.inaturalist.org/observations/8634211,https://inaturalist-open-data.s3.amazonaws.com/photos/11540789/medium.jpeg,,4,0,FALSE,"Contra Costa County, CA, USA",37.89754167,-122.251,,,,Contra Costa,Pacific madrone,Arbutus menziesii,Pacific madrone,Plantae,51046,Ericaceae,Arbutus,Arbutus menziesii
8634222,10/29/17,2017-10-29 17:42:00 UTC,Pacific Time (US & Canada),research,https://www.inaturalist.org/observations/8634222,https://inaturalist-open-data.s3.amazonaws.com/photos/11540819/medium.jpeg,,1,0,FALSE,"Contra Costa County, CA, USA",37.89508889,-122.2468806,,,,Contra Costa,watercress,Nasturtium officinale,watercress,Plantae,78174,Brassicaceae,Nasturtium,Nasturtium officinale
8634223,10/29/17,2017-10-29 17:43:00 UTC,Pacific Time (US & Canada),research,https://www.inaturalist.org/observations/8634223,https://inaturalist-open-data.s3.amazonaws.com/photos/11540820/medium.jpeg,,1,0,FALSE,"Contra Costa County, CA, USA",37.89513333,-122.2469111,,,,Contra Costa,Stinging nettle,Urtica dioica,great stinging nettle,Plantae,51884,Urticaceae,Urtica,Urtica dioica
8634226,10/29/17,2017-10-29 18:40:00 UTC,Pacific Time (US & Canada),research,https://www.inaturalist.org/observations/8634226,https://inaturalist-open-data.s3.amazonaws.com/photos/11540827/medium.jpeg,,1,0,FALSE,"Lake Anza, California 94708, USA",37.896358,-122.2501453,200,,,Contra Costa,trailing blackberry,Rubus ursinus,trailing blackberry,Plantae,53445,Rosaceae,Rubus,Rubus ursinus
8634228,10/29/17,2017-10-29 18:52:00 UTC,Pacific Time (US & Canada),research,https://www.inaturalist.org/observations/8634228,https://inaturalist-open-data.s3.amazonaws.com/photos/11540830/medium.jpeg,,3,0,FALSE,"Lake Anza, California 94708, USA",37.896358,-122.2501453,200,,,Contra Costa,Common Snowberry,Symphoricarpos albus,Common Snowberry,Plantae,48523,Caprifoliaceae,Symphoricarpos,Symphoricarpos albus
8638532,10/29/17,2017-10-29 17:37:09 UTC,Pacific Time (US & Canada),research,https://www.inaturalist.org/observations/8638532,https://static.inaturalist.org/photos/11563263/medium.jpg,,2,0,FALSE,"Tilden Regional Park, Berkeley, CA, US",37.89535487,-122.2509413,227,,,Contra Costa,common ivy,Hedera helix,common ivy,Plantae,55882,Araliaceae,Hedera,Hedera helix
8638846,10/29/17,2017-10-29 17:04:37 UTC,Pacific Time (US & Canada),research,https://www.inaturalist.org/observations/8638846,https://static.inaturalist.org/photos/11563835/medium.jpg,,2,0,FALSE,"Tilden Regional Park, Berkeley, CA, US",37.89500623,-122.250795,739,,,Contra Costa,Coast Live Oak,Quercus agrifolia,coast live oak,Plantae,47850,Fagaceae,Quercus,Quercus agrifolia
8639429,10/29/17,2017-10-29 17:45:43 UTC,Pacific Time (US & Canada),research,https://www.inaturalist.org/observations/8639429,https://static.inaturalist.org/photos/11564667/medium.jpg,,2,0,FALSE,"Tilden Regional Park, Berkeley, CA, US",37.8952024,-122.2469784,5,,,Contra Costa,broadleaf forget-me-not,Myosotis latifolia,broadleaf forget-me-not,Plantae,49132,Boraginaceae,Myosotis,Myosotis latifolia
8794014,11/12/17,2017-11-12 19:43:07 UTC,Pacific Time (US & Canada),research,https://www.inaturalist.org/observations/8794014,https://inaturalist-open-data.s3.amazonaws.com/photos/11805882/medium.jpeg,,1,0,FALSE,"Tilden Regional Park, Contra Costa County, US-CA, US",37.91163768,-122.2653908,10,,,Contra Costa,Eurabbie,Eucalyptus globulus,Eurabbie,Plantae,53398,Myrtaceae,Eucalyptus,Eucalyptus globulus
8857465,11/18/17,2017-11-18 23:45:06 UTC,Pacific Time (US & Canada),research,https://www.inaturalist.org/observations/8857465,https://inaturalist-open-data.s3.amazonaws.com/photos/11905848/medium.jpg,,1,0,FALSE,"Tilden Regional Park, Berkeley, CA, US",37.902175,-122.2541883,10,,,Contra Costa,Common Snowberry,Symphoricarpos albus,Common Snowberry,Plantae,48523,Caprifoliaceae,Symphoricarpos,Symphoricarpos albus
8866346,11/19/17,2017-11-19 19:09:03 UTC,Pacific Time (US & Canada),research,https://www.inaturalist.org/observations/8866346,https://static.inaturalist.org/photos/11920847/medium.jpg,,1,0,FALSE,"Tilden Regional Park, Berkeley, CA, US",37.90410528,-122.2463548,5,,,Contra Costa,Cape ivy,Delairea odorata,Cape-ivy,Plantae,53208,Asteraceae,Delairea,Delairea odorata
8866354,11/19/17,2017-11-19 20:28:39 UTC,Pacific Time (US & Canada),research,https://www.inaturalist.org/observations/8866354,https://static.inaturalist.org/photos/11920880/medium.jpg,,1,0,FALSE,"Tilden Regional Park, Berkeley, CA, US",37.90563255,-122.2497235,5,,,Contra Costa,spear thistle,Cirsium vulgare,Bull Thistle,Plantae,52989,Asteraceae,Cirsium,Cirsium vulgare
8866357,11/19/17,2017-11-19 20:29:42 UTC,Pacific Time (US & Canada),research,https://www.inaturalist.org/observations/8866357,https://static.inaturalist.org/photos/11920885/medium.jpg,,3,1,FALSE,"Tilden Regional Park, Contra Costa County, US-CA, US",37.9057639,-122.2495801,5,,,Contra Costa,fuller's teasel,Dipsacus sativus,fuller's teasel,Plantae,53028,Caprifoliaceae,Dipsacus,Dipsacus sativus
8866358,11/19/17,2017-11-19 20:34:13 UTC,Pacific Time (US & Canada),research,https://www.inaturalist.org/observations/8866358,https://static.inaturalist.org/photos/11920889/medium.jpg,,1,0,FALSE,"Tilden Regional Park, Contra Costa County, US-CA, US",37.90623236,-122.2495377,5,,,Contra Costa,spear thistle,Cirsium vulgare,Bull Thistle,Plantae,52989,Asteraceae,Cirsium,Cirsium vulgare
8866366,11/19/17,2017-11-19 20:59:43 UTC,Pacific Time (US & Canada),research,https://www.inaturalist.org/observations/8866366,https://static.inaturalist.org/photos/11920894/medium.jpg,var. californica ,1,0,FALSE,"Tilden Regional Park, Contra Costa County, US-CA, US",37.90745197,-122.2535772,5,,,Contra Costa,beaked hazelnut,Corylus cornuta,beaked hazelnut,Plantae,53374,Betulaceae,Corylus,Corylus cornuta
8867294,11/19/17,2017-11-19 18:57:58 UTC,Pacific Time (US & Canada),research,https://www.inaturalist.org/observations/8867294,https://static.inaturalist.org/photos/11922132/medium.jpg,,2,0,FALSE,"Tilden Regional Park, Berkeley, CA, US",37.90321333,-122.2476417,5,,,Contra Costa,yerba buena,Clinopodium douglasii,yerba buena,Plantae,53203,Lamiaceae,Clinopodium,Clinopodium douglasii
8878311,11/19/17,2017-11-19 18:43:18 UTC,Pacific Time (US & Canada),research,https://www.inaturalist.org/observations/8878311,https://static.inaturalist.org/photos/11956106/medium.jpg,,1,0,FALSE,"Tilden Regional Park, Berkeley, CA, US",37.90200833,-122.2509083,5,,,Contra Costa,Cherry-plum,Prunus cerasifera,Cherry-plum,Plantae,55837,Rosaceae,Prunus,Prunus cerasifera
8932761,11/25/17,2017-11-25 21:56:20 UTC,Pacific Time (US & Canada),research,https://www.inaturalist.org/observations/8932761,https://static.inaturalist.org/photos/12032488/medium.jpg,,1,0,FALSE,"Tilden Regional Park, Orinda, CA, US",37.8924686,-122.2384652,5,,,Contra Costa,eggleaf spurge,Euphorbia oblongata,eggleaf spurge,Plantae,77117,Euphorbiaceae,Euphorbia,Euphorbia oblongata
8940932,11/25/17,2017-11-26 00:11:22 UTC,Pacific Time (US & Canada),research,https://www.inaturalist.org/observations/8940932,https://inaturalist-open-data.s3.amazonaws.com/photos/12073126/medium.jpg,,2,0,FALSE,"Tilden Regional Park, Contra Costa County, US-CA, US",37.91573107,-122.2520865,10,,,Contra Costa,coyote brush,Baccharis pilularis,coyote brush,Plantae,53359,Asteraceae,Baccharis,Baccharis pilularis
8960734,11/25/17,2017-11-26 00:34:44 UTC,Pacific Time (US & Canada),research,https://www.inaturalist.org/observations/8960734,https://inaturalist-open-data.s3.amazonaws.com/photos/12379562/medium.jpg,,2,0,FALSE,"Tilden Regional Park, Contra Costa County, US-CA, US",37.91106566,-122.249655,5,,,Contra Costa,Yellow Starthistle,Centaurea solstitialis,Yellow Star-Thistle,Plantae,52588,Asteraceae,Centaurea,Centaurea solstitialis
9625472,12/2/17,2017-12-02 20:54:21 UTC,Pacific Time (US & Canada),research,https://www.inaturalist.org/observations/9625472,https://static.inaturalist.org/photos/13138811/medium.jpg,,4,0,FALSE,"Tilden Regional Park, Berkeley, CA, US",37.89362498,-122.2450703,1191,,,Contra Costa,California bay,Umbellularia californica,California bay,Plantae,48807,Lauraceae,Umbellularia,Umbellularia californica
9059008,12/5/17,2017-12-05 21:03:33 UTC,Pacific Time (US & Canada),research,https://www.inaturalist.org/observations/9059008,https://inaturalist-open-data.s3.amazonaws.com/photos/12230260/medium.jpeg,,2,0,FALSE,"S Park Dr, California, USA",37.89259279,-122.2423516,10,,,Contra Costa,California bay,Umbellularia californica,California bay,Plantae,48807,Lauraceae,Umbellularia,Umbellularia californica
9086536,12/6/17,2017-12-07 00:06:00 UTC,Pacific Time (US & Canada),research,https://www.inaturalist.org/observations/9086536,https://inaturalist-open-data.s3.amazonaws.com/photos/12271718/medium.jpg,,1,0,FALSE,"Contra Costa County, CA, USA",37.891371,-122.2377342,,,,Contra Costa,holly-leaved cherry,Prunus ilicifolia ilicifolia,holly-leaved cherry,Plantae,59002,Rosaceae,Prunus,Prunus ilicifolia
9116377,12/10/17,2017-12-10 18:27:14 UTC,Pacific Time (US & Canada),research,https://www.inaturalist.org/observations/9116377,https://inaturalist-open-data.s3.amazonaws.com/photos/12317854/medium.jpeg,,1,0,FALSE,"Lower Packrat Trail, Kensington, CA 94708, USA",37.91145706,-122.2684479,,,,Contra Costa,red osier dogwood,Cornus sericea,red osier dogwood,Plantae,53387,Cornaceae,Cornus,Cornus sericea
9116657,12/10/17,2017-12-10 17:15:16 UTC,Pacific Time (US & Canada),research,https://www.inaturalist.org/observations/9116657,https://inaturalist-open-data.s3.amazonaws.com/photos/12318230/medium.jpeg,,1,0,FALSE,"Upper Packrat Trail, Kensington, CA 94708, USA",37.90973282,-122.2671432,,,,Contra Costa,Thimbleberry,Rubus parviflorus,thimbleberry,Plantae,51646,Rosaceae,Rubus,Rubus parviflorus
9128209,12/10/17,2017-12-10 17:11:00 UTC,Pacific Time (US & Canada),research,https://www.inaturalist.org/observations/9128209,https://inaturalist-open-data.s3.amazonaws.com/photos/12335329/medium.jpeg,,2,0,FALSE,"jewel lake, tilden park",37.908937,-122.265401,40,,,Contra Costa,Robertskruid,Geranium robertianum,herb Robert,Plantae,55925,Geraniaceae,Geranium,Geranium robertianum
9128217,12/10/17,2017-12-10 17:31:00 UTC,Pacific Time (US & Canada),research,https://www.inaturalist.org/observations/9128217,https://inaturalist-open-data.s3.amazonaws.com/photos/12335359/medium.jpeg,,2,0,FALSE,"jewel lake, tilden park",37.910749,-122.267611,30,,,Contra Costa,California beeplant,Scrophularia californica,California beeplant,Plantae,50812,Scrophulariaceae,Scrophularia,Scrophularia californica
9128220,12/10/17,2017-12-10 17:34:00 UTC,Pacific Time (US & Canada),research,https://www.inaturalist.org/observations/9128220,https://inaturalist-open-data.s3.amazonaws.com/photos/12335367/medium.jpeg,,2,0,FALSE,"jewel lake, tilden park",37.909428,-122.26642,20,,,Contra Costa,American brooklime,Veronica americana,American brooklime,Plantae,57277,Plantaginaceae,Veronica,Veronica americana
9128222,12/10/17,2017-12-10 17:35:00 UTC,Pacific Time (US & Canada),research,https://www.inaturalist.org/observations/9128222,https://inaturalist-open-data.s3.amazonaws.com/photos/12335370/medium.jpeg,,1,0,FALSE,"jewel lake, tilden park",37.909758,-122.266903,20,,,Contra Costa,trailing blackberry,Rubus ursinus,trailing blackberry,Plantae,53445,Rosaceae,Rubus,Rubus ursinus
9128229,12/10/17,2017-12-10 17:59:00 UTC,Pacific Time (US & Canada),research,https://www.inaturalist.org/observations/9128229,https://inaturalist-open-data.s3.amazonaws.com/photos/12335387/medium.jpeg,,2,0,FALSE,"jewel lake, tilden park",37.912873,-122.269446,30,,,Contra Costa,Toyon,Heteromeles arbutifolia,Toyon,Plantae,53405,Rosaceae,Heteromeles,Heteromeles arbutifolia
9128244,12/10/17,2017-12-10 18:32:00 UTC,Pacific Time (US & Canada),research,https://www.inaturalist.org/observations/9128244,https://inaturalist-open-data.s3.amazonaws.com/photos/12335430/medium.jpeg,,1,0,FALSE,tilden nature area,37.911196,-122.268143,10,,,Contra Costa,stinging nettle,Urtica dioica,great stinging nettle,Plantae,51884,Urticaceae,Urtica,Urtica dioica
9128254,12/10/17,2017-12-10 18:57:00 UTC,Pacific Time (US & Canada),research,https://www.inaturalist.org/observations/9128254,https://inaturalist-open-data.s3.amazonaws.com/photos/12335445/medium.jpeg,,2,0,FALSE,"Tilden Regional Park, Contra Costa County, US-CA, US",37.91169,-122.2675,6,,,Contra Costa,coyote brush,Baccharis pilularis,coyote brush,Plantae,53359,Asteraceae,Baccharis,Baccharis pilularis
9130756,12/10/17,2017-12-10 17:20:14 UTC,Pacific Time (US & Canada),research,https://www.inaturalist.org/observations/9130756,https://inaturalist-open-data.s3.amazonaws.com/photos/12339890/medium.jpg,BioBlitz,2,0,FALSE,"Tilden Regional Park, Kensington, CA, US",37.90974667,-122.2674033,5,,,Contra Costa,Coast Live Oak,Quercus agrifolia,coast live oak,Plantae,47850,Fagaceae,Quercus,Quercus agrifolia
9130953,12/10/17,2017-12-10 17:25:54 UTC,Pacific Time (US & Canada),research,https://www.inaturalist.org/observations/9130953,https://inaturalist-open-data.s3.amazonaws.com/photos/12340335/medium.jpg,BioBlitz ,1,0,FALSE,"Tilden Regional Park, Berkeley, CA, US",37.90993833,-122.2674633,10,,,Contra Costa,trailing blackberry,Rubus ursinus,trailing blackberry,Plantae,53445,Rosaceae,Rubus,Rubus ursinus
9130978,12/10/17,2017-12-10 17:45:06 UTC,Pacific Time (US & Canada),research,https://www.inaturalist.org/observations/9130978,https://inaturalist-open-data.s3.amazonaws.com/photos/12340434/medium.jpg,,1,0,FALSE,"Tilden Regional Park, Berkeley, CA, US",37.912425,-122.2696083,5,,,Contra Costa,common ivy,Hedera helix,common ivy,Plantae,55882,Araliaceae,Hedera,Hedera helix
9131068,12/10/17,2017-12-10 17:57:09 UTC,Pacific Time (US & Canada),research,https://www.inaturalist.org/observations/9131068,https://inaturalist-open-data.s3.amazonaws.com/photos/12340538/medium.jpg,BioBlitz ,2,0,FALSE,"Tilden Regional Park, Berkeley, CA, US",37.912425,-122.268555,5,,,Contra Costa,Pacific Wax myrtle,Morella californica,Pacific Wax myrtle,Plantae,61039,Myricaceae,Morella,Morella californica
9131638,12/10/17,2017-12-10 18:07:50 UTC,Pacific Time (US & Canada),research,https://www.inaturalist.org/observations/9131638,https://inaturalist-open-data.s3.amazonaws.com/photos/12341441/medium.jpg,BioBlitz ,1,0,FALSE,"Tilden Regional Park, Berkeley, CA, US",37.912045,-122.268525,5,,,Contra Costa,Crevice Alumroot,Heuchera micrantha,crevice alumroot,Plantae,51274,Saxifragaceae,Heuchera,Heuchera micrantha
9131746,12/10/17,2017-12-10 18:09:50 UTC,Pacific Time (US & Canada),research,https://www.inaturalist.org/observations/9131746,https://inaturalist-open-data.s3.amazonaws.com/photos/12341531/medium.jpg,Bio blitz ,2,0,FALSE,"Tilden Regional Park, Berkeley, CA, US",37.91187833,-122.2684167,5,,,Contra Costa,Stinging nettle,Urtica dioica,great stinging nettle,Plantae,51884,Urticaceae,Urtica,Urtica dioica
9131808,12/10/17,2017-12-10 18:19:29 UTC,Pacific Time (US & Canada),research,https://www.inaturalist.org/observations/9131808,https://inaturalist-open-data.s3.amazonaws.com/photos/12341669/medium.jpg,BioBlitz,1,0,FALSE,"Tilden Regional Park, Berkeley, CA, US",37.91077833,-122.2676167,5,,,Contra Costa,marsh baccharis,Baccharis glutinosa,marsh baccharis,Plantae,75727,Asteraceae,Baccharis,Baccharis glutinosa
9252201,12/10/17,2017-12-10 18:33:20 UTC,Pacific Time (US & Canada),research,https://www.inaturalist.org/observations/9252201,https://static.inaturalist.org/photos/12528035/medium.jpg,,1,0,FALSE,"Tilden Regional Park, Contra Costa County, US-CA, US",37.91114554,-122.2680336,5,,,Contra Costa,boxelder maple,Acer negundo,box elder,Plantae,47726,Sapindaceae,Acer,Acer negundo
9252205,12/10/17,2017-12-10 17:30:25 UTC,Pacific Time (US & Canada),research,https://www.inaturalist.org/observations/9252205,https://static.inaturalist.org/photos/12528043/medium.jpg,,1,0,FALSE,"Tilden Regional Park, Contra Costa County, US-CA, US",37.91018321,-122.2676846,5,,,Contra Costa,Pacific Poison Oak,Toxicodendron diversilobum,Pacific poison oak,Plantae,51080,Anacardiaceae,Toxicodendron,Toxicodendron diversilobum
9252236,12/10/17,2017-12-10 17:11:17 UTC,Pacific Time (US & Canada),research,https://www.inaturalist.org/observations/9252236,https://static.inaturalist.org/photos/12528092/medium.jpg,,2,0,FALSE,"Tilden Regional Park, Contra Costa County, US-CA, US",37.90910798,-122.2657041,10,,,Contra Costa,crevice alumroot,Heuchera micrantha,crevice alumroot,Plantae,51274,Saxifragaceae,Heuchera,Heuchera micrantha
9252245,12/10/17,2017-12-10 17:15:45 UTC,Pacific Time (US & Canada),research,https://www.inaturalist.org/observations/9252245,https://static.inaturalist.org/photos/12528100/medium.jpg,,2,0,FALSE,"Tilden Regional Park, Contra Costa County, US-CA, US",37.9093187,-122.2662194,5,,,Contra Costa,thimbleberry,Rubus parviflorus,thimbleberry,Plantae,51646,Rosaceae,Rubus,Rubus parviflorus
9252246,12/10/17,2017-12-10 17:19:01 UTC,Pacific Time (US & Canada),research,https://www.inaturalist.org/observations/9252246,https://static.inaturalist.org/photos/12528103/medium.jpg,,2,0,FALSE,"Tilden Regional Park, Contra Costa County, US-CA, US",37.90973239,-122.2672231,5,,,Contra Costa,coffeeberry,Frangula californica,coffeeberry,Plantae,53423,Rhamnaceae,Frangula,Frangula californica
9252247,12/10/17,2017-12-10 17:26:56 UTC,Pacific Time (US & Canada),research,https://www.inaturalist.org/observations/9252247,https://static.inaturalist.org/photos/12528104/medium.jpg,,2,0,FALSE,"Tilden Regional Park, Contra Costa County, US-CA, US",37.91003079,-122.2676798,5,,,Contra Costa,Pink Honeysuckle,Lonicera hispidula,Pink Honeysuckle,Plantae,53416,Caprifoliaceae,Lonicera,Lonicera hispidula
9252251,12/10/17,2017-12-10 17:45:54 UTC,Pacific Time (US & Canada),research,https://www.inaturalist.org/observations/9252251,https://static.inaturalist.org/photos/12528117/medium.jpg,,2,0,FALSE,"Tilden Regional Park, Contra Costa County, US-CA, US",37.91248212,-122.2695116,5,,,Contra Costa,stinging nettle,Urtica dioica,great stinging nettle,Plantae,51884,Urticaceae,Urtica,Urtica dioica
9252253,12/10/17,2017-12-10 17:51:28 UTC,Pacific Time (US & Canada),research,https://www.inaturalist.org/observations/9252253,https://static.inaturalist.org/photos/12528118/medium.jpg,,2,0,FALSE,"Tilden Regional Park, Contra Costa County, US-CA, US",37.91288189,-122.2694268,5,,,Contra Costa,Toyon,Heteromeles arbutifolia,Toyon,Plantae,53405,Rosaceae,Heteromeles,Heteromeles arbutifolia
9252255,12/10/17,2017-12-10 17:56:10 UTC,Pacific Time (US & Canada),research,https://www.inaturalist.org/observations/9252255,https://static.inaturalist.org/photos/12528119/medium.jpg,,2,0,FALSE,"Tilden Regional Park, Contra Costa County, US-CA, US",37.91267549,-122.2688274,5,,,Contra Costa,coyote brush,Baccharis pilularis,coyote brush,Plantae,53359,Asteraceae,Baccharis,Baccharis pilularis
9252258,12/10/17,2017-12-10 18:07:15 UTC,Pacific Time (US & Canada),research,https://www.inaturalist.org/observations/9252258,https://static.inaturalist.org/photos/12528122/medium.jpg,,2,0,FALSE,"Tilden Regional Park, Contra Costa County, US-CA, US",37.91226184,-122.2686041,5,,,Contra Costa,Toyon,Heteromeles arbutifolia,Toyon,Plantae,53405,Rosaceae,Heteromeles,Heteromeles arbutifolia
9346486,12/10/17,2017-12-10 17:11:22 UTC,Pacific Time (US & Canada),research,https://www.inaturalist.org/observations/9346486,https://inaturalist-open-data.s3.amazonaws.com/photos/12683264/medium.jpg,,2,0,FALSE,"Tilden Regional Park, Contra Costa County, US-CA, US",37.90917613,-122.2656581,30,,,Contra Costa,Ruberta,Ruberta,,Plantae,964908,Geraniaceae,Geranium,
9346489,12/10/17,2017-12-10 17:11:48 UTC,Pacific Time (US & Canada),research,https://www.inaturalist.org/observations/9346489,https://inaturalist-open-data.s3.amazonaws.com/photos/12683292/medium.jpg,,1,0,FALSE,"Tilden Regional Park, Contra Costa County, US-CA, US",37.90912215,-122.2657295,5,,,Contra Costa,red osier dogwood,Cornus sericea,red osier dogwood,Plantae,53387,Cornaceae,Cornus,Cornus sericea
9346500,12/10/17,2017-12-10 17:12:42 UTC,Pacific Time (US & Canada),research,https://www.inaturalist.org/observations/9346500,https://inaturalist-open-data.s3.amazonaws.com/photos/12683312/medium.jpg,,1,0,FALSE,"Tilden Regional Park, Contra Costa County, US-CA, US",37.90947046,-122.2658342,30,,,Contra Costa,Pacific ninebark,Physocarpus capitatus,Pacific ninebark,Plantae,57249,Rosaceae,Physocarpus,Physocarpus capitatus
9346519,12/10/17,2017-12-10 17:14:45 UTC,Pacific Time (US & Canada),research,https://www.inaturalist.org/observations/9346519,https://inaturalist-open-data.s3.amazonaws.com/photos/12683325/medium.jpg,"Smells very lemony, square stem",1,0,FALSE,"Tilden Regional Park, Contra Costa County, US-CA, US",37.90937775,-122.2661518,10,,,Contra Costa,Lemon Balm,Melissa officinalis,lemon balm,Plantae,59901,Lamiaceae,Melissa,Melissa officinalis
9346528,12/10/17,2017-12-10 17:19:26 UTC,Pacific Time (US & Canada),research,https://www.inaturalist.org/observations/9346528,https://inaturalist-open-data.s3.amazonaws.com/photos/12683340/medium.jpg,,1,0,FALSE,"Tilden Regional Park, Contra Costa County, US-CA, US",37.90975117,-122.2672429,5,,,Contra Costa,coffeeberry,Frangula californica,coffeeberry,Plantae,53423,Rhamnaceae,Frangula,Frangula californica
9346531,12/10/17,2017-12-10 17:19:57 UTC,Pacific Time (US & Canada),research,https://www.inaturalist.org/observations/9346531,https://inaturalist-open-data.s3.amazonaws.com/photos/12683349/medium.jpg,,1,0,FALSE,"Tilden Regional Park, Contra Costa County, US-CA, US",37.90974396,-122.2673619,5,,,Contra Costa,California blackberry,Rubus ursinus macropetalus,California blackberry,Plantae,53444,Rosaceae,Rubus,Rubus ursinus
9346534,12/10/17,2017-12-10 17:21:43 UTC,Pacific Time (US & Canada),research,https://www.inaturalist.org/observations/9346534,https://inaturalist-open-data.s3.amazonaws.com/photos/12683371/medium.jpg,,1,0,FALSE,"Tilden Regional Park, Contra Costa County, US-CA, US",37.91009667,-122.2673599,30,,,Contra Costa,Toyon,Heteromeles arbutifolia,Toyon,Plantae,53405,Rosaceae,Heteromeles,Heteromeles arbutifolia
9346549,12/10/17,2017-12-10 17:22:12 UTC,Pacific Time (US & Canada),research,https://www.inaturalist.org/observations/9346549,https://inaturalist-open-data.s3.amazonaws.com/photos/12683407/medium.jpg,,1,0,FALSE,"Tilden Regional Park, Contra Costa County, US-CA, US",37.90999881,-122.2673348,5,,,Contra Costa,California hazelnut,Corylus cornuta californica,California hazelnut,Plantae,53368,Betulaceae,Corylus,Corylus cornuta
9346566,12/10/17,2017-12-10 17:29:24 UTC,Pacific Time (US & Canada),research,https://www.inaturalist.org/observations/9346566,https://inaturalist-open-data.s3.amazonaws.com/photos/12683471/medium.jpg,,1,0,FALSE,"Tilden Regional Park, Contra Costa County, US-CA, US",37.91037855,-122.2677546,5,,,Contra Costa,common ivy,Hedera helix,common ivy,Plantae,55882,Araliaceae,Hedera,Hedera helix
9346693,12/10/17,2017-12-10 17:49:28 UTC,Pacific Time (US & Canada),research,https://www.inaturalist.org/observations/9346693,https://inaturalist-open-data.s3.amazonaws.com/photos/12683658/medium.jpg,,2,0,FALSE,"Tilden Regional Park, Contra Costa County, US-CA, US",37.91318339,-122.2691638,10,,,Contra Costa,Pacific madrone,Arbutus menziesii,Pacific madrone,Plantae,51046,Ericaceae,Arbutus,Arbutus menziesii
9419432,12/10/17,2017-12-10 17:49:59 UTC,Pacific Time (US & Canada),research,https://www.inaturalist.org/observations/9419432,https://inaturalist-open-data.s3.amazonaws.com/photos/12799028/medium.jpg,,1,0,FALSE,"Tilden Regional Park, Contra Costa County, US-CA, US",37.91313917,-122.2694813,10,,,Contra Costa,Toyon,Heteromeles arbutifolia,Toyon,Plantae,53405,Rosaceae,Heteromeles,Heteromeles arbutifolia
9992821,12/10/17,2017-12-10 17:12:00 UTC,Pacific Time (US & Canada),research,https://www.inaturalist.org/observations/9992821,https://inaturalist-open-data.s3.amazonaws.com/photos/13735456/medium.jpeg,,3,1,FALSE,"Contra Costa County, CA, USA",37.90958889,-122.2656111,,,,Contra Costa,herb Robert,Geranium robertianum,herb Robert,Plantae,55925,Geraniaceae,Geranium,Geranium robertianum
9992826,12/10/17,2017-12-10 17:19:00 UTC,Pacific Time (US & Canada),research,https://www.inaturalist.org/observations/9992826,https://inaturalist-open-data.s3.amazonaws.com/photos/13735482/medium.jpeg,,2,0,FALSE,"Kensington, CA, USA",37.90972222,-122.26735,,,,Contra Costa,coast live oak,Quercus agrifolia,coast live oak,Plantae,47850,Fagaceae,Quercus,Quercus agrifolia
9992828,12/10/17,2017-12-10 17:24:00 UTC,Pacific Time (US & Canada),research,https://www.inaturalist.org/observations/9992828,https://inaturalist-open-data.s3.amazonaws.com/photos/13735504/medium.jpeg,,2,0,FALSE,"Kensington, CA, USA",37.90999722,-122.2674722,,,,Contra Costa,trailing blackberry,Rubus ursinus,trailing blackberry,Plantae,53445,Rosaceae,Rubus,Rubus ursinus
9992835,12/10/17,2017-12-10 17:58:00 UTC,Pacific Time (US & Canada),research,https://www.inaturalist.org/observations/9992835,https://inaturalist-open-data.s3.amazonaws.com/photos/13735546/medium.jpeg,,3,0,FALSE,"Contra Costa County, CA, USA",37.91300278,-122.2694694,,,,Contra Costa,Pacific madrone,Arbutus menziesii,Pacific madrone,Plantae,51046,Ericaceae,Arbutus,Arbutus menziesii
9992853,12/10/17,2017-12-10 20:06:00 UTC,Pacific Time (US & Canada),research,https://www.inaturalist.org/observations/9992853,https://inaturalist-open-data.s3.amazonaws.com/photos/13735639/medium.jpeg,,2,0,FALSE,"2501 Grizzly Peak Boulevard, Orinda, CA 94563, USA",37.892767,-122.242451,191,,,Contra Costa,trailing blackberry,Rubus ursinus,trailing blackberry,Plantae,53445,Rosaceae,Rubus,Rubus ursinus
9188358,12/17/17,2017-12-17 23:36:01 UTC,Pacific Time (US & Canada),research,https://www.inaturalist.org/observations/9188358,https://static.inaturalist.org/photos/12436378/medium.jpg,Blooming out of season in winter ,1,0,FALSE,"Tilden Regional Park, Contra Costa County, US-CA, US",37.8968261,-122.251372,10,,,Contra Costa,French Broom,Genista monspessulana,French broom,Plantae,53403,Fabaceae,Genista,Genista monspessulana
9188359,12/17/17,2017-12-17 23:57:28 UTC,Pacific Time (US & Canada),research,https://www.inaturalist.org/observations/9188359,https://static.inaturalist.org/photos/12436385/medium.jpg,Out of season bloom,1,0,FALSE,"Tilden Regional Park, Contra Costa County, US-CA, US",37.8955964,-122.2516894,10,,,Contra Costa,French Broom,Genista monspessulana,French broom,Plantae,53403,Fabaceae,Genista,Genista monspessulana
9373866,12/21/17,2017-12-21 22:28:48 UTC,Pacific Time (US & Canada),research,https://www.inaturalist.org/observations/9373866,https://static.inaturalist.org/photos/12729712/medium.jpg,,2,0,FALSE,"Tilden Regional Park, Berkeley, CA, US",37.91465833,-122.2621783,,,,Contra Costa,Stinking iris,Iris foetidissima,Stinking iris,Plantae,64331,Iridaceae,Iris,Iris foetidissima
11522430,12/22/17,2017-12-23 00:18:04 UTC,Pacific Time (US & Canada),research,https://www.inaturalist.org/observations/11522430,https://inaturalist-open-data.s3.amazonaws.com/photos/16448800/medium.jpeg,,2,0,FALSE,"Tilden Regional Park, Contra Costa County, US-CA, US",37.90179887,-122.254389,8,,,Contra Costa,Common Snowberry,Symphoricarpos albus,Common Snowberry,Plantae,48523,Caprifoliaceae,Symphoricarpos,Symphoricarpos albus
9244619,12/23/17,2017-12-23 19:31:19 UTC,Pacific Time (US & Canada),research,https://www.inaturalist.org/observations/9244619,https://inaturalist-open-data.s3.amazonaws.com/photos/12515066/medium.jpg,,1,0,FALSE,"Tilden Regional Park, Orinda, CA, US",37.89476667,-122.2352217,5,,,Contra Costa,Spanish Broom,Spartium junceum,Spanish Broom,Plantae,47406,Fabaceae,Spartium,Spartium junceum
9263234,12/25/17,2017-12-25 23:30:52 UTC,Pacific Time (US & Canada),research,https://www.inaturalist.org/observations/9263234,https://inaturalist-open-data.s3.amazonaws.com/photos/12547265/medium.jpg,,1,0,FALSE,"Tilden Regional Park, Berkeley, CA, US",37.90151167,-122.253845,10,,,Contra Costa,red osier dogwood,Cornus sericea,red osier dogwood,Plantae,53387,Cornaceae,Cornus,Cornus sericea
9263291,12/25/17,2017-12-25 23:32:05 UTC,Pacific Time (US & Canada),research,https://www.inaturalist.org/observations/9263291,https://inaturalist-open-data.s3.amazonaws.com/photos/12547494/medium.jpg,,1,0,FALSE,"Tilden Regional Park, Berkeley, CA, US",37.90171333,-122.2540583,10,,,Contra Costa,California bee plant,Scrophularia californica,California beeplant,Plantae,50812,Scrophulariaceae,Scrophularia,Scrophularia californica
9356059,1/3/18,2018-01-03 18:49:22 UTC,Pacific Time (US & Canada),research,https://www.inaturalist.org/observations/9356059,https://inaturalist-open-data.s3.amazonaws.com/photos/12699568/medium.jpg,,1,0,FALSE,"Tilden Regional Park, Berkeley, CA, US",37.91447982,-122.2669938,30,,,Contra Costa,trailing blackberry,Rubus ursinus,trailing blackberry,Plantae,53445,Rosaceae,Rubus,Rubus ursinus
9411751,1/7/18,2018-01-07 23:07:20 UTC,Pacific Time (US & Canada),research,https://www.inaturalist.org/observations/9411751,https://inaturalist-open-data.s3.amazonaws.com/photos/12785428/medium.jpg,Flowering ,2,0,FALSE,"Tilden Regional Park, Orinda, CA, US",37.88960321,-122.2309334,10,,,Contra Costa,California bay,Umbellularia californica,California bay,Plantae,48807,Lauraceae,Umbellularia,Umbellularia californica
9781436,1/31/18,2018-01-31 21:59:49 UTC,Pacific Time (US & Canada),research,https://www.inaturalist.org/observations/9781436,https://static.inaturalist.org/photos/13389738/medium.jpg,,2,0,FALSE,"Tilden Regional Park, Orinda, CA, US",37.89143333,-122.2378533,30,,,Contra Costa,holly-leaved cherry,Prunus ilicifolia ilicifolia,holly-leaved cherry,Plantae,59002,Rosaceae,Prunus,Prunus ilicifolia
9781471,1/31/18,2018-01-31 21:54:31 UTC,Pacific Time (US & Canada),research,https://www.inaturalist.org/observations/9781471,https://static.inaturalist.org/photos/13389804/medium.jpg,,3,0,FALSE,"Tilden Park Golf Course, Orinda, CA, US",37.89047,-122.2389833,10,,,Contra Costa,coast live oak,Quercus agrifolia,coast live oak,Plantae,47850,Fagaceae,Quercus,Quercus agrifolia
9748491,2/3/18,2018-02-03 23:32:24 UTC,Pacific Time (US & Canada),research,https://www.inaturalist.org/observations/9748491,https://static.inaturalist.org/photos/13345062/medium.jpg,,1,0,FALSE,"Tilden Regional Park, Berkeley, CA, US",37.89548,-122.2516167,10,,,Contra Costa,French broom,Genista monspessulana,French broom,Plantae,53403,Fabaceae,Genista,Genista monspessulana
9813649,2/10/18,2018-02-10 20:25:36 UTC,Pacific Time (US & Canada),research,https://www.inaturalist.org/observations/9813649,https://inaturalist-open-data.s3.amazonaws.com/photos/13437265/medium.jpg,,1,0,FALSE,"Tilden Regional Park, Berkeley, CA, US",37.91075012,-122.2494683,10,,,Contra Costa,Dwarf Checkermallow,Sidalcea malviflora,Dwarf Checkermallow,Plantae,48795,Malvaceae,Sidalcea,Sidalcea malviflora
9814509,2/10/18,2018-02-10 19:42:06 UTC,Pacific Time (US & Canada),research,https://www.inaturalist.org/observations/9814509,https://static.inaturalist.org/photos/13432312/medium.jpg,,2,0,FALSE,"Tilden Regional Park, Berkeley, CA, US",37.908505,-122.2552717,5,,,Contra Costa,coffeeberry,Frangula californica,coffeeberry,Plantae,53423,Rhamnaceae,Frangula,Frangula californica
9815129,2/10/18,2018-02-10 21:28:04 UTC,Pacific Time (US & Canada),research,https://www.inaturalist.org/observations/9815129,https://inaturalist-open-data.s3.amazonaws.com/photos/13433597/medium.jpg,,1,0,FALSE,"Tilden Regional Park, Orinda, CA, US",37.88346296,-122.2335667,10,,,Contra Costa,Osoberry,Oemleria cerasiformis,Osoberry,Plantae,53419,Rosaceae,Oemleria,Oemleria cerasiformis
9855700,2/13/18,2018-02-13 20:13:20 UTC,Pacific Time (US & Canada),research,https://www.inaturalist.org/observations/9855700,https://static.inaturalist.org/photos/13499638/medium.jpg,Grassland slope near bottom of rock outcrop infill sun.,1,0,FALSE,"Tilden Regional Park, Berkeley, CA, US",37.91075833,-122.2494583,5,,,Contra Costa,Dwarf Checkermallow,Sidalcea malviflora,Dwarf Checkermallow,Plantae,48795,Malvaceae,Sidalcea,Sidalcea malviflora
9859418,2/14/18,2018-02-14 18:55:33 UTC,Pacific Time (US & Canada),research,https://www.inaturalist.org/observations/9859418,https://static.inaturalist.org/photos/13509091/medium.jpg,,2,0,FALSE,"Tilden Regional Park, Berkeley, CA, US",37.89334254,-122.2428267,30,,,Contra Costa,Pacific madrone,Arbutus menziesii,Pacific madrone,Plantae,51046,Ericaceae,Arbutus,Arbutus menziesii
9861079,2/14/18,2018-02-14 19:29:05 UTC,Pacific Time (US & Canada),research,https://www.inaturalist.org/observations/9861079,https://static.inaturalist.org/photos/13509146/medium.jpg,,2,0,FALSE,"Tilden Regional Park, Berkeley, CA, US",37.89332226,-122.2429904,5,,,Contra Costa,California Dutchman's Pipe,Aristolochia californica,California Dutchman's Pipe,Plantae,55190,Aristolochiaceae,Aristolochia,Aristolochia californica
9861090,2/14/18,2018-02-14 19:55:44 UTC,Pacific Time (US & Canada),research,https://www.inaturalist.org/observations/9861090,https://static.inaturalist.org/photos/13509181/medium.jpg,,2,0,FALSE,"Tilden Regional Park, Berkeley, CA, US",37.89337444,-122.2430435,5,,,Contra Costa,Adelinia grande,Adelinia grande,Pacific hound's tongue,Plantae,769151,Boraginaceae,Adelinia,Adelinia grande
9865267,2/14/18,2018-02-14 22:16:00 UTC,Pacific Time (US & Canada),research,https://www.inaturalist.org/observations/9865267,https://inaturalist-open-data.s3.amazonaws.com/photos/13516802/medium.jpg,,1,0,FALSE,"Contra Costa County, CA, USA",37.8922299,-122.2432944,,,,Contra Costa,eggleaf spurge,Euphorbia oblongata,eggleaf spurge,Plantae,77117,Euphorbiaceae,Euphorbia,Euphorbia oblongata
9890962,2/16/18,2018-02-17 00:59:50 UTC,Pacific Time (US & Canada),research,https://www.inaturalist.org/observations/9890962,https://static.inaturalist.org/photos/13560125/medium.jpg,,1,0,FALSE,"Tilden Regional Park, Orinda, CA, US",37.91733833,-122.2564917,30,,,Contra Costa,,Helenium puberulum,Rosilla,Plantae,53092,Asteraceae,Helenium,Helenium puberulum
9900148,2/17/18,2018-02-17 23:49:16 UTC,Pacific Time (US & Canada),research,https://www.inaturalist.org/observations/9900148,https://inaturalist-open-data.s3.amazonaws.com/photos/13575208/medium.jpg,,1,0,FALSE,"Tilden Regional Park, Orinda, CA, US",37.90370833,-122.258805,10,,,Contra Costa,Red-flowering Currant,Ribes sanguineum,Red-flowering Currant,Plantae,53435,Grossulariaceae,Ribes,Ribes sanguineum
9909957,2/18/18,2018-02-18 20:29:26 UTC,Pacific Time (US & Canada),research,https://www.inaturalist.org/observations/9909957,https://static.inaturalist.org/photos/13592243/medium.jpg,,1,0,FALSE,"Tilden Regional Park, Kensington, CA, US",37.91029667,-122.2647033,10,,,Contra Costa,,Prunus cerasifera,Cherry-plum,Plantae,55837,Rosaceae,Prunus,Prunus cerasifera
9950926,2/21/18,2018-02-21 18:52:00 UTC,Pacific Time (US & Canada),research,https://www.inaturalist.org/observations/9950926,https://static.inaturalist.org/photos/13661821/medium.jpg,,1,0,FALSE,"Contra Costa County, CA, USA",37.91073562,-122.267704,262,,,Contra Costa,Osoberry,Oemleria cerasiformis,Osoberry,Plantae,53419,Rosaceae,Oemleria,Oemleria cerasiformis
9950933,2/21/18,2018-02-21 18:55:00 UTC,Pacific Time (US & Canada),research,https://www.inaturalist.org/observations/9950933,https://static.inaturalist.org/photos/13661831/medium.jpg,,1,0,FALSE,"Contra Costa County, CA, USA",37.91134507,-122.2681117,249,,,Contra Costa,Red-flowering Currant,Ribes sanguineum,Red-flowering Currant,Plantae,53435,Grossulariaceae,Ribes,Ribes sanguineum
9979383,2/24/18,2018-02-24 18:55:12 UTC,Pacific Time (US & Canada),research,https://www.inaturalist.org/observations/9979383,https://inaturalist-open-data.s3.amazonaws.com/photos/13713259/medium.jpeg,,2,0,FALSE,"Selby Trail, Berkeley, CA 94708, USA",37.88451599,-122.2448969,6,,,Contra Costa,eggleaf spurge,Euphorbia oblongata,eggleaf spurge,Plantae,77117,Euphorbiaceae,Euphorbia,Euphorbia oblongata
10037777,2/27/18,2018-02-27 23:50:32 UTC,Pacific Time (US & Canada),research,https://www.inaturalist.org/observations/10037777,https://static.inaturalist.org/photos/13809569/medium.jpg,,2,0,FALSE,"Tilden Regional Park, Orinda, CA, US",37.90488761,-122.2506516,10,,,Contra Costa,Cardre  lainer,Dipsacus sativus,fuller's teasel,Plantae,53028,Caprifoliaceae,Dipsacus,Dipsacus sativus
10052554,3/1/18,2018-03-01 23:24:39 UTC,Pacific Time (US & Canada),research,https://www.inaturalist.org/observations/10052554,https://static.inaturalist.org/photos/13836114/medium.jpg,,1,0,FALSE,"Tilden Regional Park, Kensington, CA, US",37.911075,-122.2686,5,,,Contra Costa,,Trillium chloropetalum,giant wakerobin,Plantae,50823,Melanthiaceae,Trillium,Trillium chloropetalum
10092813,3/4/18,2018-03-04 23:13:14 UTC,Pacific Time (US & Canada),research,https://www.inaturalist.org/observations/10092813,https://inaturalist-open-data.s3.amazonaws.com/photos/13905261/medium.jpg,Daisies in the meadow,2,0,FALSE,"Tilden Regional Park, Kensington, CA, US",37.90730333,-122.2633833,8,,,Contra Costa,common daisy,Bellis perennis,common daisy,Plantae,55563,Asteraceae,Bellis,Bellis perennis
10102717,3/5/18,2018-03-05 20:05:27 UTC,Pacific Time (US & Canada),research,https://www.inaturalist.org/observations/10102717,https://static.inaturalist.org/photos/13923939/medium.jpg,,2,0,FALSE,"Tilden Regional Park, Orinda, CA, US",37.90453108,-122.2504272,12,,,Contra Costa,smooth mule-ears,Wyethia glabra,smooth mule-ears,Plantae,56988,Asteraceae,Wyethia,Wyethia glabra
10119863,3/6/18,2018-03-07 00:26:51 UTC,Pacific Time (US & Canada),research,https://www.inaturalist.org/observations/10119863,https://static.inaturalist.org/photos/13952802/medium.jpg,,2,0,FALSE,"Tilden Regional Park, Orinda, CA, US",37.91267071,-122.2695868,10,,,Contra Costa,,Oenanthe sarmentosa,water parsley,Plantae,60127,Apiaceae,Oenanthe,Oenanthe sarmentosa
10176921,3/10/18,2018-03-10 18:36:29 UTC,Pacific Time (US & Canada),research,https://www.inaturalist.org/observations/10176921,https://static.inaturalist.org/photos/14051422/medium.jpg,,1,0,FALSE,"Tilden Regional Park, Kensington, CA, US",37.90829986,-122.2644401,1316,,,Contra Costa,Common Snowberry,Symphoricarpos albus,Common Snowberry,Plantae,48523,Caprifoliaceae,Symphoricarpos,Symphoricarpos albus
10189989,3/10/18,2018-03-10 17:36:50 UTC,Pacific Time (US & Canada),research,https://www.inaturalist.org/observations/10189989,https://static.inaturalist.org/photos/14073641/medium.jpg,,2,0,FALSE,"Tilden Regional Park, Orinda, CA, US",37.91076333,-122.2494883,5,,,Contra Costa,Dwarf Checkermallow,Sidalcea malviflora,Dwarf Checkermallow,Plantae,48795,Malvaceae,Sidalcea,Sidalcea malviflora
10194678,3/11/18,2018-03-12 01:19:28 UTC,Pacific Time (US & Canada),research,https://www.inaturalist.org/observations/10194678,https://static.inaturalist.org/photos/14081523/medium.jpg,,1,0,FALSE,"Tilden Regional Park, Orinda, CA, US",37.91139365,-122.2693908,24,,,Contra Costa,Trillium chloropetalum giganteum,Trillium chloropetalum giganteum,,Plantae,243295,Melanthiaceae,Trillium,Trillium chloropetalum
10209103,3/11/18,2018-03-11 22:17:00 UTC,Pacific Time (US & Canada),research,https://www.inaturalist.org/observations/10209103,https://static.inaturalist.org/photos/14104392/medium.jpg,"A fresh batch, nice and oily.",1,0,FALSE,"Contra Costa County, CA, USA",37.90737922,-122.2630718,191,,,Contra Costa,Pacific poison oak,Toxicodendron diversilobum,Pacific poison oak,Plantae,51080,Anacardiaceae,Toxicodendron,Toxicodendron diversilobum
10305130,3/18/18,2018-03-18 20:30:54 UTC,Pacific Time (US & Canada),research,https://www.inaturalist.org/observations/10305130,https://static.inaturalist.org/photos/14275127/medium.jpg,,2,0,FALSE,"Tilden Regional Park, Contra Costa County, US-CA, US",37.89373333,-122.2428133,5,,,Contra Costa,Pacific Sanicle,Sanicula crassicaulis,Pacific Sanicle,Plantae,53201,Apiaceae,Sanicula,Sanicula crassicaulis
10324601,3/18/18,2018-03-18 22:41:01 UTC,Pacific Time (US & Canada),research,https://www.inaturalist.org/observations/10324601,https://inaturalist-open-data.s3.amazonaws.com/photos/14310317/medium.jpg,,2,0,FALSE,"Tilden Regional Park, Orinda, CA, US",37.91163833,-122.2690667,10,,,Contra Costa,Trillium chloropetalum giganteum,Trillium chloropetalum giganteum,,Plantae,243295,Melanthiaceae,Trillium,Trillium chloropetalum
10342915,3/18/18,2018-03-18 20:47:23 UTC,Pacific Time (US & Canada),research,https://www.inaturalist.org/observations/10342915,https://inaturalist-open-data.s3.amazonaws.com/photos/14342481/medium.jpg,,1,0,FALSE,"Tilden Regional Park, Orinda, CA, US",37.89297167,-122.2459717,30,,,Contra Costa,miner's lettuce,Claytonia perfoliata,miner's lettuce,Plantae,52994,Montiaceae,Claytonia,Claytonia perfoliata
10354493,3/19/18,2018-03-19 16:54:11 UTC,Pacific Time (US & Canada),research,https://www.inaturalist.org/observations/10354493,https://inaturalist-open-data.s3.amazonaws.com/photos/14362699/medium.jpg,,2,0,FALSE,"Tilden Regional Park, Contra Costa County, US-CA, US",37.91060591,-122.2672205,5,,,Contra Costa,twinberry honeysuckle,Lonicera involucrata,twinberry honeysuckle,Plantae,60881,Caprifoliaceae,Lonicera,Lonicera involucrata
12416943,3/21/18,2018-03-21 21:29:39 UTC,Pacific Time (US & Canada),research,https://www.inaturalist.org/observations/12416943,https://static.inaturalist.org/photos/17902303/medium.jpg,,1,0,FALSE,"Tilden Regional Park, Orinda, CA, US",37.89351793,-122.2433344,10,,,Contra Costa,california sweet grass,Anthoxanthum occidentale,California sweet grass,Plantae,75474,Poaceae,Anthoxanthum,Anthoxanthum occidentale
10387812,3/23/18,2018-03-23 23:44:31 UTC,Pacific Time (US & Canada),research,https://www.inaturalist.org/observations/10387812,https://static.inaturalist.org/photos/14419415/medium.jpg,,1,0,FALSE,"Tilden Regional Park, Kensington, CA, US",37.91094167,-122.2686917,5,,,Contra Costa,,Ribes sanguineum,Red-flowering Currant,Plantae,53435,Grossulariaceae,Ribes,Ribes sanguineum
10387813,3/23/18,2018-03-23 23:44:40 UTC,Pacific Time (US & Canada),research,https://www.inaturalist.org/observations/10387813,https://static.inaturalist.org/photos/14419417/medium.jpg,,1,0,FALSE,"Tilden Regional Park, Kensington, CA, US",37.91094167,-122.2686917,5,,,Contra Costa,,Lathyrus vestitus,Pacific pea,Plantae,50320,Fabaceae,Lathyrus,Lathyrus vestitus
10387816,3/23/18,2018-03-23 23:45:03 UTC,Pacific Time (US & Canada),research,https://www.inaturalist.org/observations/10387816,https://static.inaturalist.org/photos/14419420/medium.jpg,,1,0,FALSE,"Tilden Regional Park, Kensington, CA, US",37.91098833,-122.26867,5,,,Contra Costa,,Sanicula crassicaulis,Pacific Sanicle,Plantae,53201,Apiaceae,Sanicula,Sanicula crassicaulis
10387817,3/23/18,2018-03-23 23:45:34 UTC,Pacific Time (US & Canada),research,https://www.inaturalist.org/observations/10387817,https://static.inaturalist.org/photos/14419422/medium.jpg,,2,0,FALSE,"Tilden Regional Park, Kensington, CA, US",37.91102,-122.2686917,5,,,Contra Costa,,Cardamine californica,milkmaids,Plantae,49651,Brassicaceae,Cardamine,Cardamine californica
10387819,3/23/18,2018-03-23 23:46:30 UTC,Pacific Time (US & Canada),research,https://www.inaturalist.org/observations/10387819,https://static.inaturalist.org/photos/14419425/medium.jpg,,2,0,FALSE,"Tilden Regional Park, Kensington, CA, US",37.91109667,-122.26898,30,,,Contra Costa,Adelinia grande,Adelinia grande,Pacific hound's tongue,Plantae,769151,Boraginaceae,Adelinia,Adelinia grande
10404265,3/24/18,2018-03-24 20:58:20 UTC,Pacific Time (US & Canada),research,https://www.inaturalist.org/observations/10404265,https://static.inaturalist.org/photos/14447422/medium.jpg,,1,0,FALSE,"Tilden Regional Park, Contra Costa County, US-CA, US",37.91236569,-122.2529974,30,,,Contra Costa,Chasmanthe bicolor,Chasmanthe bicolor,Bicolor Cobra Lily,Plantae,59948,Iridaceae,Chasmanthe,Chasmanthe bicolor
10445741,3/24/18,2018-03-24 22:51:48 UTC,Pacific Time (US & Canada),research,https://www.inaturalist.org/observations/10445741,https://inaturalist-open-data.s3.amazonaws.com/photos/14518828/medium.jpg,,2,0,FALSE,"Tilden Regional Park, Kensington, CA, US",37.91064667,-122.2670283,10,,,Contra Costa,twinberry honeysuckle,Lonicera involucrata,twinberry honeysuckle,Plantae,60881,Caprifoliaceae,Lonicera,Lonicera involucrata
97742614,3/24/18,2018-03-24 21:28:28 UTC,Pacific Time (US & Canada),research,https://www.inaturalist.org/observations/97742614,https://static.inaturalist.org/photos/162607469/medium.jpg,,1,0,FALSE,"Tilden Regional Park, Orinda, CA, US",37.90938777,-122.2478857,75,,,Contra Costa,western blue-eyed grass,Sisyrinchium bellum,western blue-eyed grass,Plantae,49918,Iridaceae,Sisyrinchium,Sisyrinchium bellum
97871471,3/24/18,2018-03-24 21:06:58 UTC,Pacific Time (US & Canada),research,https://www.inaturalist.org/observations/97871471,https://static.inaturalist.org/photos/162843633/medium.jpg,,1,0,FALSE,"Tilden Nature Area, Orinda, CA, US",37.91597232,-122.2510186,613,,,Contra Costa,Dwarf Checkermallow,Sidalcea malviflora,Dwarf Checkermallow,Plantae,48795,Malvaceae,Sidalcea,Sidalcea malviflora
97871521,3/24/18,2018-03-24 20:59:50 UTC,Pacific Time (US & Canada),research,https://www.inaturalist.org/observations/97871521,https://static.inaturalist.org/photos/162843731/medium.jpg,,1,0,FALSE,"Tilden Nature Area, Orinda, CA, US",37.91710025,-122.2531842,197,,,Contra Costa,Chasmanthe bicolor,Chasmanthe bicolor,Bicolor Cobra Lily,Plantae,59948,Iridaceae,Chasmanthe,Chasmanthe bicolor
97871806,3/24/18,2018-03-24 22:04:36 UTC,Pacific Time (US & Canada),research,https://www.inaturalist.org/observations/97871806,https://static.inaturalist.org/photos/162844156/medium.jpg,,1,0,FALSE,"Tilden Nature Area, Orinda, CA, US",37.92013857,-122.2557119,139,,,Contra Costa,miner's lettuce,Claytonia perfoliata,miner's lettuce,Plantae,52994,Montiaceae,Claytonia,Claytonia perfoliata
97872681,3/24/18,2018-03-24 22:00:06 UTC,Pacific Time (US & Canada),research,https://www.inaturalist.org/observations/97872681,https://static.inaturalist.org/photos/162845586/medium.jpg,,1,0,FALSE,"Tilden Nature Area, El Sobrante, CA, US",37.91986537,-122.2586852,277,,,Contra Costa,California manroot,Marah fabacea,California manroot,Plantae,205330,Cucurbitaceae,Marah,Marah fabacea
97872820,3/24/18,2018-03-24 22:24:10 UTC,Pacific Time (US & Canada),research,https://www.inaturalist.org/observations/97872820,https://static.inaturalist.org/photos/162845991/medium.jpg,,1,0,FALSE,"Tilden Nature Area, Orinda, CA, US",37.91913581,-122.2537278,235,,,Contra Costa,California buttercup,Ranunculus californicus,California buttercup,Plantae,52173,Ranunculaceae,Ranunculus,Ranunculus californicus
10446096,3/26/18,2018-03-27 01:25:46 UTC,Pacific Time (US & Canada),research,https://www.inaturalist.org/observations/10446096,https://inaturalist-open-data.s3.amazonaws.com/photos/14519340/medium.jpg,,1,0,FALSE,"Tilden Regional Park, Orinda, CA, US",37.90565,-122.2498867,10,,,Contra Costa,California bee plant,Scrophularia californica,California beeplant,Plantae,50812,Scrophulariaceae,Scrophularia,Scrophularia californica
10446098,3/26/18,2018-03-27 01:40:04 UTC,Pacific Time (US & Canada),research,https://www.inaturalist.org/observations/10446098,https://inaturalist-open-data.s3.amazonaws.com/photos/14519344/medium.jpg,,1,0,FALSE,"Tilden Regional Park, Orinda, CA, US",37.904475,-122.2454833,5,,,Contra Costa,Pacific poison oak,Toxicodendron diversilobum,Pacific poison oak,Plantae,51080,Anacardiaceae,Toxicodendron,Toxicodendron diversilobum
10446102,3/26/18,2018-03-27 01:18:15 UTC,Pacific Time (US & Canada),research,https://www.inaturalist.org/observations/10446102,https://inaturalist-open-data.s3.amazonaws.com/photos/14519346/medium.jpg,,2,0,FALSE,"Tilden Regional Park, Orinda, CA, US",37.90663667,-122.2526467,5,,,Contra Costa,orange bush monkeyflower,Diplacus aurantiacus,orange bush monkeyflower,Plantae,777371,Phrymaceae,Diplacus,Diplacus aurantiacus
10455611,3/27/18,2018-03-27 17:25:12 UTC,Pacific Time (US & Canada),research,https://www.inaturalist.org/observations/10455611,https://static.inaturalist.org/photos/14536628/medium.jpg,,2,0,FALSE,"Tilden Regional Park, Orinda, CA, US",37.905655,-122.247605,10,,,Contra Costa,Shepherd's-needle,Scandix pecten-veneris,Shepherd's-needle,Plantae,56843,Apiaceae,Scandix,Scandix pecten-veneris
10455635,3/27/18,2018-03-27 17:35:50 UTC,Pacific Time (US & Canada),research,https://www.inaturalist.org/observations/10455635,https://static.inaturalist.org/photos/14536741/medium.jpg,Widespread elaborate display on grassy hillside. Stem is hollow.,1,0,FALSE,"Tilden Regional Park, Orinda, CA, US",37.90991167,-122.248855,5,,,Contra Costa,arroyo lupine,Lupinus succulentus,arroyo lupine,Plantae,56759,Fabaceae,Lupinus,Lupinus succulentus
10467302,3/27/18,2018-03-28 02:28:55 UTC,Pacific Time (US & Canada),research,https://www.inaturalist.org/observations/10467302,https://static.inaturalist.org/photos/14548162/medium.jpg,,2,0,FALSE,"Tilden Regional Park, Orinda, CA, US",37.91235527,-122.2688015,270,,,Contra Costa,,Trillium chloropetalum,giant wakerobin,Plantae,50823,Melanthiaceae,Trillium,Trillium chloropetalum
10467304,3/27/18,2018-03-28 02:28:58 UTC,Pacific Time (US & Canada),research,https://www.inaturalist.org/observations/10467304,https://static.inaturalist.org/photos/14548164/medium.jpg,,4,0,FALSE,"Tilden Regional Park, Kensington, CA, US",37.91093809,-122.2695579,526,,,Contra Costa,Adelinia grande,Adelinia grande,Pacific hound's tongue,Plantae,769151,Boraginaceae,Adelinia,Adelinia grande
10630813,3/27/18,2018-03-28 00:25:22 UTC,Pacific Time (US & Canada),research,https://www.inaturalist.org/observations/10630813,https://inaturalist-open-data.s3.amazonaws.com/photos/14830644/medium.jpg,On a sloping hill near the Grizzly Peak Trail in Tilden Regional Park,1,0,FALSE,"Tilden Regional Park, Orinda, CA, US",37.89332,-122.2331783,5,,,Contra Costa,Gray Mule-Ears,Wyethia helenioides,Gray Mule-Ears,Plantae,50799,Asteraceae,Wyethia,Wyethia helenioides
10638483,3/27/18,2018-03-28 00:40:31 UTC,Pacific Time (US & Canada),research,https://www.inaturalist.org/observations/10638483,https://inaturalist-open-data.s3.amazonaws.com/photos/14841931/medium.jpg,Near the juncture of the Redwood Trail and the Grizzly Trail in Tilden Regional Park ,1,0,FALSE,"Tilden Regional Park, Orinda, CA, US",37.89895,-122.2408533,5,,,Contra Costa,Silver Lupine,Lupinus albifrons,Silver Lupine,Plantae,51691,Fabaceae,Lupinus,Lupinus albifrons
10481042,3/28/18,2018-03-29 00:13:03 UTC,Pacific Time (US & Canada),research,https://www.inaturalist.org/observations/10481042,https://inaturalist-open-data.s3.amazonaws.com/photos/14572055/medium.jpeg,,2,0,FALSE,"Seaview Trail, Orinda, CA 94563, USA",37.88182564,-122.221901,6,,,Contra Costa,field marigold,Calendula arvensis,field marigold,Plantae,59260,Asteraceae,Calendula,Calendula arvensis
10486132,3/28/18,2018-03-28 23:50:00 UTC,Pacific Time (US & Canada),research,https://www.inaturalist.org/observations/10486132,https://inaturalist-open-data.s3.amazonaws.com/photos/14580713/medium.jpg,,1,0,FALSE,"Tilden Regional Park, California, USA",37.88910167,-122.22448,,,,Contra Costa,dot-seed plantain,Plantago erecta,dot-seed plantain,Plantae,53177,Plantaginaceae,Plantago,Plantago erecta
10486133,3/28/18,2018-03-28 23:51:00 UTC,Pacific Time (US & Canada),research,https://www.inaturalist.org/observations/10486133,https://inaturalist-open-data.s3.amazonaws.com/photos/14580719/medium.jpg,,1,0,FALSE,"Tilden Regional Park, California, USA",37.88914333,-122.2244967,,,,Contra Costa,Gambel's milkvetch,Astragalus gambelianus,Gambel's milkvetch,Plantae,57042,Fabaceae,Astragalus,Astragalus gambelianus
10486134,3/28/18,2018-03-28 23:57:00 UTC,Pacific Time (US & Canada),research,https://www.inaturalist.org/observations/10486134,https://inaturalist-open-data.s3.amazonaws.com/photos/14580728/medium.jpg,,1,0,FALSE,"Tilden Regional Park, California, USA",37.89017167,-122.22568,,,,Contra Costa,Silver Lupine,Lupinus albifrons,Silver Lupine,Plantae,51691,Fabaceae,Lupinus,Lupinus albifrons
10486440,3/28/18,2018-03-29 00:15:11 UTC,Pacific Time (US & Canada),research,https://www.inaturalist.org/observations/10486440,https://inaturalist-open-data.s3.amazonaws.com/photos/14581527/medium.jpeg,,1,0,FALSE,"Tilden Regional Park, Contra Costa County, US-CA, US",37.88078542,-122.2210648,11,,,Contra Costa,herb Robert,Geranium robertianum,herb Robert,Plantae,55925,Geraniaceae,Geranium,Geranium robertianum
10486460,3/28/18,2018-03-29 00:35:31 UTC,Pacific Time (US & Canada),research,https://www.inaturalist.org/observations/10486460,https://inaturalist-open-data.s3.amazonaws.com/photos/14581551/medium.jpeg,,2,0,FALSE,"Seaview Trail, Orinda, CA 94563, USA",37.88643003,-122.2230459,5,,,Contra Costa,ribwort plantain,Plantago lanceolata,ribwort plantain,Plantae,53178,Plantaginaceae,Plantago,Plantago lanceolata
10486474,3/28/18,2018-03-29 01:05:10 UTC,Pacific Time (US & Canada),research,https://www.inaturalist.org/observations/10486474,https://inaturalist-open-data.s3.amazonaws.com/photos/14581572/medium.jpeg,,1,0,FALSE,"Tilden Regional Park, Contra Costa County, US-CA, US",37.89086073,-122.2262791,4,,,Contra Costa,purple owl's-clover,Castilleja exserta,purple owl's-clover,Plantae,49343,Orobanchaceae,Castilleja,Castilleja exserta
10486479,3/28/18,2018-03-29 01:25:39 UTC,Pacific Time (US & Canada),research,https://www.inaturalist.org/observations/10486479,https://inaturalist-open-data.s3.amazonaws.com/photos/14581578/medium.jpeg,,1,0,FALSE,"Tilden Regional Park, Contra Costa County, US-CA, US",37.88765826,-122.2258609,4,,,Contra Costa,dot-seed plantain,Plantago erecta,dot-seed plantain,Plantae,53177,Plantaginaceae,Plantago,Plantago erecta
10510045,3/30/18,2018-03-30 17:55:28 UTC,Pacific Time (US & Canada),research,https://www.inaturalist.org/observations/10510045,https://static.inaturalist.org/photos/14698298/medium.jpg,,2,0,FALSE,"Tilden Regional Park, Berkeley, CA, US",37.89194197,-122.2493159,5,,,Alameda,Douglas iris,Iris douglasiana,Douglas iris,Plantae,50854,Iridaceae,Iris,Iris douglasiana
10516706,3/30/18,2018-03-30 23:24:20 UTC,Pacific Time (US & Canada),research,https://www.inaturalist.org/observations/10516706,https://inaturalist-open-data.s3.amazonaws.com/photos/14634127/medium.jpeg,,1,0,FALSE,"Tilden Regional Park, Contra Costa County, US-CA, US",37.90885925,-122.2477722,,,,Contra Costa,field mustard,Brassica rapa,field mustard,Plantae,53271,Brassicaceae,Brassica,Brassica rapa
10516711,3/30/18,2018-03-30 23:27:57 UTC,Pacific Time (US & Canada),research,https://www.inaturalist.org/observations/10516711,https://inaturalist-open-data.s3.amazonaws.com/photos/14634153/medium.jpeg,,1,0,FALSE,"Nimitz Way, Berkeley, CA 94708, USA",37.91038132,-122.2493744,,,,Contra Costa,California poppy,Eschscholzia californica,California poppy,Plantae,48225,Papaveraceae,Eschscholzia,Eschscholzia californica
10519291,3/30/18,2018-03-30 22:51:00 UTC,Pacific Time (US & Canada),research,https://www.inaturalist.org/observations/10519291,https://inaturalist-open-data.s3.amazonaws.com/photos/14639118/medium.jpg,,1,0,FALSE,"Contra Costa County, CA, USA",37.88114344,-122.2220417,,,,Contra Costa,trailing blackberry,Rubus ursinus,trailing blackberry,Plantae,53445,Rosaceae,Rubus,Rubus ursinus
10519295,3/30/18,2018-03-30 22:53:00 UTC,Pacific Time (US & Canada),research,https://www.inaturalist.org/observations/10519295,https://inaturalist-open-data.s3.amazonaws.com/photos/14639305/medium.jpg,,1,0,FALSE,"Contra Costa County, CA, USA",37.88144431,-122.2221463,,,,Contra Costa,blue elder,Sambucus cerulea,blue elder,Plantae,143799,Viburnaceae,Sambucus,Sambucus cerulea
10519296,3/30/18,2018-03-30 22:52:00 UTC,Pacific Time (US & Canada),research,https://www.inaturalist.org/observations/10519296,https://inaturalist-open-data.s3.amazonaws.com/photos/14639186/medium.jpg,,1,0,FALSE,"Contra Costa County, CA, USA",37.88142753,-122.2221272,,,,Contra Costa,California bay,Umbellularia californica,California bay,Plantae,48807,Lauraceae,Umbellularia,Umbellularia californica
10522570,3/30/18,2018-03-30 23:31:42 UTC,Pacific Time (US & Canada),research,https://www.inaturalist.org/observations/10522570,https://inaturalist-open-data.s3.amazonaws.com/photos/14645465/medium.jpeg,,1,0,FALSE,"Nimitz Way, Berkeley, CA 94708, USA",37.91179657,-122.2503357,,,,Contra Costa,western blue-eyed grass,Sisyrinchium bellum,western blue-eyed grass,Plantae,49918,Iridaceae,Sisyrinchium,Sisyrinchium bellum
10522572,3/30/18,2018-03-30 23:40:48 UTC,Pacific Time (US & Canada),research,https://www.inaturalist.org/observations/10522572,https://inaturalist-open-data.s3.amazonaws.com/photos/14645468/medium.jpeg,,1,0,FALSE,"Tilden Regional Park, Contra Costa County, US-CA, US",37.91236877,-122.2531281,,,,Contra Costa,Two-colour cobra lily,Chasmanthe bicolor,Bicolor Cobra Lily,Plantae,59948,Iridaceae,Chasmanthe,Chasmanthe bicolor
10522574,3/30/18,2018-03-30 23:43:21 UTC,Pacific Time (US & Canada),research,https://www.inaturalist.org/observations/10522574,https://inaturalist-open-data.s3.amazonaws.com/photos/14645470/medium.jpeg,,1,0,FALSE,"Nimitz Way, Berkeley, CA 94708, USA",37.91261673,-122.2530365,,,,Contra Costa,California buttercup,Ranunculus californicus,California buttercup,Plantae,52173,Ranunculaceae,Ranunculus,Ranunculus californicus
10522577,3/30/18,2018-03-30 23:43:58 UTC,Pacific Time (US & Canada),research,https://www.inaturalist.org/observations/10522577,https://inaturalist-open-data.s3.amazonaws.com/photos/14645474/medium.jpeg,,1,0,FALSE,"Nimitz Way, Berkeley, CA 94708, USA",37.9131279,-122.2528992,,,,Contra Costa,trailing blackberry,Rubus ursinus,trailing blackberry,Plantae,53445,Rosaceae,Rubus,Rubus ursinus
10522579,3/30/18,2018-03-30 23:48:52 UTC,Pacific Time (US & Canada),research,https://www.inaturalist.org/observations/10522579,https://inaturalist-open-data.s3.amazonaws.com/photos/14645475/medium.jpeg,,1,0,FALSE,"Tilden Regional Park, Contra Costa County, US-CA, US",37.91366959,-122.252327,,,,Contra Costa,poison hemlock,Conium maculatum,poison hemlock,Plantae,52998,Apiaceae,Conium,Conium maculatum
10522587,3/30/18,2018-03-31 00:14:20 UTC,Pacific Time (US & Canada),research,https://www.inaturalist.org/observations/10522587,https://inaturalist-open-data.s3.amazonaws.com/photos/14645485/medium.jpeg,,2,0,FALSE,"Fire Trail No 3, Berkeley, CA 94708, USA",37.92020416,-122.2561874,,,,Contra Costa,miner's lettuce,Claytonia perfoliata,miner's lettuce,Plantae,52994,Montiaceae,Claytonia,Claytonia perfoliata
10522588,3/30/18,2018-03-31 00:19:45 UTC,Pacific Time (US & Canada),research,https://www.inaturalist.org/observations/10522588,https://inaturalist-open-data.s3.amazonaws.com/photos/14645486/medium.jpeg,,1,0,FALSE,"Wildcat Peak Trail, Berkeley, CA 94708, USA",37.91973877,-122.2589722,,,,Contra Costa,ribwort plantain,Plantago lanceolata,ribwort plantain,Plantae,53178,Plantaginaceae,Plantago,Plantago lanceolata
10522592,3/30/18,2018-03-31 00:24:10 UTC,Pacific Time (US & Canada),research,https://www.inaturalist.org/observations/10522592,https://inaturalist-open-data.s3.amazonaws.com/photos/14645490/medium.jpeg,,1,0,FALSE,"Wildcat Peak Trail, Berkeley, CA 94708, USA",37.91913223,-122.259819,,,,Contra Costa,California manroot,Marah fabacea,California manroot,Plantae,205330,Cucurbitaceae,Marah,Marah fabacea
10522596,3/30/18,2018-03-31 00:31:38 UTC,Pacific Time (US & Canada),research,https://www.inaturalist.org/observations/10522596,https://inaturalist-open-data.s3.amazonaws.com/photos/14645496/medium.jpeg,,2,0,FALSE,"Wildcat Peak Trail, Berkeley, CA 94708, USA",37.91854477,-122.2618332,,,,Contra Costa,milk thistle,Silybum marianum,milk thistle,Plantae,52586,Asteraceae,Silybum,Silybum marianum
10522597,3/30/18,2018-03-31 00:42:23 UTC,Pacific Time (US & Canada),research,https://www.inaturalist.org/observations/10522597,https://inaturalist-open-data.s3.amazonaws.com/photos/14645500/medium.jpeg,,1,0,FALSE,"Tilden Regional Park, Contra Costa County, US-CA, US",37.920681,-122.2640991,,,,Contra Costa,Field madder,Sherardia arvensis,Field madder,Plantae,47691,Rubiaceae,Sherardia,Sherardia arvensis
10522602,3/30/18,2018-03-31 00:56:56 UTC,Pacific Time (US & Canada),research,https://www.inaturalist.org/observations/10522602,https://inaturalist-open-data.s3.amazonaws.com/photos/14645506/medium.jpeg,,1,0,FALSE,"Wildcat Peak Trail, Berkeley, CA 94708, USA",37.91738892,-122.2640228,,,,Contra Costa,Artichoke Thistle,Cynara cardunculus,Artichoke Thistle,Plantae,57563,Asteraceae,Cynara,Cynara cardunculus
10522603,3/30/18,2018-03-31 00:58:32 UTC,Pacific Time (US & Canada),research,https://www.inaturalist.org/observations/10522603,https://inaturalist-open-data.s3.amazonaws.com/photos/14645508/medium.jpeg,,3,0,FALSE,"Wildcat Peak Trail, Berkeley, CA 94708, USA",37.91758728,-122.2644272,,,,Contra Costa,orange bush monkeyflower,Diplacus aurantiacus,orange bush monkeyflower,Plantae,777371,Phrymaceae,Diplacus,Diplacus aurantiacus
10522604,3/30/18,2018-03-31 01:02:25 UTC,Pacific Time (US & Canada),research,https://www.inaturalist.org/observations/10522604,https://inaturalist-open-data.s3.amazonaws.com/photos/14645509/medium.jpeg,,1,0,FALSE,"Wildcat Peak Trail, Berkeley, CA 94708, USA",37.91714859,-122.2649689,,,,Contra Costa,common cowparsnip,Heracleum maximum,common cowparsnip,Plantae,53094,Apiaceae,Heracleum,Heracleum maximum
10522605,3/30/18,2018-03-31 01:06:15 UTC,Pacific Time (US & Canada),research,https://www.inaturalist.org/observations/10522605,https://inaturalist-open-data.s3.amazonaws.com/photos/14645510/medium.jpeg,,1,0,FALSE,"Wildcat Peak Trail, Berkeley, CA 94708, USA",37.91625214,-122.2658615,,,,Contra Costa,Spotted medick,Medicago arabica,Spotted medick,Plantae,61012,Fabaceae,Medicago,Medicago arabica
10522606,3/30/18,2018-03-31 01:09:13 UTC,Pacific Time (US & Canada),research,https://www.inaturalist.org/observations/10522606,https://inaturalist-open-data.s3.amazonaws.com/photos/14645511/medium.jpeg,,2,0,FALSE,"Tilden Regional Park, Contra Costa County, US-CA, US",37.91617966,-122.2658615,,,,Contra Costa,star-flowered lily-of-the-valley,Maianthemum stellatum,star-flowered lily-of-the-valley,Plantae,53268,Asparagaceae,Maianthemum,Maianthemum stellatum
10539996,3/31/18,2018-03-31 21:24:15 UTC,Pacific Time (US & Canada),research,https://www.inaturalist.org/observations/10539996,https://static.inaturalist.org/photos/14676154/medium.jpg,,1,0,FALSE,"Tilden Regional Park, Contra Costa County, US-CA, US",37.90501333,-122.2652667,5,,,Contra Costa,common cowparsnip,Heracleum maximum,common cowparsnip,Plantae,53094,Apiaceae,Heracleum,Heracleum maximum
10546627,3/31/18,2018-03-31 21:00:19 UTC,Pacific Time (US & Canada),research,https://www.inaturalist.org/observations/10546627,https://static.inaturalist.org/photos/14687053/medium.jpg,,1,0,FALSE,"Tilden Regional Park, Orinda, CA, US",37.90423833,-122.263855,10,,,Contra Costa,giant wakerobin,Trillium chloropetalum,giant wakerobin,Plantae,50823,Melanthiaceae,Trillium,Trillium chloropetalum
10546936,3/31/18,2018-03-31 17:46:04 UTC,Pacific Time (US & Canada),research,https://www.inaturalist.org/observations/10546936,https://static.inaturalist.org/photos/14687724/medium.jpg,,1,0,FALSE,"Tilden Regional Park, Orinda, CA, US",37.8988697,-122.2526525,10,,,Contra Costa,miner's lettuce,Claytonia perfoliata,miner's lettuce,Plantae,52994,Montiaceae,Claytonia,Claytonia perfoliata
10546967,3/31/18,2018-03-31 17:48:23 UTC,Pacific Time (US & Canada),research,https://www.inaturalist.org/observations/10546967,https://static.inaturalist.org/photos/14687807/medium.jpg,,1,0,FALSE,"Tilden Regional Park, Orinda, CA, US",37.89947898,-122.252386,30,,,Contra Costa,Tasmanian blue gum,Eucalyptus globulus,Eurabbie,Plantae,53398,Myrtaceae,Eucalyptus,Eucalyptus globulus
10547018,3/31/18,2018-03-31 17:49:24 UTC,Pacific Time (US & Canada),research,https://www.inaturalist.org/observations/10547018,https://static.inaturalist.org/photos/14687845/medium.jpg,,1,0,FALSE,"Tilden Regional Park, Orinda, CA, US",37.89899727,-122.2525327,10,,,Contra Costa,trailing blackberry,Rubus ursinus,trailing blackberry,Plantae,53445,Rosaceae,Rubus,Rubus ursinus
10587509,4/1/18,2018-04-01 22:34:00 UTC,Pacific Time (US & Canada),research,https://www.inaturalist.org/observations/10587509,https://inaturalist-open-data.s3.amazonaws.com/photos/14758055/medium.jpeg,,1,0,FALSE,"Contra Costa County, CA, USA",37.88719559,-122.2247913,128,,,Contra Costa,giant wakerobin,Trillium chloropetalum,giant wakerobin,Plantae,50823,Melanthiaceae,Trillium,Trillium chloropetalum
10587510,4/1/18,2018-04-01 22:40:00 UTC,Pacific Time (US & Canada),research,https://www.inaturalist.org/observations/10587510,https://inaturalist-open-data.s3.amazonaws.com/photos/14758069/medium.jpeg,,1,0,FALSE,"Contra Costa County, CA, USA",37.88857164,-122.2268486,159,,,Contra Costa,blue scarlet pimpernel,Lysimachia arvensis,scarlet pimpernel,Plantae,791928,Primulaceae,Lysimachia,Lysimachia arvensis
10587512,4/1/18,2018-04-01 23:38:00 UTC,Pacific Time (US & Canada),research,https://www.inaturalist.org/observations/10587512,https://inaturalist-open-data.s3.amazonaws.com/photos/14758110/medium.jpeg,,1,0,FALSE,"El Toyonal, Orinda, CA 94563, USA",37.8889611,-122.2244239,204,,,Contra Costa,Dwarf Checkermallow,Sidalcea malviflora,Dwarf Checkermallow,Plantae,48795,Malvaceae,Sidalcea,Sidalcea malviflora
10621969,4/4/18,2018-04-04 21:07:15 UTC,Pacific Time (US & Canada),research,https://www.inaturalist.org/observations/10621969,https://static.inaturalist.org/photos/14844750/medium.jpg,,1,0,FALSE,"Tilden Regional Park, Orinda, CA, US",37.88670001,-122.232105,10,,,Contra Costa,California buttercup,Ranunculus californicus,California buttercup,Plantae,52173,Ranunculaceae,Ranunculus,Ranunculus californicus
10638401,4/4/18,2018-04-04 23:39:09 UTC,Pacific Time (US & Canada),research,https://www.inaturalist.org/observations/10638401,https://inaturalist-open-data.s3.amazonaws.com/photos/14841756/medium.jpg,All along the Redwood Trail and Grizzly Peak Trail in the south eastern part of Tilden Regional Park,1,0,FALSE,"Tilden Regional Park, Orinda, CA, US",37.88504167,-122.2408133,5,,,Contra Costa,trailing blackberry,Rubus ursinus,trailing blackberry,Plantae,53445,Rosaceae,Rubus,Rubus ursinus
10638435,4/4/18,2018-04-04 23:53:51 UTC,Pacific Time (US & Canada),research,https://www.inaturalist.org/observations/10638435,https://inaturalist-open-data.s3.amazonaws.com/photos/14841833/medium.jpg,On a sloping woody hill near the Grizzly Peak Trail in Tilden Regional Park,1,0,FALSE,"Tilden Regional Park, Orinda, CA, US",37.88345333,-122.2341917,5,,,Contra Costa,giant wakerobin,Trillium chloropetalum,giant wakerobin,Plantae,50823,Melanthiaceae,Trillium,Trillium chloropetalum
10640169,4/4/18,2018-04-04 21:21:28 UTC,Pacific Time (US & Canada),research,https://www.inaturalist.org/observations/10640169,https://static.inaturalist.org/photos/14844832/medium.jpg,,2,0,FALSE,"Tilden Regional Park, Orinda, CA, US",37.88950145,-122.2346991,65,,,Contra Costa,miner's lettuce,Claytonia perfoliata,miner's lettuce,Plantae,52994,Montiaceae,Claytonia,Claytonia perfoliata
10642760,4/4/18,2018-04-04 23:50:22 UTC,Pacific Time (US & Canada),research,https://www.inaturalist.org/observations/10642760,https://inaturalist-open-data.s3.amazonaws.com/photos/14848990/medium.jpg,Near the juncture of Grizzly Peak Trail and Tower Trail ,1,0,FALSE,"Tilden Regional Park, Orinda, CA, US",37.88355,-122.23565,10,,,Contra Costa,red baneberry,Actaea rubra,red baneberry,Plantae,49870,Ranunculaceae,Actaea,Actaea rubra
10736567,4/4/18,2018-04-04 23:08:26 UTC,Pacific Time (US & Canada),research,https://www.inaturalist.org/observations/10736567,https://inaturalist-open-data.s3.amazonaws.com/photos/15003918/medium.jpg,,1,0,FALSE,"Tilden Regional Park, Orinda, CA, US",37.88536167,-122.2322617,5,,,Contra Costa,California buttercup,Ranunculus californicus,California buttercup,Plantae,52173,Ranunculaceae,Ranunculus,Ranunculus californicus
11422660,4/4/18,2018-04-04 18:45:35 UTC,Pacific Time (US & Canada),research,https://www.inaturalist.org/observations/11422660,https://inaturalist-open-data.s3.amazonaws.com/photos/16289601/medium.jpg,,1,0,FALSE,"Tilden Regional Park, Orinda, CA, US",37.913475,-122.2642217,5,,,Contra Costa,miner's lettuce,Claytonia perfoliata,miner's lettuce,Plantae,52994,Montiaceae,Claytonia,Claytonia perfoliata
11422779,4/4/18,2018-04-04 17:44:30 UTC,Pacific Time (US & Canada),research,https://www.inaturalist.org/observations/11422779,https://inaturalist-open-data.s3.amazonaws.com/photos/16289816/medium.jpg,,1,0,FALSE,"Tilden Regional Park, Orinda, CA, US",37.91608,-122.2563467,10,,,Contra Costa,giant wakerobin,Trillium chloropetalum,giant wakerobin,Plantae,50823,Melanthiaceae,Trillium,Trillium chloropetalum
11423157,4/4/18,2018-04-04 18:25:25 UTC,Pacific Time (US & Canada),research,https://www.inaturalist.org/observations/11423157,https://inaturalist-open-data.s3.amazonaws.com/photos/16290416/medium.jpg,,1,0,FALSE,"Tilden Regional Park, El Sobrante, CA, US",37.917305,-122.2643667,5,,,Contra Costa,common cowparsnip,Heracleum maximum,common cowparsnip,Plantae,53094,Apiaceae,Heracleum,Heracleum maximum
11423373,4/4/18,2018-04-04 18:19:07 UTC,Pacific Time (US & Canada),research,https://www.inaturalist.org/observations/11423373,https://inaturalist-open-data.s3.amazonaws.com/photos/16290659/medium.jpg,,1,0,FALSE,"Tilden Regional Park, El Sobrante, CA, US",37.91821667,-122.2636717,5,,,Contra Costa,coast Indian paintbrush,Castilleja affinis,Coast Paintbrush,Plantae,50042,Orobanchaceae,Castilleja,Castilleja affinis
11433921,4/4/18,2018-04-04 18:24:27 UTC,Pacific Time (US & Canada),research,https://www.inaturalist.org/observations/11433921,https://inaturalist-open-data.s3.amazonaws.com/photos/16308442/medium.jpg,,2,0,FALSE,"Tilden Regional Park, El Sobrante, CA, US",37.91761333,-122.264305,5,,,Contra Costa,orange bush monkeyflower,Diplacus aurantiacus,orange bush monkeyflower,Plantae,777371,Phrymaceae,Diplacus,Diplacus aurantiacus
11434382,4/4/18,2018-04-04 17:45:37 UTC,Pacific Time (US & Canada),research,https://www.inaturalist.org/observations/11434382,https://inaturalist-open-data.s3.amazonaws.com/photos/16308489/medium.jpg,,1,0,FALSE,"Tilden Regional Park, Orinda, CA, US",37.91603833,-122.25602,10,,,Contra Costa,broadleaf forget-me-not,Myosotis latifolia,broadleaf forget-me-not,Plantae,49132,Boraginaceae,Myosotis,Myosotis latifolia
10651654,4/5/18,2018-04-05 23:23:32 UTC,Pacific Time (US & Canada),research,https://www.inaturalist.org/observations/10651654,https://static.inaturalist.org/photos/14864092/medium.jpg,,1,0,FALSE,"Tilden Regional Park, El Sobrante, CA, US",37.92069667,-122.26413,5,,,Contra Costa,,Sparaxis tricolor,Harlequin flower,Plantae,50843,Iridaceae,Sparaxis,Sparaxis tricolor
10651658,4/5/18,2018-04-05 23:35:02 UTC,Pacific Time (US & Canada),research,https://www.inaturalist.org/observations/10651658,https://static.inaturalist.org/photos/14864096/medium.jpg,,1,0,FALSE,"Tilden Regional Park, El Sobrante, CA, US",37.92076333,-122.2642283,5,,,Contra Costa,Common Vetch,Vicia sativa,Common Vetch,Plantae,53324,Fabaceae,Vicia,Vicia sativa
10651670,4/5/18,2018-04-05 23:38:14 UTC,Pacific Time (US & Canada),research,https://www.inaturalist.org/observations/10651670,https://static.inaturalist.org/photos/14864105/medium.jpg,,1,0,FALSE,"Tilden Regional Park, El Sobrante, CA, US",37.91999667,-122.2631917,5,,,Contra Costa,,Sisyrinchium bellum,western blue-eyed grass,Plantae,49918,Iridaceae,Sisyrinchium,Sisyrinchium bellum
10651674,4/5/18,2018-04-05 23:43:14 UTC,Pacific Time (US & Canada),research,https://www.inaturalist.org/observations/10651674,https://static.inaturalist.org/photos/14864111/medium.jpg,,1,0,FALSE,"Tilden Regional Park, El Sobrante, CA, US",37.91887167,-122.2636717,5,,,Contra Costa,,Lupinus albifrons,Silver Lupine,Plantae,51691,Fabaceae,Lupinus,Lupinus albifrons
10651676,4/5/18,2018-04-05 23:44:29 UTC,Pacific Time (US & Canada),research,https://www.inaturalist.org/observations/10651676,https://static.inaturalist.org/photos/14864117/medium.jpg,,1,0,FALSE,"Tilden Regional Park, El Sobrante, CA, US",37.91847,-122.2633883,5,,,Contra Costa,,Heracleum maximum,common cowparsnip,Plantae,53094,Apiaceae,Heracleum,Heracleum maximum
10651684,4/5/18,2018-04-05 23:45:48 UTC,Pacific Time (US & Canada),research,https://www.inaturalist.org/observations/10651684,https://static.inaturalist.org/photos/14864129/medium.jpg,,1,0,FALSE,"Tilden Regional Park, El Sobrante, CA, US",37.918195,-122.2636633,5,,,Contra Costa,,Sidalcea malviflora,Dwarf Checkermallow,Plantae,48795,Malvaceae,Sidalcea,Sidalcea malviflora
10651686,4/5/18,2018-04-05 23:46:55 UTC,Pacific Time (US & Canada),research,https://www.inaturalist.org/observations/10651686,https://static.inaturalist.org/photos/14864133/medium.jpg,,2,0,FALSE,"Tilden Regional Park, El Sobrante, CA, US",37.91810333,-122.2637117,5,,,Contra Costa,,Castilleja affinis,Coast Paintbrush,Plantae,50042,Orobanchaceae,Castilleja,Castilleja affinis
10651689,4/5/18,2018-04-05 23:51:26 UTC,Pacific Time (US & Canada),research,https://www.inaturalist.org/observations/10651689,https://static.inaturalist.org/photos/14864137/medium.jpg,,1,0,FALSE,"Tilden Regional Park, El Sobrante, CA, US",37.91798,-122.263695,5,,,Contra Costa,,Phacelia imbricata,Mountain Phacelia,Plantae,53171,Boraginaceae,Phacelia,Phacelia imbricata
10651690,4/5/18,2018-04-05 23:52:05 UTC,Pacific Time (US & Canada),research,https://www.inaturalist.org/observations/10651690,https://static.inaturalist.org/photos/14864140/medium.jpg,,1,0,FALSE,"Tilden Regional Park, El Sobrante, CA, US",37.91788,-122.2637467,5,,,Contra Costa,,Achillea millefolium,Common Yarrow,Plantae,52821,Asteraceae,Achillea,Achillea millefolium
10651693,4/5/18,2018-04-05 23:54:08 UTC,Pacific Time (US & Canada),research,https://www.inaturalist.org/observations/10651693,https://static.inaturalist.org/photos/14864148/medium.jpg,,1,0,FALSE,"Tilden Regional Park, El Sobrante, CA, US",37.91763,-122.263655,5,,,Contra Costa,Dipterostemon capitatus,Dipterostemon capitatus,Blue Dicks,Plantae,1196784,Asparagaceae,Dipterostemon,Dipterostemon capitatus
10651697,4/5/18,2018-04-05 23:56:49 UTC,Pacific Time (US & Canada),research,https://www.inaturalist.org/observations/10651697,https://static.inaturalist.org/photos/14864152/medium.jpg,,2,0,FALSE,"Tilden Regional Park, El Sobrante, CA, US",37.91767833,-122.264245,5,,,Contra Costa,orange bush monkeyflower,Diplacus aurantiacus,orange bush monkeyflower,Plantae,777371,Phrymaceae,Diplacus,Diplacus aurantiacus
10682887,4/7/18,2018-04-07 18:07:42 UTC,Pacific Time (US & Canada),research,https://www.inaturalist.org/observations/10682887,https://static.inaturalist.org/photos/14915824/medium.jpg,,1,0,FALSE,"Tilden Regional Park, El Sobrante, CA, US",37.91815407,-122.2635785,315,,,Contra Costa,,Lupinus bicolor,Miniature Lupine,Plantae,50614,Fabaceae,Lupinus,Lupinus bicolor
11196181,4/7/18,2018-04-08 00:12:37 UTC,Pacific Time (US & Canada),research,https://www.inaturalist.org/observations/11196181,https://static.inaturalist.org/photos/15868802/medium.jpg,,1,0,FALSE,"Tilden Regional Park, Orinda, CA, US",37.90672383,-122.2571149,130,,,Contra Costa,coyote brush,Baccharis pilularis,coyote brush,Plantae,53359,Asteraceae,Baccharis,Baccharis pilularis
10735049,4/9/18,2018-04-09 19:14:40 UTC,Pacific Time (US & Canada),research,https://www.inaturalist.org/observations/10735049,https://static.inaturalist.org/photos/15001213/medium.jpeg,,1,0,FALSE,"Seaview Trail, Orinda, CA 94563, USA",37.88157817,-122.2216622,4,,,Contra Costa,hillside gooseberry,Ribes californicum,hillside gooseberry,Plantae,47129,Grossulariaceae,Ribes,Ribes californicum
10735071,4/9/18,2018-04-09 19:18:08 UTC,Pacific Time (US & Canada),research,https://www.inaturalist.org/observations/10735071,https://static.inaturalist.org/photos/15001287/medium.jpeg,,1,0,FALSE,"Seaview Trail, Orinda, CA 94563, USA",37.88105118,-122.2211563,6,,,Contra Costa,Pacific Sanicle,Sanicula crassicaulis,Pacific Sanicle,Plantae,53201,Apiaceae,Sanicula,Sanicula crassicaulis
10735163,4/9/18,2018-04-09 19:19:44 UTC,Pacific Time (US & Canada),research,https://www.inaturalist.org/observations/10735163,https://static.inaturalist.org/photos/15001432/medium.jpeg,,1,0,FALSE,"Seaview Trail, Orinda, CA 94563, USA",37.88085444,-122.2211936,7,,,Contra Costa,herb Robert,Geranium robertianum,herb Robert,Plantae,55925,Geraniaceae,Geranium,Geranium robertianum
10735240,4/9/18,2018-04-09 19:23:52 UTC,Pacific Time (US & Canada),research,https://www.inaturalist.org/observations/10735240,https://static.inaturalist.org/photos/15001539/medium.jpeg,,1,0,FALSE,"Seaview Trail, Orinda, CA 94563, USA",37.88149922,-122.2211893,7,,,Contra Costa,Cut-leaved crane's-bill,Geranium dissectum,Cut-leaved crane's-bill,Plantae,53075,Geraniaceae,Geranium,Geranium dissectum
